14,https://www.reuters.com/article/alcoa-corp-results/aluminum-producer-alcoa-reports-fourth-quarter-profit-idUSL3N1ZG50R,2019-01-16T21:16:31Z,Aluminum producer Alcoa reports fourth-quarter profit,"Jan 16 (Reuters) - No. 1 U.S. aluminum producer Alcoa Corp on Wednesday reported a fourth-quarter profit compared with a year-ago loss, helped by its bauxite and alumina segments.","Net income attributable to Alcoa was $43 million, or 23 cents per share, in the fourth quarter ended Dec. 31, compared with a loss of $196 million, or $1.06 per share, a year earlier.",Revenue rose 5.4 percent to $3.34 billion. (Reporting by Sanjana Shivdas in Bengaluru)
15,https://www.reuters.com/article/us-alcoa-corp-results/alcoas-profit-beat-fueled-by-rising-alumina-prices-shares-rise-idUSKCN1MR2ZK,2018-10-17T22:46:00Z,"Alcoa's profit beat fueled by rising alumina prices, shares rise","(Reuters) - Top U.S. aluminum producer Alcoa Corp AA.N reported a better-than-expected quarterly profit on Wednesday, as a series of supply hits boosted alumina prices.","Shares of the company rose almost 5 percent to $38.49 in after-hours trading, also helped by the announcement of a $200 million share repurchase program.","Alumina prices spiked during the year, largely due to supply disruptions such as lower production at Norsk Hydro's NHY.OL Alunorte, the world's largest alumina refinery, a strike at Alcoa's Australian operations and U.S. sanctions on Russian aluminum giant Rusal 0486.HK.","Chief Executive Roy Harvey said on a post-earnings call with analysts that while increased alumina prices represented an added cost, the company benefited from strength in third-party alumina sales.","Third-party alumina sales, or supplies to other smelters, surged 54.4 percent to $1.10 billion in the third quarter, the company said.",Alcoa said it had a net benefit of $27 million in the third quarter from U.S. tariffs as they helped push up the Midwest regional premium.,President Donald Trump in March imposed tariffs on imported aluminum aimed at boosting domestic aluminum makers against the backdrop of overcapacity in China.,"The tariffs, which came into force in June, also extended to products from allies such as the European Union and Canada.","Alcoa in August asked the U.S. Commerce Department to exempt from tariffs its purchases of 40,000 metric tons of aluminum from Canada, and is awaiting the government’s response.","Excluding certain items, Alcoa earned 63 cents per share, easily topping expectation of 36 cents, according to I/B/E/S data from Refinitiv.","Peter Ward, an analyst at Renaissance Macro Research, said the quarter was “okay” given the competitive challenges in the market. “The Street had recently cut estimates way too much.”","The company tightened its 2018 adjusted earnings before interest, tax, depreciation and amortization (EBITDA) forecast to range between $3.1 billion and $3.2 billion, raising its midpoint slightly, compared with its previous expectation of $3.0 billion and $3.2 billion.","Net loss attributable to Alcoa was $41 million, or 22 cents per share, in the third quarter ended Sept. 30, compared with a profit of $113 million, or 60 cents per share, a year earlier.",The results include a charge of $160 million mainly from the transfer of certain of the company’s U.S. pension and retirement benefits.,"Revenue rose 14.4 percent to $3.39 billion, topping analysts’ average estimate of $3.31 billion."
16,https://www.reuters.com/article/alcoa-corp-results/aluminum-producer-alcoa-posts-quarterly-loss-on-pension-charge-idUSL3N1WX55U,2018-10-17T20:25:00Z,Aluminum producer Alcoa posts quarterly loss on pension charge,"Oct 17 (Reuters) - Top U.S. aluminum producer Alcoa Corp reported a quarterly loss on Wednesday, compared with a profit a year earlier, largely due to a charge related to the transfer of its pension liabilities.","Net loss attributable to Alcoa was $41 million, or 22 cents per share, in the third quarter ended Sept. 30, compared with a profit of $113 million, or 60 cents per share, a year earlier.",The results include a charge of $160 million mainly due to a non-cash charge from the transfer of its U.S. pension and postemployment benefits (OPEB) obligations.,Revenue rose 14.4 percent to $3.39 billion. (Reporting by Sanjana Shivdas in Bengaluru; Editing by Sriraj Kalluvila)
17,https://www.reuters.com/article/alcoa-spain-closure/update-1-alcoa-to-close-two-spanish-aluminium-plants-cut-jobs-idUSL8N1WX4DM,2018-10-17T13:19:53Z,"UPDATE 1-Alcoa to close two Spanish aluminium plants, cut jobs","(Adds comment by the Spanish government, unions)","MADRID, Oct 17 (Reuters) - Alcoa said on Wednesday it would close two of its three aluminium plants in Spain with a combined annual production of 180,000 metric tonnes, resulting in the lay off of almost 700 workers.",The U.S. company said it was starting a consultation process with workers’ representatives and was committed to negotiating a social plan with unions.,"Negotiations begin on Oct. 31 and will last a maximum of 30 days, a spokesman for the workers’ union told Reuters. The closure plans would affect as many as 3,000 workers if indirect employment was taken into account, he said.","The Aviles and La Coruna plants were two of the least productive due to intrinsic structural problems such as inefficient technology and high fixed costs, Alcoa said in a statement.","“Those problems, together with external market factors such as overproduction in China, high raw material prices and energy costs, have generated significant losses in these two plants in the last two years,” the company said.",The Spanish industry ministry on Wednesday called on Alcoa for more information on the closures which it said were due to a lack of investment and structural problems since 2014 and has requested the company find a way to continue with production.,"“The government is surprised and worried that, during contacts over the last three months, the company had never reported that it would take this decision,” the ministry said in a statement.","The benchmark aluminium price on the London Metal Exchange erased losses after the news about the closure and was up 0.2 percent at $2,037.50 a tonne by 1240 GMT. (Additional reporting by Paul Day; Editing by Sonya Dowsett and Emelia Sithole-Matarise)"
18,https://www.reuters.com/article/alcoa-spain-closure/alcoa-to-close-2-spanish-aluminium-plants-with-job-losses-idUSE8N1WJ00P,2018-10-17T12:20:38Z,Alcoa to close 2 Spanish aluminium plants with job losses,"MADRID, Oct 17 (Reuters) - Alcoa said on Wednesday it would close two of its three aluminium plants in Spain with a combined annual production of 180,000 metric tonnes, resulting in the lay off of almost 700 workers.","The Aviles and La Coruna plants were two of the least productive due to intrinsic structural problems such as inefficient technology and high fixed costs, Alcoa said in a statement.","“Those problems, together with external market factors such as overproduction in China, high raw material prices and energy costs, have generated significant losses in these two plants in the last two years,” the company said. (Reporting by Robert Hetz; Writing by Paul Day; Editing by Sonya Dowsett)"
19,https://www.reuters.com/article/australia-alcoa-strike-wages/union-says-reached-wage-deal-with-alcoa-australia-end-strike-idUSS9N1TD025,2018-09-28T06:38:52Z,"Union says reached wage deal with Alcoa Australia, end strike","SYDNEY, Sept 28 (Reuters) - Unionised workers at aluminium producer Alcoa’s Western Australian operations agreed on a new wage deal on Friday and will return to work after a strike that lasted more than six weeks, according to the Australian Council of Trade Unions (ACTU).","“This has been a difficult dispute but the workers at Alcoa have shown what is possible when workers stand together and demand fair treatment,” the ACTU said in a statement.","Unionised workers at two alumina refineries and three bauxite mines had walked out on Aug. 8 on worries that a new workplace agreement did not adequately address job security, but Alcoa offered new terms last week. (Reporting by Swati Pandey; Editing by Christian Schmollinger)"
20,https://www.reuters.com/article/us-alcoa-australia-strike/workers-extend-strike-at-alcoas-alumina-operations-in-western-australia-idUSKCN1LN05O,2018-09-10T00:11:00Z,Workers extend strike at Alcoa's alumina operations in Western Australia,(This version of the Sep. 7 story was refiled to correct a typo in paragraph six),"MELBOURNE (Reuters) - Workers at Alcoa’s alumina and bauxite operations in Western Australia have voted to reject a proposed workplace agreement and will continue to strike, a trade union said on Friday.","Around 1,500 staff at three alumina refineries and two bauxite mines walked out on Aug. 8 over a new workplace agreement they say does not offer sufficient job security.","The strike threatens to stoke shortages of alumina, a white powder used to produce aluminum, which has already been hit by a partial shutdown at the world’s largest refinery in Brazil and sanctions on global aluminum giant Rusal.","U.S. company Alcoa, which has continued to run its operations in the state of Western Australia, said in a statement on Friday that it would monitor the situation and would welcome an alternative proposal from union workers.",The Australian Workers Union (AWU) said 80 percent of workers had voted to reject the new workplace agreement.,"“This decisive vote should provide Alcoa management with the impetus to come back to the table with job security assurances,” said AWU National Secretary Daniel Walton.","Alcoa said production of alumina had been cut by a total of about 15,000 tonnes in August. The operations normally churn out about 9 million tonnes a year, or 25,000 tonnes a day.","The refineries and mines are owned by Alcoa of Australia Ltd, which is part of the AWAC group of companies. Sixty percent of AWAC is held by Alcoa and 40 percent by Alumina Ltd.","Alcoa has applied to terminate an existing workplace agreement, with a court hearing set to last five days from Sept. 17, a union spokesman told Reuters. If it is successful in that, Alcoa may have a stronger hand in negotiations over the new workplace agreement.","Meanwhile, the company is also negotiating with 1,030 members of the United Steelworkers union to resolve an eight-month lockout of workers at its ABI aluminum smelter in Canada.",Alumina prices have surged by 40 percent since late June to around $638 a tonne after regulators ordered Norsk Hydro to slash output at its Brazilian refinery by half in February over pollution concerns. Hydro said on Thursday it was making progress to restart the plant.,"Shares in AWAC were down 4 percent by 0306 GMT in a slightly lower Australian market, while in New York, shares in Alcoa sank 5.9 percent on Thursday.","“The equity market rightly or wrongly is saying Norsk is edging closer to a restart, so alumina prices are closer to a peak, therefore the share prices have done about as much as they will do,” said analyst Peter O’Conner of Shaw and Partners in Sydney."
21,https://www.reuters.com/article/alcoa-australia-strike/alcoa-western-australian-workers-reject-labour-agreement-to-extend-strike-idUSM0N1K801N,2018-09-07T01:26:30Z,"Alcoa Western Australian workers reject labour agreement, to extend strike","MELBOURNE, Sept 7 (Reuters) - Workers at Alcoa’s western Australian operations have voted to reject a proposed workplace agreement and will continue their industrial action, the Australian Workers Union said in a statement on Thursday.",The strike at the company’s alumina and bauxite operations has been going for more than four weeks so far.
22,https://www.reuters.com/article/global-metals/metals-aluminium-hits-6-week-highs-as-supply-fears-revive-idUSL5N1V03X4,2018-08-09T16:21:41Z,METALS-Aluminium hits 6-week highs as supply fears revive
23,https://www.reuters.com/article/global-metals/metals-shanghai-aluminium-jumps-to-near-2-month-closing-high-on-alcoa-strike-idUSL4N1V027C,2018-08-09T07:30:55Z,METALS-Shanghai aluminium jumps to near 2-month closing high on Alcoa strike
24,https://www.reuters.com/article/global-metals/metals-shanghai-aluminium-hits-near-2-month-high-amid-alcoa-strike-idUSL4N1V01JD,2018-08-09T02:22:16Z,METALS-Shanghai aluminium hits near 2-month high amid Alcoa strike,"BEIJING, Aug 9 (Reuters) - Shanghai aluminium rose as much 2.8 percent to a near two-month high on Thursday, tracking a jump in London in the previous session, as a strike affecting Alcoa’s alumina refineries in Australia and warnings of shutdowns by Rusal supported prices.","The Alcoa plants account for around 9.3 million tonnes of capacity or some 8 percent of the world’s supply of alumina, the substance used to make aluminium.","* SHFE ALUMINIUM: The most-traded October aluminium contract on the Shanghai Futures Exchange was up 2.7 percent at 14,875 yuan ($2,179.68) a tonne, as of 0203 GMT, having earlier touched 14,885 yuan a tonne, its highest since June 13.","* LME ALUMINIUM: Three-month aluminium on the London Metal Exchange rose as much as 1.9 percent to $2,146 a tonne, its highest since June 29, extending a 3.3 percent jump in the previous session.","* ALCOA: Alcoa workers in Western Australia have walked out indefinitely over an enterprise agreement dispute with the aluminium maker, the Australian Workers’ Union (AWU) said on Wednesday.","* RUSAL: Russian aluminium giant Rusal is concerned about an impending catastrophe if U.S. sanctions are not lifted, with some of its production halted as early as September, two sources close to the company said.","* TARIFFS: China is slapping additional tariffs of 25 percent on $16 billion worth of U.S. imports from fuel and steel products to autos and medical equipment, the Chinese commerce ministry said, as the world’s largest economies escalated their trade dispute.",* COPPER: Chile’s state copper firm Codelco on Wednesday announced a $4.881 billion investment to convert its open cast Chuquicamata mine into an underground facility.,"* For the top stories in metals and other news, click or","* Asian shares were subdued on Thursday after a new round of tit-for-tat tariffs in the U.S.-Sino trade conflict torpedoed oil prices, while the Russian rouble tumbled as the U.S. slapped fresh sanctions on the country.",1230 U.S. Weekly jobless claims,1400 U.S. Wholesale sales Jun,Three month LME copper,Most active ShFE copper,Three month LME aluminium,Most active ShFE aluminium,Three month LME zinc,Most active ShFE zinc,Three month LME lead,Most active ShFE lead,Three month LME nickel,Most active ShFE nickel,Three month LME tin,Most active ShFE tin,ARBS ($1 = 6.8244 Chinese yuan)
25,https://www.reuters.com/article/alcoa-australia-strike/update-2-alcoas-w-australia-workers-walk-out-over-labour-agreement-union-idUSL4N1UZ2UD,2018-08-08T07:57:57Z,UPDATE 2-Alcoa's W.Australia workers walk out over labour agreement - union,"(Adds Alcoa comment, details)","KALGOORLIE, Aug 8 (Reuters) - Alcoa workers in Western Australia have walked out indefinitely over an enterprise agreement dispute with the aluminium maker, the Australian Workers’ Union (AWU) said on Wednesday.","The strike comes after Alcoa applied to Australia’s workplace regulator to terminate its current agreement, affecting around 1,500 of its 1,600 workers at its three alumina refineries and two bauxite mines in the state, the union said.","The refineries account for around 9.3 million tonnes of capacity or some 8 percent of the world’s alumina supply, with the market for the aluminium-making ingredient already tight after sanctions on global aluminium maker UC Rusal and the partial closure of Norsk Hydro’s plant in Brazil.","The walk out has not impacted production, Alcoa said.",The union said it spent 20 months trying to negotiate an agreement with Alcoa.,"“Our members are sensible, and only want what is fair and reasonable – a secure and good job,” AWU WA State Secretary Mike Zoetbrood said.","“However, the members won’t accept the company using threats of termination as means of pressuring the workforce into accepting sub-par working conditions.”",Alcoa said it would ask employees to vote on a new enterprise bargaining agreement (EBA) later this month.,"“Alcoa wants to establish a modern EBA that provides employees with competitive pay and conditions, allows us to manage our operations efficiently and productively, and gives us the ability to respond to changing market and operating conditions,” an Alcoa spokeswoman said in an email to Reuters. “Our sites have contingency plans to ensure they can continue to operate during industrial action,” she said.","Alcoa last year won regulatory approval to ship 2.5 million tonnes of West Australian bauxite to third-party customers, on top of the production it supplies to feed its Western Australian alumnina refineries.","That bauxite would go to China, where supply was already tight because the country’s pollution crackdown had closed some domestic mines, said Paul Adkins of aluminium consultancy AZ China.","Any disruption to West Australian supply could add more heat to China’s alumina prices, he added.",Alcoa’s aluminium smelter in Portland in the state of Victoria was not affected.,"The refineries and mines are owned by Alcoa of Australia Ltd, which is part of the AWAC group of companies and owned 60 percent by Alcoa and 40 percent by Alumina Ltd. (Reporting by Melanie Burton; Editing by Christian Schmollinger and Sherry Jacob-Phillips)"
26,https://www.reuters.com/article/alcoa-australia-strike/alcoas-western-australia-workers-walk-out-over-labour-agreement-union-idUSL4N1UZ2RH,2018-08-08T06:12:06Z,Alcoa's Western Australia workers walk out over labour agreement - union,"KALGOORLIE, Aug 8 (Reuters) - Alcoa workers in Western Australia have walked out indefinitely over an enterprise agreement dispute with the aluminium maker, the Australian Workers’ Union said on Wednesday.","The strike comes after Alcoa applied to Australia’s workplace regulator to terminate its current agreement, impacting some 1,600 workers at its three alumina refineries, and two bauxite mines, the union said in a statement. (Reporting by Melanie Burton; Editing by Christian Schmollinger)"
27,https://www.reuters.com/article/us-usa-trade-alcoa/alcoa-asks-u-s-government-for-tariff-exemption-on-canadian-aluminum-idUSKBN1KR277,2018-08-06T22:03:53Z,Alcoa asks U.S. government for tariff exemption on Canadian aluminum,"WASHINGTON (Reuters) - Alcoa Corp AA.N on Monday asked the U.S. Commerce Department to exempt from tariffs its purchases of 40,000 metric tons of Canadian aluminum used to make beverage cans, adding to thousands of requests for such relief.","According to documents posted to its website, Alcoa said no U.S. aluminum producer can meet its specification needs and quality requirements for rolling slabs used at its Warrick, Indiana plant to produce aluminum for can manufacturers.","Alcoa’s application for a waiver from 10 percent tariffs on the Canadian aluminum rolling slabs is the start of an effort to try to roll back the Trump administration’s tariffs on Canadian aluminum imports, a company official said. More such requests are planned, the official said.","Alcoa, the No. 1 U.S. aluminum producer, operates three aluminum smelters in hydropower-rich Quebec, employing about 3,300 people, in addition to its three smelters in the United States.","In an opening shot of growing global trade tensions, the United States imposed global tariffs of 10 percent on aluminum imports and 25 percent on steel imports and a 10 percent tariff on aluminum based on national security grounds, arguing that financially healthy U.S. producers of both metals were needed to keep America safe.","Although most trade and industry experts blame U.S. steel and aluminum producers’ woes on excess output in China, the tariffs also were applied to Canada, the European Union and Mexico in June.",These countries have responded with retaliatory tariffs on U.S. products ranging from motorcycles to bourbon whiskey and ketchup. U.S. Trade Representative Robert Lighthizer has linked a deal to lift the metals tariffs on Canada and Mexico to negotiations over a revamped North American Free Trade Agreement.,"Alcoa said in July it will incur as much as $14 million a month in extra expenses, mainly from tariffs levied on aluminum imported from Canada, its biggest supplier.","“Even if all the curtailed smelting capacity in the states was back online and producing metal, the United States would still need to import the majority of its aluminum, and most of it from Canada,” said Tim Reyes, president of Alcoa Aluminum, one of the company’s three business units.","Section 232 tariffs should be removed from Canada and other fair-trading partners, Reyes said.","Chief Executive Officer Roy Harvey told investors in July that Alcoa was in “active discussions” with the Trump administration, the Commerce Department and members of Congress about the elimination of tariffs or getting an exception for Canadian aluminum.",Alcoa on Monday filed five applications for one-year exclusions from Section 232 tariffs on imports of “primary aluminum alloyed slab” that it says is not available from any other U.S. manufacturer.
28,https://www.reuters.com/article/usa-trade-alcoa/update-1-alcoa-asks-u-s-government-for-tariff-exemption-on-canadian-aluminum-idUSL1N1UX1BB,2018-08-06T21:57:09Z,UPDATE 1-Alcoa asks U.S. government for tariff exemption on Canadian aluminum,"(Adds details on tariffs, Alcoa operations in Canada)","WASHINGTON, Aug 6 (Reuters) - Alcoa Corp on Monday asked the U.S. Commerce Department to exempt from tariffs its purchases of 40,000 metric tons of Canadian aluminum used to make beverage cans, adding to thousands of requests for such relief.","According to documents posted to its website, Alcoa said no U.S. aluminum producer can meet its specification needs and quality requirements for rolling slabs used at its Warrick, Indiana plant to produce aluminum for can manufacturers.","Alcoa’s application for a waiver from 10 percent tariffs on the Canadian aluminum rolling slabs is the start of an effort to try to roll back the Trump administration’s tariffs on Canadian aluminum imports, a company official said. More such requests are planned, the official said.","Alcoa, the No. 1 U.S. aluminum producer, operates three aluminum smelters in hydropower-rich Quebec, employing about 3,300 people, in addition to its three smelters in the United States.","In an opening shot of growing global trade tensions, the United States imposed global tariffs of 10 percent on aluminum imports and 25 percent on steel imports and a 10 percent tariff on aluminum based on national security grounds, arguing that financially healthy U.S. producers of both metals were needed to keep America safe.","Although most trade and industry experts blame U.S. steel and aluminum producers’ woes on excess output in China, the tariffs also were applied to Canada, the European Union and Mexico in June.",These countries have responded with retaliatory tariffs on U.S. products ranging from motorcycles to bourbon whiskey and ketchup. U.S. Trade Representative Robert Lighthizer has linked a deal to lift the metals tariffs on Canada and Mexico to negotiations over a revamped North American Free Trade Agreement.,"Alcoa said in July it will incur as much as $14 million a month in extra expenses, mainly from tariffs levied on aluminum imported from Canada, its biggest supplier.","“Even if all the curtailed smelting capacity in the states was back online and producing metal, the United States would still need to import the majority of its aluminum, and most of it from Canada,” said Tim Reyes, president of Alcoa Aluminum, one of the company’s three business units.","Section 232 tariffs should be removed from Canada and other fair-trading partners, Reyes said.","Chief Executive Officer Roy Harvey told investors in July that Alcoa was in “active discussions” with the Trump administration, the Commerce Department and members of Congress about the elimination of tariffs or getting an exception for Canadian aluminum.",Alcoa on Monday filed five applications for one-year exclusions from Section 232 tariffs on imports of “primary aluminum alloyed slab” that it says is not available from any other U.S. manufacturer. (Additional reporting by David Lawder; Editing by Richard Chang and Grant McCool)
