29,https://www.reuters.com/article/us-alcoa-corp-tariffs/alcoa-cuts-adjusted-ebitda-forecast-citing-tariffs-shares-slide-idUSKBN1K82SH,2018-07-19T19:47:33Z,"Alcoa cuts adjusted EBITDA forecast citing tariffs, shares slide",(This 18 July story corrects to remove reference to rising oil and gas prices in last paragraph.),"(Reuters) - Aluminum producer Alcoa Corp lowered its forecast for adjusted earnings before interest, tax, depreciation and amortization (EBITDA) for 2018 on Wednesday, citing U.S. tariffs on imported aluminum and rising energy costs.","The company’s shares fell 2 percent in after-market trading, dragging shares of rival Century Aluminum Co down 1 percent.","Alcoa now expects adjusted EBITDA to range between $3.0 billion and $3.2 billion, compared to its previous forecast of $3.5 billion to $3.7 billion.",U.S. President Donald Trump imposed tariffs of 25 percent on imports of steel and 10 percent on aluminum on countries including Canada and Mexico and the European Union that went into effect in June.,"Alcoa said the tariffs led to an extra $15 million in costs in the reported quarter that were mainly levied on aluminum imported from Canada, its biggest supplier.","The company operates 3 smelters in Canada, which were not excluded from tariffs. Alcoa said it anticipates a negative monthly impact between $12 million and $14 million as long as the tariffs are in place.","Chief Executive Officer Roy Harvey said on a post-earnings call with analysts that even if all U.S. curtailed capacity was back online, the U.S. would still need to import 60 percent of its primary aluminum needs from Canada.","“In short, tariffs will not solve the challenges facing the aluminum industry.”","On Wednesday, the company reported adjusted earnings of $1.52 per share, and revenue of $3.58 billion for the quarter ending June 30 that beat Wall Street estimates, according to Thomson Reuters I/B/E/S.","Net income was reduced by $22 million due to higher electricity prices in Spain, Norway and the Pacific Northwest, the company said."
30,https://www.reuters.com/article/us-alcoa-corp-stocks/alcoa-shares-fall-as-tariffs-energy-costs-weigh-on-forecast-idUSKBN1K92I8,2018-07-19T19:24:24Z,"Alcoa shares fall as tariffs, energy costs weigh on forecast","(Reuters) - Shares of Alcoa Corp AA.N fell 11.8 percent on Thursday a day after the aluminum producer lowered its 2018 forecast for adjusted earnings before interest, tax, depreciation and amortization (EBITDA) citing recent U.S. trade tariffs.","Alcoa, which was also hit by higher electricity costs in the quarter, said it expects a negative monthly impact between $12 million and $14 million as long as the tariffs on imported aluminum are in place.","Credit Suisse analyst Curt Woodworth said in a note that it was surprising Alcoa has not filed an exclusion request as it is currently seeing annualized headwinds of $150 million and imports about 600,000 tons of aluminum from Canada.","Alcoa, the largest aluminum producer in the United States, has also been hurt by falling prices.","Aluminum prices MAL3 fell to $2,001 on Thursday, lowest since April 6, on worries about demand from the trade tussle between the U.S. and China, which accounts for around half of global industrial metals consumption.","The company however beat profit and revenue expectations on Wednesday, but said tariffs led to $15 million in costs in the reported quarter.",Alcoa’s total costs and expenses rose about 21 percent to $3.17 billion during the quarter.,"Up to Wednesday's close, Alcoa shares have fallen 10.9 percent year-to-date, with rival Century Aluminum Co CENX.O down 24 percent during the same period.","(This version of the story corrects second paragraph to say Alcoa was hit by higher electricity costs in the quarter, not rising oil and gas prices.)"
31,https://www.reuters.com/article/alcoa-corp-tariffs/corrected-update-1-alcoa-cuts-adjusted-ebitda-forecast-citing-tariffs-shares-slide-idUSL4N1UE57T,2018-07-18T22:56:48Z,"CORRECTED-UPDATE 1-Alcoa cuts adjusted EBITDA forecast citing tariffs, shares slide",(Corrects revenue figure to “$3.58 billion” from “$2.86 billion” in last paragraph),"July 18 (Reuters) - Aluminum producer Alcoa Corp lowered its forecast for adjusted earnings before interest, tax, depreciation and amortization (EBITDA) for 2018 on Wednesday, citing U.S tariffs on imported aluminum and rising energy costs.",The company’s shares were down 4 percent in after-market trading.,"Alcoa now expects adjusted EBITDA to range between $3.0 billion and $3.2 billion, compared with its previous forecast of $3.5 billion to $3.7 billion.",Alcoa said it had incurred $15 million in costs related to the tariffs. The company’s imports are mostly from Canada where the U.S. government’s Section 232 tariffs became effective on June 1.,"President Trump imposed U.S. tariffs of 25 percent on imports of steel and 10 percent on aluminum in March on countries including Canada, Mexico and the European Union.",The company said that uncertainty continues to exist in the global supply chain due to the U.S. tariffs and ongoing alumina supply disruptions in the Atlantic region.,"The company reported adjusted earnings of $1.52 per share, on a revenue of $3.58 billion for the second quarter ending June 30, beating Wall Street estimates according to Thomson Reuters I/B/E/S. (Reporting by Sanjana Shivdas in Bengaluru)"
32,https://www.reuters.com/article/alcoa-corp-tariffs/alcoa-cuts-adjusted-ebitda-forecast-citing-tariffs-idUSL4N1UE4VY,2018-07-18T20:20:26Z,Alcoa cuts adjusted EBITDA forecast citing tariffs,"July 18 (Reuters) - Aluminum producer Alcoa Corp said on Wednesday it cut its adjusted earnings before interest, tax, depreciation and amortization (EBITDA) for 2018, citing U.S tariffs on imported aluminum.","The company now expects adjusted EBITDA to range between $3.0 billion to $3.2 billion, compared with its previous range of $3.5 billion to $3.7 billion. (Reporting by Sanjana Shivdas in Bengaluru)"
33,https://www.reuters.com/article/us-saudi-arabia-reforms/former-siemens-ceo-kleinfeld-made-adviser-to-saudi-crown-prince-idUSKBN1JT07K,2018-07-03T05:31:32Z,Former Siemens CEO Kleinfeld made adviser to Saudi crown prince,"DUBAI (Reuters) - Klaus Kleinfeld, a former chief executive of industrial conglomerate Siemens and giant aluminum producer Alcoa, has been appointed an adviser to Saudi Arabia’s Crown Prince Mohammed bin Salman.","Kleinfeld will leave his current position as chief executive of NEOM, a 26,500 square kilometer (10,230 square mile) business zone under development in the northwest of the kingdom, but will retain a position on its board, an official Saudi statement said on Tuesday.","He “will take over wider responsibilities to enhance the economic, technological and financial development of Saudi Arabia”, the statement said.",Prince Mohammed has launched a sweeping program of reforms designed to wean the Saudi economy off its reliance on oil exports by selling billions of dollars of state assets and developing new industries from tourism to technology.,"Kleinfeld, who will take up his new post on Aug. 1, had been appointed to lead the NEOM project when it was announced last October.","He will be replaced at NEOM by Nadhmi al-Nasr, who has been developing strategy for the project and has over 30 years of experience at national oil giant Saudi Aramco.",Saudi Arabia has said public and private investment in NEOM is eventually expected to total $500 billion.,"The zone, with its own judicial system and legislation to attract international investors, will focus on industries including energy and water, biotechnology, food, advanced manufacturing and tourism."
34,https://www.reuters.com/article/brief-alcoa-corp-announces-pension-fundi/brief-alcoa-corp-announces-pension-funding-after-closing-of-debt-offering-idUSASC0A3AR,2018-05-22T21:11:49Z,BRIEF-Alcoa Corp Announces Pension Funding After Closing Of Debt Offering,May 22 (Reuters) - Alcoa Corp:,* ALCOA CORPORATION ANNOUNCES PENSION FUNDING AFTER CLOSING OF DEBT OFFERING,"* ALCOA CORP - MADE DISCRETIONARY CONTRIBUTIONS TO ITS U.S. PENSION PLANS OF $500 MILLION, GROSS PROCEEDS OF A RECENTLY CLOSED DEBT OFFERING","* ALCOA - ON MAY 17, UNIT ALCOA NEDERLAND HOLDING B.V. CLOSED ITS OFFERING OF $500 MILLION IN 6.125 PERCENT SENIOR NOTES DUE 2028","* ALCOA - IN 2018, EXPECTS TO ACHIEVE FURTHER LIABILITY OPTIMIZATION OF ABOUT $200 MILLION BY CONTRIBUTIONS TO ITS PENSION PLANS OR REDUCING FUNDED DEBT IN BRAZIL Source text for Eikon: Further company coverage:"
35,https://www.reuters.com/article/brief-alcoa-corporation-announces-closin/brief-alcoa-corporation-announces-closing-of-debt-offering-idUSASC0A2UQ,2018-05-17T20:40:30Z,BRIEF-Alcoa Corporation Announces Closing Of Debt Offering,May 17 (Reuters) - Alcoa Corp:,* ALCOA CORPORATION ANNOUNCES CLOSING OF DEBT OFFERING Source text for Eikon: Further company coverage:
36,https://www.reuters.com/article/brief-alcoa-corporation-announces-pricin/brief-alcoa-corporation-announces-pricing-of-debt-offering-idUSASC0A24X,2018-05-14T21:28:50Z,BRIEF-Alcoa Corporation Announces Pricing Of Debt Offering,May 14 (Reuters) - Alcoa Corp:,* ALCOA CORP - CO’S UNIT HAS PRICED AN OFFERING OF $500 MILLION AGGREGATE PRINCIPAL AMOUNT OF 6.125% SENIOR NOTES DUE 2028 Source text for Eikon: Further company coverage:
37,https://www.reuters.com/article/brief-alcoa-corporation-announces-propos/brief-alcoa-corporation-announces-proposed-debt-offering-idUSASC0A1X2,2018-05-14T12:05:38Z,BRIEF-Alcoa Corporation Announces Proposed Debt Offering,May 14 (Reuters) - Alcoa Corp:,* ALCOA CORP - PROPOSED OFFERING OF SENIOR NOTES BY A WHOLLY-OWNED UNIT OF ALCOA,* ALCOA CORP - NOTES WILL BE GUARANTEED ON SENIOR UNSECURED BASIS BY ALCOA & CERTAIN UNITS Source text for Eikon: Further company coverage:
38,https://www.reuters.com/article/us-alcoa-corp-smelter-canada/alcoa-ready-to-resume-labor-talks-for-canada-aluminum-smelter-idUSKBN1I522U,2018-05-04T16:30:33Z,Alcoa ready to resume labor talks for Canada aluminum smelter,TORONTO (Reuters) - Aluminum producer Alcoa Corp said on Friday that management at its Quebec smelter have notified the provincial labor ministry they are ready to resume mediated contract talks with the United Steelworkers union.,"The smelter, which produces some 430,000 metric tonnes of aluminum annually, has been operating at reduced capacity by non-union workers since Jan. 11, when 1,030 unionized workers were locked out after their contract expired.","Aluminum markets, roiled for weeks by U.S. sanctions on Russian oligarch Oleg Deripaska and the massive Rusal aluminum producer he controls, calmed with the extension of a sanctions deadline to Oct. 23.","Prices, which hit a seven-year high of $2,718 per tonne on April 19, were down at $2,350 a tonne Friday.","The United Steelworkers welcome a return to contract talks, a spokeswoman said.","Union workers rejected the company’s final contract offer because it included a new, member-funded pension plan for all workers and concessions on seniority rights, the Steelworkers said.","Quebec appointed lawyer and former politician Lucien Bouchard as special mediator to the talks on April 23, saying it was very concerned about the dispute’s economic impact. Bouchard and another mediator, appointed in November, will set dates for future negotiations.","Alcoa, which holds its annual meeting May 9, owns 74.95 percent of the Becancour, Quebec smelter and Rio Tinto holds the remainder."
39,https://www.reuters.com/article/brief-alcoa-corp-q1-earnings-per-share-0/brief-alcoa-corp-q1-earnings-per-share-0-80-idUSASC09WCR,2018-04-18T20:19:44Z,BRIEF-Alcoa Corp Q1 Earnings Per Share $0.80,April 18 (Reuters) - Alcoa Corp:,* Q1 EARNINGS PER SHARE VIEW $0.70 -- THOMSON REUTERS I/B/E/S,* COMPANY PROJECTS FULL-YEAR 2018 GLOBAL DEFICIT FOR BOTH ALUMINA AND ALUMINUM,* INCREASED ITS 2018 PROJECTION FOR ADJUSTED EBITDA EXCLUDING SPECIAL ITEMS TO $3.5 BILLION TO $3.7 BILLION,* ALCOA - UPDATED FY OUTLOOK FOR ADJUSTED EBITDA EXCLUDING SPECIAL ITEMS DUE TO RECENT FAVORABLE MARKET CONDITIONS,"* QTRLY ALUMINA PRODUCTION 3,173 KMT VERSUS 3,211 KMT LAST YEAR","* INVENTORIES AT QUARTER END WERE $1,630 MILLION VERSUS $1,453 MILLION REPORTED AT Q4 END","* ALCOA - DUE TO DELAYS IN PROJECTS TO EXPAND SMELTERS IN CHINA, EXPECT GLOBAL ALUMINUM DEFICIT TO GROW TO BETWEEN 600,000 - 1 MILLION METRIC TONS IN 2018",* GLOBAL ALUMINUM DEMAND GROWTH IS PROJECTED BETWEEN 4.25 TO 5.25 PERCENT IN 2018,"* ALCOA - “CONSIDERABLE UNCERTAINTY REMAINS IN GLOBAL SUPPLY CHAIN DUE TO MULTIPLE TRADE ACTIONS, SANCTIONS, AND SUPPLY DISRUPTIONS”","* IN ALUMINA, PROJECTS GLOBAL DEFICIT BETWEEN 300 THOUSAND METRIC TONS AND 1.1 MILLION METRIC TONS FOR 2018","* IN ALUMINA, PROJECTS GLOBAL DEFICIT PRIMARILY DUE TO SUPPLY DISRUPTIONS IN ATLANTIC REGION",* “GLOBAL MARKET FOR BAUXITE IS EXPECTED TO REMAIN IN BALANCE” IN 2018 Source text for Eikon: Further company coverage:
40,https://www.reuters.com/article/usa-steel-outlook/earnings-of-alcoa-steel-makers-in-focus-for-insight-on-tariff-impact-idUSL1N1RU11N,2018-04-18T18:42:33Z,"Earnings of Alcoa, steel makers in focus for insight on tariff impact","NEW YORK, April 18 (Reuters) - Shares of Alcoa, Steel Dynamics and Nucor have risen this week, ahead of earnings and boosted by higher commodity prices following sanctions on Russia’s UC Rusal and U.S. tariffs on imported steel and aluminum, and investors are keen for more details on the impact of these political measures.","Alcoa, due to report after the closing bell on Wednesday, was up 4.9 percent on the day and up nearly 9 percent for the week so far. It rose 14.4 percent last week, when U.S. sanctions on Rusal, the world’s second-biggest aluminum producer, sharply drove up aluminum prices.",Aluminum prices hit their highest level since 2011 this week.,"Investors’ focus is likely to be on the companies’ outlooks, which analysts said could be stronger than expectations given the jump in aluminum and steel prices.","If Alcoa uses the same type of analysis as previously, said David Lipschitz, senior analyst for metals and mining at Macquarie Capital in New York, “My guess is ... their numbers would have to go up if they do it off of what (the spot aluminum price) is today.”","He rates Alcoa “outperform,” though he said plenty of uncertainty remains over the longer-term impact of the sanctions on the market.","The quarterly results could provide among the first comments from companies that are likely to benefit from the tariffs or sanctions, though Lipschitz said the benefit of tariffs for Alcoa is less certain because of its operations in Canada.","Last month, U.S. President Donald Trump moved to impose tariffs on steel and aluminum imports, with initial exemptions for Canada and Mexico. The United States has since granted temporary exemptions to the European Union and six other allies.","“With the tariffs and/or quotas we have to wait and see ... there’s a lot of uncertainty around that in terms of how that plays out,” Lipschitz said.","Steel shares have risen this week as well, although they have been volatile since the tariffs’ announcement, given news over which countries might be exempted.","Shares of Steel Dynamics, also due to report after the bell on Wednesday, are up 7.3 percent so far this week, while Nucor, due to report Thursday, is up 6.2 percent. The S&P 1500 steel index, however, is down 4.7 percent since March 1, when Trump announced the tariffs.","“What investors are going to be keenly aware of is what the outlook is for the second quarter,” said Philip Gibbs, analyst at KeyBanc Capital Markets. “For Nucor and Steel Dynamics, it’s going to be very good because these companies have a very high spot orientation and we know spot prices ... have gone up a lot since the announcement of the tariffs.”","All three of the stocks also look less expensive relative to the broader market. Alcoa is trading at about 15.7 times forward earnings compared with 16.7 for the S&P 500, according to Thomson Reuters data.",Steel Dynamics is trading at 10.5 times forward earnings and Nucor at 10.9 times.,"For the first quarter, analysts expect earnings for Alcoa of 70 cents a share. Steel Dynamics is expected to report 91 cents a share and Nucor to report $1.10 a share, according to Thomson Reuters I/B/E/S. (Reporting by Caroline Valetkevitch; editing by Alden Bentley and Leslie Adler)"
