1,https://www.reuters.com/article/us-alcoa-corp-deals-agl-energy/alcoa-australian-smelter-wins-lifeline-bringing-relief-to-embattled-city-idUSKBN2BB05S,2021-03-19T03:52:46Z,Alcoa Australian smelter wins lifeline bringing relief to embattled city,"MELBOURNE (Reuters) - U.S. aluminium giant Alcoa Corp snared government aid and a power deal to keep its Australian smelter open for another five years, bringing relief to an embattled manufacturing and port city with more than 500 jobs saved.","The Portland aluminium smelter’s future had been in doubt after Alcoa flagged in October 2019 it was looking to improve, sell or shut 1.5 million tonnes of smelter capacity worldwide to cut costs and carbon emissions.","Alcoa said on Friday it had reached new, five-year electricity supply agreements with AGL Energy, Origin Energy and Alinta Energy for the smelter, which is the biggest single power user in the state of Victoria.",It also lined up about A$160 million ($124 million) in aid from the Australian and Victorian state governments.,"“The government’s support for Portland recognises its important position, not just as a large employer and key manufacturer, but also for its vital role in keeping the lights on in Victoria,” Prime Minister Scott Morrison said.",Alcoa President Roy Harvey said the power agreements would “help to improve the smelter’s competitiveness” of the plant.,Financial terms of the deals were not disclosed.,"Australia’s rapidly evolving power grid, increasingly reliant on wind and solar power, has made the plant vulnerable to outages over the past several years as it consumes about 10% of Victoria state’s electricity. The worst instance was in December 2016, when the plant lost two-thirds of its capacity.","The plant has since become crucial to balancing electricity supply and demand, being paid by the market operator to lower its power use at peak demand times.","Located on Australia’s southern coast, Portland, population 10,000, has suffered a horrid 12 months that includes the suspension of its timber trade with China amid a diplomatic rift between Canberra and Beijing.","China typically takes more than 90% of Australian log exports, with Portland the export hub for the country’s south-east.","“You better believe we’ve had a rough time, but this is good news today,” resident and business-owner Steve Garner told Reuters on Friday.",“If Alcoa wasn’t here we would lose around 50% of our supermarkets in town and two or three schools.”,The federal government’s aid will ensure the smelter earns at least A$76.8 million ($59 million) through June 2025 in grid security payments. Alcoa said Victoria has agreed in principle to match the federal support.,"“It’s been tough, it’s been challenging and at times it’s been overwhelming,” plant manager Ron Jorgensen said at the announcement of the deal in Portland, apologising as his voice cracked.","The smelter is co-owned by Alcoa, Australia’s Alumina Ltd, CITIC Resources and an arm of Japan’s Marubeni Corp.",($1 = 1.2918 Australian dollars)
2,https://www.reuters.com/article/alcoacorp-spain-layoffs/update-1-alcoa-considering-more-than-500-layoffs-at-spanish-plant-idUSL8N2DA4P9,2020-05-28T14:14:58Z,UPDATE 1-Alcoa considering more than 500 layoffs at Spanish plant,"(Adds background, reaction from local authorities, union rep)","MADRID, May 28 (Reuters) - Alcoa said on Thursday it is considering laying off up to 534 workers from its San Ciprian aluminum plant in the Spanish region of Galicia, though a final decision has not yet been made.","High energy costs and low aluminum prices led to persistent losses and left the plant unable to compete internationally, the company said in an emailed statement.","Alcoa’s announcement comes shortly after Japanese auto giant Nissan Motor Co said it would shut its Barcelona plant from December, putting thousands of jobs in jeopardy.","Together, they are a major blow to the country’s morale as unemployment skyrockets and a steep recession looms in the wake of the coronavirus pandemic.",Workers representatives will meet with Alcoa’s management for three weeks of talks to discuss what challenges the plant faces and the options available.,"“No decision will be taken until this consultation period has finished,” Alcoa said.","Union representative Jose Antonio Zan blasted the company’s actions as “shameful” in an interview on state broadcaster TVE, and attacked the government for failing to support the highly energy-intensive industry.","“We have been asking for a stable energy price for a long time, we have been saying that electro-intensive industries must be supported, as they are in the rest of Europe,” he said.","Including contractors and employees, San Ciprian’s workforce numbers around 2,000 people, he added.","Francisco Conde, the Galicia region’s economy councilor, echoed his criticism of the government’s inaction.","“The decision made by Alcoa is a response to the lack of initiative and response from the government of Spain to establish a price of electricity that would be competitive enough to produce primary aluminum,” he said in an audio statement. (Reporting by Nathan Allen, Emma Pinedo and Inti Landauro, editing by Andrei Khalip)"
3,https://www.reuters.com/article/alcoacorp-spain-layoffs/alcoa-considering-more-than-500-layoffs-at-spanish-plant-idUSL8N2DA4MB,2020-05-28T13:15:09Z,Alcoa considering more than 500 layoffs at Spanish plant,"MADRID, May 28 (Reuters) - Alcoa said on Thursday it is considering laying off up to 534 workers from its San Ciprian aluminium plant in the Spanish region of Galicia, though a final decision has not yet been taken.","High energy costs and low aluminium prices had led to persistent losses and left the plant unable to compete internationally, the company said in an emailed statement. The plant has around 2,000 workers, according to union representatives. (Reporting by Nathan Allen, editing by Andrei Khalip)"
4,https://www.reuters.com/article/health-coronavirus-aluminium/factbox-aluminium-operations-shuttered-due-to-coronavirus-idUSL8N2CM5H7,2020-05-06T10:06:51Z,FACTBOX-Aluminium operations shuttered due to coronavirus,(Adds Alcoa),"LONDON, May 6 (Reuters) - The aluminium market is expected to see a massive surplus this year as demand plummets due to the coronavirus and still growing supply.",A recent Reuters survey showed analysts on average expect the aluminium market to see a surplus of 2.6 million tonnes this year and 1.8 million tonnes in 2021.,"Large amounts of capacity needs to be idled to balance the market. But many producers will not cut, partly because the cost of inputs such as electricity, carbon and alumina have tumbled, supporting their margins.",Companies that have cut aluminium output have largely done so because of lockdowns due to the new coronavirus.,"April 22 -- Alcoa announces the curtailment of the remaining 230,000 tonnes of uncompetitive smelting capacity at the Intalco smelter in Washington State as part of a portfolio review.","Full curtailment, including 49,000 metric tons of earlier-curtailed capacity, is expected to be complete by the end of July 2020.","April 17 - Rio Tinto has shut down the fourth pot-line at the Tiwai Point smelter in New Zealand (NZAS) with production continuing on three lines, to comply here with government lockdown requirements.","Tiwai Point produced 69,000 tonnes of aluminium in Q4 2019 and 279,000 tonnes last year. Potline 4 accounts for around 10% of aluminium production at Tiwai Point.","April 14 - Norsk Hydro has pushed back the restart of idled capacity at its Husnes plant in Norway to the third quarter of this year at the earliest. Husnes has capacity to produce 190,000 tonnes of aluminium a year, it is currently producing 95,000 tonnes a year.","March 30 - Argentina's Aluar has temporarily closed 50% of its 460,000-tonne per year Puerto Madryn here plant to comply with the government's emergency quarantine measures.","March 24 - Chinese aluminium smelters have cut their annual production capacity by up to 340,000 tonnes.",March 23 - Norsk Hydro's Primary Metal business will temporarily idle recycling operations in France and in Luxembourg. bit.ly/2wquVQx,"March 13 - Rusal delays launch of the Taishet aluminium smelter, with capacity of 428,500 tonnes a year, to the first half of 2021 from late 2020. (Reporting by Pratima Desai; editing by Kirsten Donovan)"
5,https://www.reuters.com/article/us-people-paul-o-neill/former-u-s-treasury-secretary-and-iraq-war-critic-paul-oneill-dies-at-84-wsj-idUSKBN2200MW,2020-04-18T14:36:32Z,Former U.S. Treasury Secretary and Iraq war critic Paul O’Neill dies at 84: WSJ,"(Reuters) - Paul O’Neill, the blunt-spoken former head of Alcoa Corp who was fired after two rocky years as U.S. President George W. Bush’s Treasury secretary, died on Saturday at the age of 84 at his home in Pittsburgh, the Wall Street Journal reported.","His family said he had been treated for lung cancer and his death was unrelated to the novel coronavirus, the WSJ reported.","O’Neill served as the Republican Bush’s first Treasury secretary, from January 2001 to December 2002, during a period of in-fighting within the administration and tough economic times worsened by the Sept. 11, 2001, attacks on the United States.","The multimillionaire former corporate chieftain - he led aluminum company Alcoa from 1987 to 2000 - was not a big fan of Bush’s first round of tax cuts. He then argued in vain with others in the administration, including Vice President Dick Cheney, against more cuts that he felt could fuel budget deficits and hurt the economy.","He also earned a reputation as a loose cannon as Treasury secretary with comments that at various times infuriated members of Bush’s inner circle, fellow Republicans in Congress, Wall Street, Latin American governments and others.","It was Cheney, his friend dating to the 1970s in President Gerald Ford’s administration and had recruited O’Neill into the Treasury job, who told him that he was fired. O’Neill said Cheney had asked him to say his departure was his own decision, but O’Neill refused.","“I’m too old to begin telling lies now,” he said.","History bore out his concerns over the Bush tax cuts, which along with the costs of Bush’s wars in Iraq and Afghanistan contributed to soaring U.S. budget deficits in subsequent years.","Regarding Iraq, O’Neill said Bush’s team had decided on a course of war which it then tried to justify by touting the threat posed by Iraqi leader Saddam Hussein’s weapons of mass destruction. After the invasion, no such weapons were found.",‘FINDING A WAY’,"“From the start, we were building the case against Hussein and looking at how we could take him out and change Iraq into a new country,” O’Neill said in the 2004 book “The Price of Loyalty” by journalist Ron Suskind. “And, if we did that, it would solve everything. It was about finding a way to do it.”","Asked in 2008 whether he felt bitter about his time in the Bush administration, O’Neill told the New York Times: “No. I’m thankful I got fired when I did so that I didn’t have to be associated with what they subsequently did.”",During his stint as Treasury secretary O’Neill outraged congressional Republicans by calling one of their tax cut measures “show business.” He annoyed others in the administration by telling lawmakers that Bush’s signature tax cut drive was not likely to boost the economy in the short term.,"He dismissed stock, bond and currency traders as “people who sit in front of flickering green screens” whose jobs he could master in “a couple of weeks.” Brazil’s government protested after O’Neill worried publicly that money lent to Latin American countries would vanish into Swiss bank accounts.",He also irked Wall Street with overly optimistic assessments of the economy including an errant forecast after the 2001 attacks that the stock market would swiftly bounce back. His comment that the administration was not interested in pursuing a strong-dollar policy rattled global currency markets.,"O’Neill was born on Dec. 4, 1935, in St. Louis to a family of modest means. After college, he began his career in government in 1961, working for the Veterans Administration. He was named as the No. 2 official in the White House budget office in 1974 and became friends with fellow Ford administration officials Cheney and Alan Greenspan, the future Fed chairman.","After Ford lost his 1976 re-election bid, O’Neill joined International Paper Co, eventually becoming its president.","Greenspan served on Alcoa’s board when the aluminum company was searching for a new leader, and recruited O’Neill.","O’Neill served as both chairman and CEO of Alcoa from 1987 to 1999 - increasing its profit, stock price and market share - and retired as chairman in 2000. His Alcoa stock and options exceeded $100 million by the time he left.","O’Neill and his wife, Nancy, had four children."
6,https://www.reuters.com/article/people-paul-oneill/corrected-former-u-s-treasury-secretary-paul-oneill-dies-at-84-wsj-idUSFWN2C519G,2020-04-18T13:56:39Z,CORRECTED-Former U.S. Treasury Secretary Paul O’Neill dies at 84 -WSJ,"(Corrects headline to remove reference to Alcoa, which incorrectly stated he was Alcoa CEO after serving as Treasury secretary, when it was actually before)","April 18 (Reuters) - Paul O’Neill, former Treasury secretary of the United States and former chief executive of Alcoa Corp , died at age 84 on Saturday, the Wall Street Journal reported.","O’Neill had been under treatment for lung cancer and his death is unrelated to the coronavirus, the Journal on.wsj.com/2RNi9Tv said."
7,https://www.reuters.com/article/brief-alcoa-says-ceo-roy-harveys-fy-2019/brief-alcoa-says-ceo-roy-harveys-fy-2019-total-compensation-was-about-13-0-mln-sec-filing-idUSFWN2BC1FR,2020-03-19T22:12:37Z,BRIEF-Alcoa Says CEO Roy Harvey's FY 2019 Total Compensation Was About $13.0 Mln - SEC Filing,March 19 (Reuters) - Alcoa Corp:,* ALCOA CORP SAYS CEO ROY HARVEY’S FY 2019 TOTAL COMPENSATION WAS ABOUT $13.0 MILLION VERSUS $13.2 MILLION IN FY 2018 - SEC FILING,"* ALCOA CORP SAYS FOR 2019, CEO PAY RATIO IS 129:1 Source : (bit.ly/2wkTQ7K) Further company coverage:"
8,https://www.reuters.com/article/us-australia-electricity-alcoa-corp/alcoa-says-power-restored-to-australian-plant-after-heat-waves-idUSKBN1ZX0CN,2020-02-03T04:34:52Z,Alcoa says power restored to Australian plant after heat waves,"MELBOURNE (Reuters) - Power to Alcoa Corp’s Portland aluminum smelter has returned to normal levels after a blackout on Friday caused by heat waves in Australia’s south, the company said in a statement on Monday.","One of two transmission lines to the smelter remains out of service due to the outage, however, Alcoa added. It blamed an external disruption for the interruption, but did not say if production had been affected.","“Focus has now turned to the repair of the damaged transmission line, which is essential to help safeguard the plant against further outages,” Michael Gollschewski, the president of Alcoa of Australia, said in the statement.","Friday’s power cut followed the tripping of a transmission line amid soaring temperatures, the Australian Energy Market Operator said.","Heatwaves in Australia during the southern hemisphere summer caused brought an earlier than usual start to the bushfire season, killing 33 people and razing more than 11.7 million hectares (28 million acres) of bushland.","The Portland aluminum smelter is a joint venture between Alcoa of Australia Limited, which has a stake of 55%; CITIC, which holds a stake of 22.5%; and Marubeni Aluminium Australia, with 22.5%. Alcoa manages daily operations."
9,https://www.reuters.com/article/australia-electricity-alcoa-corp/alcoas-australian-aluminium-smelter-hit-by-power-cut-amid-heatwave-idUSL4N2A025G,2020-01-31T05:36:42Z,Alcoa's Australian aluminium smelter hit by power cut amid heatwave,"MELBOURNE, Jan 31 (Reuters) - Alcoa Corp’s Australian aluminium smelter was hit by a power cut on Friday after a transmission line tripped amid soaring temperatures in the country’s southeast, the Australian Energy Market Operator said.","AEMO, which manages electricity supply, said the transmission line outage “has resulted in a separation between Victoria and South Australia at the Heywood Interconnector, as well as interrupting supply at the Portland aluminium smelter.”","“At approximately 2:20 p.m. EST on 31 January, Portland Aluminium smelter lost power to both potlines due to a fault external to the plant. The cause of the fault is currently unknown,” an Alcoa spokeswoman said in emailed comments. (Reporting by Sonali Paul; Editing by Muralikumar Anantharaman)"
10,https://www.reuters.com/article/us-apple-aluminum/apple-buys-first-ever-carbon-free-aluminum-from-alcoa-rio-tinto-venture-idUSKBN1Y91RQ,2019-12-05T14:32:50Z,Apple buys first-ever carbon-free aluminum from Alcoa-Rio Tinto venture,(Reuters) - Apple Inc on Thursday said it has bought the first-ever commercial batch of carbon-free aluminum from a joint venture between two of the world’s biggest aluminum suppliers.,"The metal is being made by Elysis, a Montreal-based joint venture of Alcoa Corp and Rio Tinto announced last year with $144 million in funding from the two companies, Apple and the governments of Canada and Quebec.","The aluminum will be shipped this month from an Alcoa research facility in Pittsburgh and used in Apple products, although the technology company did not say which ones.","Aluminum is carbon-intensive to produce. The smelting process involves passing electrical current through a large block of carbon called an anode, which burns off during the process and releases carbon dioxide into the atmosphere.","The carbon-free move is a response to consumer, activist and investor demand that miners and manufacturers show they are working to lessen their impact on climate change.","“For more than 130 years, aluminum - a material common to so many products consumers use daily - has been produced the same way. That’s about to change,” Lisa Jackson, Apple’s vice president of environment, policy and social initiatives, said in a statement.","Apple uses aluminum housings for many of its electronics, including iPhones, Apple Watches and Mac computers. Apple last year introduced Mac models that use recycled aluminum.","The Alcoa-Rio joint venture wants to commercialize a technology by 2024 that uses a ceramic anode to make aluminum and emits only oxygen, eliminating direct greenhouse gas emissions from the smelting process.",Alcoa has already produced test metal with the process and joined with Rio Tinto to bring it up to commercial scale. Elysis plans to license the technology and says that existing smelting facilities can be retrofitted to use it.,"The first batch was made in Pittsburgh, but Elysis also plans to manufacture it at a $50 million CAD research facility being built in Saguenay, Quebec, and that is expected to come online in the second half of 2020.","Apple and Elysis would not disclose the size or cost of the first purchase. They described it as a “commercial batch,” and Elysis said the process is expected to have lower operating costs than traditional aluminum smelting."
11,https://www.reuters.com/article/australia-aluminium/alcoas-australian-smelter-needs-cheaper-power-to-stay-open-past-2021-partner-idUSL4N28E4KB,2019-12-05T07:08:33Z,Alcoa's Australian smelter needs cheaper power to stay open past 2021 - partner,"MELBOURNE, Dec 5 (Reuters) - Alcoa Corp will need cheaper, more reliable power to keep its Portland smelter in Australia open beyond 2021 when its current supply deal ends, the aluminium major’s partner said on Thursday.","Alumina Ltd, Alcoa’s partner in the Alcoa World Alumina and Chemical joint venture, would have a veto over any decision to shut the plant, its Chief Executive Mike Ferraro said, adding it was too early to predict the smelter’s future.","“We would ideally like to find a solution,” Ferraro told reporters on the sidelines of a mining event in Melbourne.","“It’s well run, it’s a relatively new smelter,” he said.","The power contract for the Portland smelter, which consumes about 10% of the state of Victoria’s electricity, ends in mid-2021.","“Ideally, we would like to renegotiate a new power contract at a lower price,” Ferraro said.","The Portland smelter was rescued in 2017 with Australian federal and state government subsidies of around A$230 million ($156 million) and a cheap power deal, after being crippled by a blackout that caused molten aluminium to solidify.","The plant has been plagued by power issues over the past few years, and now gets paid to curtail power use to help prevent blackouts during heatwaves. Two weeks ago it had to cope with eight hours of shaky supply.","Speculation the plant may be shut in 2021 grew after Alcoa said in October that it planned to curtail, close, sell or improve 1.5 million tonnes of smelting capacity over the next five years to help it become the world’s lowest per ton carbon emitter among aluminium producers.","The Portland plant, co-owned by AWAC, CITIC and Marubeni Corp, is powered by coal-fired electricity, making it a big carbon emitter compared to Alcoa’s plants elsewhere that are fuelled by hydropower.","Rival Rio Tinto is also weighing up the future of three aluminium smelters in Australia and a smelter in New Zealand, pressing for cheaper and more reliable power, as the Australian grid becomes more dependent on intermittent wind and solar power.","AGL Energy, Australia’s top power producer, said last month it is in talks with the Portland plant and Rio Tinto’s Tomago smelter, it’s two biggest customers.","“All things being equal, whether we make a dime out of it or not, we will work as a good corporate citizen to do everything we can to keep those smelters going,” AGL Chief Executive Brett Redman told analysts. ($1 = 1.4736 Australian dollars) (Reporting by Sonali Paul, Editing by Sriraj Kalluvila)"
12,https://www.reuters.com/article/us-alcoa-corp-canada-strike/alcoa-expects-40-million-50-million-hit-from-restarting-canada-smelter-idUSKCN1TX2WT,2019-07-02T22:18:15Z,Alcoa expects $40 million-$50 million hit from restarting Canada smelter,"(Reuters) - Aluminum producer Alcoa Corp said on Tuesday it expects to incur a charge of between $40 million and $50 million in the second half of 2019, related to restarting operations at its Canadian smelter in Becancour, Quebec.","An 18-month lock out between the company and workers at the Aluminerie de Bécancour Inc smelter ended on Tuesday as about 80% of the workers voted to ratify the latest contract, according to the United Steelworkers union.","Alcoa said it expects the smelter, which has an annual capacity of 413,000 metric tons per year, to restart on July 26.",The company said it expects a charge of between 22 cents and 27 cents per share in the second half of 2019.
13,https://www.reuters.com/article/us-alcoa-corp-results/alcoa-beats-profit-estimates-on-strength-in-alumina-segment-idUSKCN1PA2WW,2019-01-17T20:40:01Z,Alcoa beats profit estimates on strength in alumina segment,"(This Jan 16 story corrects quote in third paragraph to read “the quarterly point-in-time full-year earnings”, instead of “the poorly point-in-time full-year earnings”.)","(Reuters) - Top U.S. aluminum producer Alcoa Corp beat Wall Street estimates for quarterly profit on Wednesday, buoyed by strength in its alumina segment, but shares slipped after the company did not provide a closely watched profit measure for the full year.","The company’s shares were down 1.6 percent in extended trading, reversing course after rising as much as 3.5 percent to $30.","Alcoa Chief Financial Officer William Oplinger said on a post-earnings call that the company was eliminating “the quarterly point-in-time full-year earnings before interest, tax, depreciation and amortization outlook” given the unprecedented market volatility.","Alcoa said it expected the global aluminum deficit to extend into 2019 and estimated that its aluminum shipments would decline 500,000 to 600,000 tons year over year.","“Demand growth for primary aluminum in 2019 is expected to be robust, with global consumption growth in the range of 3 percent to 4 percent, driven by continued strong growth in China,” Chief Executive Officer Roy Harvey said on the call.","The company said it expected an alumina surplus in China in 2019, driven by refinery expansions and lower-than-expected smelting production.","Strong sales of alumina to third-party smelters, which jumped 20.8 percent to $1.13 billion, helped the company counter a fall in aluminum prices.",Pittsburgh-based Alcoa has reaped mixed benefits from President Donald Trump’s decision to impose tariffs on aluminum and steel imports into the United States. The company has been hit by imports from its smelter in Canada.,"Alcoa, which is shuttering two of its aluminum plants in Spain, said it expected an annual net income improvement of $70 million to $80 million beginning in the third quarter of 2019 from the closures.","Benchmark three-month aluminum prices on the London Metal Exchange fell 5.7 percent in December, the steepest monthly drop since June, as the United States said it would withdraw its sanctions on Russian aluminum giant Rusal.","Net income attributable to Alcoa was $43 million, or 23 cents per share, in the quarter ended Dec. 31, compared with a loss of $196 million, or $1.06 per share, a year earlier.",Revenue rose 5.4 percent to $3.34 billion.,"On an adjusted basis, the company earned 66 cents per share.","Analysts on average had expected a profit of 50 cents per share, according to I/B/E/S data from Refinitiv."
