1,https://www.reuters.com/article/brief-american-financial-group-sets-regu/brief-american-financial-group-sets-regular-quarterly-dividend-of-0-45-share-idUSFWN2E80GD,2020-07-01T13:01:20Z,BRIEF-American Financial Group Sets Regular Quarterly Dividend Of $0.45/Share,July 1 (Reuters) - American Financial Group Inc:,* SETS REGULAR QUARTERLY DIVIDEND OF $0.45PER SHARE Source text for Eikon: Further company coverage:
2,https://www.reuters.com/article/brief-american-financial-group-appoints/brief-american-financial-group-appoints-interim-principal-financial-officer-and-principal-accounting-officer-idUSFWN2E00TE,2020-06-23T21:19:09Z,BRIEF-American Financial Group Appoints Interim Principal Financial Officer And Principal Accounting Officer,June 23 (Reuters) - American Financial Group Inc:,* AMERICAN FINANCIAL GROUP INC - APPOINTED BRIAN S. HERTZMAN AS ITS INTERIM PRINCIPAL FINANCIAL OFFICER AND PRINCIPAL ACCOUNTING OFFICER Source text: bit.ly/2Ys1oRu Further company coverage:
3,https://www.reuters.com/article/brief-american-financial-group-cfo-resig/brief-american-financial-group-cfo-resigns-idUSASA00TE9,2020-06-10T21:22:02Z,BRIEF-American Financial Group CFO Resigns,June 10 (Reuters) - American Financial Group Inc:,"* AMERICAN FINANCIAL GROUP, INC. ANNOUNCES LEADERSHIP CHANGES",* AMERICAN FINANCIAL GROUP - CONSOLINO WILL BE LEAVING TO PURSUE ANOTHER OPPORTUNITY IN INSURANCE INDUSTRY Source text for Eikon: Further company coverage:
4,https://www.reuters.com/article/brief-american-financial-group-announces/brief-american-financial-group-announces-pricing-of-150-million-of-5-625-subordinated-debentures-due-june-1-2060-idUSFWN2D30LH,2020-05-21T21:09:48Z,"BRIEF-American Financial Group Announces Pricing Of $150 Million Of 5.625% Subordinated Debentures Due June 1, 2060",May 21 (Reuters) - American Financial Group Inc:,"* AMERICAN FINANCIAL GROUP, INC. ANNOUNCES THE PRICING OF $150 MILLION AGGREGATE PRINCIPAL AMOUNT OF SUBORDINATED DEBENTURES DUE 2060","* AMERICAN FINANCIAL GROUP - PRICED OFFERING OF $150 MILLION OF 5.625% SUBORDINATED DEBENTURES DUE JUNE 1, 2060 Source text for Eikon: Further company coverage:"
5,https://www.reuters.com/article/brief-american-financial-group-inc-files/brief-american-financial-group-inc-files-prospectus-supplement-related-to-a-potential-subordinated-debentures-offering-idUSFWN2D30NE,2020-05-21T13:52:35Z,BRIEF-American Financial Group Inc Files Prospectus Supplement Related To A Potential Subordinated Debentures Offering,May 21 (Reuters) - American Financial Group Inc:,* AMERICAN FINANCIAL GROUP INC FILES PROSPECTUS SUPPLEMENT RELATED TO A POTENTIAL SUBORDINATED DEBENTURES OFFERING - SEC FILING,* AMERICAN FINANCIAL GROUP INC - WILL APPLY FOR LISTING OF DEBENTURES ON NYSE”UNDER THE SYMBOL “AFGD.” Source text - bit.ly/2TodiJm Further company coverage:
6,https://www.reuters.com/article/brief-american-financial-group-posts-q1/brief-american-financial-group-posts-q1-loss-of-3-34-idUSASA00PJC,2020-05-11T22:42:17Z,BRIEF-American Financial Group Posts Q1 Loss Of $3.34,May 11 (Reuters) - American Financial Group Inc:,"* AMERICAN FINANCIAL GROUP, INC. ANNOUNCES FIRST QUARTER RESULTS",* Q1 EARNINGS PER SHARE ESTIMATE $1.85 -- REFINITIV IBES DATA,* AMERICAN FINANCIAL GROUP- CONTINUES TO EXPECT 2020 CORE NET OPERATING EARNINGS PER SHARE EXCLUDING MTM INVESTMENTS TO BE IN RANGE OF $6.45 TO $7.25,"* BOOK VALUE PER SHARE, EXCLUDING UNREALIZED GAINS RELATED TO FIXED MATURITIES, WAS $55.52 PER SHARE AT MARCH 31, 2020 Source text for Eikon: Further company coverage:"
7,https://www.reuters.com/article/brief-american-financial-group-reports-r/brief-american-financial-group-reports-revised-earnings-guidance-for-2020-idUSFWN2C314C,2020-04-15T20:35:31Z,BRIEF-American Financial Group Reports Revised Earnings Guidance For 2020,April 15 (Reuters) - American Financial Group Inc:,"* AMERICAN FINANCIAL GROUP, INC. (NYSE: AFG) ANNOUNCED TODAY REVISED EARNINGS GUIDANCE FOR 2020",* AMERICAN FINANCIAL GROUP INC - COMPANY NOW BELIEVES RETURN ON MTM INVESTMENTS IN 2020 WILL BE SIGNIFICANTLY LOWER THAN ITS PREVIOUS EXPECTATIONS,* AMERICAN FINANCIAL GROUP INC SEES 2020 AFG CORE NET OPERATING EARNINGS PER SHARE $6.45 - $7.25,* AMERICAN FINANCIAL GROUP INC SEES Q1 2020 AFG CORE NET OPERATING EARNINGS PER SHARE $1.80 - $1.90,* AMERICAN FINANCIAL GROUP INC SEES Q1 2020 AFG NET LOSS PER SHARE $3.40- $3.30,* AMERICAN FINANCIAL GROUP INC - DUE TO ONGOING VOLATILITY AND UNCERTAINTY IT IS DIFFICULT TO FORECAST ACCURATELY ULTIMATE MTM RETURNS IN 2020,"* AMERICAN FINANCIAL GROUP INC - ESTIMATES THAT ITS EXCESS CAPITAL AT MARCH 31, 2020 EXCEEDED $600 MILLION",* AMERICAN FINANCIAL GROUP INC - EXPECTS TO CONTINUE TO HAVE SIGNIFICANT EXCESS CAPITAL AND LIQUIDITY THROUGHOUT 2020 AND BEYOND Source text for Eikon: Further company coverage:
8,https://www.reuters.com/article/brief-american-financial-2019-compensati/brief-american-financial-2019-compensation-for-co-chief-executive-officer-co-president-was-10-5-mln-vs-10-2-mln-idUSFWN2BR0Q3,2020-04-03T13:04:17Z,BRIEF-American Financial- 2019 Compensation For Co-Chief Executive Officer & Co-President Was $10.5 Mln Vs $10.2 Mln,April 3 (Reuters) - American Financial Group Inc:,* AMERICAN FINANCIAL GROUP - 2019 COMPENSATION FOR CO-CHIEF EXECUTIVE OFFICER AND CO-PRESIDENT CARL H. LINDNER III $10.5 MILLION VERSUS $10.2 MILLION IN 2018,* AMERICAN FINANCIAL - 2019 COMPENSATION FOR CO-CHIEF EXECUTIVE OFFICER AND CO-PRESIDENT S. CRAIG LINDNER $10.5 MILLION VERSUS $10.2 MILLION IN 2018,* AMERICAN FINANCIAL - RATIO OF 2019 TOTAL COMPENSATION OF EACH CO-CEO TO 2019 TOTAL COMPENSATION OF MEDIAN EMPLOYEE WAS 142 TO 1 Source text: bit.ly/3dNtgFk Further company coverage:
9,https://www.reuters.com/article/brief-american-financial-group-inc-annou/brief-american-financial-group-inc-announces-the-offering-of-300-million-of-senior-notes-idUSASA00J3U,2020-03-27T00:39:34Z,"BRIEF-American Financial Group, Inc. Announces The Offering Of $300 Million Of Senior Notes",American Financial Group Inc:,"* AMERICAN FINANCIAL GROUP, INC. ANNOUNCES THE OFFERING OF $300 MILLION OF SENIOR NOTES Source text for Eikon: Further company coverage:"
10,https://www.reuters.com/article/brief-american-financial-group-inc-files/brief-american-financial-group-inc-files-prospectus-supplement-related-to-a-potential-senior-notes-offering-idUSFWN2BJ0ZY,2020-03-26T14:10:08Z,BRIEF-American Financial Group Inc Files Prospectus Supplement Related To A Potential Senior Notes Offering,March 26 (Reuters) - American Financial Group Inc:,* AMERICAN FINANCIAL GROUP INC FILES PROSPECTUS SUPPLEMENT RELATED TO A POTENTIAL SENIOR NOTES OFFERING - SEC FILING Source text - (bit.ly/2vU2bPK) Further company coverage:
11,https://www.reuters.com/article/brief-american-financial-group-reports-q/brief-american-financial-group-reports-q1-core-operating-earnings-per-share-2-42-idUSASC09Z9H,2018-05-02T21:13:50Z,BRIEF-American Financial Group Reports Q1 Core Operating Earnings Per Share $2.42,May 2 (Reuters) - American Financial Group Inc:,"* AMERICAN FINANCIAL GROUP, INC. ANNOUNCES FIRST QUARTER RESULTS",* SEES FY 2018 CORE OPERATING EARNINGS PER SHARE $7.90 TO $8.40,* Q1 EARNINGS PER SHARE VIEW $1.98 -- THOMSON REUTERS I/B/E/S,* BOARD OF DIRECTORS HAS DECLARED A SPECIAL CASH DIVIDEND OF $1.50 PER SHARE,* SPECIAL DIVIDEND IS IN ADDITION TO COMPANY’S REGULAR QUARTERLY CASH DIVIDEND OF $0.35 PER SHARE Source text for Eikon: Further company coverage:
