1,https://www.reuters.com/article/tadawul-ipo-int/saudi-tadawul-group-hires-jp-morgan-citi-ncb-capital-for-ipo-statement-idUSKBN2CF1ZD,2021-04-28T14:53:33Z,"Saudi Tadawul Group hires JP Morgan, Citi, NCB Capital for IPO -statement","DUBAI (Reuters) -Saudi Tadawul Group, the owner and operator of the country’s stock market, said on Wednesday it appointed JP Morgan, Citigroup and the securities arm of Saudi National Bank for its initial public offering.",Tadawul said the public share sale will allow it to expand and strengthen its position globally. The deal is part of efforts by Saudi Arabia to diversify its economy.,"With a market capitalisation of $2.5 trillion, Tadawul is the Arab world’s largest stock exchange.","Saudi Arabia’s stock exchange has converted itself into a holding company and will be renamed Saudi Tadawul Group ahead of the listing this year, Group Chief Executive Khalid al-Hussan said previously.","The group will have four subsidiaries - its bourse Saudi Exchange, securities clearing and depository businesses and technology services."
2,https://www.reuters.com/article/us-citigroup-moves-ghiawadwala/tasnim-ghiawadwala-to-head-citigroup-commercial-bank-memo-idUSKBN2CA1LX,"April 23, 2021 2:00 PM UTC",Tasnim Ghiawadwala to head Citigroup commercial bank: memo,"Citigroup (C.N) has appointed Tasnim Ghiawadwala as head of its Commercial Bank, according to an internal memo seen by Reuters on Friday.",A spokesman for Citi confirmed the contents of the memo.,"Ghiawadwala joins from Barclays where she was head of its corporate bank in Britain since 2018. Citi is expanding its commercial bank in Europe, Reuters reported last year.",,,,
3,https://www.reuters.com/article/us-mcguire-citigroup-mayor/citi-to-pay-ny-mayor-candidate-and-former-executive-mcguire-over-5-7-million-idUSKBN2C92WG,"April 22, 2021 9:54 PM UTC",Citi to pay NY mayor candidate and former executive McGuire over $5.7 million,"Former Wall Street executive and Democratic candidate for mayor of New York Ray McGuire will receive more than $5.7 million from Citigroup Inc (C.N) as part of a bonus program, according to his annual financial disclosure report.",McGuire was one of the senior-most Black executives on Wall Street till he left Citi last year after 15 years in various roles to join the mayor's race.,"""Under our regular annual bonus program, a large portion of compensation earned by an employee each year is not paid when earned, but rather is delivered over a four-year period,"" a spokeswoman for Citi said on Thursday.","""The treatment of Mr. McGuire's deferred amounts follows our standard policy for employees who retire after long service with Citi.""","He will receive the money in four equal installments between 2022 and 2025, the filing showed.","McGuire headed Citi's corporate and investment banking unit for 13 years and was also chairman of banking, capital markets and advisory. Prior to Citi, he was with Morgan Stanley (MS.N).","The move into politics for McGuire, who until recently held the title of vice chairman at Citi, came after he was on a short list of candidates to head the New York Federal Reserve in 2018.","A successful candidacy would make McGuire only the second Black mayor of America's largest city, after David Dinkins' stint in the 1990s.","McGuire is not the first Wall Street executive to dabble in politics. Billionaire Michael Bloomberg was New York mayor from 2001-2013, and Phil Murphy, a former Goldman Sachs banker, is the current governor of New Jersey.",News of the bonus payments was first reported by CNBC earlier on Thursday.,
4,https://www.reuters.com/article/us-citigroup-ceo-breakingviews/citis-new-boss-could-grow-or-shrink-to-greatness-idUSKBN2C7277,"April 20, 2021 5:41 PM UTC",Citi’s new boss could grow or shrink to greatness,"Jane Fraser, the new boss of Citigroup (C.N), says she wants her bank to be excellent. Much of what the $150 billion U.S. lender does at the moment is middling. If Fraser can clean up Citi’s tattered image, brilliance could come from bulking up. Otherwise, a breakup could shine more brightly. Both routes come with challenges.","The Scot hinted at the slimming-down approach last week when she said Citi will sell a collectively unprofitable group of retail networks across Asia and Europe, barely two months into her tenure as chief executive. While Fraser isn’t talking about dismantling the empire, which reaped $73 billion in revenue over the last four quarters, it’s worth totting up the value of its three main chunks.",,3 x 1 = 2.5,"Start with Citi’s banking business in the United States. While it’s a huge credit-card issuer, both under its own name and for brands like Best Buy (BBY.N) and Macy’s (M.N), Citi’s assets place it a distant fourth after JPMorgan (JPM.N), Bank of America (BAC.N) and Wells Fargo (WFC.N), according to Federal Reserve data. That jars with Fraser’s claim that she wants Citi’s divisions to occupy market-leading positions.","Even so, it’s a big portion of Citi’s market value. The consumer business makes around $9 billion of operating profit a year before provisions against bad debt. Next-smallest rival U.S. Bancorp (USB.N) trades at 8.7 times its own pre-provision profit. On the same multiple, Citi’s home-turf retail bank could be worth $80 billion.","Then there’s Mexican lender Banamex, which by Fraser’s reckoning has a decent market share of around 20%, plus a selection of Asian credit card and retail bank operations. Collectively they make a little more than $2 billion in net income a year. Put those on a 10 times multiple, roughly where bigger and more efficient rivals Santander Mexico and Banorte trade, and they’re worth $20 billion.","That leaves Citi's institutional business – a trading, lending and cash management beast with tentacles extending across the globe. While Citi doesn’t have the flashiness of Goldman Sachs (GS.N), its corporate connections suggest its $14 billion of institutional net profit over the past four quarters could be valued on a par with Goldman’s 8 times earnings, according to Refinitiv, giving it a value of $110 billion.","Put it all together, and Citi’s parts could be worth over $200 billion, more than a third above its current market value. A broader manifestation of the same problem is that for most of the past decade, Citi’s market capitalization has been less than its net assets, which normally act as a floor for a bank’s valuation.",,BUILDING UP,"To realize some of that buried value, Fraser could go shopping. Put Citi and U.S. Bancorp together, for example, and the result would be a consumer bank with $43 billion of annual revenue, bigger than Bank of America’s business and with more highly profitable credit cards. Citi has branches in places like New York where U.S. Bancorp, which is mostly spread across the Midwest and West Coast, doesn’t.","It would be a quicker way to create a top-ranked U.S. retail presence than fighting for business one person at a time. Fraser thinks she can add customers with apps and digital services, but that’s a slog, and her rivals are all trying to do the same thing. Moreover, crunching together two banking franchises can generate substantial cost savings. In M&T Bank's (MTB.N) deal to buy People’s United Financial (PBCT.O), announced in February, the two reckon on cutting one-third of the smaller bank’s operating costs. In U.S. Bancorp’s case, that would be $4 billion a year.","The problem is that there’s virtually no chance of Washington's regulators letting a company as accident-prone as Citi make a huge acquisition for the next couple of years at least. Recent gaffes include a $400 million fine over its sloppy processes and accidentally wiring nearly $1 billion to a group of hedge funds. In time Fraser might get permission from the regulators to grow to greatness, but only if she can do what her predecessor Mike Corbat didn’t, and keep Citi’s nose clean.",,TAKING DOWN,"If bulking up doesn't work out, Fraser's other option is to shrink. Ditching small markets like Poland and Vietnam, as she is now doing, isn’t really significant. But selling the U.S. consumer bank would be a bold step that might unwind Citi's so-called conglomerate discount, which amounts to a kind of punishment for sprawl inflicted by investors.","Dismantling Citi as aggressively as that would also need to wait, though. The U.S. retail bank's deposits are a cheap form of funding, and there’s no obvious taker, either. Wells Fargo might covet Citi’s credit card business, but Charlie Scharf, the San Francisco-based lender's newish boss, is still trying to mend fences with regulators after his bank’s fraud problems. Retail banking is also a way to snare wealth management customers, which for now is part of Fraser’s grand plan.","Selling Banamex would be an easier interim step towards a more focused bank. But it would only be a start, and Fraser would have to have a bigger plan in mind. The business it's hardest to imagine Citi parting with, and the one that in any case punches its weight, is the institutional behemoth.","In the long term, keeping today's middling Citi muddling along isn't an option. Fraser has one thing in her favor though: investor tolerance. Corbat left an institution that had delivered shareholders a total return of only around a third of what they would have got from Bank of America or JPMorgan during his eight-year tenure. Even then, shareholders weren’t clamoring for a breakup. Fraser has time to think bigger.",,Follow @johnsfoley on Twitter,,"- For previous columns by the author, Reuters customers can click on",
5,https://www.reuters.com/article/us-citigroup-m-a-asia-exclusive/exclusive-dbs-stanchart-weigh-bids-as-citi-retreats-from-asia-consumer-business-sources-idUSKBN2C70SV,"April 20, 2021 10:33 AM UTC","Exclusive-DBS, StanChart weigh bids as Citi retreats from Asia consumer business - sources","Banks including DBS Group (DBSM.SI), Mitsubishi UFJ Financial Group (MUFG), OCBC (OCBC.SI) and Standard Chartered (STAN.L) are set to bid for parts of Citigroup’s (C.N) consumer business in Asia, people with direct knowledge of the matter said.","The sale process will start within a couple of weeks, they added, declining to be named as they were not authorised to speak to media.","The move comes after Citi said it would exit from its consumer franchises in 13 markets, 10 of which are in Asia, as it refocuses on its more lucrative institutional and wealth management businesses in these markets.","Potential bids from the regional banks and StanChart, which makes most of its profit in Asia, underscores their growing appetite for businesses like credit cards and mortgages in a push to lock in long-term income growth.","The businesses Citi is exiting had $82 billion in assets and were allocated $7 billion in tangible common equity last year. Citi has plans to reposition its Asian consumer banking business from its ""wealth centres"" of Hong Kong and Singapore.","As Citi is not giving up its banking licences in most of the markets it is exiting, the sale of the consumer banking portfolios and branches will only appeal to lenders with existing presence in these countries, the people said.","""Asia is critical to our firm's strategy, and we will allocate resources to drive profitable growth,"" a Citi spokesman in Hong Kong said, declining to comment on the sale process.","Representatives at Japanese lender MUFG and StanChart, and Sumitomo Mitsui Financial Group (8316.T), which the sources said was another potential bidder, declined to comment.","""DBS has always been open to exploring sensible bolt-on opportunities in markets where we have a consumer banking franchise (China, India, Indonesia and Taiwan) and where we can overlay our digital capabilities,"" Southeast Asia's biggest lender said in a statement.","In 2016, DBS bought ANZ's (ANZ.AX) wealth management and retail businesses in five Asian markets for about $80 million.","Citi's sprawling India consumer business, comprising retail deposits, mortgages and credit cards, and its Taiwan business would be among the most valuable parts of its Asian consumer portfolio, the sources said.",Citi's consumer banking business in the 13 markets accounted for $4.2 billion of the bank's $74.3 billion revenue in 2020. All the markets it is exiting made a combined loss of $40 million in the consumer banking business in the same year.,INDIA 'JEWEL IN THE CROWN',"DBS, the only big foreign bank with a fully owned Indian subsidiary, is eyeing Citi's India business, which is also set to attract StanChart and local lenders Kotak Mahindra Bank (KTKM.NS) and Axis Bank (AXBK.NS), the sources said.","SBI Cards and Payment Services Ltd (SBIC.NS), a unit of State Bank of India (SBI.NS), is also weighing a bid for Citi's credit card portfolio in India, two of the sources said.","Citi's India consumer business is valued at over $2 billion, according to four sources.","""India is the jewel in the crown and will command a better price than the other markets,"" one of the sources added.",Citi has been in India for decades and was among the first to introduce Indians to credit cards in 1987. It ranks as the sixth largest local card issuer with nearly 2.7 million cards.,"Sources say Citi has a significant share in the premium segment, commanding higher spends per card of 10-25% versus the industry average. It is also among the top five wealth management players, with 35 branches and about 4,000 staff in the consumer banking segment.","Kotak Mahindra declined to comment, while Axis Bank and SBI Cards did not respond to a request for comment.","The other markets Citi is exiting as part of its new CEO Jane Fraser's strategy include South Korea, Australia, mainland China and Thailand - countries where it does not have the necessary scale to compete with local rivals.","Singapore's DBS and OCBC, Britain's StanChart, and the Japanese lenders are also weighing bids for some of Citi's Southeast Asia businesses, the people said.","Citi's businesses in Australia and South Korea could attract interest from domestic banks, they added.",($1 = 1.3271 Singapore dollars)
6,https://www.reuters.com/article/us-citi-drury-moves/citi-taps-drury-to-lead-newly-launched-tech-comms-franchise-memo-idUSKBN2C629M,"April 19, 2021 5:33 PM UTC",Citi taps Drury to lead newly launched Tech & Comms franchise - memo,Citigroup (C.N) has tasked one of its most senior London-based bankers with leading its new technology and communications franchise as the sector benefits from a wave of deals triggered by digital disruption.,"British-born Philip Drury, who has been leading Citi's banking, capital markets and advisory business across Europe, the Middle East and Africa since 2018, will quit London to take on a new global role as Tech & Comms' head out of San Francisco.","Digital transformation has proved to be a key driver of dealmaking since the second half of 2020, with companies around the world using technology and data analytics to cope with the fallout of the coronavirus pandemic.","""Tech & Comms is one of the fastest growing franchises in global banking, capital markets and advisory and represents one of the greatest opportunities to close our competitive gap,"" said the memo, which was signed by the co-heads of Citi's banking, capital markets and advisory business globally, Tyler Dickson and Manuel Falco.",Drury joined Citi in 2000 as an equity capital markets banker based in New York and quickly rose through the ranks to lead the ECM coverage in the Americas in 2011.,"The Tech & Comms team, which includes three global heads of communications, Gordon Kroft, Dan Richards and Wilhelm Schulz, will support Citi's financial institutions group to make a joint push on fintech advisory.","Drury will remain in charge of the banking, capital markets and advisory (BCMA) business until a successor is found.",Citi also announced that BCMA's vice chairman Mark Hantho will become chairman of the Tech & Comms unit.,
7,https://www.reuters.com/article/citi-drury-moves/citi-taps-drury-to-lead-newly-launched-tech-comms-franchise-memo-idUSL1N2MC1PA,"April 19, 2021 5:33 PM UTC",Citi taps Drury to lead newly launched Tech & Comms franchise - memo,Citigroup (C.N) has tasked one of its most senior London-based bankers with leading its new technology and communications franchise as the sector benefits from a wave of deals triggered by digital disruption.,"British-born Philip Drury, who has been leading Citi's banking, capital markets and advisory business across Europe, the Middle East and Africa since 2018, will quit London to take on a new global role as Tech & Comms' head out of San Francisco.","Digital transformation has proved to be a key driver of dealmaking since the second half of 2020, with companies around the world using technology and data analytics to cope with the fallout of the coronavirus pandemic.","""Tech & Comms is one of the fastest growing franchises in global banking, capital markets and advisory and represents one of the greatest opportunities to close our competitive gap,"" said the memo, which was signed by the co-heads of Citi's banking, capital markets and advisory business globally, Tyler Dickson and Manuel Falco.",Drury joined Citi in 2000 as an equity capital markets banker based in New York and quickly rose through the ranks to lead the ECM coverage in the Americas in 2011.,"The Tech & Comms team, which includes three global heads of communications, Gordon Kroft, Dan Richards and Wilhelm Schulz, will support Citi's financial institutions group to make a joint push on fintech advisory.","Drury will remain in charge of the banking, capital markets and advisory (BCMA) business until a successor is found.",Citi also announced that BCMA's vice chairman Mark Hantho will become chairman of the Tech & Comms unit.,
8,https://www.reuters.com/article/us-citigroup-china-investment-bank/citigroup-to-ramp-up-chinese-investment-banking-plan-source-idUSKBN2C6138,"April 19, 2021 10:26 AM UTC",Citigroup to ramp up Chinese investment banking plan - source,"Citigroup (C.N) plans to expand its investment banking business in China and will soon apply to set up local underwriting, sales and trading and futures trading businesses by the end of June, a person with direct knowledge of the matter told Reuters.","The move comes after the U.S. bank revealed last week it would sell its retail banking assets in 13 markets, including mainland China.","Citigroup's applications to regulators are being finalised and should be officially lodged shortly, the source said.","The expanded investment banking unit could employ about 100 people, consisting of existing employees and new hires, by the time it is operational, the person added.","When contacted, a Citigroup spokesman declined to comment.","Citigroup's move reflects ""the broad trend of China's opening up, and local brokerages are fully prepared for the foreign competition,"" said Zhu Feifei, analyst at Huafu Securities Co.","Zhu said that China represented a huge potential market for foreign players, but it would take time for them to win market share.","A local underwriting licence would allow Citigroup to participate in the fast-growing mainland Chinese IPO market, especially the STAR Board, which is dominated by local institutions.","There were $8.9 billion worth of IPOs on the main Shanghai Stock Exchange board, STAR Market and Shenzhen ChiNext in the first quarter of 2021, according to Refinitiv data.","Regulatory rules require lead underwriters for STAR IPOs to buy 2% to 5% of stock on sale and hold it for two years. This requirement has discouraged foreign institutions, as it ties up capital, leaving the market to be dominated by major Chinese banks.","Citigroup sold its stake in its Chinese joint venture with Orient Securities in 2019, paving the way for the U.S. bank to launch its own investment bank, as China opened up its brokerage sector.",The bank was given a domestic custody licence last year and already has licences to settle and underwrite bonds in mainland China.,
9,https://www.reuters.com/article/us-citi-hong-kong/citi-on-hong-kong-hiring-spree-in-effort-to-triple-client-numbers-idUSKBN2C317P,"April 16, 2021 3:38 PM UTC",Citi on Hong Kong hiring spree in effort to triple client numbers,"Citigroup Inc (C.N) will hire 300 new relationship managers in Hong Kong and plans to triple client numbers and double assets under management in its wealth management business in the Asian financial hub, it said on Friday.","The announcement comes a day after the U.S. bank said it would withdraw from consumer banking in 13 markets in Asia and Europe, including Australia, mainland China, Korea and Thailand. The group plans instead to focus its east Asian consumer banking business on the ""wealth centres"" of Hong Kong and Singapore.","Many large global banks are looking to provide more services to wealthy clients in Asia, both the newly affluent and the super rich.","HSBC's (HSBA.L) latest strategy, for example, has a focus on wealth management in Asia. read more","“Hong Kong customers increasingly require portfolio advice, design and allocation geared toward diversification of asset types and geographic exposures ... we are fully committed to serving these needs,” Lawrence Lam, Chief Executive and Consumer Business Manager for Citibank Hong Kong, said in the statement."
10,https://www.reuters.com/article/us-global-finance-breakingviews/capital-calls-india-shines-in-citis-consumer-bank-selloff-idUSKBN2C3159,"April 16, 2021 9:57 AM UTC",Capital Calls: India shines in Citi’s consumer bank selloff,Concise insights on global finance in the Covid-19 era.,,------------------------------------------------,"SHINING BRIGHT. Citigroup’s (C.N) consumer banking business in India may be the most valuable of the 13 markets boss Jane Fraser has ordered the U.S. bank to retreat from read more . Unlike in China, in India a sale offers rivals a juicy chance to bulk up.","Conservatism has cost Citi. Its Indian wealth management business is large, but its share of credit cards has fallen to 4% from more than 10% over a decade as the market has rapidly expanded. Its customers spend more than average, however.","Focusing on the affluent has kept books clean. Citi could add more than one-quarter of loans to the retail portfolio of $47 billion Kotak Mahindra Bank (KTKM.NS), Credit Suisse notes. Singapore’s DBS (DBSM.SI), led by an ex-Citi banker, is in expansion mode too and may also be keen.","Citi’s consumer bank, which generated about $730 million of revenue in the year to March 2020, could expect a premium valuation; analysts privately guess it could fetch between $3 billion and $5 billion. Rivals SBI Cards and Payment Services (SBIC.NS) and IIFL Wealth Management (IIFW.NS) trade on 10 and 4 times expected book value. India is a prime morsel. (By Una Galani)",,On Twitter http://twitter.com/breakingviews,,Earlier in Capital Calls:,,Vietnam airline reaches for the moon via U.S. read more,Delta flies cash-flow positive read more,L'Oreal’s cash pile is a nice problem to have read more,"BlackRock, the anti-Coinbase read more",Elliott’s GSK punt looks well timed read more,
11,https://www.reuters.com/article/us-australia-banks/australias-nab-fields-questions-over-potential-purchase-of-citis-local-consumer-unit-idUSKBN2C30BM,"April 16, 2021 3:40 AM UTC",Australia's NAB fields questions over potential purchase of Citi's local consumer unit,"National Australia Bank (NAB.AX) (NAB) on Friday declined to rule out buying the local consumer finance and credit card operations of Citigroup Inc (C.N), which unveiled plans to exit some businesses in Asia and Europe overnight.","Citi, the fifth-largest provider of credit cards in Australia behind NAB and the country's other three major lenders, on Thursday said it would exit retail banking in Australia, Korea and 11 other markets across Asia and Europe. read more","Facing questions at a parliamentary committee about the high concentration of Australia's banking system and whether NAB would be interested in a deal with Citi, NAB Chief Executive Officer Ross McEwan declined to rule out or comment on any specific transaction.","""Our strategy today is to grow through our own activities but you know, every business, be it a bank or anybody else would look at areas that might add to the customer services and make it more efficient,"" he said.","The questioning follows NAB's agreement in January to purchase Australia's largest digital-only retail lender, 86 400, for A$220 million ($170.1 million).","NAB is Australia's third-largest lender by assets, putting it among the so-called Big Four banks that dominate most commercial banking products including home loans, credit cards and business finance.","NAB, Commonwealth Bank (CBA.AX), Westpac Banking Corp (WBC.AX) and Australia and New Zealand Banking Group (ANZ.AX) account for over 75% of the county's A$2.85 trillion in banking assets, official data shows.","Accounting for 3.5% of its global consumer finance business, Citi had $9.3 billion in loans in Australia, a figure that had shrunk 12% in the past year, it said on Thursday.","The U.S. lender had already received approaches from a number of unnamed parties to buy the Australian unit, which operates credit cards, mortgages, and wealth management, Citi said.",,,($1 = 1.2942 Australian dollars),,
