12,https://www.reuters.com/article/us-citigroup-results/citigroup-profit-jumps-plans-asia-and-emea-exits-as-fraser-makes-her-mark-idUSKBN2C21L4,"April 15, 2021 5:31 PM UTC","Citigroup profit jumps, plans Asia and EMEA exits as Fraser makes her mark","Citigroup Inc (C.N) trounced first-quarter profit expectations, thanks to a rebound in the broader economy and a jump in investment banking activity, and said it will exit some overseas businesses as new chief executive Jane Fraser starts to make her mark on the country's third-largest lender.","The bank reported $7.94 billion in profit, triple the $2.54 billion it made a year earlier, as it released funds set aside to cover pandemic loan losses and cashed in on a boom in listed shell company deals which has boosted underwriting income across Wall Street.",Citigroup's share price was broadly flat in afternoon trading.,"""Our first impression is the incoming CEO Jane Fraser is striking the right cord on messaging a sense of urgency to undertake strategic changes that enhance the profitability profile,"" UBS analyst Saul Martinez wrote in a note.","Fraser, who took over from Michael Corbat on March 1, is trying to bring Citigroup -- an industry laggard hobbled by creaky technology and poor risk-management controls -- in line with the profitability and share price performance of its peers.","Over the past decade, Citigroup's share price return has paled in comparison to that of JPMorgan Chase & Co (JPM.N) and Bank of America Corp (BAC.N), while its ongoing operational problems have got it into hot water with its regulators.","As part of Fraser's turnaround strategy, the bank is exiting consumer businesses in 13 Asia and EMEAmarkets, including Australia, China and India where it does not have the necessary scale to compete, said Fraser.","""We believe our capital, investment dollars and other resources are better deployed against higher returning opportunities in wealth management and our institutional businesses in Asia,"" she said in a statement.","The consumer bank will still operate ""wealth centers"" in Singapore and Hong Kong, as well as London and the United Arab Emirates, and its Institutional Clients Group, which includes capital markets, commercial banking and private banking, will be unaffected, the bank said.","It provided no timeframe for the exits but Fraser, who grew up in Scotland, told analysts there would be ""no dilly-dallying"" on executing the changes.","Efforts to fix risk controls and operational issues pushed expenses up 4%, in line with the company's projections.","Like its peers, Citigroup's bottom line was buoyed by a broader economic recovery thanks to vaccine rollouts, which have allowed Americans to get back to work, and $1.9 trillion in stimulus. As a result, Citigroup released $3.85 billion in loan loss reserves.","Also in line with Wall Street peers, Citigroup's investment banking revenue surged 46% on stronger equity underwriting fees. The bank has been a leader in raising money for the so-called special purpose acquisition, or SPAC, company frenzy, which has seen $100 billion worth of U.S. deals this year alone.","But Chief Financial Officer Mark Mason told reporters on Thursday that he doubts the record-breaking activity will last. ""We expect to see a decline in SPACs in line with broader equity underwriting activity as interest rates push investors towards surer returns,"" Mason added.",,REVENUES DOWN,"The bank also felt the impact of ultra-low interest rates and cash-flush consumers using debit cards for more purchases and paying off loans. That helped push total revenues down7% to $19.3 billion, while its pre-provision profit - seen as a better gauge of bank performance this quarter - was down 18% on last year.","Much of that was driven by an 18% decline in credit card revenue, even as overall credit card sales grew %1. Net interest revenue, the difference between interest the bank earns and what it pays on deposits and borrowings, was down 12% from a year earlier at $10.17 billion.","Markets and securities revenue for Citigroup rose 2%, compared with an exceptionally strong quarter a year earlier.","""As elsewhere, trading and banking were a bit stronger than expected and net interest income a bit weaker but it was basically all pretty close to expectations,"" wrote Oppenheimer analyst Chris Kotowski.",
13,https://www.reuters.com/article/us-citigroup-revlon-lawsuit/citigroup-lawyer-says-another-bank-made-bigger-payment-error-than-revlon-idUSKBN2AV1WS,"April 9, 2021 9:32 PM UTC",Citigroup lawyer says another bank made bigger payment error than Revlon,A lawyer for Citigroup Inc (C.N) told a U.S. judge on Friday he was aware of another large bank that recently made a bigger payment error than Citigroup made last August when it sent $894 million of its own money to Revlon Inc (REV.N) lenders.,"Neal Katyal, the lawyer, made the disclosure at a hearing in Manhattan federal court, where Citigroup urged U.S. District Judge Jesse Furman to extend a freeze on $504 million that it has been unable to recoup from the Revlon lenders.","Katyal did not identify the bank, the size of the payment error, or whether the error was fixed.","Citigroup is appealing Furman's Feb. 16 decision that 10 asset managers, whose clients include Revlon lenders, could keep its mistaken payments.","Furman accepted the asset managers' argument that Citigroup, as Revlon's loan agent, paid what they were owed, and they had no reason to think a sophisticated bank would blunder so badly.","Citigroup has said the lenders received a ""windfall,"" and Furman's decision could steer banks away from doing wire transfers in a ""finders, keepers"" marketplace.",Katyal is a partner at Hogan Lovells and former Acting U.S. Solicitor General. Citigroup hired him for its appeal.,
14,https://www.reuters.com/article/us-citigroup-esg/citi-adds-esg-scores-to-data-platform-for-climate-conscious-investors-idUSKBN2BV14Q,2021-04-08T09:08:12Z,Citi adds ESG scores to data platform for climate-conscious investors,"(Reuters) - Citigroup has added environmental, social and governance (ESG) scores to its securities services data platform for clients to track the sustainability exposure of their portfolio holdings, the U.S.-based banking group said on Thursday.","For the Citi Velocity Clarity platform, the lender said it analyzes “multiple sustainability measures” provided on a daily basis by the ESG insight company Arabesque S-Ray, and will work with clients to include more data from other providers.","“The ability to understand ESG exposure has become imperative across the entire industry as investors, advisors and regulators are increasingly asking for transparency from asset managers and asset owners,” said Fiona Horsewill, global head of data for Citi securities services.","Along with growing investor concerns over climate change, Citi has introduced several measures in its green push, including plans last month to merge three of its investment banking groups into one."
15,https://www.reuters.com/article/us-bytedance-india-tax/india-court-says-bytedance-must-deposit-11-million-in-tax-evasion-case-idUSKBN2BT16K,2021-04-06T14:24:23Z,India court says ByteDance must deposit $11 million in tax evasion case,"MUMBAI (Reuters) - An Indian court on Tuesday said China’s ByteDance must deposit around $11 million that authorities believe the company owes in an alleged case of tax evasion, a decision the government said bars the firm from using existing bank funds for other purposes.",An Indian tax intelligence agency in mid-March ordered HSBC and Citibank in Mumbai to freeze accounts of ByteDance India as it investigated some of the firm’s financial dealings. ByteDance challenged the move in court saying the freeze amounted to harassment and was done illegally.,"ByteDance, owner of the TikTok video app, has said in court it does not owe the tax government is demanding and does not agree with the tax authority’s decision to freeze its accounts.","After a government counsel said ByteDance owed the authorities about 790 million rupees ($11 million), the High Court in Mumbai said the company will need to keep that amount blocked in a state-run bank.","That amount will be frozen, the two-judge bench said.","However, the four blocked bank accounts of ByteDance held only $10 million in funds, according to its court filing.","A counsel for the federal tax authority, Jitendra Mishra, told Reuters ByteDance can use the $10 million for making the court mandated deposit, but cannot use it for any other activity. Effectively, Mishra said, the accounts remain frozen until the amount is moved to the state-run bank.","ByteDance in a statement said the court had agreed with the company that its accounts “should be unblocked” and that will allow it to continue operations. “We are prepared to take further steps required by the court and are confident in our position on this tax matter,” it said.",ByteDance did not comment on government counsel Mishra’s statement and it is unclear how the company will deposit the amount ordered by court while also funding operations.,"ByteDance in January reduced its Indian workforce after New Delhi maintained a ban on video app TikTok, imposed last year after a border clash between India and China. Beijing has repeatedly criticised India over that ban and those of other Chinese apps.","The company has told the court it still has an Indian workforce of 1,335, including outsourced personnel, which includes 800 people working in its “trust and safety” team that supports activities like content moderation overseas.","In the tax probe, which started in July 2020, India’s tax authority told ByteDance it had reasons to believe the company suppressed certain transactions and claimed excessive tax credits, Reuters has previously reported."
16,https://www.reuters.com/article/us-usa-georgia-voting-companies-analysis/analysis-millennials-and-global-consumers-push-u-s-companies-to-get-political-idUSKBN2BP0N1,2021-04-02T10:44:37Z,Analysis: Millennials and global consumers push U.S. companies to get political,"BOSTON/NEW YORK (Reuters) - A push to attract young and diverse talent and global consumers is behind some of corporate America’s willingness to speak out on politically charged issues like Georgia’s new voting law, executives and corporate governance experts said.","Georgia’s decision last month to strengthen identification requirements for absentee ballots and make it a misdemeanor to offer food and water to voters waiting in line, among other changes, drew condemnation from many U.S. companies this week, including Microsoft Corp and Citigroup.","A number of companies say it disenfranchises some voters. Some, such as Delta Air Lines and Coca-Cola Co., are based in Georgia, where state lawmakers have the power to raise state taxes. Delta CEO Ed Bastian said in a public memo that his decision to speak out was informed by discussions with leaders and employees in the Black community.","The companies criticizing the law so far represent a sliver of the U.S. business landscape. Yet they are part of a growing group of companies shedding their reluctance to speak out on politically controversial social issues that matter to many of their employees and customers globally, business leaders interviewed by Reuters said.","“Young people want more than words, they want action,” Debra Lee, the former chair and CEO of BET Networks, a TV network owned by ViacomCBS Inc, said in an interview on Thursday. ViacomCBS has also criticized the Georgia law.","A new focus from investors on environmental, social and governance issues such as climate change and the Black Lives Matter and #MeToo movements has also emboldened companies.","Recent examples range from companies criticizing former President Donald Trump’s claims of election fraud, to Washington Redskins football stadium sponsor Fedex Corp asking for a team name change. Retailers Walmart Inc and Dick’s Sporting Goods Inc, for example, have adopted new restrictions on gun sales following mass shootings.","Some companies that are reluctant to criticize specific laws or policies are still willing to come out with more general statements. For example, roughly 330 of the 500 companies in the S&P 500 Index issued comments last year in support of social justice in the wake of the death of George Floyd, a Black man, in the custody of Minneapolis police, according to shareholder advocacy group As You Sow.","This approach, however, does not always appease activists looking for bigger change. Olivia Knight, the group’s racial justice initiative coordinator, said companies often did not follow up with any action, and that many were limited to vague statements of support.","“I don’t think we can make the assumption the corporate world is a pot of social justice advocacy and should be looked to for guidance on these issues,” she said.","On Thursday, Reuters reported that Ford Motor Co’s political action committee is resuming making political donations. It said it will not rule out making donations to Republican lawmakers who voted against President Joe Biden’s election certification on Jan. 6. Former American Express Co CEO Ken Chenault, who co-authored a letter with other Black business leaders this week calling on companies to condemn the Georgia voting law, said in an interview that some firms may be hesitant to speak out for fear of appearing partisan.","But he noted that more than 60 big U.S. companies recently signed a statement opposing state bills focused on sexual orientation, showing a willingness to weigh in at least on some topics. In the battle on voting bills, “we are in the early stages,” Chenault said.","Speaking out against politically sensitive issues can be risky. Shares of some western apparel companies declined after they faced boycotts in China over their statements expressing concern about labor conditions, amid investor worries they would lose access to a vast, growing market. However, companies that spoke out against the Georgia voting law saw little impact on their share price.","Shivaram Rajgopal, a Columbia Business School professor who follows corporate cultural issues, said corporate America is focused on satisfying its skilled young workers, who are getting more politically active on social media.","“The younger workforce expects you to take a stand on these social justice issues,” Rajgopol said.","A 2019 study by the Pew Research Center found members of the U.S. generations known as Millennials, born between 1981 and 1996, and Gen Z, born after 1996, share more liberal attitudes than older generations on a range of issues, such as favoring more racial diversity and activist government.","“If we are not speaking up against these voter suppression efforts, we’re really taking a chunk out of ourselves and who we are as aviation,” said Sara Nelson, president of the Association of Flight Attendants, speaking at a U.S. aviation summit on Wednesday.","The views of global customers and investors also matter more to international conglomerates like Coke and Delta than local politics, said Ric Marshall, executive director at sustainability ratings firm MSCI.","“Management at these companies is much more beholden to this broader stakeholder group,” Marshall said. Conversely, companies that have said less about voting rights could be wary of alienating a more domestic customer base, he said."
17,https://www.reuters.com/article/us-citigroup-esg/citigroup-announces-new-investment-banking-unit-in-green-push-idUSKBN2BL28M,2021-03-29T15:51:28Z,Citigroup announces new investment banking unit in green push,"(Reuters) - Citigroup Inc said it will consolidate three of its investment banking groups into one in a push for environmental sustainability, an area that has become critical for investors.","The new unit, to be called the Natural Resources and Clean Energy Transition Group, will be headed by Steve Trauber and Sandip Sen, according to a memo seen by Reuters on Monday.","The unit will include the chemicals, energy and power franchises, showed the memo from Tyler Dickson and Manuel Falcó, co-heads at Citi’s Banking, Capital Markets and Advisory business.","Trauber will oversee the unit’s investment banking front, while Sen will be in charge of corporate banking, the memo said.","In a blog post on March 1, Citigroup's Chief Executive Officer Jane Fraser announced the bank's commitment to achieve net zero greenhouse gas emissions by 2050. (citi.us/3foQuVx)","The COVID-19 pandemic has caused a surge in interest in companies that perform well on environmental, social and governance (ESG) targets.",Other top-tier institutional firms such as Mastercard Inc and HSBC have also committed to net zero emissions by 2050.,"Last year, Citi launched a new business unit within its corporate and investment bank dedicated to ESG goals."
18,https://www.reuters.com/article/us-goldman-sachs-moves-hogan/citi-hires-goldmans-chief-diversity-officer-idUSKBN2BI1YU,2021-03-26T16:25:06Z,Citi hires Goldman's chief diversity officer,"NEW YORK (Reuters) - Citi Group said on Friday that it hired Erika Irish Brown from rival Goldman Sachs Group Inc to lead its global diversity strategy, according to an announcement on the bank’s website.","Brown joins Citi as its chief diversity, equity and inclusion officer from Goldman Sachs, where she had led that bank’s diversity and inclusion efforts since mid-2018. Brown previously worked at Bloomberg in the same role.","Goldman named Megan Hogan to replace Brown, according to a memo sent to staff and seen by Reuters.",The role of chief diversity officer has taken on renewed prominence as corporations work to address inequality and systemic racism roughly one year after George Floyd’s death in Minnesota.,"Wall Street banks have taken steps to increase recruitment, hiring and retention of diverse employees in recent years, but diverse and female employees still comprise a small percentage of the workforce.","Under Brown, Goldman set a goal that 11% of all new analysts and entry-level associates hired in the United States and 9% hired in the U.K. be Black professionals, for 14% to be Latino professionals and half to be women.","And last summer, Goldman’s investment bank formed the Council for Advancement of Racial Equity to increase recruitment, hiring and career development for Black professionals.","Hogan, who joined Goldman in 2014, also played a key role in the development and implementation of some of those initiatives and others, according to a memo sent by Goldman’s head of human resources Bentley de Beyer on Friday announcing her hire.","Hogan will continue in her job as chief operating officer of Goldman’s internal Global Inclusion and Diversity Committee, de Beyer wrote."
19,https://www.reuters.com/article/goldman-sachs-moves-hogan/update-1-citi-hires-goldmans-chief-diversity-officer-idUSL1N2LO1DZ,"March 26, 2021 9:05 PM UTC",UPDATE 1-Citi hires Goldman's chief diversity officer,"Citi Group (C.N)has hired Erika Irish Brown from rival Goldman Sachs Group Inc (GS.N) to lead its global diversity strategy, the bank said on its website on Friday.","Brown joins Citi as its chief diversity, equity and inclusion officer after leading similar efforts at Goldman Sachs since mid-2018. Brown previously worked at Bloomberg in the same role.","Goldman named Megan Hogan to replace Brown, according to a staff memo seen by Reuters.",The role of chief diversity officer has taken on renewed prominence as corporations work to address inequality and systemic racism roughly one year after George Floyd's death in Minnesota.,"Wall Street banks have taken steps to increase recruitment, hiring and retention of diverse employees in recent years, but non-whites and females still comprise a small percentage of the workforce.","Under Brown, Goldman committed to ensuring that 11% of all new analysts and entry-level associates hired in the United States and9% in the UK will be Black professionals, 14% will be Latino and half will be women.","The bank also committed to seeing that 40% of its Americas vice presidents will be women, 7% will be Black and 9% Latino by 2025.","Goldman is working to double the analysts it recruits on campuses of historically Black colleges and universities by 2025, and it launched a paid internship program for candidates who identify as neurodiverse.","Hogan, who joined Goldman in 2014, played a key role in the development and implementation of those initiatives, according to the Goldman memo sent by its head of human resources Bentley de Beyer on Friday.",,
20,https://www.reuters.com/article/us-health-coronavirus-citi/zoom-to-zen-citi-unveils-zoom-free-fridays-to-beat-remote-working-stress-idUSKBN2BF1XA,2021-03-23T14:21:28Z,Zoom to zen - Citi unveils Zoom-free Fridays to beat remote working stress,"(Reuters) - In a move to combat fatigue triggered by remote working during the COVID-19 pandemic, Citigroup Inc has declared “Zoom-Free Fridays” and encouraged employees to limit calls outside work hours.","While Wall Street is known for its tough work culture, the remote working during the pandemic has been particularly gruelling for most employees, taking enormous toll on their health and mental wellbeing.","“I know from your feedback and my own experience, the blurring of lines between home and work and the relentlessness of the pandemic workday have taken a toll on our well-being,” Chief Executive Officer Jane Fraser said in a memo seen by Reuters on Tuesday. “It’s simply not sustainable.”","Any internal meetings on Fridays would happen as audio-only calls, according to the memo. The CEO also encouraged employees to take their vacations, while the company announced a firm-wide holiday on May 28.","Citigroup also said that post-pandemic, a majority of the roles at the bank would be designated as “Hybrid”, allowing employees to work from the office at least three days a week and from home for up to two days a week.","Last week, an internal survey at Goldman Sachs circulated online showed junior bankers were working an average of 95 hours a week.","On Monday, Goldman Sachs CEO announced a number of measures the bank would take to address these concerns, including shifting bankers from other divisions to the busiest teams in the investment bank and hiring more junior bankers."
21,https://www.reuters.com/article/lawyers-crypto-currency/law-firms-weigh-cryptocurrency-payment-risks-as-prices-rise-idUSL1N2LB007,2021-03-13T00:08:14Z,Law firms weigh cryptocurrency payment risks as prices rise,"Cryptocurrency prices have soared in 2021, with bitcoin hitting a market capitalization of $1 trillion and Citigroup saying the digital tokens could become the preferred currency for international trade. But lawyers, for the most part, aren’t cashing in.","While some firms like Quinn Emanuel Urquhart & Sullivan do accept cryptocurrency, the volatile market - and the complications it represents for law firm management - have kept most away. That means the payments remain a novelty in Big Law even as more and more firms launch digital currency and blockchain practices and court clients in the industry.","To read the full story on Westlaw Today, click here: bit.ly/3lcEt6j"
22,https://www.reuters.com/article/us-health-coronavirus/citigroup-offers-rapid-at-home-covid-19-tests-to-some-u-s-staff-idUSKBN2B21PU,2021-03-10T14:14:23Z,Citigroup offers rapid at-home COVID-19 tests to some U.S. staff,"(Reuters) - Citigroup Inc has offered rapid at-home COVID-19 testing to some employees that have continued to work at its U.S. branches and offices through the pandemic as they were unable perform their roles remotely, the bank said in a blog post on Wednesday.","The at-home COVID-19 testing program uses a rapid antigen test, which offers results within 20 minutes, the bank said, adding the test is awaiting emergency use approval from the U.S. Food and Drug Administration.",Citi said it has offered employees at its Chicago area branches and those working on its trading floors in New York a chance to participate in the home testing program.,The bank said it would use the learnings from this initial pilot for its broader plans around at-home testing and future return to office strategy.,"The company intends to make at-home testing widely available to more employees in the coming months, it added."
23,https://www.reuters.com/article/us-citigroup-moves/citis-general-counsel-to-retire-memo-idUSKBN2B12JP,2021-03-09T19:48:17Z,Citi's general counsel to retire - memo,"(Reuters) - Citigroup Inc’s General Counsel Rohan Weerasinghe will retire from the bank after nearly a decade in the role, Chief Executive Officer Jane Fraser told staff on Tuesday, according to a memo seen by Reuters.","Weerasinghe will retire by the end of this year and Citi will consider both internal as well as external candidates for his replacement, the memo said.","“Rohan joined Citi in 2012, just as we were emerging from the financial crisis. He helped steer us through a difficult period of post-crisis litigation,” Fraser said.","In his time with the bank, Weerasinghe worked with Citi’s legal team, ethics office, and security and investigative services team.","Prior to joining the bank, Weerasinghe was a senior partner at New York-based global law firm Shearman & Sterling."
