57,https://www.reuters.com/article/us-citigroup-results/citigroups-corbat-faces-tense-analyst-questions-as-he-approaches-exit-idUSKBN26Y1MO,2020-10-13T20:51:04Z,Citigroup's Corbat faces tense analyst questions as he approaches exit,"(Reuters) - Citigroup Inc’s outgoing chief executive came under fire on Tuesday for mistakes that have led to regulatory penalties, with analysts questioning his pay and why he is not leaving immediately in a conference call to discuss quarterly results.","In unusually direct exchanges, analysts pressed Chief Executive Mike Corbat to explain what management is doing to fix technical and operational problems that have plagued Citigroup for years and led the bank to erroneously send $900 million of its own funds to Revlon creditors in August.","That blunder led to costly litigation between Citigroup and the recipients, as well as regulatory consent orders, a $400-million penalty and lots of embarrassment. Last month, Citigroup announced that Corbat would retire earlier than expected, to be replaced in February by Jane Fraser.","Several analysts asked why Corbat did not make more progress in overhauling creaky technology or generating better returns for shareholders during his tenure. They also criticized what they described as a lack of accountability, noting that executive compensation should be better tied to risk management and shareholder returns.",“Where is the sense of urgency?” Wells Fargo analyst Mike Mayo asked Corbat. “Why not step aside now?”,"Corbat described steps Citigroup is taking to repair issues identified by the Federal Reserve and Office of the Comptroller of the Currency, and defended the progress Citigroup has made since he took charge.","When asked how much the overhaul might ultimately cost, Chief Financial Officer Mark Mason said it would be “hard to pinpoint a number” beyond the $1 billion Citigroup is spending this year.",Citigroup shares closed 5% lower at $43.68 on Tuesday. The stock is down more than 45% so far this year while the KBW Bank Index has fallen 31%.,"Earlier in the day, Citigroup detailed a 34% decline in third-quarter profit as the coronavirus recession hurt its consumer bank.","Its net income of $3.2 billion, or $1.40 per share, still topped analyst expectations of 93 cents per share. But the results were weaker than crosstown rival JPMorgan Chase & Co, whose quarterly profit rose, and Citigroup’s management offered a bleaker outlook.","“We are expecting a somewhat more muted and slower recovery in both unemployment and GDP through 2022,” Mason said.","Citigroup added about $314 million to credit loss reserves in the quarter, compared to the $15 billion it had set aside in the first half of the year.","Revenue in North American branded cards, the growth engine for Citi’s consumer bank going into the year, fell 12% as its credit card customers closed accounts and spent less.","The bank, one of the largest credit card issuers globally, said end-of-period open accounts across its portfolio dropped by 4%, or more than 5 million, and purchase sales slid 10%.","Citi’s trading business was a bright spot, with a 16% jump in revenue helping to offset consumer weakness.","Fraser, who was not on the call, has said that overhauling risk management and internal controls will be her priority. Analysts will probably get a chance to engage with her on the next quarterly call, Corbat said. Regulators have curtailed Citigroup’s ability to make significant acquisitions until its operational issues are fixed. Similar problems caused Citigroup to fail or barely pass its annual stress tests in prior years.","Shareholders are concerned that the consent orders and $400 million fine are only the beginning of regulatory fallout for Citigroup, said Bank of America analyst Erika Najarian.","She likened the situation to scandal-plagued Wells Fargo & Co , which has faced a long series of fines, lawsuits and regulatory penalties since its phony-accounts scandal began unraveling in 2016.","Corbat said the two situations were not comparable because, unlike Wells Fargo, Citigroup did not dupe customers or seek to profit from the Revlon error. Instead, it lost money.","“No fraud, no customer harm, no benefit around that,” he said."
58,https://www.reuters.com/article/us-citigroup-valueact/valueacts-morfit-says-citigroup-positioned-for-growth-sees-higher-share-price-idUSKBN26T36R,2020-10-08T18:52:17Z,"ValueAct's Morfit says Citigroup positioned for growth, sees higher share price","BOSTON (Reuters) - ValueAct Capital Management, a long-time investor in Citigroup Inc, threw its weight behind the third largest U.S. bank in an unusually public way on Thursday by saying its share price could double in the near term.","“The upside is very compelling,” Mason Morfit, chief executive officer and chief investment officer of the $12 billion investment firm said at the 13D Monitor Investor Summit on Thursday. He said the bank is inexpensive now and well positioned for growth.",Citigroup stock has languished compared to its peers as the bank struggled for years to convince Wall Street that it could reliably hit its financial targets. Shares have fallen 44% so far this year while the KBW Bank index has fallen 30%.,Morfit spoke one day after U.S. banking regulators fined Citi $400 million and ordered it to repair its risk-management systems.,The government’s rebuke was largely seen to have accelerated Citi CEO Michael Corbat’s decision to retire early next year and hand the reins to Citi President Jane Fraser.,"Morfit supported Fraser’s appointment and said the firm, which has owned Citi shares since early 2018, was looking forward to working with her.","Citi’s institutional clients group is a star business, Morfit said, saying that it alone is worth at least $70 to $110 per share, which is double what the stock is trading today.",He forecast this part of the business can continue to grow earnings per share over the next decade.,"Citi’s stock price, currently trading at $44.91, could jump to $80 in the near term and rise more to hit $150 over time, he said.","Morfit called Citi an “irreplicable platform” and said it is well positioned for long-term growth because it is stable, safe and steadily taking share. As its core platform “chugs along,” Morfit said the payoff will come as the company’s return on tangible common equity can reach 15% to 16%.","ValueAct, which recently saw founder Jeff Ubben depart, is an activist investor that likes to work behind the scenes over years by advising senior management instead of waging noisy proxy fights. “We try to transform companies from underachievers to overachievers,” Morfit said, adding that ValueAct has in the past lost money on bets before they pay off big."
59,https://www.reuters.com/article/usa-citigroup-enforcement/citigroup-fined-by-u-s-regulators-for-longstanding-deficiencies-idUSL1N2GY1ZH,2020-10-07T20:30:00Z,Citigroup fined by U.S. regulators for 'longstanding deficiencies',"WASHINGTON, Oct 7 (Reuters) - A pair of U.S. bank regulators ordered Citigroup Inc to clean up “several longstanding deficiencies” in a new enforcement order against the bank.","The order, from the Federal Reserve and Office of the Comptroller of the Currency, say the bank must overhaul its firm-wide risk management and internal controls, adding the firm has not taken effective actions to identify issues previously raised by regulators. (Reporting by Pete Schroeder Editing by Chris Reese)"
60,https://www.reuters.com/article/citigroup-qanon/citigroup-terminates-manager-involved-in-running-qanon-website-idUSKBN26S07W,2020-10-07T02:34:59Z,Citigroup terminates manager involved in running QAnon website,(Reuters) - Citigroup Inc C.N said on Tuesday that it terminated a manager in its technology department following an investigation into his role as the operator of a popular website dedicated to the unfounded QAnon conspiracy theory.,Jason Gelinas had been placed on paid leave last month after he was identified as the operator of the website QMap.pub and its associated mobile apps by fact-checking site Logically.ai.,"“Mr. Gelinas is no longer employed by Citi. Our Code of Conduct includes specific policies that employees are required to adhere to, and when breaches are identified, the firm takes action,” the bank said in a statement.","QAnon followers espouse an intertwined series of beliefs, based on anonymous web postings from “Q”, who claims to have insider knowledge of the Trump administration.",QAnon has become a “big tent” conspiracy theory encompassing misinformation about topics ranging from alien landings to vaccine safety.,"A core tenet of the conspiracy theory is that U.S. President Donald Trump is secretly fighting a cabal of child-sex predators that includes prominent Democrats, Hollywood elites and “deep state” allies."
61,https://www.reuters.com/article/us-usa-fed-banks/u-s-fed-to-extend-curbs-on-big-bank-buy-backs-dividends-through-end-of-year-idUSKBN26L3OO,2020-09-30T20:54:56Z,"U.S. Fed to extend curbs on big bank buy backs, dividends through end of year","WASHINGTON (Reuters) - The U.S. Federal Reserve will curb big bank capital distributions through the end of the year, meaning the likes of JPMorgan Chase & CoJPN., Citigroup Inc.C.N, Wells Fargo & CoWFC.N and Bank of America Corp.BAC.Nwill be barred from share buy backs and will have to cap dividends.","The central bank announced it would extend its existing policy of limiting capital payouts for banks with at least $100 billion in assets, to ensure lenders have enough capital to weather the economic strain caused by the coronavirus pandemic.","The restrictions, which apply to 34 banks, including the U.S. operations of several large foreign firms, were extended “due to the continued economic uncertainty from the coronavirus response,” the Fed said.","The Fed announced in June it was taking the unprecedented step of limiting bank payouts after finding lenders faced significant capital losses under a pandemic-informed stress test. Under the new policy, banks cannot pay higher dividends than they did in the second quarter, and payments cannot exceed a firm’s average net income over the last four quarters.","Large banks will face a second pandemic Fed stress test later this year, with results to be announced by the end of 2020. The Fed found in its original stress test that lenders could endure as much as $700 billion in loan losses under a severe economic downturn caused by the outbreak.","Banks were expected to stay afloat amid those losses, but several skirted close to violating minimum capital levels required by regulators, the Fed said at the time."
62,https://www.reuters.com/article/us-cftc-citigroup/citigroup-is-fined-4-5-million-by-u-s-cftc-for-deleting-subpoenaed-audio-recordings-idUSKBN26J2NG,2020-09-28T17:43:35Z,Citigroup is fined $4.5 million by U.S. CFTC for deleting subpoenaed audio recordings,"NEW YORK (Reuters) - A U.S. regulator on Monday fined Citigroup Inc C.N $4.5 million for deleting millions of audio files, including recordings it had subpoenaed, after failing to fix a known design flaw in its audio preservation system.","The U.S. Commodity Futures Trading Commission said the Nov. 2018 deletion of 2.77 million audio files included recordings of traders subpoenaed in Dec. 2017 for a probe, which Citigroup had promised would be preserved.","Citigroup was accused of not following up on an employee’s warning in 2014 that the configuration of its audio preservation system might create a “ticking time bomb effect” that could, and did, cause mass deletions of audio files.","The civil fine was imposed against Citibank NA, Citigroup Energy Inc and Citigroup Global Markets Inc for the New York-based bank’s failure to maintain sufficient internal controls over its technology.",Citigroup did not admit or deny wrongdoing. A spokeswoman said the bank was pleased to settle.,"According to the CFTC, the deleted recordings comprised 683,296 calls for 982 individual users, including recordings covered by its subpoena, and 2,087,789 recordings from speakerbox or “Hoot n’ Holler” lines.",The case is the latest to highlight problems with technology systems at the third-largest U.S. bank by assets.,Citigroup is battling separately in Manhattan federal court to recoup $900 million of its own money that it accidentally paid to lenders for the cosmetics company Revlon Inc REV.N.,"Some hedge funds that lent money to Revlon and received payments from Citigroup have balked at repaying the bank, which blamed the incident on a clerical error."
63,https://www.reuters.com/article/us-citigroup-moves/citigroups-icg-unit-names-kira-cordoba-brown-as-head-of-talent-diversity-idUSKCN26F1TE,2020-09-24T11:23:04Z,Citigroup's ICG unit names Kira Cordoba-Brown as head of talent & diversity,(Reuters) - Citigroup Inc’s institutional clients group (ICG) unit named Kira Cordoba-Brown as the head of talent & diversity on Tuesday.,"She joined Citi in 2006, and has served in several roles in human resources in both ICG and global consumer segments within the global diversity office, campus recruitment and program management."
64,https://www.reuters.com/article/us-global-race-citigroup/citigroup-pledges-over-1-billion-to-combat-racial-inequality-idUSKCN26E28U,2020-09-24T11:10:01Z,Citigroup pledges over $1 billion to combat racial inequality,(Reuters) - Citigroup Inc said on Wednesday it would set aside more than $1 billion to support initiatives that help close the racial wealth gap and increase economic mobility for people of color.,"The Wall Street bank said the three-year initiative will include programs that would provide greater access to banking and credit in communities of color, increase investment in Black-owned businesses and expand homeownership among Black Americans.","“We are in the midst of a national reckoning on race and words are not enough,” said Chief Financial Officer Mark Mason. “We need awareness, education, and action that drive results.”",Mason is one of the industry’s most senior Black executives.,"Citi’s statement comes amid a broader re-think of racism in the United States in recent months, after police killings of Black Americans including George Floyd, who died on May 25 in Minneapolis.","Many U.S. companies have issued statements of solidarity with the Black community, promised to increase diversity among employees and collectively pledged nearly $2 billion to advance racial justice and equity.","In June, Bank Of America decided to pledge $1 billion to address economic and racial inequality. [nL4N2DF2NU]",Reuters reported on Tuesday Wells Fargo & Co Chief Executive Charles Scharf exasperated some Black employees in a Zoom meeting this summer when he reiterated the bank had trouble reaching diversity goals because there was not enough qualified minority talent. [nL2N2GJ1DW]
65,https://www.reuters.com/article/us-citigroup-retail-options/citi-closes-market-making-business-in-retail-options-ft-idUSKCN26E0MS,2020-09-23T05:10:43Z,Citi closes market making business in retail options: FT,"(Reuters) - Citigroup Inc C.N has closed its market making business in retail options that serves retail broker-dealers, the Financial Times reported on Wednesday, citing three people with knowledge of the decision.","The bank closed the business at the start of last month, the FT said, adding that Citi maintained its market making operations for institutional investors and high-net-worth customers.","Citi pulled out as it was unable to compete in a technology arms race to be among the fastest and most reliable venues on Wall Street, according to the report.",Citi did not immediately respond to a Reuters request for comment.
66,https://www.reuters.com/article/us-societe-generale-lyxor-m-a/societe-generale-gears-up-for-lyxor-asset-management-sale-sources-idUSKCN26B0NH,2020-09-20T15:19:29Z,Societe Generale gears up for Lyxor asset management sale - sources,"NEW YORK/LONDON (Reuters) - Societe Generale SOGN.PA is gearing up to launch the sale of its asset management arm Lyxor as the French lender seeks to shore up its finances after two consecutive quarterly losses, two sources familiar with the matter told Reuters.","France's third-biggest bank has hired Citigroup C.N to oversee the sale, which is expected to kick off in the fourth quarter, the sources said, speaking on condition of anonymity as the matter is confidential.",Societe Generale and Citi declined to comment.,"Lyxor had about 132 billion euros ($156 billion) of assets under management at the end of June, with exchanged-traded funds (ETF) representing almost half of its operations. It ranks as Europe’s third largest ETF provider.","The business could be valued at about $1 billion, one of the sources said, adding that interested parties have recently been contacted as the sale is about to kick off.","It will be aimed at bidders in Europe and United States, including French asset manager Amundi AMUN.PA and German rival DWS DWSG.DE, one of sources said, while cautioning that no deal was certain.","“It’s all been prepared and is ready to start, but the board has yet to sign it off,” the source said.",The unit posted a 21.6% decline in revenue to 40 million euros in the second quarter due to challenging market conditions and the fallout from the coronavirus crisis.,"Societe Generale’s boss Frederic Oudea is trying to strengthen the bank’s capital ratio and may also explore strategic options for its UK wealth management unit, Kleinwort Hambros, another source said.","As part of an asset disposal programme first launched in 2018, Societe Generale has parted ways with assets in Eastern Europe and last year agreed to sell its Nordics-based SG Finans division to Nordea Bank NDAFI.HE for 575 million euros.",The bank said it would sell or close business lines that have not reached critical mass or do not generate synergies.
67,https://www.reuters.com/article/us-jpmorgan-conference/jpmorgan-cuts-outlook-for-net-interest-income-on-lower-rates-idUSKBN2662M8,2020-09-15T17:10:24Z,JPMorgan cuts outlook for net interest income on lower rates,"NEW YORK (Reuters) - JPMorgan Chase & Co JPM.N expects about $55 billion in net interest income for full-year 2020, down from an earlier estimate of $56 billion, Chief Financial Officer Jennifer Piepszak said on Tuesday.","Piepszak, at a virtual conference hosted by Barclays, also said the current trend points to 2021 net interest income of about $13 billion per quarter.","JPMorgan’s third-quarter trading revenue will be up about 20% from a year earlier, Piepszak said.","Citigroup Inc C.N expects third-quarter markets revenue will be up by a ""low double-digit"" percentage from a year earlier, Chief Financial Officer Mark Mason said on Monday at the same conference.","JPMorgan does not expect to add a meaningful amount to its loan loss reserves after making large provisions at the end of the first and second quarters, she said.",Banks are earning less interest on loans while the Federal Reserve holds interest rates down to support the economy.,Trading revenue at the biggest banks has been one of the few bright spots in their results since the coronavirus outbreak.,Piepszak said the bank has reserved for worse loan losses than it would expect under its base case for the economy.,"“While things do look a little bit better than we thought they would, we’re still dealing with an enormous amount of uncertainty looking ahead,” she said.","“We would have to have confidence in the outlook before we would release reserves,” she said.",Piepszak added that slack loan demand is weighing on net interest income.,"Consumers are paying off more of their credit card charges and paying down home loans, she said. And, many businesses quickly paid back the money they had borrowed on revolving credit lines when the pandemic started.","“Loan growth, I think it is fair to say, will be challenged,” Piepszak said."
68,https://www.reuters.com/article/us-citigroup-conference/citi-to-boost-risk-and-control-investment-after-operational-error-cfo-idUSKBN26534C,2020-09-15T01:00:33Z,Citi to boost risk and control investment after operational error: CFO,(Reuters) - Citigroup Inc C.N Chief Financial Officer Mark Mason said on Monday the bank was accelerating investments in its risk and control functions following a high-profile $900 million operational error.,"The bank has planned $1 billion in incremental investments this year to shore up the bank’s infrastructure and improve risk management and compliance, Mason said at an investor conference.","For the third quarter, the bank expects to continue adding to its reserves for loan losses in light of a weaker economic outlook due to the ongoing coronavirus pandemic.","However, the build is likely to be significantly lower than in the first half of the year when the bank set aside over $7 billion a quarter for potential losses.","Overall, the bank forecasts quarterly revenue to decline in the high single digits compared to last year due to lower interest rates and a slowdown in investment banking and consumer activity.","Trading continued to be a bright spot, showing low double-digit growth for the quarter, Mason said."
69,https://www.reuters.com/article/us-citi-regulator/regulators-prepare-to-reprimand-citigroup-for-failing-to-improve-risk-systems-wsj-idUSKBN26537L,2020-09-14T23:08:57Z,Regulators prepare to reprimand Citigroup for failing to improve risk systems: WSJ,"(Reuters) - Federal regulators are preparing to reprimand Citigroup Inc C.N for failing to improve its risk-management systems, the Wall Street Journal reported on.wsj.com/3mvwLES on Monday.",The bank’s shares fell 3.3% after the news.,"The expected move from the Office of the Comptroller of the Currency and the Federal Reserve accelerated planning for Chief Executive Officer Michael Corbat’s retirement, although regulators did not ask for him to step down, the Journal said, citing people familiar with the matter.",Citigroup and Federal regulators did not immediately respond to Reuters requests for comment.,Citigroup earlier this month named consumer banking head Jane Fraser as its next chief executive. Fraser will take over from Corbat in February.
