1,https://www.reuters.com/article/us-kansas-city-m-a-ca-natl-rlwy/cascade-investment-says-fully-supports-talks-between-cn-rail-and-kansas-city-southern-idUSKBN2CF2HO,"April 28, 2021 6:24 PM UTC",Cascade Investment says 'fully supports' talks between CN Rail and Kansas City Southern,"Bill Gates' Cascade Investment said on Wednesday it ""fully supports"" the ongoing talks between Canadian National Railway (CNR.TO) and Kansas City Southern (KSU.N) over Canadian National's takeover bid for the U.S. railroad.","Canadian National made an unsolicited $33.7 billion offer for Kansas City Southern last week, topping Canadian Pacific's $25 billion bid.","""There is a clear path to completion as Canadian National has stated its commitment to address any reasonable regulatory requirements,"" said Charles Zehren, a spokesperson for Cascade Investment.","""Canadian National's cash and stock proposal also offers greater financial value and certainty to Kansas City Southern shareholders. Cascade looks forward to participating in the value a combination with KCS will create for all stakeholders.""","Cascade Investment held a 14.25% stake in Canadian National as of March 23. Kansas City Southern is still evaluating if Canadian National's offer could lead to a ""superior proposal.""",
2,https://www.reuters.com/article/ca-natl-rlwy-results/update-2-canadian-national-rail-raises-annual-forecast-on-economic-recovery-hopes-idUSL4N2MJ3TP,2021-04-26T22:48:33Z,UPDATE 2-Canadian National Rail raises annual forecast on economic recovery hopes,"(Adds CFO comment, estimates)","April 26 (Reuters) - Canadian National Railway on Monday raised its full-year forecasts for profit and volume growth, hoping that vaccine rollouts would accelerate an economic recovery and boost shipments for the country’s biggest railroad operator.","Its revenue and profit for the first quarter slightly missed estimates as the pandemic weighed down freight volumes of coal, petroleum and chemicals.","Low demand for consumer products, industrial goods and weak crude shipments hurt railroad operators last year, but vaccination programs and fiscal stimulus have fueled expectations of a recovery.","“We are encouraged about the economic recovery and the vaccine rollout, which is giving us strong confidence for the balance of the year,” Chief Financial Officer Ghislain Houle said on a post-earnings call.",Canadian National now expects double-digit adjusted EPS growth for 2021 and high single-digit volume growth. The company had previously forecast high single-digit EPS growth and volume growth in mid-single digits.,"Carload segments such as chemicals, forest products, metals, fuels and plastic are also expected to grow as industrial production picks up.","The results come as Canadian National and smaller rival Canadian Pacific race to take over U.S. railroad Kansas City Southern, eyeing control over a vast network of railways across North America.",Canadian National said a deal between it and Kansas City would enhance choices for shippers and customers.,"North America’s freight rail customers, from grain shippers to logistics companies, are pushing for Canadian Pacific to win the bidding war, eyeing stronger competition and swifter service.","Canadian National’s operating ratio, a closely watched measure of operating expenses as a percentage of revenue, improved to 62.5% from 65.7%. A lower operating ratio signals improved profitability.","On an adjusted basis, Canadian National earned C$1.23 per share, missing analysts’ average estimate of C$1.24, according to IBES data from Refinitiv.",Revenue of C$3.54 billion came below Wall Street’s estimate of $3.58 billion. (Reporting by Shreyasee Raj in Bengaluru; Editing by Devika Syamnath)
3,https://www.reuters.com/article/ca-natl-rlwy-results/canadian-national-posts-near-4-fall-in-profit-idUSL4N2MJ3SY,2021-04-26T20:10:25Z,Canadian National posts near 4% fall in profit,"April 26 (Reuters) - Canadian National Railway on Monday reported a 3.6% fall in quarterly profit, hit by lower automotive shipments.","Net income at Canada’s largest railroad operator rose to C$974 million ($785.67 million), or C$1.37 per share, in the first quarter ended March 31, from C$1.01 billion, or C$1.42 per share, a year earlier.",Revenue fell to C$3.54 billion from C$3.55 billion a year earlier.
4,https://www.reuters.com/article/canada-stocks/canada-stocks-tsx-opens-higher-as-tech-stocks-boost-idUSL4N2MJ34Q,2021-04-26T13:36:31Z,CANADA STOCKS-TSX opens higher as tech stocks boost,"April 26 (Reuters) - Canada’s main stock index opened higher on Monday, boosted by technology shares, as investors awaited a first-quarter earnings update from Canadian National Railway later in the day.","* At 9:32 a.m. ET (13:32 GMT), the Toronto Stock Exchange’s S&P/TSX composite index was up 17.76 points, or 0.09%, at 19,120.09. (Reporting by Devik Jain in Bengaluru; Editing by Amy Caren Daniel)"
5,https://www.reuters.com/article/us-kansas-city-southern-m-a-canadaian-pa/kansas-city-southern-says-it-will-talk-with-rival-bidder-cn-cp-welcomes-regulatory-ruling-idUSKBN2CB0D9,"April 24, 2021 11:23 PM UTC",Kansas City Southern says it will talk with rival bidder CN; CP welcomes regulatory ruling,"Canadian Pacific Railway (CP.TO) on Saturday welcomed a favorable regulatory decision related to its proposed merger with Kansas City Southern (KSU.N), on the same day that Kansas City said its board has determined that a competing offer from Canadian National Railway (CNR.TO) could be expected to lead to a “superior proposal.”","Kansas City Southern said the board made its determination unanimously and said it would open negotiations with Canadian National, although it remains ""bound by the terms of the CP merger agreement."" It noted that its board ""has not determined"" that the CN proposal ""in fact constitutes a Company Superior Proposal.""","Canadian Pacific’s $25 billion cash-and-stock offer, at the time the deal was announced in March, values Kansas City Southern at $275 per share.","Canadian National's rival cash-and-stock offer, made earlier this week, values Kansas City Southern at $325 a share.","Canadian Pacific on Saturday touted a ruling by the U.S. Surface Transportation Board, which oversees freight rail, that a waiver of stricter rules governing mergers granted to Kansas City Southern in 2001 would be applicable to a merger of Kansas City and Canadian Pacific.","The pre-2001 rule judges a proposed merger on whether it would adversely affect competition. Under the rule introduced in 2001, rail merger applicants must demonstrate that a proposed tie-up would be in the public interest. Kansas City Southern had been granted the waiver based on its small size.",The STB on Friday confirmed that the waiver it granted to Kansas City Southern in 2001 is applicable to the proposed friendly combination of the two companies.,Both companies expect the STB's review to be completed by the middle of 2022.,"According to the regulator, the merger would result in the smallest Class I railroad, based on U.S. operating revenues and also result in few overlapping routes.","Following Canadian National’s rival $33.7 billion offer for Kansas City Southern on Tuesday, CP said it would not raise its bid.",Canadian National Railway said in a statement on Saturday that it looked forward to engaging with Kansas City to finalize a merger agreement and that it welcomed the determination by Kansas City Southern's board.,"Canadian Pacific, in a response, said the Kansas City Southern board was simply meeting its obligations under the merger agreement with CP and fulfilling its ""fiduciary duty"" to its shareholders by assessing the Canadian National offer."
6,https://www.reuters.com/article/us-kansas-city-m-a-ca-natl-rlwy/canadian-national-confident-of-getting-regulatory-nod-for-kansas-city-southern-bid-idUSKBN2C91VR,2021-04-22T15:27:23Z,Canadian National confident of getting regulatory nod for Kansas City Southern bid,(Reuters) -Canadian National Railway Co said on Thursday it had informed Kansas City Southern’s board about its confidence in winning regulatory approvals for its $33.7 billion offer for the U.S. railroad.,"Canadian National made an unsolicited bid for the U.S. company on Tuesday, locking horns with Canadian Pacific Railway Ltd and topping the company’s $25 billion bid.",Canadian Pacific said on Wednesday it was not considering raising its offer as it did not want put its balance sheet at “risk”.,Analysts have said it now depends on which suitor Kansas City Southern wants to go with. Shares of Kansas City Southern were up marginally at $298.51 in morning trading.,"Canadian Pacific has no overlapping rail networks with Kansas City Southern, unlike Canadian National, making it easier for its deal to clear regulatory hurdles.","“We continue to think that what it will all come down to is how the Kansas City Southern board views the regulatory risk of the Canadian National’s proposal relative to the Canadian Pacific deal,” Credit Suisse analyst Allison Landry wrote in a note.","An outcome “could ultimately hinge on the shipper response to the U.S. Surface Transportation Board”, Landry said. The U.S. STB oversees freight rail service and rates."
7,https://www.reuters.com/article/kansas-city-ma-ca-natl-rlwy/canadian-national-confident-of-regulatory-approval-for-kansas-city-southern-bid-idUSL4N2MF3EX,2021-04-22T13:43:19Z,Canadian National confident of regulatory approval for Kansas City Southern bid,"April 22 (Reuters) - Canadian National Railway Co on Thursday sent a letter to Kansas City Southern’s board, saying the company is confident of winning regulatory approvals for its takeover offer of about $33.7 billion.","Canadian National submitted its bid for the U.S. company on Tuesday, rivaling an agreement Kansas City already had in place to be taken over for about $25 billion by Canadian Pacific Railway Ltd. (Reporting by Shariq Khan in Bengaluru; Editing by Anil D’Silva)"
8,https://www.reuters.com/article/us-kansas-city-m-a-ca-natl-rlwy/canadian-national-challenges-canadian-pacific-with-33-7-billion-kansas-city-bid-idUSKBN2C71BK,"April 20, 2021 9:27 PM UTC",Canadian National challenges Canadian Pacific with $33.7 billion Kansas City bid,"Canadian National (CNR.TO) said on Tuesday it had offered to buy Kansas City Southern (KSU.N) railroad for about $33.7 billion, sending shares of the U.S. company soaring as investors anticipated a bidding war with Canadian Pacific (CP.TO).","Canadian Pacific had agreed a deal to acquire Kansas City Southern for about $25 billion last month. Either combination would create a North American railway spanning the United States, Mexico and Canada as supply chains recover from pandemic-led disruptions.","The acquisition interest in Kansas City Southern also follows the ratification of the US-Mexico-Canada Agreement last year that removed the threat of trade tensions, which had escalated under former U.S. President Donald Trump.","Kansas City said it would evaluate Canadian National's offer. If it found it could lead to a better deal, Canadian Pacific will be given the opportunity to raise its bid.","Meanwhile, Canadian Pacific said Canadian National's cash-and-stock offer of $325 per share at a 26.8% premium to Kansas City Southern's share price at the end of Monday's trading, was ""illusory and inferior.""","The proposal was ""massively complex and likely to fail"" and it would reduce competition and negatively impact shippers, the company said.","""We are surprised by this move given the healthy valuation Canadian Pacific had already offered to Kansas City Southern shareholders,"" Stephens analyst Justin Long wrote in a client note.","Kansas City Southern shares closed up 15.3% to $295.5, indicating most investors deemed it unlikely the company would stick with Canadian Pacific's offer.","However, Chilton Investment Co, which has a less than 1% stake in the U.S. railroad, preferred a deal with Canadian Pacific, citing regulatory hurdles.","""There's more overlap with Canadian National deal which makes it harder to get (regulatory) approval. The Surface Transportation Board (STB) doesn't like overlap,"" Chilton CEO Richard Chilton said.","Canadian National CEO Jean-Jacques Ruest said the two companies have ""highly complementary networks with limited overlap."" They only run parallel for 65 miles, between Baton Rouge and New Orleans.","Kansas City Southern has domestic and international rail operations in North America, focused on the north-south freight corridor connecting markets in the central United States with industrial cities in Mexico. Calgary-based Canadian Pacific is Canada's No. 2 railroad operator, behind Canadian National.",The STB updated its merger regulations in 2001 to introduce a requirement that Class I railways have to show a deal is in the public interest.,"Yet it provided an exemption to Kansas City Southern given its small size, potentially limiting the scrutiny that its acquisition will be subjected to.","Canadian Pacific agreed in its talks with Kansas City Southern to bear most of the risk of the deal not going through. It will buy Kansas City Southern shares and place them in an independent voting trust, insulating the acquisition target from its control until the STB clears the deal.","Were the STB to reject the combination, Canadian Pacific would have to sell the shares of Kansas City Southern, but the current shareholders would keep their proceeds.","Canadian National said it was willing to match these terms. It said its offer does not require approval from its shareholders because of how much cash it has, eliminating a condition in Canadian Pacific's offer.","Canadian Pacific said its rival's proposal would create the third largest Class 1 railroad, while it would remain the smallest of the six U.S. Class 1 railroads by revenue.","Bill Gates' Cascade Investment, which is Canadian National's biggest investor with a 14.25% stake, said it supports the combination.",A private equity consortium led by Blackstone Group Inc and Global Infrastructure Partners made an unsuccessful offer last year to acquire Kansas City Southern.,"But it was Canadian Pacific's announcement of a deal with Kansas City Southern that spurred Canadian National into action, as it raised the prospect of losing out to its rival, according to people familiar with the matter.",
9,https://www.reuters.com/article/kansas-city-ma-ca-natl-rlwy/canadian-national-to-make-30-billion-bid-for-kansas-city-wsj-idUSL4N2MD2T5,"April 20, 2021 9:27 PM UTC",Canadian National to make $30 billion bid for Kansas City- WSJ,"Canadian National (CNR.TO) said on Tuesday it had offered to buy Kansas City Southern (KSU.N) railroad for about $33.7 billion, sending shares of the U.S. company soaring as investors anticipated a bidding war with Canadian Pacific (CP.TO).","Canadian Pacific had agreed a deal to acquire Kansas City Southern for about $25 billion last month. Either combination would create a North American railway spanning the United States, Mexico and Canada as supply chains recover from pandemic-led disruptions.","The acquisition interest in Kansas City Southern also follows the ratification of the US-Mexico-Canada Agreement last year that removed the threat of trade tensions, which had escalated under former U.S. President Donald Trump.","Kansas City said it would evaluate Canadian National's offer. If it found it could lead to a better deal, Canadian Pacific will be given the opportunity to raise its bid.","Meanwhile, Canadian Pacific said Canadian National's cash-and-stock offer of $325 per share at a 26.8% premium to Kansas City Southern's share price at the end of Monday's trading, was ""illusory and inferior.""","The proposal was ""massively complex and likely to fail"" and it would reduce competition and negatively impact shippers, the company said.","""We are surprised by this move given the healthy valuation Canadian Pacific had already offered to Kansas City Southern shareholders,"" Stephens analyst Justin Long wrote in a client note.","Kansas City Southern shares closed up 15.3% to $295.5, indicating most investors deemed it unlikely the company would stick with Canadian Pacific's offer.","However, Chilton Investment Co, which has a less than 1% stake in the U.S. railroad, preferred a deal with Canadian Pacific, citing regulatory hurdles.","""There's more overlap with Canadian National deal which makes it harder to get (regulatory) approval. The Surface Transportation Board (STB) doesn't like overlap,"" Chilton CEO Richard Chilton said.","Canadian National CEO Jean-Jacques Ruest said the two companies have ""highly complementary networks with limited overlap."" They only run parallel for 65 miles, between Baton Rouge and New Orleans.","Kansas City Southern has domestic and international rail operations in North America, focused on the north-south freight corridor connecting markets in the central United States with industrial cities in Mexico. Calgary-based Canadian Pacific is Canada's No. 2 railroad operator, behind Canadian National.",The STB updated its merger regulations in 2001 to introduce a requirement that Class I railways have to show a deal is in the public interest.,"Yet it provided an exemption to Kansas City Southern given its small size, potentially limiting the scrutiny that its acquisition will be subjected to.","Canadian Pacific agreed in its talks with Kansas City Southern to bear most of the risk of the deal not going through. It will buy Kansas City Southern shares and place them in an independent voting trust, insulating the acquisition target from its control until the STB clears the deal.","Were the STB to reject the combination, Canadian Pacific would have to sell the shares of Kansas City Southern, but the current shareholders would keep their proceeds.","Canadian National said it was willing to match these terms. It said its offer does not require approval from its shareholders because of how much cash it has, eliminating a condition in Canadian Pacific's offer.","Canadian Pacific said its rival's proposal would create the third largest Class 1 railroad, while it would remain the smallest of the six U.S. Class 1 railroads by revenue.","Bill Gates' Cascade Investment, which is Canadian National's biggest investor with a 14.25% stake, said it supports the combination.",A private equity consortium led by Blackstone Group Inc and Global Infrastructure Partners made an unsuccessful offer last year to acquire Kansas City Southern.,"But it was Canadian Pacific's announcement of a deal with Kansas City Southern that spurred Canadian National into action, as it raised the prospect of losing out to its rival, according to people familiar with the matter.",
10,https://www.reuters.com/article/us-ca-natl-rlwy-results/canadian-national-sees-high-single-digit-2021-eps-growth-beats-profit-idUSKBN29V2K6,2021-01-26T21:35:20Z,"Canadian National sees high single-digit 2021 EPS growth, beats profit",(Reuters) - Canadian National Railway Co said on Tuesday it aims to deliver high single-digit earnings per share growth in fiscal 2021 and beat quarterly profit as improvement in consumer spending drove volumes.,"COVID-19 mandated lockdowns impacted railroad volumes in the first half of 2020 due to low demand for consumer products and industrial goods. However, intermodal and grain shipment picked pace in the third quarter which, along with the return of consumer spending, boosted volumes in the later half of the year.","The company’s operating ratio, a closely watched measure of operating expenses as a percentage of revenue, fell to 61.4% from 66%. A higher ratio represents inefficiency.","On an adjusted basis, Canadian National earned C$1.43 per share, topping analysts’ average estimate of C$1.41, according to Refinitiv data","Revenue rose to C$3.66 billion from C$3.58 billion, a year earlier.","Analysts on average expect earnings of C$6.29 per share for full-year 2021, according to IBES data from Refinitiv.","Net income at the largest railroad operator in Canada rose to C$1.02 billion ($803.53 million), or C$1.43 per share, in the quarter ended Dec. 31, from C$873 million, or C$1.22 per share, a year earlier.",($1 = 1.2694 Canadian dollars)
11,https://www.reuters.com/article/ca-natl-rlwy-results/canadian-national-railway-quarterly-profit-rises-17-idUSL4N2K13TH,2021-01-26T21:13:08Z,Canadian National Railway quarterly profit rises 17%,Jan 26 (Reuters) - Canadian National Railway Co on Tuesday reported a 17% rise in quarterly profit as improvement in consumer spending drove volume momentum.,"Net income at the largest railroad operator in Canada rose to C$1.02 billion ($803.53 million), or C$1.43 per share, in the quarter ended Dec. 31, from C$873 million, or C$1.22 per share, a year earlier. ($1 = 1.2694 Canadian dollars) (Reporting by Shreyasee Raj in Bengaluru; Editing by Aditya Soni)"
12,https://www.reuters.com/article/us-canadian-national-railway-results/canadian-national-quarterly-profit-misses-estimates-idUSKBN2752RX,2020-10-20T20:32:39Z,Canadian National quarterly profit misses estimates,(Reuters) - Canadian National Railway Co CNR.TOCNI.N on Tuesday missed analysts' estimates for third-quarter profit on Tuesday due to lower crude shipment during the COVID-19 pandemic.,"Rail operators, which moved record-high Canadian oil volumes at the beginning of the year, witnessed a plunge in crude volumes as energy companies cut production in the face of falling demand due to coronavirus-driven lockdowns.","The company’s operating ratio, a closely watched measure of operating expenses as a percentage of revenue, rose to 59.9% from 57.9%.","However, grain and fertilizers carloads, the amount of freight loaded into cars during a specified period, rose 12% in the quarter as reduced shipment of crude and consumer goods has freed up railway space, boosting movement of grains.",Smaller rival Canadian Pacific Railway Ltd CP.TO earlier in the day missed Wall Street estimates as shipments declined during the pandemic.,"On an adjusted basis, Canadian National earned C$1.38 per share, missing analysts’ average estimates of C$1.46, according to IBES data from Refinitiv.","Net income fell to C$985 million ($750.36 million), or C$1.38 per share, in the quarter ended Sept. 30 from C$1.20 billion, or C$1.66 per share, a year earlier.",Revenue fell 11% to C$3.41 billion.,($1 = 1.3127 Canadian dollars)
13,https://www.reuters.com/article/canadian-national-railway-results/canadian-national-quarterly-profit-falls-17-6-idUSL4N2HB477,2020-10-20T20:08:45Z,Canadian National quarterly profit falls 17.6%,"Oct 20 (Reuters) - Canadian National Railway Co on Tuesday reported a 17.6% fall in quarterly profit, hit by lower crude shipments during the COVID-19 pandemic.","Net income fell to C$985 million ($750.36 million), or C$1.38 per share, in the quarter ended Sept. 30, from C$1.20 billion, or C$1.66 per share, a year earlier.",Revenue fell 11% to C$3.41 billion.
14,https://www.reuters.com/article/us-ca-natl-rlwy-results/canadian-national-profit-beats-estimates-on-cost-saving-moves-idUSKCN24M318,2020-07-21T22:43:58Z,Canadian National profit beats estimates on cost-saving moves,(Reuters) - Canadian National Railway Co CNR.TO on Tuesday reported a quarterly profit that edged past analysts' estimates as its cost-cutting moves helped it weather lower shipment volumes due to the COVID-19 pandemic.,"Canada’s largest railroad operator, which was betting on higher crude oil shipments due to congested pipelines earlier this year, saw its petroleum and chemical shipments slump 25% in the second quarter.","“We will be ready and prepared if there is a second (virus) wave”, Chief Executive Officer Jean-Jacques Ruest said on a call with analysts, adding the company will continue to increase capacity year-over-year.","The company’s operating expenses fell 15% from a year earlier, excluding certain items.","Canadian National reaffirmed its C$2.9 billion capital investment plan for 2020 and said it would acquire about 1,500 covered hopper cars to expand its grain export business for delivery starting next year.","The company’s adjusted operating ratio, a key metric for the Wall Street, rose to 60.4% from 57.5%.","Canadian National’s net income fell to C$545 million ($405.14 million) or 77 Canadian cents per share, in the quarter, from C$1.36 billion, or C$1.88 per share, a year earlier.","On an adjusted basis, the company earned C$1.28 per share, beating analysts’ estimate of C$1.26, according to IBES data from Refinitiv.","Revenue declined nearly 19% to C$3.21 billion, and was below expectations of C$3.25 billion.",($1 = 1.3452 Canadian dollars)
15,https://www.reuters.com/article/ca-natl-rlwy-investment/cn-rail-to-invest-c445-mln-in-british-columbia-in-2020-idUSL4N2E63IH,2020-06-29T16:01:22Z,CN Rail to invest C$445 mln in British Columbia in 2020,June 29 (Reuters) - Canadian National Railway Co said on Monday it plans to invest about C$445 million ($324.94 million) across British Columbia this year to add rail tracks and handle growing traffic at the country’s biggest railroad.,"The investments include building about 3.5 miles of double track between Vancouver and Edmonton, replacing more than 100 miles of rail and installing over 209,000 new railroad ties.","Montreal-based CN, which has 2,465 employees in British Columbia, said the investments would also help enable supply chains.",The company in April withdrew its full-year 2020 forecast following the pandemic and expects a tough second quarter for its energy unit.
