16,https://www.reuters.com/article/ca-natl-rlwy-ceo/rpt-cn-rail-sees-eastern-network-revival-on-supply-chain-diversity-ports-idUSL1N2DY04W,2020-06-22T10:00:00Z,"RPT-CN Rail sees eastern network revival on supply chain diversity, ports",(Repeats story first published Sunday with no changes to text),"MONTREAL, June 21 (Reuters) - Canadian National Railway Co , the country’s biggest railroad, is banking on growth in consumer products and supply-chain diversification in Asia, to revive traffic on its underutilized eastern Canadian rail lines, the company’s chief executive told Reuters on Friday.","Coronavirus, which hit China’s industrial production, along with U.S. tariffs on Chinese goods, are further leading suppliers to eye alternative manufacturing sites in Asia.","“The tariff war and coronavirus have intensified and accelerated these trends,” CN CEO Jean-Jacques Ruest said. “I think, therefore, we are even more bullish today than two years ago.”","He sees a shift in the business mix, combined with container expansion projects planned for ports in Montreal, Quebec City and Halifax - three main eastern Canadian ports - as key to reviving CN’s underutilized eastern network, which lost capacity as manufacturing dwindled.","“CN is very focused to repurpose that network, which is in great shape and only running at 50% capacity,” Ruest said.","CN, which has access to 15 port operations overall, is a partner in a C$775 million ($570 million) joint venture for a new container terminal at Quebec City’s port, but has not disclosed its specific investment.","Montreal-based CN is betting on more freight generated by consumer spending being shipped through the Suez Canal to North America’s east coast, even as the pandemic fuels demand for e-commerce.","CN figures show 30% of 2018 revenues were from consumer products, compared with 65% for commodities like chemicals, grain and fertilizer, that the railway moves on its densely-trafficked line in western Canada.","But revenues for CN’s consumer franchise grew nearly 28% between 2014 and 2018, around double the rise in the company’s commodity and resource business during those years.","CN figures show overall twenty-foot equivalent units (TEU), a measurement for cargo capacity, are expected to grow by around 70% at the three ports in 2024. Plans for the two Quebec ports, however, still require permits.","CN’s strategy is to connect more cities with the port access through acquisitions, joint ventures, or strategic partners that would help it access markets in the U.S. midwest and central Canada.",Ruest said what CN needs to fully capitalize on the unused capacity on the mainline between Halifax and Chicago is increased access to highly-populated areas.,CN withdrew its full-year 2020 forecast following the pandemic and expects a tough second quarter for its energy unit. ($1 = 1.3603 Canadian dollars) (Reporting By Allison Lampert in Montreal Editing by Denny Thomas and Nick Zieminski)
17,https://www.reuters.com/article/ca-natl-rlwy-ceo/cn-rail-sees-eastern-network-revival-on-supply-chain-diversity-ports-idUSL1N2DW2D6,2020-06-21T15:23:51Z,"CN Rail sees eastern network revival on supply chain diversity, ports","MONTREAL, June 21 (Reuters) - Canadian National Railway Co , the country’s biggest railroad, is banking on growth in consumer products and supply-chain diversification in Asia, to revive traffic on its underutilized eastern Canadian rail lines, the company’s chief executive told Reuters on Friday.","Coronavirus, which hit China’s industrial production, along with U.S. tariffs on Chinese goods, are further leading suppliers to eye alternative manufacturing sites in Asia.","“The tariff war and coronavirus have intensified and accelerated these trends,” CN CEO Jean-Jacques Ruest said. “I think, therefore, we are even more bullish today than two years ago.”","He sees a shift in the business mix, combined with container expansion projects planned for ports in Montreal, Quebec City and Halifax - three main eastern Canadian ports - as key to reviving CN’s underutilized eastern network, which lost capacity as manufacturing dwindled.","“CN is very focused to repurpose that network, which is in great shape and only running at 50% capacity,” Ruest said.","CN, which has access to 15 port operations overall, is a partner in a C$775 million ($570 million) joint venture for a new container terminal at Quebec City’s port, but has not disclosed its specific investment.","Montreal-based CN is betting on more freight generated by consumer spending being shipped through the Suez Canal to North America’s east coast, even as the pandemic fuels demand for e-commerce.","CN figures show 30% of 2018 revenues were from consumer products, compared with 65% for commodities like chemicals, grain and fertilizer, that the railway moves on its densely-trafficked line in western Canada.","But revenues for CN’s consumer franchise grew nearly 28% between 2014 and 2018, around double the rise in the company’s commodity and resource business during those years.","CN figures show overall twenty-foot equivalent units (TEU), a measurement for cargo capacity, are expected to grow by around 70% at the three ports in 2024. Plans for the two Quebec ports, however, still require permits.","CN’s strategy is to connect more cities with the port access through acquisitions, joint ventures, or strategic partners that would help it access markets in the U.S. midwest and central Canada.",Ruest said what CN needs to fully capitalize on the unused capacity on the mainline between Halifax and Chicago is increased access to highly-populated areas.,CN withdrew its full-year 2020 forecast following the pandemic and expects a tough second quarter for its energy unit. ($1 = 1.3603 Canadian dollars) (Reporting By Allison Lampert in Montreal Editing by Denny Thomas and Nick Zieminski)
18,https://www.reuters.com/article/canadian-national-railway-results/update-2-cn-rail-profit-beats-pulls-2020-forecast-on-coronavirus-hit-idUSL3N2CF4SU,2020-04-27T22:40:08Z,"UPDATE 2-CN Rail profit beats, pulls 2020 forecast on coronavirus hit","(Adds CEO comment, background)",April 27 (Reuters) - Canadian National Railway Co beat analysts’ estimates for first-quarter profit on Monday driven by crude-by-rail shipments and withdrew its full-year 2020 forecast following the COVID-19 pandemic.,Canadian railroad operators have been getting a boost from shipping oil for producers looking for alternatives to congested pipelines. Canadian National said in January it expected crude shipments to be a growth driver this year.,"“Looking broadly at energy-related carloads, crude by rail was a significant growth driver, up 45% year-over-year for the quarter,” Chief Executive Officer Jean-Jacques Ruest said on Monday.","Rail freight revenue rose marginally to C$3.42 billion in the reported quarter on higher petroleum and chemical shipments. Total carloads, the amount of freight loaded into cars during a specified period, fell 5.9%.","However, with global storage space filling up fast and oil demand slumping, railroads could stand to lose a key part of their business.",Smaller rival Canadian Pacific Railway Ltd last week warned the pandemic would result in flat growth for the full-year and flagged rapidly slowing crude volumes.,"CN Rail, Canada’s largest railroad operator, expects the second quarter to be tough for its energy unit on lower demand for crude, frack sand and jet fuel.",Current-quarter volumes for the company’s automotives unit will also be hit as North American assembly plants remain shut as the virus outbreak continues.,"However, unlike many companies in North America, which have suspended dividend payouts to maintain liquidity during the pandemic, CN Rail said it plans to maintain its previously announced 2020 dividend increase of 7%.","Rail blockades hit CN Rail’s capacity equivalent to 10,000 carloads, or 1 million tonnes of grain exports in February.",Protesters blocked rail lines and roads across Canada for weeks to show solidarity with an indigenous group in the Pacific province of British Columbia who were opposed to a pipeline being built across their land.,"The company’s operating ratio, a key metric for Wall Street, fell to 65.7% from 69.5%. A lower ratio signals improved profitability.","On an adjusted basis, the company earned C$1.22 per share, beating analysts’ estimate of C$1.09, according to IBES data from Refinitiv.",Revenue was flat at C$3.55 billion. (Reporting by Devbrat Saha and Shanti S Nair in Bengaluru; Editing by Shounak Dasgupta)
19,https://www.reuters.com/article/canadian-national-railway-results/canadian-national-railway-pulls-2020-forecast-on-coronavirus-hit-idUSL3N2CF4OF,2020-04-27T20:15:44Z,Canadian National Railway pulls 2020 forecast on coronavirus hit,April 27 (Reuters) - Canadian National Railway Co on Monday reported a 28.6% rise in quarterly profit and said it plans to withdraw its full-year 2020 forecast following the COVID-19 pandemic.,"Net income at the largest railroad operator in Canada rose to C$1.01 billion, or C$1.42 per share, in the quarter ended March 31, from C$786 million, or C$1.08 per share, a year earlier.",Revenue was flat at C$3.55 billion. (Reporting by Sanjana Shivdas and Devbrat Saha in Bengaluru; Editing by Shounak Dasgupta)
20,https://www.reuters.com/article/us-canad-natio-rail-ceo/cn-rail-faces-grain-export-backlog-of-10000-carloads-ceo-idUSKBN20Q2ZG,2020-03-03T21:43:09Z,"CN Rail faces grain export backlog of 10,000 carloads: CEO","MONTREAL (Reuters) - Canadian National Railway Co CNR.TO lost capacity equivalent to 10,000 carloads, or 1 million tonnes of grain exports, in February due to rail blockades by protesters opposed to a pipeline project, Chief Executive Jean-Jacques Ruest said on Tuesday.","Activists disrupted passenger and freight traffic last month to show solidarity with the Wet'suwet'en people, who are seeking to stop TC Energy Corp's TRP.TO Coastal GasLink pipeline from being built across their land.","“In the case of CN we lost the equivalent of 10,000 carloads, or roughly 1 million tonnes,” Ruest said in an interview. “Of all the supply chains the one that will take the longest (to recover) is the grain export.”","The lost capacity represents roughly 1% of Canada’s total harvest during the 2019-20 marketing year, which runs from Aug. 1, 2019, through July 31, 2020.","Canada relies on CN, the country's largest railroad, and smaller rival Canadian Pacific Railway CP.TO to move crops, oil, potash, coal and manufactured goods to ports and the United States.","The blockades, which shut some lines for weeks, hit “every commodity,” creating backlogs of products sitting on CN railcars, along with product that “has yet to enter our network,” he said.","Ruest said CN did not move as much crude by rail as expected in February because of the blockades. He said he believes crude shipments will remain a driver of growth this year for CN, although weaker prices could impact output.","Global crude price benchmarks have tumbled this year by more than one-fifth, due to fears that the coronavirus outbreak could sap global demand.","Earlier on Tuesday, CN said over 1,400 trains, including passenger trains, were delayed or canceled because of the blockades, causing shutdowns of parts of the company’s network as freight is parked across the network, ready to be moved.",CN also confirmed a Reuters report from Friday that the company was calling back many of the 450 employees based in Eastern Canada who had been temporarily laid off because of the blockades.,"Ruest said he hopes protesters will not target rail amid tensions over other pipeline projects. Along with Coastal GasLink, twinning is under way with the Canadian government-owned Trans Mountain oil pipeline from Alberta to the Pacific coast near Vancouver, which also faces fierce opposition from environmental and some indigenous groups.","“It is a very costly way to resolve issues,” Ruest said. “I surely hope this is not the way of the future.”"
21,https://www.reuters.com/article/canad-natio-rail-ceo/cn-rail-faces-grain-export-backlog-of-10000-carloads-ceo-idUSL1N2AW1SE,2020-03-03T21:03:32Z,"CN Rail faces grain export backlog of 10,000 carloads -CEO","MONTREAL, March 3 (Reuters) - Canadian National Railway Co lost capacity equivalent to 10,000 carloads or 1 million tonnes of grain exports in February due to rail blockades by protesters opposed to a pipeline project, Chief Executive Jean-Jacques Ruest said on Tuesday.","Activists disrupted passenger and freight traffic last month to show solidarity with the Wet’suwet’en people, who are seeking to stop TC Energy Corp’s Coastal GasLink pipeline from being built across their land.","“In the case of CN we lost the equivalent of 10,000 carloads, or roughly one million tonnes,” Ruest said in an interview. “Of all the supply chains the one that will take the longest (to recover) is the grain export.” (Reporting By Allison Lampert Editing by Chris Reese)"
22,https://www.reuters.com/article/us-canada-pipeline-cn/canadian-national-railway-starts-calling-back-employees-laid-off-during-rail-blockade-idUSKCN20N00D,2020-02-29T00:20:33Z,Canadian National Railway starts calling back employees laid off during rail blockade,"MONTREAL (Reuters) - Canadian National Railway Co has started calling back many of the 450 workers it laid off earlier this month in eastern Canada, when blockades crippled operations on strategic rail lines, according to a company email sent to customers on Friday.","Earlier this week, police made 10 arrests and cleared a blockade in eastern Canada that had been stopping freight and passenger traffic for almost three weeks on one of Canada’s busiest lines.","The blockades were held in solidarity with the Wet’suwet’en people in the Pacific province of British Columbia, who are seeking to stop TC Energy Corp from building a gas pipeline over their land.","“In the absence of illegal blockades on our network over the last 24 hours, and while we are keeping a close watch for any further disruptions, we have started calling back many of the temporarily laid off employees based in Eastern Canada,” CN chief executive Jean-Jacques Ruest said in the email seen by Reuters.",The email did not specify how many of the 450 workers were being called back.,"After 21 days of disruptions, “there is a significant backlog of trains parked on our tracks and in our yards that will be processed,” the email said.",“The complete network recovery process will take several weeks.”,"Montreal-based CN said the company was on its way to recovering in Western Canada, and said products like export grain, imported containerized goods, coal, potash and other commodities are moving to market.","Canada relies on CN and rival Canadian Pacific Railway to move crops, oil, potash, coal and manufactured goods to ports and the United States. About half of Canada’s exports move by rail, according to industry data."
23,https://www.reuters.com/article/canada-derailment/cn-rail-train-leaks-crude-oil-after-it-derails-in-ontario-idUSL1N2AJ0WI,2020-02-19T16:59:18Z,CN Rail train leaks crude oil after it derails in Ontario,"TORONTO, Feb 19 (Reuters) - A Canadian National Railway Co freight train derailed in Ontario and started leaking crude oil, the company said on Wednesday, marking the second such incident in less than two weeks.","About 30 cars came off the rails on Tuesday night near Emo, Ontario, just north of the border with Minnesota, the railroad said in a statement. Emo is about 380 km (240 miles) west of Thunder Bay, Ontario.","Several cars have leaked crude oil, but preliminary reports show none of it entered waterways, the company said. The cause of the derailment was still under investigation, it added.",No fire or injuries were reported.,The derailment prompted local emergency workers to evacuate residents within 800 meters (yards) from the site as a precaution. Ontario police said there was no risk to public safety at the time.,"A Canadian Pacific Railway Ltd crude oil train derailed and caught fire in Saskatchewan on Feb. 6, prompting Ottawa to impose temporary speed limits on trains hauling dangerous goods. (Writing by David Ljunggren; editing by Jonathan Oatis)"
24,https://www.reuters.com/article/us-tc-energy-pipeline-canad-natio-rail/cn-rail-to-shut-down-eastern-canadian-operations-due-to-protests-idUSKBN2072WB,2020-02-13T23:47:45Z,CN Rail to shut down Eastern Canadian operations due to protests,"(Reuters) - Canadian National Railway Co CNR.TO will shut operations in Eastern Canada as its rail lines continue to be blocked by anti-pipeline protesters, the country's biggest railroad operator said on Thursday.",The protests by an indigenous community opposing the construction of a gas pipeline project in British Columbia and its supporters have disrupted passenger trains and goods transportation for the seventh straight day.,"The shutdown will continue until the blockades end and may lead to temporary layoffs within its Eastern Canadian operational staff, the company said.","“With over 400 trains canceled during the last week and new protests that emerged at strategic locations on our mainline, we have decided that a progressive shutdown of our Eastern Canadian operations is the responsible approach to take,” Chief Executive Officer JJ Ruest said in a statement.","The company’s national rail passenger service, VIA Rail also said it would cancel all of its services on the network, effective immediately.","“This is devastating news for the manufacturing sector which heavily relies on rail transportation and, the overall Canadian economy,” said Dennis Darby, President and CEO of Canadian Manufacturers & Exporters.","On Thursday, British Columbia Premier John Horgan and federal Indigenous Services Minister Marc Miller said they are willing to meet with the protesting indigenous groups.","“My request, that I ask you kindly to consider, is to discontinue the protest and barricade of the train tracks as soon as practicable. As you well know, this is a highly volatile situation and the safety of all involved is of the utmost importance to me,” Miller said in an email to the Mohawks.","The C$6.6 billion ($4.97 billion) pipeline, which will be operated by TC Energy Corp TRP.TO, is set to move natural gas from northeastern British Columbia to the Pacific Coast, where the Royal Dutch Shell-led LNG Canada export facility is under construction."
25,https://www.reuters.com/article/tc-energy-pipeline-canad-natio-rail/cn-rail-to-shut-down-eastern-canadian-operations-due-to-protests-idUSL4N2AD4XG,2020-02-13T22:01:04Z,CN Rail to shut down Eastern Canadian operations due to protests,Feb 13 (Reuters) - Canadian National Railway Co said on Thursday it has been forced to shutdown its operations in Eastern Canada due to the blocking of rail lines by those protesting against a natural gas pipeline in British Columbia.,"Canada’s biggest railway said the shut down, which would continue until the blockades end, may lead to temporary layoffs within its Eastern Canadian operational staff.","Anti-pipeline protesters near tracks in Ontario, Canada’s most populated province, have disrupted passenger trains and goods transportation for the seventh straight day. (Reporting by Nishara Karuvalli Pathikkal in Bengaluru; Editing by Shailesh Kuber)"
26,https://www.reuters.com/article/canad-natio-rail-labor/update-2-cn-railway-workers-okay-contract-that-ended-canadas-crippling-strike-union-idUSL1N2A0216,2020-01-31T21:44:08Z,UPDATE 2-CN Railway workers okay contract that ended Canada's crippling strike -union,"(Adds comment from CN, sector data hit by strike)","MONTREAL, Jan 31 (Reuters) - Canadian National Railway Co workers have approved a new three-year-contract, cementing a deal that was struck in November to end the country’s largest rail strike in a decade, their union said on Friday.","Teamsters Canada said in a statement the contract was approved by 91.3% of the estimated 3,200 workers including rail conductors.","The new contract “focuses primarily on safety, specifically with regards to crew fatigue and hours of work,” the union said.","The agreement, which is retroactive to July 23, 2019, will “provide wage increases and benefit improvements” for the workers, CN said in a statement.","Workers hit picket lines for eight days last year, calling for improved working conditions, including rest breaks. A tentative agreement reached between the union and CN brought them back to work in late November.","“We’ve succeeded in getting CN to adjust some of its practices in the interests of safety. But the core problem of fatigue in the rail industry can only be resolved through government regulations,” said Lyndon Isaak, president of the Teamsters Canada Rail Conference (TCRC) in a release.",“The issue of fatigue is still far from resolved.”,The strike triggered a severe propane shortage and left many Canadian exports stranded.,"Canada relies on CN and rival Canadian Pacific Railway to move crops, oil, potash, coal and manufactured goods to ports and the United States. About half of Canada’s exports move by rail, according to industry data.","The mining, quarrying and oil and gas extraction sectors fell 1.4% in November, in part because of disruptions from the strike, Statistics Canada said on Friday.","Still, the Canadian economy grew 0.1% during the month, as increases in utility use because of a cold weather snap helped to offset the effects of the strike. (Reporting by Allison Lampert; Additional reporting by Kelsey Johnson in Ottawa Editing by Sandra Maler and David Gregorio)"
27,https://www.reuters.com/article/canad-natio-rail-results/update-2-cn-rail-expects-crude-shipments-to-drive-growth-in-2020-idUSL4N29X36P,2020-01-28T23:26:34Z,UPDATE 2-CN Rail expects crude shipments to drive growth in 2020,"(Adds details from the call, executive comment, background)","Jan 28 (Reuters) - Canadian National Railway Co said on Tuesday it sees crude shipments as a growth driver in the year for the country’s largest railway operator, which reported better-than-expected fourth-quarter profit.","Canadian railroad operators had been benefiting from shipping oil for producers looking for alternatives to congested pipeline until recently when Alberta’s output cuts in Jan, 2019 hurt crude-by-rail volumes.","The volumes, however, started recovering late last year, after Alberta eased the curtailments in October and said it would allow companies to produce additional oil if they move it by rail.","“We expect significant year-over-year growth in crude carloads for the balance of first quarter,” said James Cairns, senior vice president of Rail Centric Supply Chain at CN Rail on a post-earnings call with analysts.","The company’s quarterly results were hurt by a crippling eight-day strike in November, but it has been ramping up its services to clear delayed shipments.","The strike resulted in lower volumes shipped across all units in the quarter, with revenue from the petroleum and chemicals segment, which includes crude-by-rail shipments, falling 8% to C$169 million ($128.60 million).","CN Rail’s operating ratio, a closely watched productivity metric that measures expenses as a percentage of revenue, worsened to 66% from 61.9% a year earlier. A higher ratio represents inefficiency.","Net income fell to C$873 million, or C$1.22 per share, in the quarter ended Dec. 31, from C$1.14 billion, or C$1.56 per share, a year earlier.","Excluding one-time items, the company earned C$1.25 per share, beating the average analyst estimate of C$1.20, according to IBES data from Refinitiv.","Revenue fell to C$3.58 billion from C$3.80 billion, but was above analysts’ expectations of $3.52 billion.","Shares of the company, which said it would buy back up to 16 million common shares over the next one year, closed at C$123.47 on Tuesday. ($1 = 1.3142 Canadian dollars) (Reporting by C Nivedita in Bengaluru; Editing by Shinjini Ganguli)"
28,https://www.reuters.com/article/canad-natio-rail-results/cn-rail-quarterly-profit-falls-24-idUSL4N29X36I,2020-01-28T21:08:19Z,CN Rail quarterly profit falls 24%,"Jan 28 (Reuters) - Canadian National Railway Co reported a nearly 24% fall in fourth-quarter profit on Tuesday, hurt by a crippling eight-day strike in November that delayed shipments.","Net income at the largest railroad operator in Canada fell to C$873 million ($664.28 million), or C$1.22 per share, in the quarter ended Dec. 31, from C$1.14 billion, or C$1.56 per share, a year earlier.",Revenue fell to C$3.58 billion from C$3.80 billion. ($1 = 1.3142 Canadian dollars) (Reporting by C Nivedita in Bengaluru; Editing by Shinjini Ganguli)
