29,https://www.reuters.com/article/us-teck-resources-canad-natio-rail/canadian-national-rail-enters-deal-with-teck-resources-to-ship-steelmaking-coal-idUSKBN1Y828N,2019-12-04T16:17:24Z,Canadian National Rail enters deal with Teck Resources to ship steelmaking coal,(Reuters) - Canadian National Railway Co said on Wednesday it has entered a long-term deal to ship steelmaking coal from some of Teck Resources Ltd’s operations in British Columbia.,"Under the terms of deal, CNR will ship steelmaking coal from four of Teck’s operations in the province, between Kamloops and Neptune terminals, and other west coast ports.","CNR, the country’s largest railroad said it would also invest more than C$125 million ($93.98 million) to improve rail infrastructure and support increased shipment volumes to the Neptune facility.","“This agreement and the associated infrastructure investment will provide us with rail capacity to match the major upgrades underway now at Neptune Terminals,” said Don Lindsay, president and chief executive officer of Teck Resources.",The deal will begin from April 2021 and runs through December 2026.
30,https://www.reuters.com/article/canad-natio-rail-ceo/update-2-cn-rail-ceo-says-crude-by-rail-may-help-earnings-in-early-2020-idUSL1N28E0HO,2019-12-04T15:43:21Z,UPDATE 2-CN Rail CEO says crude by rail may help earnings in early 2020,(Adds comments on crude by rail from CP CEO),"MONTREAL, Dec 4 (Reuters) - Canadian National Railway Co’s chief executive on Wednesday said crude-by-rail shipments may help earnings during the first three months of 2020, despite softer market conditions overall.","CN, Canada’s largest railroad, is ramping up its service following a crippling eight-day strike that ended last week, as it cuts jobs in response to softer economic conditions and less demand for freight services.","“This year, crude by rail still hasn’t got its traction, which it may early year,” CN CEO JJ Ruest said at the Credit Suisse Industrials Conference.","Crude by rail may actually affect “our first quarter positively,” he added, given a possible rise in production next year.","Alberta Premier Jason Kenney has said he may allow more oil production next year, but pipelines are congested, leaving rail as the main transport alternative.","“We have the capacity, especially out west,” said Ruest, adding the railroad would also be able to move higher grain shipments.","Canada relies on CN and its smaller rival Canadian Pacific Railway to move products such as crops, oil, potash, coal and manufactured goods to domestic ports and the United States.","The chief executive of CP, which did not suffer a strike, told analysts at the same conference that crude by rail increased during the fourth quarter.","“We’re going to exit the fourth quarter with our highest ever crude-by-rail month with fundamentals that just strengthened that in 2020,” said CP CEO Keith Creel.","CN’s Ruest said it had not lost business permanently because of the work stoppage, the biggest Canadian rail strike in a decade, but some business had to find its way to customers through other modes of transport.","On Tuesday, CN cut its adjusted profit growth target for 2019, citing shipment delays from the eight-day strike.","“It’s an expensive strike,” Ruest said.","The strike saw about 3,200 conductors and yard workers hit picket lines demanding improved working conditions and rest breaks. Union members must still vote on the deal."
31,https://www.reuters.com/article/canad-natio-rail-ceo/cn-rail-ceo-sees-crude-by-rail-lift-on-earnings-in-early-2020-idUSL1N28E0DZ,2019-12-04T14:01:25Z,CN Rail CEO sees crude by rail lift on earnings in early 2020,"MONTREAL, Dec 4 (Reuters) - Canadian National Railway Co’s chief executive on Wednesday said crude by rail shipments may help earnings during the first three months of 2020, despite softening demand for freight services.","CN, Canada’s largest railroad, is ramping up its service following a crippling eight-day strike that ended last week, as it cuts jobs to meet softer economic conditions and less demand for freight services. (Reporting By Allison Lampert Editing by Chizu Nomiyama)"
32,https://www.reuters.com/article/canad-natio-rail-labor/canadian-national-railway-implements-recovery-plan-after-eight-day-strike-idUSL4N2883QK,2019-11-28T16:38:45Z,Canadian National Railway implements recovery plan after eight-day strike,Nov 28 (Reuters) - Canadian National Railway Co on Thursday said it was implementing a recovery plan and gradual ramp up of operations after the country’s biggest rail strike in a decade.,"The eight-day-long work stoppage, which saw about 3,200 conductors and yard workers demanding improved working conditions and rest breaks, ended on Tuesday as the company reached a tentative agreement with workers.","In a statement, CN said the strike caused its network to run at about 10% of capacity and that it would work on starting its recovery plan while staying in direct contact with customers of the railroad to collect feedback on progress.","“Overriding emphasis will be placed on safety as we implement a disciplined and progressive ramp up to avoid congestion that can overwhelm parts of the supply chain that are the most vulnerable,” said Chief Executive Officer JJ Ruest.","As part of the deal ending the strike, CN will waive the ""work-now-grieve-later principle"" and not compel train workers to work past the start of their rest breaks, the Free Press reported, citing details from a draft copy of the agreement. (bit.ly/2pY9D9p)",CN and workers’ union Teamsters Canada were not immediately available for comment.,"The draft of the new labor agreement also calls for a retroactive 2.5% increase in hourly, mileage-based and flat rates of pay as of July 23, 2019, an identical wage rise a year later, and a 3% raise in 2021, according to the Free Press report.","Workers had previously cited disputes over what counts as showing up on time for shifts. The tentative agreeement seeks to resolve this, in part, by setting out shifts as starting and ending at an agreed location, such as the employee’s locker facility.","Employees will also be compensated when scheduled to work 30 or 60 minutes into their rest periods, including train staff and those at railyards, the Free Press reported.",Union members should vote on the deal within eight weeks. (Reporting by Saumya Sibi Joseph in Bengaluru Editing by Tom Brown)
33,https://www.reuters.com/article/us-canad-natio-rail-labor/canadian-national-railway-resume-services-after-biggest-rail-strike-in-a-decade-ends-idUSKBN1Y11YL,2019-11-27T15:53:45Z,Canadian National Railway resume services after biggest rail strike in a decade ends,"MONTREAL/OTTAWA (Reuters) - Operations resumed at Canada’s largest railway, Canadian National Railway Co., on Wednesday, a day after company and union officials reached a tentative deal to end an eight-day-long strike that had triggered a severe propane shortage and left many Canadian exports stranded.",A CN spokesman said on Wednesday that there were no hiccups in the return to work and that trains were resuming operations as expected. The company had said Tuesday operations would resume across Canada at 6 a.m. local time on Wednesday.,"The some 3,200 striking conductors and yard workers had been demanding improved working conditions, including rest breaks.",Reuters reported on Tuesday that union’s release of recorded pleas of an exhausted rail worker wanting a break after a 10-hour shift helped deliver a critical breakthrough in securing the preliminary agreement.,That deal help the end of the country’s biggest railway strike in a decade.,The CN spokesman would not comment on Wednesday about the duration of any backlog or the recovery process. Shippers had warned on Tuesday it could take weeks before service normalized.,"Canada relies on CN and Canadian Pacific Railway Co. to move crops, oil, potash, coal and manufactured goods to ports and the United States. About half of Canada’s exports move by rail, according to industry data.","Transport Minister Marc Garneau told reporters in Ottawa on Tuesday the government would be monitoring CN’s return to operations, saying it would take a few days for the railway to ramp its operations back up. CN, he said, would “get going as quickly as possible.”","“CN is a very experienced large company and, yes, they’re very aware of all the goods that we need to be moving,” Garneau said.","CN shares rose 0.4% in early Wednesday trade, adding to Tuesday’s 1.3% gains. The benchmark Canadian share index was steady on Wednesday."
34,https://www.reuters.com/article/canada-forex/canada-fx-debt-canadian-dollar-gains-as-trade-deal-optimism-boosts-stocks-idUSL1N2861SM,2019-11-26T21:51:29Z,CANADA FX DEBT-Canadian dollar gains as trade deal optimism boosts stocks
35,https://www.reuters.com/article/canada-forex/canada-fx-debt-canadian-dollar-sticks-to-narrow-range-as-railway-strike-ends-idUSL1N2860LS,2019-11-26T15:10:26Z,CANADA FX DEBT-Canadian dollar sticks to narrow range as railway strike ends
36,https://www.reuters.com/article/us-canad-natio-rail-labor-cargill-ltd/cargill-taking-mitigation-measures-during-canadian-rail-strike-spokeswoman-idUSKBN1XZ1XF,2019-11-25T17:31:27Z,Cargill taking 'mitigation measures' during Canadian rail strike: spokeswoman,"WINNIPEG, Manitoba (Reuters) - Cargill Ltd [CARGIL.UL], the Canadian arm of the U.S. agribusiness giant, has taken steps to ensure its customer needs are met during a strike at Canada’s biggest railway, Canadian National Railway Co, a spokeswoman said on Monday.","The strike by some 3,200 unionized employees entered its seventh day, leaving more than 30 vessels waiting on Canada’s West Coast.","“While Cargill is disappointed that this strike and the disruption of CN’s essential rail services could not be avoided, we hope it can be resolved swiftly,” spokeswoman Connie Tamoto said in a statement. “We have taken mitigation measures across all of our impacted businesses in Canada to ensure customer needs continue to be met.”"
37,https://www.reuters.com/article/canad-natio-rail-labor-cargill-ltd/cargill-taking-mitigation-measures-during-canadian-rail-strike-spokeswoman-idUSL1N2850KR,2019-11-25T15:40:11Z,Cargill taking 'mitigation measures' during Canadian rail strike: spokeswoman,"WINNIPEG, Manitoba, Nov 25 (Reuters) - Cargill Ltd , the Canadian arm of the U.S. agribusiness giant, has taken steps to ensure its customer needs are met during a strike at Canada’s biggest railway, Canadian National Railway Co , a spokeswoman said on Monday.","The strike by some 3,200 unionized employees entered its seventh day, leaving more than 30 vessels waiting on Canada’s West Coast.","“While Cargill is disappointed that this strike and the disruption of CN’s essential rail services could not be avoided, we hope it can be resolved swiftly,” spokeswoman Connie Tamoto said in a statement. “We have taken mitigation measures across all of our impacted businesses in Canada to ensure customer needs continue to be met.” (Reporting by Rod Nickel in Winnipeg, Manitoba Editing by Chizu Nomiyama)"
38,https://www.reuters.com/article/canad-natio-rail-labor/canadas-labor-union-says-no-progress-in-talks-with-cn-rail-idUSL4N28535S,2019-11-25T12:59:32Z,Canada's labor union says no progress in talks with CN Rail,"Nov 25 (Reuters) - Labor union Teamsters Canada said on Monday it has made no progress in reaching an agreement with Canadian National Railway Co, the country’s biggest railroad.","We are “no closer to reaching an agreement than when the strike began,” union spokesman Chris Monette told Reuters by phone.","Some 3,200 unionized employees with the Teamsters, including conductors and yard workers, hit picket lines to demand better working conditions and changes they say would make their jobs safer. (Reporting by Arunima Kumar in Bengaluru; Editing by Arun Koyyur)"
39,https://www.reuters.com/article/canad-natio-rail-labor/strike-at-canadas-biggest-railroad-enters-third-day-as-talks-continue-idUSL3N2813I0,2019-11-21T14:42:32Z,Strike at Canada's biggest railroad enters third day as talks continue,"MONTREAL/WINNIPEG, Nov 21 (Reuters) - A strike at Canada’s biggest railroad, Canadian National Railway Co, entered its third day on Thursday, as the company said talks were continuing with workers, assisted by federally appointed mediators.","Some 3,200 unionized employees, including conductors and yard workers, hit picket lines on Tuesday amid softening demand for freight service. The strike, the biggest in a decade, has slowed output at industrial plants making products such as chemicals and canola oil that were cut off from their markets.",CN Rail Chief Executive JJ Ruest said in a statement on Thursday he regretted the impact the strike was having on customers and was committed to finding a solution.,"The railway has proposed binding arbitration, an option that the Teamsters Canadian Rail Conference union has rejected.","The union’s concerns center on fatigue, safety and ensuring that workers’ breaks are not reduced.","Canada, one of the world’s biggest exporters of farm products, relies on CN and Canadian Pacific Railway to move crops, potash, coal and manufactured goods to ports and the United States.","Numerous industry groups, including mining, chemicals and lumber, have complained about the impact of the strike on their businesses.","On Wednesday, Canada’s transport minister said the talks were making progress. A spokesman for the ministry said on Thursday there was no further update.",Union representatives could not be immediately reached.,"CN shares eased 0.3% in Toronto, continuing a four-day slide of 3%. (Reporting by Allison Lampert in Montreal and Rod Nickel in Winnipeg; additional reporting by Kelsey Johnson in Ottawa. Writing by Denny Thomas; Editing by Bernadette Baum)"
40,https://www.reuters.com/article/us-canad-natio-rail-stocks/cn-rail-dips-as-workers-strike-enters-second-day-slows-factory-output-idUSKBN1XU2LY,2019-11-20T20:20:25Z,"CN Rail dips as workers' strike enters second day, slows factory output","(Reuters) - Shares of Canadian National Railway Co fell as much as 2.2% on Wednesday, as a strike by about 3,000 unionized workers, including conductors and yardmen, at the country’s biggest railroad entered the second day.",Talks with the management to end the stalemate was on even as factories whose supplies have been cut off from their markets began slowing production.,"The union’s concerns center on fatigue, safety and ensuring that workers’ breaks are not reduced. However, in a letter to employees that was seen by Reuters, the railroad denied union arguments that the “strike was about safety.”","Canada, one of the world’s biggest exporters of farm products, relies on Canadian National and Canadian Pacific Railway to move crops, potash, coal and manufactured goods to ports and the United States.",Chemicals maker Chemtrade Logistics Income Fund CHE_u.TO warned a prolonged interruption of rail service could negatively impact its operating results and may prevent the company from meeting its earnings forecast.,"Some plants that crush canola into vegetable oil and animal meal have slowed production and reduced purchases of the crop from farmers, said Chris Vervaet, executive director of the Canadian Oilseed Processors Association.","Canadian canola processors include Bunge Ltd, Cargill Ltd and Richardson International.","“Rail strikes are normally short-lived, with either a fast negotiated resolution or back-to-work legislation enacted to prevent a significant impact on the economy,” TD Securities analyst Sean Steuart said in a note on Tuesday.","The strike could impact lumber shipments as well, Brokerage Raymond James said.",Shares of the railroad have risen 21% so far this year and were trading at C$119.93 on Wednesday.
41,https://www.reuters.com/article/us-canad-natio-rail-labor/thousands-of-canadian-national-railway-workers-go-on-strike-idUSKBN1XT0XX,2019-11-19T19:32:54Z,Thousands of Canadian National Railway workers go on strike,"(Reuters) - About 3,000 workers of Canadian National Railway CNR.TO, the country's largest railroad operator, went on strike on Tuesday, labor union Teamsters Canada said after both parties failed to resolve contract issues.","""Conductors, trainperson and yard workers at Canadian National Railway are now officially on strike,"" the union said in a tweet bit.ly/2O10KW3.","Canada, one of the world’s biggest exporters of farm products, relies on its two main railways to move canola and wheat over the vast distances from western farms to ports. Crude oil shippers in Alberta have also increasingly used trains in the past year to reach U.S. refineries as an alternative to congested pipelines.","The union had issued a 72-hour strike action notice period to the company on Saturday after the talks reached a stalemate, setting the momentum for the first strike at Canadian National in a decade.",Teamsters Canada spokesman Christopher Monette had said on Monday the strike comes because workers are “hitting a wall on issues related to health and safety”.,"The labor union’s Facebook account also shared pictures of dozens of CN workers carrying placards in support of the strike on the streets of Saskatoon, Saskatchewan.",CN workers voted in favor of a strike in September after negotiations failed to produce a contract. The previous collective bargaining agreement expired on July 23.,The union and CN did not immediately respond to Reuters requests for comment.
42,https://www.reuters.com/article/us-canad-natio-rail-labor/canadian-ministers-meet-with-cn-rail-union-in-effort-to-avert-strike-idUSKBN1XS2A6,2019-11-18T19:53:22Z,"Canadian ministers meet with CN Rail, union in effort to avert strike","MONTREAL/WINNIPEG (Reuters) - Canada’s Liberal government sent two ministers on Monday to meet with representatives of Canadian National Railway Ltd and its largest union, as already hard-hit shippers pleaded for government intervention to avert a strike planned for early on Tuesday.","The threatened strike by 3,000 workers with Teamsters Canada comes after CN, the country’s largest railroad operator, said on Friday it would cut management and union jobs, as it grapples with softer economic conditions.","Labor Minister Patty Hajdu and Transportation Minister Marc Garneau were to meet with representatives from CN and the union in Montreal, Hajdu’s press secretary Veronique Simard said, following a stalemate in contract talks.","CN said it believes a strike can be averted “with the assistance of federal mediators,” after Teamsters declined to submit to binding interest arbitration.","“We expect talks to continue up to Nov. 19,” CN said.",Teamsters and CN reached a last-minute deal in 2017 that averted a planned strike.,"Canada, one of the world’s biggest exporters of farm products, relies on its two main railways to move canola and wheat over the vast distances from western farms to ports. Crude oil shippers in Alberta have also used trains in the past two years to reach U.S. refineries as an alternative to congested pipelines.","Alberta wheat and barley commissions, representing farmers, urged Ottawa to intervene, as they are already facing difficult harvest conditions because of weather.","“There are a lot of farmers who already have a significant amount of their income trapped under snow,” said Gary Stanford, Alberta Wheat Commission chair. “Now adding insult to injury, we’re looking at possible CN rail strike action too.”","CN was expecting slightly lower fourth-quarter crude shipments from the third quarter, officials said on an Oct. 22 conference call.","Slumping commodity prices, congested oil pipelines and a dispute with China that has hampered Canadian agriculture exports have pressured the economies of resource-rich western provinces.","Teamsters Canada spokesman Christopher Monette said the planned strike by its conductors, train personnel and yard workers comes because workers are “hitting a wall on issues related to health and safety.”","“While we continue to negotiate in good faith and in hopes of avoiding a labor dispute, we have every intention of striking at 00:01 a.m. ET tonight (0501 GMT) unless an agreement can be reached before then,” Monette said by email.",CN shares were trading down 0.5% in early afternoon Toronto trading.
43,https://www.reuters.com/article/canad-natio-rail-labor/canadian-national-railway-gets-strike-action-notice-from-union-idUSL5N27W04B,2019-11-16T13:27:26Z,Canadian National Railway gets strike action notice from union,"Nov 16 (Reuters) - Canadian National Railway said on Saturday that the Teamsters labor union had given it notice it plans to strike starting Nov. 19, following a stalemate in negotiations between the two parties.","The company, the largest Canadian railroad operator, offered the Teamsters Canadian Rail Conference a binding arbitration, which the union declined, CN’s Chief Operating Officer Rob Reilly said in a statement.","“If a settlement cannot be reached this weekend, we will once again encourage the union leadership to accept binding arbitration as an alternative to disrupting the Canadian economy,” Reilly said.","“We remain committed to constructive talks to reach an agreement without a work stoppage,” he added.",The union did not immediately respond to a request for comment.,"Canada, one of the world’s biggest exporters of farm products, relies on its two main railways to move canola and wheat over the vast distances from western farms to ports. Crude oil shippers in Alberta have also increasingly used trains in the past year to reach U.S. refineries as an alternative to congested pipelines.","CN’s estimated 3,000 conductors, trainpersons and yardpersons voted in favour of strike action in September, after negotiations failed to produce a contract. The previous collective agreement expired on July 23, 2019.","CN said on Friday it would cut management and union jobs, as it grapples with an economic slowdown. The company will lay off 1,600 employees in the United States and Canada, according to a report by the Globe and Mail. (Reporting by Akshay Balan in Bengaluru, Allison Lampert in Montreal Additional reporting by Rod Nickel in Winnipeg Editing by Frances Kerry)"
44,https://www.reuters.com/article/us-canad-natio-rail-layoffs/canadian-national-railway-to-cut-management-and-union-jobs-idUSKBN1XP2A6,2019-11-15T21:41:17Z,Canadian National Railway to cut management and union jobs,"(Reuters) - Canadian National Railway said on Friday it would cut management and union jobs, as the largest Canadian railroad operator grapples with an economic slowdown.","The company will lay off 1,600 employees in the United States and Canada, according to a report here by the Globe and Mail.",The announcement comes amid declining freight volumes as trade tensions have weighed on the North American economy.,"The number of people to be laid off could rise if demand from rail customers continues to decline, the Canadian newspaper said, citing a person familiar with the matter.","Canadian National Railway spokesman said the action, which includes sending some of its employees on temporary leave, has already begun across its network."
45,https://www.reuters.com/article/canad-natio-rail-layoffs/canadian-national-railway-to-layoff-1600-workers-globe-and-mail-idUSL4N27V4AO,2019-11-15T20:45:15Z,"Canadian National Railway to layoff 1,600 workers - Globe and Mail","Nov 15 (Reuters) - Canadian National Railway will lay off 1,600 employees in the United States and Canada, the Globe and Mail reported tgam.ca/32Sek26 on Friday.","The layoffs will affect managers, office employees and unionized rail workers in a range of positions across the largest Canadian railroad operator’s network, the newspaper reported.","The number of people to be laid off could rise if demand from rail customers continues to decline, the report said, citing a person familiar with matter.",Canadian National Railway was not immediately available for a Reuters request for a comment. (Reporting by Dominic Roshan K.L. in Bengaluru; Editing by Amy Caren Daniel)
