9,https://www.reuters.com/article/us-health-coronavirus-britain-credit/uk-credit-agencies-reassure-companies-over-pandemic-loan-freezes-idUSKCN22417E,2020-04-22T09:18:33Z,UK credit agencies reassure companies over pandemic loan freezes,"LONDON (Reuters) - Loan payment freezes negotiated by companies with their banks during the pandemic should not damage their credit rating, credit reference agencies in Britain said on Wednesday.","Experian, Creditsafe, Dun and Bradstreet, and Equifax set out guidance on Wednesday to protect business credit scores during the coronavirus lockdown.",The government and regulators want banks to offer loan repayment freezes to companies struggling to stay afloat as millions of people are furloughed or forced to claim welfare benefits and a deep recession looms.,"“Once agreed, lenders should not report a build-up of arrears to the four designated credit reference agencies... ensuring business credit scores are protected from this forbearance during the agreed timeframe,” Experian said in a statement.",The Financial Conduct Authority has said that temporary payment freezes should not damage credit scores.
10,https://www.reuters.com/article/data-privacy-massachusetts/in-brief-massachusetts-announces-18-2-mln-settlement-with-equifax-over-data-breach-idUSL1N2C52GI,2020-04-17T23:24:34Z,IN BRIEF-Massachusetts announces $18.2 mln settlement with Equifax over data breach,Massachusetts Attorney General Maura Healey on Friday announced an $18.2 million settlement with consumer credit reporting company Equifax Inc over a 2017 data breach that affected 147 million people nationwide.,"The settlement, which was approved by a Suffolk Superior Court judge on April 13, resolves a lawsuit by the attorney general accusing Equifax of failing to address a known vulnerability that allowed hackers to access consumers’ personal information. Nearly three million Massachusetts residents were affected by the breach, according to Healey’s office.","To read the full story on Westlaw Practitioner Insights, click here: bit.ly/2yodyjT"
11,https://www.reuters.com/article/equifax-dataprivacy/equifax-settles-indiana-case-over-massive-data-breach-for-19-5-million-idUSL2N2C224X,2020-04-14T20:30:55Z,Equifax settles Indiana case over massive data breach for $19.5 million,"Equifax Inc will pay Indiana $19.5 million to resolve claims it failed to protect residents whose personal information was exposed in a data breach that affected 147 million people, the state’s attorney general said on Monday.","The credit-reporting company has also agreed to settle similar claims by Massachusetts, the only other state that had chosen to proceed with a lawsuit against Equifax when it announced $700 million in federal, state and class action settlements in July.","To read the full story on Westlaw Practitioner Insights, click here: bit.ly/2V9uqni"
12,https://www.reuters.com/article/brief-equifax-inc-says-ceo-mark-begors-f/brief-equifax-inc-says-ceo-mark-begors-fy-2019-total-compensation-was-14-3-million-versus-20-0-million-in-fy-2018-sec-filing-idUSFWN2BK1G8,2020-03-27T21:51:12Z,BRIEF-Equifax Inc Says CEO Mark Begor's FY 2019 Total Compensation Was $14.3 Million Versus $20.0 Million In FY 2018 - SEC Filing,March 27 (Reuters) - Equifax Inc:,* EQUIFAX INC SAYS CEO MARK BEGOR'S FY 2019 TOTAL COMPENSATION WAS $14.3 MILLION VERSUS $20.0 MILLION IN FY 2018 - SEC FILING Source : (bit.ly/2wHkoAp) Further company coverage:
13,https://www.reuters.com/article/us-usa-justice-cyber-china/chinas-defense-ministry-asks-u-s-to-rescind-equifax-hacking-indictments-idUSKBN2070D2,2020-02-13T04:27:00Z,China's defense ministry asks U.S. to rescind Equifax hacking indictments,BEIJING (Reuters) - China's defense ministry asked the United States on Thursday to correct its mistakes and rescind the indictments against four Chinese military personnel in the 2017 Equifax EFX.N hacking case.,"A defense ministry spokesman, in a statement, said the move was needed to avoid further damage to the relations of the two countries and the two armed forces."
14,https://www.reuters.com/article/us-usa-justice-cyber/u-s-charges-four-chinese-military-hackers-in-2017-equifax-breach-idUSKBN2041RT,2020-02-11T07:48:33Z,U.S. charges four Chinese military hackers in 2017 Equifax breach,"WASHINGTON (Reuters) - The United States has charged four Chinese military hackers in the 2017 breach of the Equifax credit reporting agency that affected nearly 150 million American citizens, Attorney General William Barr said on Monday.","“This was a deliberate and sweeping intrusion into the private information of the American people,” Barr said in announcing the indictments of four members of the Chinese Liberation Army in connection with one of the largest data breaches in U.S. history.","Chinese foreign ministry spokesman Geng Shuang denied the allegations on Tuesday and said China’s government, military and their personnel “never engage in cyber theft of trade secrets.”","The announcement is the latest in an aggressive campaign by American authorities to root out Chinese espionage operations in the United States. Since turning the spotlight on China in 2018, the United States has snared a growing group of Chinese government officials, business people, and academics pursuing American secrets.","Roughly 147 million people had information, including Social Security numbers, birth dates and driver’s license data, compromised by the Equifax breach.","The hackers spent weeks in the Equifax system, breaking into computer networks, stealing company secrets and personal data. The hackers routed traffic through approximately 34 servers located in nearly 20 countries to obfuscate their true location.",Equifax Chief Executive Mark Begor said the company was grateful for the Justice Department investigation.,"“It is reassuring that our federal law enforcement agencies treat cybercrime – especially state-sponsored crime – with the seriousness it deserves,” he said in a statement.","U.S. officials have said Chinese hackers were behind a massive breach at the Office of Personnel Management, which came to light in 2015 and involved the compromise of sensitive personal data submitted by applicants for U.S. government security clearances.","That breach exposed the names, Social Security numbers and addresses of more than 22 million current and former U.S. federal employees and contractors, as well as 5.6 million fingerprints.",Chinese hackers are similarly suspected of being behind a massive breach at hotel group Marriott International Inc.,"The Equifax hack fits into a pattern of past Chinese cyberattacks, said Michael Daniel, a former White House cybersecurity coordinator, because the stolen data can support other spying efforts.","“Its primary utility would be in developing potential targets for approach by intelligence operatives or feeding artificial intelligence [and] machine learning tools,” said Daniel, who currently serves as president of the Cyber Threat Alliance, a cybersecurity information sharing group.","Chinese foreign ministry spokesman Geng, when asked about the indictments, said on Tuesday that Beijing is also a victim of U.S. “cyber intrusion, surveillance and monitoring activities.”","“We have lodged stern representations to the US and asked it to make explanations and immediately stop such activities,” he said.","Senator Ben Sasse, a Republican member of the Senate Select Committee on Intelligence, urged tougher action to counter Chinese hacking.","“The Chinese Communist Party will leave no stone unturned in its effort to steal and exploit American data. These indictments are good news, but we’ve got to do more to protect Americans’ data from Chinese Communist Party influence operations,” he said in a statement.","The Equifax data breach, because it was so large and involved so much sensitive financial information on so many Americans, had far-reaching implications for Equifax and the consumer credit industry.",The company agreed to pay up to $700 million to settle claims it broke the law during the data breach and to repay harmed consumers.,"The scandal sent the company into turmoil, leading to the exit of its then-CEO, Richard Smith, and multiple congressional hearings as the company’s slowness to disclose the breach and security practices were challenged by lawmakers.","Policymakers and consumer groups have questioned how private companies could amass so much personal data, sparking efforts to bolster consumers’ ability to control their information. Both the Senate Banking and House of Representatives Financial Services Committees are considering legislation that would require companies to better protect consumer data."
15,https://www.reuters.com/article/us-equifax-cyber-consumers/equifax-consumers-face-uphill-battle-for-claims-idUSKCN1UH2KA,2019-07-23T19:41:36Z,Equifax consumers face uphill battle for claims,"(Reuters) - Consumers affected by the massive Equifax Inc data breach in 2017 will not reap any windfalls from the credit reporting company’s $700 million U.S. settlement announced on Monday, but may face a cumbersome process to get compensation.",Federal Trade Commission officials said those among the 147 million consumers who had to spend time or money to protect their information or fight identity theft after the September 2017 data breach could be entitled to compensation.,"Consumers can file documents detailing what sort of information might have been stolen or harmed by identity theft. They need not prove the theft occurred during the Equifax hack, but simply show their identities were stolen after the breach, officials added.","Consumers can also seek repayment for time spent responding to the Equifax breach, at $25 per hour for up to 20 hours. Documentation must be provided, but consumers can “self-certify” up to 10 hours. Any time spent addressing identity theft or fraud issues after the breach, seeking credit monitoring, or freezing credit reports can be reimbursed.","Equifax will cover the cost of four years of credit monitoring from all three credit bureaus, including Experian Plc and TransUnion , and up to $1 million in identity theft protection. After that, Equifax will provide another six years of credit monitoring.",Anyone who was a minor at the time of the breach is eligible for 18 years of free credit monitoring.,"“That is a significant benefit,” said Norman Siegel of Kansas City’s Stueve Siegel, an attorney and chairman of the settlement committee who led the negotiations on behalf of consumers in class-action lawsuits. “We have also tried to make this process as simple as possible.”",The settlement is subject to court approval.
16,https://www.reuters.com/article/us-equifax-cyber-settlement/equifaxs-700-million-data-breach-settlement-spurs-criticism-calls-for-new-rules-idUSKCN1UH16Y,2019-07-23T19:41:36Z,"Equifax's $700 million data breach settlement spurs criticism, calls for new rules","WASHINGTON (Reuters) - Credit-reporting company Equifax Inc EFX.N will pay up to $700 million to settle claims it broke the law during a massive 2017 data breach and to repay harmed consumers, in a landmark settlement that was nonetheless criticized by consumer advocates and some lawmakers who called for stricter regulation.","While it was the largest-ever settlement for a data breach, they said the amount was still too small for the millions of Americans affected, and worried it could prove difficult for consumers to be repaid. The agreement also spurred multiple lawmakers to renew calls for legislation giving consumers more control over their personal information.","“This settlement is just a drop in the bucket of what Equifax’s disregard for privacy could cost American families,” Democratic U.S. Senator Sherrod Brown said in a statement.","The settlement concludes multiple probes into Equifax by the Federal Trade Commission, the Consumer Financial Protection Bureau and nearly all state attorneys general. It also resolves pending class-action lawsuits against the company.","Shares in Equifax, which is one of three major credit reporting companies, closed up 0.4 percent at $137.84 a share in trading on the New York Stock Exchange on Monday.","Roughly 147 million people had information, including Social Security numbers and driver’s license data, compromised by the breach. The hackers have never been identified.","While Equifax said on Monday it saw no evidence the stolen information had been used in identity thefts, regulators said the company failed to protect the data and misled consumers as to how secure it was. They ordered Equifax to set aside funds to repay consumers who spent time or money protecting themselves after the breach.","The company will establish a $300 million restitution fund which could climb to $425 million depending on how many people file claims. Only consumers who can show they suffered direct costs following the breach, either from identity theft or by purchasing credit-monitoring services, will be eligible for restitution, capped at $20,000 per person.","Equifax Chief Executive Mark Begor told reporters Monday he expected that the initial amount, which will also cover the costs of a decade of free credit monitoring for affected consumers, would be sufficient. In an interview on Monday afternoon with CNBC, Begor said the fund could be operational by year’s end.","In addition, the company will pay a $175 million fine to the states and $100 million to the CFPB.",Consumer advocates said the settlement was modest given the huge number of people affected.,"“It’s a parking ticket, not a penalty,” Ed Mierzwinski of the Washington-based U.S. Public Interest Research Group said in an email. He added that consumers should not have to jump through hoops to receive compensation.",Others questioned whether the fund would be sufficient given the long-term risks of having a Social Security number exposed.,"“The settlement provides some compensation right now, but the risk of identity theft is forever,” said Chi Chi Wu, attorney for the National Consumer Law Center.","Speaking to reporters, Federal Trade Commission Chairman Joe Simons said the agency also wanted to impose a monetary penalty, but the law does not allow it to fine companies for their first offense, an issue he has called on Congress to fix.","A spokeswoman for the Massachusetts attorney general, who along with Indiana, is not participating in the settlement, said its litigation against the company was ongoing. “Equifax must pay a penalty commensurate with the worst data breach in American history,” she added.","Equifax disclosed in 2017 that a data breach had compromised the personal information, including Social Security numbers, of 147 million people.","The scandal sent the company into turmoil, leading to the exit of its then-CEO, Richard Smith, and multiple congressional hearings as the company’s slowness to disclose the breach and security practices were challenged by lawmakers.","Policymakers and consumer groups have questioned how private companies could amass so much personal data, sparking efforts to bolster consumers’ ability to control their information. Both the Senate Banking and House of Representatives Financial Services Committees are considering legislation that would require companies to better protect consumer data.","“We need structural reforms and increased oversight of credit reporting agencies in order to make sure that this never happens again,” Democratic Senator Mark Warner said in a statement.","Begor told reporters on Monday the company was overhauling its processes to put consumers first, and was committing $1.25 billion to bolster its data security.","Equifax has also agreed as part of the settlement to several new measures, including reviews of its security policies by a government-appointed third party. Equifax’s board also must certify annually that the company has complied with the settlement terms, and could be fined if not."
17,https://www.reuters.com/article/us-equifax-cyber-settlement-factbox/factbox-biggest-u-s-data-breach-settlements-before-equifax-idUSKCN1UH22P,2019-07-22T18:43:14Z,Factbox: Biggest U.S. data breach settlements before Equifax,(Reuters) - The U.S. Federal Trade Commission announced on Monday that Equifax Inc. EFX.N will pay up to $700 million for a data breach that exposed millions of consumers' personal information.,The following are seven of the largest data breach settlements in recent years.,1) Equifax,"Following its 2017 data breach, Equifax will pay up to $700 million to the U.S. Federal Trade Commission, the Consumer Financial Protection Bureau and nearly all U.S. states and territories. That includes a $175 million fine to the states and $100 million to the CFPB. It will also establish a $300 million restitution fund for harmed consumers. That amount could grow to $425 million depending on how many consumers act on it.",2) Uber,"In 2018, ride-hailing app Uber UBER.N reached a $148 million settlement with 50 U.S. states and Washington, D.C., for failing to disclose a massive data breach in 2016. It exposed personal data from 57 million user accounts.",3) Target,Retailer Target Corp TGT.N agreed in 2017 to pay $18.5 million to 47 U.S. states and the District of Columbia for the company's massive 2013 data breach. Target reported that hackers stole data from up to 40 million credit and debit cards from shoppers who visited its stores in the 2013 holiday season.,4) Anthem,"Anthem, Inc. ANTM.N agreed to pay $16 million to the U.S. Department of Health and Human Services and the Office for Civil Rights in 2018 to settle potential violations of HIPAA, the Health Insurance Portability and Accountability Act Privacy and Security Rules, an HHS statement said. A series of cyberattacks exposed the health information of almost 79 million people.",5) Premera,"Earlier this month, health insurance company Premera Blue Cross agreed to pay $10 million to 30 U.S. states for allegedly failing to secure consumer data. A hacker had access to its network of private health information and Social Security numbers from May 2014 to March 2015, a statement from the Washington state attorney general said.",6) Nationwide Mutual,Insurance company Nationwide Mutual agreed in 2017 to pay $5.5 million to 33 U.S. states for a 2012 data breach. The attorneys general alleged that the company failed to apply a critical security patch and resulted in the loss of the personal information of over one million consumers.,7) Ashley Madison,"Adultery website Ashley Madison’s parent company Ruby Corp agreed in 2016 to pay $1.6 million to settle FTC and state charges that it failed to protect 36 million users’ account and profile information in a July 2015 data breach. In a separate 2017 settlement, the company agreed to pay $11.2 million in a class-action settlement, which said users with valid claims could recoup up to $3,500 depending on their losses from the breach."
18,https://www.reuters.com/article/equifax-cyber-settlement/equifax-to-pay-up-to-700-mln-to-settle-2017-data-breach-u-s-ftc-idUSL2N24N05F,2019-07-22T11:03:53Z,Equifax to pay up to $700 mln to settle 2017 data breach -U.S. FTC,"WASHINGTON, July 22 (Reuters) - Equifax Inc will pay at least $575 million, and potentially as much as $700 million, to settle allegations over its massive over 2017 data breach, U.S. regulators said in a statement on Monday.","The U.S. Federal Trade Commission, in a statement, said the credit reporting company would also have to implement a comprehensive information security program. (Reporting by Susan Heavey)"
19,https://www.reuters.com/article/equifax-cyber-settlement/equifax-to-pay-up-to-650-million-in-data-breach-settlement-idUSL2N24M09L,2019-07-22T11:01:00Z,Equifax to pay up to $650 million in data breach settlement,"WASHINGTON, July 22 (Reuters) - Credit-reporting company Equifax Inc will pay up to a record $650 million to settle U.S. federal and state probes into a massive 2017 data breach of personal information, authorities said on Monday.","The largest-ever settlement for a data breach draws to a close multiple probes into Equifax by the Federal Trade Commission, the Consumer Financial Protection Board and nearly all state attorneys general. It also resolves pending class-action lawsuits against the company.","“This company’s ineptitude, negligence, and lax security standards endangered the identities of half the U.S. population,” New York Attorney General Letitia James said in a statement.","Equifax, one of three major credit-reporting companies, disclosed in 2017 that a data breach had compromised the personal information, including Social Security numbers, of 143 million Americans.","The scandal upended the company, which saw the exit of its chief executive, as its security practices and slow speed in disclosing the breach were challenged. Washington policymakers questioned how private companies could amass so much personal data, setting off efforts to bolster consumers’ ability to protect and control their information.","Under the settlement, the company will establish a $300 million restitution fund for harmed consumers that could climb to $425 million depending on its use. Consumers eligible for the fund must submit claims showing they were fraud victims or set up credit-monitoring services following the breach.",Equifax will also pay a $175 million fine to the states and $50 million to the CFPB.,"Affected consumers will also be eligible for 10 years of free credit monitoring from Equifax, and the company agreed to make it easier for consumers to freeze their credit or dispute inaccurate information in credit reports.",The company has also agreed to bolster its security practices and have its policies assessed regularly by a third party.
20,https://www.reuters.com/article/us-equifax-cyber-settlement/equifax-nears-deal-to-pay-about-700-million-to-settle-u-s-data-breach-probes-wsj-idUSKCN1UE2QU,2019-07-20T00:02:51Z,Equifax nears deal to pay about $700 million to settle U.S. data breach probes: WSJ,"(Reuters) - Credit reporting company Equifax Inc EFX.N is close to a deal to pay around $700 million to settle data breach probes with U.S. regulators and states, the Wall Street Journal reported on Friday, citing people familiar with the matter.","Equifax will pay the amount to settle with the Federal Trade Commission, the Consumer Financial Protection Bureau and most state attorneys general, the Journal reported.",Equifax said it had no comment on the WSJ report.,The 2017 data breach at the company affected more than 143 million people worldwide.,"The amount to be paid by the company could change depending on the number of claims eventually filed by consumers, according to the report, which added that the settlement could be announced as soon as Monday.","The settlement will require the credit reporting firm to make more changes to how it protects and handles consumer data, the WSJ said.","A fund will be established to compensate consumers for the harm that they suffered as a result of the breach, according to the settlement reported by the paper."
21,https://www.reuters.com/article/equifax-cyber-settlement/equifax-nears-deal-to-pay-about-700-mln-to-settle-u-s-data-breach-probes-wsj-idUSL4N24K42L,2019-07-19T23:27:53Z,Equifax nears deal to pay about $700 mln to settle U.S. data-breach probes -WSJ,"July 19 (Reuters) - Credit reporting company Equifax Inc is close to a deal to settle data breach probes by paying around $700 million, the Wall Street Journal reported on Friday, citing people familiar with the matter.","Equifax will pay the amount to settle with the Federal Trade Commission, the Consumer Financial Protection Bureau and most state attorneys general, the Journal reported on.wsj.com/2y3olw9.",The 2017 data breach at the company affected more than 143 million people worldwide.,Equifax did not respond to a request for comment outside regular business hours. (Reporting by Kanishka Singh in Bengaluru Editing by Leslie Adler)
22,https://www.reuters.com/article/equifax-reports-lawsuit/lawsuit-says-equifax-named-wrong-source-on-credit-reports-idUSL1N22600S,2019-04-24T00:39:54Z,Lawsuit says Equifax named wrong source on credit reports,Atlanta-based credit bureau Equifax was hit with a proposed class action on Monday accusing it of violating federal law by misreporting the source of bankruptcy information it included in consumers credit reports.,"Filed in Riverside, California federal court, the lawsuit said Equifax told consumers it was getting information on bankruptcies from courthouses, when in reality it was coming from third-party vendors such as LexisNexis.","To read the full story on Westlaw Practitioner Insights, click here: bit.ly/2L7VJey"
23,https://www.reuters.com/article/financial-moves/moves-stone-harbor-equifax-state-street-idUSL3N21X2H5,2019-04-15T10:45:06Z,"MOVES-Stone Harbor, Equifax, State Street","April 15 (Reuters) - The following financial services industry appointments were announced on Monday. To inform us of other job changes, email moves@thomsonreuters.com.",The investment manager named Seamus Smyth Chief Developed Market Economist to boost its outlook on advanced economies.,The credit reporting company said it has appointed Tony Banks as vice-president of operations for the UK and Ireland.,The custodian bank named former Citigroup Inc Asia head Francisco Aristeguieta as chief executive officer for its international business. (Compiled by Uday Sampath in Bengaluru)
