38,https://www.reuters.com/article/us-equifax-cyber-insidertrading/u-s-charges-former-equifax-manager-with-insider-trading-idUSKBN1JO1ZG,2018-06-28T17:03:59Z,U.S. charges former Equifax manager with insider trading,(Reuters) - A former Equifax Inc EFX.N software development manager was charged on Thursday with insider trading before the credit reporting company disclosed a cyber attack that exposed the personal data of about 148 million people last year.,"Federal prosecutors in Atlanta announced the charges against Sudhakar Reddy Bonthu, who was among the employees given the task of assisting in the company’s response to the breach.",It is the second time prosecutors have charged an Equifax employee with profiting by trading on confidential information related to the cyber attack before the company disclosed the data breach last September.,"“Bonthu allegedly took advantage of his position to profit while members of the public were unaware of the data breach at Equifax,” U.S. Attorney Byung Pak said in a statement.","Bonthu, 44, was arraigned in federal court in Atlanta on Thursday, prosecutors said.","Meg Strickler, Bonthu’s lawyer, said in a statement that her client was looking forward to moving his case through the criminal justice system.","Equifax fired Bonthu in March after he refused to cooperate with an internal investigation, according to the U.S. Securities and Exchange Commission, which filed a related civil case against him on Thursday.","“We are fully cooperating with the SEC and the Department of Justice, and will continue to do so,” Equifax said in a statement. “We take corporate governance and compliance very seriously and will not tolerate violations of our policies.”","From May 2017 to July 2017, hackers gained access to Equifax databases, allowing them to acquire the names, Social Security numbers, birthdates and addresses for millions of people, according to the government.","Atlanta-based Equifax began investigating the breach in July 2017 after discovering the suspicious activity, and by August had determined that consumers’ data had likely been stolen, prosecutors alleged.","Bonthu knew by Aug. 30, 2017 that information from about 100 million individuals had been exposed and that the company planned to publicly disclose the breach in early September, the government said.","Using the information, Bonthu bought put options in Equifax stock using his wife’s brokerage account prior to the announcement, allowing him to profit if the company’s stock price dropped, according to prosecutors.","Equifax disclosed the breach on Sept. 7, 2017, after the market closed. Its stock price dropped the next day, and Bonthu made a profit of more than $75,000, according to charging documents.","In March, prosecutors filed insider trading charges against Jun Ying, a former Equifax technology executive. Ying has pleaded not guilty."
39,https://www.reuters.com/article/equifax-cyber-insidertrading/former-equifax-employee-charged-in-u-s-with-insider-trading-idUSL1N1TU0N8,2018-06-28T13:48:58Z,Former Equifax employee charged in U.S. with insider trading,June 28 (Reuters) - A former Equifax Inc software development manager was criminally charged on Thursday with engaging in insider trading ahead of the credit reporting company disclosing a massive breach that exposed the personal data of about 148 million people.,"Federal prosecutors in Atlanta announced the charges against Sudhakar Reddy Bonthu, who according to court papers was among the employees tasked with assisting in the company’s respond to the breach. (Reporting by Nate Raymond in Boston Editing by Chizu Nomiyama)"
40,https://www.reuters.com/article/us-equifax-states-agreement/equifax-avoids-fines-in-deal-with-u-s-states-over-data-breach-idUSKBN1JN2YH,2018-06-27T22:04:15Z,Equifax avoids fines in deal with U.S. states over data breach,"WASHINGTON/NEW YORK (Reuters) - Equifax Inc EFX.N on Wednesday avoided fines in a deal with eight states' banking regulators over a data breach that compromised sensitive data of more than 145 million people, as the credit reporting agency agreed to tighten up security.","Equifax’s disclosure of the cyber attack in September 2017, one of the largest to date, prompted the ouster of top executives. Former Chief Executive Richard Smith in October told U.S. lawmakers that hackers got into its network by exploiting a known software vulnerability that the company had failed to patch.","Equifax must perform a detailed assessment of cyber threats, boost board oversight of cyber security and improve processes for patching known security vulnerabilities, according to the terms of the agreement. The consent decree was approved by regulators in Alabama, California, Georgia, Maine, Massachusetts, New York, North Carolina and Texas.","Equifax, which collects information on over 800 million individuals and more than 88 million businesses worldwide, said in a statement it had already completed “a good number” of the required actions.","“The findings, with a very few exceptions, are not new findings and are already part of our remediation plans,” the statement said. “We expect to meet or exceed all the commitments made under the Consent Order.”","The state regulators acted because federal agencies have so far failed to sanction Equifax for the breach, Maria T. Vullo, head of the New York Department of Financial Services, said in a statement.","“In an era of weakened federal government oversight, strong state regulation is essential,” she said.",One consumer advocate said the lack of a financial penalty set a bad precedent.,"“Companies don’t change their practices unless they suffer financial consequences,” said Jamie Court, president of the Foundation for Taxpayer and Consumer Rights. “The fact that Equifax is not required to pay any fines is sending the wrong message.”"
41,https://www.reuters.com/article/brief-equifax-files-prelim-prospectus-su/brief-equifax-files-prelim-prospectus-supplement-related-to-potential-senior-notes-offering-idUSFWN1SU0T4,2018-05-23T13:27:33Z,BRIEF-Equifax Files Prelim Prospectus Supplement Related To Potential Senior Notes Offering,May 23 (Reuters) - Equifax Inc:,* EQUIFAX INC FILES PRELIMINARY PROSPECTUS SUPPLEMENT RELATED TO A POTENTIAL TWO-PART SENIOR NOTES OFFERING - SEC FILING Source text: (bit.ly/2IVsAkP) Further company coverage:
42,https://www.reuters.com/article/brief-equifax-to-meet-with-investors-in/brief-equifax-to-meet-with-investors-in-los-angeles-kansas-city-idUSFWN1SS0PG,2018-05-21T16:42:13Z,BRIEF-Equifax To Meet With Investors In Los Angeles & Kansas City,May 21 (Reuters) - Equifax Inc:,* EQUIFAX TO MEET WITH INVESTORS IN LOS ANGELES AND KANSAS CITY,"* EQUIFAX - JOHN GAMBLE, JEFF DODGE & TREVOR BURNS WILL BE MEETING WITH INVESTORS IN LOS ANGELES ON MAY 24 & IN KANSAS CITY ON MAY 25 Source text for Eikon: Further company coverage:"
43,https://www.reuters.com/article/us-usa-stocks/wall-st-gains-as-small-cap-russell-2000-hits-record-idUSKCN1IH1IE,2018-05-16T21:36:49Z,Wall St. gains as small-cap Russell 2000 hits record,"(Reuters) - Retail and technology stocks led Wall Street higher on Wednesday and the small-cap Russell 2000 hit a record peak, even as a rise in U.S. bond yields to an almost seven-year high suggested more competition for equities and investors fretted over geopolitics.",Smaller companies continued this year's trend of outperforming their larger rivals with the Russell 2000 .RUT reaching a record high. The index ended up 1 percent.,"“Small caps present a cleaner play than large caps on two fundamental market drivers: lower corporate taxes and a stronger US economy,” research firm DataTrek wrote in its morning briefing.",Macy's Inc M.N shares advanced 10.8 percent after the department store operator reported results that beat analyst estimates and the company raised its profit outlook.,"The results also boosted shares of rival department stores J.C. Penney Co Inc JCP.N, Kohl's Corp KSS.N, Nordstrom Inc JWN.N and Target Corp TGT.N. The S&P 500 Department Store index .SPLRCRETD gained 5.2 percent, its largest daily jump in nearly six months.","“I think corporate earnings have been remarkably strong,” said David Carter, chief investment officer at Lenox Wealth Advisors in New York. “The concern is really more about the future and decelerating growth.”","Macy’s earnings pushed the consumer discretionary sector higher, a day after government data showing an acceleration of consumer spending fanned inflation concerns and helped send U.S. government bond yields higher.","Yields on 10-year U.S. Treasuries hit 3.10 percent for the first time since July 2011, continuing to pressure stocks as investors consider whether U.S. government bonds pose a more attractive option to riskier equities.","“As yields go up, they start to be a little bit more competitive with risk assets and with stocks in particular,” said Katie Nixon, chief investment officer for the wealth management division of Northern Trust in Chicago.",Weeks of diplomatic progress were thrown into doubt when North Korea postponed high-level talks with Seoul and threatened to pull out of its historic meeting with the United States.,The uncertainty compounded investor jitters ahead of United States-China trade negotiations.,"“The general consensus seems to be we’ll come to some sort of trade agreement,” Carter said. “But it may be choppy until we get there.”","The Dow Jones Industrial Average .DJI rose 62.52 points, or 0.25 percent, to 24,768.93, the S&P 500 .SPX gained 11.01 points, or 0.41 percent, to 2,722.46, and the Nasdaq Composite .IXIC added 46.67 points, or 0.63 percent, to 7,398.30.","Of the 11 major sectors of the S&P 500, only rate-sensitive utilities .SPLRCU and real estate .SPLRCR stocks closed in negative territory.","The tech sector .SPLRCT rose 0.4 percent, and gave the S&P 500 its biggest boost among the major sectors.","Micron Technology Inc MU.O rose 4.6 percent after RBC Capital Markets initiated coverage of the chipmaker with an ""outperform"" rating. The Philadelphia SE semiconductor index .SOX was up 1.4 percent.","Facebook Inc FB.O shares were the biggest drag on the S&P 500, closing down 0.6 percent, on news that Chief Executive Mark Zuckerberg would appear before members of the European Parliament to answer questions about the improper use of users' data.","3M Co MMM.N weighed the most on the Dow, slipping 1.1 percent after Jefferies downgraded the stock to ""hold.""","Advancing issues outnumbered declining ones on the NYSE by a 1.92-to-1 ratio; on Nasdaq, a 1.95-to-1 ratio favored advancers.",The S&P 500 posted 15 new 52-week highs and three new lows; the Nasdaq Composite recorded 128 new highs and 48 new lows.,"Volume on U.S. exchanges was 6.22 billion shares, compared to the 6.66 billion average for the full session over the last 20 trading days."
44,https://www.reuters.com/article/us-equifax-cyber/equifax-provides-more-detail-to-congress-on-cyber-security-incident-idUSKBN1I903V,2018-05-08T15:03:43Z,Equifax provides more detail to Congress on cyber security incident,(Reuters) - Credit-monitoring firm Equifax Inc EFX.N said on Monday it has sent a letter to several U.S. Congressional committees providing additional details on data that was breached in a cybersecurity incident in September.,"Equifax said that about 38,000 driver's licenses and 3,200 passports details had been uploaded to the portal that had was hacked. (bit.ly/2jF3VTh)","Equifax said in September that hackers had stolen personally identifiable information of U.S., British and Canadian consumers.","The company confirmed that information on about 146.6 million names, 146.6 million dates of birth, 145.5 million social security numbers, 99 million address information and 209,000 payment card number and expiration date, were stolen in the cyber security incident."
45,https://www.reuters.com/article/brief-equifax-inc-submitted-statement-fo/brief-equifax-inc-submitted-statement-for-record-to-multiple-congressional-committees-regarding-cybersecurity-incident-announced-on-sept-7-2017-idUSFWN1SE130,2018-05-07T21:36:07Z,"BRIEF-Equifax Inc - Submitted Statement For Record To Multiple Congressional Committees Regarding Cybersecurity Incident Announced On Sept. 7, 2017",May 7 (Reuters) - Equifax Inc:,"* EQUIFAX INC - ON MAY 4, SUBMITTED STATEMENT FOR RECORD TO MULTIPLE CONGRESSIONAL COMMITTEES REGARDING CYBERSECURITY INCIDENT ANNOUNCED ON SEPT. 7, 2017",* EQUIFAX - STATEMENT SUBMITTED TO CONGRESSIONAL COMMITTEES PROVIDED ADDITIONAL DETAIL ON DATA ELEMENTS STOLEN IN CYBERSECURITY INCIDENT RELATED TO AFFECTED U.S. CONSUMERS,"* EQUIFAX - ADDITIONAL DETAIL PROVIDED IN STATEMENT DOES NOT IDENTIFY ADDITIONAL CONSUMERS AFFECTED, DOES NOT REQUIRE ADDITIONAL CONSUMER NOTIFICATIONS","* EQUIFAX INC - DETERMINED APPROXIMATE NUMBER OF VALID U.S. GOVERNMENT-ISSUED IDS UPLOADED TO DISPUTE PORTAL INCLUDE 38,000 DRIVER’S LICENSES","* EQUIFAX - APPROXIMATE NUMBER OF VALID U.S. GOVERNMENT-ISSUED IDS UPLOADED TO DISPUTE PORTAL INCLUDE 12,000 SOCIAL SECURITY/TAXPAYER ID CARDS, 3,200 PASSPORTS/PASSPORT CARDS Source text: (bit.ly/2K2rCA1) Further company coverage:"
46,https://www.reuters.com/article/brief-equifax-sets-quarterly-dividend-of/brief-equifax-sets-quarterly-dividend-of-0-39-per-share-idUSFWN1SA1BA,2018-05-03T16:39:23Z,BRIEF-Equifax Sets Quarterly Dividend Of $0.39 Per Share,May 3 (Reuters) - Equifax Inc:,* SETS QUARTERLY DIVIDEND OF $0.39 PER SHARE Source text for Eikon: Further company coverage:
47,https://www.reuters.com/article/brief-equifax-announces-preliminary-2018/brief-equifax-announces-preliminary-2018-annual-meeting-results-idUSFWN1SA165,2018-05-03T13:48:04Z,BRIEF-Equifax Announces Preliminary 2018 Annual Meeting Results,May 3 (Reuters) - Equifax Inc:,* SAYS PRELIM VOTING RESULTS FROM 2018 ANNUAL MEETING SHOW MAJORITY VOTES CAST IN FAVOR OF CO’S RECOMMENDATION TO RE-ELECT ALL BOARD MEMBERS,* SAYS SHAREHOLDER PROPOSAL REGARDING POLITICAL CONTRIBUTIONS DISCLOSURE DID NOT PASS AT ANNUAL MEETING Source text for Eikon: Further company coverage:
48,https://www.reuters.com/article/brief-equifax-reports-q1-adjusted-earnin/brief-equifax-reports-q1-adjusted-earnings-per-share-of-1-43-idUSFWN1S21A5,2018-04-25T20:24:04Z,BRIEF-Equifax Reports Q1 Adjusted Earnings Per Share Of $1.43,April 25 (Reuters) - Equifax Inc:,"* COMPANY REPORTED REVENUE OF $865.7 MILLION IN Q1 OF 2018, A 4 PERCENT INCREASE COMPARED TO Q1 OF 2017","* COMPANY REPORTED REVENUE OF $865.7 MILLION IN Q1 OF 2018, A 4 PERCENT INCREASE","* Q1 EARNINGS PER SHARE VIEW $1.37, REVENUE VIEW $854.7 MILLION -- THOMSON REUTERS I/B/E/S","* DURING Q1 ENDED MARCH 31, 2018, COMPANY RECORDED EXPENSES, NET OF INSURANCE RECOVERIES OF $68.7 MILLION RELATED TO CYBERSECURITY INCIDENT",* QTRLY ADJUSTED EPS EXCLUDES CYBERSECURITY INCIDENT RELATED COSTS,* “OUR Q1 OPERATING RESULTS WERE BETTER THAN EXPECTED”,"* DURING QUARTER, INVESTED “SIGNIFICANTLY” IN DATA SECURITY AND IT INFRASTRUCTURE ENHANCEMENTS","* EXECUTIVE SAYS “OVER COMING MONTHS, MY FOCUS WILL BE TO ACCELERATE INVESTMENTS TO ENHANCE OUR INFRASTRUCTURE AND DATA SECURITY” Source text for Eikon: Further company coverage:"
49,https://www.reuters.com/article/us-equifax-agm-iss-proxy/proxy-adviser-iss-recommends-against-five-equifax-directors-over-cyberbreach-idUSKBN1HL1CL,2018-04-15T14:50:08Z,Proxy adviser ISS recommends against five Equifax directors over cyberbreach,(Reuters) - Proxy adviser Institutional Shareholder Services on Saturday recommended investors vote against the re-election of five Equifax Inc EFX.N directors who served on the company's audit and technology committees prior to a 2017 data breach.,"The Atlanta-based consumer credit company last fall said hackers had stolen personally identifiable information of U.S., British and Canadian consumers, including names, Social Security numbers, birth dates, addresses, driver’s license and credit card numbers. Over time, Equifax has increased the number affected to more than 147 million people.","ISS said in a report to shareholders sent to Reuters by a spokesman that the company’s reputation and shareholder value had been damaged by the extent of the breach and the company’s slow response to it, placing a cloud over the company.","In response, it recommended against voting for directors Mark L. Feidler, G. Thomas Hough, John A. McKinley, Elane B. Stock and Mark B. Templeton, who served on the two committees with relevant oversight duties. It recommended votes in support of the remaining five director candidates at the company, including Siri S. Marshall, head of the governance committee.",An Equifax spokeswoman did not immediately respond to a request for comment on the recommendations.,"Equifax has said breach-related costs could reach $439 million through year-end, potentially making it the most costly U.S. hack yet disclosed. The company has lost 19 percent of its market value since the massive cybertheft was disclosed. Its shares traded at $116 on Friday. [L2N1QK1Q1]","The credit reporting company is facing 100s of lawsuits by consumers, financial institutions and even the city of Chicago relating to the cybersecurity breach. The company disputes the claims and has said it intends to defend against them.","ISS also recommended “cautionary support” for the company’s say-on-pay resolution, noting the compensation committee’s decision to not pay annual incentives, steps to adjust incentive metrics and strengthen clawback provisions. However, it said there are ongoing questions about former Chief Executive Richard F. Smith’s pay and “the issue warrants continued monitoring.”","It also recommended a vote in favor of a shareholder resolution seeking a report on political contributions by the company, saying holders would benefit from more disclosure of the company’s political spending, payments to trade groups, its management of related risks.",The company’s annual general meeting is scheduled for May 3.
