24,https://www.reuters.com/article/equifax-moves-tonybanks/moves-equifax-ropes-in-tony-banks-as-vice-president-of-uk-ireland-operations-idUSL3N21X2AF,2019-04-15T09:42:42Z,"MOVES-Equifax ropes in Tony Banks as vice president of UK, Ireland operations",April 15 (Reuters) - Credit reporting company Equifax Inc said on Monday it has appointed Tony Banks as vice-president of operations for the UK and Ireland.,Banks previously worked at the Royal Bank of Scotland Group PLC.,"He will be based in London, and report to Patricio Remón, President for Europe at Equifax."
25,https://www.reuters.com/article/us-equifax-cyber/canadian-regulator-says-equifax-fell-short-of-privacy-compliance-idUSKCN1RL2HK,2019-04-09T18:39:24Z,Canadian regulator says Equifax fell short of privacy compliance,"(Reuters) - Equifax Inc and its Canadian unit fell far short of their privacy obligations, a Canadian federal agency said on Tuesday following an investigation into the 2017 data breach at the credit reporting company.","The agency, which is charged with protecting privacy rights of individuals, noted that poor security safeguards worsened the impact of the global cyber attack here that affected more than 143 million people worldwide, including 19,000 Canadians.","“Given the vast amounts of highly sensitive personal information Equifax holds...it was completely unacceptable to find such significant shortcomings in the company’s privacy and security practices,” said Daniel Therrien, the privacy commissioner of Canada.",The agency said Equifax Canada has entered into a compliance agreement to address these concerns and will submit third-party audit reports on its own security and that of its parent to the OPC every two years for the next six years.,"This will allow ongoing monitoring of compliance with Canada’s federal private sector privacy law, including assessing the steps taken by Equifax since the breach, OPC said in a statement."
26,https://www.reuters.com/article/uk-equifax-cyber/equifax-says-us-regulators-seek-damages-related-to-2017-breach-idUSKCN1QB24R,2019-02-22T18:44:19Z,Equifax says US regulators seek damages related to 2017 breach,(Reuters) - Credit reporting company Equifax Inc said it was informed by several U.S. regulators that they intend to seek damages from the company related to the cybersecurity breach of 2017 that exposed personal information of nearly 145 million people.,"The company has received legal notices from the Federal Trade Commission, Consumer Financial Protection Bureau and the New York Department of Financial Services, it said in a filing on Thursday.","The United States Securities and Exchange commission had also issued a subpoena on May 14, 2018, regarding disclosure issues relating to the data breach, while the Office of the Privacy Commissioner of Canada has informed Equifax it intends to “make certain findings and recommendation” related to the incident.","The company has been named in 19 class action lawsuits in courts across the country, it said, and has spent hundreds of millions of dollars since disclosing the breach.","Regulators in the UK and Australia have also fined the company for the breach that saw personal information such as Social Security numbers, birth dates and addresses of millions of people being stolen by hackers.","Equifax first disclosed in September 2017 that it had been the target of a massive data breach, mostly in the United States."
27,https://www.reuters.com/article/equifax-breach-lawsuit/equifax-must-face-lawsuits-over-massive-data-breach-ruling-idUSL1N1ZT255,2019-01-29T22:38:33Z,Equifax must face lawsuits over massive data breach-ruling,"Two consolidated class actions filed against credit bureau Equifax over a 2017 security breach that exposed the data of nearly 150 million consumers can go forward, a federal judge in Atlanta ruled on Monday.","The decision by U.S. District Judge Thomas Thrash allows consumers and financial institutions to proceed with their separate lawsuits over the breach, one of the largest in U.S. history, although parts of each lawsuit were dismissed.","To read the full story on WestlawNext Practitioner Insights, click here: bit.ly/2HFjYz5"
28,https://www.reuters.com/article/otc-equifax-frankel/equifax-data-breach-judge-rejects-blame-other-hacks-defense-idUSKCN1PN2TJ,2019-01-29T21:19:38Z,Equifax data breach judge rejects ‘blame other hacks’ defense,"(Reuters) - My parents have four dogs who cannot resist pie. Last Thanksgiving, I made the mistake of leaving a baked-from-scratch pumpkin pie in the middle of the kitchen table while the family ate dinner in the dining room. When we went to fetch dessert from the kitchen, the pie was gone. All of the dogs had access. All of them have criminal intent when it comes to pumpkin pie. Obviously, at least one of them (and probably more than one) stole it. But we couldn’t yell at any of the dogs for pie-snatching because we couldn’t know for sure which of them was responsible. That’s just common sense, right? You can’t hold a dog responsible for wrongdoing unless you’re sure the dog has, in fact, caused harm.","What works for pie-thieving dogs does not, however, work for data breach defendants. On Monday, U.S. District Judge Thomas Thrash of Atlanta became the latest judge to reject defense arguments that Americans’ personal information has been exposed in so many different data breaches that it’s impossible to hold any particular corporation responsible for harm to any particular plaintiff. Thrash, who is overseeing multidistrict litigation against Equifax for the 2017 infiltration in which hackers stole the personal information of nearly 148 million (!) Americans, denied the company’s motion to dismiss a class action by consumers who claim to have been victimized.",Want more On the Case? Listen to the On the Case podcast.,"Equifax’s lawyers at King & Spalding actually based their argument on statistics included in a complaint by a separate class of financial institutions suing the credit reporting company over the 2017 breach. The banks’ complaint, citing a 2017 report by the Identity Theft Resource Center, said there were a record-setting 1,579 data breaches in 2017, exposing more than 178.93 billion records. The banks cited the stat to argue that Equifax should have been more careful to protect confidential data, given the prevalence of hacks and identity theft. Equifax’s lawyers attempted to turn the information to their advantage, claiming that consumers in the class action can’t prove their confidential data wasn’t compromised in some other data hack.","“Certainly, no individual plaintiff has alleged (or could allege) facts tying any actual harm to the Equifax breach,” the dismissal motion said. “Importantly, no plaintiff alleges that her (personal identifying information) was not stolen in other data breaches. Given how often data breaches occur, plaintiffs’ attempt to blame Equifax is guesswork at best.” Without tying specific harms to the theft of information from Equifax, the company argued, consumers can’t claim negligence because they can’t establish proximate cause.","Judge Thrash was having none of it. He held it’s enough for plaintiffs to allege, at this stage of the case, that their personal information was exposed in the Equifax hack and that they’ve suffered some form of identity theft or identity fraud. “The plaintiffs need not explicitly state that other breaches did not cause these alleged injuries, since their allegations that this data breach did cause their injuries implies such an allegation,” the judge wrote.","More broadly, he said, it’s just misguided to conclude that no defendant can be liable because others have committed the same alleged wrongdoing. “Allowing the defendants to rely on other data breaches to defeat a causal connection would ‘create a perverse incentive for companies: So long as enough data breaches take place, individual companies will never be found liable,’” Thrash wrote. “The court declines to create such a perverse incentive.”","Judge Thrash’s opinion cited two rulings by U.S. District Judge Lucy Koh of San Jose in previous data breach class actions against Yahoo and Anthem. In both cases, defense lawyers argued that consumers didn’t have standing to sue because they couldn’t trace their alleged injuries back to specific hacks. Judge Koh had no more patience for those arguments than Judge Thrash. Her most extensive discussion was in the Anthem class action, in which she coined the “perverse incentive” phrase. Judge Koh pointed out that the 7th U.S. Circuit Court of Appeals considered – and dismissed – a similar “you can’t blame anyone when everyone could be liable” argument in its landmark 2015 ruling in Remijas v. Neiman Marcus, the first decision to hold that hacking victims have standing because of the mere threat of identity theft. The 7th Circuit, Judge Koh said, said that under the common law of torts, defendants claiming someone else could be responsible for their alleged negligence bear the burden of proving it. “No court,” Judge Koh said in her Anthem opinion, “has ever accepted the Anthem defendants' argument in the data breach context.”","When Yahoo’s lawyers nevertheless tried the same play, Judge Koh smacked them down: “Again, the court is not persuaded by defendants' arguments,” she wrote in a 2017 opinion. “Plaintiffs have plausibly alleged that plaintiffs had accounts with Yahoo, that plaintiffs' account information was accessed in the data breaches, and that hackers used plaintiffs' account information to gain access to plaintiffs' Yahoo email accounts … the existence of other potential data breaches or causes for plaintiffs' injuries does not defeat plaintiffs' standing to sue defendants.”","I suppose Equifax could try to revive its proximate cause arguments later in the case, in a summary judgment motion or in opposition to class certification. But at the dismissal stage, it’s becoming clear that judges are not willing to let specific defendants off the hook because others have been just as allegedly negligent."
29,https://www.reuters.com/article/equifax-breach-block/plaintiffs-fight-separate-track-by-short-seller-in-equifax-mdl-idUSL2N1XO1Z5,2018-11-13T22:04:13Z,Plaintiffs fight separate track by short seller in Equifax MDL,Lead plaintiffs in multidistrict litigation over a 2017 Equifax data breach have asked the judge overseeing the litigation against the credit bureau to reject a bid by well-known short seller Carson Block to take separate discovery to pursue claims against Equifax managers.,"In a motion on Monday in Atlanta federal court, the lead plaintiffs said Block’s bid is a “naked attempt to circumvent the MDL process” and would unnecessarily complicate the litigation, which includes more than 400 lawsuits. Suing individual defendants is not sound legal strategy because consumers can recover damages more efficiently from Equifax itself, the consumers’ lead plaintiffs’ said.","To read the full story on WestlawNext Practitioner Insights, click here: bit.ly/2DlrlIr"
30,https://www.reuters.com/article/equifax-cyber-insidertrading/update-1-former-equifax-manager-sentenced-in-insider-trading-case-idUSL2N1WW1WT,2018-10-16T21:33:04Z,UPDATE 1-Former Equifax manager sentenced in insider trading case,"(Updates to show change in DoJ statement from “restitution” to “forfeiture”; Adds details, background)",Oct 16 (Reuters) - A former Equifax Inc manager was sentenced to eight months of home confinement over insider trading charges related to last year’s data breach at the credit monitoring firm.,"Sudhakar Reddy Bonthu, 44, a former software product development manager at Equifax, pleaded guilty in July to charges he bought and sold stock options before the company announced the massive data breach in September 2017.","Bonthu knew by Aug. 30, 2017 that information from about 100 million individuals had been exposed and that the company planned to publicly disclose the breach in early September, the government said in July.","Using the information, Bonthu bought put options in Equifax stock and made a profit of more than $75,000 after the company’s shares dropped following the announcement, according to charging documents.","U.S. District Court Judge Amy Totenberg on Tuesday ordered Bonthu to forfeit $75,979 and also pay a $50,000 fine.","“He’s relieved to have this ordeal over,” said Meg Strickler, a lawyer for Bonthu.","The breach gave hackers access to names, Social Security numbers, birthdates and addresses for millions of people."
31,https://www.reuters.com/article/us-equifax-cyber-insidertrading/former-equifax-manager-sentenced-in-insider-trading-case-idUSKCN1MQ2VI,2018-10-16T21:01:50Z,Former Equifax manager sentenced in insider trading case,"NEW YORK (Reuters) - A former Equifax Inc EFX.N manager was sentenced to eight months of home confinement and $125,979 in fines and restitution on Tuesday, over insider trading charges related to last year's data breach at the credit monitoring firm.","U.S. District Court Judge Amy Totenberg issued the sentence in Atlanta federal court to Sudhakar Reddy Bonthu, 44, the U.S. Justice Department said in a press release. He had pleaded guilty in July to charges he bought and sold Equifax stock options before Equifax’s massive data breach was announced in September 2017."
32,https://www.reuters.com/article/equifax-breach-dismiss/banks-tell-court-equifax-liable-for-increased-fraud-risks-idUSL2N1W71Q5,2018-09-21T21:24:36Z,Banks tell court Equifax liable for increased fraud risks,"Banks and credit unions have challenged Equifax’s bid to dismiss their lawsuit over last year’s data breach, arguing in federal court on Thursday that the credit bureau is responsible for increased risks of banking fraud and damage to the entire credit reporting system.","The hacking of Equifax’s systems was “arguably the most damaging data breach in the nation’s history,” the financial institutions said in a filing in multidistrict litigation in Atlanta federal court. “Each plaintiff has already spent time and money to mitigate what experts universally acknowledge is a substantial risk of future fraudulent banking activity.”","To read the full story on WestlawNext Practitioner Insights, click here: bit.ly/2NvKAFs"
33,https://www.reuters.com/article/us-equifax-cyber/uk-regulator-fines-equifax-ltd-500000-pounds-for-2017-security-breach-idUSKCN1LZ311,2018-09-20T01:04:46Z,"UK regulator fines Equifax Ltd 500,000 pounds for 2017 security breach","(Reuters) - A British regulator on Thursday fined credit reference company Equifax Inc’s UK arm, Equifax Ltd, 500,000 pounds for failing to protect the personal information of up to 15 million people in Britain during a 2017 cyber attack.","The Information Commissioner’s Office (ICO) said in a statement its investigation found that although Equifax systems in the United States were compromised, Equifax Ltd was responsible for the personal information of its customers in Britain.",Equifax said its UK office received the Monetary Penalty Notice from the ICO on Wednesday and was evaluating the notice and its response.,Equifax added that it cooperated fully throughout the investigation.,"The cyber attack, which took place between May 13 and July 30, 2017, affected 146 million Equifax customers globally, the ICO said. bit.ly/2xv5cTk","The British arm of the company failed to take appropriate steps to ensure its American parent company, Equifax Inc, which was processing the data on its behalf, was protecting the information, the ICO said.","It said the investigation, carried out in parallel with the Financial Conduct Authority, revealed multiple failures at the company, which led to personal information being retained for longer than necessary and vulnerable to unauthorized access.","The personal information lost or compromised ranged from names and dates of birth to addresses, passwords, driving license and financial details.","Equifax contravened five out of eight data protection principles of the Data Protection Act 1998, including failure to secure personal data, poor retention practices and lack of legal basis for international transfers of UK citizens’ data, the ICO said.","The ICO found that measures that should have been in place to manage the personal information were inadequate and ineffective. Investigators found significant problems with data retention, IT system patching and audit procedures.","The investigation also found that the U.S. Department of Homeland Security had warned Equifax about a critical vulnerability as far back as March 2017 and that sufficient steps to address the vulnerability were not taken, the ICO said.","As a credit reporting agency, Equifax keeps vast amounts of consumer data for banks and other creditors to use to determine the chances of their customers’ defaulting.","Equifax first disclosed in September 2017 that it had been the target of a massive data breach, mostly in the United States."
34,https://www.reuters.com/article/equifax-cyber/rpt-uk-regulator-fines-equifax-ltd-500000-pounds-for-2017-security-breach-idUSL8N1W56GV,2018-09-19T23:49:34Z,"RPT-UK regulator fines Equifax Ltd 500,000 pounds for 2017 security breach",(Repeats to widen distribution to certain clients),"Sept 20 (Reuters) - A British regulator on Thursday fined credit reference company Equifax Inc’s UK arm Equifax Ltd 500,000 pounds for failing to protect the personal information of up to 15 million people in Britain during a 2017 cyber attack.","The Information Commissioner’s Office (ICO) said in a statement its investigation found that, although Equifax systems in the United States were compromised, Equifax Ltd was responsible for the personal information of its customers in Britain.",Equifax did not immediately respond to a request for comment on the fine outside regular business hours.,"The cyber attack, which took place between May 13 and July 30 2017 affected 146 million Equifax customers globally, the ICO said. bit.ly/2xv5cTk","The British arm of the company failed to take appropriate steps to ensure its American parent company Equifax Inc, which was processing the data on its behalf, was protecting the information, ICO said.","It said the investigation, carried out in parallel with the Financial Conduct Authority, revealed multiple failures at the company, which led to personal information being retained for longer than necessary and vulnerable to unauthorised access. (Reporting by Rishika Chatterjee in Bengaluru; editing by Grant McCool)"
35,https://www.reuters.com/article/equifax-cyber/uk-regulator-fines-equifax-ltd-500000-pounds-for-2017-security-breach-idUSL3N1W563Z,2018-09-19T23:47:49Z,"UK regulator fines Equifax Ltd 500,000 pounds for 2017 security breach","Sept 20 (Reuters) - A British regulator on Thursday fined credit reference company Equifax Inc’s UK arm Equifax Ltd 500,000 pounds for failing to protect the personal information of up to 15 million people in Britain during a 2017 cyber attack.","The Information Commissioner’s Office (ICO) said in a statement its investigation found that, although Equifax systems in the United States were compromised, Equifax Ltd was responsible for the personal information of its customers in Britain.",Equifax did not immediately respond to a request for comment on the fine outside regular business hours.,"The cyber attack, which took place between May 13 and July 30 2017 affected 146 million Equifax customers globally, the ICO said. bit.ly/2xv5cTk","The British arm of the company failed to take appropriate steps to ensure its American parent company Equifax Inc, which was processing the data on its behalf, was protecting the information, ICO said.","It said the investigation, carried out in parallel with the Financial Conduct Authority, revealed multiple failures at the company, which led to personal information being retained for longer than necessary and vulnerable to unauthorised access. (Reporting by Rishika Chatterjee in Bengaluru; editing by Grant McCool)"
36,https://www.reuters.com/article/us-equifax-cyber-insidertrading/former-equifax-employee-pleads-guilty-to-insider-trading-idUSKBN1KD2E7,2018-07-24T01:17:46Z,Former Equifax employee pleads guilty to insider trading,(Reuters) - A former Equifax Inc employee pleaded guilty on Monday to having engaged in insider trading before the credit reporting company last year disclosed a cyber attack that exposed the personal data of about 148 million people.,"Sudhakar Reddy Bonthu, a former software development manager who was involved in assisting in Equifax’s response to the breach, pleaded guilty in federal court in Atlanta to a single insider trading count, prosecutors said.","Bonthu, 44, is one two former Equifax employees who federal prosecutors have accused of seeking to profit by trading on confidential information related to the cyber attack before the company disclosed the data breach last September.","Meg Strickler, his lawyer, confirmed Bonthu’s plea but had no other immediate comment. He is scheduled to be sentenced on Oct. 18.","Equifax fired Bonthu in March after he refused to cooperate with an internal investigation, according to the U.S. Securities and Exchange Commission, which has reached a related settlement with him. Equifax has said it was cooperating with authorities.","From May to July 2017, hackers gained access to Equifax databases, allowing them to acquire the names, Social Security numbers, birthdates and addresses for millions of people, according to the government.","Atlanta-based Equifax began investigating the breach in July 2017 after discovering the suspicious activity, and by August had determined that consumers’ data had likely been stolen, prosecutors alleged.","According to prosecutors, on Aug. 25, 2017, Bonthu, who belonged to an Equifax unit that developed security products for clients, was assigned with other employees to help respond to the breach, though he was not told Equifax itself was breached.","According to prosecutors, by Aug. 30, 2017, Bonthu knew that information from at least 100 million individuals had been exposed due to the breach.","The next day, he received an email with a file attached that included Equifax’s stock ticker symbol in its name, prosecutors said.","After determining that Equifax had been breached, Bonthu bought put options in its stock using his wife’s brokerage account prior to the announcement, allowing him to profit when the company’s stock price dropped, according to prosecutors.","Equifax disclosed the breach on Sept. 7, 2017, after the market closed. Its stock price dropped the next day, and Bonthu made a profit of more than $75,000, according to charging documents.","A separate insider trading case remains pending against Jun Ying, a former Equifax technology executive. He has pleaded not guilty."
37,https://www.reuters.com/article/equifax-errors-lawsuit/lawsuit-alleges-equifax-misreports-consumers-paid-off-accounts-idUSL1N1U6202,2018-07-10T21:56:21Z,Lawsuit alleges Equifax misreports consumers' paid-off accounts,"The lawsuit filed on Monday in Los Angeles federal court accused the credit bureau of violating the U.S. Fair Credit Reporting Act by failing to take reasonable steps to assure that its consumer reports were accurate. As many as thousands of consumers may have been affected by the errors, the lawsuit said.","To read the full story on WestlawNext Practitioner Insights, click here: bit.ly/2J8QGEt"
