33,https://www.reuters.com/article/icici-bank-results/update-2-icici-bank-posts-smallest-quarterly-profit-in-2-yrs-on-bad-loan-surge-idUSL3N1SE46B,2018-05-07T15:12:12Z,UPDATE 2-ICICI Bank posts smallest quarterly profit in 2 yrs on bad loan surge,* Net profit 10.2 bln rupees vs 10.77 bln rupees forecast,* Bad loans rise after central bank rule tightening,"* Aims to lower net NPA ratio to 1.5 pct by March 2020 (Adds CEO comments, outlook)","MUMBAI, May 7 (Reuters) - India’s ICICI Bank reported its smallest quarterly profit in two years on Monday as stricter central bank rules forced the country’s third-biggest lender by assets to account for more bad loans.","Net profit for its fiscal fourth quarter to March 31 almost halved to 10.2 billion rupees ($152 million), the bank said, missing analysts’ average forecast of 10.77 billion rupees.","While the bulk of the country’s 9.5 trillion rupees of bad loans, as of the end of 2017, were with the country’s dominant state-run banks, private sector lenders ICICI Bank and smaller rival Axis Bank also accounted for large chunks.","The central bank in February did away with half a dozen loan restructuring schemes in a surprise move to hasten a clean-up of near-record levels of soured loans and tightened some other rules, which has led to banks disclosing more bad loans in the March quarter.",ICICI’s long-serving Chief Executive Chanda Kochhar has also been battling allegations of nepotism in a loan the bank gave to the Videocon conglomerate.,"The board of ICICI Bank, which is also listed in New York , has backed Kochhar and denied any wrongdoing.","Responding to repeated questions from journalists on the Videocon case, Kochhar said on a conference call after the earnings announcement that she had nothing more to add to the board’s existing public stance.","On bad loans, she said the focus was turning to recovery and resolution and the bank would aim to lower its net non-performing loan ratio to 1.5 percent in two years from 4.77 percent at the end of March.","“We believe that since a lot of the stress has already been recognised, going forward, in fact, our focus will be on recovery and resolution,” Kochhar said.","She outlined other medium-term goals for the bank such as growing retail loans to more than 60 percent of total loans, bringing down overseas loans to less than 10 percent, and boosting the provision coverage ratio of the bank to 70 percent by March 2020.","The new central bank rules led to 99.68 billion rupees of bad loans being added to its pile in the March quarter, ICICI Bank said. Including other bad loans, the gross non-performing loan ratio shot up to 8.84 percent from 7.82 percent at the end of December.","Domestic loans were up 15 percent year-on-year at the end of March, and Kochhar said the aim would be to increase the overall domestic loan book by 15 percent a year, with retail loans growing at above 20 percent until March 2020.","Ahead of the results, ICICI Bank shares closed 2.5 percent higher, outperforming the main Mumbai market index which gained 0.9 percent.",Axis Bank posted its first ever quarterly loss last month as its bad loans surged. Major state-run lenders are due to report March quarter earnings later this month.
34,https://www.reuters.com/article/brief-icici-bank-ceo-a-lot-of-stressed-l/brief-icici-bank-ceo-a-lot-of-stressed-loans-recognised-already-focus-on-resolution-idUSI8N1D301L,2018-05-07T13:19:35Z,"BRIEF-ICICI Bank CEO: A Lot of Stressed Loans Recognised Already, Focus On Resolution",May 7 (Reuters) - ICICI Bank Ltd Chief Executive Chanda Kochhar On Earnings Call:,* BOARD WILL MEET ON TUESDAY FOR STRATEGY AND BUDGET PLANNING,* BOARD DID NOT DISCUSS VIDEOCON LOAN ISSUE IN MONDAY’S MEETING,"* TOTAL EXPOSURE TO BORROWERS SENT TO BANKRUPTCY COURT ABOUT 152 BILLION RUPEES, HAVE 50 PERCENT PROVISION COVER ON THOSE LOANS",* GOVERNMENT NOMINEE DIRECTOR ON BOARD WAS NOT ABLE TO ATTEND MONDAY’S MEETING Further company coverage: (Mumbai Newsroom)
35,https://www.reuters.com/article/brief-indias-icici-bank-march-qtr-net-pr/brief-indias-icici-bank-march-qtr-net-profit-nearly-halves-idUSFWN1SE0PV,2018-05-07T12:37:30Z,BRIEF-India's ICICI Bank March-Qtr Net Profit Nearly Halves,May 7 (Reuters) - ICICI Bank Ltd:,* MARCH QUARTER NET PROFIT 10.20 BILLION RUPEES VERSUS PROFIT OF 20.25 BILLION RUPEES LAST YEAR,* CONSENSUS FORECAST FOR MARCH QUARTER PROFIT WAS 10.77 BILLION RUPEES,* MARCH QUARTER INTEREST EARNED 142.64 BILLION RUPEES VERSUS 135.69 BILLION RUPEES LAST YEAR,* MARCH QUARTER PROVISIONS AND CONTINGENCIES 66.26 BILLION RUPEES VERSUS 28.98 BILLION RUPEES LAST YEAR,* MARCH QUARTER GROSS NPA 8.84 PERCENT VERSUS 7.82 PERCENT PREVIOUS QUARTER,* MARCH QUARTER NET NPA 4.77 PERCENT VERSUS 4.20 PERCENT PREVIOUS QUARTER,* SAYS DOMESTIC NET INTEREST MARGIN WAS 3.67 PERCENT AND THE OVERALL NET INTEREST MARGIN WAS 3.24 PERCENT IN Q4-2018,* SAYS RECOVERIES AND UPGRADES FROM NON-PERFORMING LOANS WERE 42.34 BILLION RUPEES IN Q4-2018,* BOARD APPROVED SEEKING CONSENT TO INVITE SUBSCRIPTION FOR NCDS OR BONDS ON PRIVATE PLACEMENT BASIS FOR UP TO 250 BILLION RUPEES,"* SAYS CO’S DRILLDOWN LIST DECREASED FROM 440.65 BILLION RUPEES AT MARCH 31, 2016 TO 47.28 BILLION RUPEES AT MARCH 31, 2018","* DURING Q4, MADE PROVISION FOR CERTAIN FRAUD AND NON-PERFORMING CASES BY DEBITING RESERVES AND SURPLUS AMOUNTING TO 199.8 MILLION RUPEES",* CLASSIFIED 3 BORROWER ACCOUNTS IN GEMS & JEWELLERY SECTOR WITH FUND-BASED OUTSTANDING OF 7.95 BILLION RUPEES AS FRAUD AND NON PERFORMING,"* DURING Q4 MADE PROVISION OF 2.89 BILLION RUPEES VIA PROFIT & LOSS ACCOUNT, 5.05 BILLION RUPEES BY DEBITING RESERVES & SURPLUS, AS PERMITTED BY RBI","* PROVISION MADE BY DEBITING RESERVES, SURPLUS WILL BE REVERSED, ACCOUNTED VIA P&L ACCOUNT OVER SUBSEQUENT QTRS OF FY 2019 Source text: bit.ly/2rqvzHU Further company coverage:"
36,https://www.reuters.com/article/icici-bank-results/indias-icici-bank-q4-profit-dives-50-pct-bad-loan-provisions-surge-idUSL3N1SE45S,2018-05-07T12:28:04Z,"India's ICICI Bank Q4 profit dives 50 pct, bad loan provisions surge","May 7 (Reuters) - ICICI Bank Ltd, India’s third-largest lender by assets, posted a near 50 percent drop in its fourth-quarter net profit as its provisions for bad loans surged.","Net profit for the three months to March 31 fell to 10.20 billion rupees ($151.94 million) from 20.25 billion rupees a year earlier, the bank said in a statement here on Monday.","Twelve analysts on average had expected the company to post a net profit of 10.77 billion rupees, according to Thomson Reuters data.","Gross bad loans as a percentage of total loans was 8.84 percent at the end of March, compared with 7.82 percent at the end of the previous quarter and 7.89 percent a year earlier. ($1 = 67.1300 Indian rupees) (Reporting by Vishal Sridhar in Bengaluru)"
37,https://www.reuters.com/article/brief-gujarat-fluorochemicals-says-icici/brief-gujarat-fluorochemicals-says-icici-bank-carved-out-bank-guarantee-limits-of-co-for-up-to-600-mln-rupees-idUSFWN1S30H1,2018-04-26T07:22:47Z,BRIEF-Gujarat Fluorochemicals Says ICICI Bank Carved Out Bank Guarantee Limits Of Co For Up to 600 Mln Rupees,April 26 (Reuters) - Gujarat Fluorochemicals Ltd:,"* ICICI BANK CARVED OUT BANK GUARANTEE LIMITS FOR UPTO 600 MILLION RUPEES, OUT OF EXISTING CAPITAL FACILITIES SANCTIONED TO CO",* ISSUED 4 PERFORMANCE BANK GUARANTEES OF 100 MILLION RUPEES EACH ON BEHALF OF ITS UNITS IN FAVOUR OF SOLAR ENERGY CORP Source text: bit.ly/2HybnKk Further company coverage:
38,https://www.reuters.com/article/brief-icici-bank-says-co-responded-to-se/brief-icici-bank-says-co-responded-to-sebi-on-clarification-of-news-reports-idUSFWN1RT030,2018-04-16T05:15:04Z,BRIEF-ICICI Bank Says Co Responded To SEBI On Clarification Of News Reports,April 16 (Reuters) - ICICI Bank Ltd:,* SAYS CO RESPONDED TO SEBI on CLARIFICATION OF NEWS REPORTS Source text - bit.ly/2qzVATP Further company coverage:
