17,https://www.reuters.com/article/icici-bank-results/update-1-indias-icici-bank-q2-profit-halves-but-asset-quality-improves-idUSL3N1X64EA,2018-10-26T12:28:21Z,"UPDATE 1-India's ICICI Bank Q2 profit halves, but asset quality improves","(Adds bad loan additions, background on CEO)","Oct 26 (Reuters) - India’s ICICI Bank reported on Friday a bigger than expected 56 percent decline in second-quarter net profit, as expenses increased, but the lender’s bad loan ratio improved.","India’s third-largest bank by assets said net profit came in at 9.09 billion rupees ($124 million) for the three months ended Sept. 30, compared with 20.58 billion rupees a year earlier.","Analysts had forecast a second-quarter profit of 9.98 billion rupees, according to Refinitiv data.","Still, the bank’s performance was better than the first quarter when it made a quarterly loss for the first time in at least 16 years due to higher provisions.",ICICI said second-quarter profit was partly hit by a 10.6 percent rise in operating expenses to 43.24 billion rupees.,"The bank is facing a change of its top management after Chief Executive Officer Chanda Kochhar resigned this month after being mired in allegations of nepotism. Kochhar will be replaced by Sandeep Bakhshi, the former head of ICICI’s life insurance arm.","Gross bad loans as a percentage of total loans fell to 8.54 percent by the end of September 2018, from 8.81 percent in the previous quarter, but that was still higher than 7.87 percent in the same period a year ago.","Bad loan additions of 31.17 billion rupees in the second quarter, were down from 40.36 billion in the June quarter.",Provisions fell 10.5 percent to 39.94 billion rupees.
18,https://www.reuters.com/article/icici-bank-results/indias-icici-bank-q2-profit-halves-misses-estimates-idUSL3N1X648M,2018-10-26T11:30:12Z,"India's ICICI Bank Q2 profit halves, misses estimates","Oct 26 (Reuters) - ICICI Bank, reported on Friday a 55.8 percent fall in second-quarter net profit, which missed analysts’ estimates, as expenses climbed.","Net profit came in at 9.09 billion rupees ($123.84 million) in the three months ended Sept. 30, compared with 20.58 billion rupees a year earlier, the private-sector bank said here on Friday.","Analysts on average had expected a net profit of 9.98 billion rupees, according to Refinitiv data.","Gross bad loans as a percentage of total loans stood at 8.54 percent at September-end, compared with 8.81 percent in the previous quarter and 7.87 percent in the same period a year ago."
19,https://www.reuters.com/article/us-icici-bank-ceo/icicis-scandal-hit-kochhar-quits-as-ceo-bakhshi-gets-top-job-idUSKCN1ME0XT,2018-10-04T11:30:15Z,"ICICI's scandal-hit Kochhar quits as CEO, Bakhshi gets top job","MUMBAI/BENGALURU (Reuters) - ICICI Bank Ltd ICBK.NS chief Chanda Kochhar, who has been mired in controversy for months, resigned on Thursday after seeking an early retirement and will be replaced by Sandeep Bakhshi, the Indian private lender said.","Kochhar is the third high-profile woman banker in India to step down in recent months, following Arundhati Bhattacharya who retired from the State Bank of India SBI.NS a year ago and Shikha Sharma who is set to exit after almost ten years atop Axis Bank AXBK.NS in December.","Her exit also comes at a time when the banking regulator, the Reserve Bank of India (RBI), is driving a push for better governance and leadership changes at lenders that have racked up some $150 billion in bad loans.","“There is now additional pressure from RBI to show that banks are better governed,” said Shriram Subramanian, founder of proxy advisory firm InGovern.","ICICI has been in the grips of a controversy for months over allegations that Kochhar had favored Videocon VEDI.NS, a consumer electronics and oil and gas exploration company, in the bank's lending practices. Videocon's founders had an investment in a renewable energy company founded by Kochhar's husband.","Bakhshi, the former head of ICICI’s life insurance arm, took the helm of the bank on an interim basis in June, after Kochhar went on leave pending the completion of a probe into the alleged conflict of interest.","The bank said the “inquiry instituted by the board will remain unaffected” by Kochhar’s exit, adding that some of her benefits would be subject to the outcome of the probe.","The board had initially backed Kochhar, calling the nepotism allegations against her “malicious and unfounded”, but later instituted the probe into the matter in June.",ICICI shares rallied as much as 5.8 percent after Bakhshi was confirmed as CEO for a five-year term on Thursday.,"“This removes the element of uncertainty and will be positive for the stock,” R. Sreesankar, co-head, institutional equities at Indian brokerage firm Prabhudas Lilladher, said.","Kochhar, 56, had headed ICICI, India’s third-largest lender by assets, since May 2009. She is also stepping down from the board of directors of the bank’s units, ICICI said."
20,https://www.reuters.com/article/icici-bank-ceo/indias-icici-bank-names-sandeep-bakhshi-as-ceo-kochhar-to-retire-idUSL4N1WK22Q,2018-10-04T08:31:08Z,"India's ICICI Bank names Sandeep Bakhshi as CEO, Kochhar to retire","Oct 4 (Reuters) - ICICI Bank Ltd said on Thursday it has appointed Sandeep Bakhshi as Chief Executive Officer to replace Chanda Kochhar, who has requested early retirement from the bank.","Kochhar will also relinquish office from the Board of Directors of the bank's units, it said in a statement here.",Shares in ICICI rose as much as 5.8 percent following the announcement. (Reporting by Krishna V Kurup in Bengaluru Editing by Euan Rocha)
21,https://www.reuters.com/article/india-stocks/indian-shares-snap-4-sessions-of-gains-icici-bank-top-drag-idUSB8N1V502V,2018-08-24T10:25:53Z,Indian shares snap 4 sessions of gains; ICICI Bank top drag,* Both indexes close 0.22 pct lower,* Both post 5th straight weekly gain,"Aug 24 (Reuters) - Indian shares closed lower on Friday after four straight sessions of gains, as investors took a breather following a record-setting spree.",Financial and consumer stocks were among the top losers with ICICI Bank shedding 2.1 percent and Yes Bank down 3.7 percent.,"The benchmark BSE index fell 0.22 percent to 38,251.80, but ended the week 0.8 percent higher.","The broader NSE index declined 0.22 percent to 11,557.10, but posted a weekly gain of 0.75 percent.",Both indexes posted their fifth consecutive weekly gain.,"For midday report, click (Reporting by Tanvi Mehta in Bengaluru; Editing by Subhranshu Sahu)"
22,https://www.reuters.com/article/india-stocks/indian-shares-mark-record-close-bse-index-settles-above-38000-idUSB8N1TR02N,2018-08-09T10:23:30Z,"Indian shares mark record close; BSE index settles above 38,000","* NSE index up 0.18 pct, BSE index up 0.36 pct",* ICICI Bank top gainer on NSE Index,"Aug 9 (Reuters) - Indian shares ended at record closing highs on Thursday, driven by strong gains in financial stocks such as ICICI Bank Ltd and Axis Bank Ltd.","The benchmark BSE index closed up 0.36 percent to 38024.37, a record high, while the broader NSE index ended 0.18 percent higher at 11470.7, its highest ever.","India’s third-biggest lender by assets, ICICI Bank ended 4.8 percent higher at 333.95 rupees, while Axis Bank rose 4.35 percent to 622.2 rupees.","For midday report, click (Reporting by Abinaya Vijayaraghavan in Bengaluru; Editing by Vyas Mohan)"
23,https://www.reuters.com/article/icici-bank-results/update-2-bad-loans-and-bond-provisions-tip-indias-icici-bank-into-loss-idUSL4N1UN4AQ,2018-07-27T14:07:53Z,UPDATE 2-Bad loans and bond provisions tip India's ICICI Bank into loss,* Q1 net loss of 1.2 bln rupees,"* NPLs, bankruptcy cases led to additional provisions","* Long-serving CEO Kochhar on leave over alleged nepotism charges (Adds more details, Bank of Baroda results)","BENGALURU/NEW DELHI, July 27 (Reuters) - ICICI Bank Ltd , the third-biggest Indian lender by assets, reported its first quarterly net loss in at least 16 years, hurt by higher provisions for bad loans and bond losses.","The results come amid uncertainty about the bank’s long-serving Chief Executive Chanda Kochhar, who is on leave pending the completion of a probe into alleged nepotism charges against her. Group veteran Sandeep Bakhshi was last month named in a newly-created position of chief operating officer to run the lender in the interim.","While more than 86 percent of India’s $150 billion worth of non-performing loans at the end of March was with the dominant state-backed lenders, ICICI accounts for the biggest chunk of bad loans among the private sector banks.","Net loss came in at 1.20 billion rupees ($17.5 million) for the fiscal first quarter ended June 30, compared with a profit of 20.49 billion rupees a year earlier, the bank said here on Friday.",Thomson Reuters data going back to 2002 do not show any previous quarterly losses for the bank.,"Analysts had on average expected a net profit of 14.62 billion rupees for the bank which is also listed in New York , according to Thomson Reuters I/B/E/S.","Even though the gross bad loan additions of 40.36 billion rupees in the June quarter was the lowest in 11, ICICI said it had to make additional provisions for ageing non-performing loans and cases in bankruptcy court, leading to the net loss.",Total provisions more than doubled from a year earlier to 59.71 billion rupees with the bank not making use of a central bank dispensation of spreading bond losses over four quarters.,"Gross bad loans as a percentage of total loans were 8.81 percent at the end of June, compared with 8.84 percent at the end of the previous quarter, and 7.99 percent a year earlier.","Domestic loans grew 15 percent, led by a 20 percent growth in retail loans which now account for 58 percent of the total portfolio, the bank said.","Kochhar, who has been CEO of ICICI Bank since May 2009, has faced allegations of favouring Videocon Group, a consumer electronics and oil and gas exploration company, in the bank’s lending practices. Videocon’s founders had an investment in a renewable energy company founded by Kochhar’s husband.","Kochhar has not commented on the issue. Her husband Deepak Kochhar has denied any wrongdoing, as has the head of the Videocon group.","In its statement on Friday, the bank gave no update on the probe.","Bank of Baroda, the third-biggest among India’s state-run lenders which also reported first-quarter results on Friday, said net profit more than doubled, helped by lower bad-loan provisions.","Ahead of the results, ICICI shares closed 2.6 percent higher in Mumbai trading. In New York, the stock rose 2.6 percent by 1400 GMT after the results, reversing earlier losses."
24,https://www.reuters.com/article/icici-bank-results/indias-icici-bank-posts-surprise-q1-loss-as-provisions-surge-idUSL4N1UN4A2,2018-07-27T12:28:23Z,India's ICICI Bank posts surprise Q1 loss as provisions surge,"July 27 (Reuters) - ICICI Bank Ltd, India’s third-largest lender by assets, reported a surprise first-quarter net loss on Friday on higher provisions for bad loans and treasury losses.","The bank made a net loss of 1.20 billion rupees ($17.47 million) in the three months to June 30, compared with a profit of 20.49 billion rupees a year earlier, it said in a statement here.","Analysts on average had expected a net profit of 14.62 billion rupees, according to Thomson Reuters I/B/E/S.","Gross bad loans as a percentage of total loans was 8.81 percent at the end of June, compared with 8.84 percent at the end of the previous quarter and 7.99 percent a year earlier. ($1 = 68.6800 Indian rupees) (Reporting by Chris Thomas in Bengaluru; Editing by Stephen Coates and Jan Harvey)"
25,https://www.reuters.com/article/india-stocks/indian-shares-end-lower-reliance-icici-bank-top-drags-idUSB8N1TR020,2018-07-16T10:29:17Z,"Indian shares end lower; Reliance, ICICI Bank top drags","* NSE index down 0.7 pct, BSE index dips 0.6 pct",* Oil prices hurt energy shares,"July 16 (Reuters) - Indian shares ended lower on Monday, as a dip in oil prices hurt energy stocks such as Reliance Industries Ltd, while ICICI Bank Ltd fell on reports that the bank has hired a law firm to look into allegations of irregularities in some loan accounts.","The broader NSE index closed 0.74 percent lower at 10,936.85, while the benchmark BSE index was down 0.6 percent at 36,323.77.","Reliance Industries closed 2.2 percent lower, while ICICI Bank fell 3.2 percent.","For the mid-day report, click (Reporting by Krishna V Kurup in Bengaluru; Editing by Sunil Nair)"
26,https://www.reuters.com/article/icici-bank-chairman/indias-icici-bank-names-girish-chandra-chaturvedi-as-part-time-non-exec-chairman-idUSL4N1TV2RY,2018-06-29T07:01:31Z,"India's ICICI Bank names Girish Chandra Chaturvedi as part-time, non-exec chairman","June 29 (Reuters) - India’s ICICI Bank Ltd said on Friday it appointed Girish Chandra Chaturvedi as part-time, non-executive chairman, effective July 1.","Chaturvedi, a former Indian Administrative Services officer, most recently served as chairman of the Warehousing Development and Regulatory Authority.","He has also served as a government nominee director on the boards of Life Insurance Corp (LIC) of India, Canara Bank , Bank of Baroda, IDBI Bank Ltd and IDFC Ltd.","ICICI Bank's current Chairman M.K. Sharma's term expires on June 30, the bank said in a statement bit.ly/2tGb0s1.","The bank, India’s third largest lender by assets, also named Chaturvedi as an independent director for three years.","This comes shortly after the bank tapped group veteran Sandeep Bakhshi to be its interim head, with Chief Executive Chanda Kochhar on leave pending a probe over an alleged conflict of interest. (Reporting by Chris Thomas in Bengaluru; Editing by Subhranshu Sahu)"
27,https://www.reuters.com/article/icici-bank-ceo/update-2-icici-bank-names-bakhshi-interim-head-as-ceo-kochhar-goes-on-leave-during-probe-idUSL4N1TK3VV,2018-06-18T17:13:41Z,UPDATE 2-ICICI Bank names Bakhshi interim head as CEO Kochhar goes on leave during probe,"* Bakhshi, CEO of ICICI Pru Life, named bank COO from June 19",* Kochhar to go on leave during probe over nepotism allegations,"* ICICI conducting independent probe after whistleblower complaint (Adds analyst quote, more details)","MUMBAI, June 18 (Reuters) - India’s ICICI Bank named group veteran Sandeep Bakhshi as its interim head, and said Chief Executive Chanda Kochhar would go on leave pending the completion of a probe over an alleged conflict of interest that has led to months of controversy for the lender.","Bakhshi, who currently heads ICICI’s life insurance arm, will take up a newly created position of chief operating officer at the bank for a five-year term beginning June 19, pending regulatory approvals, the bank said in a statement late on Monday.","Bakhshi will report to the bank’s board during the period of Kochhar’s leave and will be responsible for handling all the businesses and corporate centre functions, ICICI Bank said. All the executive directors of the bank and its executive management would report to Bakhshi.","Kochhar, 56, who has been CEO of ICICI Bank, India’s third-biggest lender by assets, since May 2009, has faced allegations of favouring Videocon Group, a consumer electronics and oil and gas exploration company, in the bank’s lending practices. Videocon’s founders had an investment in a renewable energy company founded by Kochhar’s husband.","ICICI Bank’s board, which had initially backed Kochhar calling the alleged nepotism charges against her “malicious and unfounded”, last month said it would institute a probe headed by an independent person into allegations raised by an anonymous whistleblower.","“In line with the highest levels of governance and corporate standards, Ms. Chanda Kochhar has decided to go on leave till the completion of the enquiry,” the bank said.","The bank has yet to provide any details of the probe. Local media has reported B.N. Srikrishna, a retired judge of India’s Supreme Court, will lead the probe.","Bakhshi started his career with the ICICI group in 1986 and has looked after the group’s corporate, retail lending and insurance businesses. He has headed ICICI Prudential Life Insurance Co Ltd since 2010 and helped take the company public in 2016.","“Bakhshi is part of the ICICI culture. So, from that perspective, he is the right choice as the senior-most person within the ICICI umbrella after Kochhar,” said Shriram Subramanian, founder of proxy advisory firm InGovern.","“That should be taken favourably by investors,” Subramanian said, although he criticised the bank’s board for not having acted more decisively in tackling the controversy.",The bank’s New York-listed shares rose 3.6 percent by 1647 GMT on the news. Its Mumbai-listed shares had closed 3.7 percent higher before the announcement.,"Chanda Kochhar has not commented on the issue. Her husband Deepak Kochhar has denied any wrongdoing, as has the head of the Videocon group.","N.S. Kannan, currently an executive director at ICICI Bank, is set to be the new CEO of ICICI Prudential Life, the bank said. (Reporting by Devidutta Tripathy and Abhirup Roy; Additional reporting by Aby Jose Koilparambil in Bengaluru; Editing by David Evans and Susan Fenton)"
28,https://www.reuters.com/article/icici-bank-ceo/icici-bank-says-ceo-to-go-on-leave-during-probe-names-new-coo-idUSI8N1QW00R,2018-06-18T15:21:32Z,ICICI Bank says CEO to go on leave during probe; names new COO,"MUMBAI, June 18 (Reuters) - India’s ICICI Bank Ltd said on Monday Chief Executive Chanda Kochhar would go on leave until the completion of an inquiry over an alleged conflict of interest, and named Sandeep Bakhshi, the head of its life insurance unit, as chief operating officer (COO) of the bank.","Bakhshi, whose appointment is for a period of five years beginning June 19, pending regulatory approvals, will report to Kochhar, the bank said in a statement.",The new COO will report to the bank’s board during Kochhar’s period of leave.,"“Bakhshi will be responsible for handling all the businesses and corporate centre functions at the Bank,” the bank said in a statement late on Monday, adding all executive directors of the bank and the executive management would report to him.","ICICI, the third-biggest Indian lender by assets, said last month it would institute a probe headed by an independent person into the allegations raised by an anonymous whistleblower against Kochhar. (Reporting by Devidutta Tripathy and Abhirup Roy; Editing by Mark Potter)"
29,https://www.reuters.com/article/us-icici-bank-ceo/indias-icici-bank-says-ceo-kochhar-on-planned-leave-idUSKCN1IX3OF,2018-06-01T05:46:09Z,India's ICICI Bank says CEO Kochhar on planned leave,(Reuters) - ICICI Bank Ltd ICBK.NS said on Friday Chief Executive Officer Chanda Kochhar is on planned annual leave and denied a media report that she was asked to go on leave until an independent board enquiry is concluded.,"The Mint daily reported here that Kochhar was asked to go on indefinite leave until a probe into allegations of favoritism in loan distribution is concluded, and that the decision was taken on the advice of a majority of the bank's seven independent directors.","""The ICICI Bank board denies having asked Chanda Kochhar to go on leave ... Further, the board denies that it has appointed any search committee to find her successor,"" the bank said in a statement here.","India's second largest private sector lender is facing allegations over conflict of interest in loans made to Videocon VEDI.NS, a consumer electronics and oil and gas exploration company, which is alleged to have been favored by Kochhar.","However, the bank rebutted the nepotism charges in March and said the board had “full confidence and reposes full faith” in Kochhar.","Shares of the Mumbai-based lender which jumped nearly 5 percent in early trading, pared some gains and were up 1.8 percent at 0541 GMT."
30,https://www.reuters.com/article/icici-bank-ceo/icici-bank-denies-media-report-on-sending-its-ceo-on-leave-idUSL3N1T32AX,2018-06-01T04:56:37Z,ICICI Bank denies media report on sending its CEO on leave,June 1 (Reuters) - ICICI Bank Ltd on Friday denied a media report that said CEO Chanda Kochhar has been asked to go on leave until an independent enquiry on alleged cases of impropriety is concluded.,"""The ICICI Bank Board denies having asked Chanda Kochhar to go on leave. She is on her annual leave which was planned in advance,"" the bank said in a statement here.","The board also “denies it has appointed any search committee to find her successor”, the private sector lender said in a statement.",The Mint daily earlier reported here that Kochhar has been asked to be on leave until a probe is over. (Reporting by Vishal Sridhar in Bengaluru; Editing by Gopakumar Warrier)
31,https://www.reuters.com/article/us-icici-bank-probe/indias-icici-bank-to-probe-allegations-against-ceo-idUSKCN1IV19W,2018-05-30T10:52:19Z,India's ICICI Bank to probe allegations against CEO,(Reuters) - ICICI Bank Ltd ICBK.NS said on Wednesday it will institute an inquiry into the allegations raised by an anonymous whistleblower against Chief Executive Chanda Kochhar.,"ICICI, India’s third-biggest lender by assets, said the probe, headed by an independent person, would examine allegations that the chief executive did not adhere to provisions relating to the bank’s code of conduct and whether her actions involved “conflict of interest”.",The bank is battling allegations that Kochhar allegedly favored Videocon Group in its lending practices. Videocon’s founders had an investment in a renewable energy company founded by Kochhar’s husband.,"The bank has backed Kochhar, calling the rumors “malicious and unfounded”."
32,https://www.reuters.com/article/icici-bank-sebi/icici-bank-ceo-receive-notice-from-capital-markets-regulator-over-videocon-loans-idUSL3N1SW49M,2018-05-25T13:24:12Z,"ICICI Bank, CEO receive notice from capital markets regulator over Videocon loans","May 25 (Reuters) - ICICI Bank Ltd said on Friday the lender and its chief executive, Chanda Kochhar, had received a notice from India’s capital markets regulator seeking responses over alleged non-compliance with certain rules.","The bank said it would respond to the Securities and Exchange Board of India, adding that the notice received on Thursday was based on information given by the bank and its CEO on earlier queries over their dealings with the Videocon conglomerate.","ICICI, India’s third-biggest lender by assets, is battling allegations that Kochhar allegedly favoured Videocon Group in its lending practices. Videocon’s founders had an investment in a renewable energy company founded by Kochhar’s husband.","The bank has backed Kochhar, calling the rumours “malicious and unfounded”. (Reporting by Aby Jose Koilparambil in Bengaluru; Editing by Subhranshu Sahu)"
