1,https://www.reuters.com/article/india-fraud/india-court-remands-former-icici-bank-ceos-husband-in-police-custody-idUSKBN25Z13L,2020-09-08T14:33:23Z,India court remands former ICICI Bank CEO's husband in police custody,"MUMBAI/NEW DELHI (Reuters) - An Indian court on Tuesday allowed the country’s financial crime fighting agency to take 10-day custody of former ICICI Bank CEO Chanda Kochhar’s husband, two lawyers familiar with the matter said.",Deepak Kochhar’s remand in custody comes a day after he was arrested by the Enforcement Directorate as part of an ongoing probe into allegations of money laundering which ended the career of one of India’s most celebrated bankers.,"Indian authorities have been investigating Kochhar, head of the company NuPower Renewables, and his wife on suspicion of cheating, criminal conspiracy and money laundering.",Chanda Kochhar quit as ICICI CEO around two years ago due to the investigation. The Kochhars have denied all charges against them and did not respond to a Reuters request for comment on Tuesday.,"The Enforcement Directorate also did not respond. In its request seeking Deepak’s custody, the agency said he had been “totally noncooperative, evasive and misleading during the investigation”, according to a court filing seen by Reuters.","The two lawyers involved in the case, who declined to be named, said the court in Mumbai allowed custody until Sept. 19 following a request from the Directorate.","Indian enforcement authorities have alleged that ICICI Bank, under Chanda Kochhar, sanctioned “high value” loans to Videocon Industries, violating the bank’s lending policies. In exchange, the authorities allege, Videocon’s owner invested in NuPower Renewables.","The former banker has in the past faced interrogation by enforcement authorities. Last year, the Enforcement Directorate also conducted searches on Chanda Kochhar’s properties and those linked to Videocon.",Videocon’s managing director also denies any wrongdoing.
2,https://www.reuters.com/article/us-icici-bank-satellite-images/indias-icici-bank-uses-space-images-for-farm-loans-to-cut-costs-idUSKBN25L17B,2020-08-25T10:28:13Z,India's ICICI Bank uses space images for farm loans to cut costs,"BENGALURU (Reuters) - India's ICICI Bank Ltd ICBK.NS has begun using satellite images of farmland to help assess farmers' credit-worthiness, a move the bank says is helping cut travel costs and make faster lending decisions in a world hit by the COVID-19 pandemic.","The lender, India’s fourth largest by assets, is using pictures taken from space and analysed by a third-party firm, for farm loans in 500 northern Indian villages, with plans to take the technology to 63,000 villages, it said on Tuesday.","Indian banks typically deploy officials to travel hundreds of miles across the hinterland to assess irrigation systems, crop quality and land location for forecasting farm revenue to make loans. Agriculture accounted for nearly 15% of India’s $2.8 trillion economy as of January.","Data from satellite images would help ICICI Bank cut costs and reduce the time taken to give out loans, Executive Director Anup Bagchi told reporters on a conference call.","“It is now taking place in a few days, as against the industry practice of 15 days or more,” Bagchi said. “The biggest upside for us is that there is very little wastage of time on getting the data.”","The technology, which will use more than 40 variables for assessing a farmer’s credit-worthiness, will be applied to a type of farm loan that makes up a third of ICICI’s rural loan portfolio of about 571.8 billion rupees ($7.7 billion), he added.","Indian lenders are currently grappling with more than $100 billion of soured loans, and stress in the agriculture sector has been rising just as the overall share of bad loans is coming down.",Bagchi said satellite imagery - used globally for everything from crop-monitoring and geology to defense and urban planning - could help improve ICICI’s asset quality over the long term.,($1 = 74.2896 Indian rupees)
3,https://www.reuters.com/article/us-singapore-oil-hinleong-icici-bank/indias-icici-bank-confirms-exposure-to-troubled-oil-trader-hin-leong-idUSKCN2231EP,2020-04-21T11:07:24Z,India's ICICI Bank confirms exposure to troubled oil trader Hin Leong,NEW DELHI (Reuters) - India's second largest private lender ICICI Bank ICBK.NS on Tuesday confirmed its exposure to the Singapore-based troubled oil trader Hin Leong Trading Pte Ltd (HLT) and said it is taking steps to protect its interest.,"“We confirm that the Bank, in the normal course of its business, has exposure to the borrower group in question, is taking due steps to protect its interests, and will appropriately reflect the same in its financial statements, as it would do in respect of all its banking exposures,” ICICI said in a stock exchange filing.",The Bank did not elaborate the extent of its exposure and the steps it is taking to protect its interest. Reuters on Monday reported the ICICI Bank has $100 million exposure to the trader.,"ICICI Bank is asking for authorities to impound two vessels operated by Ocean Tankers (Pte) Ltd, a unit HLT, an ICICI source said on Monday.","According to a court filing reviewed by Reuters, HLT’s founder and director had directed his firm not to disclose hundreds of millions of dollars in losses over several years.",Shares of ICICI Bank fell about 9% on Tuesday.,(This story corrects day in lede graf to Tuesday.)
4,https://www.reuters.com/article/us-singapore-oil-hinleong-icici-bank/icici-seeks-impounding-of-ships-operated-by-hlt-unit-ocean-tankers-source-idUSKBN22219U,2020-04-20T10:21:50Z,ICICI seeks impounding of ships operated by HLT unit Ocean Tankers: source,"NEW DELHI/SINGAPORE (Reuters) - India’s ICICI Bank is seeking the impounding of two vessels operated by Ocean Tankers (Pte) Ltd, a unit of Singapore oil-trading company Hin Leong Trading Pte Ltd (HLT), an ICICI source said on Monday.","The tankers, Wu Yi San and Chang Bai San, were carrying cargoes financed by ICICI, the source said, adding that the bank had about $100 million exposure to HLT.","According to a court filing reviewed by Reuters, HLT’s founder and director had directed his firm not to disclose hundreds of millions of dollars in losses over several years.",Shares of ICICI Bank fell about 4% after Reuters reported ICICI’s exposure to HLT.,"ICICI, Hin Leong and Ocean Tankers did not immediately respond to Reuters emails seeking comments."
5,https://www.reuters.com/article/us-yes-bank-investment-icici-bank/indias-icici-bank-to-invest-up-to-135-million-in-crisis-hit-yes-bank-idUSKBN2101HI,2020-03-13T11:15:06Z,India's ICICI Bank to invest up to $135 million in crisis-hit Yes Bank,BENGALURU (Reuters) - India's ICICI Bank ICBK.NS said on Friday it will invest up to 10 billion rupees ($135 million) in troubled lender Yes Bank Ltd YESB.NS as part of an initial phase of a rescue deal.,ICICI said here it will buy 10 billion shares of Yes Bank at 10 rupees per share and hold about a 5% stake.,"India placed Yes Bank, the country’s fifth-largest private-sector lender, under a moratorium last week following a serious deterioration in the bank’s financial position.","The rescue plan for Yes Bank involves State Bank of India SBI.NS, the country's largest lender, buying a stake in the troubled lender along with a consortium of other investors."
6,https://www.reuters.com/article/india-icici-bank-results/indias-icici-bank-dec-quarter-net-profit-nearly-trebles-idUSL4N29U06E,2020-01-25T10:01:36Z,India's ICICI Bank Dec quarter net profit nearly trebles,"MUMBAI, Jan 25 (Reuters) - India’s ICICI Bank, the country’s second largest private lender, reported a near trebling of its quarterly profit on Saturday, helped by a rise in retail loans and improving asset quality.","Net profit for the October-December quarter was 41.46 billion rupees ($583.37 million) compared with 16.05 billion rupees in the same quarter a year ago, the bank said in a statement.","The profit was lower than the 44.51 billion rupees that 24 analysts had expected on average, according to Refinitiv data.",Asset quality improved with gross non-performing assets (NPAs) falling to 5.95% of total assets compared with 7.75% a year ago. Net NPA also improved to 1.49%.,"Net interest margin, a key indicator of a bank’s profitability, stood at 3.77%. ($1 = 71.0700 Indian rupees) (Reporting by Nupur Anand; Editing by Sam Holmes)"
7,https://www.reuters.com/article/icici-results/indias-icici-bank-quarterly-profit-falls-28-idUSL3N277265,2019-10-26T09:33:10Z,India's ICICI Bank quarterly profit falls 28%,"NEW DELHI, Oct 26 (Reuters) - India’s second-largest private-lender, ICICI Bank, reported a 28% fall in net profit in the quarter ended Sept. 30 due to a one-time charge related to deferred taxes.",Net profit fell to 6.5 billion Indian rupees ($91.79 million) in the second quarter compared with 9.09 billion rupees the same time last year.,Asset quality improved with gross non-performing assets (NPAs) at 6.37% compared to 8.54% in the corresponding quarter a year ago.,Net NPA also improved to 1.60%.,"Net interest margin, a key indicator of bank profitability, stood at 3.64%.",The bank remains well-capitalised with a capital adequacy ratio of 16.14% at the end of September. ($1 = 70.9470 Indian rupees) (Reporting by Devjyot Ghoshal; Editing by Stephen Coates)
8,https://www.reuters.com/article/us-icici-bank-results/lower-provisions-help-indias-icici-bank-swing-to-first-quarter-profit-idUSKCN1UM0DD,2019-07-27T12:49:42Z,Lower provisions help India's ICICI bank swing to first quarter profit,"MUMBAI (Reuters) - ICICI Bank Ltd ICBK.NS, India's second-largest private lender, reported a quarterly profit on Saturday compared with a loss a year earlier, helped by lower provisions and higher retail loan growth.","Net profit for the fiscal first quarter ended June 30 was 19.08 billion rupees ($277.04 million), compared with a loss of 1.20 bln rupees in the same period a year ago, the bank said in a statement.","But the profit fell slightly short of the average forecast of 20.87 billion rupees from 19 analysts, according to Refinitiv data.","ICICI, like its peers, also said India’s ongoing economic slowdown weighed on its performance in the quarter.","“From an economic scenario there is a bit of a slowdown in consumption as well as in auto sales,” said Sandeep Batra, Executive Director of ICICI Bank in a conference call after the results. “However, the services sector continues to do well and we are seeing an improvement in the capital expenditure cycle.”","The bank’s corporate loan book grew at a pace of 13% in the quarter, while its retail loan book grew 22% in the period.","ICICI, which has been under pressure lately due to rising bad loans, said net non-performing assets (NPA) at the end of the June quarter were down 51% to $1.17 billion. The net NPA was at a 14-quarter low of 1.77%, said the bank’s management.",Quarterly provisions fell to $507 million from $865 million a year ago.,"Net interest margin, a key indicator of the bank’s profitability, was 3.61% in the quarter, compared with 3.19% in the year-ago quarter.","The total capital adequacy ratio of the bank was 16.19% and it does not have any immediate plans to raise capital, said Batra.","Earlier in the week, ICICI's peer Kotak Mahindra Bank Ltd KTKM.NS also reported a profit that fell marginally shy of estimates, and joined the country's largest private lender HDFC Bank HDBK.NS in warning of the slowing pace of domestic growth.","The warnings from the private lenders in Asia’s third largest economy, which have been dealing with a large pile of stressed loans, have spooked investors."
9,https://www.reuters.com/article/icici-bank-results/indias-icici-bank-posts-quarterly-profit-idUSL4N24S042,2019-07-27T09:53:50Z,India's ICICI bank posts quarterly profit,"MUMBAI, July 27 (Reuters) - ICICI Bank Ltd, India’s second-largest private lender, reported a quarterly profit on Saturday compared with a loss a year earlier, helped by lower provisions and higher retail loan growth.","Net profit for the quarter ended June 30 was 19.08 billion rupees ($277.04 million) compared with a loss of 1.20 bln rupees in the same period a year ago, the bank said in a statement.","But the profit fell slightly short of the estimated 20.87 billion rupees that 19 analysts had expected on average, according to Refinitiv data. ($1 = 68.8700 Indian rupees) (Reporting by Nupur Anand in Mumbai; editing by Richard Pullin)"
10,https://www.reuters.com/article/icici-bank-results/update-2-indias-icici-bank-misses-forecasts-with-quarterly-profit-fall-idUSL3N22I1ZB,2019-05-06T11:52:32Z,UPDATE 2-India's ICICI Bank misses forecasts with quarterly profit fall,"(Adds detail, analyst quote)","BENGALURU, May 6 (Reuters) - ICICI Bank reported a 5 percent drop in fourth-quarter profit on Monday, missing estimates after being hit by a rise in expenses and a higher accumulation of bad loans.","State-run banks account for most of the sector’s bad loans, but private sector lenders such as ICICI also own a substantial chunk of such assets. ICICI has one of the highest bad loan ratios among its peers.",The Mumbai-based company's bad loan accumulation in the three months to March 31 was up 70 percent from the previous quarter at 35.47 billion rupees ($511 million). bit.ly/2J19vOn,Elara Capital analyst Rakesh Kumar said he had been expecting the so-called slippage figure to come in at 23 billion rupees.,"“That is one of the key reasons for deviation from (profit) estimates,” he said.",Net profit dropped to 9.69 billion rupees in the period from 10.20 billion rupees a year earlier.,"Analysts had been looking for a profit of 21.29 billion rupees, I/B/E/S data from Refinitiv showed.","Total expenses jumped 18.1 percent to 146.80 billion rupees, led by 17 percent rise in interest payments on deposits.","However, asset quality overall improved, with gross bad loans as a percentage of total loans easing to 6.7 percent in the quarter, from 7.8 percent in the previous quarter and 8.8 percent a year earlier.",Provisions for bad loans fell 17.7 percent to 54.51 billion rupees.,The bank’s Mumbai-listed shares closed flat at 401.30 rupees. ($1 = 69.4100 Indian rupees)
11,https://www.reuters.com/article/icici-bank-results/indias-icici-bank-fourth-quarter-profit-drops-on-higher-expenses-idUSL3N22I1YY,2019-05-06T10:48:04Z,India's ICICI Bank fourth-quarter profit drops on higher expenses,"BENGALURU, May 6 (Reuters) - ICICI Bank Ltd reported on Monday a 5 percent drop in its fourth-quarter profit, dented by higher expenses.","Net profit dropped to 9.69 billion rupees ($139.71 million) in the three months ended March 31, from 10.20 billion rupees a year earlier when stricter central bank rules had forced the country's third-biggest lender by assets to account for more bad loans. bit.ly/2J19vOn Analysts were looking for a profit of 21.29 billion rupees, I/B/E/S data from Refinitiv showed.",Total expenses jumped 18.1 percent to 146.80 billion rupees.
12,https://www.reuters.com/article/icici-bank-probe-searches/indian-agency-searches-properties-of-former-icici-bank-ceo-kochhar-idUSL3N20O32G,2019-03-01T10:35:17Z,Indian agency searches properties of former ICICI Bank CEO Kochhar,"MUMBAI, March 1 (Reuters) - India’s financial crime fighting agency said on Friday it was conducting searches on properties of former ICICI Bank CEO Chanda Kochhar and a top executive of Videocon group, amid probes into suspected conflict of interest and misconduct.","Searches, under prevention of money laundering laws, were being conducted in Mumbai and Aurangabad, the Enforcement Directorate (ED) said on Twitter.","In January, India’s federal police, the Central Bureau of Investigation (CBI) filed a case of criminal conspiracy and fraud against Kochhar, her husband, and Videocon Managing Director Venugopal Dhoot alleging Kochhar had favoured Videocon, a consumer electronics and oil and gas exploration company, by violating the bank’s lending policies.","CBI alleged that Dhoot, in return, invested a large sum in NuPower Renewables, a business headed by Kochhar’s husband.","Last month, the federal investigating agency raided four locations owned by Videocon Industries and NuPower Renewables, according to a source at CBI.","The Enforcement Directorate registered a money laundering case against Kochhar, her husband and Dhoot last month based on the case by CBI, according to media reports.","Dhoot, Kochhar, and her husband were not reachable for comment on the Enforcement Directorate’s searches on Friday.","ICICI said in January an investigation had found Kochhar had violated internal bank policies and it sought to revoke her unpaid bonuses or increments, unexercised stock options and medical benefits.","Kochhar has not commented on the allegations by CBI but had said she was “utterly disappointed, hurt and shocked” by ICICI’s decision. Her husband Deepak Kochhar and Videocon’s Dhoot have denied any wrongdoing.",ICICI Bank did not immediately respond to a request for comment. (Reporting by Abhirup Roy; Additional reporting by Promit Mukherjee; Editing by Muralikumar Anantharaman)
13,https://www.reuters.com/article/icici-bank-probe/update-2-icici-bank-probe-finds-ex-ceo-kochhar-violated-internal-policies-idUSL3N1ZU4FL,2019-01-30T17:46:47Z,UPDATE 2-ICICI Bank probe finds ex-CEO Kochhar violated internal policies,* Board said bank to revoke Kochhar’s financial entitlements,* Board will seek to reclaim bonuses paid from 2009-2018,* Enquiry found Kochhar in violation of fiduciary duties,"* Kochhar said “utterly disappointed” by ICICI decision (Adds details from board report, comments, background)","MUMBAI, Jan 30 (Reuters) - ICICI Bank Ltd said on Wednesday an investigation into former Chief Executive Chanda Kochhar found she had violated internal bank policies and the bank will seek to revoke her financial entitlements.","Kochhar, who worked at India’s third biggest lender for over three decades, rose through the ranks to become one of the most influential women bankers in the country before she retired last year.",But Kochhar has been dogged by allegations of conflict of interest and misconduct over the last two years and she sought early retirement from the bank in October.,"ICICI Bank said in a statement it would seek to revoke Kochhar’s unpaid bonuses or increments, unexercised stock options and medical benefits following a board decision on Wednesday.","The board also planned to “clawback” all bonuses paid to Kochhar between April 2009 until March 2018, the statement said.","Kochhar said in response to the ICICI statement she was “utterly disappointed, hurt and shocked by the decision.”","“I reiterate that none of the credit decisions at the bank are unilateral ... the organisation design and structure obviate the possibility of conflict of interest,” she said.",ICICI’s decision follows the conclusion of an investigation led by former Supreme Court judge B. N. Srikrishna. This was opened last May.,"The bank had earlier dismissed allegations against Kochhar after an earlier investigation in 2016. In March last year, the bank backed Kochhar, saying there was no issue of conflict of interest.","But the new enquiry into Kochhar’s conduct between April 2009 and March 2018 found that she was in “violation of the ICICI Bank Code of Conduct, its framework for dealing with conflict of interest and fiduciary duties,” the board said in the statement.","The report also found that Kochhar had failed to meet requirements with respect to annual disclosures required by ICICI Bank and found that her actions rendered bank’s processes ineffective, the board also said.","“The board’s move is a lesson for corporate India - both for a company’s board and its top executives,” Shriram Subramanian, founder of proxy advisory firm InGovern, said.","Last week, India’s federal investigating agency filed a case of criminal conspiracy and fraud against Kochhar, her husband and the managing director of Videocon Industries Ltd.","Separately, ICICI Bank earlier on Wednesday reported a 2.7 percent fall in third-quarter net profit on Wednesday to 16.05 billion rupees ($225.51 million) in the three months to Dec. 31, from 16.50 billion rupees a year earlier, missing analysts’ estimates by a wide margin."
14,https://www.reuters.com/article/icici-bank-ceo-probe/indias-icici-bank-to-treat-kochhars-exit-as-termination-for-cause-idUSL3N1ZU4R0,2019-01-30T13:16:10Z,India's ICICI Bank to treat Kochhar's exit as 'termination for cause',Jan 30 (Reuters) - ICICI Bank Ltd said on Wednesday it would treat former Chief Executive Chanda Kochhar’s exit from the bank as a “termination for cause” after an enquiry report ruled that she had violated internal bank policies.,"Kochhar resigned in October after being mired in allegations that she favoured Videocon Group, a consumer electronics and oil and gas exploration company, in the bank’s lending practices. (Reporting by Chris Thomas in Bengaluru, Editing by Sherry Jacob-Phillips)"
15,https://www.reuters.com/article/icici-bank-results/refile-indias-icici-bank-third-quarter-profit-slips-2-7-pct-idUSL3N1ZU4DS,2019-01-30T13:06:26Z,REFILE-India's ICICI Bank third-quarter profit slips 2.7 pct,(Corrects day in first paragraph to Wednesday from Thursday),"Jan 30 (Reuters) - ICICI Bank reported a 2.7 percent fall in third-quarter net profit on Wednesday, missing analysts’ estimates by a wide margin, as it set aside higher provisions.","Net profit fell to 16.05 billion rupees ($225.51 million) in the three months to Dec. 31, from 16.50 billion rupees a year earlier, India's third-biggest private-sector lender by market value said here.","That compares with analysts’ average estimate for a profit of 18.36 billion rupees, I/B/E/S data from Refinitiv showed.","However, gross bad loans as a percentage of total loans, a measure of asset quality, fell to 7.75 percent at the end of December, from 8.54 percent in the previous quarter and 7.82 percent in the same period a year earlier.",($1 = 71.1720 Indian rupees)
16,https://www.reuters.com/article/india-videocon/update-2-indias-cbi-files-case-against-former-icici-bank-chief-chanda-kochhar-idUSL3N1ZO446,2019-01-24T15:20:28Z,UPDATE 2-India's CBI files case against former ICICI Bank chief Chanda Kochhar,* Case also filed against Kochhar’s husband and Videocon executive,"* CBI says it may also investigate ICICI’s CEO, among others",* Agency alleges Kochhar abused position to favour Videocon (Adds detail from FIR),"MUMBAI, Jan 24 (Reuters) - India’s federal investigating agency has filed a case of criminal conspiracy and fraud against the former ICICI Bank CEO Chanda Kochhar and her husband Deepak Kochhar, a statement from the Central Bureau of Investigation (CBI) showed on Thursday.",The CBI case is the latest twist in a saga that has dogged ICICI and its former chief executive for months and was instrumental in her decision to step down at the Indian bank last October.,"The agency alleges that ICICI Bank, under Kochhar, sanctioned “high value” loans to Videocon Industries, violating the bank’s lending policies, in exchange for an investment by the consumer electronics company’s owner in a business headed by Kochhar’s husband. In the first information report (FIR), a copy of which was reviewed by Reuters, the CBI said it might also investigate current and former ICICI group officials, including CEO Sandeep Bakshi, who were a part of the loan sanctioning committee. The CBI also filed a case against Venugopal Dhoot, the managing director of the Videocon group and two of Videocon’s subsidiaries.","Former CEO Kochhar has been accused of cheating ICICI of 17.3 billion rupees ($243.2 million), now classed by the bank as non-performing assets.",The CBI accused Kochhar of dishonesty and “abusing her official position” by sanctioning the loan to Videocon.,"The FIR said that Kochhar, through the bank’s sanctioning committee, extended credit lines worth 32.5 billion rupees to various entities of the Videocon group in breach of lending policies prescribed by the Reserve Bank of India.","The CBI also alleges that Dhoot made a 640 million rupee investment in Nupower Renewables, a company headed by Kochhar’s husband.","Chanda Kochhar, Deepak Kochhar and Venugopal Dhoot were not immediately reachable for comment.",ICICI Bank did not respond to requests for comment and Videocon officials were not reachable for comment.,"Earlier in the day the CBI raided multiple locations owned by Videocon Industries and Nupower, a CBI source said. ($1 = 71.1300 Indian rupees) (Reporting by Promit Mukherjee and Abhirup Roy; Additional reporting by Nidhi Verma and Swati Bhat; editing by Darren Schuettler, Emelia Sithole-Matarise and David Goodman)"
