134,https://www.reuters.com/article/us-bayer-loxo-vitrakvi/bayer-gains-full-vitrakvi-rights-from-eli-lillys-loxo-idUSKCN1Q41V7,2019-02-15T16:36:16Z,Bayer gains full Vitrakvi rights from Eli Lilly's Loxo,"FRANKFURT (Reuters) - German drugmaker Bayer took full control of Vitrakvi, a drug used against a variety of cancers driven by a rare genetic mutation, in a deal with from Eli Lilly’s Loxo Oncology.","Bayer said on Friday it exercised a right to gain exclusive licensing rights for the global development and commercialization of Vitrakvi, also known as larotrectinib, under a clause in the initial collaboration deal with Loxo Oncology that provided for Loxo becoming a takeover target.",Eli Lilly agreed to buy Loxo for $8 billion in January and the deal was wrapped up on Friday.,Bayer has been called on by analysts and investors to strengthen its drug development pipeline as its pharmaceuticals division faces falling sales from 2024 amid looming competition for its two bestselling drugs.,"Bayer clinched the initial Vitrakvi deal in November 2017, about a year before the drug eventually won U.S. regulatory approval, marking a bright spot in Bayer’s development pipeline which has suffered a number of setbacks.","Shares in the German company, which also owns seed maker Monsanto, jumped on Friday and were up 4.4 percent at 68.44 euros at 1543 GMT. The stock has been dragged lower by litigation risks as thousands of U.S. plaintiffs claim its Roundup weed-killer played a role in their cancer.","Financial terms such as the initially agreed upfront payments to Loxo as well as milestone payments for development achievements remain unaffected, said a Bayer spokeswoman.","Vitrakvi, which is set to compete with Roche’s entrectinib, has been shown to shrink tumors in 81 percent of cases across 24 tumor types in different parts of the body, all driven by a rare gene anomaly known as NTRK fusion.",Commercial success will depend on the fast uptake of comprehensive gene-sequencing tools for tissue samples at cancer units to help identify the cases that benefit from Vitrakvi.,Bayer has put the drug’s annual peak sales potential at more than 750 million euros ($844 million).,"The change-of-control option exercised by Bayer also covers the experimental compound LOXO-195, also known as BAY 2731954, which is designed to treat patients whose cancers are returning after an initial Vitrakvi treatment.","Rather than co-promote with Loxo in the U.S., as initially agreed, Bayer will commercialize the drug there exclusively.","The sharing of U.S. commercial costs and profits in equal parts will be replaced by royalties to be paid by Bayer, the company said, without specifying financial terms.",The German drugmaker will continue to pay royalties on future net sales outside the U.S.,($1 = 0.8880 euros)
135,https://www.reuters.com/article/bayer-loxo-vitrakvi/bayer-acquires-full-vitrakvi-rights-from-eli-lillys-loxo-idUSFWN20A0R6,2019-02-15T14:57:52Z,Bayer acquires full Vitrakvi rights from Eli Lilly's Loxo,"FRANKFURT, Feb 15 (Reuters) - German drugmaker Bayer acquired all rights it does not already own in Vitrakvi, a drug against a variety of cancers driven by a rare genetic mutation, from Eli Lilly’s Loxo Oncology.","Bayer said on Friday it exercised an option to gain exclusive licensing rights for the global development and commercialization of Vitrakvi, also known as larotrectinib, under a change-in-control clause in the initial collaboration deal with Loxo Oncology.",Eli Lilly agreed to buy Loxo for $8 billion in January and the deal was wrapped up on Friday.
136,https://www.reuters.com/article/us-lilly-results/eli-lilly-backs-u-s-proposal-on-drug-rebates-to-lower-costs-idUSKCN1PV196,2019-02-06T16:22:52Z,Eli Lilly backs U.S. proposal on drug rebates to lower costs,"(Reuters) - Eli Lilly and Co on Wednesday embraced a U.S. government proposal to end a decades-old system of rebates drugmakers make to industry middlemen, saying it could lower the cost of insulin and other prescription drugs for patients.","Lilly, along with other major insulin makers, Sanofi SA and Novo Nordisk, has been under mounting pressure from patients and politicians over the rising cost of the life-sustaining diabetes treatment.","“While it’s still a proposal, we see this as ... a win for patients, lowering their out-of-pocket costs at the pharmacy counter with the greatest benefit realized by patients taking more highly-rebated products such as insulin,” Chief Executive David Ricks said on a call with analysts.","Drugmakers argue they have to keep prices high because of the rebates they must pay to pharmacy benefit managers and health insurers to get products on their lists of covered drugs. In January, the administration of U.S. President Donald Trump proposed a rule that would end the rebate system or pass along the savings to patients.","“We’ll adapt to whatever rules come out and how they get finalized,” Ricks said.","Lilly on Wednesday also cut its 2019 profit and revenue forecasts to account for disappearing sales of its cancer drug Lartruvo, which won conditional U.S. approval in 2016 based on early data but last month failed to extend patient survival a confirmatory trial. Costs related to Lilly’s pending $8 billion acquisition of Loxo Oncology also contributed to the revised forecast.",Lilly has said it is suspending promotion of Lartruvo and it will no longer be prescribe to new U.S. patients.,The Indianapolis-based drugmaker’s research and development spending is also expected to rise as it develops Loxo’s pipeline of targeted drugs for cancers driven by rare genetic mutations.,"The company said it now expects 2019 adjusted earnings of $5.55 to $5.65 per share, down from its prior forecast of $5.90 to $6.00. It expects revenue of $25.1 billion to $25.6 billion versus its prior view of $25.3 billion to $25.8 billion.","“The forecast cut was generally expected, given the Loxo acquisition and the Lartruvo failure were known events,” Edward Jones analyst Ashtyn Evans said.","“Diabetes will always be an area where we’ll see pricing pressure. Lilly fully takes that into consideration when giving guidance,” she added.","Excluding items, Lilly earned $1.33 per share, a penny shy of analysts’ average estimate, according to IBES data from Refinitiv.",Eli Lilly shares fell 1.3 percent to $118.82.
137,https://www.reuters.com/article/lilly-results/eli-lilly-quarterly-sales-beat-expectations-idUSL3N2011VC,2019-02-06T11:32:58Z,Eli Lilly quarterly sales beat expectations,"Feb 6 (Reuters) - Eli Lilly and Co posted better-than-expected fourth-quarter revenue on Wednesday, helped by higher sales of its newer drugs such as diabetes treatment Trulicity and psoriatic arthritis medication Taltz.","Revenue rose 4.5 percent to $6.44 billion, beating the average analyst estimate of $6.29 billion, according to IBES data from Refinitiv.","The company posted net income of $1.13 billion, or $1.10 per share, in the fourth quarter ended Dec. 31, compared with a net loss of $1.66 billion, or $1.58 per share, a year earlier, when it recorded charges related to the U.S. tax overhaul."
138,https://www.reuters.com/article/us-lilly-study/lilly-cancer-drug-fails-key-trial-will-no-longer-be-prescribed-idUSKCN1PC1B1,2019-01-18T18:52:38Z,"Lilly cancer drug fails key trial, will no longer be prescribed","(Reuters) - Eli Lilly and Co said on Friday that its cancer treatment Lartruvo, which had won conditional approval, failed to improve patient survival in a long-term confirmatory study and will no longer be prescribed, driving the drugmaker’s shares down nearly 3 percent.","No new U.S. patients will be started on the drug and Lilly is suspending promotion of the medicine, the company said.","Lartruvo won accelerated approval in 2016 in the United States and conditional approval in Europe based on results from a promising mid-stage trial. But its continued approval was contingent on the results of a larger, late-stage trial confirming the drug’s benefits.","On Friday, Lilly said Lartruvo combined with the standard-of-care chemotherapy doxorubicin did not prolong survival more than doxorubicin alone in patients with advanced soft tissue sarcoma.",Lilly oncology chief Anne White said in a phone interview the results were “completely unexpected.”,The disappointing outcome reflects the risk involved when drugs are approved based on smaller trials with promising data.,"“In a sense, this is the way it’s supposed to work,” White said. “You do that confirmatory study. Obviously, there are times when it doesn’t work out.”","Lartruvo will continue to be available to patients who appear to be benefiting from it as global regulators determine the next steps for the treatment, White said.","The Lartruvo news is a major setback to Lilly’s efforts to significantly boost its presence in oncology, as evidenced by its announcement last week that it would buy Loxo Oncology Inc for $8 billion to acquire its cancer drugs that target rare genetic mutations.","Analysts had forecast 2019 Lartruvo sales of $374.50 million, according to IBES data from Refinitiv.","Lilly in the past had avoided large deals, preferring to develop its own drugs. But the Loxo deal, the biggest acquisition in Lilly’s 143-year history, followed last year’s $1.6 billion purchase of Armo Biosciences, a developer of immunotherapy drugs.","“Given Lilly’s strategic focus on oncology, this increases the probability that Lilly will make more oncology acquisitions to improve scale,” BMO Capital Markets analyst Alex Arfaei said of the Lartruvo setback in a research note.","Lilly expects to take a first-quarter pretax charge of $70 million to $90 million, or about 10 cents per share, after tax, and said the setback will cut about 17 cents per share from its full-year 2019 earnings forecast.",The company does not see a change in its 2020 minimum financial goals.,Eli Lilly shares were down 2.8 percent at $115.81 afternoon trading.
139,https://www.reuters.com/article/lilly-study/lillys-cancer-therapy-lartruvo-fails-to-meet-main-goal-in-late-stage-trial-idUSL3N1ZI3DX,2019-01-18T12:02:34Z,Lilly's cancer therapy Lartruvo fails to meet main goal in late-stage trial,Jan 18 (Reuters) - Eli Lilly and Co said on Friday its cancer treatment Lartruvo failed to meet the main goal in a late-stage trial testing the therapy in patients with advanced or metastatic soft tissue sarcoma.,"The company said the study did not confirm the clinical benefit of Lartruvo when used in combination with the standard-of-care doxorubicin, when compared to doxorubicin. (Reporting by Saumya Sibi Joseph in Bengaluru; Editing by Shailesh Kuber)"
140,https://www.reuters.com/article/deals-day/deals-of-the-day-mergers-and-acquisitions-idUSL3N1ZB3CM,2019-01-11T21:00:58Z,Deals of the day-Mergers and acquisitions,"(Adds Twenty-First Century Fox, Eli Lilly, Medco Energi Internasional, Ophir Energy, Anheuser-Busch InBev, Enel, Lottoland, EWE, Oslo Bors VPS, Faroe, Elior, Deutsche Bank; Updates Bharti Airtel)","Jan 11 (Reuters) - The following bids, mergers, acquisitions and disposals were reported by 2100 GMT on Friday: ** Twenty-First Century Fox said it does not plan to bid for any of the regional sports networks that Walt Disney Co may need to sell to win U.S. Justice Department’s approval for its purchase of Fox’s film and TV assets. ** Eli Lilly and Co remains in the hunt for cancer drugs even after announcing an $8 billion purchase of Loxo Oncology this week, but it plans to remain on the sidelines when it comes to two of the hottest areas of drug development. ** Indonesian oil and gas group Medco Energi Internasional Tbk PT said it could offer 340 million pounds ($436 million) in cash for London-listed Ophir, which has assets in south-east Asia. ** Ophir Energy said Indonesia’s Medco Energi International cut its possible cash offer for the British firm after it lost a liquefied natural gas project in Africa’s Equatorial Guinea.","** A consortium of Virgin Atlantic Ltd, Stobart Group Ltd and Cyrus Capital Partners agreed to buy British regional airline Flybe Group Plc, Stobart said, for 2.2 million pounds ($2.81 million). ** Ceconomy, Europe’s biggest consumer electronics retailer, said it was delaying plans to form an extensive business alliance with French peer Fnac Darty, in which it owns a 24 percent stake. ** India’s Bharti Airtel has agreed to give part of its stake in Airtel Tanzania to the government, raising the East African nation’s holding in the mobile phone operator to 49 percent from 40 percent, the president’s office said.","** Enel and SEAS-NVE are among at least four bidders for the Danish power distributor and residential customer businesses being sold by energy group Orsted that could be worth about 2.5 billion euros ($2.9 billion), several sources said. ** Anheuser-Busch InBev, the world’s largest brewer, is considering floating part of its Asian operations, an Asian banking source said, in a deal that would help to ease its debt burden. ** Gambling company Lottoland said it was ready to offer up to 76 million euros ($88 million) for German lottery business Tipp24 in a move which could thwart the restructuring plans of Tipp24’s owner Zeal Network. ** German regional utility EWE is expected to kick off a sales process for a minority stake in itself next month, three people familiar with the matter said, in a deal that could value the whole group at up to 6.2 billion euros ($7.2 billion). ** Norwegian exchanges operator Oslo Bors VPS, the subject of a takeover offer from Euronext NV, has received interest from other parties, its board said. ** Faroe Petroleum’s Chief Executive Graham Stewart, Chief Financial Officer Jonathan Cooper and Chief Operating Officer Helge Hammer will resign, Faroe said after the company was taken over in a hostile bid by DNO. ** France’s Elior wants bids for its Areas business, which focuses on railways and motorway catering, to be submitted by the end of January, a source familiar with the situation told Reuters. ** Germany’s finance ministry regularly met with top Deutsche Bank executives in 2018 for talks that included topics such as strategic options, a finance ministry letter seen by Reuters showed. (Compiled by Vibhuti Sharma and Manogna Maddipatla in Bengaluru)"
141,https://www.reuters.com/article/us-eli-france-redundancies/eli-lilly-to-cut-250-jobs-at-france-plant-through-voluntary-redundancy-idUSKCN1P21OA,2019-01-08T16:02:25Z,"Eli Lilly to cut 250 jobs at France plant, through voluntary redundancy",PARIS (Reuters) - Pharmaceutical group Eli Lilly LLY.N said on Tuesday it will cut 250 jobs at its factory located near Strasbourg in Eastern France.,The company said it will reduce its payroll at the plant through a voluntary redundancy plan.,"Eli Lilly currently employs 1,400 workers at the plant."
142,https://www.reuters.com/article/us-loxo-oncology-m-a-lilly/lilly-makes-8-billion-bet-on-drugs-for-rare-cancers-with-loxo-oncology-buy-idUSKCN1P10YZ,2019-01-08T03:14:48Z,Lilly makes $8 billion bet on drugs for rare cancers with Loxo Oncology buy,"(Reuters) - Eli Lilly said on Monday it will buy Loxo Oncology Inc for $8 billion, an expensive bet on a pipeline of cancer drugs that target rare genetic mutations and the biggest acquisition in the drugmaker’s 143-year history. The price represents a 68 percent premium to Loxo’s Friday share price close, which some Wall Street analysts said was high for a company with only one drug on the market that it shares with a partner.","Loxo shares surged 66 percent to $232.65, close to the offer price of $235 per share, and prompted stock price rises for a other small developers of targeted cancer therapies, including Array BioPharma, Blueprint Medicines Corp and Clovis Oncology Inc. Lilly shares rose 0.5 percent to $115.28.","The cash deal comes on the heels of Bristol-Myers Squibb Co’s agreement last week to buy Celgene Corp for $74 billion in the largest pharmaceutical deal ever, spurring investors’ hopes of a new wave of large healthcare acquisitions.","Loxo gained prominence in 2017 - just three years after going public - with impressive clinical trial results showing its drug to be highly effective on cancers driven by a single gene mutation known as TRK fusion, regardless of where in the body the tumors originated.","These patients, with more than 17 different types of advanced cancer but all with the same genetic mutation, had run out of other treatment options. Yet some 80 percent who received Loxo’s first drug, a pill called larotrectinib, experienced dramatic, often long-term improvement.","The Connecticut-based company won U.S. approval in November for the treatment under the brand name Vitrakvi, which is sold in partnership with Bayer AG. Lilly said it “very much” wants to continue the agreement with Bayer, which sells Vitrakvi outside the United States and shares U.S. commercial costs and profits with Loxo.","Loxo is also developing LOXO-292 targeting a different rare gene mutation, and analysts have forecast eventual annual sales of over $1 billion. Lilly would gain full control of that drug as it is not part of Loxo’s Bayer collaboration.","In an interview, Lilly Chief Executive David Ricks said that drug targeting a mutation known as RET, seen in thyroid, lung and other cancers, was a major driver of the deal. It received breakthrough therapy designation from U.S. regulators, which could speed its path to approval.","Loxo was quick to take advantage of new technologies that can isolate genetic drivers of tumor growth, and the willingness of regulators to approve treatments across tumor types when a specific defect is present, Ricks said at the annual JPMorgan Healthcare Conference in San Francisco on Monday.","“Loxo sort of predicted that and then capitalized on that in a way that created value,” Ricks said, adding that the acquisition will help Lilly identify new targetable mutations. He said Lilly was also interested in expanding in immuno-oncology through its own research and possible deals.","Targeted therapies offer the promise of potentially dramatic results if patients most likely to benefit are correctly identified, and are seen as a potential alternative to chemotherapy and its many adverse side effects.","“The acquisition of Loxo, along with last week’s acquisition of Celgene, may represent the cream of the crop in biotech being harvested by big pharma,” IFS Securities analyst David Bouchey said. “The size of the deal may indicate Lilly’s willingness to pay up to out-bid the competition.”",BMO Capital Markets analyst Alex Arfaei said the $8 billion valuation seemed high as Wall Street does not expect Loxo revenue to reach $1 billion until 2023.,"Loxo’s drugs present the particular challenge of finding advanced cancer patients with the rare genetic mutations, which will require significantly increased use of advanced sequencing of tumors. The TRK mutation targeted by Vitrakvi only occurs in about 1 percent of patients with solid tumor cancers.","That effort got a boost last year, when the U.S. government said its Medicare program will cover so-called next generation sequencing, which looks for hundreds of mutations across all solid tumors, for advanced cancer patients.","Lilly has typically eschewed large deals, preferring to develop its own drugs. But last year it paid $1.6 billion for Armo Biosciences, a developer of immunotherapy cancer drugs, and said in November it was open to more deals.","Lilly’s oncology portfolio includes lung cancer chemotherapy Alimta, which had third-quarter sales of $520.5 million.","Vitrakvi, priced at $32,800 per month, and experimental follow-up drug LOXO-195, on which Bayer is also a partner, together could generate annual sales of about $750 million, according to Piper Jaffray & Co.",Bayer said it does not expect the Lilly deal to impact its contract with Loxo for the time being.,"Loxo’s shares have run up nearly 65 percent over the past 12 months, and ten-fold since its IPO in 2014, while Lilly’s stock has surged about 35 percent since last January."
143,https://www.reuters.com/article/deals-day/deals-of-the-day-mergers-and-acquisitions-idUSL3N1Z73A0,2019-01-07T21:00:28Z,Deals of the day-Mergers and acquisitions,"(Adds QEP Resources, Bandhan Bank, Embraer, Rowan Companies Plc, Petroregional del Lago; Updates Eli Lilly, Dollar Tree)","Jan 7 (Reuters) - The following bids, mergers, acquisitions and disposals were reported by 2100 GMT on Monday:","** Eli Lilly and Co said it will buy Loxo Oncology Inc for $8 billion, an expensive bet on a pipeline of cancer drugs that target rare genetic mutations and the biggest acquisition in Lilly’s 143-year history.",** IT and consulting services provider DXC Technology Co said on Monday it would buy software development company Luxoft Holding Inc for about $2 billion to expand its digital offerings to the financial and automotive sectors.,"** Australian medical centre operator Healius Ltd on Monday rejected a A$1.7 billion ($1.21 billion) buyout approach from China’s Jangho Group Co Ltd, denting its shares but leaving investors hoping for a higher offer.","** Mexican petrochemical company Alpek, a unit of conglomerate Alfa, said on Sunday it had agreed to sell two cogeneration energy plants to a subsidiary of London-listed power generator ContourGlobal for $801 million.","** Sanofi will pay Regeneron some $582 million in a revision of their deal in immuno-oncology, a growing sector in healthcare research which aims to help the body’s own immune system fight cancer.",** Activist hedge fund Starboard Value LP called on Dollar Tree Inc to sell its underperforming Family Dollar business and proposed replacing a majority of the board after revealing a stake in the U.S. discount retailer.,"** India’s Bandhan Bank Ltd will buy mortgage provider Gruh Finance Ltd in a share-swap deal to build up its housing loan portfolio, the companies said.","** Hedge fund Elliott Management Corp offered to buy QEP Resources Inc, which has a big presence in the Permian Basin near major energy producers, for $2.07 billion, or $8.75 per share, 44 percent above the stock’s closing price on Friday.",** Brazil’s national security adviser Augusto Heleno said that the government is studying if the current deal between planemakers Embraer and Boeing is in its “ideal form” or if it will need to present suggestions.,"** Hedge fund Canyon Capital Advisors warned it would vote against the $2.38 billion sale of offshore driller Rowan Companies Plc to rival Ensco Plc, casting doubt on a combination that had signaled optimism about the future of offshore exploration.","** France’s Maurel & Prom will invest $400 million to take a 40 percent stake in a Venezuela oilfield joint venture called Petroregional del Lago, state oil company PDVSA President Manuel Quevedo said. (Compiled by Vibhuti Sharma and Manogna Maddipatla in Bengaluru)"
144,https://www.reuters.com/article/loxo-oncology-ma-lilly/lilly-to-buy-loxo-oncology-for-about-8-bln-idUSL3N1Z73D4,2019-01-07T11:37:20Z,Lilly to buy Loxo Oncology for about $8 bln,Jan 7 (Reuters) - Eli Lilly and Co said on Monday it would buy Loxo Oncology Inc for about $8 billion in cash.,The offer of $235 per share in cash represents a premium of about 68 percent to Loxo’s Friday close.,"In November, a Loxo drug found to be effective against a wide variety of cancers driven by a single, rare genetic mutation won U.S. approval. (Reporting by Ankur Banerjee in Bengaluru Editing by Saumyadeb Chakrabarty)"
145,https://www.reuters.com/article/us-lilly-alzheimers-ac-immune/lilly-partners-with-ac-immune-for-alzheimers-treatment-idUSKBN1OB18F,2018-12-12T11:55:26Z,Lilly partners with AC Immune for Alzheimer's treatment,(Reuters) - U.S. drugmaker Eli Lilly & Co and AC Immune SA have agreed to jointly develop the Swiss biotech’s potential treatment for Alzheimer’s disease.,AC Immune already has such partnerships with Johnson & Johnson and Roche Holding AG.,"There is a desperate need for a treatment for Alzheimer’s disease. Several drugmakers, including Pfizer Inc and Merck and Co Inc, have been forced to abandon their trials after dozens of failures of experimental drugs.","An estimated 5.7 million Americans of all ages are living with Alzheimer’s dementia in 2018, and this number is projected to rise to nearly 14 million by 2050, according to the Alzheimer’s Association.","AC Immune will conduct the early-stage development of the treatment, ACI-3024, while Lilly will fund and conduct further clinical development, the two companies said in a statement.",AC Immune will receive an upfront payment of 80 million Swiss francs ($80.5 million) and $50 million in exchange for a note convertible to equity at a premium.,AC Immune will also get 60 million Swiss francs in near-term development milestone payments and other potential payments of up to 1.7 billion Swiss francs.
146,https://www.reuters.com/article/lilly-alzheimers-ac-immune/lilly-partners-with-ac-immune-for-alzheimers-treatment-idUSL3N1YH3KR,2018-12-12T11:10:13Z,Lilly partners with AC Immune for Alzheimer's treatment,Dec 12 (Reuters) - Eli Lilly & Co and AC Immune SA have agreed to jointly develop a potential treatment for Alzheimer’s disease.,"Under the terms of the deal, AC Immune will receive an upfront payment of 80 million Swiss francs ($80.47 million) and $50 million in exchange for a note convertible to equity at a premium, the companies said on Wednesday."
