1,https://www.reuters.com/article/lilly-results/eli-lilly-profit-falls-7-on-higher-costs-idUSL4N2MK2X8,"April 27, 2021 3:21 PM UTC",Eli Lilly profit falls 7% on higher costs,Eli Lilly and Co (LLY.N) on Tuesday missed expectations for first-quarter profit and cut the top end of its full-year earnings forecast as demand waned for its COVID-19 antibody therapies with the U.S. vaccine rollout in full swing.,"Nearly 30% of the U.S. population has been vaccinated against COVID-19, hitting demand for antibody drugs that already suffered from slower-than-expected uptake by hospitals.","""We didn't get into this thinking about margins. We wanted to be useful during the pandemic,"" said Lilly Chief Executive Officer David Ricks.","The company's single antibody therapy is no longer being used in the United States after lab tests showed bamlanivimab alone was not effective against some of the new coronavirus variants now widely circulating. It is still being used effectively in combination with etesevimab, another Lilly antibody drug.",Sales of other high-profile Lilly drugs also fell short of Wall Street expectations and its shares fell 3% to $181.64 in morning trading.,"""We assumed lower sales of COVID-19 antibodies would impact the quarter and guidance .... but the extent of the miss, especially for important products such as Taltz and Verzenio, is surprising to us,"" said Mizuho analyst Vamil Divan.","Sales of psoriasis drug Taltz fell 9% to $403.2 million, missing estimates by $82 million, due to lower prices. The company said it expects the drug to return to net sales growth in the second quarter.","Sales of breast cancer drug Verzenio, facing tough competition, rose 43% to $269 million, shy of Wall Street estimates of $290 million.","Lilly reported sales of $810.1 million from its COVID-19 drugs in the quarter, below estimates of $985 million and fourth-quarter sales of $871.2 million.","The company now expects adjusted full-year earnings of $7.80 to $8.00 per share, from its prior forecast of $7.75 to $8.40 per share.",Lilly sees 2021 antibody combination therapy sales of $1 billion to $1.5 billion. It had previously forecast sales as high as $2 billion.,"Excluding items, the company earned $1.87 per share, missing analysts' estimates by 26 cents, according to IBES data from Refinitiv.",
2,https://www.reuters.com/article/us-health-coronavirus-lilly/lilly-asks-fda-to-not-allow-lone-use-of-covid-19-drug-bamlanivimab-idUSKBN2C3197,"April 16, 2021 2:49 PM UTC",Lilly asks FDA to not allow lone use of COVID-19 drug bamlanivimab,"(Reuters) - Eli Lilly and Co said it had requested cancellation of the U.S. authorization granted to its COVID-19 antibody, bamlanivimab, which will now be used in combination with another to achieve greater efficacy against emerging virus variants.",,"The request made to the U.S. Food and Drug Administration is not due to any new safety issues, but in response to the new variants in the country that could be resistant to bamlanivimab when used alone, the drugmaker said in a statement.",,The U.S. government stopped the distribution of the therapy last month.,,"Hospitals with bamlanivimab supply should now order etesevimab to pair with it, Lilly said.",,"Earlier this week, Lilly revised its pact with the U.S. government to enable the supply of etesevimab to complement doses of bamlanivimab that the government had already purchased.",,"Etesevimab and bamlanivimab together neutralize more emerging COVID-19 variants in the U.S. than bamlanivimab alone, including the rapidly growing B.1.427/B.1.429 California strain, Lilly said on Friday.",,"Lilly said it was not seeking cancellation of bamlanivimab's authorization in other countries, but its use was preferred in combination with etesevimab.",,The drugmaker said it expects to make enough of the cocktail therapy along with partner Amgen to meet global supply needs.,,
3,https://www.reuters.com/article/us-health-coronavirus-lilly/eli-lillys-arthritis-drug-fails-to-prevent-mechanical-ventilation-in-covid-19-patients-idUSKBN2BV1JE,2021-04-08T13:28:08Z,Eli Lilly's arthritis drug fails to prevent mechanical ventilation in COVID-19 patients,(Reuters) -Eli Lilly and Co and Incyte Corp said their rheumatoid arthritis drug baricitinib did not meet the main goal of preventing progression to mechanical ventilation in hospitalized COVID-19 patients under a late-stage study.,"Patients receiving baricitinib were 2.7% less likely than those receiving standard of care to progress to ventilation, which was not statistically significant, the data showed. (refini.tv/3t0NfHD)",Baricitinib has been granted emergency use authorization by the U.S. Food and Drug Administration in combination with remdesivir for COVID-19 patients requiring supplemental oxygen.,"The study enrolled 1,525 hospitalized COVID-19 patients who received either baricitinib or placebo along with standard of care including corticosteroids and remdesivir.","Lilly will share the data from the trial with regulatory authorities in the United States, European Union and other geographies to evaluate next steps."
4,https://www.reuters.com/article/health-coronavirus-lilly/eli-lillys-arthritis-drug-fails-to-meet-main-goal-of-late-stage-covid-19-study-idUSL4N2M12H1,"April 8, 2021 11:26 AM UTC",Eli Lilly's arthritis drug fails to meet main goal of late-stage COVID-19 study,Eli Lilly and Co (LLY.N) and Incyte Corp (INCY.O) said their rheumatoid arthritis drug baricitinib did not meet the main goal of preventing progression to mechanical ventilation in hospitalized COVID-19 patients under a late-stage study.,"Patients receiving baricitinib were 2.7% less likely than those receiving standard of care to progress to ventilation, which was not statistically significant, the data showed. (https://refini.tv/3t0NfHD)",Baricitinib has been granted emergency use authorization by the U.S. Food and Drug Administration in combination with remdesivir for COVID-19 patients requiring supplemental oxygen.,"The study enrolled 1,525 hospitalized COVID-19 patients who received either baricitinib or placebo along with standard of care including corticosteroids and remdesivir.","Lilly will share the data from the trial with regulatory authorities in the United States, European Union and other geographies to evaluate next steps.",
5,https://www.reuters.com/article/lawyer-compensation-healthcare/pharma-and-healthcare-gcs-made-millions-in-2020-idUSL1N2LL3GJ,2021-03-23T22:53:45Z,Pharma and healthcare GCs made millions in 2020,"Top lawyers at major pharmaceutical companies Eli Lilly and Co and AbbVie Inc had a lucrative year, new regulatory filings show, with the coronavirus pandemic keeping Big Pharma busy in 2020 even as it wreaked economic havoc elsewhere.","Total compensation for AbbVie chief legal officer Laura Schumacher surpassed $17.1 million in 2020, the Humira drugmaker disclosed in a Monday filing with the U.S. Securities and Exchange Commission. Over $5.7 million of that stemmed from changes to pension value and non-qualified defined contribution plan earnings.","To read the full story on Westlaw Today, click here: bit.ly/3d3leZd"
6,https://www.reuters.com/article/us-lilly-study/eli-lilly-bowel-disease-treatment-succeeds-in-late-stage-study-idUSKBN2B81DY,2021-03-16T11:16:39Z,Eli Lilly bowel disease treatment succeeds in late-stage study,Eli Lilly and Co said on Tuesday its experimental treatment for an inflammatory bowel disease succeeded in a late-stage trial.,"The 12-week study was testing the efficacy and safety of mirikizumab in patients with moderate to severe ulcerative colitis, a chronic inflammatory disease of the colon that leads to ulcers causing abdominal pain, bloody stools and incontinence.",Mirikizumab met the main goal of reducing colon inflammation and frequency of stools in patients compared to placebo.,"In addition, mirikizumab demonstrated rapid improvement in patient symptoms as early as four weeks after initiating treatment and met all secondary goals of the study, the company said."
7,https://www.reuters.com/article/lilly-study/eli-lilly-bowel-disease-treatment-succeeds-in-late-stage-study-idUSL4N2LE2YU,"March 16, 2021 11:19 AM UTC",Eli Lilly bowel disease treatment succeeds in late-stage study,Eli Lilly and Co (LLY.N) said on Tuesday its experimental treatment for an inflammatory bowel disease succeeded in a late-stage trial.,"The 12-week study was testing the efficacy and safety of mirikizumab in patients with moderate to severe ulcerative colitis, a chronic inflammatory disease of the colon that leads to ulcers causing abdominal pain, bloody stools and incontinence.",Mirikizumab met the main goal of reducing colon inflammation and frequency of stools in patients compared to placebo.,"In addition, mirikizumab demonstrated rapid improvement in patient symptoms as early as four weeks after initiating treatment and met all secondary goals of the study, the company said.",
8,https://www.reuters.com/article/us-health-coronavirus-eli-lilly-antibody/u-s-limits-supply-of-eli-lillys-covid-19-antibody-therapy-in-three-states-idUSKBN2B42U5,2021-03-12T23:11:33Z,U.S. limits supply of Eli Lilly's COVID-19 antibody therapy in three states,(Reuters) - The U.S. Department of Health and Human Services said it will limit distribution of Eli Lilly and Co’s COVID-19 antibody therapy in three states over concerns regarding the impact of a new variant on its effectiveness.,"The U.S government is evaluating recommendations for using the antibody, bamlanivimab, in regions where the variant, CAL.20C, which was found in California, is circulating in high numbers, the department said. (bit.ly/3ljEZzK)","While evaluations are ongoing, direct ordering of bamlanivimab will not be allowed in California, Arizona and Nevada, HHS said, adding that other authorized COVID-19 antibody therapies will remain available in the states.","The U.S. FDA in November granted emergency use authorization to bamlanivimab and a two-antibody cocktail developed by Regeneron Pharmaceuticals Inc. Eli Lilly also has a combination therapy of two antibodies, bamlanivimab and etesevimab, which was authorized in February.",Eli Lilly said earlier this week its combination therapy reduced the risk of hospitalization and death by 87% in high-risk COVID-19 patients in a study. (reut.rs/3vlPyqo)
9,https://www.reuters.com/article/us-health-coronavirus-gsk-vir-biotech/vir-gsk-to-seek-emergency-use-clearance-for-covid-19-antibody-therapy-idUSKBN2B3072,2021-03-11T23:35:07Z,"Vir, GSK to seek emergency use clearance for COVID-19 antibody therapy","(Reuters) - Vir Biotechnology and Britain’s GSK plan to seek emergency use authorization for their experimental COVID-19 antibody therapy after interim data from a study showed 85% reduction in hospitalization and deaths among patients, the companies said.","The move brings the antibody therapy one step closer to becoming another weapon against the pandemic, with similar therapies from Eli Lilly and Regeneron Pharmaceuticals receiving recommendations from U.S. and European health regulators earlier this year.",Vir and GSK said in a joint statement on Wednesday that an independent panel recommended stopping further enrollment in the late-stage trial of the therapy due to evidence of “profound efficacy”.,The companies said they plan to use the results of the study to seek emergency use authorization from the U.S. Food and Drug Administration and regulatory approvals in other countries.,Vir Chief Executive George Scangos said in a Thursday interview with Reuters that Vir is in contract talks for the therapy with governments including the United States and that the data will likely speed up their progress towards a deal.,Antibody treatments are designed to decrease the severity of COVID-19 among patients diagnosed with the infection.,"Vir and GSK also said that a new laboratory study showed the therapy, VIR-7831, was equally effective against the UK, South African and Brazilian variants of the coronavirus.",Scangos said Vir is reviewing data from its study to identify which patients have variants of COVID-19 and confirm the antibody is effective against them.,"“We don’t yet have data to definitely say the antibody is as effective against variants of the virus as it is against prototypic strains. It appears that way from preclinical research,” Scangos said.",Vir and GSK announced a partnership last year to research COVID-19 treatments.
10,https://www.reuters.com/article/us-health-coronavirus-europe-eli-lilly/europe-begins-rolling-review-of-eli-lillys-antibodies-for-covid-19-idUSKBN2B313H,2021-03-11T10:58:10Z,Europe begins rolling review of Eli Lilly's antibodies for COVID-19,"(Reuters) - Europe’s drug regulator said on Thursday it had initiated a rolling review of U.S.-based Eli Lilly’s antibodies to treat COVID-19, days after saying their combination could be used in patients at high risk of progressing to severe illness.","Lilly’s bamlanivimab and etesemivab belong to a class of drugs called monoclonal antibody treatments, which mimic natural antibodies the body generates to fight infection.",This is the latest antibody treatment to earn such a review in the region and follows the European Medicines Agency’s (EMA) evaluation of drugs from South Korea’s Celltrion and U.S.-based Regeneron.,The rolling reviews are aimed at speeding up the approval process by allowing researchers to submit findings in real-time before final trial data is available.,"Vir Biotechnology and Britain’s GSK plan to seek emergency use authorization for their experimental antibody therapy after interim data, the companies said on Thursday.","EMA said it was yet to evaluate the full dataset, adding it was too early to draw any conclusions regarding the benefit-risk balance of Lilly’s medicines.","It said the decision to start the review was based on preliminary results from two studies, one testing the ability of the antibodies to treat patients when combined and the other when bamlanivimab is used as a standalone.","So far, vaccines from Pfizer/BioNTech,, Moderna and AstraZeneca/Oxford have been approved in the region, with the verdict on J&J’s single-shot vaccine is expected later in the day.",(This story has been refiled to add reporting credits)
11,https://www.reuters.com/article/health-coronavirus-europe-eli-lilly/europe-begins-review-of-eli-lillys-antibodies-for-covid-19-idUSL4N2L92HV,"March 11, 2021 10:58 AM UTC",Europe begins review of Eli Lilly's antibodies for COVID-19,"Europe's drug regulator said on Thursday it had initiated a rolling review of U.S.-based Eli Lilly's (LLY.N) antibodies to treat COVID-19, days after saying their combination could be used in patients at high risk of progressing to severe illness.","Lilly's bamlanivimab and etesemivab belong to a class of drugs called monoclonal antibody treatments, which mimic natural antibodies the body generates to fight infection.",This is the latest antibody treatment to earn such a review in the region and follows the European Medicines Agency's (EMA) evaluation of drugs from South Korea's Celltrion and U.S.-based Regeneron (REGN.O).,The rolling reviews are aimed at speeding up the approval process by allowing researchers to submit findings in real-time before final trial data is available.,"Vir Biotechnology (VIR.O) and Britain's GSK (GSK.L) plan to seek emergency use authorization for their experimental antibody therapy after interim data, the companies said on Thursday. read more","EMA said it was yet to evaluate the full dataset, adding it was too early to draw any conclusions regarding the benefit-risk balance of Lilly's medicines.","It said the decision to start the review was based on preliminary results from two studies, one testing the ability of the antibodies to treat patients when combined and the other when bamlanivimab is used as a standalone.","So far, vaccines from Pfizer/BioNTech (PFE.N), (22UAy.DE), Moderna (MRNA.O) and AstraZeneca (AZN.L)/Oxford have been approved in the region, with the verdict on J&J's (JNJ.N) single-shot vaccine is expected later in the day.",,
12,https://www.reuters.com/article/brief-ema-starts-rolling-review-of-eli-l/brief-ema-starts-rolling-review-of-eli-lilly-antibodies-bamlanivimab-and-etesemivab-for-covid-19-idUSFWN2L81L0,2021-03-11T09:06:09Z,BRIEF-EMA Starts Rolling Review Of Eli Lilly Antibodies Bamlanivimab And Etesemivab For COVID-19,March 11 (Reuters) - EMA:,* EMA STARTS ROLLING REVIEW OF ELI LILLY ANTIBODIES BAMLANIVIMAB AND ETESEMIVAB FOR COVID-19,"* EMA SAYS EMA HAS STARTED EVALUATING THE FIRST BATCH OF DATA, WHICH COME FROM ANIMAL STUDIES (NON-CLINICAL DATA).","* EMA - OVERALL REVIEW TIMELINE CANNOT BE FORECAST YET, PROCESS SHOULD BE QUICKER THAN REGULAR EVALUATION DUE TO TIME GAINED DURING ROLLING REVIEW",* EMA SAYS THE REVIEW WILL ALSO LOOK AT BAMLANIVIMAB USED ALONE.,* EMA SAYS THE PROCESS SHOULD BE QUICKER THAN A REGULAR EVALUATION DUE TO THE TIME GAINED DURING THE ROLLING REVIEW.,"* EMA ON ELI LILLY ANTIBODIES BAMLANIVIMAB & ETESEMIVAB, SAYS TOO EARLY TO DRAW ANY CONCLUSIONS REGARDING THE BENEFIT-RISK BALANCE OF THE MEDICINES Source text : bit.ly/2N5voQc Further company coverage:"
13,https://www.reuters.com/article/products-incretin/judge-shuts-down-mdl-claiming-link-between-diabetes-drugs-and-pancreatic-cancer-idUSL1N2L900I,2021-03-11T00:14:35Z,Judge shuts down MDL claiming link between diabetes drugs and pancreatic cancer,"A federal judge in San Diego has rejected claims by some 1,500 plaintiffs in a multidistrict litigation that several similar type 2 diabetes drugs increase the risk of pancreatic cancer.","U.S. District Judge Anthony Battaglia on Tuesday granted summary judgment to AstraZeneca PLC’s Amylin Pharmaceuticals, Eli Lilly and Co, Merck & Co Inc and Novo Nordisk Inc, finding the plaintiffs’ claims preempted by federal law.","To read the full story on Westlaw Today, click here: bit.ly/2OjtpIJ"
14,https://www.reuters.com/article/us-eli-lilly-rigel/eli-lilly-in-deal-with-rigel-to-develop-autoimmune-therapy-for-up-to-960-million-idUSKBN2AI1HO,2021-02-18T12:19:31Z,Eli Lilly in deal with Rigel to develop autoimmune therapy for up to $960 million,"(Reuters) - Eli Lilly will gain exclusive worldwide license to Rigel Pharmaceuticals Inc’s autoimmune and inflammatory diseases treatment, including its lead candidate, R552, for potentially up to $960 million, the companies said on Thursday.","Rigel will receive an upfront cash payment of $125 million, with the potential for an additional up to $835 million in milestone payments.","R552 belongs to a class of drugs called RIPK1 inhibitors which target a critical signaling protein that regulates inflammation and cell death in tissues. It is a new approach to treat various autoimmune, inflammatory, and neurodegenerative disorders.","Under the deal, Lilly will foot the costs of global commercialization for the therapy, R552, and Rigel will have the right to co-sell the treatment in the United States.",Lilly will also lead all clinical development and commercialization of the treatment in central nervous system diseases.,Rigel’s lead therapy has completed early-stage trials and will begin mid-stage trials this year.,Shares of Rigel were up 37% before the bell.
15,https://www.reuters.com/article/eli-lilly-rigel/eli-lilly-to-pay-up-to-960-mln-for-rigels-autoimmune-disease-therapy-idUSL4N2KO2XK,"February 18, 2021 12:21 PM UTC",Eli lilly to pay up to $960 mln for Rigel's autoimmune disease therapy,"Eli Lilly (LLY.N) will gain exclusive worldwide license to Rigel Pharmaceuticals Inc's (RIGL.O) autoimmune and inflammatory diseases treatment, including its lead candidate, R552, for potentially up to $960 million, the companies said on Thursday.","Rigel will receive an upfront cash payment of $125 million, with the potential for an additional up to $835 million in milestone payments.","R552 belongs to a class of drugs called RIPK1 inhibitors which target a critical signaling protein that regulates inflammation and cell death in tissues. It is a new approach to treat various autoimmune, inflammatory, and neurodegenerative disorders.","Under the deal, Lilly will foot the costs of global commercialization for the therapy, R552, and Rigel will have the right to co-sell the treatment in the United States.",Lilly will also lead all clinical development and commercialization of the treatment in central nervous system diseases.,Rigel's lead therapy has completed early-stage trials and will begin mid-stage trials this year.,Shares of Rigel were up 37% before the bell.,
16,https://www.reuters.com/article/us-health-coronavirus-lilly-fda/eli-lillys-antibody-combination-receives-fda-emergency-use-authorization-for-covid-19-idUSKBN2AA02P,2021-02-10T08:25:17Z,Eli Lilly's antibody combination receives FDA emergency use authorization for COVID-19,"(Reuters) - Eli Lilly’s combination antibody therapy to fight COVID-19 has been granted emergency use authorization by the U.S. Food and Drug Administration, Lilly said on Tuesday.","Lilly’s combination therapy of two antibodies, bamlanivimab and etesevimab, helped cut the risk of hospitalization and death in COVID-19 patients by 70%, data from a late-stage trial showed in January.",Lilly said the therapy will be available immediately.,"“There are 100,000 doses ready immediately and an additional 150,000 doses will be available throughout the first quarter,” Lilly said in a statement.","The company said that in collaboration with Amgen, it plans to manufacture up to 1 million doses of etesevimab for administration with bamlanivimab by mid-2021.",Lilly said the “therapy is authorized for the treatment of mild to moderate COVID-19 in patients aged 12 and older who are at high risk for progressing to severe COVID-19 and/or hospitalization.”,"The FDA, separately, said bamlanivimab and etesevimab are not authorized for patients hospitalized due to COVID-19 or who require oxygen therapy due to COVID-19.","Late last month, Lilly reported a fourth-quarter profit that topped Wall Street estimates. It recorded $871.2 million in quarterly sales of the COVID-19 therapy bamlanivimab, benefiting from the U.S. government’s move to stock up on the drug for emergency use.",(This story corrects typographical error in first paragraph)
17,https://www.reuters.com/article/health-coronavirus-lilly-fda/eli-lillys-antibody-combination-receives-fda-emergency-use-authorization-for-covid-19-idUSFWN2KF18A,"February 10, 2021 1:29 AM UTC",Eli Lilly's antibody combination receives FDA emergency use authorization for COVID-19,"The U.S. Food and Drug Administration (FDA) granted emergency use authorization (EUA) to Eli Lilly's (LLY.N) combination antibody therapy to fight COVID-19, the U.S. drugmaker said on Tuesday.","Eli Lilly's combination therapy of two antibodies, bamlanivimab and etesevimab, helped cut the risk of hospitalization and death in COVID-19 patients by 70%, data from a late-stage trial showed in January. read more","""This therapy is authorized for the treatment of mild to moderate COVID-19 in patients aged 12 and older who are at high risk for progressing to severe COVID-19 and/or hospitalization"", the company said in a statement.",
18,https://www.reuters.com/article/us-lilly-cfo/lilly-says-cfo-resigns-after-investigation-into-inappropriate-relationship-idUSKBN2A91KO,2021-02-09T19:00:53Z,Lilly says CFO resigns after investigation into inappropriate relationship,(Reuters) - Eli Lilly and Co said on Tuesday Chief Financial Officer Josh Smiley had resigned after allegations about a personal relationship sparked an investigation that found “inappropriate personal communication” with some company employees.,The Indianapolis-based drugmaker said it immediately hired external counsel to conduct an independent probe after it was made aware of the allegations. The investigation revealed consensual though inappropriate personal communications between Smiley and certain Lilly employees.,Lilly said the behavior exhibited poor judgment by Smiley. The company would not give further details on the communications or the number of employees involved.,"Reuters could not immediately reach Smiley for comment. A LinkedIn search showed Smiley’s account, which he managed himself, was no longer available.","The company took “swift and significant action” as soon as it learned about the allegations, a Lilly spokeswoman told Reuters.",Eli Lilly shares were down about 2%. The stock had risen 40% through Monday’s close in the past 12 months.,"Smiley has been with the company since 1995 and became CFO in 2018. He will be replaced by Anat Ashkenazi, who joined the company in 2001 and was most recently senior vice president, controller and chief financial officer of Lilly Research Laboratories, Lilly said.","Smiley’s conduct was not related to financial controls, financial statements or any other business matters or judgments, the company said, and he will be available to assist in the transition of his role through July at reduced cash compensation of $9,000 every two weeks.","Smiley has agreed to forgo all of his $1 million 2020 cash bonus, about $3 million he was awarded between 2018 and 2020, and all of his other current and future stock awards, totaling about $20 million based on Lilly’s share price, according to a public filing. Earlier this month, Smiley sold shares worth more than $3 million, filings show.",Executive behavior and the treatment of employees has been under scrutiny over the past few years following the #MeToo social media movement.,"In 2019, McDonald’s Corp dismissed Chief Executive Steve Easterbrook over a consensual relationship with an employee, which the board determined violated company policy.","Intel Corp INTC.O Chief Executive Brian Krzanich resigned in June 2018, after an investigation found he had a consensual relationship with an employee that breached company policy."
