37,https://www.reuters.com/article/us-health-coronavirus-junshi/shanghai-junshi-delays-drug-trials-focuses-on-covid-19-treatment-idUSKBN27T1YT,2020-11-13T14:24:56Z,"Shanghai Junshi delays drug trials, focuses on COVID-19 treatment","BEIJING (Reuters) - A shortage of lab monkeys and a focus on developing a COVID-19 treatment have prompted Shanghai Junshi Biosciences to push back clinical trials of some other drugs, an executive at U.S. drugmaker Eli Lilly's LLY.N Chinese partner said.","Junshi's 688180.SS1877.HK experimental COVID-19 antibody treatment, JS016, is in early to mid-stage trials in the United States and Eli Lilly plans to combine it with another candidate and apply for a U.S. emergency use authorization later this month.","Feng Hui, chief operating officer at Junshi said in a call with investors on Friday that the monkeys used to evaluate the safety of drugs and how they work in living systems before they can be tested in humans had been in tight supply between February and June, partly because of competing research by firms and institutes into COVID-19 treatments.","As his company prioritised finding enough animals on which to test the antibody treatment, it delayed applications for clinical trials of some of its non-coronavirus drugs in the pipeline, Feng said.","It had originally planned to file applications for clinical trials of those drugs in the second half of this year but the schedule is now pushed back to the first quarter of 2021, he added, without elaborating on how many and which drugs were involved.","“Overall the firm’s research and development progress is smooth,” Feng said.","Many global pharmaceutical companies have rushed to develop vaccines and treatments against COVID-19 at an unprecedented speed this year, as the pandemic has killed more than 1.2 million people globally.","There are around 200 experimental COVID-19 vaccines being researched and more than 40 of them are being studied on humans, according to the World Health Organization."
38,https://www.reuters.com/article/us-health-coronavirus-britain-fauci/fauci-stresses-on-need-for-equitable-access-of-covid-19-vaccines-idUSKBN27S25O,2020-11-12T15:34:04Z,Fauci stresses on need for equitable access of COVID-19 vaccines,"(Reuters) - U.S. infectious disease expert Anthony Fauci said on Thursday vaccine developers should push to make billions of their COVID-19 vaccines to ensure access to all parts of the world, instead of focusing on the rich countries.","Fauci’s comments come days after Pfizer Inc said its COVID-19 vaccine candidate was more than 90% effective based on initial results from a large-scale trial, securing a lead in the race to develop a safe and effective vaccine for the respiratory illness.","Pfizer has a $1.95 billion contract with the U.S. government to deliver 100 million vaccine doses beginning this year, as well as a deal with the European Union to supply up to 300 million doses.","“Now a number of different companies are talking about the ability to make billions of doses. That’s what we need. We don’t need hundreds of millions for the rich countries,” Fauci said at a webinar conducted by British think tank Chatham House.","“We need billions (of vaccine doses), so whether you live in the darkest part of the developing world, or if you live in London, you should have the same access.”","Experts have also raised doubts about access to the vaccine, especially in the developing countries, as it needs to be stored at temperatures of minus 70 degrees Celsius (-94 F) or below, posing infrastructure challenges.","“Certainly it is not going to be pandemic for a lot longer, because I believe the vaccines are going to turn that around,” Fauci said, while adding that there may be a need to re-vaccinate people intermittently, if COVID-19 becomes endemic.",Fauci said efforts were underway in the United States to push for the development of antivirals and other therapies for early intervention during the course of the COVID-19 respiratory illness.
39,https://www.reuters.com/article/health-coronavirus-britain-fauci/antivirals-therapies-for-early-intervention-need-of-the-hour-to-tackle-covid-19-fauci-idUSL4N2HY3KF,2020-11-12T14:34:09Z,"Antivirals, therapies for early intervention need of the hour to tackle COVID-19 - Fauci",Nov 12 (Reuters) - U.S. infectious disease expert Anthony Fauci said on Thursday that efforts are underway in the U.S. to push for the development of antivirals and other therapies for early intervention during the course of the COVID-19 respiratory illness.,"Fauci’s comments come days after the United States authorized emergency use of Eli Lilly & Co’s bamlanivimab, the first experimental antibody drug for COVID-19 in patients who are not hospitalized, but are at risk of serious illness because of their age or other conditions.","“Studies have shown that things like dexamethasone and remdesivir have very positive effects late in the course when people are hospitalized, even when they’ve been on ventilators and requiring oxygen,” Fauci said at a webinar conducted by British think tank Chatham House. (Reporting by Manojna Maddipatla in Bengaluru; Editing by Shounak Dasgupta)"
40,https://www.reuters.com/article/health-coronavirus-vaccine-azar/health-secretary-says-u-s-will-ensure-equitable-distribution-of-coronavirus-treatment-idUSL1N2HW174,2020-11-10T13:47:35Z,Health secretary says U.S. will ensure equitable distribution of coronavirus treatment,"WASHINGTON, Nov 10 (Reuters) - U.S. Health Secretary Alex Azar said on Tuesday the U.S. government would ensure equitable distribution of Eli Lilly’s antibody treatment for COVID-19 patients, starting first with hospitals and areas where there are many cases.","“We’ll ensure equitable distribution, and we’ll work tightly with our governors,” Azar said, using the same process the government used with remdesivir, a drug used to treat people hospitalized with COVID-19.","Azar said health officials and Lily were exploring other ways to give the treatment outside hospitals, including outpatient infusion centers. (Reporting by Doina Chiacu; Editing by Andrew Heavens)"
41,https://www.reuters.com/article/health-coronavirus-eli-lilly-fda/u-s-allows-emergency-use-of-eli-lillys-covid-19-antibody-therapy-idUSL1N2HA0DG,2020-11-09T23:47:00Z,U.S. allows emergency use of Eli Lilly's COVID-19 antibody therapy,"Nov 9 (Reuters) - The U.S. Food and Drug Administration on Monday authorized emergency use of Eli Lilly and Co’s experimental COVID-19 antibody treatment, which President Donald Trump has praised and vowed to make available free of cost for all Americans.","The FDA said its emergency use authorization was based on clinical trials showing that the treatment, bamlanivimab, reduced the need for hospitalization or emergency room visits in COVID-19 patients at high risk of disease progression. It can be used for treating mild-to-moderate COVID-19 in adults and pediatric patients over the age of 12, the FDA said."
42,https://www.reuters.com/article/health-coronavirus-lilly/u-s-strikes-deal-with-lilly-for-potential-covid-19-antibody-drug-idUSKBN27D1UN,2020-10-28T16:38:06Z,U.S. strikes deal with Lilly for potential COVID-19 antibody drug,"(Reuters) - The U.S. government will pay as much as $1.19 billion to Eli Lilly and Co to secure nearly 1 million doses of its experimental COVID-19 antibody treatment, a drug similar to a treatment that U.S. President Donald Trump received.","Lilly will start delivering 300,000 doses of the treatment, for which it is being paid $375 million, within two months of receiving an emergency use authorization from the U.S. health regulator, the company said.","After that, the government has an option to buy an additional 650,000 vials for $812.5 million, the U.S. Department of Health and Human Services said in a statement.","The price per dose amounts to $1,250 as per the contract, but the vials purchased by the government will be free to the American public.","The U.S. has also signed deals with AstraZeneca and Regeneron Pharmaceuticals for their antibody therapies, under Trump administration’s Operation Warp Speed program.","The deal with Regeneron covers the cost of manufacturing, while the deal with AstraZeneca also includes support for development.","While vaccines are seen critical to ending the pandemic, governments are increasingly looking at other effective treatments to slow the spread of the virus and kick-start economic activity.",The company submitted a request to the U.S. Food and Drug Administration earlier this month for emergency use authorization of the drug to treat mild to moderate COVID-19 patients. The drug had a recent setback after it failed to show benefits in hospitalized patients.,"In addition, Reuters reported that U.S. drug inspectors uncovered serious quality control problems at an Eli Lilly plant that is ramping up to make its antibody therapy.",The antibody therapy is similar to a drug from Regeneron that was given to Trump during his bout with COVID-19.,The treatments belong to a class of drugs called monoclonal antibodies that are manufactured copies of antibodies created by the body to fight against an infection.
43,https://www.reuters.com/article/health-coronavirus-lilly/eli-lilly-signs-deal-with-u-s-for-300000-vials-of-potential-covid-19-drug-idUSL4N2HJ2SA,2020-10-28T10:49:19Z,"Eli Lilly signs deal with U.S. for 300,000 vials of potential COVID-19 drug","Oct 28 (Reuters) - Eli Lilly and Co said on Wednesday it signed an agreement with the U.S. government to supply 300,000 vials of its experimental antibody drug to treat COVID-19 for $375 million. (Reporting by Manas Mishra in Bengaluru; Editing by Saumyadeb Chakrabarty)"
44,https://www.reuters.com/article/usa-stocks/us-stocks-sp-500-dow-slip-on-earnings-worries-stimulus-uncertainty-idUSL4N2HI3ZL,2020-10-27T15:37:30Z,"US STOCKS-S&P 500, Dow slip on earnings worries, stimulus uncertainty","(For a Reuters live blog on U.S., UK and European stock markets, click LIVE/ or type LIVE/ in a news window.)",* Xilinx jumps on $35 bln buyout deal from AMD,* Merck up after raising profit forecast,"* Pfizer, Eli Lilly fall after results","* Indexes: Dow down 0.28%, S&P down 0.03%, Nasdaq up 0.56% (Adds comment, details; updates prices)","Oct 27 (Reuters) - The S&P 500 and Dow fell on Tuesday, dragged down by a string of earnings disappointments and doubts about a coronavirus stimulus package before Election Day, although Nasdaq rose ahead of results from mega-cap technology companies.",Caterpillar Inc fell 2.2% and 3M Co slipped 1% after both the industrial companies reported lower quarterly earnings.,"Investor sentiment sagged after the White House said a potential deal on COVID-19 relief could come in “weeks,” casting doubt on whether an accord could be struck with Congress before the Nov. 3 election.","“Stimulus is now pushed back to after the election and the market is digesting that today,” said Thomas Hayes, managing member at Great Hill Capital LLC in New York.",Sectors sensitive to economic growth took a hit. The S&P 500 banks index and the S&P energy sector shed about 1% each.,The three major U.S. stock indexes fell to near four-week lows on Monday as investors fretted about record number of new coronavirus infections in the United States and some European countries and an elusive fiscal stimulus.,"Meanwhile, Wall Street’s fear gauge hovered at its highest level in nearly two months on jitters over the outcome of the election.",Democratic challenger Joe Biden leads President Donald Trump in national polls but the race is much tighter in battleground states which determine the election outcome.,"At 10:53 a.m. ET, the Dow Jones Industrial Average fell 78.40 points, or 0.28% to 27,606.98, the S&P 500 lost 1.09 points, or 0.03% to 3,399.88 and the Nasdaq Composite gained 63.73 points, or 0.56% to 11,422.67.","The tech-heavy Nasdaq rose as Microsoft Corp firmed 1% in the run-up to its results after the closing bell. Apple Inc, Amazon.com, Google-parent Alphabet and Facebook Inc, which together account for about a fifth of the S&P 500’s total value, also report results this week.","Analysts expect the tech sector to post a 0.3% fall in third-quarter earnings from a year earlier, while overall S&P 500 profit is forecast to fall 18.4%, according to Refinitiv data.","Concerns over a rise in U.S. coronavirus cases are weighing on the market although technology sector, in particular, seems to be the least exposed, said Rick Meckler, partner, Cherry Lane Investments, a family investment office in New Vernon, New Jersey.",“A focus on big technology companies may move this market to rally despite the problems the virus is creating.”,Insurer American International Group Inc gained 2% after its board named Peter Zaffino as chief executive officer and approved a plan to separate the life and retirement business from the rest of the company.,"Semiconductor designer Advanced Micro Devices Inc fell 3.4% as it agreed to buy Xilinx Inc in a $35 billion all-stock deal. Xilinx shares soared about 10%, while those of Intel fell 3.4%.",Merck & Co Inc gained 0.2% as it raised its full-year earnings forecast. Drugmaker Eli Lilly and Co fell about 5% after its quarterly profit took a hit from increased costs to develop a COVID-19 treatment.,Declining issues outnumbered advancers for a 1.4-to-1 ratio on the NYSE and nearly matched them on the Nasdaq.,"The S&P index recorded 11 new 52-week highs and one new lows, while the Nasdaq recorded 18 new highs and 35 new lows. (Reporting by Medha Singh and Shivani Kumaresan in Bengaluru; Editing by Saumyadeb Chakrabarty and Anil D’Silva)"
45,https://www.reuters.com/article/usa-stocks/us-stocks-sp-500-flat-after-mondays-selloff-as-focus-turns-to-corporate-earnings-idUSL4N2HI3VD,2020-10-27T14:16:39Z,US STOCKS-S&P 500 flat after Monday's selloff as focus turns to corporate earnings,"(For a Reuters live blog on U.S., UK and European stock markets, click LIVE/ or type LIVE/ in a news window.)",* Xilinx jumps on $35 bln buyout deal from AMD,* Merck up after raising profit forecast,"* Pfizer, Eli Lilly fall after results","* Indexes: Dow down 0.26%, S&P flat, Nasdaq up 0.47% (Updates to market open)","Oct 27 (Reuters) - The S&P 500 was little changed on Tuesday after a sharp pull back in the prior session as investors parsed through a slew of mixed corporate earnings, while awaiting progress on U.S. fiscal stimulus.",The blue-chip Dow was weighed down by shares of Caterpillar Inc and 3M Co after the industrial companies reported lower quarterly earnings.,"The tech-heavy Nasdaq rose 0.6% as Microsoft Corp firmed 0.8% in the run-up to its results after the closing bell. Apple Inc, Amazon.com, Google-parent Alphabet and Facebook Inc, which account for about a fifth of the S&P 500’s total value, also report results this week.","Concerns over a rise in U.S. coronavirus cases is weighing on the market but technology, in particular, seems the least exposed sector, said Rick Meckler, partner, Cherry Lane Investments, a family investment office in New Vernon, New Jersey.",“A focus on the big technology companies may move this market to rally despite the problems the virus is creating.”,Record number of new coronavirus infections in the United States and some European countries and an elusive fiscal stimulus sent the three major U.S. stock indexes to near four-week lows on Monday.,Sectors sensitive to economic growth took a hit. The S&P 500 banks index and the S&P energy sector shed about 1% each.,"Meanwhile, Wall Street’s fear gauge hovered at its highest level in nearly two months on jitters over the outcome of the election.",Democratic challenger Joe Biden leads President Donald Trump in national polls but the race is much tighter in battleground states which determine the election outcome.,"At 9:43 a.m. ET, the Dow Jones Industrial Average was down 71.97 points, or 0.26%, at 27,613.41, the S&P 500 was down 0.95 points, or 0.03%, at 3,400.02. The Nasdaq Composite was up 53.17 points, or 0.47%, at 11,412.11.",Insurer American International Group Inc gained 3.3% after its board named Peter Zaffino as chief executive officer and approved a plan to separate the life and retirement business from the rest of the company.,"Semiconductor designer Advanced Micro Devices Inc fell 2.8% as it agreed to buy Xilinx Inc in a $35 billion all-stock deal that will intensify its battle with Intel Corp in the data center chip market. Xilinx shares soared about 10.2%, while Intel shares fell 1.9%.",Merck & Co Inc gained 0.4% as it raised its full-year earnings forecast. Drugmaker Eli Lilly and Co fell about 5% after its quarterly profit took a hit from increased costs to develop a COVID-19 treatment.,Declining issues outnumbered advancers for a 1.34-to-1 ratio on the NYSE. Advancing issues outnumbered decliners by a 1.02-to-1 ratio on the Nasdaq.,"The S&P index recorded eight new 52-week highs and one new lows, while the Nasdaq recorded 10 new highs and 14 new lows. (Reporting by Medha Singh and Shivani Kumaresan in Bengaluru; Editing by Saumyadeb Chakrabarty and Anil D’Silva)"
46,https://www.reuters.com/article/us-health-coronavirus-elililly/lilly-hires-external-adviser-for-covid-19-drug-plant-problems-idUSKBN2760QF,2020-10-21T13:12:13Z,Lilly hires external adviser for COVID-19 drug plant problems,(Reuters) - Eli Lilly and Co LLY.N said late on Tuesday it had hired an independent consultant to review a plant producing its COVID-19 antibody drug after receiving a notice from the U.S. health regulator.,"The company reiterated that it had not received a warning letter from the U.S. Food and Drugs Administration (FDA) following its plant inspection, which was first reported by Reuters last week.","It received an Official Action Indicated (OAI) notice from the FDA in relation to issues at its Branchburg plant in New Jersey, Lilly reiterated. (bit.ly/3m9z1AE)","Reuters on Oct. 13 reported that inspectors who visited Lilly’s plant in Branchburg, New Jersey last November found data on various manufacturing processes had been deleted and not appropriately audited, according to government inspection documents.","Following its November inspection, the FDA classified the problems as the most serious level of violation, resulting in an OAI notice.",The problems could complicate the drugmaker’s bid for an emergency use authorization from the federal agency for its COVID-19 drug.,"Last week, Lilly said other trials of its experimental coronavirus antibody therapy remain on track after a government-run study testing the treatment in hospitalized COVID-19 patients was paused due to safety concerns."
47,https://www.reuters.com/article/health-coronavirus-elililly/lilly-hires-outside-advisor-for-covid-drug-plant-problems-idUSKBN2760QR,2020-10-21T06:57:26Z,Lilly hires outside advisor for COVID drug plant problems,(Reuters) - Eli Lilly and Co said late on Tuesday it had hired an independent consultant to review a plant producing its promising COVID-19 drug after receiving notices from the U.S. health regulator.,The company reiterated that it had not received a warning letter from the U.S. Food and Drugs Administration following inspections at the plant first revealed by Reuters last week.,"The company, however, also reiterated that it had received an Official Action Indicated (OAI) notice from the FDA in relation to issues at its Branchburg plant in New Jersey."
48,https://www.reuters.com/article/global-markets/world-stocks-pause-rally-on-jj-news-dollar-bounces-from-three-week-low-idUSKBN26Y0AH,2020-10-13T20:52:19Z,"World stocks pause rally on J&J news, dollar bounces from three-week low","NEW YORK (Reuters) - The dollar rose from a three-week low on Tuesday while U.S. and European shares eased, as news of pauses in trials of a COVID-19 vaccine and a treatment led investors to take stock of recent rallies before chasing further gains.","Some analysts said the stock market pullback did not indicate a deeper aversion to risk, since many investors are convinced that more U.S. fiscal stimulus is on the way, even if it may not be unveiled until after the Nov. 3 U.S. election.","Still, demand firmed for traditional safe-haven assets such as the dollar and government bonds. A stronger dollar in turn weighed on gold prices.","China trade data released overnight signaling a rebound in the world’s second-largest economy was mostly brushed aside by stock and bond markets, though it boosted oil prices as investors hoped for a slow recovery in energy demand.","The S&P 500 .SPX fell 22.5 points, or 0.64%, to 3,511.76, but still within sight of its record high of 3,580.84 struck on Sept. 2. In the last 2-1/2-weeks, the index has rebounded 8.5%.","The Dow Jones Industrial Average .DJI dropped 157.2 points, or 0.55%, to 28,680.33. The Nasdaq Composite .IXIC pared earlier gains to lose 12.4 points, or 0.1%, to 11,863.90 points.","Shares in Johnson & Johnson JNJ.N sagged 2.6% as investors digested news that a participant in its COVID-19 vaccine trial had fallen ill, and that it would take at least a few days to evaluate the situation.",News late in the day that U.S. drugmaker Eli Lilly and Co LLY.N had also paused the clinical trial of its COVID-19 antibody treatment due to a safety concern led the U.S. equity market to deepen losses in the final minutes of trading.,Shares in Eli Lilly closed down 2.85%.,"Investors see the quick introduction of a vaccine as key to helping economies recover. J&J's news came after rival AstraZeneca AZN.L, which uses similar technology, paused the trial of its experimental vaccine in September due to a participant's unexplained illness.","“Markets have already priced in perfection,” said Ken Polcari, chief market strategist at SlateStone Wealth LLC in Florida. “It’s ‘buy the rumor, sell the news.’”",European shares also struggled as investors found a reason in news of Johnson & Johnson’s delayed trial to take profits.,"The Euro STOXX 600 .STOXX lost 0.77%, ending three straight days of gains, with markets in Frankfurt .GDAXI, London .FTSE and Paris .FCHI mirroring its moves.","The sentiment in European and U.S. equities defied earlier resilience in Asia, where Chinese shares got a lift from data that showed exports rising 9.9% in September and imports swinging to a 13.2% gain, versus a 2.1% drop in August.","The data suggested Chinese exporters were recovering from the pandemic's damage to overseas orders and helped Chinese blue-chip shares .CSI300 rise 0.33%. MSCI's broadest index of Asia-Pacific shares outside Japan .MIAPJ0000PUS, however, trimmed gains and was little changed by the end of Tuesday.",The dollar was on track for its best daily performance in three weeks. The dollar index =USD climbed 0.51% against a basket of other currencies to 93.524.,"A stronger dollar pushed the euro EUR=EBS down 0.56% to $1.1746 and weighed on sterling GBP=D3, which sank 0.96% to $1.2939. The pound had breached the $1.30 mark at one point on Tuesday as investors kept an eye on ongoing Brexit negotiations.","The Australian dollar was slugged by news that Beijing has stopped taking shipments of Australian coal, dragging the Aussie AUD=D4 down 0.67% to $0.7159 AUD=D4.",Government bond yields mostly fell as demand for safe-haven bonds firmed.,"The benchmark 10-year Treasury US10YT=RR yield retreated to 0.7256%, the biggest one-day drop since Aug. 4.","Government bond yields in the euro zone also held near recent troughs, with hefty supply failing to dent a market bolstered by expectations for further central bank easing.","Germany's 10-year Bund yield touched -0.538% DE10YT=RR, its lowest in just over a week. Italian IT10YT=RR and Greek GR10YT=RR benchmark 10-year debt both hit record lows.","A stronger dollar capped gold XAU= prices, which dropped 1.5% to $1,893.01 per ounce.","Benefiting from China's promising trade data, Brent crude futures LCOc1 were up 73 cents, or 1.75%, to $42.45 a barrel. U.S. West Texas Intermediate crude CLc1 futures rose 81 cents, or 2.05%, to $40.24 a barrel."
