69,https://www.reuters.com/article/brief-lilly-announces-start-of-phase-1-s/brief-lilly-announces-start-of-phase-1-study-for-second-potential-covid-19-antibody-treatment-idUSFWN2DL0HA,2020-06-08T12:13:07Z,BRIEF-Lilly Announces Start Of Phase 1 Study For Second Potential COVID-19 Antibody Treatment,June 8 (Reuters) -,* LILLY ANNOUNCES START OF A PHASE 1 STUDY FOR ITS SECOND POTENTIAL COVID-19 ANTIBODY TREATMENT,"* ELI LILLY - FIRST HEALTHY VOLUNTEER HAS BEEN DOSED IN A PHASE 1 STUDY OF JS016, LEAD ANTIBODY FROM LILLY’S COLLABORATION WITH JUNSHI BIOSCIENCES",* ELI LILLY AND CO - JUNSHI BIOSCIENCES IS CONDUCTING ITS PHASE 1 STUDY IN CHINA WITH LILLY TO IMMINENTLY BEGIN ITS PHASE 1 STUDY IN UNITED STATES,* ELI LILLY - LILLY WILL EVALUATE EFFICACY OF JS016 AS BOTH A SINGLE AGENT AND A COMBINATION WITH OTHER ANTIBODY TREATMENTS IN COVID-19 PATIENTS Source text for Eikon: Further company coverage:
70,https://www.reuters.com/article/brief-eli-lilly-taltz-shows-consistent-e/brief-eli-lilly-taltz-shows-consistent-efficacy-long-term-potential-to-help-patients-with-psoriatic-arthritis-in-new-data-idUSFWN2DG08I,2020-06-03T10:50:31Z,BRIEF-Eli Lilly - Taltz Shows Consistent Efficacy & Long-Term Potential To Help Patients With Psoriatic Arthritis In New Data,June 3 (Reuters) - Eli Lilly and Co:,* ELI LILLY - TALTZ SHOWED CONSISTENT EFFICACY & LONG-TERM POTENTIAL TO HELP PATIENTS WITH PSORIATIC ARTHRITIS IN NEW DATA TO BE PRESENTED AT EULAR 2020,"* ELI LILLY AND CO - RESULTS AT 52 WEEKS SHOWED IMPROVEMENTS WERE SEEN WITH TALTZ ACROSS MULTIPLE ENDPOINTS, WITH/WITHOUT USE OF MTX OR OTHER CSDMARDS",* ELI LILLY AND CO - MORE TALTZ PATIENTS ACHIEVED PRIMARY ENDPOINT OF SIMULTANEOUS ACHIEVEMENT OF ACR50 AND PASI 100 AT WEEK 52 IN ALL THREE SUBGROUPS Source text for Eikon: Further company coverage:
71,https://www.reuters.com/article/us-health-coronavirus-lilly-treatments/eli-lilly-starts-human-study-of-potential-covid-19-antibody-treatment-idUSKBN23825Y,2020-06-01T17:15:04Z,Eli Lilly starts human study of potential COVID-19 antibody treatment,"(Reuters) - Eli Lilly and Co said on Monday it had started an early-stage trial to test its potential treatment for COVID-19, in the world’s first study of an antibody treatment against the disease.","Lilly is one of the several drugmakers and research institutions that are working on vaccines, antivirals and other treatments to help those infected with the fast-spreading novel coronavirus, which has already killed over 370,000 worldwide.",An antiviral drug from Gilead Sciences called remdesivir has shown some promise against COVID-19 and is being given to patients by some countries under compassionate or emergency use rule.,Lilly said its early stage study will assess safety and tolerability in patients hospitalized with COVID-19 and results are anticipated by the end of June.,"The experimental treatment, LY-CoV555, has been developed through collaboration with privately held AbCellera Biologics, which Lilly partnered with in March.","Lilly’s treatment is an antibody directed against the spike-shaped protein structures of the virus and is designed to block it from locking on to human cells, thus neutralizing the virus.",The drugmaker said the antibody treatment was developed after it was identified from a blood sample taken from one of the first U.S. patients who recovered from the lung illness caused by the new coronavirus.,"Lilly said it expects to move into the next phase of testing, studying the potential treatment in non-hospitalized COVID-19 patients, if the drug is shown to be safe.",Rival Regeneron Pharmacuticals Inc has said it plans to start clinical studies in June to test its antibody cocktail treatment for the new coronavirus and is aiming to have hundreds of thousands of preventative doses available by the end of August.,Lilly’s shares were up 2.5% at $156.75 before the bell.
72,https://www.reuters.com/article/health-coronavirus-lilly-treatments/eli-lilly-starts-human-study-of-potential-covid-19-treatment-idUSL4N2DE2P1,2020-06-01T10:38:55Z,Eli Lilly starts human study of potential COVID-19 treatment,"June 1 (Reuters) - Eli Lilly and Co said on Monday patients have been dosed to test its potential antibody treatment designed to fight COVID-19, caused by the new coronavirus.","The study will assess safety and tolerability in patients hospitalized with COVID-19 and results are anticipated by the end of June, the company said in a statement. (Reporting by Ankur Banerjee in Bengaluru; Editing by Shinjini Ganguli)"
73,https://www.reuters.com/article/brief-lilly-receives-fda-approval-of-tau/brief-lilly-receives-fda-approval-of-tauvid-for-patients-being-evaluated-for-alzheimers-disease-idUSASA00RYW,2020-05-28T23:54:14Z,BRIEF-Lilly Receives FDA Approval Of Tauvid For Patients Being Evaluated For Alzheimer's Disease,May 28 (Reuters) - Eli Lilly and Co:,* LILLY RECEIVES U.S. FDA APPROVAL OF TAUVID™ (FLORTAUCIPIR F 18 INJECTION) FOR USE IN PATIENTS BEING EVALUATED FOR ALZHEIMER’S DISEASE,* AVAILABILITY OF TAUVID WILL INITIALLY BE LIMITED AND WILL EXPAND IN RESPONSE TO COMMERCIAL DEMAND AND PAYOR REIMBURSEMENT Source text for Eikon: Further company coverage:
74,https://www.reuters.com/article/us-health-coronavirus-lilly/lilly-junshi-biosciences-plan-to-start-human-trials-of-covid-19-antibody-in-second-quarter-idUSKBN2321ZS,2020-05-26T14:50:40Z,"Lilly, Junshi Biosciences plan to start human trials of COVID-19 antibody in second quarter","(Reuters) - Shanghai Junshi Biosciences Co Ltd said on Tuesday it plans to start clinical studies to test its experimental antibody against COVID-19 in the United States and China in the second quarter of the year, with partner Eli Lilly and Co.","Lilly and several other drugmakers such as Gilead Sciences, Pfizer Inc and Merck & Co Inc are racing to develop treatments or vaccines for the fast-spreading respiratory illness caused by the novel coronavirus.",Junshi said the companies intend to file an application to begin human testing of one of their two antibodies - protective proteins produced in response to infection - tested first in rhesus monkeys.,"Shanghai Junshi said results from the preclinical studies, published in the science journal Nature, show that both the tested antibodies, called CA1 and CB6, showed substantial neutralization activity against the virus.","The company said CB6, which showed a greater reduction in virus levels in the monkeys, will be advanced to human trials.","Separately, Merck on Tuesday announced a deal and multiple partnerships to develop vaccines and test an antiviral drug against COVID-19."
75,https://www.reuters.com/article/health-coronavirus-lilly/lilly-junshi-biosciences-to-start-human-trials-of-covid-19-antibodies-idUSL4N2D82XF,2020-05-26T13:37:08Z,"Lilly, Junshi Biosciences to start human trials of COVID-19 antibodies","May 26 (Reuters) - Shanghai Junshi Biosciences Co Ltd said on Tuesday it planned to start clinical studies to test its experimental COVID-19 antibodies, developed with partner Eli Lilly and Co, by the second quarter of the year in the United States and China.",Shanghai Junshi also announced the publication of results from preclincal studies that tested two of the experimental antibodies in rhesus monkeys in the science journal Nature. (Reporting by Manojna Maddipatla in Bengaluru; Editing by Shinjini Ganguli)
76,https://www.reuters.com/article/brief-emgality-shows-improvement-in-work/brief-emgality-shows-improvement-in-work-productivity-and-health-and-well-being-between-attacks-in-patients-with-migraine-and-a-history-of-preventive-treatment-failure-idUSFWN2D70AO,2020-05-26T11:43:46Z,BRIEF-Emgality Shows Improvement In Work Productivity And Health And Well-Being Between Attacks In Patients With Migraine And A History Of Preventive Treatment Failure,May 26 (Reuters) - Eli Lilly and Co:,* EMGALITY® SHOWS IMPROVEMENT IN WORK PRODUCTIVITY AND HEALTH AND WELL-BEING BETWEEN ATTACKS IN PATIENTS WITH MIGRAINE AND A HISTORY OF PREVENTIVE TREATMENT FAILURE,"* ELI LILLY AND CO - AMONG 462 PATIENTS RANDOMIZED TO EMGALITY OR PLACEBO, STATISTICALLY SIGNIFICANT IMPROVEMENTS IN WORK PRODUCTIVITY Source text for Eikon: Further company coverage:"
77,https://www.reuters.com/article/brief-eli-lilly-study-results-demonstrat/brief-eli-lilly-study-results-demonstrate-societal-cost-burden-during-early-stages-of-alzheimers-disease-idUSFWN2D10PO,2020-05-19T13:02:10Z,BRIEF-Eli Lilly - Study Results Demonstrate Societal Cost Burden During Early Stages Of Alzheimer's Disease,May 19 (Reuters) - Eli Lilly and Co:,* RESULTS OF GERAS-US STUDY DEMONSTRATE SOCIETAL COST BURDEN FOR PATIENTS AND CAREGIVERS DURING EARLY STAGES OF ALZHEIMER’S DISEASE Source text for Eikon: Further company coverage:
78,https://www.reuters.com/article/brief-eli-lilly-receives-us-fda-approval/brief-eli-lilly-receives-u-s-fda-approval-for-retevmo-idUSASA00P75,2020-05-09T01:40:25Z,BRIEF-Eli Lilly Receives U.S. FDA Approval For Retevmo,May 8 (Reuters) - Eli Lilly and Co:,"* LILLY RECEIVES U.S. FDA APPROVAL FOR RETEVMO™ (SELPERCATINIB), THE FIRST THERAPY SPECIFICALLY FOR PATIENTS WITH ADVANCED RET-DRIVEN LUNG AND THYROID CANCERS",* RETEVMO IS EXPECTED TO BE AVAILABLE FROM SPECIALTY PHARMACIES WITHIN ONE WEEK. Source text for Eikon: Further company coverage:
79,https://www.reuters.com/article/brief-us-fda-approves-eli-lillys-retevmo/brief-u-s-fda-approves-eli-lillys-retevmo-capsules-to-treat-three-types-of-tumors-idUSASA00P6X,2020-05-08T21:43:56Z,BRIEF-U.S. FDA Approves Eli Lilly's Retevmo Capsules To Treat Three Types Of Tumors,May 8 (Reuters) - U.S. Food and Drug Administration:,* FDA APPROVES FIRST THERAPY FOR PATIENTS WITH LUNG AND THYROID CANCERS WITH A CERTAIN GENETIC MUTATION OR FUSION,* U.S. FDA - APPROVED RETEVMO CAPSULES TO TREAT THREE TYPES OF TUMORS,"* U.S. FDA - FDA GRANTED APPROVAL OF RETEVMO TO LOXO ONCOLOGY, INC., A SUBSIDIARY OF ELI LILLY AND COMPANY Source text for Eikon:"
80,https://www.reuters.com/article/brief-eli-lilly-says-higher-investigatio/brief-eli-lilly-says-higher-investigational-doses-of-trulicity-meaningfully-reduced-a1c-and-body-weight-in-people-with-type-2-diabetes-idUSFWN2CQ19B,2020-05-08T18:27:30Z,BRIEF-Eli Lilly Says Higher Investigational Doses Of Trulicity (Dulaglutide) Meaningfully Reduced A1C And Body Weight In People With Type 2 Diabetes,May 8 (Reuters) - Eli Lilly and Co:,* HIGHER INVESTIGATIONAL DOSES OF TRULICITY® (DULAGLUTIDE) MEANINGFULLY REDUCED A1C AND BODY WEIGHT IN PEOPLE WITH TYPE 2 DIABETES,* ELI LILLY AND CO - SAFETY & TOLERABILITY PROFILE OF INVESTIGATIONAL DULAGLUTIDE DOSES WAS CONSISTENT WITH KNOWN PROFILE OF TRULICITY 1.5 MG,* ELI LILLY AND CO - AWARD-11 RESULTS HAVE BEEN SUBMITTED TO REGULATORY AUTHORITIES IN U.S. AND EUROPE FOR REVIEW Source text for Eikon: Further company coverage:
81,https://www.reuters.com/article/brief-eli-lilly-and-co-sets-quarterly-di/brief-eli-lilly-and-co-sets-quarterly-dividend-of-0-74-per-share-idUSFWN2CM14G,2020-05-04T19:02:33Z,BRIEF-Eli Lilly And Co Sets Quarterly Dividend Of $0.74 Per Share,May 4 (Reuters) - Eli Lilly and Co:,* SETS QUARTERLY DIVIDEND OF $0.74PER SHARE Source text for Eikon: Further company coverage:
82,https://www.reuters.com/article/brief-lilly-endowment-reports-open-marke/brief-lilly-endowment-reports-open-market-sale-of-220000-shares-of-eli-lillys-common-stock-on-april-24-idUSFWN2CF1BU,2020-04-27T18:41:38Z,"BRIEF-Lilly Endowment Reports Open Market Sale Of 220,000 Shares Of Eli Lilly's Common Stock On April 24",April 27 (Reuters) - Eli Lilly and Co:,"* LILLY ENDOWMENT REPORTS OPEN MARKET SALE OF 220,000 SHARES OF ELI LILLY'S COMMON STOCK ON APRIL 24, PRICE RANGE BETWEEN $160.67PER SHARE AND $164.23PER SHARE Source text : (bit.ly/2KGkiwl) Further company coverage:"
83,https://www.reuters.com/article/brief-eli-lilly-files-for-potential-note/brief-eli-lilly-files-for-potential-notes-offering-idUSFWN2CC1Y1,2020-04-24T13:24:51Z,BRIEF-Eli Lilly Files For Potential Notes Offering,April 24 (Reuters) - Eli Lilly and Co:,* ELI LILLY AND CO FILES FOR POTENTIAL NOTES OFFERING; SIZE NOT DISCLOSED - SEC FILING,"* ELI LILLY AND CO SAYS NOTES WILL BE ISSUED IN DENOMINATIONS OF $2,000 AND INTEGRAL MULTIPLES OF $1,000 IN EXCESS OF THAT AMOUNT Source text: (bit.ly/3eNuHUH) Further company coverage:"
84,https://www.reuters.com/article/brief-innovent-and-eli-lilly-announce-nm/brief-innovent-and-eli-lilly-announce-nmpa-acceptance-of-supplemental-new-drug-application-for-sintilimab-idUSFWN2CB1GF,2020-04-24T01:32:49Z,BRIEF-Innovent And Eli Lilly Announce NMPA Acceptance Of Supplemental New Drug Application For Sintilimab,April 23 (Reuters) - Innovent Biologics Inc:,* INNOVENT AND ELI LILLY ANNOUNCE NMPA ACCEPTANCE OF A SUPPLEMENTAL NEW DRUG APPLICATION FOR SINTILIMAB IN COMBINATION WITH ALIMTA® (PEMETREXED) Source text for Eikon: Further company coverage:
85,https://www.reuters.com/article/us-lilly-results/eli-lilly-lifts-2020-profit-forecast-coronavirus-fuels-stockpiling-of-its-medicines-idUSKCN2251N6,2020-04-23T15:52:44Z,Eli Lilly lifts 2020 profit forecast; coronavirus fuels stockpiling of its medicines,"(Reuters) - Eli Lilly and Co LLY.N raised the top-end of its 2020 profit forecast on Thursday and reported better-than-expected quarterly results, as customers stocking up medicines such as diabetes drug Trulicity during the coronavirus pandemic boosted sales.","First-quarter revenue got a nearly $250 million boost from stockpiling of Lilly’s insulin products, Trulicity and psoriasis drug Taltz. However, this benefit would largely be reversed over the course of 2020, the company said.","Lilly raised the top end of its full-year adjusted profit forecast by 10 cents, citing increased demand for its newer drugs, and now expects to earn $6.70 to $6.90 per share.",It said it expects clinical trials delayed by the pandemic to resume in the second half of the year.,The company also noted that staggeringly high U.S. unemployment rates could force more Americans to shift from commercial health insurance to federal programs or become uninsured. Some 26.5 million Americans have sought unemployment benefits over the last five weeks as efforts to curb the spread of the virus shuttered businesses and schools across the country.,"As patients shift to Medicaid - the federal and states-run plan for low-income individuals - Lilly could see lower payments for its drugs, Chief Executive Officer David Ricks told Reuters, adding that the hit would be more pronounced in 2021.","The company said 10% of its customers were on Medicaid, while 40% were commercially insured.","Long-term unemployment rates would lower Medicaid reimbursement for Lilly’s key drugs, said Citi analyst Andrew Baum, adding that there are cheaper alternatives to Trulicity and Taltz.","“We’re looking at everything we can do to ensure that people can stay on our medications and have access to them, and believe that some of these impacts will be temporary,” Chief Financial Officer Joshua Smiley said.","Earlier this month, Lilly capped out-of-pocket costs for insulin products, including widely-used Humalog, at $35 per month.","Lilly is also working on potential treatments for the coronavirus. It has begun testing its new rheumatoid arthritis drug Olumiant for COVID-19, the illness caused by the virus. It is also conducting trials on an experimental biotech drug in pneumonia patients, among other efforts. The virus attacks the lungs and causes pneumonia in severe cases.","Trulicity sales jumped 40% to $1.23 billion, helping drive a 15% rise in total quarterly revenue to $5.86 billion. That topped Wall Street estimates of $5.51 billion.","Excluding items, Lilly earned $1.75 per share, beating analysts’ average estimates by 27 cents, according to Refinitiv data.",Eli Lilly shares were up 2% at $159.84.
86,https://www.reuters.com/article/lilly-results/eli-lilly-reports-15-rise-in-quarterly-sales-idUSL3N2CB2T9,2020-04-23T10:35:57Z,Eli Lilly reports 15% rise in quarterly sales,"April 23 (Reuters) - Eli Lilly and Co reported a 15.1% rise in first-quarter sales on Thursday, boosted by higher sales of its top-selling diabetes drug Trulicity and also benefiting from customers stockpiling its medicines amid the coronavirus pandemic.",Its quarterly revenue rose to $5.86 billion from $5.09 billion a year earlier.,"However, net income fell to $1.46 billion, or $1.60 per share, in the quarter ended March 31, from $4.24 billion, or $4.31 per share, a year earlier when it recorded a gain of $3.68 billion from the sale of Elanco Animal Health.."
87,https://www.reuters.com/article/brief-lower-priced-versions-of-humalog-m/brief-lower-priced-versions-of-humalog-mix75-25-kwikpen-and-humalog-junior-kwikpen-now-available-idUSFWN2C40KU,2020-04-16T10:53:33Z,BRIEF-Lower-Priced Versions Of Humalog® Mix75/25™ Kwikpen® And Humalog® Junior Kwikpen® Now Available,April 16 (Reuters) - Eli Lilly and Co:,* LOWER-PRICED VERSIONS OF HUMALOG® MIX75/25™ KWIKPEN® AND HUMALOG® JUNIOR KWIKPEN® NOW AVAILABLE,"* ELI LILLY AND CO - NON-BRANDED INSULIN OPTIONS IDENTICAL TO BRANDED VERSIONS, WITH 50% LOWER LIST PRICE OF $265.20 FOR PACKAGE OF 5 KWIKPENS Source text for Eikon: Further company coverage: (Reuters.Briefs@thomsonreuters.com)"
88,https://www.reuters.com/article/brief-eli-lilly-begins-clinical-testing/brief-eli-lilly-begins-clinical-testing-of-therapies-for-covid-19-idUSFWN2BY04K,2020-04-10T21:34:50Z,BRIEF-Eli Lilly Begins Clinical Testing Of Therapies For COVID-19,April 10 (Reuters) - Eli Lilly and Co:,* ELI LILLY AND CO - STARTS PHASE 2 TRIAL WITH ANTI-ANG2 IN COVID-19,* ELI LILLY AND CO - BARICITINIB RESEARCH COMMENCES IN NIH-LED ADAPTIVE COVID-19 TREATMENT TRIAL,* ELI LILLY AND CO - ENTERED INTO AGREEMENT WITH NIAID TO STUDY BARICITINIB AS AN ARM IN NIAID’S ADAPTIVE COVID-19 TREATMENT TRIAL,* ELI LILLY AND CO - RESULTS FROM BARICITINIB STUDY ARE EXPECTED WITHIN NEXT 2 MONTHS,* ELI LILLY AND CO - TO ADVANCE LY3127804 TO PHASE 2 TESTING IN PNEUMONIA PATIENTS HOSPITALIZED WITH COVID-19 & AT HIGHER RISK OF PROGRESSING TO ARDS,"* ELI LILLY AND CO - CURRENTLY DOES NOT ANTICIPATE SHORTAGES FOR ANY OF MEDICINES, INCLUDING BARICITINIB Source text for Eikon: Further company coverage:"
89,https://www.reuters.com/article/brief-eli-lilly-and-company-to-hold-2020/brief-eli-lilly-and-company-to-hold-2020-annual-meeting-of-shareholders-virtually-idUSFWN2BV1AM,2020-04-07T16:02:13Z,BRIEF-Eli Lilly And Company To Hold 2020 Annual Meeting Of Shareholders Virtually,Eli Lilly and Co:,* ELI LILLY AND COMPANY TO HOLD 2020 ANNUAL MEETING OF SHAREHOLDERS VIRTUALLY Source text for Eikon: Further company coverage:
90,https://www.reuters.com/article/brief-medical-professionals-across-merck/brief-medical-professionals-across-merck-pfizer-inc-eli-lilly-to-support-health-systems-idUSFWN2BP1GW,2020-04-01T20:11:53Z,"BRIEF-Medical Professionals Across Merck, Pfizer Inc, Eli Lilly To Support Health Systems",April 1 (Reuters) - Eli Lilly and Co:,"* MEDICAL PROFESSIONALS ACROSS MERCK & CO., INC., PFIZER INC., AND ELI LILLY AND COMPANY ACTIVATE TO SUPPORT HEALTH SYSTEMS, FIRST RESPONDERS AND PATIENTS AMID COVID-19 PANDEMIC Source text for Eikon: Further company coverage:"
91,https://www.reuters.com/article/brief-lilly-endowment-reports-open-marke/brief-lilly-endowment-reports-open-market-sale-of-38962-shares-of-eli-lilly-common-stock-on-march-31-idUSFWN2BP12J,2020-04-01T17:51:54Z,"BRIEF-Lilly Endowment Reports Open Market Sale Of 38,962 Shares Of Eli Lilly Common Stock On March 31",April 1 (Reuters) - Eli Lilly and Co:,"* LILLY ENDOWMENT REPORTS OPEN MARKET SALE OF 38,962 SHARES OF ELI LILLY COMMON STOCK AT AVERAGE PRICE OF $140.07PER SHARE ON MARCH 31 - SEC FILING Source text : (bit.ly/3ayAOda) Further company coverage:"
92,https://www.reuters.com/article/us-teva-lilly-patent/u-s-court-rules-for-teva-in-migraine-patent-dispute-with-eli-lilly-idUSKBN21I2WV,2020-03-31T18:38:12Z,U.S. court rules for Teva in migraine patent dispute with Eli Lilly,WASHINGTON (Reuters) - Teva Pharmaceutical Industries Ltd on Tuesday won a ruling from a U.S. administrative court that could help it fend off competition from Eli Lilly and Co in the market for migraine drugs.,"The Patent Trial and Appeal Board (PTAB) upheld the validity of three Teva patents on its migraine treatment Ajovy, rejecting arguments by Eli Lilly that they were invalid.","In a separate legal action filed in 2018, Teva accused Eli Lilly’s competing drug Emgality of infringing the same patents. Eli Lilly could be liable for money damages if it loses that case.","Eli Lilly responded to the lawsuit by asking PTAB, a court run by the U.S. Patent and Trademark Office, to separately reconsider whether the patents should have been granted in the first place.","Teva’s stock price jumped about 9% after the patent court issued its decision, which Eli Lilly can still appeal.",A Teva spokeswoman said the company was pleased with the outcome and called the ruling a “testament to the strength of Teva’s intellectual property.”,An Eli Lilly spokesman did not immediately respond to a request for comment.,"Ajovy, a next-generation migraine drug known as a CGRP inhibitor, generated $96 million in worldwide sales for Teva last year. The Israel-based company has projected $250 million in sales in 2020.","Emgality, another CGRP inhibitor, generated worldwide revenue of $162.5 million for the Indianapolis, Indiana-based Eli Lilly last year.","Teva is looking to Ajovy to boost revenue and help it pay down its debt, which at the end of 2019 stood at $26.9 billion. The company’s debt soared after it paid more than $40 billion in 2016 to buy Allergan’s generic drugs business."
93,https://www.reuters.com/article/teva-lilly-patent/u-s-court-rules-for-teva-in-migraine-patent-dispute-with-eli-lilly-idUSL1N2BO1JI,2020-03-31T17:23:47Z,U.S. court rules for Teva in migraine patent dispute with Eli Lilly,"WASHINGTON, March 31 (Reuters) - Teva Pharmaceutical Industries Ltd on Tuesday won a ruling from a U.S. administrative court that helps preserve its rights to the migraine drug Ajovy.",The Patent Trial and Appeal Board rejected a challenge to three Teva patents relating to Ajovy brought by Eli Lilly and Co .
94,https://www.reuters.com/article/us-health-coronavirus-lilly/coronavirus-pandemic-leads-big-drugmakers-to-hit-pause-on-clinical-trials-idUSKBN21A1J7,2020-03-24T01:42:22Z,Coronavirus pandemic leads big drugmakers to hit pause on clinical trials,(Reuters) - U.S. drugmakers Eli Lilly and Co and Bristol Myers Squibb said they are delaying the start of new clinical trials in part to free up doctors and healthcare facilities to deal with the surge in patients infected with the new coronavirus.,"Lilly and Bristol are the biggest drugmakers yet to announce clinical trial delays in the face of the pandemic that has killed over 16,000 people worldwide, after several small biotech companies said last week that they would be pulling back on drug studies.","The moves are not related to clinical trials testing drugs or vaccines that could be used to treat or prevent COVID-19, the respiratory illness caused by the virus.",The U.S. Food and Drug Administration last week urged switching to virtual patient visits instead of in-person monitoring when conducting clinical studies as it anticipated the outbreak would disrupt them.,"Pfizer Inc, Merck & Co, AbbVie Inc, and Johnson & Johnson were not immediately available for comment on their trials policies.",Delaying clinical trials could hurt future revenue for pharmaceutical companies as it lengthens the time it takes for drugs to receive approval and reach the market. It could also hurt patients by limiting their access to experimental treatments being studied.,Lilly said the move would delay the timeline for ongoing late-stage studies of its experimental gastrointestinal disease treatment mirikizumab.,The Indianapolis-based drugmaker said there will not be any delay in other ongoing late-stage trials.,"It added that it would analyze ongoing trials on a study-by-study basis, as discontinuing them would disrupt the treatment course for patients. But it plans to continue most trials where patients are already enrolled.",Lilly said it does not anticipate any change to its full-year financial forecast as a result of the coronavirus outbreak.,"Bristol posted a message to clinical trial investigators on its website on Friday, saying it will put off beginning new clinical trials for at least three weeks because of the impact of the rapidly spreading coronavirus pandemic.","The New York-based drugmaker said it will not initiate any new sites for clinical trials until April 13, noting that the timeframe of the halt could extend further.",It also said studies involving healthy volunteers should be put on hold if they are at a natural break point until at least April 13.,Bristol did not say how many trials or which drugs in development might be affected.,"Conducting clinical trials is a good source of revenue for non-profit and academic hospitals, but are not as significant for for-profit hospital companies, Jefferies analyst Brian Tanquilut said.","Large publicly listed hospital operators in the United States include HCA Healthcare, Tenet Healthcare Corp and Community Health Systems.","Lost revenue from clinical studies can directly impact staffing and operations as sites are usually paid per visit, according to Nariman Nasser, an executive at Continuum Clinical, an industry consultant that works with trial sites.","Large hospitals and academic centers also stand to lose fees that cover costs for things like building space, maintenance and operating costs, Nasser said in an email.","Last week, U.S.-based Iveric Bio Inc delayed enrollment in a trial of its eye disease drug, two days after Provention Bio paused a study of a diabetes drug but allowed trial patients to complete their treatment course."
