70,https://www.reuters.com/article/us-ireland-jobs-mastercard/mastercard-to-add-1500-technology-jobs-in-ireland-idUSKCN20I0XA,2020-02-24T10:21:45Z,"Mastercard to add 1,500 technology jobs in Ireland","DUBLIN (Reuters) - Mastercard Inc plans to hire 1,500 more staff in Dublin over the next three to five years, more than trebling its workforce in one of Ireland’s largest single multinational jobs announcements.","The U.S. credit card issuer has had a presence in Dublin since 2008 where it set up its research and development arm, Mastercard Labs, four years later. Its workforce will increase to more than 2,000 from 650 now, IDA Ireland, the state agency competing to win foreign jobs, said in a statement on Monday.","That matched the 1,500 jobs U.S. cloud software company Salesforce.com said it would add over a similar period a year ago, which at the time IDA Ireland said marked one of the largest job announcements in its 70-year history.","Foreign multinationals, particularly in the technology sector, employ about a quarter of a million people in Ireland, accounting for one in 10 jobs in the fast growing economy.","“This is excellent news and further proof of Ireland’s place as a global hub for technology. The 1,500 jobs being created at Mastercard are high quality, skilled positions,” Acting Prime Minister Leo Varadkar said in a statement.","Mastercard, which like other financial payments companies is investing heavily in technology, said it aimed to recruit staff in the growing areas of cyber security, artificial intelligence, blockchain and user experience.","It will take on 22,500 square meters of additional space in two newly built office blocks near its current location in south Dublin to facilitate expansion in what the company said will become its European technology hub.","That will also make Mastercard the latest technology company to establish a campus-style site in Dublin after Microsoft’s LinkedIn, Alphabet’s Google and Facebook bought or leased large spaces in the city.","The head of IDA Ireland said last month that he expects the strong multinational jobs growth to continue in the first half of 2020, but subdued global economic growth, continued trade tensions and capacity constraints in Ireland posed significant risks beyond that."
71,https://www.reuters.com/article/ireland-jobs-mastercard/mastercard-to-add-1500-technology-jobs-in-ireland-idUSS8N27R07O,2020-02-24T09:29:08Z,"Mastercard to add 1,500 technology jobs in Ireland","DUBLIN, Feb 24 (Reuters) - Mastercard Inc plans to hire 1,500 more staff at its global technology hub in Dublin over the next three to five years, more than trebling the size of its workforce in Ireland’s first major multinational jobs announcement of 2020.","The U.S. credit card issuer has had a presence in Dublin since 2008 and set up its research and development arm, Mastercard Labs, there eight years ago. It plans to increase its staff to more than 2,000 from 650 now, IDA Ireland, the state agency competing to win foreign jobs, said in a statement.","Foreign multinationals, particularly in the technology sector, employ about a quarter of a million people in Ireland, accounting for one in 10 jobs in the fast growing economy. (Reporting by Padraic Halpin; Editing by Edmund Blair)"
72,https://www.reuters.com/article/brief-soros-fund-management-llc-takes-sh/brief-soros-fund-management-llc-takes-share-stake-in-mastercard-cuts-in-unitedhealth-group-idUSFWN2AE1B2,2020-02-14T22:09:47Z,BRIEF-Soros Fund Management Llc Takes Share Stake In Mastercard; Cuts In Unitedhealth Group,Feb 14 (Reuters) - Soros Fund Management Llc:,"* SOROS FUND MANAGEMENT LLC TAKES SHARE STAKE OF 18,078 CLASS A SHARES IN MASTERCARD INC - SEC FILING",* SOROS FUND MANAGEMENT LLC DISSOLVES SHARE STAKE IN DOMINION ENERGY INC,"* SOROS FUND MANAGEMENT LLC CUTS SHARE STAKE IN UNITEDHEALTH GROUP INC BY 11.1 PERCENT TO 120,000 SHARES","* SOROS FUND MANAGEMENT LLC - CHANGE IN HOLDINGS ARE AS OF DECEMBER 31, 2019 AND COMPARED WITH THE PREVIOUS QUARTER ENDED AS OF SEPTEMBER 30, 2019 Source for the quarter ended December 31, 2019: bit.ly/37sCIJV Source for the quarter ended September 30, 2019: bit.ly/2QkGgc4"
73,https://www.reuters.com/article/us-china-bank-mastercard/china-c-bank-gives-green-light-to-mastercards-china-jv-for-clearing-business-idUSKBN2050Z4,2020-02-11T19:15:52Z,China c.bank gives green light to Mastercard's China JV for clearing business,BEIJING (Reuters) - China’s central bank said on Tuesday it has approved an application by Mastercard’s China joint venture to conduct bank card clearing operations in the country.,The People’s Bank of China (PBOC) made the announcement weeks after China and the United States signed a Phase I trade deal in which Beijing agreed to open up its giant financial services market.,"The approval, made with China’s banking regulator, is another example of “China opening up its financial industry, and deepening supply-side reforms in the sector,” PBOC said in a statement on its website.","In early January, PBOC said it had accepted an application from a unit of American Express Co regarding starting operations in China. [nL4N29D338] American card giant Visa submitted its application in early 2018 and is still awaiting approval.",China is opening up its local currency payments market to foreign companies after a decade of lobbying from foreign players seeking direct access to what is set to be the biggest bank card market by 2020.,"Mastercard’s China JV is given a maximum of one year to prepare for business opening, which also requires PBOC approval.","The Sino-U.S. Phase I trade deal states that no later than one month after U.S. service suppliers, including Mastercard, Visa and American Express, notify China that preparatory work is completed, China shall accept the licence application."
74,https://www.reuters.com/article/china-bank-mastercard/china-c-bank-gives-greenlight-to-mastercards-china-jv-for-clearing-business-idUSB9N29N024,2020-02-11T09:25:48Z,China c.bank gives greenlight to Mastercard's China JV for clearing business,"BEIJING, Feb 11 (Reuters) - China’s central bank said on Tuesday it has approved an application by Mastercard’s China joint venture to conduct bank card clearing operations in the country.","The decision, made with China’s banking regulator, is part of efforts to open up China’s financial industry, the People’s Bank of China said in a statement on its website. (Reporting by Beijing Newsroom, editing by Louise Heavens)"
75,https://www.reuters.com/article/us-australia-banks-payments/australia-central-bank-looks-to-rid-visa-mastercard-of-debit-payments-edge-idUSKBN1ZZ2AS,2020-02-05T23:00:50Z,"Australia central bank looks to rid Visa, Mastercard of debit payments edge","SYDNEY (Reuters) - Australian regulators will consider intervening to stop banks from automatically directing ""tap-and-go"" card payments through the world's largest payment processors Visa V.N and Mastercard Inc. MA.N, the central bank said on Wednesday.","Banks must stop automatically directing debit card payments through the two global networks, and instead give retailers the cheaper option to use local network EFTPOS, Philip Lowe, the governor of the Reserve Bank of Australia (RBA), told reporters.","“Regulating here is not the preferred option but it is a fallback option if we don’t see the required change,” he said after a speech in Sydney.","Global card schemes MasterCard and Visa, alongside the major four banks, dominate card payments systems in Australia. EFTPOS is owned by domestic financial institutions and retailers.","The RBA says debit card payments, Australia’s most frequently used method, processed through Visa or Mastercard cost retailers more than twice as much as using EFTPOS.",The retailers’ association estimates this adds up to extra costs of between A$300 million and A$500 million ($200 million and $340 million) each year.,"“We have made it very clear to the banking industry that we expect them to develop the functionality to allow the merchant to choose which payment rails it goes through, the international schemes or the EFTPOS schemes,” Lowe added.",“If that process doesn’t work then we would have to consider a regulatory solution.”,Visa and Mastercard were not immediately available for comment.,"The banks had promised to develop systems to facilitate the cheaper route for retailers, Low said, adding that his preference would be not to have to intervene.","The RBA is reviewing payments regulations to see what strategic issues need to be tackled, from the impact of new payment technologies and new entrants to regulatory technology and an electronic form of banknotes.","“One of the possible reasons for the major banks dragging their feet on least-cost routing is that they each have very extensive relationships with the large international schemes – we will be exploring this in the review,” Tony Richards, the head of payments policy at the RBA, was quoted as saying in the Australian Financial Review on Wednesday.",A spokesman from Commonwealth Bank of Australia CBA.AX declined to comment.,"A spokesman for NAB said the bank started letting its merchant customers choose their payment network in April 2018, adding, “We continue to roll out this service across our client base throughout this year.”",Westpac Banking Corp WBC.AX and Australia and New Zealand Banking Group ANZ.AX were not immediately available for comment.,"(This story corrects location of speech to Sydney in paragraph 3, not Canberra)"
76,https://www.reuters.com/article/australia-banks-payments/australia-could-intervene-to-unwind-visa-mastercard-preferential-payment-structure-idUSL4N2A51UT,2020-02-05T07:06:10Z,"Australia could intervene to unwind Visa, Mastercard preferential payment structure","SYDNEY, Feb 5 (Reuters) - Australian regulators would consider intervening to stop banks from automatically directing “tap-and-go” card payments through the world’s largest payment processors Visa and Mastercard Inc., the Reserve Bank of Australia (RBA) said Wednesday.","Banks needed to stop automatically directing debit card payments through the two global networks, and instead give retailers the cheaper option to use EFTPOS, a local payment network, Governor Philip Lowe told reporters after a speech in Canberra.","Global card schemes MasterCard and Visa, alongside the major four banks, dominate card payments systems in Australia. EFTPOS is owned by local financial institutions and retailers.","According to the RBA, processing debit card payments - the most frequently used payment method in Australia - through Visa or Mastercard costs retailers more than twice as much as using the local EFTPOS network.",The retailers association estimates this adds up to between A$300 million to A$500 million ($200 million to $340 million) in extra costs per year.,"“We have made it very clear to the banking industry that we expect them to develop the functionality to allow the merchant to chose which payment rails it goes through, the international schemes or the EFTPOS schemes,” Lowe said.",“If that process doesn’t work then we would have to consider a regulatory solution.”,Visa and Mastercard were not immediately available for comment.,"Low said the banks had promised to develop systems that would facilitate the cheaper route for retailers, and said his preference would be not to have to intervene.",“Regulating here is not the preferred option but it is a fallback option if we don’t see the required change.”,"The RBA is currently reviewing the country’s payments regulations to identify strategic issues that should be addressed, including the impact of new payment technologies and new entrants, regulatory technology, and the possible issuance of an electronic form of banknotes.","“One of the possible reasons for the major banks dragging their feet on least-cost routing is that they each have very extensive relationships with the large international schemes – we will be exploring this in the review,” Tony Richards, the head of payments policy at the RBA, was quoted as saying in the Australian Financial Review on Wednesday.",A spokesman from the Commonwealth Bank of Australia declined to comment.,"Westpac Banking Corp, National Australia Bank and Australia and New Zealand Banking Group were not immediately available for comment."
77,https://www.reuters.com/article/us-visa-mastercard-stocks/swiping-their-way-higher-visa-mastercard-could-be-the-next-1-trillion-companies-idUSKBN1ZU0JA,2020-01-31T16:36:16Z,"Swiping their way higher: Visa, Mastercard could be the next $1 trillion companies","NEW YORK (Reuters) - Tech and internet titans were the first to reach $1 trillion in stock market value, but the next U.S. companies that could do so are better known for their plastic.","Soaring stock prices are propelling credit and debit card companies Visa Inc and Mastercard Inc up the market value charts, where they currently rank 7th and 11th among companies in the benchmark S&P 500 index. The stock prices of both Visa and Mastercard have gained roughly 50% in the past year.","While the stocks may not keep up that torrid pace, Visa and Mastercard would each be worth over $1 trillion by 2023 if their average annual gains of the past three years were to continue, surging past the likes of Facebook Inc and Berkshire Hathaway Inc, if they also maintain their recent pace.",Fueling their rise is a shift toward cashless financial transactions spurred by a rise in online shopping.,"“Everything travels on their rails,” said Sandy Villere, portfolio manager of the Villere Balanced Fund, which holds Visa shares. “They literally sit in the middle of the banks, consumers and merchants and that has been a really enviable place to be.”","Visa had a market value of $449 billion and Mastercard’s stood at about $324 billion as of Thursday’s close. The $1 trillion club currently includes Apple Inc, Microsoft, and Google-parent Alphabet. Amazon.com’s market value jumped back above $1 trillion on Friday morning as the stock soared on the heels of its earnings report on Thursday.",(GRAPHIC: Top U.S. market cap companies - ),"Revenue for both Visa and Mastercard nearly doubled over their past five fiscal years, to nearly $23 billion for Visa, and about $17 billion for Mastercard, according to Refinitiv data.",Adjusted earnings per share more than doubled for both companies over that period.,"Visa reported quarterly revenue late on Thursday that slightly missed analyst estimates, a day after Mastercard beat quarterly profit estimates.","About 43% of consumer purchases around the world excluding China are made using a digital form of payment, up from 28% in 2010, according to Lisa Ellis, senior analyst at MoffettNathanson. “Globally, we still have five to 10 years, at least, to go of penetration,” Ellis said.","Visa holds a 60% share of the credit and debit card market, followed by Mastercard with 30%, according to Ellis, with American Express far behind at 8.5%.","Despite their importance in finance, Visa and Mastercard are categorized as part of the S&P 500’s information technology sector. While Apple, Microsoft and chip companies such as Intel Corp often garner the lion’s share of attention, Visa and Mastercard have been key contributors to the rally in technology shares.",Their valuations have expanded to their most expensive in at least a decade.,"Visa trades at nearly 32 times forward 12 months’ earnings estimates, while Mastercard trades at 35 times, according to Refinitiv Datastream. Both stocks are trading at a higher premium to the market than they have on average over the past five years.",(Graphic: Top U.S. market cap companies - ),"The big run for Visa and Mastercard shares has also come during an more than 10-year U.S. bull market, and gains could be more muted in any downturn. Stocks started 2020 strong but have pulled back amid concerns over the spread of a virus from China.","Risks to the companies, Ellis said, include greater competition in the payment sector from big tech companies, as well as tougher regulations from governments around the world that might hinder access.","The companies are not sitting still. Earlier this month, Visa agreed to buy privately held Plaid Inc in a $5.3 billion deal to boost access to financial technology, and in August Mastercard agreed to buy a majority of the corporate services businesses of Scandinavian payments group Nets for about $3.19 billion.",(Graphic: Top U.S. companies by market value (interactive) - )
78,https://www.reuters.com/article/visa-mastercard-stocks/swiping-their-way-higher-visa-mastercard-could-be-the-next-1-trillion-companies-idUSL1N29Y0SG,2020-01-31T06:00:00Z,"Swiping their way higher: Visa, Mastercard could be the next $1 trillion companies","NEW YORK, Jan 31 (Reuters) - Tech and internet titans were the first to reach $1 trillion in stock market value, but the next U.S. companies that could do so are better known for their plastic.","Soaring stock prices are propelling credit and debit card companies Visa Inc and Mastercard Inc up the market value charts, where they currently rank 7th and 11th among companies in the benchmark S&P 500 index. The stock prices of both Visa and Mastercard have gained roughly 50% in the past year.","While the stocks may not keep up that torrid pace, Visa and Mastercard would each be worth over $1 trillion by 2023 if their average annual gains of the past three years were to continue, surging past the likes of Facebook Inc and Berkshire Hathaway Inc, if they also maintain their recent pace.",Fueling their rise is a shift toward cashless financial transactions spurred by a rise in online shopping.,"“Everything travels on their rails,” said Sandy Villere, portfolio manager of the Villere Balanced Fund, which holds Visa shares. “They literally sit in the middle of the banks, consumers and merchants and that has been a really enviable place to be.”","Visa had a market value of $449 billion and Mastercard’s stood at about $324 billion as of Thursday’s close. The $1 trillion club currently includes Apple Inc, Microsoft and Google-parent Alphabet.","Amazon.com stood at $927 billion, though the e-commerce leader’s shares jumped on the heels of its earnings report on Thursday after the bell, putting it in position to crack $1 trillion, as it did briefly in September 2018.","Revenue for both Visa and Mastercard nearly doubled over their past five fiscal years, to nearly $23 billion for Visa, and about $17 billion for Mastercard, according to Refinitiv data. Adjusted earnings per share more than doubled for both companies over that period.","Visa reported quarterly revenue late on Thursday that slightly missed analyst estimates, a day after Mastercard beat quarterly profit estimates.","About 43% of consumer purchases around the world excluding China are made using a digital form of payment, up from 28% in 2010, according to Lisa Ellis, senior analyst at MoffettNathanson.","“Globally, we still have five to 10 years, at least, to go of penetration,” Ellis said.","Visa holds a 60% share of the credit and debit card market, followed by Mastercard with 30%, according to Ellis, with American Express far behind at 8.5%.","Despite their importance in finance, Visa and Mastercard are categorized as part of the S&P 500’s information technology sector. While Apple, Microsoft and chip companies such as Intel Corp often garner the lion’s share of attention, Visa and Mastercard have been key contributors to the rally in technology shares.","Their valuations have expanded to their most expensive in at least a decade. Visa trades at about 31 times forward 12 months’ earnings estimates, while Mastercard trades at 35 times, according to Refinitiv Datastream. Both stocks are trading at a higher premium to the market than they have on average over the past five years.","The big run for Visa and Mastercard shares has also come during an more than 10-year U.S. bull market, and gains could be more muted in any downturn. Stocks started 2020 strong but have pulled back amid concerns over the spread of a virus from China.","Risks to the companies, Ellis said, include greater competition in the payment sector from big tech companies, as well as tougher regulations from governments around the world that might hinder access.","The companies are not sitting still. Earlier this month, Visa agreed to buy privately held Plaid Inc in a $5.3 billion deal to boost access to financial technology, and in August Mastercard agreed to buy a majority of the corporate services businesses of Scandinavian payments group Nets for about $3.19 billion."
79,https://www.reuters.com/article/us-mastercard-results/mastercard-beats-profit-estimates-on-strong-holiday-season-spending-idUSKBN1ZS1NU,2020-01-29T13:27:12Z,Mastercard beats profit estimates on strong holiday season spending,"(Reuters) - Mastercard Inc MA.N beat Wall Street estimates for quarterly profit on Wednesday as customers spent more on its cards during the U.S. holiday shopping season, boosting fees for the world's second-largest payment processor.","The company’s gross dollar volume, the dollar value of transactions processed, rose 12% to $1.73 trillion in the fourth quarter.","U.S. retail sales, a measure of purchases at stores, restaurants and online, rose every month in the fourth quarter helped by a strong holiday shopping season, while wage gains and the labor market remained on solid footing.","Around 29.38 billion transactions were processed, a 19% increase from a year earlier. The gain was led by a 9% rise in the United States and a 28% jump in Europe.","Net revenue rose 16% to $4.41 billion, edging past analysts’ estimates of $4.40 billion.",Adjusted net income rose to $2.0 billion in the fourth quarter ended Dec. 31 from $1.6 billion a year earlier. (mstr.cd/36wyQag),"On a per share basis, the company earned $1.96 per share, while analysts had expected a profit of $1.87 per share, according to IBES data from Refinitiv.",Shares of the company were up 1% in premarket trading.
80,https://www.reuters.com/article/mastercard-results/mastercard-profit-rises-25-on-higher-transactions-idUSL4N29Y2DZ,2020-01-29T13:05:22Z,Mastercard profit rises 25% on higher transactions,"Jan 29 (Reuters) - Mastercard Inc reported a 25% jump in adjusted quarterly profit on Wednesday as customers spent more on its cards to shop and pay bills, boosting fees for the world’s second-largest payment processor.","Adjusted net income rose to $2.0 billion, or $1.96 per share, in the fourth quarter ended Dec. 31 from $1.6 billion, or $1.55 per share, a year earlier. (mstr.cd/36wyQag) (Reporting by Bharath Manjesh in Bengaluru; Editing by Krishna Chandra Eluri)"
81,https://www.reuters.com/article/us-ftc-visa-mastercard-probe/visa-mastercard-draw-ftc-inquiry-over-debit-card-transactions-bloomberg-law-idUSKBN1XN291,2019-11-13T18:14:14Z,"Visa, Mastercard draw FTC inquiry over debit card transactions: Bloomberg Law","(Reuters) - The Federal Trade Commission (FTC) has initiated a preliminary inquiry on Visa Inc V.N and Mastercard Inc MA.N for possibly prohibiting merchants from using other debit networks, Bloomberg Law reported on Wednesday, citing sources.","The regulator is looking into whether Visa, Mastercard and other large debit card issuers are blocking retailers from routing card transactions over alternative networks such as Pulse, NYCE and Star, the report said.","The FTC has been reaching out to large merchants and their trade groups over the issue, the report added. (bit.ly/2O5Br3M)",The inquiry could spell fresh regulatory trouble for the world’s two largest payments processors which settled a protracted European Union antitrust probe in April this year over card fees.,"The regulator has probed issues related to debit routing in the past. Following an FTC inquiry in 2016, Visa revised a rule that required retailers to ask cardholders to choose a routing network for their debit card transactions.",The FTC declined to comment and the companies did not immediately respond to a request for comment.
82,https://www.reuters.com/article/ftc-visa-mastercard-probe/visa-mastercard-draw-ftc-inquiry-over-debit-card-transactions-bloomberg-law-idUSL4N27T3ZT,2019-11-13T17:07:54Z,"Visa, Mastercard draw FTC inquiry over debit card transactions - Bloomberg Law","Nov 13 (Reuters) - The Federal Trade Commission (FTC) is conducting a preliminary inquiry on Visa Inc and Mastercard Inc over policies that can prohibit merchants from routing card transactions through other debit networks, Bloomberg Law reported on Wednesday, citing sources familiar with the matter.","The FTC has been reaching out to large merchants and their trade groups over the issue, the report said. (bit.ly/2O5Br3M)",Visa and Mastercard did not immediately respond to a request for comment. (Reporting by Bharath Manjesh in Bengaluru; Editing by Shinjini Ganguli)
