115,https://www.reuters.com/article/us-china-mastercard/mastercard-says-plans-to-apply-for-china-license-to-clear-card-payments-idUSKCN1PK034,2019-01-26T02:53:35Z,Mastercard says plans to apply for China license to clear card payments,SHANGHAI (Reuters) - U.S. payments card company Mastercard Inc said on Friday it still plans to apply for a bankcard clearing license in China and was in “active discussions” to explore solutions.,"Mastercard “continues to make every effort to secure the requisite license to be able to access China’s domestic market,” it said in a statement posted on its website.",The company “hopes to be able to present another application for the bankcard clearing license in the very near future.”,"State newspaper Beijing News reported on Friday that Mastercard had submitted application materials in 2017 but voluntarily withdrew its application in June 2018, citing an unnamed source at China’s central bank.",Mastercard did not immediately respond to an emailed request from Reuters on Saturday for further comment.,"American Express Co in November won approval to clear card payments in China, becoming the first U.S. card network to gain direct access to what is set to be the biggest bank card market by 2020.","Previously, foreign card companies have had to partner with China’s UnionPay, a state-controlled consortium that enjoyed a monopoly on all yuan payment cards issued and used in the country, for access to the country’s payments network.","UnionPay counts Mastercard, Visa Inc and Apple Inc among its partners for payment services in China."
116,https://www.reuters.com/article/us-earthport-m-a-mastercard/mastercard-tops-visas-offer-to-buy-british-payments-firm-earthport-idUSKCN1PJ0L3,2019-01-25T16:20:23Z,Mastercard tops Visa's offer to buy British payments firm Earthport,"(Reuters) - Mastercard Inc made a 233 million pound ($305 million) bid to take over payments firm Earthport Plc on Friday, as it looks to head off rival Visa Inc’s attempts to buy the British company.","Mastercard’s offer is at a 10 percent premium to Visa’s 198 million pound offer. Visa said later in the day that it would consider its options, without giving further details.","Earthport’s shares, which have risen four-fold since Visa first offered to buy the company, rose another 30 percent on Friday.","Mastercard said the Earthport deal would allow it to expand its cross-border network service, the same reason cited by Visa when it made its bid in December.","The rival bid comes after Earthport’s shares, listed on the London Stock Exchange’s secondary market, fell more than 28 percent in 2018 amid growing losses and expenses. In November, the company said “fundamental” changes were required in its strategy.","Payment processing has become one of the hottest areas for deal making in the last two years, driven by technological changes in the way consumers pay for products.",Earthport offers a lower-cost alternative to traditional payments systems by allowing banks and money transfer firms to have a single relationship instead of multiple ties with various payments channels around the world.,"Earthport’s directors have unanimously recommended Mastercard’s offer and withdrawn their recommendation for Visa’s proposal, the company said.","Mastercard shares were up 1.8 percent, while Visa shares were up 1.1 percent on the New York Stock Exchange.",($1 = 0.7634 pounds)
117,https://www.reuters.com/article/earthport-ma-mastercard/mastercard-nudges-visas-offer-to-buy-british-payments-firm-earthport-idUSL3N1ZP2OG,2019-01-25T07:35:11Z,Mastercard nudges Visa's offer to buy British payments firm Earthport,"Jan 25 (Reuters) - Mastercard Inc made a 233 million pound ($305 million) bid to take over payments firm Earthport on Friday, scuppering rival Visa Inc’s attempts to buy the British company.",Mastercard’s offer is at a 10 percent premium to Visa’s 198 million pound offer.,"Earthport’s directors have unanimously recommended Mastercard’s offer and withdrawn its recommendation for Visa’s proposal, the company said."
118,https://www.reuters.com/article/us-eu-mastercard/eu-fines-mastercard-570-million-euros-over-cross-border-barriers-idUSKCN1PG11X,2019-01-22T12:00:46Z,EU fines Mastercard 570 million euros over cross-border barriers,BRUSSELS (Reuters) - The European Commission said on Tuesday it had fined Mastercard MA.N 570.6 million euros ($648.3 million) for limiting the possibility for merchants to benefit from better conditions offered by banks elsewhere in the European Union.,"“By preventing merchants from shopping around for better conditions offered by banks in other member states, Mastercard’s rules artificially raised the costs of card payments, harming consumers and retailers in the EU,” European Competition Commissioner Margrethe Vestager said in a statement.",The Commission granted Mastercard a 10 percent fine reduction for cooperating with its investigation.,"The fine is the latest in a series of actions over the past decade that the Commission, acting as the antitrust regulator for the 28-member European Union, has taken to reduce card fees for merchants.","It has, for example, taken decisions to make legally binding commitments by Visa Europe to cap the levels of interchange fees for all debit and credit card transactions within the European Economic Area.",It has also looked into the fees charged on card payments made by tourists visiting the European Union.,($1 = 0.8801 euros),(This story was refiled to remove extraneous text at end of story)
119,https://www.reuters.com/article/us-eu-mastercard-statement/mastercard-eu-fine-of-570-million-euros-to-be-taken-as-charge-in-the-fourth-quarter-of-2018-idUSKCN1PG18Z,2019-01-22T11:48:23Z,Mastercard: EU fine of 570 million euros to be taken as charge in the fourth quarter of 2018,"BRUSSELS (Reuters) - Mastercard MA.N said on Tuesday that an EU antitrust fine of 570.6 million euros ($648.3 million) would be taken as a charge in the fourth quarter of 2018, calling the closure of the case an important milestone for the company.","“This decision relates to historic practices only, covers a limited period of time of less than 2 years and will not require any modification of Mastercard’s current business practices,” it said in a statement.",The European Commission said earlier on Tuesday that it had fined for limiting the possibility for merchants to benefit from better conditions offered by banks elsewhere in the European Union.
120,https://www.reuters.com/article/eu-mastercard-statement/mastercard-eu-fine-of-570-mln-euros-to-be-taken-as-charge-in-q4-2018-idUSL8N1ZM39K,2019-01-22T11:42:45Z,Mastercard: EU fine of 570 mln euros to be taken as charge in Q4 2018,"BRUSSELS, Jan 22 (Reuters) - Mastercard said on Tuesday that an EU antitrust fine of 570.6 million euros ($648.3 million) would be taken as a charge in the fourth quarter of 2018, calling the closure of the case an important milestone for the company.","“This decision relates to historic practices only, covers a limited period of time of less than 2 years and will not require any modification of Mastercard’s current business practices,” it said in a statement.",The European Commission said earlier on Tuesday that it had fined for limiting the possibility for merchants to benefit from better conditions offered by banks elsewhere in the European Union. (Reporting by Foo Yun Chee and Alissa de Carbonnel; editing by Philip Blenkinsop)
121,https://www.reuters.com/article/us-eu-visa-mastercard-fees/visa-mastercard-offer-to-cap-tourist-card-fees-to-end-eu-probe-idUSKBN1O314X,2018-12-04T17:40:49Z,"Visa, Mastercard offer to cap tourist card fees to end EU probe",BRUSSELS (Reuters) - Visa V.N and Mastercard MA.N have offered to cap the fees charged on card payments made by tourists in the European Union to stave off fines and end an EU antitrust investigation.,"The European Commission, which has waged a decades-long crackdown on payment and credit card fees, says so-called interchange fees in which the merchant’s bank pays a charge to the cardholder’s bank, result in higher prices for consumers.","This is because the fees, which are a lucrative source of revenue for banks, are ultimately borne by the merchant.","Visa, the world’s largest payments network operator, and its closest rival Mastercard have proposed a 0.2 percent fee on non-EU debit card payments carried out in shops and a 0.3 percent fee on credit card payments, the Commission said on Tuesday.","This would bring their fees in line with those charged for EU cards, which were the subject of a long EU investigation after a 1997 complaint by business lobby EuroCommerce.","The group, whose members include Carrefour CARR.PA, Marks & Spencer MKS.L, Lidl and Metro B4B.DE, welcomed the offer but criticized the big difference in online and offline transaction fees.","Under the terms of the offer for online payments, debit card charges would be 1.15 percent and 1.50 percent for credit cards and the commitments would apply for five-and-a-half years.","“No such distinction is made for cards issued in the EU... We therefore cannot understand why merchants should be charged more for a perceived risk which can only arise by the card issuers’ failure to implement adequate fraud prevention measures,” the lobbying group said.",European consumer group BEUC urged merchants to pass on the cost savings to consumers.,"Third parties have a month to provide feedback before the Commission decides whether to accept the offer, which was revealed by Reuters last month, or demand a bigger reduction.",Mastercard said it expected to incur a $650 million charge in the fourth quarter of this year because of a substantial fine related to a second EU antitrust investigation.,The Commission three years ago charged the company with imposing rules which blocked banks in one EU country from offering lower interchange fees to a retailer in a second EU country. Mastercard scrapped this practice in December 2015 after the bloc adopted rules capping such charges.,"“The case is still ongoing and we cannot comment further on it,” Commission spokesman Ricardo Cardoso said."
122,https://www.reuters.com/article/us-eu-visa-mastercard-fine/mastercard-to-incur-650-million-fourth-quarter-charge-for-eu-antitrust-fine-idUSKBN1O31A3,2018-12-04T11:49:32Z,Mastercard to incur $650 million fourth-quarter charge for EU antitrust fine,"BRUSSELS (Reuters) - Mastercard MA.N will incur a $650 million charge in the fourth quarter of this year because of a substantial fine related to a second EU antitrust investigation, the world's second largest payments network operator said on Tuesday.",The European Commission three years ago accused the company of having rules which blocked banks in one EU country from offering lower interchange fees to a retailer in a second EU country.
123,https://www.reuters.com/article/eu-visa-mastercard-fine/mastercard-to-incur-650-million-q4-charge-for-eu-antitrust-fine-idUSL1N1Y90BF,2018-12-04T11:32:06Z,Mastercard to incur $650 million Q4 charge for EU antitrust fine,"BRUSSELS, Dec 4 (Reuters) - Mastercard will incur a $650 million charge in the fourth quarter of this year because of a substantial fine related to a second EU antitrust investigation, the world’s second largest payments network operator said on Tuesday.",The European Commission three years ago accused the company of having rules which blocked banks in one EU country from offering lower interchange fees to a retailer in a second EU country.
124,https://www.reuters.com/article/us-eu-visa-mastercard-resolution/mastercard-sees-eu-antitrust-cases-resolved-in-first-quarter-of-2019-idUSKBN1O318T,2018-12-04T11:29:50Z,Mastercard sees EU antitrust cases resolved in first quarter of 2019,BRUSSELS (Reuters) - Mastercard MA.N said on Tuesday it expected a resolution to two EU antitrust investigations in the first quarter of 2019.,"The world's second-biggest payments network operator and Visa V.N have offered to cut the merchants' charges for non-EU credit and debit cards by at least 40 percent, the European Commission said earlier on Tuesday."
125,https://www.reuters.com/article/eu-visa-mastercard-resolution/mastercard-sees-eu-antitrust-cases-resolved-in-q1-2019-idUSL1N1Y90B1,2018-12-04T11:19:47Z,Mastercard sees EU antitrust cases resolved in Q1 2019,"BRUSSELS, Dec 4 (Reuters) - Mastercard said on Tuesday it expected a resolution to two EU antitrust investigations in the first quarter of 2019.","The world’s second-biggest payments network operator and Visa have offered to cut the merchants’ charges for non-EU credit and debit cards by at least 40 percent, the European Commission said earlier on Tuesday."
126,https://www.reuters.com/article/eu-visa-mastercard-fees/visa-mastercard-propose-merchants-tourist-card-fee-cut-to-end-eu-probe-idUSL1N1Y909R,2018-12-04T10:50:37Z,"Visa, Mastercard propose merchants' tourist card fee cut to end EU probe","BRUSSELS, Dec 4 (Reuters) - Visa and Mastercard have offered to reduce merchants’ charges for non-EU credit and debit cards by at least 40 percent to end an EU antitrust investigation, the European Commission said on Tuesday.","Visa, the world’s largest payments network operator, and No. 2 player Mastercard have proposed a 0.2 percent fee on debit card payments carried out in shops and a 0.3 percent fee on credit card payments, the European Commission said on Tuesday.","For online payments, debit card charges would be 1.15 percent and 1.50 percent for credit cards. (Reporting by Foo Yun Chee; editing by Philip Blenkinsop)"
127,https://www.reuters.com/article/us-usa-holidayshopping-blackfriday/black-friday-deals-lure-u-s-shoppers-biggest-sales-gains-online-idUSKCN1NS122,2018-11-24T22:36:09Z,"Black Friday deals lure U.S. shoppers, biggest sales gains online","NEW YORK (Reuters) - Shoppers across the United States snapped up deep discounts on toys, clothing and electronics both online and at stores on Black Friday, giving retailers a strong start to their make-or-break holiday season.",A healthy economy and rising wages gave people the confidence to splash out on retailers’ annual raft of bargains.,"“The prices today are very good,” said Jose Manuel Cruz Hernandez, 59, who hit the Del Amo Fashion Center in Torrance, California, with his sister Paulina Cruz, 66, who comes every year from Mexico City to shop.","The pair spent $120 on princess dolls and other toys at the Walt Disney Co store, where items were 20 percent off. They spent a similar amount at Gap Inc, where items were discounted by about 55 percent.","Cruz Hernandez, a foreman at an aerospace firm, said he was comfortable with the U.S. economy and his own finances and plans to spend another $1,000 on holiday gifts - about the same as last year.","A similar story played out online, where shoppers spent $643 million by 10 a.m. ET, up 28 percent from a year ago, according to Adobe Analytics, which tracks transactions at most of the top U.S. online retailers. Smartphone sales in particular contributed to gains.","Foot traffic looked healthy at stores offering discounts, although detailed numbers on brick-and-mortar holiday sales will not be available for several days.","“Overall, Black Friday doesn’t have the sense of urgency as in the past and feels more like a busy regular weekend day in many of the stores,” said Dana Telsey at Telsey Advisory Group.","“Many of the promotions were available for the past couple of weeks,” Telsey said. “We haven’t noticed desperation from any retailer.”","Shares of Macy’s Inc, Kohl’s Corp, and Target Corp all closed down on Friday and weighed on the broader S&P 500 retailing index, which closed down 0.56 percent.","Investors are concerned retail sales growth may have peaked in the second quarter and business will slow down as comparisons get tougher, said Brian Yarbrough, retail analyst with Edward Jones.","Victoria’s Secret owner L Brands, Walmart Inc and American Eagle Outfitters rose. J.C. Penney Co Inc ended flat and Amazon.com Inc closed slightly lower.",The overall stock market finished a shortened session with losses.,"Early numbers showed overall retail sales, both in stores and online, were in line with expectations, according to Mastercard Inc’s SpendingPulse retail report. The firm expects overall Black Friday sales to top $23 billion this year, up from $21 billion last year.",Mastercard combines sales activity in its payments network with estimates of cash and other payment forms. It said cold weather in the eastern United States and wet weather in the west may be pushing more consumers online.,"Online spending is on track to hit $6.4 billion on Friday, Adobe said. Online sales on Thanksgiving Day were up 28 percent at $3.7 billion.",The National Retail Federation forecast U.S. holiday retail sales in November and December will increase between 4.3 and 4.8 percent over 2017 for a total of $717.45 billion to $720.89 billion. That compares with an average annual increase of 3.9 percent over the past five years.,"About 38 percent of American consumers plan to shop on Black Friday, a Reuters/Ipsos poll showed last week.","Very cold weather in the U.S. Northeast may have kept some shoppers at home, although industry analysts also reported added demand for coats and other warm clothing. An Athleta clothing store in Tysons, Virginia, provided hot chocolate with marshmallows to women in line for the dressing room.","Shoppers picked up big-ticket items such as TVs, Apple Inc iPads and Watches at Target, while phones, toys, gaming consoles and cookware were top sellers at Walmart Inc.","Many shoppers sought out air fryers, which do not use oil to deep fry food and Instant Pots. Kohl’s Chief Executive Michelle Gass told CNBC the company was selling 60 Instant Pots per minute online on Thanksgiving Day.","While most retailers have not changed their deals and discounts year-over-year, many have moved their start dates earlier and offered more teasers, according to deal site RetailMeNot.","The deepest discounts in apparel and accessories were offered by Michael Kors, which ran a 60 percent discount sale; Gap, which offered 50 percent off site-wide; and Nordstrom, which gave away up to 60 percent on merchandise.",Other deals included:,* An H&M store in Manhattan offered 30 percent off everything in-store and online.,"* Macy’s in Herald Square, Manhattan, sold a Coach designer wallet, originally $225, for $53. Coach bags there, originally $259, were half off.",* Midtown Comics was taking 25 percent off everything at its three Manhattan locations until noon.,* An Eddie Bauer in Chicago offered 50 percent off all items.,"* At a Chicago-area Pandora, which sells popular charm bracelets that can cost up to $1,000, jewelry was 35 percent off before 10 a.m. and 25 percent off for the remainder of the day.",* J Crew clothing was 50 percent off. Its site experienced some technical difficulties.,* Walmart was selling a Google Home mini for $99.,"Many retailers, reacting to the bankruptcy of the Toys ‘R’ Us chain, are catering to parents.",Target said in October it planned to dedicate nearly a quarter of a million square feet of new space to its toy business across 500 of its stores.,"“Toys ‘R’ Us had better quality for toys,” said Ashley Drew, 29, shopping for her 5-year-old daughter at a Los Angeles-area Walmart, next door to the empty shell of a Toys ‘R’ Us store.","Department store JC Penney, known for its mid-priced apparel, has also made a push into toys.","Carolyn Pertette from Wilkinsburg, Pennsylvania, shopped in the early morning at the Waterfront Mall in Pittsburgh.","“I’m concerned about where I’m going to get toys,” she said."
128,https://www.reuters.com/article/us-eu-visa-mastercard-fees-exclusive/exclusive-visa-mastercard-offer-tourist-card-fee-cut-in-eu-antitrust-probe-sources-idUSKCN1NR1TX,2018-11-23T16:19:47Z,"Exclusive: Visa, Mastercard offer tourist card fee cut in EU antitrust probe - sources","BRUSSELS (Reuters) - Visa and Mastercard have offered to trim the fees merchants pay on card payments by tourists in the European Union in an attempt to stave off possible fines after a long-running antitrust investigation, people familiar with the matter said.","Even after the cut, the fees paid by merchants when they accept card payments, a lucrative source of revenue for banks, will still likely be higher than those for EU cards, they said.",The European Commission has battled for more than a decade to reduce so-called interchange costs and encourage cross-border trade and online commerce. U.S. regulators have also frowned on such practices.,Retailers say interchange fees count as a hidden cost and the card companies have paid billions of dollars to settle class action lawsuits.,"Visa, the world’s largest payments network operator found itself in the Commission’s crosshairs in August 2017, charged with subjecting the cards of foreign tourists to excessive fees when they were used in the EU.",The case originally concerned Visa Europe which was acquired by Visa Inc in June 2016. The EU said that fees charged to retailers when they accept Visa cards issued outside the EU could raise prices of goods and services for all consumers.,The EU competition enforcer’s charge against Mastercard dated from July 2015. The company is also accused of having rules which blocked banks in one EU country from offering lower interchange fees to a retailer in a second EU country.,"The Commission and Visa declined to comment. Mastercard said: “At this time, we have no information to share on our ongoing engagement with the European Commission.”","Mastercard has warned it might be fined more than $1 billion if found guilty of breaching EU antitrust rules, but this might be less if there was a negotiated resolution.",The Commission can hand down fines as much as 10 percent of a company’s global turnover for infringing EU antitrust rules.,"But under EU settlement rules for antitrust cases, companies do not get fines nor are required to admit wrongdoing.",The Commission is expected to seek feedback from retailers and consumer groups before deciding whether to accept the offer from Visa and Mastercard. Negative comments could lead it to demand a bigger fee cut.,"Business lobbying group EuroCommerce, whose 1997 complaint triggered the EU investigations, and Visa declined to comment.","Visa and MasterCard capped cross-border fees within Europe - that is, fees on transactions in one EU country charged for transactions in another EU country - in 2014 and 2009 respectively, to end another EU investigation."
