31,https://www.reuters.com/article/us-pornhub-mastercard/mastercard-visa-halt-payments-on-pornhub-over-allegations-of-child-sex-abuse-content-idUSKBN28K30C,2020-12-10T22:03:39Z,"Mastercard, Visa halt payments on Pornhub over allegations of child sex-abuse content",(Reuters) - Mastercard Inc and Visa Inc on Thursday stopped processing payments on Pornhub after a New York Times report last week that many videos posted on the adult website depicted sexual assault of children.,Mastercard said it was permanently ending the use of its cards on the sex videos site after its investigation confirmed the presence of illegal content on the platform. Visa said it was suspending payments till an investigation was completed.,"Pornhub called the actions as “disappointing”, saying it came after the site implemented safeguards such as a ban on video downloads, as well as permitting only certain partner accounts to upload content.",The New York Times article had also described some videos on the site as recordings of assaults on unconscious women and girls.,Pornhub has denied the allegations.,"“This news is crushing for the hundreds of thousands of models who rely on our platform for their livelihoods,” Pornhub said on Thursday."
32,https://www.reuters.com/article/brief-mastercard-says-use-of-its-cards-a/brief-mastercard-says-use-of-its-cards-at-pornhub-is-being-terminated-nyt-columnist-tweet-idUSFWN2IQ15K,2020-12-10T19:24:31Z,BRIEF-Mastercard Says Use Of Its Cards At Pornhub Is Being Terminated- NYT Columnist Tweet,Dec 10 (Reuters) -,* MASTERCARD SAYS USE OF ITS CARDS AT PORNHUB IS BEING TERMINATED- NYT COLUMNIST TWEET,* MASTERCARD SAYS “CONTINUE TO INVESTIGATE POTENTIAL ILLEGAL CONTENT ON OTHER WEBSITES” - NYT COLUMNIST TWEET,* MASTERCARD SAYS INVESTIGATION ON PORNHUB OVER PAST SEVERAL DAYS CONFIRMED VIOLATIONS OF ITS STANDARDS PROHIBITING UNLAWFUL CONTENT-NYT COLUMNIST TWEET Source text : bit.ly/3m42Hyr Further company coverage:
33,https://www.reuters.com/article/pornhub-mastercard/mastercard-ends-use-of-its-cards-on-pornhub-nyt-columnist-idUSL4N2IQ3N9,2020-12-10T19:22:19Z,Mastercard ends use of its cards on Pornhub - NYT columnist,"Dec 10 (Reuters) - Mastercard Inc is ending the use of its cards at Pornhub, citing the presence of illegal content on the website, New York Times columnist Nicholas Kristof tweeted on Thursday. (Reporting by Munsif Vengattil; Editing by Anil D’Silva)"
34,https://www.reuters.com/article/us-pornhub-payments/mastercard-to-investigate-allegations-against-pornhub-idUSKBN28G0KH,2020-12-07T09:16:38Z,Mastercard to investigate allegations against Pornhub,(Reuters) - Mastercard Inc said on Sunday it was investigating allegations against Pornhub.com following a newspaper column which said many videos posted on the adult website depicted child abuse.,"The New York Times column, written by Nicholas Kristof, described videos on Pornhub that the author said were recordings of assaults on unconscious women and girls.","""The issue is not pornography but rape. Let's agree that promoting assaults on children or on anyone without consent is unconscionable,"" Kristof wrote in the column published on Friday. (nyti.ms/2JXiqSw)",Pornhub denied the allegations.,"“Any assertion that we allow CSAM (child sexual abuse material) is irresponsible and flagrantly untrue,” it said in a statement emailed to Reuters.","Mastercard told Reuters in a statement that it was investigating the allegations with Pornhub’s parent MindGeek’s bank. “If the claims are substantiated, we will take immediate action,” Mastercard said.",Billionaire investor Bill Ackman called on Mastercard and Visa Inc to temporarily withhold payments to Pornhub following the newspaper column.,"Ackman also asked American Express Co to take action, though the company’s cards aren’t accepted on the site.","Visa said it is aware of the allegations and is “actively engaging with the relevant financial institutions to investigate,” while also engaging directly with MindGeek.","“If the site is identified as not complying with applicable laws or the financial institutions’ acceptable use policies and underwriting standards they will no longer be able to accept Visa payments,” the company said in a statement.",American Express said it has a longstanding global policy that prohibits acceptance of its cards on digital adult content websites.,"Ackman suggested it should be made illegal for porn sites to post videos before they are reviewed by a monitor, and until the ages and consent of participants have been validated.","In its response, Pornhub said it has a vast team of human moderators who manually review “every single upload,” as well as automated detection technologies. It did not say how many people were part of its review team.","Kristof’s column also drew reactions from politicians including Canadian Prime Minister Justin Trudeau, who said his government was working with police and security officials to address the issues it raised.","In the United States, Senator Josh Hawley said he will introduce legislation to create a federal right to sue for every person “coerced or trafficked or exploited by sites like Pornhub.”"
35,https://www.reuters.com/article/pornhub-payments/mastercard-to-investigate-allegations-against-pornhub-idUSL4N2IM035,2020-12-06T15:43:07Z,Mastercard to investigate allegations against Pornhub,Dec 6 (Reuters) - Mastercard Inc said on Sunday it was investigating allegations against Pornhub.com following a newspaper column which said many videos posted on the adult website depicted child abuse.,"The New York Times column, written by Nicholas Kristof, described videos on Pornhub that the author said were recordings of assaults on unconscious women and girls.","""The issue is not pornography but rape. Let's agree that promoting assaults on children or on anyone without consent is unconscionable,"" Kristof wrote in the column published on Friday. (nyti.ms/2JXiqSw)",Pornhub denied the allegations.,"“Any assertion that we allow CSAM (child sexual abuse material) is irresponsible and flagrantly untrue,” it said in a statement emailed to Reuters.","Mastercard told Reuters in a statement that it was investigating the allegations with Pornhub’s parent MindGeek’s bank. “If the claims are substantiated, we will take immediate action,” Mastercard said.",Billionaire investor Bill Ackman called on Mastercard and Visa Inc to temporarily withhold payments to Pornhub following the newspaper column.,"Ackman also asked American Express Co to take action, though the company’s cards aren’t accepted on the site.",Visa did not immediately respond to a request for comment.,American Express said it has a longstanding global policy that prohibits acceptance of its cards on digital adult content websites.,"Ackman suggested it should be made illegal for porn sites to post videos before they are reviewed by a monitor, and until the ages and consent of participants have been validated.","In its response, Pornhub said it has a vast team of human moderators who manually review “every single upload,” as well as automated detection technologies. It did not say how many people were part of its review team.","Kristof’s column also drew reactions from politicians including Canadian Prime Minister Justin Trudeau, who said his government was working with police and security officials to address the issues it raised.","In the United States, Senator Josh Hawley said he will introduce legislation to create a federal right to sue for every person “coerced or trafficked or exploited by sites like Pornhub.” (Reporting by Shubham Kalia and Juby Babu in Bengaluru; Editing by Daniel Wallis)"
36,https://www.reuters.com/article/us-finicity-m-a-mastercard/mastercard-gets-u-s-doj-green-light-for-finicity-deal-idUSKBN27W22F,2020-11-16T16:01:14Z,Mastercard gets U.S. DoJ green light for Finicity deal,(Reuters) - Mastercard Inc said (here) on Monday the U.S. Department of Justice has allowed it to move forward with its $825 million deal to buy fintech firm Finicity.,The deal was first announced in June by the payment processing company.,"Finicity is expected to help Mastercard strengthen its open banking services, which allow customers to determine how and where third parties such as fintechs or other banks can access information to initiate payments on their behalf or provide money management services.","Finicity has partnered with major financial institutions in the past including Wells Fargo & Co, Fidelity Investments, Capital One Financial Corp and JPMorgan Chase.",Mastercard said in June the deal was expected to close by the end of the year.
37,https://www.reuters.com/article/finicity-ma-mastercard/mastercard-gets-u-s-doj-green-light-for-finicity-deal-idUSL4N2I23KX,2020-11-16T15:38:37Z,Mastercard gets U.S. DoJ green light for Finicity deal,Nov 16 (Reuters) - Mastercard Inc said here on Monday the U.S. Department of Justice has allowed it to move forward with its $825 million deal to buy technology firm Finicity. (Reporting by Noor Zainab Hussain in Bengaluru; Editing by Shinjini Ganguli)
38,https://www.reuters.com/article/us-visa-results/visa-profit-falls-23-as-payment-volumes-plunge-idUSKBN27D30Z,2020-10-28T20:43:53Z,Visa profit falls 23% as payment volumes plunge,"(Reuters) - Visa Inc V.N missed Wall Street estimates for fourth quarter profit on Wednesday, as high unemployment due to the coronavirus-induced recession continued to weigh on consumer spending.","The payments processor said total spending decreased 10% on a constant dollar basis, and the number of processed transactions tumbled 13% from a year earlier.",Cross-border volume slid 47% as the continuing global pandemic continued to hurt travel demand.,"Earlier on Wednesday, Mastercard Inc MA.N missed profit expectations and warned that travel-related spending will likely be a major headwind for the industry until COVID-19 vaccines are widely available.","Visa’s net income fell to $2.4 billion, or $1.07 per Class A share, for the fourth quarter ended Sept. 30, from $3.03 billion, or $1.34 per Class A share, a year earlier. On an adjusted basis the company reported earnings of $1.06 per share.","Net revenue fell 17% to $4.8 billion as consumer spending was limited due to the health crisis, which has triggered the worst economic downturn in decades and prompted massive layoffs.",This is only the second time the company’s quarterly revenue declined year-over-year since it went public in 2008.,Analysts polled by Refinitiv had been expecting an 18.5% slide in revenue and earnings of $1.09 per share.
39,https://www.reuters.com/article/mastercard-results/mastercard-warns-of-ongoing-virus-led-travel-slowdown-as-profit-slumps-idUSKBN27D1W5,2020-10-28T15:22:56Z,Mastercard warns of ongoing virus-led travel slowdown as profit slumps,"(Reuters) - Mastercard Inc said on Wednesday it does not expect a pickup in overall travel spending anytime soon, warning that a recovery in cross-border volumes would be tied to the timing and the availability of COVID-19 vaccines.","The payments processor said the impact of the pandemic on international travel, especially outside Europe, remains significant. The comments echoed sentiments of American Express, which last week reported a 40% fall in quarterly profit and warned business travel would not recover before early 2022.","Mastercard’s shares fell 7% to $295.45, while shares in rival Visa Inc, expected to report results after market close, were also lower.","“While we believe that cross-border will ultimately recover, it will take time for people to build their confidence in the safety of travel,” Mastercard’s finance chief Sachin Mehra told analysts on a conference call.","“We believe that is tied to the broad availability of vaccines and therapeutics, likely towards the latter part of next year,” he said.","The pandemic has forced companies to lay off workers by the millions, hurting their spending power, and the hit to air travel has also taken a toll on cross-border card transaction volumes.","Mastercard reported a 36% drop in cross-border volumes on a local currency basis, with the first three weeks of the current quarter clocking declines of more than 30% each.","Chief Executive Officer Ajay Banga, however, pointed to “some” improvement in domestic travel in the quarter, including spending on lodging and sports.","Banga, who took charge just after the 2008-09 financial crisis, was speaking to analysts on his final earnings call before his transition to the role of executive chairman next year.","Mastercard’s net income fell 28% to $1.5 billion, or $1.51 per share, in the third quarter ended Sept. 30. Excluding items, profit was $1.60 per share, missing Street estimates of $1.66, according to IBES data from Refinitiv.","Net revenue fell 14% to $3.8 billion, while gross dollar volume, the dollar value of transactions processed, rose 1% to $1.6 trillion. Purchase volumes rose 2%, returning to positive territory. (bit.ly/34CIvyt)","The company forecast growth in U.S. retail sales excluding automotive and gas of 2.4% during the holiday season, with spending mainly on home furnishing, athleisure, clothing and electronics."
40,https://www.reuters.com/article/mastercard-results/mastercard-profit-falls-as-pandemic-hits-spending-volumes-idUSL4N2HJ2M9,2020-10-28T12:03:39Z,Mastercard profit falls as pandemic hits spending volumes,"Oct 28 (Reuters) - Mastercard Inc reported a 28% slump in quarterly profit on Wednesday as fewer people used its cards to shop, travel and pay bills during the COVID-19 pandemic.","Net income fell to $1.5 billion, or $1.51 per share, in the third quarter ended Sept. 30 from $2.1 billion, or $2.07 per share, a year earlier. (Reporting by Noor Zainab Hussain in Bengaluru; Editing by Ramakrishnan M.)"
41,https://www.reuters.com/article/us-nets-m-a-mastercard-eu/eu-regulators-okay-with-conditions-mastercards-scandinavian-e-pay-deal-idUSKCN25D1W1,2020-08-17T15:32:17Z,EU regulators okay with conditions Mastercard's Scandinavian e-pay deal,BRUSSELS (Reuters) - EU antitrust regulators on Monday cleared Mastercard's MA.N bid to buy part of Scandinavian payments group Nets after the companies agreed to sell a Nets technology to a rival to boost competition in the market.,"U.S. payments group Mastercard last year announced the proposed acquisition of three divisions of Nets, which cover corporate clearing, instant payments and e-billing, for about for about 2.85 billion euros ($3.4 billion).","It offered concessions last month after the European Commission voiced concerns about the impact of the deal in account-to-account core infrastructure services, where payments are processed directly from one bank account to another without the need for a card.","“Mastercard and Nets offered to transfer to a suitable purchaser a global license to distribute, supply, sell, develop, modify, upgrade or otherwise use Nets’ Realtime 24/7 technology,” the EU competition enforcer said in a statement.",($1 = 0.8426 euros)
42,https://www.reuters.com/article/us-facebook-brazil-whatsapp/brazil-central-bank-authorizes-tests-of-facebooks-whatsapp-pay-mastercard-and-visa-say-idUSKCN24W337,2020-07-31T21:37:53Z,"Brazil central bank authorizes tests of Facebook's WhatsApp pay, Mastercard and Visa say","SAO PAULO (Reuters) - Brazil’s central bank has authorized testing of payments via Facebook Inc’s messaging service WhatsApp in the country, Visa Inc and Mastercard Inc said on Friday, easing an outright ban on the service imposed last month.","The ubiquitious messaging service in Brazil was finally entering the arena of payments by launching the service on June 15, after years of questions on how Facebook would make money from WhatsApp.","But only eight days later, Brazil’s central bank and anti-trust regulator blocked the service, saying it must be reviewed fair competition and data privacy concerns.",Mastercard said in a statement that the tests would allow a limited number of cards to make small payments while the service is still pending central bank approval.,"The central bank said in a statement that “the request is being analyzed and is following the normal approval procedure,” without elaborating."
43,https://www.reuters.com/article/facebook-brazil-whatsapp/brazil-central-bank-authorizes-tests-of-facebooks-whatsapp-pay-mastercard-and-visa-say-idUSS0N2F0035,2020-07-31T21:19:09Z,"Brazil central bank authorizes tests of Facebook's WhatsApp pay, Mastercard and Visa say","SAO PAULO, July 31 (Reuters) - Brazil’s central bank has authorized testing of payments via Facebook Inc’s messaging service WhatsApp in the country, Visa Inc and Mastercard Inc said on Friday.","Mastercard said in a statement that the tests would allow a limited number of cards to make small payments. WhatsApp initially launched its payments service on June 15, but was later blocked by Brazilian authorities, citing fair competition and data privacy concerns. (Reporting by Aluisio Alves in Sao Paulo Editing by Matthew Lewis)"
44,https://www.reuters.com/article/us-mastercard-results/mastercard-profit-beats-estimates-as-lower-costs-dull-spending-hit-idUSKCN24V254,2020-07-30T15:03:07Z,Mastercard profit beats estimates as lower costs dull spending hit,"(Reuters) - Mastercard Inc's MA.N quarterly profit beat analyst estimates on Thursday, as lower costs softened the blow from fewer people using the payment processor's cards during the coronavirus pandemic.",The outbreak has hit large parts of the global travel and retail industries as stores remain shut and shoppers stay at home to avoid catching the illness.,Travel bans around the world have taken a toll on payment processors. Mastercard reported a 45% drop in cross-border volume on a local currency basis in the quarter.,Gross dollar volume - the dollar value of transactions processed - fell 10% to $1.4 trillion.,"The decline in cross-border volume has continued since the quarter ended, even as the number of transactions increased within the United States.","In the third week of July, the value of cross-border volume was down 40% from a year earlier, according to a presentation for investors. U.S. transactions were up 5% while transactions outside of the United States were down 3%.",Chief Financial Officer Sachin Mehra told analysts that since June cross-border business has “improved modestly” and will get better as travel restrictions are relaxed.,"Net income fell about 31% to $1.42 billion in the second quarter ended June 30. Excluding items, profit was $1.36 per share, beating estimates for $1.16, according to IBES data from Refinitiv.",Mastercard’s shares rose 1.41% in premarket trading on the announcement but were down 1.3% with the market in mid-morning trading.,Total operating expenses fell 5% to $1.6 billion in the quarter.,Rival Visa Inc's V.N results also topped analysts' estimates on Tuesday as lower-than-expected expenses eased the drag of lower spending due to the coronavirus pandemic.,"The U.S. government reported earlier this month that retail sales rebounded in May and June from a sharp drop in April, and ended down 8% for the quarter from a year earlier."
45,https://www.reuters.com/article/mastercard-results/mastercard-profit-drops-as-pandemic-hits-consumer-spending-idUSL3N2F13IU,2020-07-30T12:06:46Z,Mastercard profit drops as pandemic hits consumer spending,"July 30 (Reuters) - Mastercard Inc on Thursday reported a 30% slump in quarterly profit as fewer people used its cards during the COVID-19 pandemic, hitting spending volumes for the payment processor.","Net income fell to $1.4 billion, or $1.41 per share, in the second quarter ended June 30, from $2 billion, or $2 per share, a year earlier."
46,https://www.reuters.com/article/us-eu-banks-payments/eu-banks-to-take-on-visa-mastercard-with-new-payments-system-idUSKBN243284,2020-07-02T14:29:38Z,"EU banks to take on Visa, Mastercard with new payments system","LONDON/PARIS (Reuters) - Sixteen banks from Germany, France and three other euro zone countries on Thursday said a “truly European” payments system was expected to be up and running in 2022 to fully digitalise a region where half of all retail payments are still in cash.","European Union policymakers and central bankers have long sought a ""home grown"" rival to take on Mastercard MA.N and Visa V.N from the United States, and more recently tech giants like Alipay and Google GOOGL.O. But this has not happened even though real-time payments have been possible in the euro zone since 2017.","The European Central Bank on Thursday welcomed the banks’ decision to launch the unified European payment system by 2022, after advocating for years an industry-driven solution to compete with the likes of Mastercard and Visa.","""It is aimed at strengthening Europe, at making it more independent and robust,"" said Thierry Laborde, deputy chief operating officer of French bank BNP Paribas BNPP.PA, which is part of the project.","“We will do it collectively, by pooling our resources. As for distribution systems, prices will differ from one bank to another, but the infrastructure will be pan-European.”",The ECB had said last year that dependence on non-European players for two-thirds of non-cash payments created a risk that the payments market would not be fit to support the EU single market and euro.,"The so-called European Payments Initiative aims to become a new standard means of payment, offering a card for consumers and retailers across Europe, the statement from the 16 banks said.","It will cover all types of transactions including in-store, online, cash withdrawal and ‘peer-to-peer’ in addition to existing international payment scheme solutions.","Banks that have already signed up include BBVA BBVA.MC, BNP Paribas BNPP.PA, Commerzbank CBKG.DE, Deutsche Bank DBKGn.DE, Santander SAN.MC, ING INGA.AS, UniCredit CRDI.MI and Societe Generale SOGN.PA.","In coming weeks the project will set up an interim company in Brussels, with other payment service providers invited to join, the banks said.",The payments system is expected to become operational during 2022.,"“EPI’s objective is to offer a digital payment solution that can be used anywhere in Europe and to supersede the fragmented landscape that currently still exists,” the banks’ statement said.",“The Covid-19 crisis has underlined the need for a unified European digital payment solution.”,"During lockdowns, the use of cash has tumbled as shoppers move online or use “contactless” forms of payments."
47,https://www.reuters.com/article/us-nets-m-a-mastercard-eu/eu-antitrust-regulators-to-rule-on-mastercards-scandinavian-e-pay-deal-by-august-3-idUSKBN24119X,2020-06-30T09:46:36Z,EU antitrust regulators to rule on Mastercard's Scandinavian e-pay deal by August 3,"BRUSSELS (Reuters) - EU antitrust regulators will decide by Aug. 3 whether to clear Mastercard Inc’s bid for part of Scandinavian payments group Nets, according to a European Commission filing.","Mastercard’s planned acquisition of European rival Nets’ three divisions covering corporate clearing, instant payments and e-billing, has already triggered regulatory concerns.","The EU competition enforcer, which agreed to review the deal following requests from Austria, Denmark, Finland, Norway, Sweden and Britain, in April said the deal threatens to significantly affect competition in the Nordic area, Europe and Britain.","Mastercard sought EU approval on June 26, the Commission site showed.",The Commission can approve the deal with or without concessions in its preliminary review or open a four-month investigation if it has serious concerns.
48,https://www.reuters.com/article/us-facebook-brazil-whatsapp/whatsapp-says-brazil-central-bank-willing-to-restore-payments-service-idUSKBN23W27T,2020-06-25T15:00:36Z,WhatsApp says Brazil central bank willing to restore payments service,SAO PAULO/BRASILIA (Reuters) - Facebook Inc FB.O messaging service WhatsApp said on Thursday that Brazil's central bank had said it intended to find a way to restore the payments service in the country by working with Visa Inc V.N and Mastercard Inc MA.N.,"“The central bank made clear that they support platforms like WhatsApp that are innovating in digital payments,” Will Cathcart, head of WhatsApp, said in a statement.","On Tuesday, Brazil's central bank and antitrust watchdog suspended WhatsApp's newly launched payments services, as they see potential damage in the areas of competition, efficiency and data privacy. Regulators blocked WhatsApp partnerships with Visa, Mastercard and Cielo SA CIEL3.SA.","As Cielo is the only card acquirer in a deal with WhatsApp, Brazil’s antitrust watchdog Cade is investigating if the terms of the partnership could favor it in terms of exclusivity.",Cade estimates WhatsApp could increase Cielo’s card transactions by 10% in a conservative scenario. Cielo is already the country’s biggest acquirer with a 41% market share,"Still, Whatsapp reinforced in the statement its plans to open the service to more players in the future and to provide payments via central bank payments platform PIX.","Brazil is the first country where WhatsApp has announced a nationwide payments service. It has over 120 million users, its second largest market behind India.",The central bank did not immediately comment on the matter.
