1,https://www.reuters.com/article/us-mastercard-results/mastercard-profit-beats-estimates-as-consumer-spending-improves-idUSKBN2CG1E5,"April 29, 2021 1:17 PM UTC",Mastercard profit beats estimates as consumer spending improves,"Mastercard Inc (MA.N) reported a better-than-expected first-quarter profit on Thursday, as improved overall consumer spending helped offset a steep decline in cross-border payments on its cards.","The company also posted a return to top line growth, with overall revenue rising for the first time in four quarters. Net revenue grew 4% to $4.2 billion from last year, coming in ahead of estimates of $3.99 billion.","""We started the year with good momentum, delivering positive net revenue growth this quarter, and are encouraged by the return of domestic spending levels to pre-pandemic trends,"" Chief Executive Officer Michael Miebach said in a statement.",Mastercard's optimism on spending was in line with what peers Visa Inc (V.N) and American Express Co (AXP.N) had said earlier in April.,A rebound from last year's pandemic-fueled recession has lifted consumer spending in parts of the world and boosted card companies.,"Visa, the world's largest payments processor, beat quarterly profit estimates on Tuesday, helped by a surge in online shopping that countered sluggish travel spending. read more","Mastercard's gross dollar volumes, which represents the dollar value of the transactions processed, rose 8% on a local currency basis from a year earlier to $1.7 trillion.","However, cross-border spending remains weak, as a resurgence in the number of COVID-19 cases in some parts of the world weighs on travel spending.","Mastercard's cross-border volume, one of the key measures that track spending on its cards beyond the country of its issue, tumbled 17% on a local currency basis in the first quarter.","Net income, excluding exceptional items, fell to $1.7 billion, or $1.74 per share, from $1.8 billion, or $1.83 per share, a year earlier.","Still, profit still came in ahead of estimates. Analysts on average had expected a profit of $1.57 per share, according to Refinitiv IBES data.",
2,https://www.reuters.com/article/mastercard-results/corrected-update-1-mastercard-profit-falls-nearly-6-on-cross-border-spending-slump-idUSL4N2MM3KO,"April 29, 2021 1:17 PM UTC",CORRECTED-UPDATE 1-Mastercard profit falls nearly 6% on cross-border spending slump,"Mastercard Inc (MA.N) reported a better-than-expected first-quarter profit on Thursday, as improved overall consumer spending helped offset a steep decline in cross-border payments on its cards.","The company also posted a return to top line growth, with overall revenue rising for the first time in four quarters. Net revenue grew 4% to $4.2 billion from last year, coming in ahead of estimates of $3.99 billion.","""We started the year with good momentum, delivering positive net revenue growth this quarter, and are encouraged by the return of domestic spending levels to pre-pandemic trends,"" Chief Executive Officer Michael Miebach said in a statement.",Mastercard's optimism on spending was in line with what peers Visa Inc (V.N) and American Express Co (AXP.N) had said earlier in April.,A rebound from last year's pandemic-fueled recession has lifted consumer spending in parts of the world and boosted card companies.,"Visa, the world's largest payments processor, beat quarterly profit estimates on Tuesday, helped by a surge in online shopping that countered sluggish travel spending. read more","Mastercard's gross dollar volumes, which represents the dollar value of the transactions processed, rose 8% on a local currency basis from a year earlier to $1.7 trillion.","However, cross-border spending remains weak, as a resurgence in the number of COVID-19 cases in some parts of the world weighs on travel spending.","Mastercard's cross-border volume, one of the key measures that track spending on its cards beyond the country of its issue, tumbled 17% on a local currency basis in the first quarter.","Net income, excluding exceptional items, fell to $1.7 billion, or $1.74 per share, from $1.8 billion, or $1.83 per share, a year earlier.","Still, profit still came in ahead of estimates. Analysts on average had expected a profit of $1.57 per share, according to Refinitiv IBES data.",
3,https://www.reuters.com/article/mastercard-results/mastercard-profit-falls-5-6-on-cross-border-spending-slump-idUSL4N2MM2WJ,2021-04-29T12:07:09Z,Mastercard profit falls 5.6% on cross-border spending slump,"April 29 (Reuters) - Mastercard Inc reported a 5.6% drop in first-quarter profit on Thursday, mainly driven by a steep decline in cross-border spending on its cards because of a slump in international travel due to the COVID-19 pandemic.","Net income, excluding exceptional items, fell to $1.7 billion, or $1.74 per share, from $1.8 billion, or $1.83 per share, a year earlier.","Analysts on average had expected a profit of $1.57 per share, according to Refinitiv IBES data."
4,https://www.reuters.com/article/us-crypto-currency-mastercard/mastercard-and-digital-currency-exchange-gemini-to-launch-crypto-rewards-credit-card-idUSKBN2CE18B,"April 27, 2021 11:14 AM UTC",Mastercard and digital currency exchange Gemini to launch crypto rewards credit card,"Mastercard Inc (MA.N) and U.S. cryptocurrency exchange Gemini will launch the first credit card that gives users digital currency ""rewards"" on purchases this year, deepening the involvement of major payment firms in the emerging asset class.","Users of the card will from this summer receive up to 3% in bitcoin or other cryptocurrencies on their purchases, the companies said in a statement, with the digital currency deposited in the cardholder's Gemini account.","The card will be issued by WebBank, a Utah-based digital lender.","Payment giants from Mastercard and Visa Inc (V.N) to PayPal Holdings Inc (PYPL.O) have stepped up their engagement with cryptocurrencies in recent months, as larger investors and companies warm to bitcoin and its kin. read more","Mastercard said in February it was planning to offer support for some cryptocurrencies on its network this year, while Visa will also allow the use of cryptocurrency to settle transactions on its payment network. read more","""As consumers go about spending in various acceptance locations, now they get a chance to earn reward in the form of crypto,"" Raj Dhamodharan, Mastercard's head of digital assets and blockchain products & partnerships, said.",The card will be available in the United States.,,
5,https://www.reuters.com/article/ekata-ma-mastercard/mastercard-to-buy-digital-id-verification-firm-ekata-in-850-mln-deal-idUSL4N2MC37P,"April 19, 2021 3:54 PM UTC",Mastercard to buy digital ID verification firm Ekata in $850 mln deal,"Mastercard Inc (MA.N) said on Monday it had agreed to buy digital identity verification company Ekata in a deal valued at $850 million, as the global payments processor bets on a boom in demand for companies in the digital security space.","Ekata's products allow businesses to separate fraudsters from legitimate customers during digital interactions like opening an online account or making digital payments. It operates in three industries: e-commerce, payments and financial services, according to its website.","""The acceleration of online transactions has thrust global digital identity verification to the forefront as one of the biggest opportunities to build digital trust and combat global fraud,"" said Rob Eleveld, chief executive officer of Ekata, in a statement.","Seattle-headquartered Ekata counts more than 2,000 companies as its partners, including credit reporting company Equifax Inc (EFX.N) and software firm Intuit Inc (INTU.O), its website showed.","Its products, which include Ekata Identity Graph and Ekata Identity Network, allow companies to combat online fraud, it said.","In February, Ekata said its revenue had surged in 2020, as the COVID-19 pandemic accelerated the adoption of e-commerce, boosting demand for services to safeguard against cyber fraud.","Ekata added 300 new customers last year, including food and grocery-delivery startup Postmates, which was acquired by Uber Technologies (UBER.N) last year. (https://bwnews.pr/32qaUG7)","The payments processor said the deal is expected to close in the next six months, adding that it does not expect the deal to be a drag on its business for more than two years."
6,https://www.reuters.com/article/us-elo-ipo/exclusive-brazilian-payments-network-elo-picks-banks-for-ipo-sources-idUSKBN2BV2H0,2021-04-08T16:15:44Z,Exclusive: Brazilian payments network Elo picks banks for IPO - sources,"SAO PAULO (Reuters) - Brazilian payments firm Elo has chosen six banks to manage its initial public offering, four sources close to the matter said, in the first concrete sign it is proceeding with a move first proposed by shareholders in August.","The payments network - launched a decade ago to compete with Visa Inc and Mastercard Inc - is planning an IPO on Nasdaq, the sources said, following recent successful listings by Brazilian financial services firms such as XP Inc and StoneCo Ltd.","Elo has picked Morgan Stanley, Goldman Sachs and JPMorgan & Co as the main underwriters, along with the investment banking units of its owners Banco Bradesco SA, Banco do Brasil SA and Caixa Economica Federal.","One of the sources said Elo is pursuing a valuation of around $7 billion through the flotation, which another source said is likely to happen in the second half of the year. Elo declined to comment on the matter.","Bradesco, Banco do Brasil and Caixa intend to sell only a part of their holdings in the offering, the sources said.","Elo plans to use some of the IPO proceeds to increase its network of issuers. Aside from its three founders, which are among Brazil’s biggest lenders, only a few other small banks currently issue cards under its banner.","The company, with 132 million credit and debit cards outstanding, also needs to increase its acceptance abroad, mainly in Europe and in countries such as Mexico and Canada.","No final decision on a U.S. listing has yet been made, but if it proceeds, Elo would probably also list its Brazilian Depositary Receipts on Sao Paulo bourse B3 SA.","More domestic banks may still join the deal, two of the sources said, asking for anonymity to disclose private talks.","Card payments grew rapidly in Brazil during the coronavirus pandemic last year. The country’s card association estimates card transactions will jump by a fifth in 2021, after rising 8.2% last year.","Elo, which posted net income of 838 million reais ($149.8 million) last year, ended 2020 with 1.5 billion reais in cash.",($1 = 5.5941 reais)
7,https://www.reuters.com/article/us-airtel-africa-stake-mastercard/mastercard-to-invest-100-million-in-airtel-africas-mobile-money-unit-idUSKBN2BO4G4,2021-04-01T06:40:10Z,Mastercard to invest $100 million in Airtel Africa's mobile money unit,"(Reuters) - Mastercard Inc will invest $100 million in Airtel Africa’s mobile money operations valuing the business at $2.65 billion, the London-listed company said on Thursday.","Mastercard will hold a minority stake in Airtel Mobile Commerce, in line with Airtel Africa’s plan to monetise the mobile money business by selling up to a 25% stake in the unit, the company said."
8,https://www.reuters.com/article/airtel-africa-stake-mastercard/update-1-mastercard-to-invest-100-mln-in-airtel-africas-mobile-money-unit-idUSL4N2LU1TB,"April 1, 2021 6:46 AM UTC",UPDATE 1-Mastercard to invest $100 mln in Airtel Africa's mobile money unit,"Global payment processor Mastercard Inc (MA.N) will invest $100 million in Airtel Africa's (AAF.L) mobile money operations, valuing the business at $2.65 billion, the London-listed company said on Thursday.","Airtel Africa is targeting a public listing of Airtel Mobile Commerce BV (AMC BV) within the next four years. Earlier this month, private equity firm TPG's The Rise Fund invested $200 million in AMC BV.","Mastercard will hold a minority stake in AMC BV, in line with Airtel Africa's plan to monetise the mobile money business by selling up to a 25% stake in the unit, the company said.","The unit, operating under the Airtel Money brand in Africa, includes mobile wallets, merchant and commercial payments, virtual credit card and international money transfers available across 14 countries in the region.","Airtel Africa, which offers Airtel Money in Nigeria in partnership with a local bank, said it aims to have all mobile money operations to be owned and operated by AMC BV.",
9,https://www.reuters.com/article/us-britain-payments/mastercard-rivals-ran-cartel-on-cards-for-the-vulnerable-uk-watchdog-says-idUSKBN2BN0Q5,2021-03-31T10:40:49Z,"Mastercard, rivals 'ran cartel' on cards for the vulnerable, UK watchdog says","LONDON (Reuters) - Mastercard is among five companies which broke the law for cartel behaviour when offering pre-paid cards to vulnerable members of society, Britain’s Payment Systems Regulator said on Wednesday.","Mastercard, allpay, APS, PFS and Sulion agreed not to compete or poach each other’s customers on cards used by local authorities for welfare payments including to the homeless, victims of domestic violence and asylum seekers, the PSR said.","The investigation is ongoing and the companies can make representations on the provisional findings, the PSR said.","Mastercard, allpay and PFS have admitted liability, and if the regulator ultimately concludes there is wrongdoing have agreed to pay maximum fines totalling more than 32 million pounds ($44 million), the watchdog said.",The PSR alleges two infringements of Britain’s 1998 competition law.,"One breach took place over six years between 2012 and 2018 and involved all five firms, the PSR said.","The other lasted between 2014 and 2016 and involved APS and FPS, the watchdog said.","“Pre-paid card services, like these, can provide significant benefits to local authorities as one way to make welfare payments to some of the most vulnerable people in society,” said Chris Hemsley, managing director of the PSR.","“By colluding in this way, we consider the parties were acting as a cartel... Collusion in payments is absolutely unacceptable. Where we see it happening, we will take action, stop it, and seek to impose significant penalties.”","Mastercard said it took the issue very seriously and had put further controls and training in place, adding the incident was isolated to UK prepaid cards.","“We apologise that the actions of two former employees resulted in the standards expected of us not being met in this instance,” a Mastercard spokesman said.","Allpay said it accepted the PSR’s decision, adding it had immediately informed the regulator after it became aware of potential breaches and had cooperated fully with the investigation.","Australia’s EML, which bought PFS in 2019, said it had worked collaboratively with the regulator to resolve the issue and arrangements were already in place for PFS’s previous owners to cover the cost of its around 920,000 pound fine.",APS was not immediately available for comment. Sulion could not be reached.
10,https://www.reuters.com/article/us-facebook-brazil-payments/facebook-messaging-service-gets-delayed-brazil-nod-for-payments-idUSKBN2BM37H,2021-03-30T23:13:12Z,Facebook messaging service gets delayed Brazil nod for payments,"SAO PAULO (Reuters) - Brazil’s central bank on Tuesday cleared the way for Facebook’s WhatsApp messaging service to let its users send each other funds using the Visa Inc and Mastercard card networks, months after vetoing WhatsApp’s initial attempt.","When WhatsApp tried to launch the transfer service last June, the central bank said it could damage Brazil’s existing payments system in terms of competition, efficiency and data privacy, adding that the service had failed to obtain the needed licenses.",The regulatory friction was the latest setback for Facebook’s effort to use its social media platforms to compete with banks and fintechs in allowing fast electronic funds transfers.,"The regulatory approval comes months after the central bank launched its own instant payments system in November, called Pix, which has since been widely adopted.","After initially trying to avoid becoming a financial services company in Brazil and seeking to piggyback on Visa and Mastercard’s existing central bank licenses, WhatsApp surrendered to regulatory pressure, obtaining formal approval as a payments initiator using Visa and Mastercard as processors.","Both card networks also had to obtain new permits to operate with Facebook’s messaging app, which itself will be regulated by the central bank.","Still, WhatsApp is only allowed to do peer-to-peer payments, not involving merchants, unlike the free Pix service, which can be used to pay businesses and individuals. Facebook is still seeking approval to operate with merchants.","“(We) are making the final preparations to have payments on WhatsApp available in Brazil as soon as possible,” a WhatsApp spokesperson said in a statement. The messaging platform, which has over 120 million users in Brazil, did not say when it will start offering the service."
11,https://www.reuters.com/article/uk-britain-mastercard-lawsuit/mastercard-battles-to-limit-scope-of-19-billion-uk-class-action-idUSKBN2BH013,2021-03-26T17:26:26Z,Mastercard battles to limit scope of $19 billion UK class action,"LONDON (Reuters) -Mastercard, a global payment processor, is battling attempts to add about 14 million deceased people to a 14 billion pound-plus ($19.3 billion) British class action in an effort to limit the scope of the historic case.","A Mastercard lawyer told London’s Competition Appeal Tribunal (CAT) on Friday that an application seeking to add those who died between 1992 and 2008 into the country’s first mass consumer claim, that alleges the company overcharged people over a near 16-year period, was a “nullity”.","“A claim cannot be brought in the name of a deceased person,” Mark Hoskins, representing Mastercard, said at the hearing.","Former financial ombudsman Walter Merricks, who is leading the claim, alleges that Mastercard overcharged almost 60 million people in Britain - including about 14 million people who are deceased - over the period. The case could entitle adults and their estates to roughly 300 pounds each if successful.","Hoskins said attempts to add new members -- or their administrators, personal representatives, executors or next of kin -- to the “very serious claim” was also now time-barred.","The company is also resisting attempts to add compound interest to any award, which the court heard could push up the value of the claim by more than 2 billion pounds.","Lawyers for Merricks pushed for the deceased to be included, questioned why death might time-bar a valid case and urged the tribunal either to certify the lawsuit with compound interest or defer the question to the trial tribunal.","The drawn-out case was brought in 2016, one year after the CAT was nominated to oversee Britain’s U.S.-style “opt-out” class action regime for breaches of UK or EU competition law.","The CAT blocked the case in 2017 but is re-considering authorising it as a collective action and determining its scope -- and establishing a standard for a string of other, stalled class actions -- after the UK Supreme Court in December lowered the bar for allowing such actions to proceed.","Merricks, who is being advised by law firm Quinn Emanuel, alleges Mastercard charged excessive “interchange” fees – the fees retailers pay credit card companies when consumers use a card to shop - between May 1992 and June 2008 and that those fees were passed on to consumers as retailers raised prices.","Mastercard says it “fundamentally disagrees” with the claim, that people received valuable benefits from its payments technology and that the lawsuit is driven by U.S. lawyers and backed by organisations focused on making money for themselves.",A judgment will be made later.,($1 = 0.7264 pounds)
12,https://www.reuters.com/article/us-britain-mastercard-lawsuit/mastercard-resists-compound-interest-on-19-billion-uk-class-action-idUSKBN2BH007,2021-03-26T15:16:16Z,Mastercard resists compound interest on $19 billion UK class action,LONDON (Reuters) - Mastercard Inc on Thursday pushed back against attempts to add compound interest to a 14 billion-pound ($19.2 billion) British consumer class action during a specialist court hearing to certify and agree the scope of the historic case.,"On the first day of a two-day hearing at the Competition Appeal Tribunal (CAT), a Mastercard lawyer said that common law did not assume that interest would accrue on a compound basis on such claims.","“The law is not the same as economic theory,” he said.","“In most cases, simple interest is going to be perfectly adequate as a means of compensation.”","Former financial ombudsman Walter Merricks, who is leading the claim, alleges that Mastercard overcharged almost 60 million people in Britain - including about 14 million people now deceased - over nearly 16 years. The case could entitle adults and their estates to roughly 300 pounds each if successful.","Mastercard will on Friday lay out its arguments about why claims from the deceased should be excluded, after which the CAT has to decide whether to certify Britain’s first mass consumer claim as a collective action - and clarify the rules for a string of other class actions stalled in its wake.",The UK Supreme Court paved the way for the case to proceed after overruling objections in December.,"Merricks, who is being advised by law firm Quinn Emanuel, alleges Mastercard charged excessive “interchange” fees – the fees retailers pay credit card companies when consumers use a card to shop - between May 1992 and June 2008 and that those fees were passed on to consumers as retailers raised prices.","Mastercard says it “fundamentally disagrees” with the claim, that people received valuable benefits from its payments technology and that the lawsuit is driven by U.S. lawyers and backed by organisations focused on making money for themselves.","The case was filed in 2016, one year after the CAT was nominated to oversee Britain’s U.S.-style “opt-out” class action regime for breaches of UK or EU competition law - and 12 years after the European Commission ruled that Mastercard had charged unlawful cross-border interchange fees over the period.",($1 = 0.7288 pound)
13,https://www.reuters.com/article/britain-mastercard-lawsuit/mastercard-battles-return-of-19-bln-uk-class-action-idUSL8N2KG4IY,"March 25, 2021 5:35 PM UTC",Mastercard battles return of $19 bln UK class action,Mastercard Inc (MA.N) on Thursday pushed back against attempts to add compound interest to a 14 billion-pound ($19.2 billion) British consumer class action during a specialist court hearing to certify and agree the scope of the historic case.,"On the first day of a two-day hearing at the Competition Appeal Tribunal (CAT), a Mastercard lawyer said that common law did not assume that interest would accrue on a compound basis on such claims.","""The law is not the same as economic theory,"" he said.","""In most cases, simple interest is going to be perfectly adequate as a means of compensation.""","Former financial ombudsman Walter Merricks, who is leading the claim, alleges that Mastercard overcharged almost 60 million people in Britain - including about 14 million people now deceased - over nearly 16 years. The case could entitle adults and their estates to roughly 300 pounds each if successful.","Mastercard will on Friday lay out its arguments about why claims from the deceased should be excluded, after which the CAT has to decide whether to certify Britain's first mass consumer claim as a collective action - and clarify the rules for a string of other class actions stalled in its wake.",The UK Supreme Court paved the way for the case to proceed after overruling objections in December. read more,"Merricks, who is being advised by law firm Quinn Emanuel, alleges Mastercard charged excessive ""interchange"" fees – the fees retailers pay credit card companies when consumers use a card to shop - between May 1992 and June 2008 and that those fees were passed on to consumers as retailers raised prices.","Mastercard says it ""fundamentally disagrees"" with the claim, that people received valuable benefits from its payments technology and that the lawsuit is driven by U.S. lawyers and backed by organisations focused on making money for themselves.","The case was filed in 2016, one year after the CAT was nominated to oversee Britain's U.S.-style ""opt-out"" class action regime for breaches of UK or EU competition law - and 12 years after the European Commission ruled that Mastercard had charged unlawful cross-border interchange fees over the period.",($1 = 0.7288 pound),
