1,https://www.reuters.com/article/us-plantronics-sec/plantronics-to-pay-36-million-to-settle-sec-investigation-into-polycom-idUSKCN1OP1DN,2018-12-26T23:10:10Z,Plantronics to pay $36 million to settle SEC investigation into Polycom,"(Reuters) - Headsets maker Plantronics Inc said on Wednesday it has entered an agreement with the U.S. Securities and Exchange Commission to settle an investigation into Polycom Inc, which it acquired in July.","Plantronics will pay $36 million to settle the investigation, which began after Polycom reported it discovered evidence of “possible improper behavior” by former employees at its China unit.","Plantronics, which bought Polycom in a $2 billion deal in July, said the incident happened prior to the video conferencing equipment maker going private in 2016.",The company in August said the SEC and the U.S. Department of Justice (DOJ) were investigating into possible violations of the Foreign Corrupt Practices Act by Polycom.,"Polycom has neither admitted nor denied the SEC’s allegations, Plantronics said in a statement.",The company said the DOJ cited Polycom’s voluntary disclosure and full cooperation to close its investigation.
2,https://www.reuters.com/article/us-plantronics-m-a-logitech/logitech-ends-negotiations-to-acquire-plantronics-idUSKCN1NV03H,2018-11-26T02:27:24Z,Logitech ends negotiations to acquire Plantronics,"(Reuters) - Logitech International SA LOGN.S, a Swiss manufacturer of keyboards and webcams, has ended discussions to acquire Plantronics Inc PLT.N, a U.S. maker of Bluetooth earpieces and gaming headsets, the companies said on Sunday.","The announcement came after Reuters reported on the negotiations between Logitech and Plantronics last Friday. The companies confirmed the talks on Sunday, but said they had now been terminated.","Plantronics added in its statement that Logitech approached it regarding a potential acquisition, and that it engaged in discussions in line with its fiduciary duties. It said it would deliver on its strategy as a stand-alone company.","“I have been and remain tremendously optimistic about the opportunity in front of us, and with our focused strategy and leadership team, I am confident that Plantronics will create significant long term value for shareholders,” Plantronics Chief Executive Joe Burton said in the statement.","Logitech and Plantronics were hoping to successfully conclude negotiations this week, but Logitech’s board decided on Sunday to walk away from the potential deal, according to people familiar with the matter who requested anonymity to discuss the confidential discussions.","Logitech’s board ended negotiations over price disagreements, according to a source close to the company. That was despite Plantronics having opened its books to Logitech on the basis of an offer by Logitech that was well in excess of $3 billion, three of the sources added.",Plantronics had a market capitalization of about $2 billion as of the end of trading on Friday.,"The deal would have been by far Logitech’s largest acquisition, amid a push to diversify its business beyond computer peripherals. It would have come as Logitech and Plantronics seek to keep down manufacturing costs following the introduction of tariffs on imports from China into the United States.","Logitech's and Plantronics' businesses have been under pressure as a result of new offerings being developed, not just from network gear makers such as Cisco Systems Inc CSCO.O, but",from major technology companies such as Microsoft Inc MSFT.O and Google owner Alphabet Inc GOOGL.O.,"Founded in 1981, Logitech has been countering declining sales of personal computers by focusing on consumer accessories that are benefiting from the growth of cloud computing, such as gaming, music, smart home connectivity and video conferencing. The Lausanne-based company has a market capitalization of $5.6 billion.","Last year, Logitech acquired ASTRO Gaming for $85 million in cash to expand in the video game sector.","Santa Cruz, California-based Plantronics makes unified communications systems, wireless headsets, conferencing systems, and some software, which it sells to businesses and consumers.","Founded in 1961, Plantronics’ first products were lightweight headsets for airline pilots. It later became known for selling headsets to the National Aeronautics and Space Administration, including the ones worn by Neil Armstrong during his first moonwalk in 1969.",A sale of Plantronics would have come on the heels of the company’s $2 billion acquisition in July of U.S. video-conferencing equipment maker Polycom Inc.
3,https://www.reuters.com/article/brief-plantronics-confirms-no-ongoing-di/brief-plantronics-confirms-no-ongoing-discussions-with-logitech-idUSFWN1Y000N,2018-11-26T00:33:42Z,BRIEF-Plantronics Confirms No Ongoing Discussions With Logitech,Nov 25 (Reuters) - Plantronics Inc:,* PLANTRONICS CONFIRMS NO ONGOING DISCUSSIONS WITH LOGITECH Source text for Eikon: Further company coverage:
4,https://www.reuters.com/article/plantronics-ma-logitech/logitech-ends-negotiations-to-acquire-plantronics-idUSL8N1Y0192,2018-11-25T22:58:25Z,Logitech ends negotiations to acquire Plantronics,"Nov 25 (Reuters) - Logitech International SA, a Swiss manufacturer of keyboards and webcams, said on Sunday it had ended discussions to acquire Plantronics Inc, a U.S. maker of Bluetooth earpieces and gaming headsets.","The announcement came after Reuters reported on the negotiations between Logitech and Plantronics last Friday. Logitech confirmed the talks on Sunday, but said they had now been terminated. Plantronics offered no immediate comment.","Logitech and Plantronics were hoping to successfully conclude negotiations this week, but Logitech’s board decided on Sunday to walk away from the potential deal, according to people familiar with the matter who requested anonymity to discuss the confidential discussions.","Logitech terminated negotiations over price disagreements, according to one of the sources. Plantronics was looking to sell itself for well over $3 billion, two of the sources said. Plantronics had a market capitalization of about $2 billion as of the end of trading on Friday.","The deal would have been by far Logitech’s largest acquisition, amid a push to diversify its business beyond computer peripherals. It would have come as Logitech and Plantronics seek to keep down manufacturing costs following the introduction of tariffs on imports from China into the United States.","Logitech’s and Plantronics’ businesses have been under pressure as a result of new offerings being developed, not just from network gear makers such as Cisco Systems Inc, but from major technology companies such as Microsoft Inc and Google owner Alphabet Inc.","Founded in 1981, Logitech has been countering declining sales of personal computers by focusing on consumer accessories that are benefiting from the growth of cloud computing, such as gaming, music, smart home connectivity and video conferencing. The Lausanne-based company has a market capitalization of $5.6 billion.","Last year, Logitech acquired ASTRO Gaming for $85 million in cash to expand in the video game sector.","Santa Cruz, California-based Plantronics makes unified communications systems, wireless headsets, conferencing systems, and some software, which it sells to businesses and consumers.","Founded in 1961, Plantronics’ first products were lightweight headsets for airline pilots. It later became known for selling headsets to the National Aeronautics and Space Administration, including the ones worn by Neil Armstrong during his first moonwalk in 1969.",A sale of Plantronics would have come on the heels of the company’s $2 billion acquisition in July of U.S. video-conferencing equipment maker Polycom Inc. (Reporting by Liana B. Baker and Greg Roumeliotis in New York; Editing by Peter Cooney)
5,https://www.reuters.com/article/brief-logitech-not-in-acquisition-discus/brief-logitech-not-in-acquisition-discussions-with-plantronics-idUSASP000316,2018-11-25T22:22:21Z,BRIEF-Logitech Not In Acquisition Discussions With Plantronics,Nov 25 (Reuters) - Logitech International SA:,* LOGITECH INTERNATIONAL- CONFIRMED WAS ENGAGED IN DISCUSSIONS WITH PLANTRONICS REGARDING A POTENTIAL TRANSACTION ;HOWEVER THOSE DISCUSSIONS TERMINATED Source text for Eikon: Further company coverage:
6,https://www.reuters.com/article/us-plantronics-m-a-logitech-intl-exclusi/exclusive-logitech-in-talks-to-acquire-headphone-maker-plantronics-sources-idUSKCN1NS2BF,2018-11-23T23:20:50Z,Exclusive: Logitech in talks to acquire headphone maker Plantronics - sources,"(Reuters) - Logitech International SA, a Swiss manufacturer of keyboards and webcams, is in discussions to acquire Plantronics Inc, a U.S. maker of Bluetooth earpieces and gaming headsets, people familiar with the matter said on Friday.",The deal would be by far Logitech’s largest acquisition and would illustrate the company’s push to diversify its business. It would come as Logitech and Plantronics seek to keep down manufacturing costs following the introduction of tariffs on imports from China into the United States.,"Logitech has offered more than $2.2 billion to acquire Plantronics, one of the sources said. As of the end of trading on Friday, Plantronics had a market capitalization of about $2 billion.","If the negotiations prove successful, a deal between Logitech and Plantronics could come as early as next week, the sources said, cautioning that it was also possible that no agreement would be reached.","The sources asked not to be identified because the negotiations are confidential. Plantronics declined to comment, while Logitech did not respond to a request for comment.",Plantronics shares jumped 5.6 percent to $56.50 on the news in after hours trading in New York on Friday.,"Logitech’s and Plantonics’ businesses have been under pressure as a result of new offerings being developed, not just from network gear makers such as Cisco Systems Inc, but also from major technology companies such as Microsoft Inc and Google owner Alphabet Inc.","Founded in 1981, Logitech has been countering declining sales of personal computers by focusing on consumer accessories that are benefiting from the growth of cloud computing, such as gaming, music, smart home connectivity and video conferencing. The Lausanne-based company has a market capitalization of $5.6 billion.","Last year, Logitech acquired ASTRO Gaming for $85 million in cash to expand in the video game sector.","Santa Cruz, California-based Plantronics makes unified communications systems, wireless headsets, conferencing systems, and some software, which it sells to businesses and consumers.","Founded in 1961, Plantronics’ first products were lightweight headsets for airline pilots. It later became known for selling headsets to the National Aeronautics and Space Administration (NASA), including the ones worn by Neil Armstrong during his first moonwalk in 1969.",A sale of Plantronics would come on the heels of the company’s $2 billion acquisition in July of U.S. video-conferencing equipment maker Polycom Inc.,"Private equity firm Siris Capital Group LLC owns 16 percent of Plantronics, making it its largest shareholder. Reuters had reported earlier this month that Plantronics was exploring a sale."
7,https://www.reuters.com/article/us-plantronics-m-a-exclusive/exclusive-headset-maker-plantronics-explores-potential-sale-sources-idUSKCN1ND2Z5,2018-11-08T20:36:44Z,Exclusive: Headset-maker Plantronics explores potential sale - sources,"(Reuters) - Plantronics Inc PLT.N, a U.S. manufacturer of Bluetooth earpieces and gaming headsets, is exploring options that include a potential sale of the company after attracting takeover interest, people familiar with the matter said on Thursday.","A sale of Plantronics would come on the heels of the company’s $2 billion acquisition in July of U.S. video-conferencing equipment maker Polycom Inc. It would underscore the scope for consolidation in the sector, as telephony equipment becomes more commoditized and competition increases.","There is no certainty that Plantronics’ sale discussions will result in any deal, said the sources, who asked not to be identified because the deliberations are confidential.",Plantronics declined to comment.,"Plantronics shares were trading down 11 percent on Thursday before news broke of the company’s efforts to sell itself, as investors digested the company’s second-quarter earnings this week that missed analyst expectations.","The shares reversed course following the Reuters report and were trading up 6.3 percent at $62.89 in afternoon trading in New York on Thursday, giving the company a market capitalization of $2.5 billion.","Santa Cruz, California-based Plantronics makes unified communications systems, wireless headsets, conferencing systems, and some software, which it sells to businesses and consumers. It faces competition from new rivals entering the market for headsets, including Cisco Systems Inc CSCO.O.","Founded in 1961, Plantronics’ first products were lightweight headsets for airline pilots. It later became known for selling headsets to the National Aeronautics and Space Administration (NASA), including the ones worn by Neil Armstrong during his first moonwalk in 1969.","Private equity firm Siris Capital Group LLC owns 16 percent of Plantronics, making it its largest shareholder.",Plantronics acquired Polycom this year to expand its offerings of business communications equipment and add video communications capabilities to its product mix. The deal roughly doubled Plantronics’ revenues to around $483 million in the second quarter.
8,https://www.reuters.com/article/brief-plantronics-sees-q1-non-gaap-dilut/brief-plantronics-sees-q1-non-gaap-diluted-eps-of-0-66-to-0-78-idUSL8N1S85WN,2018-05-01T22:00:57Z,BRIEF-Plantronics Sees Q1 Non-GAAP Diluted EPS Of $0.66 To $0.78,May 1 (Reuters) - Plantronics Inc:,* PLANTRONICS ANNOUNCES FOURTH QUARTER AND FISCAL YEAR 2018 FINANCIAL RESULTS,* Q4 REVENUE $216.1 MILLION VERSUS I/B/E/S VIEW $208.8 MILLION,* SEES Q1 NON-GAAP DILUTED EPS OF $0.66 TO $0.78 Source text for Eikon: Further company coverage:
9,https://www.reuters.com/article/brief-plantronics-q4-gaap-earnings-per-s/brief-plantronics-q4-gaap-earnings-per-share-0-29-idUSASC09YQN,2018-05-01T21:04:24Z,BRIEF-Plantronics Q4 GAAP Earnings Per Share $0.29,Plantronics Inc:,* PLANTRONICS ANNOUNCES FOURTH QUARTER AND FISCAL YEAR 2018 FINANCIAL RESULTS,* Q4 REVENUE $216.1 MILLION VERSUS I/B/E/S VIEW $208.8 MILLION,* SEES Q1 NON-GAAP DILUTED EPS OF $0.66 TO $0.78 Source text for Eikon: Further company coverage:
