25,https://www.reuters.com/article/brief-drreddys-labs-announces-launch-of/brief-dr-reddys-labs-announces-launch-of-desmopressin-acetate-injection-in-u-s-market-idUSFWN2CN12T,2020-05-06T07:03:47Z,BRIEF-Dr.Reddy's Labs Announces Launch Of Desmopressin Acetate Injection In U.S. Market,May 6 (Reuters) - Dr.Reddy’s Laboratories Ltd:,"* ANNOUNCES LAUNCH OF DESMOPRESSIN ACETATE INJECTION USP, 4 MCG/ML IN U.S. MARKET Source text for Eikon: Further company coverage:"
26,https://www.reuters.com/article/brief-fda-approves-dr-reddys-laboratorie/brief-fda-approves-dr-reddys-laboratories-elyxyb-oral-solution-for-acute-treatment-of-migraine-with-or-without-aura-in-adults-idUSFWN2CN10I,2020-05-05T19:55:27Z,BRIEF-FDA Approves Dr. Reddy's Laboratories' Elyxyb Oral Solution For Acute Treatment Of Migraine With Or Without Aura In Adults,May 5 (Reuters) - FDA:,* FDA GRANTS APPROVAL FOR ELYXYB ORAL SOLUTION INDICATED FOR ACUTE TREATMENT OF MIGRAINE WITH OR WITHOUT AURA IN ADULTS TO DR. REDDY’S LABORATORIES,* FDA APPROVES DR. REDDY’S LABORATORIES' ELYXYB ORAL SOLUTION WITH A BOXED WARNING FOR RISK OF SERIOUS CARDIOVASCULAR & GASTROINTESTINAL EVENTS - LABEL Source text: (bit.ly/3cacrmL) Further company coverage:
27,https://www.reuters.com/article/brief-drreddys-re-schedules-board-meetin/brief-dr-reddys-re-schedules-board-meeting-to-consider-results-for-fy-ended-march-31-idUSFWN2CH075,2020-04-29T08:03:03Z,BRIEF-Dr.Reddy's Re-Schedules Board Meeting To Consider Results For FY Ended March 31,April 29 (Reuters) - Dr.Reddy’s Laboratories Ltd:,"* IN VIEW OF COVID-19 SITUATION, BOARD MEETING TO CONSIDER RESULTS FOR FY ENDED MARCH 31 NOW RE-SCHEDULED TO MAY 20 Source text for Eikon: Further company coverage:"
28,https://www.reuters.com/article/brief-drreddys-laboratories-announces-la/brief-dr-reddys-laboratories-announces-launch-of-fenofibrate-tablets-usp-in-u-s-market-idUSFWN2CE01N,2020-04-27T06:13:22Z,BRIEF-Dr.Reddy's Laboratories Announces Launch Of Fenofibrate Tablets USP In U.S. Market,April 27 (Reuters) - Dr.Reddy’s Laboratories Ltd:,"* DR.REDDY’S LABORATORIES LTD -ANNOUNCES LAUNCH OF FENOFIBRATE TABLETS USP, IN U.S. MARKET Source text for Eikon: Further company coverage:"
29,https://www.reuters.com/article/brief-drreddys-laboratories-got-eir-from/brief-dr-reddys-laboratories-got-eir-from-u-s-fda-for-audit-of-api-manufacturing-plant-5-in-telangana-idUSFWN2BX09R,2020-04-09T10:33:01Z,BRIEF-Dr.Reddy's Laboratories - Got EIR From U.S. FDA For Audit Of API Manufacturing Plant 5 In Telangana,April 9 (Reuters) - Dr.Reddy’s Laboratories Ltd:,* DR.REDDY’S LABORATORIES - GOT ESTABLISHMENT INSPECTION REPORT FROM U.S. FDA FOR AUDIT OF API MANUFACTURING PLANT 5 IN TELANGANA Source text for Eikon: Further company coverage:
30,https://www.reuters.com/article/brief-drreddys-to-sell-contract-developm/brief-dr-reddys-to-sell-contract-development-manufacturing-organisation-division-for-72-mln-idUSFWN2BJ1SG,2020-03-27T07:10:43Z,BRIEF-Dr.Reddy's To Sell Contract Development & Manufacturing Organisation Division For $72 Mln,March 27 (Reuters) - Dr.Reddy’s Laboratories Ltd:,* APPROVED SALE OF CONTRACT DEVELOPMENT & MANUFACTURING ORGANISATION DIVISION OF CUSTOM PHARMACEUTICAL SERVICES BUSINESS,* APPROVED BORROWINGS BY CO UP TO AGGREGATE AMOUNT OF 20 BILLION RUPEES,"* SELLING DIVISION TO CO'S STEP-DOWN SUBSIDIARY, AURIGENE PHARMACEUTICAL SERVICES Source text: (bit.ly/39k5duk) Further company coverage:"
31,https://www.reuters.com/article/brief-drreddys-laboratories-to-consider/brief-dr-reddys-laboratories-to-consider-raising-of-funds-by-issuance-of-commercial-paper-idUSFWN2BG1CG,2020-03-23T14:23:45Z,BRIEF-Dr.Reddy's Laboratories To Consider Raising Of Funds By Issuance Of Commercial Paper,March 23 (Reuters) - Dr.Reddy’s Laboratories Ltd:,* TO CONSIDER RAISING OF FUNDS BY ISSUANCE OF COMMERCIAL PAPER Source text for Eikon: Further company coverage:
32,https://www.reuters.com/article/brief-drreddys-labs-launches-naloxone-hy/brief-dr-reddys-labs-launches-naloxone-hydrochloride-injection-in-u-s-idUSFWN2BC05Z,2020-03-19T05:49:29Z,BRIEF-Dr.Reddy's Labs Launches Naloxone Hydrochloride Injection In U.S.,March 19 (Reuters) - Dr.Reddy’s Laboratories Ltd:,* LAUNCHES FIRST-TO-MARKET NALOXONE HYDROCHLORIDE INJECTION IN U.S. MARKET Source text for Eikon: Further company coverage:
33,https://www.reuters.com/article/brief-drreddys-laboratories-launches-zip/brief-dr-reddys-laboratories-launches-ziprasidone-mesylate-for-injection-in-u-s-market-idUSFWN2BA0BL,2020-03-17T09:01:58Z,BRIEF-Dr.Reddy's Laboratories Launches Ziprasidone Mesylate For Injection In U.S. Market,March 17 (Reuters) - Dr.Reddy’s Laboratories Ltd:,* DR.REDDY’S LABORATORIES LTD SAYS LAUNCH OF ZIPRASIDONE MESYLATE FOR INJECTION IN THE U.S. MARKET Source text for Eikon: Further company coverage:
34,https://www.reuters.com/article/brief-fda-completes-audit-of-indias-drre/brief-fda-completes-audit-of-indias-dr-reddys-api-manufacturing-plant-5-in-telangana-idUSFWN2AY0O3,2020-03-05T14:08:27Z,BRIEF-FDA Completes Audit Of India's Dr.Reddy's API Manufacturing Plant 5 In Telangana,March 5 (Reuters) - Dr.Reddy’s Laboratories Ltd:,* AUDIT OF API MANUFACTURING PLANT 5 IN TELANGANA BY U.S. FDA HAS BEEN COMPLETED,* FDA ISSUED FORM 483 WITH 3 OBSERVATIONS Source text for Eikon: Further company coverage:
35,https://www.reuters.com/article/brief-nuvo-pharma-says-dr-reddys-launche/brief-nuvo-pharma-says-dr-reddys-launched-generic-version-of-vimovo-in-u-s-idUSFWN2AX0N4,2020-03-04T22:44:00Z,BRIEF-Nuvo Pharma Says Dr. Reddy's Launched Generic Version Of Vimovo In U.S.,March 4 (Reuters) - Nuvo Pharmaceuticals Inc:,* NUVO PHARMACEUTICALS INC - ANNOUNCED DR. REDDY’S LABORATORIES INC HAS LAUNCHED ITS GENERIC VERSION OF VIMOVO IN UNITED STATES Source text for Eikon: Further company coverage:
36,https://www.reuters.com/article/brief-fda-issues-revised-form-483-with-1/brief-fda-issues-revised-form-483-with-1-observation-for-dr-reddys-hyderabad-plant-idUSFWN2AS0U0,2020-02-28T14:33:29Z,BRIEF-FDA Issues Revised Form 483 With 1 Observation For Dr Reddy's Hyderabad Plant,Feb 28 (Reuters) - Dr.Reddy’s Laboratories Ltd:,"* U.S. FDA ISSUED REVISED FORM 483 WITH 1 OBSERVATION ONLY FOR MANUFACTURING PLANT AT BACHUPALLY, HYDERABAD Further company coverage:"
37,https://www.reuters.com/article/brief-fda-completes-audit-of-indias-drre/brief-fda-completes-audit-of-indias-dr-reddys-formulations-manufacturing-plant-3-in-hyderabad-idUSFWN2AS0FH,2020-02-28T09:19:56Z,BRIEF-FDA Completes Audit Of India's Dr.Reddy's Formulations Manufacturing Plant 3 In Hyderabad,Feb 28 (Reuters) - Dr.Reddy’s Laboratories Ltd:,"* AUDIT OF FORMULATIONS MANUFACTURING PLANT 3 AT BACHUPALLY, HYDERABAD BY U.S. FDA COMPLETED",* SAYS FDA ISSUED A FORM 483 WITH 2 (TWO) OBSERVATIONS Source text for Eikon: Further company coverage:
38,https://www.reuters.com/article/brief-indias-drreddys-says-fda-audit-at/brief-indias-dr-reddys-says-fda-audit-at-medchal-malkajgiri-telangana-completed-idUSFWN2AR0B9,2020-02-27T07:07:07Z,"BRIEF-India's Dr.Reddy's Says FDA Audit At Medchal-Malkajgiri, Telangana Completed",Feb 27 (Reuters) - Dr.Reddy’s Laboratories Ltd:,"* AUDIT OF INTEGRATED PRODUCT DEVELOPMENT ORGANIZATION AT MEDCHAL-MALKAJGIRI, TELANGANA, BY U.S. FDA, HAS BEEN COMPLETED","* NO FORM 483 ISSUED AT CLOSURE OF AUDIT AT MEDCHAL-MALKAJGIRI, TELANGANA Source text: (bit.ly/2PsP4vq) Further company coverage:"
39,https://www.reuters.com/article/brief-drreddys-laboratories-gets-eir-fro/brief-dr-reddys-laboratories-gets-eir-from-usfda-for-duvvada-formulations-manufacturing-plant-idUSFWN2AK0J4,2020-02-20T14:10:57Z,BRIEF-Dr.Reddy's Laboratories Gets EIR From USFDA For Duvvada Formulations Manufacturing Plant,Feb 20 (Reuters) - Dr.Reddy’s Laboratories Ltd:,* GETS ESTABLISHMENT INSPECTION REPORT FROM USFDA FOR DUVVADA FORMULATIONS MANUFACTURING PLANT,* FACILITY HAS BEEN CLASSIFIED AS VOLUNTARY ACTION INDICATED Source text: bit.ly/329Vrc0 Further company coverage:
40,https://www.reuters.com/article/brief-wockhardt-seeks-members-nod-for-sa/brief-wockhardt-seeks-members-nod-for-sale-of-unit-to-dr-reddys-laboratories-idUSFWN2AE0L7,2020-02-14T11:04:58Z,BRIEF-Wockhardt Seeks Members' Nod For Sale Of Unit To Dr. Reddy's Laboratories,Feb 14 (Reuters) - Wockhardt Ltd:,* SEEKS MEMBERS’ NOD FOR SALE OF UNIT TO DR. REDDY’S LABORATORIES Source text for Eikon: Further company coverage:
41,https://www.reuters.com/article/brief-drreddys-laboratories-says-unit-en/brief-dr-reddys-laboratories-says-unit-enters-amendment-of-license-agreement-with-aurigene-discovery-technologies-idUSFWN2A70IS,2020-02-07T12:03:56Z,BRIEF-Dr.Reddy's Laboratories Says Unit Enters Amendment Of License Agreement With Aurigene Discovery Technologies,Feb 7 (Reuters) - Dr.Reddy’s Laboratories Ltd:,"* DR.REDDY’S LABORATORIES LTD - UNIT ENTERS AMENDMENT OF ITS COLLABORATION, LICENSE AND OPTION AGREEMENT WITH AURIGENE DISCOVERY TECHNOLOGIES Source text for Eikon: Further company coverage:"
42,https://www.reuters.com/article/brief-drreddys-laboratories-says-launch/brief-dr-reddys-laboratories-says-launch-of-trientine-hydrochloride-capsules-usp-250-mg-in-u-s-market-idUSFWN2A61EU,2020-02-07T06:29:34Z,"BRIEF-Dr.Reddy's Laboratories Says Launch Of Trientine Hydrochloride Capsules USP, 250 Mg, In U.S. Market",Feb 7 (Reuters) - Dr.Reddy’s Laboratories Ltd:,"* DR.REDDY’S LABORATORIES LTD SAYS LAUNCH OF TRIENTINE HYDROCHLORIDE CAPSULES USP, 250 MG, IN U.S. MARKET Source text for Eikon: Further company coverage:"
43,https://www.reuters.com/article/drreddys-results/update-1-indian-drugmaker-dr-reddys-q3-profit-surges-on-strong-growth-in-emerging-markets-idUSL3N1ZW3I9,2019-02-01T09:56:09Z,UPDATE 1-Indian drugmaker Dr. Reddy's Q3 profit surges on strong growth in emerging markets,"(Adds CEO quote, details, share movement)","Feb 1 (Reuters) - Indian generic drugmaker Dr. Reddy’s Laboratories Ltd posted a 65.3 percent surge in quarterly profit on Friday, handily beating market expectations, helped by strong growth in emerging markets.","Third-quarter net profit came in at 5 billion rupees ($70.10 million), compared with 3.03 billion rupees a year earlier, the company said bit.ly/2Rvk10b.","Analysts on average expected the Hyderabad-based company to post a profit of 3.94 billion rupees, according to Refinitiv data.","“We continued to improve our performance in the third quarter, supported by significant growth in emerging markets and India,” Chief Executive Officer GV Prasad said.","Revenue from emerging markets rose 31 percent to 7.7 billion rupees, aided by new product launches, a pick-up in momentum in new markets and better volume offtake in existing markets, the company said.",Dr.Reddy’s shares were trading 2.8 percent higher in a broader Mumbai market that was up 0.62 percent at 0940 GMT ($1 = 71.3300 Indian rupees)
44,https://www.reuters.com/article/drreddys-results/indian-drugmaker-dr-reddys-q3-profit-rises-65-3-pct-beats-estimates-idUSL3N1ZS48B,2019-02-01T09:35:49Z,"Indian drugmaker Dr. Reddy's Q3 profit rises 65.3 pct, beats estimates","Feb 1 (Reuters) - Indian generic drugmaker Dr. Reddy’s Laboratories Ltd posted a 65.3 percent surge in quarterly profit on Friday, driven by strong growth in emerging markets.","Third-quarter net profit came in at 5 billion rupees ($70.10 million), compared with 3.03 billion rupees a year earlier, the company said bit.ly/2Rvk10b.","Analysts on average expected the Hyderabad-based company to post a profit of 3.94 billion rupees, according to Refinitiv data. ($1 = 71.3300 Indian rupees)"
45,https://www.reuters.com/article/indivior-results/update-2-cost-cuts-help-drugmaker-indivior-as-it-battles-cheap-rival-idUSL3N1XC4BS,2018-11-01T14:42:50Z,UPDATE 2-Cost cuts help drugmaker Indivior as it battles cheap rival,* Hit from Dr.Reddy’s copycat to be lower than forecast,* Indivior says on track to meet FY targets,* Sublocade’s prescription journey falls to 16-22 days,"* Shares give back early gains to trade lower (Adds details on the company’s drugs, background, comments)","Nov 1 (Reuters) - Embattled drugmaker Indivior said on Thursday the hit to revenue this year from a cheap copy of its top-selling opium addiction drug would be less than feared, as cost cutting helped it to deliver a 22 percent rise in quarterly profit.","However, shares in the UK-listed company gave back early gains as it stuck to recently lowered full-year financial goals.","Indivior has been battling the introduction of a cheaper generic version of its film-based opioid addiction treatment Suboxone, and has also faced distribution challenges with its new injectable opioid addiction drug, Sublocade.","The company, spun-off from consumer products group Reckitt Benckiser in 2014, said the revenue hit this year from the generic Suboxone launched by India’s Dr.Reddy’s Laboratories Ltd was now expected to be $12-18 million.",That is less than its previous warning the impact “could be materially higher” than $25 million.,"Indivior also said anecdotal feedback from patients and healthcare providers on Sublocade was very encouraging, and reiterated its confidence in reaching its peak net revenue target of more than $1 billion from the drug.",The company also managed to reduce Sublocade’s prescription journey - the time from prescription to injection - to 16-22 days as at Sept. 30 from 27-37 days at June 30.,It had previously warned the prescription journey was being held back by more than 30 paper-driven steps before doctors can manually administer the injection.,"Third-quarter adjusted net income rose to $58 million, ahead of analysts’ average forecast of $49 million, according to Jefferies. Revenue came in at $245 million, down 11 percent from a year earlier, but ahead of the average forecast by 3 percent.","After rising sharply in early trading, shares in the U.S.-headquartered company were down 3.9 percent to 180.95 pence at 1405 GMT. The stock has more than halved in value this year.","One stock exchange market maker said that while there had been no outright bad news in the results, the bearish mood around the company had not yet abated."
46,https://www.reuters.com/article/drreddys-results/update-1-indian-drugmaker-dr-reddys-q2-profit-soars-past-market-estimates-idUSL3N1X63TM,2018-10-26T10:17:48Z,UPDATE 1-Indian drugmaker Dr. Reddy's Q2 profit soars past market estimates,"(Adds details, background)","Oct 26 (Reuters) - Dr.Reddy’s Laboratories posted a better-than-expected rise in second-quarter profit as higher sales in some emerging countries offset a marginal decline in business in North America, a key market for the Indian generic drugmaker.","Dr.Reddy’s net profit soared 69.7 percent to 5.18 billion rupees in the quarter ended Sept. 30, well ahead of analysts’ expectations of 3.52 billion rupees, according to Refinitiv data.","Revenue in the global generics segment from emerging markets surged 36 percent to 7.49 billion rupees ($102.16 million), while domestic sales grew eight percent.","Net sales were 36.87 billion rupees, up from 34.91 billion rupees last year, the company said here on Friday.","Revenue from North America fell marginally due to the absence of sales of a generic version of an opioid addiction drug, offset by a sharply weaker rupee.","British drugmaker Indivior Plc has been fighting the introduction of a cheaper copycat of its film-based blockbuster opioid addiction drug Suboxone by Reddy’s Labs, while also hoping to head off competition from Teva Pharmaceuticals.","The company’s shares ended marginally higher in a broader Mumbai market, which dropped 0.9 percent."
47,https://www.reuters.com/article/us-dr-reddys-results/indias-dr-reddys-profit-soars-on-anti-opioid-drug-sales-in-u-s-idUSKBN1KG1LV,2018-07-26T12:17:27Z,India's Dr.Reddy's profit soars on anti-opioid drug sales in U.S.,"(Reuters) - Indian generic drugmaker Dr.Reddy's Laboratories Ltd REDY.NS posted an over seven-fold rise in first-quarter net profit on Thursday, handily beating market expectations, aided by the U.S. launch of a generic version of an opioid addiction drug.","Net profit came in at 4.76 billion rupees ($69.31 million) in the quarter ended June 30, compared with 666 million rupees a year earlier, the company said.","Analysts on average had expected a net profit of 2.98 billion rupees, according to Thomson Reuters I/B/E/S.","Revenue from the company’s generics business in North America, its biggest market, jumped 6 percent to 15.90 billion rupees, driven by the U.S. launch of gSuboxone.","Dr.Reddy's got approval to sell versions of Indivior Plc's INDV.L best-selling opioid addiction treatment last month, materially hurting the British drugmaker's revenue and forcing it to scrap its full-year forecast amid market share loss.",The company also said revenues in the United States were partly offset by competitive pressure on key molecules as it continues to experience price erosion in the U.S. generics market.,Revenue from its India generics business jumped 30 percent to 6.07 billion rupees. But revenue from its Europe generics business dropped 3 percent to 2.02 billion rupees due to pricing pressures.,Dr.Reddy's shares closed 2.1 percent higher in a broader Mumbai market .NSEI that closed 0.3 percent up at a record.
48,https://www.reuters.com/article/dr-reddys-results/indias-dr-reddys-q1-net-profit-rises-seven-fold-beats-forecast-idUSL4N1UM2ET,2018-07-26T09:40:27Z,"India's Dr. Reddy's Q1 net profit rises seven-fold, beats forecast","July 26 (Reuters) - Indian generic drugmaker Dr. Reddy’s Laboratories Ltd posted an over seven-fold rise in first-quarter net profit on Thursday, handily beating market expectations, aided by the launch of a generic version of an opioid addiction drug.","Net profit came in at 4.76 billion rupees ($69.31 million) in the quarter ended June 30, compared with 666 million rupees a year earlier, the company said here.","Analysts on average had expected a net profit of 2.98 billion rupees, according to estimates compiled by Thomson Reuters I/B/E/S. ($1 = 68.6750 Indian rupees) (Reporting by Krishna V Kurup in Bengaluru; Editing by Sunil Nair)"
49,https://www.reuters.com/article/us-indivior-results/british-drugmaker-indiviors-shares-hit-by-copycat-new-drug-worries-idUSKBN1KF0KK,2018-07-25T11:27:19Z,"British drugmaker Indivior's shares hit by copycat, new drug worries",(Reuters) - Indivior shares fell more than 20 percent after the British drugmaker warned of a bigger-than-expected blow from a copycat of its top opioid addiction treatment and posted weak initial sales from its new blockbuster prospect.,"The company, which reported a second straight drop in quarterly profit on Wednesday, said “uncertainties” stopped it from issuing guidance weeks after scrapping its full-year forecast amid market share loss to an Indian copycat rival.",Indivior’s shares have dropped more than 40 percent since India’s Dr.Reddy’s Laboratories announced a cheaper version of the UK firm’s blockbuster opiate addiction drug Suboxone Film.,"The impact on revenue from the copycat “could be materially higher” than the $25 million forecast earlier this month, the company said. Jefferies analysts estimate the hit will be $37.5 million to $45 million for the year.","A U.S. court blocked Dr.Reddy’s from selling a cut-price version of Suboxone Film on July 13, but not before the drug’s market share dropped rapidly. Its share stands at 49 percent from 52 percent before it won the injunction.",Investors were also disappointed with lower-than-expected sales from the firm’s new opioid addiction drug Sublocade.,"Instead of going to the pharmacy to pick up tablets or an under-the-tongue film, Sublocade injections are delivered direct to doctors for administration.","Indivior has pinned its hopes on the once-monthly injection it launched in February, but the company said it was experiencing “some friction” in the new distribution and reimbursement model for Sublocade, making doctors less willing to prescribe the new drug.","Sublocade revenues in the first half were $2 million, below brokerage Jefferies’ expectations but the company said it hopes revenue from the drug will be in the range of $25 to $50 million for the year.","Sublocade’s prescription journey - the time from prescription to injection - has been slow, but the company has lowered it from 43-62 days at launch to 27-36 days currently and Chief Executive Shaun Thaxter said he hopes to get that down to 15-18 days.",Thaxter said the company was making “good” progress in overcoming Sublocade’s initial challenges and remains confident that Sublocade will deliver peak net revenue of more than $1 billion a year.,"Adjusted net income fell 21.3 percent to $70 million in the quarter ended June 30 from a year earlier, while revenue fell 6.9 percent to $268 million in the quarter."
50,https://www.reuters.com/article/indivior-results/rpt-update-2-indivior-shares-plummet-on-warning-of-bigger-hit-from-copycat-drug-idUSL5N1UL2G6,2018-07-25T08:32:13Z,RPT-UPDATE 2-Indivior shares plummet on warning of bigger hit from copycat drug,(Repeats to add pix to slug),* Shares down 20 pct,* Hit from Dr.Reddy’s copycat “could be materially higher”,* New drug Sublocade’s initial H1 sales below Jefferies estimate,* Unable to issue new guidance due to uncertainties,By Justin George Varghese,July 25 (Reuters) - Indivior shares fell more than 20 percent on Wednesday after the British drugmaker warned of a bigger-than-expected blow from the launch of a copycat of its best-selling opioid addiction treatment.,"The company, which also reported a second straight drop in quarterly profit, has had a turbulent few months with its shares down by a third since India’s Dr.Reddy’s Laboratories said it would launch a generic version of Indivior’s blockbuster opioid addiction treatment Suboxone Film.",Indivior said it was unable to issue new guidance due to uncertainties around the drug after scrapping its full-year forecast earlier this month due to a significant market share loss in the United States.,"The impact from the launch of the copycat “could be materially higher” than the $25 million hit on revenue it forecast earlier this month, the company said.","Suboxone Film, a dissolvable oral strip form of Indivior’s older tablet, Suboxone, is used to treat patients addicted to heroin and other painkillers and contributed about 80 percent of its annual revenue a year ago.","Indivior has been involved in a number of legal battles with generic drugmakers to stop copycats from flooding the market. It won an injunction on July 13 to block Dr.Reddy’s from selling cheaper versions of Suboxone Film, but not before the drug’s market share dropped rapidly.","The market share of the film has dropped further to 49 percent from the 52 percent before it got the injunction, the company said on Wednesday.",Invidior’s shares were down 23 percent at 255 pence at 0726 GMT.,"Indivior has pinned its hopes on its new opioid addiction drug, Sublocade, a once-monthly injection launched in February, but the company’s plans have been hit with early stage snags.","Sublocade revenues in the first half were $2 million, below brokerage Jefferies’ expectations. The company said that full-year revenue from the drug is expected to be in the range of $25 to $50 million.",Chief Executive Shaun Thaxter said on Wednesday the company was making progress in overcoming Sublocade’s initial challenges and continues to expect to deliver peak net revenue of more than $1 billion.,"Adjusted net income fell 21.3 percent to $70 million in the quarter ended June 30 from a year earlier, while revenue fell 6.9 percent to $268 million in the quarter. (Reporting by Justin George Varghese in Bengaluru Editing by Saumyadeb Chakrabarty and Jane Merriman)"
