1,https://www.reuters.com/article/us-usa-election-guns-stocks/shares-of-gun-makers-gain-as-bidens-lead-grows-idUSKBN2711KD,2020-10-16T21:54:15Z,Shares of gun makers gain as Biden's lead grows,"(Reuters) - Shares of gun makers have been gaining ground as Democratic candidate Joe Biden leads polls, and if he wins the presidential election in November there are expectations of a renewed surge in gun sales that could drive shares even higher.","Shares of Smith & Wesson Brands SWBI.O and Sturm Ruger RGR.N have both rallied around 8% since late September, mirroring Biden’s widening lead in the polls since his debate against President Donald Trump. The S&P 500 is up 4% in that period.","Fears about the coronavirus pandemic, civil unrest related to protests over racial justice and worries about a potentially disputed presidential election on Nov. 3 have created a surge in gun demand this year. Smith & Wesson CEO Mark Smith last month said the industry was unable to keep up with demand.","A victory by Biden and his vice presidential running mate Kamala Harris, who favor increased gun regulation, could further stoke demand for firearms - and shares of firearms makers - particularly if Democrats wrest control of the Senate from Republicans, giving them majorities in both houses of Congress and making it easier to approve legislation.","“Should we see a Biden-Harris administration get elected, I would anticipate a surge in sales of modern sporting rifles, high-capacity magazines and corresponding ammunition,” said Aegis Capital analyst Rommel Dionisio, using an industry term for military-style rifles, a high-margin product category for firearm manufacturers.","An aggregation of betting odds by RealClearPolitics reflects a 65% chance Biden will defeat Trump, up from 55% before the Sept. 29 presidential debate.","Smith & Wesson’s stock is up 135% this year, while Sturm Ruger has gained 51%.","Shares of Sturm Ruger surged nearly 900% in the eight years from Democratic President Barack Obama’s election victory in November 2008 to the November 2016 election, which Trump won. Sturm Ruger is up just 10% during Trump’s nearly years in office. During the same 2008 to 2016 period, the S&P 500 rose about 113%.","Biden has promised to prohibit the sale of military-style rifles and high-capacity magazines, similar to a 10-year ban that expired in 2004. He also promises to require owners of military-style weapons to either sell them to the government or register them with the government.","Shares of gun makers surged ahead of the 2016 election on expectations Democratic candidate Hilary Clinton would win. Trump’s victory drove the industry into a two-year slump, with customers no longer worried they would lose access to firearms.","Firearm sales surged anew in 2020 due to fears related to the pandemic, and following social unrest in several U.S. cities and calls to defund police departments.","Federal background checks, a proxy for firearm sales to U.S. consumers, in the first nine months of 2020 reached 28.8 million, even before the typically busy holiday shopping season, topping the record 28.4 million checks done in the 2019 full year.",Graphic: Shares of gun makers outperform in 2020,"First-time buyers made up 40% of gun sales in early 2020, compared to an average of 24% in recent years, according to a survey of gun shops by the National Shooting Sports Foundation, a trade association.","Even if Trump wins a second term and dispels expectations of gun control measures, the potential for renewed protests against across the deeply divided country could drive additional demand for handguns for self defense, Dionisio said.",Graphic: U.S. firearm background checks hit record
2,https://www.reuters.com/article/usa-election-guns-stocks/rpt-shares-of-gun-makers-gain-as-bidens-lead-grows-idUSL1N2H70LN,2020-10-16T13:07:59Z,RPT-Shares of gun makers gain as Biden's lead grows,"(Repeats to widen distribution, no change to content of story)","Oct 16 (Reuters) - Shares of gun makers have been gaining ground as Democratic candidate Joe Biden leads polls, and if he wins the presidential election in November there are expectations of a renewed surge in gun sales that could drive shares even higher.","Shares of Smith & Wesson Brands and Sturm Ruger have both rallied around 8% since late September, mirroring Biden’s widening lead in the polls since his debate against President Donald Trump. The S&P 500 is up 4% in that period.","Fears about the coronavirus pandemic, civil unrest related to protests over racial justice and worries about a potentially disputed presidential election on Nov. 3 have created a surge in gun demand this year. Smith & Wesson CEO Mark Smith last month said the industry was unable to keep up with demand.","A victory by Biden and his vice presidential running mate Kamala Harris, who favor increased gun regulation, could further stoke demand for firearms - and shares of firearms makers - particularly if Democrats wrest control of the Senate from Republicans, giving them majorities in both houses of Congress and making it easier to approve legislation.","“Should we see a Biden-Harris administration get elected, I would anticipate a surge in sales of modern sporting rifles, high-capacity magazines and corresponding ammunition,” said Aegis Capital analyst Rommel Dionisio, using an industry term for military-style rifles, a high-margin product category for firearm manufacturers.","An aggregation of betting odds by RealClearPolitics reflects a 65% chance Biden will defeat Trump, up from 55% before the Sept. 29 presidential debate.","Smith & Wesson’s stock is up 135% this year, while Sturm Ruger has gained 51%.","Shares of Sturm Ruger surged nearly 900% in the eight years from Democratic President Barack Obama’s election victory in November 2008 to the November 2016 election, which Trump won. Sturm Ruger is up just 10% during Trump’s nearly years in office. During the same 2008 to 2016 period, the S&P 500 rose about 113%.","Biden has promised to prohibit the sale of military-style rifles and high-capacity magazines, similar to a 10-year ban that expired in 2004. He also promises to require owners of military-style weapons to either sell them to the government or register them with the government.","Shares of gun makers surged ahead of the 2016 election on expectations Democratic candidate Hilary Clinton would win. Trump’s victory drove the industry into a two-year slump, with customers no longer worried they would lose access to firearms.","Firearm sales surged anew in 2020 due to fears related to the pandemic, and following social unrest in several U.S. cities and calls to defund police departments.","Federal background checks, a proxy for firearm sales to U.S. consumers, in the first nine months of 2020 reached 28.8 million, even before the typically busy holiday shopping season, topping the record 28.4 million checks done in the 2019 full year.","First-time buyers made up 40% of gun sales in early 2020, compared to an average of 24% in recent years, according to a survey of gun shops by the National Shooting Sports Foundation, a trade association.","Even if Trump wins a second term and dispels expectations of gun control measures, the potential for renewed protests against across the deeply divided country could drive additional demand for handguns for self defense, Dionisio said."
3,https://www.reuters.com/article/us-usa-guns-sturmruger/sturm-ruger-directors-get-backing-may-start-shareholder-talks-idUSKCN1SJ2BB,2019-05-13T21:45:00Z,"Sturm Ruger directors get backing, may start shareholder talks","BOSTON (Reuters) - All director nominees at gunmaker Sturm Ruger & Co received a majority of support from investors, including three criticized by a top proxy adviser, a securities filing showed on Monday.","Institutional Shareholder Services had recommended investors withhold support from three of nine director nominees at the company’s annual meeting held May 8, including then-chair Michael Jacobi. ISS cited the company’s “limited response” to a shareholder resolution last year calling for a safety report and its unusual policy of not engaging with investors.","Sturm Ruger and other gunmakers have been under pressure from social activist investors after a series of mass shootings across the United States, including at schools, businesses and houses of worship.","Jacobi and the other two directors in question each received support from 72% of votes cast, according to Monday’s filing, the first breakdown of voting results the company has provided. The other six directors each received at least 97% support, a typical level in U.S. corporation elections.","Ruger will “likely modify” its no-talks policy, Chief Executive Christopher Killoy said at the meeting, according to a transcript of the event the company included as part of Monday’s filing. The company also named director Ronald Whitaker as board chairman, replacing Jacobi.",Sturm Ruger General Counsel Kevin Reid said via e-mail last week that Whitaker’s appointment reflected “normal Board rotation” and that Jacobi will continue as a director.
4,https://www.reuters.com/article/us-sturm-ruger-co-guns/proxy-adviser-iss-recommends-against-three-directors-at-sturm-ruger-idUSKCN1S21N8,2019-04-26T19:00:50Z,Proxy adviser ISS recommends against three directors at Sturm Ruger,"BOSTON (Reuters) - Institutional Shareholder Services recommended investors withhold support from three directors at gunmaker Sturm Ruger & Co ahead of its May 8 annual meeting, the top proxy adviser said in a report seen by Reuters on Friday.","Sturm Ruger has been under pressure from gun control activists over how it might respond to a series of mass shootings across the United States, including at schools, houses of worship and workplaces.","ISS recommended investors withhold support from Sturm Ruger Chair Michael Jacobi and the heads of its governance and risk oversight committees. It did recommend investors back the company’s six other board nominees including Chief Executive Christopher Killoy and Sandra Froman, who is also a director of the National Rifle Association and was its president from 2005 to 2007.","In a separate report, rival proxy adviser Glass Lewis recommended support for all nine of Sturm Ruger’s director nominees.","Last year a majority of Sturm Ruger investors backed a call for a safety report, but ISS said the document the company produced “provides little new information.”","ISS also wrote that contrary to the board’s policy of non-engagement with investors, many U.S. companies routinely engage with their shareholders.","Sturm Ruger general counsel Kevin Reid said via e-mail, “We are disappointed with the ISS report and strongly disagree with the withhold recommendations.”","He said the company is confident the 34-page report it issued Feb. 8 “was fully responsive to the shareholder proposal” passed last year and said investors should read it and judge for themselves, via the firm’s website."
5,https://www.reuters.com/article/sturm-ruger-co-guns/proxy-adviser-iss-recommends-against-three-directors-at-sturm-ruger-idUSL1N2280NN,2019-04-26T14:42:21Z,Proxy adviser ISS recommends against three directors at Sturm Ruger,"BOSTON, April 26 (Reuters) - Institutional Shareholder Services recommended investors withhold support from three directors at gunmaker Sturm Ruger & Co ahead of its annual meeting on May 8, the influential proxy adviser said in a report seen by Reuters."
6,https://www.reuters.com/article/us-usa-guns-sturmruger/investor-activists-will-campaign-against-sturm-ruger-directors-idUSKCN1RL18M,2019-04-09T22:54:39Z,Investor activists will campaign against Sturm Ruger directors,"BOSTON (Reuters) - Investor activists said on Monday they will campaign to unseat two directors at gunmaker Sturm Ruger & Co, citing what they called its resistance to their concerns after shareholders won a battle over safety at last year’s annual meeting.","The plan for this year’s gathering, set for May 8 in New Hampshire, promises to renew a debate over how the company might respond to a series of mass shootings across the United States, including at schools, houses of worship and workplaces.","The activists include Majority Action, a liberal-leaning shareholder group, and religious investors affiliated with the Interfaith Center on Corporate Responsibility. While they hold a small number of Sturm Ruger shares, last year members of Interfaith Center won backing for a resolution from fund companies including top Ruger shareholders BlackRock Inc and Vanguard Group, showing an ability to set the agenda.","This year the activists said they will call on other investors to vote “withhold” on Sturm Ruger Chairman Michael Jacobi and on company director Sandra Froman, who is also a director of the National Rifle Association and was its president from 2005 to 2007.","Eli Kasargod-Staub, Majority Action’s executive director, said in an interview that Sturm Ruger should take a harder look at “smart gun” technology and hold talks with investors, dialogue it has rejected in the past.","He also said the company should step back from divisive cultural issues promoted by the NRA. Together, the topics “are the kind of issues that can and have been productively engaged on through dialogue with long-term investors at other companies,” he said.",A Sturm Ruger spokesman did not respond to messages on Monday.,Sturm Ruger and Smith & Wesson parent American Outdoor Brands Corp have faced new attention from gun safety activists after 17 people were killed at a mass shooting at a Florida high school in early 2018.,"At Sturm Ruger’s annual meeting last May a resolution that called on the company to produce a report on the safety of its products won about two-thirds of votes cast over the company’s opposition. The document issued in February outlines safety features, improved background checks and other steps Sturm Ruger has taken, though the company cast doubt on the viability of smart guns and other technical changes suggested by the activists.",Top fund firms also backed all company directors despite their rare stance of avoiding talks with investors.,"Sturm Ruger Chief Executive Christopher Killoy said at the meeting that fair disclosure rules kept it from speaking with BlackRock or Vanguard, although such meetings are common elsewhere."
7,https://www.reuters.com/article/us-usa-guns-investors/limited-engagement-top-funds-backed-gunmaker-ruger-board-despite-no-talks-idUSKCN1LF2QV,2018-08-31T11:21:43Z,Limited engagement: Top funds backed gunmaker Ruger board despite no talks,"BOSTON (Reuters) - Funds run by BlackRock Inc BLK.N and Vanguard Group backed all directors at gunmaker Sturm Ruger & Co Inc RGR.N despite the company's rare rejection of talks with the world's top asset managers, disclosures to regulators on Thursday showed.","The votes by the gunmaker’s largest investors stood in contrast to support BlackRock and Vanguard gave to a measure calling on Sturm Ruger to report on the safety of its products, which passed over the board’s objections at the company’s annual meeting on May 9.","Neither BlackRock nor Vanguard would discuss in detail their votes at the meeting. It drew attention amid a nationwide youth-led gun control movement following a mass shooting at a Florida high school in February that killed 17 people, one in a decades-long series of shootings at U.S. schools, colleges and workplaces.","Sturm Ruger declined to comment on the filings by the funds with the U.S. Securities and Exchange Commission on Thursday. BlackRock holds about 18 percent of shares outstanding, followed by Vanguard, with about 10 percent.","Both fund firms rarely vote against directors, and say critical votes may come only after companies fail to respond to shareholder concerns.","Since July, BlackRock and Vanguard said in separate “investment stewardship” reports that they had held talks with other U.S. public companies that make or sell civilian firearms.","Investors and activists with a range of views about gun control said the asset managers’ split tickets seemed to reflect an approach designed to appeal to young investors concerned with social issues, without alienating clients who own guns or pushing Sturm Ruger’s board too quickly.","The big fund firms “have to look at sensitivities” of their clients and business partners, said Brian Rafn, principal of Morgan Dempsey Capital Management in Milwaukee, who described himself as a gun-rights supporter and says the firm voted all its 80,000 or so shares with Sturm Ruger’s management.","Eli Kasargod-Staub, co-founder of Majority Action, a group that had campaigned for top funds to vote against Sturm Ruger director Sandra Froman, a past president of the National Rifle Association, called the votes “a failure of leadership” by the fund managers.","“The only plausible explanation to me is that they were simply trying to avoid controversy,” he said.",BlackRock spokeswoman Tara McDonnell said via email it takes a case-by-case approach to its engagement and voting “because doing so encourages change over time and promotes responsible business practices that align with the financial interests of our clients.”,"In a statement emailed by spokeswoman Carolyn Wegemann, Vanguard said that while a company’s willingness to engage can affect its voting decisions, corporate moves to improve shareholder value “may unfold over the course of a few years, rather than a few months.”","Sturm Ruger is unusual in that its executives and directors will not talk with investors directly, at a time both big passive managers have stressed more engagement with companies in their portfolios. Sturm Ruger Chief Executive Officer Christopher Killoy at the May meeting said it does not meet with top holders including BlackRock and Vanguard because of fair-disclosure rules, a rare stance.","BlackRock voted against Exxon directors over similar discussion limits in the past, and BlackRock CEO Larry Fink earlier this year told CEOs that “engagement needs to be a year-round conversation about improving long-term value.”",BlackRock and Vanguard said they would contact gunmakers after the Florida shooting.,"Sturm Ruger said previously its directors each won more than 10 million votes at the May 9 meeting. The most votes withheld from any director was 425,763.","Thursday's filings showed funds including BlackRock's iShares Core S&P Small-Cap ETF IJR.P and Vanguard Small-Cap Index Fund VB.P voted for all nine directors, and for the safety report.","In a July 20 “investment stewardship” report BlackRock said it had talks with “nearly all” 13 U.S. public gun manufacturers or sellers. The company also said that at one unidentified gunmaker that did not allow shareholder talks, it voted for a safety report.","Vanguard’s similar report in mid-August said that during the 12 months ended June 30, it spoke with three gunmakers and supported a shareholder resolution calling for more risk disclosure at a company it did not identify.","Vanguard wrote that in its outreach, “our objective is not to change what business a company is in or what product it produces, but rather to ensure that the risks of these choices are understood by the market and reflected in the company’s long-term value to investors.”"
8,https://www.reuters.com/article/usa-guns-investors/rpt-limited-engagement-top-funds-backed-gunmaker-ruger-board-despite-no-talks-idUSL2N1VL1W9,2018-08-31T11:00:00Z,RPT-Limited engagement: Top funds backed gunmaker Ruger board despite no talks,(Repeats with no changes to headline or text),"BOSTON, Aug 30 (Reuters) - Funds run by BlackRock Inc and Vanguard Group backed all directors at gunmaker Sturm Ruger & Co Inc despite the company’s rare rejection of talks with the world’s top asset managers, disclosures to regulators on Thursday showed.","The votes by the gunmaker’s largest investors stood in contrast to support BlackRock and Vanguard gave to a measure calling on Sturm Ruger to report on the safety of its products, which passed over the board’s objections at the company’s annual meeting on May 9.","Neither BlackRock nor Vanguard would discuss in detail their votes at the meeting. It drew attention amid a nationwide youth-led gun control movement following a mass shooting at a Florida high school in February that killed 17 people, one in a decades-long series of shootings at U.S. schools, colleges and workplaces.","Sturm Ruger declined to comment on the filings by the funds with the U.S. Securities and Exchange Commission on Thursday. BlackRock holds about 18 percent of shares outstanding, followed by Vanguard, with about 10 percent.","Both fund firms rarely vote against directors, and say critical votes may come only after companies fail to respond to shareholder concerns.","Since July, BlackRock and Vanguard said in separate “investment stewardship” reports that they had held talks with other U.S. public companies that make or sell civilian firearms.","Investors and activists with a range of views about gun control said the asset managers’ split tickets seemed to reflect an approach designed to appeal to young investors concerned with social issues, without alienating clients who own guns or pushing Sturm Ruger’s board too quickly.","The big fund firms “have to look at sensitivities” of their clients and business partners, said Brian Rafn, principal of Morgan Dempsey Capital Management in Milwaukee, who described himself as a gun-rights supporter and says the firm voted all its 80,000 or so shares with Sturm Ruger’s management.","Eli Kasargod-Staub, co-founder of Majority Action, a group that had campaigned for top funds to vote against Sturm Ruger director Sandra Froman, a past president of the National Rifle Association, called the votes “a failure of leadership” by the fund managers.","“The only plausible explanation to me is that they were simply trying to avoid controversy,” he said.",BlackRock spokeswoman Tara McDonnell said via email it takes a case-by-case approach to its engagement and voting “because doing so encourages change over time and promotes responsible business practices that align with the financial interests of our clients.”,"In a statement emailed by spokeswoman Carolyn Wegemann, Vanguard said that while a company’s willingness to engage can affect its voting decisions, corporate moves to improve shareholder value “may unfold over the course of a few years, rather than a few months.”","Sturm Ruger is unusual in that its executives and directors will not talk with investors directly, at a time both big passive managers have stressed more engagement with companies in their portfolios. Sturm Ruger Chief Executive Officer Christopher Killoy at the May meeting said it does not meet with top holders including BlackRock and Vanguard because of fair-disclosure rules, a rare stance.","BlackRock voted against Exxon directors over similar discussion limits in the past, and BlackRock CEO Larry Fink earlier this year told CEOs that “engagement needs to be a year-round conversation about improving long-term value.”",BlackRock and Vanguard said they would contact gunmakers after the Florida shooting.,"Sturm Ruger said previously its directors each won more than 10 million votes at the May 9 meeting. The most votes withheld from any director was 425,763.","Thursday’s filings showed funds including BlackRock’s iShares Core S&P Small-Cap ETF and Vanguard Small-Cap Index Fund voted for all nine directors, and for the safety report.","In a July 20 “investment stewardship” report BlackRock said it had talks with “nearly all” 13 U.S. public gun manufacturers or sellers. The company also said that at one unidentified gunmaker that did not allow shareholder talks, it voted for a safety report.","Vanguard’s similar report in mid-August said that during the 12 months ended June 30, it spoke with three gunmakers and supported a shareholder resolution calling for more risk disclosure at a company it did not identify.","Vanguard wrote that in its outreach, “our objective is not to change what business a company is in or what product it produces, but rather to ensure that the risks of these choices are understood by the market and reflected in the company’s long-term value to investors.” (Reporting by Ross Kerber; editing by Grant McCool)"
