9,https://www.reuters.com/article/usa-guns-sturm-ruger/rpt-despite-gun-debate-sturm-ruger-board-faced-little-opposition-idUSL2N1SM039,2018-05-15T10:00:00Z,"RPT-Despite gun debate, Sturm Ruger board faced little opposition","(Repeats to widen distribution, no change to headline or text)","BOSTON, May 14 (Reuters) - Gunmaker Sturm Ruger & Co directors faced little opposition at its recent board election, a securities filing showed on Monday, despite its policy of not talking with shareholders even in the midst of a national debate over gun control.","Additionally, a proposal calling for Ruger to produce a report on the safety of its products was supported by 7.2 million votes, with 3.3 million votes cast “against.”","All nine of Ruger’s candidates won more than 10 million votes “for” a one-year board term at its annual meeting on May 9, the filing showed. The highest number of votes “withheld” from any director was 425,763.","Ruger’s proxy showed BlackRock with 2.9 million shares of Ruger’s common stock, just under 17 percent, as of March 15, and Vanguard with 1.7 million shares, or 9.5 percent, meaning neither could have withheld all support from the directors.",BlackRock and Vanguard declined to state how they voted.,Both fund managers were among major financial firms that had said they would speak with weapons companies about the safety of their products after the February shooting at Marjory Stoneman Douglas High School in Florida that left 17 dead. BlackRock has also made plans to offer gun-free investment strategies.,Ruger’s meeting had been seen as an early test of how far the investment firms would push their concerns.,"Chief Executive Christopher Killoy declined to meet with gun safety activists at the meeting, saying the company does not meet even with major investors BlackRock or Vanguard.",Ruger had said the directors were elected and the shareholder proposal passed but it had not provided vote tallies.,"University of Pennsylvania law professor Jill Fisch, who follows corporate governance, said opposition to the directors seemed low considering the concern financial companies expressed about gun safety issues after the Parkland shooting.","“I’m surprised given the current debate that the withhold levels are as small as they are,” Fisch said in a telephone interview. “Clearly the institutional investors are not trying to make a statement through their voting on directors.”","For each nominee and for the shareholder proposal there were also 5.1 million “non-votes,” the filing showed.",Ruger did not reply to a request for comment on the tallies.,Monday’s filing showed that at the meeting Killoy said a reason for Ruger’s no-meeting policy was a federal securities rule known as “Regulation FD” for fair disclosure that is meant to prevent companies from selectively disclosing material information to investors.,"Asked about Killoy’s comments, Carolyn Wegemann, a spokeswoman for Vanguard of Pennsylvania, said by email that it “has had 1000+ engagements with public portfolio companies over the past year alone (hundreds of these discussions have included members of the board), all without raising Reg. FD concerns.”","In 2016 and 2017, BlackRock voted against directors at Exxon Mobil Corp over the company barring talks with outside directors. Last year, Exxon said its board had ended a prohibition on outside directors meeting with shareholders.",BlackRock’s proxy voting guidelines posted on its website state that it expects boards to be “engaged and responsive.”,"Although rules do not require talks with investors, representatives of big investment firms and academics who follow corporate governance said such meetings are common. (Reporting by Ross Kerber)"
10,https://www.reuters.com/article/us-usa-guns-sturm-ruger/despite-gun-debate-sturm-ruger-board-faced-little-opposition-idUSKCN1IG03I,2018-05-15T00:58:30Z,"Despite gun debate, Sturm Ruger board faced little opposition","BOSTON (Reuters) - Gunmaker Sturm Ruger & Co RGR.N directors faced little opposition at its recent board election, a securities filing showed on Monday, despite its policy of not talking with shareholders even in the midst of a national debate over gun control.","Additionally, a proposal calling for Ruger to produce a report on the safety of its products was supported by 7.2 million votes, with 3.3 million votes cast “against.”","All nine of Ruger’s candidates won more than 10 million votes “for” a one-year board term at its annual meeting on May 9, the filing showed. The highest number of votes “withheld” from any director was 425,763.","Ruger’s proxy showed BlackRock with 2.9 million shares of Ruger’s common stock, just under 17 percent, as of March 15, and Vanguard with 1.7 million shares, or 9.5 percent, meaning neither could have withheld all support from the directors.",BlackRock and Vanguard declined to state how they voted.,Both fund managers were among major financial firms that had said they would speak with weapons companies about the safety of their products after the February shooting at Marjory Stoneman Douglas High School in Florida that left 17 dead. BlackRock has also made plans to offer gun-free investment strategies.,Ruger’s meeting had been seen as an early test of how far the investment firms would push their concerns.,"Chief Executive Christopher Killoy declined to meet with gun safety activists at the meeting, saying the company does not meet even with major investors BlackRock or Vanguard.",Ruger had said the directors were elected and the shareholder proposal passed but it had not provided vote tallies.,"University of Pennsylvania law professor Jill Fisch, who follows corporate governance, said opposition to the directors seemed low considering the concern financial companies expressed about gun safety issues after the Parkland shooting.","“I’m surprised given the current debate that the withhold levels are as small as they are,” Fisch said in a telephone interview. “Clearly the institutional investors are not trying to make a statement through their voting on directors.”","For each nominee and for the shareholder proposal there were also 5.1 million “non-votes,” the filing showed.",Ruger did not reply to a request for comment on the tallies.,Monday’s filing showed that at the meeting Killoy said a reason for Ruger’s no-meeting policy was a federal securities rule known as “Regulation FD” for fair disclosure that is meant to prevent companies from selectively disclosing material information to investors.,"Asked about Killoy’s comments, Carolyn Wegemann, a spokeswoman for Vanguard of Pennsylvania, said by email that it “has had 1000+ engagements with public portfolio companies over the past year alone (hundreds of these discussions have included members of the board), all without raising Reg. FD concerns.”","In 2016 and 2017, BlackRock voted against directors at Exxon Mobil Corp XOM.N over the company barring talks with outside directors. Last year, Exxon said its board had ended a prohibition on outside directors meeting with shareholders.",BlackRock’s proxy voting guidelines posted on its website state that it expects boards to be “engaged and responsive.”,"Although rules do not require talks with investors, representatives of big investment firms and academics who follow corporate governance said such meetings are common."
11,https://www.reuters.com/article/us-usa-guns-sturmruger/majority-of-sturm-ruger-investors-vote-for-gun-safety-report-idUSKBN1IA2S1,2018-05-10T21:44:41Z,Majority of Sturm Ruger investors vote for gun-safety report,(Reuters) - (This May 9 story has been refiled to correct name of organization to “Catholic Health Initiatives” from “Catholic Health Services” in thirteenth paragraph.),"A majority of Sturm Ruger & Co investors on Wednesday voted to support a call for the gun maker to produce a report on the safety of its products, in what shareholder activists called the first victory for such a proposal.",The resolution passed in the wake of marches and demonstrations in support of gun control during the three months since 17 people were shot dead at a Florida high school.,"It calls on Sturm Ruger to report by next year on how it monitors the use of its products in violent crimes, on research to produce safer firearms and on risks gun violence could pose to its reputation and finances.","Sturm Ruger and rival publicly traded gun makers such as American Outdoor Brands Corp have been under pressure from fund firms, banks and retailers since the Parkland, Florida, massacre.","Religious investor activists sponsored the resolution. Southport, Connecticut-based Sturm Ruger did not disclose the margin by which it passed at its Wednesday annual meeting in Prescott, Arizona.",Chief Executive Officer Christopher Killoy said the maker of handguns and assault-style rifles would prepare the report but would not be forced into changing its business.,"“What it does not do, and cannot do, is force us to adopt misguided principles created by groups who do not own guns, know nothing about our business, and frankly would rather see us out of business,” Killoy said of the resolution.",He rejected calls to meet with shareholders.,"A majority of the company’s shares were owned by six institutional investors as of recent filings, indicating the measure could not have passed without support from at least one of them.","Top investors include BlackRock Inc and Vanguard Group, which together own about 25 percent of the company. A BlackRock representative did not immediately comment. A Vanguard representative declined to comment.",Major proxy advisers had recommended investors vote for the safety report.,"The religious activists’ proposal discussed the possibility of developing “smart guns,” with electronic limits on their ability to fire.","“If new product development, as you said Mr. Killoy, is the lifeblood of Sturm Ruger, safer guns need to be on that development agenda,” one proposal supporter, Colleen Scanlon of Catholic Health Initiatives, told the meeting.","A representative for the Interfaith Center on Corporate Responsibility said similar proposals at Sturm Ruger got less than 6 percent support when they were last voted on, in 2001 and 2002."
12,https://www.reuters.com/article/usa-guns-sturmruger/sturm-ruger-says-majority-of-investors-back-call-for-safety-report-idUSL1N1SG1H6,2018-05-09T16:30:21Z,Sturm Ruger says majority of investors back call for safety report,"BOSTON, May 9 (Reuters) - Sturm Ruger & Co executives said on Wednesday a majority of the gunmaker’s investors backed a shareholder resolution calling for a safety report.","Sturm Ruger leaders also said at the company’s annual meeting, which was webcast, that all nine of its director nominees received a majority of support from shareholders. (Reporting by Ross Kerber Editing by Chizu Nomiyama)"
13,https://www.reuters.com/article/brief-sturm-ruger-co-reports-q1-sales-of/brief-sturm-ruger-co-reports-q1-sales-of-131-2-mln-idUSASC0A0SG,2018-05-08T21:10:43Z,"BRIEF-Sturm, Ruger & Co Reports Q1 Sales Of $131.2 Mln",May 8 (Reuters) - Sturm Ruger & Company Inc:,"* STURM, RUGER & COMPANY, INC. REPORTS FIRST QUARTER DILUTED EARNINGS OF 81¢ PER SHARE AND DECLARES DIVIDEND OF 32¢ PER SHARE",* Q1 EARNINGS PER SHARE $0.81 Source text for Eikon: Further company coverage:
14,https://www.reuters.com/article/us-usa-guns-sturmruger/proxy-adviser-iss-backs-call-for-gun-safety-report-at-sturm-ruger-idUSKBN1HW2YA,2018-04-25T23:02:23Z,Proxy adviser ISS backs call for gun safety report at Sturm Ruger,"BOSTON (Reuters) - Proxy adviser Institutional Shareholder Services on Wednesday recommended investors vote to support a shareholder proposal calling for gunmaker Sturm Ruger & Co to report on gun safety, which could put new attention on so-called “smart gun” technology.","In a note to clients, ISS also backed the election of all director nominees at Sturm Ruger ahead of its shareholder meeting scheduled for May 9.","The board of Connecticut company Sturm Ruger had recommended investors vote against the call for the safety report. Its proxy statement said that “the intentional criminal misuse of firearms is beyond our control. Similarly, the constitutional right of firearms ownership carries with it certain responsibilities and the Company has long advocated the safe and responsible ownership and use of firearms.”",Sturm Ruger representatives did not immediately respond to a request for further comment.,"Second-ranked proxy adviser Glass Lewis made the same recommendations to Sturm Ruger investors on April 14, citing gun violence as a risk to the company’s reputation.",Just what additional steps if any weapons makers should take on safety has drawn renewed interest in the wake of a shooting at a Florida high school in February in which 17 people were killed.,"Banks including Citigroup Inc and Bank of America Corp lately have restricted lending to clients involved with firearms. Also, asset managers including BlackRock Inc and Vanguard Group have said they would raise safety concerns with gunmakers whose stocks they own.","BlackRock and Vanguard are the top two investors in Sturm Ruger, together with about 25 percent of shares.",Representatives for both firms declined to discuss how they might vote at Sturm Ruger.,"The shareholder proposal was filed by the Sisters of the Holy Names of Jesus and Mary in Oregon. It asks the company report on gun safety such as how it monitors violence, research on safer guns, and its assessment of risks to its reputation.","The proposal mentions smart guns, designs with electronic limits on their ability to fire, which it says could help reduce accidental shootings and suicides.",Smart guns have faced opposition from gun rights groups concerned about their practicality and legislative implications.,"ISS wrote the technology could make guns safer, and that a market for smart guns could help overcome engineering problems. ISS noted the proposal does not call for the production of smart guns, but only seeks evidence that Sturm Ruger’s board is properly assessing risks."
15,https://www.reuters.com/article/usa-guns-sturmruger/proxy-adviser-iss-backs-call-for-gun-safety-report-at-sturm-ruger-idUSL1N1S223E,2018-04-25T21:11:18Z,Proxy adviser ISS backs call for gun safety report at Sturm Ruger,"BOSTON, April 25 (Reuters) - Proxy adviser Institutional Shareholder Services on Wednesday recommended investors vote to support a shareholder resolution calling on Sturm Ruger & Co to report on gun safety.","In a note to clients, ISS also backed the election of all director nominees at the gunmaker ahead of its shareholder meeting scheduled for May 9.","Sturm Ruger’s board had recommended investors vote against the call for the safety report, saying in its proxy statement that “the intentional criminal misuse of firearms is beyond our control.” (Reporting by Ross Kerber Editing by Tom Brown)"
16,https://www.reuters.com/article/brief-amalgamated-bank-says-sent-letter/brief-amalgamated-bank-says-sent-letter-to-chairman-of-sturm-ruger-company-on-april-19-sec-filing-idUSFWN1S119L,2018-04-24T19:09:21Z,BRIEF-Amalgamated Bank Says Sent Letter To Chairman Of Sturm Ruger & Company on April 19 - Sec Filing,April 24 (Reuters) - Amalgamated Bank Longview Funds:,* AMALGAMATED BANK LONGVIEW FUNDS - SENT LETTER TO CHAIRMAN OF STURM RUGER & COMPANY ON APRIL 19 - SEC FILING,* AMALGAMATED BANK LONGVIEW FUNDS - EXPRESS CONCERNS ABOUT STURM RUGER & COMPANY INC’S PERFORMANCE AND RISK OVERSIGHT,"* AMALGAMATED BANK-IF STURM RUGER BOARD DOESN’T PUBLICLY COMMIT TO EVERYTOWN ACTIONS BY MAY 4, INTEND TO WITHHOLD SUPPORT FOR SANDRA FROMAN’S RE-ELECTION","* AMALGAMATED BANK - URGE STURM RUGER BOARD TO COMMIT TO TAKING STEPS TO PROMOTE POLICY REFORMS CONSISTENT WITH ""PROFESSED GOALS"" Source text: (bit.ly/2HXUSbs) Further company coverage:"
