1,https://www.reuters.com/article/us-at-t-results/att-beats-revenue-estimates-as-reopening-helps-phone-sales-idUSKBN2C91A0,"April 22, 2021 3:07 PM UTC",AT&T beats revenue estimates as reopening helps phone sales,AT&T Inc (T.N) beat Wall Street revenue targets as the reopening of the U.S. economy following pandemic-linked restrictions boosted smartphone sales and the media business.,Shares of AT&T surged 5.3% to $31.70 in morning trading.,"The company said on Thursday it added 595,000 net wireless phone subscribers in the first quarter, more than double what analysts had expected.",AT&T's controversial move to make its entire 2021 theatrical movies slate available to its streaming customers at the same time helped the company attract 2.7 million new subscribers for HBO and HBO Max.,"The theatrical release of ""Godzilla vs. Kong,"" which was also available to HBO Max subscribers, generated over $80 million at the U.S. box office and over $300 million globally as the No. 1 film over the past three weekends, and represented an early endorsement of WarnerMedia CEO Jason Kilar's strategy.","In an interview, Kilar said the company's 2022 movie slate, especially big blockbuster films, will return to theaters, but a portion will be offered on the same day on HBO Max.","""I don't think that we would be going back to ... 2016 where windows were quite long and lengthy,"" he said.","Shares of streaming rival Netflix sank 11% on Monday after it reported a sharp slowdown in new customer additions globally. In the U.S. and Canada, Netflix added 450,000 new paid subscribers.","HBO and HBO Max now have 63.9 million global subscribers, compared to over 100 million for Walt Disney Co's Disney+ and 207.6 million for Netflix.",A lower-priced version of HBO Max supported with ads is set to be launched in June.,AT&T has been investing heavily in its new 5G wireless network and bundling its streaming service HBO Max for free with certain phone plans to retain customers and keep them from switching to competitors.,"Wireless phone churn, or the rate of customer defections, declined 0.1% in the first quarter to 0.76%. The improvements were, in part, due to the bundling of HBO Max to higher-priced phone plans.","Ahead of HBO Max's launch last year, AT&T Chief Executive John Stankey said that a single basis point, or 0.01%, improvement in churn represents about $100 million in wireless revenue. This quarter's improvement would have represented about $1 billion in wireless revenue.","Revenue for AT&T was up nearly 3% at $43.9 billion, beating analysts' average estimate of $42.69 billion, according to IBES data from Refinitiv.","Excluding items, AT&T earned 86 cents per share, above analyst estimates of 78 cents.","WarnerMedia, which includes HBO, began to recover from the ravages of the pandemic during which sports events and movie productions were paused. Revenue for WarnerMedia rose 9.8% to $8.5 billion.","AT&T added 235,000 new fiber internet customers, as Americans continued to work from home during the pandemic, driving up demand for home Wi-Fi.","The company's net debt rose to $169 billion at the end of the first quarter, due to its purchase of more wireless spectrum, or airwaves that carry data.","Separately, rival Verizon Communications Inc (VZ.N) has said it lost more wireless subscribers than expected during the first quarter as it battled intense competition from T-Mobile US Inc (TMUS.O) and AT&T to attract customers. read more"
2,https://www.reuters.com/article/usa-stocks/us-stocks-snapshot-wall-st-opens-flat-as-earnings-roll-in-jobless-claims-fall-idUSL4N2MF3E7,"April 22, 2021 1:37 PM UTC",US STOCKS SNAPSHOT-Wall St opens flat as earnings roll in; jobless claims fall,"Wall Street's main indexes opened flat on Thursday as investors assessed earnings from U.S. airlines and AT&T, while data showed fewer Americans filed fresh claims for unemployment benefits last week.","The Dow Jones Industrial Average (.DJI) fell 27.43 points, or 0.08%, at the open to 34,109.88.","The S&P 500 (.SPX) opened lower by 2.96 points, or 0.07%, at 4,170.46, while the Nasdaq Composite (.IXIC) gained 2.35 points, or 0.02%, to 13,952.57 at the opening bell."
3,https://www.reuters.com/article/att-results/att-beats-revenue-wireless-subscribers-estimates-idUSL4N2MF2GB,"April 22, 2021 3:07 PM UTC","AT&T beats revenue, wireless subscribers estimates",AT&T Inc (T.N) beat Wall Street revenue targets as the reopening of the U.S. economy following pandemic-linked restrictions boosted smartphone sales and the media business.,Shares of AT&T surged 5.3% to $31.70 in morning trading.,"The company said on Thursday it added 595,000 net wireless phone subscribers in the first quarter, more than double what analysts had expected.",AT&T's controversial move to make its entire 2021 theatrical movies slate available to its streaming customers at the same time helped the company attract 2.7 million new subscribers for HBO and HBO Max.,"The theatrical release of ""Godzilla vs. Kong,"" which was also available to HBO Max subscribers, generated over $80 million at the U.S. box office and over $300 million globally as the No. 1 film over the past three weekends, and represented an early endorsement of WarnerMedia CEO Jason Kilar's strategy.","In an interview, Kilar said the company's 2022 movie slate, especially big blockbuster films, will return to theaters, but a portion will be offered on the same day on HBO Max.","""I don't think that we would be going back to ... 2016 where windows were quite long and lengthy,"" he said.","Shares of streaming rival Netflix sank 11% on Monday after it reported a sharp slowdown in new customer additions globally. In the U.S. and Canada, Netflix added 450,000 new paid subscribers.","HBO and HBO Max now have 63.9 million global subscribers, compared to over 100 million for Walt Disney Co's Disney+ and 207.6 million for Netflix.",A lower-priced version of HBO Max supported with ads is set to be launched in June.,AT&T has been investing heavily in its new 5G wireless network and bundling its streaming service HBO Max for free with certain phone plans to retain customers and keep them from switching to competitors.,"Wireless phone churn, or the rate of customer defections, declined 0.1% in the first quarter to 0.76%. The improvements were, in part, due to the bundling of HBO Max to higher-priced phone plans.","Ahead of HBO Max's launch last year, AT&T Chief Executive John Stankey said that a single basis point, or 0.01%, improvement in churn represents about $100 million in wireless revenue. This quarter's improvement would have represented about $1 billion in wireless revenue.","Revenue for AT&T was up nearly 3% at $43.9 billion, beating analysts' average estimate of $42.69 billion, according to IBES data from Refinitiv.","Excluding items, AT&T earned 86 cents per share, above analyst estimates of 78 cents.","WarnerMedia, which includes HBO, began to recover from the ravages of the pandemic during which sports events and movie productions were paused. Revenue for WarnerMedia rose 9.8% to $8.5 billion.","AT&T added 235,000 new fiber internet customers, as Americans continued to work from home during the pandemic, driving up demand for home Wi-Fi.","The company's net debt rose to $169 billion at the end of the first quarter, due to its purchase of more wireless spectrum, or airwaves that carry data.","Separately, rival Verizon Communications Inc (VZ.N) has said it lost more wireless subscribers than expected during the first quarter as it battled intense competition from T-Mobile US Inc (TMUS.O) and AT&T to attract customers. read more"
4,https://www.reuters.com/article/us-verizon-results/verizon-loses-more-than-expected-wireless-subscribers-idUSKBN2C81KU,"April 21, 2021 11:51 AM UTC",Verizon loses more-than-expected wireless subscribers,Verizon Communications Inc (VZ.N) said on Wednesday it lost more wireless subscribers than expected during the first quarter as it battled intense competition from T-Mobile US Inc (TMUS.O) and AT&T Inc (T.N) to attract customers.,"As the 5G technology gains traction, customers have been exploring competitive options from the big three telecoms carriers, which are making big investments to upgrade their networks.","Verizon lost 178,000 wireless phone subscribers in the first quarter, more than 121,700 subscriber loss estimated by FactSet.","Total operating revenue rose about 4% to $32.9 billion, compared with analysts' estimates of $32.46 billion, according to IBES data from Refinitiv.","In February, AT&T, Verizon and T-Mobile won $78 billion in bids in the government's auction of C-Band spectrum, which is seen as the most likely short-term source of available spectrum for next-generation 5G networks.","To finance the purchase, Verizon raised $12 billion in the fourth quarter and more than $31 billion in March this year, the wireless carrier said."
5,https://www.reuters.com/article/us-usa-treasury-jobs/u-s-treasury-names-ex-communications-industry-exec-pomeroy-domestic-finance-adviser-idUSKBN2C72WO,2021-04-20T20:57:54Z,U.S. Treasury names ex-communications industry exec Pomeroy domestic finance adviser,WASHINGTON (Reuters) - The U.S. Treasury Department on Tuesday said it had named former communications industry executive Darla Pomeroy as senior adviser to its office of domestic finance.,"Pomeroy, who served on President Joe Biden’s transition team, was a co-owner and senior vice president at Edge Wireless, LLC, where she negotiated its successful sale to AT&T.","Pomeroy, who also previously worked at NEXTLINK Communications, began her career working for then-Senator Biden on his staff at the Senate Judiciary Committee.","The department also named Matthew Wiegmann as senior adviser for technology and delivery, serving Treasury Secretary Janet Yellen. A veteran of the U.S. Army, Wiegmann was also a top official on Biden’s transition team, serving as its director of information technology."
6,https://www.reuters.com/article/employment-arbitration/att-units-mixed-messages-gave-union-more-time-to-sue-over-arbitration-11th-circuit-idUSL1N2MD2QF,2021-04-20T20:23:28Z,AT&T unit's mixed messages gave union more time to sue over arbitration - 11th Circuit,"A U.S. appeals court on Tuesday revived the Communications Workers of America’s bid to compel arbitration with a utility company over a seniority dispute, saying a judge was wrong to rule that the union waited too long to sue.",A unanimous three-judge panel of the 11th U.S. Circuit Court of Appeals said BellSouth Telecommunications LLC telling the CWA in 2018 that it did not believe the dispute could be arbitrated was not an “unequivocal refusal to arbitrate” that triggered a six-month window for the union to file a lawsuit under the federal Labor Management Relations Act.,"To read the full story on Westlaw Today, click here: bit.ly/3tCu8US"
7,https://www.reuters.com/article/us-at-t-results-preview/5g-spending-in-spotlight-for-att-verizon-quarterly-results-idUSKBN2C72RC,"April 20, 2021 8:14 PM UTC","5G spending in spotlight for AT&T, Verizon quarterly results","When AT&T Inc (T.N) and Verizon Communications Inc (VZ.N) report their first-quarter results this week, investors will look for clarity on capital spending and margin pressures as wireless carriers shell out billions to upgrade their networks to 5G.","Analysts have been bullish about the pandemic helping the telecom sector, but some have flagged concerns over the rising costs of 5G deployments. Some carriers have paid huge sums in a recent spectrum auction, limiting their ability to spend on infrastructure.","In February, AT&T, Verizon and T-Mobile US (TMUS.O) won $78 billion in bids in the government's auction of C-Band spectrum, which is seen as the most likely short-term source of available spectrum for next-generation 5G networks.","""We expect upward pressure on Big 3 capex because of the enormous spectrum investments they've made in 2020 and 2021,"" Bernstein analyst Peter Supino said.",THE CONTEXT,"Wall Street on average expects AT&T to incur $18.54 billion in capital expenditure this year, an increase of 18% over last year, while Verizon's spending is expected to rise about 10% to nearly $20 billion.","The onset of the 5G era has left customers exploring various available options from among the big three carriers that continue to invest in the rapidly evolving technology, thereby intensifying competition.",Brokerage JP Morgan expects margins at the big three carriers to contract in the second quarter as economies reopen and companies burn cash on aggressive promotions to snap up customers.,THE FUNDAMENTALS,"* Dallas, Texas-based AT&T is expected to report a 1% decrease in revenue to $42.36 billion from $42.78 billion a year ago, according to Refinitiv data.","On the other hand, analysts expect New York-based Verizon expected to report a 2.7% rise in revenue to $32.46 billion from $31.61 billion a year ago.","* Analysts' mean estimate for AT&T's first-quarter earnings is 78 cents per share, where as the mean estimate for Verizon's earnings is $1.29 per share.",WALL STREET SENTIMENT,"* The current analysts' average rating on AT&T's shares is ""hold"" and the breakdown of recommendations is 8 ""strong buy"" or ""buy,"" 18 ""hold"" and 6 ""sell"" or ""strong sell.""","The current average analyst rating on the shares of Verizon is ""hold"" and out of the 30 analysts covering the stock, 9 rate it ""strong buy"" or ""buy,"" 21 ""hold"" and no ""sell"" or ""strong sell."""
8,https://www.reuters.com/article/us-nokia-at-t/nokia-signs-5g-equipment-deal-with-att-idUSKBN2BA1E1,2021-03-18T11:54:31Z,Nokia signs 5G equipment deal with AT&T,"HELSINKI (Reuters) - Nokia has signed a five-year deal with AT&T to deploy a 5G network on the mobile operator’s C-Band spectrum in parts of the United States, the Finnish company said on Thursday.","Nokia said its portfolio for C-Band, meaning satellite transmissions in the 4-8GHz frequency range, includes support for different 5G networks, cloud-based implementations and Open RAN products.",U.S. wireless companies last month won $78 billion in bids in the government’s auction for a band of C-Band spectrum critical to next-generation 5G networks.,"C-Band spectrum provides a good balance of both capacity and coverage, while also allowing rapid 5G rollout and fast introduction of services.",Nokia did not disclose the value of the agreement.
9,https://www.reuters.com/article/us-film-justice-league/justice-league-original-directors-cut-sought-by-fans-debuts-thursday-idUSKBN2B92BZ,2021-03-17T16:09:37Z,'Justice League' original director's cut sought by fans debuts Thursday,LOS ANGELES (Reuters) - Fans disappointed by 2017 film “Justice League” will finally be able to see the original director’s vision for the movie that united several DC Comics superheroes on screen for the first time.,"Zack Snyder’s cut of “Justice League” debuts Thursday on HBO Max, a subscription streaming service launched last year by AT&T Inc’s WarnerMedia.","“This movie would not exist at all without the fans, without the fans’ pressure and without their constant drumbeat and without their dedication on such a level that you can’t even imagine,” Snyder told Reuters in an interview.","Snyder and his wife Deborah, a producer, left the original film before it was finished following the death of their daughter. The movie was completed by “Avengers” director Joss Whedon and fell flat with critics and fans who thought the storytelling was disjointed and the visual effects messy.",Fans began lobbying for WarnerMedia to release Snyder’s version of the film. They even bought a billboard in New York’s Times Square in October 2019 to promote their cause.,"In an unusual move, the company agreed and let Snyder rework a black-and-white version that he had completed in 2017.","The new movie goes into greater detail about many characters, which include Superman, Batman, Wonder Woman, The Flash, Aquaman and Cyborg, and explains the motives of their enemy, Steppenwolf. Stars include Ben Affleck as Batman, Henry Cavill as Superman and Gal Gadot as Wonder Woman.","Critics have generally applauded Snyder’s version. The film scored a 77% positive rating on Rotten Tomatoes, a website that aggregates reviews, as of Tuesday, compared with 40% for the 2017 movie.","The new film runs four hours and is divided into chapters of around 30 minutes each to give options for viewers watching at home, Deborah Snyder said.","“They can watch it, binge watch it all the way through or they can watch it in parts,” she said."
10,https://www.reuters.com/article/us-att-data/att-halting-some-free-data-services-in-response-to-california-law-idUSKBN2B91KY,2021-03-17T12:17:39Z,AT&T halting some free data services in response to California law,"WASHINGTON (Reuters) - AT&T Inc said Wednesday it will halt some free data services in response to a California net neutrality law, the latest flashpoint in an ongoing debate over internet rules.",The U.S. wireless carrier said the state law bans “sponsored data” services that allowed companies such as video providers to pay for some data usage of certain AT&T wireless customers.,"“Given that the Internet does not recognize state borders, the new law not only ends our ability to offer California customers such free data services but also similarly impacts our customers in states beyond California,” AT&T said in a statement.",It declined to disclose how many customers are impacted.,"In February, U.S. Judge John Mendez said he would not block California’s 2018 net neutrality law that barred internet service providers from blocking or throttling traffic, or offering paid fast lanes. The law had previously been on hold.",AT&T wireless customers on tiered plans who also have an AT&T video service like DIRECTV or AT&T TV and stream that service over the AT&T wireless network are impacted. AT&T wireless customers on unlimited plans are unaffected.,The company notified customers late Tuesday of the change effective March 25 in an email titled “Data Free TV ends.”,The Federal Communications Commission (FCC) under former President Barack Obama adopted net neutrality rules in 2015. These were overturned in 2017 by the FCC under President Donald Trump. California’s legislature responded by adopting a state law requiring net neutrality in August 2018.,"Under the Obama administration, the FCC sent letters raising concerns about AT&T and Verizon sponsored data practices violating net neutrality rules. The Trump FCC ended those inquiries and said the free data plans had “enhanced competition in the wireless marketplace”.",Some critics contend sponsored data services could prod users into avoiding competitors’ video services.,"In January, the U.S. Justice Department withdrew its Trump-era legal challenge to the California net neutrality law after President Joe Biden, a Democrat, took office.",Industry groups that challenged the law have appealed Mendez’s decision to the Ninth U.S. Court of Appeals.
11,https://www.reuters.com/article/lawyer-compensation-att/in-brief-att-general-counsels-pay-hit-18-6-mln-in-2020-boosted-by-stock-awards-idUSL1N2LA34T,2021-03-12T23:37:18Z,"IN BRIEF: AT&T general counsel's pay hit $18.6 mln in 2020, boosted by stock awards","AT&T Inc general counsel David McAtee’s total compensation hit $18.6 million in fiscal year 2020 - up from $9.35 million in 2019, mostly because of a boost in stock awards, a regulatory filing shows.","McAtee’s 2020 compensation package included over $14.3 million in stock awards, almost $10 million more than his 2019 package. His 2020 comp also included $1.76 million in non-equity incentives, a post-Dodd Frank form of cash pay, nearly $1.3 million in salary, $484,566 in changes to pension value and $715,725 in all other compensation, AT&T disclosed Thursday in a filing with the U.S. Securities and Exchange Commission.","To read the full story on Westlaw Today, click here: bit.ly/3cGbeoX"
12,https://www.reuters.com/article/us-at-t-streaming/att-raises-subscriber-forecast-for-hbo-max-as-streaming-booms-idUSKBN2B42BX,2021-03-12T17:45:58Z,AT&T raises subscriber forecast for HBO Max as streaming booms,"(Reuters) - AT&T Inc said on Friday it expects up to 150 million global subscribers for its video services HBO Max and HBO, and $15 billion in revenue for the businesses by the end of 2025, as more people turn to cheaper streaming services for entertainment.",Shares of AT&T were up 2% to $30.16 in morning trading.,The U.S. wireless carrier has invested heavily to break into the streaming video market dominated by Netflix Inc and Walt Disney Co’s Disney+.,WarnerMedia Chief Executive Officer Jason Kilar said during a virtual investor presentation on Friday that he believes HBO Max is already the No. 2 revenue-generating standalone video service in the United States.,"The company said it expects $14 in average revenue per user for HBO Max in the United States by 2025, up from $12 this year.","Netflix, the world’s largest streaming service, booked $6.64 billion in revenue in its fourth quarter.","HBO Max, which launched in May, includes 10,000 hours of content from brands and libraries such as Warner Bros, New Line Cinema and Cartoon Network.","New movies this year, such as the upcoming “Godzilla vs. Kong,” will be released HBO Max at the same time as they debut in movie theaters, whose business has been slammed by the pandemic.","“We’ve worked tirelessly for the right to partner with the world’s best talent,” Kilar said. “Consumers are using and loving HBO Max.”","A lower-priced version of HBO Max supported by advertising will launch in the United States in June, but will not include new movie releases, Kilar said.","HBO Max will also expand internationally to 60 markets including in Latin America and Europe, the company said."
13,https://www.reuters.com/article/us-at-t-sec/u-s-sec-charges-att-executives-with-leaking-information-to-analysts-idUSKBN2AX2HJ,2021-03-05T22:35:02Z,"U.S. SEC charges AT&T, executives with leaking information to analysts",WASHINGTON (Reuters) - The U.S. Securities and Exchange Commission on Friday sued AT&T Inc and three executives for allegedly disclosing nonpublic information to research analysts to avoid falling short of quarterly expectations in 2016.,"AT&T allegedly learned in March 2016 that a steeper-than-expected decline in first quarter smartphone sales would leave the company falling short of analysts’ estimates, so the phone company’s chief financial officer directed investor relations employees to “work the analysts” to get them to lower their estimates, the SEC said in a court filing.","The SEC said investor relations executives Christopher Womack, Michael Black, and Kent Evans made private, one-on-one phone calls to analysts at approximately 20 firms, disclosing material nonpublic information in violation of securities laws.","AT&T denied the allegations in a lengthy statement published online, noting: “Not only did AT&T publicly disclose this trend on multiple occasions before the analyst calls in question, but AT&T also made clear that the declining phone sales had no material impact on its earnings.”","The firm also said its core business is selling wireless service, and a decline in equipment revenue is not material to AT&T.","Counsel for Womack, Black and Evans did not respond immediately to requests for comment.","The SEC said the leaks prompted analysts to lower their forecasts, enabling AT&T to report better-than-expected revenue when it announced quarterly results on April 26, 2016. AT&T’s share price rose 1.7% the next day.","The allegations would represent a violation of regulation that prohibits firms from disclosing significant information to securities analysts without sharing it with the public, the SEC said. The lawsuit was filed in Manhattan."
14,https://www.reuters.com/article/us-walmart-board/former-att-chief-stephenson-joins-walmart-board-idUSKBN2AX2IV,2021-03-05T22:11:44Z,Former AT&T chief Stephenson joins Walmart board,(Reuters) - Walmart Inc said on Friday it had appointed former AT&T Inc Chief Executive Officer Randall Stephenson to its board.,"Stephenson’s addition, effective March 3, will expand the retailer’s board to 12 members.","Stephenson, 60, retired as AT&T’s executive chairman in January this year, after a 38-year stint with the company and serving as its CEO.","He has previously served as chairman of the Business Roundtable, a group of CEOs from some of the biggest U.S. companies that Walmart chief Doug McMillon currently leads."
