74,https://www.reuters.com/article/us-at-t-layoffs/att-plans-to-cut-thousands-of-jobs-close-stores-company-tells-union-idUSKBN23N34I,2020-06-16T19:31:56Z,"AT&T plans to cut thousands of jobs, close stores, company tells union","(Reuters) - AT&T Inc T.N plans to cut more than 3,400 technician and clerical jobs across the country over the next few weeks, the wireless carrier told its main labor union, the Communications Workers of America, on Tuesday.","The U.S. telecom and media giant also plans to permanently close over 250 stores, which would impact about 1,300 retail jobs, the union said.",AT&T said in a statement that the novel coronavirus pandemic and lockdowns to curb the spread of infections have changed consumer behaviors.,"“With more customers shopping online, we are closing some retail stores to reflect our customers’ shopping practices,” AT&T said. “While these plans are not new, they have been accelerated by the COVID-19 pandemic.”",The company said that most employees will be offered an alternative position within the company.,"Executives, managers and union-represented employees will be affected along with non-payroll workers outside of the United States, AT&T said. The company is offering severance pay and health care for laid-off employees for the rest of the year.",The company in April pulled reut.rs/3d8coYf its financial forecast for the year due to the COVID-19 crisis and warned the current quarter would demonstrate the full impact of the nationwide stay-at-home mandates.
75,https://www.reuters.com/article/att-layoffs/att-plans-to-cut-over-3000-jobs-union-idUSL4N2DT40G,2020-06-16T18:39:49Z,"AT&T plans to cut over 3,000 jobs: Union","June 16 (Reuters) - AT&T Inc has informed Communications Workers of America of its plans to cut more than 3,400 technician and clerical jobs across the country over the next few weeks, the wireless carrier’s main labor union said on Tuesday.",AT&T did not immediately respond to a request for comment. (Reporting by Akanksha Rana in Bengaluru; Editing by Shinjini Ganguli)
76,https://www.reuters.com/article/us-at-t-divestiture/att-seeks-sale-for-warner-bros-gaming-unit-could-fetch-about-4-billion-cnbc-idUSKBN23J31I,2020-06-12T20:20:15Z,"AT&T seeks sale for Warner Bros. gaming unit, could fetch about $4 billion: CNBC","(Reuters) - AT&T Inc T.N is discussing a sale of its Warner Bros. Interactive Entertainment gaming division in a deal that could fetch about $4 billion, CNBC reported on Friday, citing people familiar with the matter.","Videogame publishers Take-Two Interactive Software Inc TTWO.O, Electronic Arts Inc EA.O and Activision Blizzard Inc ATVI.O have expressed interest in buying the gaming division that owns the popular videogame ""Mortal Kombat"", the report said here.",AT&T said it does not comment on rumor and speculation.
77,https://www.reuters.com/article/us-at-t-hbo-max/att-launches-hbo-max-vying-with-netflix-others-for-quarantine-viewing-idUSKBN2331B4,2020-05-27T17:42:53Z,"AT&T launches HBO Max, vying with Netflix, others for quarantine viewing","(Reuters) - AT&T’s WarnerMedia division launches its HBO Max streaming service on Wednesday, taking on Netflix, Disney and Amazon at a time when coronavirus lockdowns have boosted demand for streaming even as rising unemployment has cut disposable incomes.","HBO Max launches to a captive audience stuck at home without access to theater, live music, shopping excursions or live or televised sporting events. That situation helped Netflix Inc sign up 15.8 million new paying customers in the first three months of the year, more than double what it expected to attract.","But with film and TV productions halted across the globe, HBO Max has postponed dozens of releases - most notably a “Friends” reunion special originally planned for launch. If HBO Max does not resume production by this fall, the service could start to see a shortage of original content as early as January, according to a source familiar with the company.","At $15 per month, the service is more expensive than both the $7 per month Disney+ streaming service and the $13 per month standard Netflix plan. Still, WarnerMedia hopes to reach about 80 million global HBO Max subscribers by 2025.","Many existing HBO subscribers in the United States will not need to do anything to get the new service, as WarnerMedia revised deals with distributors including Apple Inc, Charter Communications Inc, Hulu and most recently, Comcast Corp.",But subscribers of HBO through Amazon.com Inc and Roku Inc are out of luck as WarnerMedia has yet to strike new agreements.,"For these and new customers, WarnerMedia is offering a promotion for subscribing directly with the company: $3 off the regular $15 price. Some AT&T customers will also get it at no additional cost.","HBO Max will feature 10,000 hours of content from WarnerMedia brands and libraries such as Warner Bros, New Line Cinema and Cartoon Network. At launch it will include sixoriginal titles, including “Love Life,” a romantic comedy anthology series featuring Anna Kendrick, and a Sesame Workshop children’s show “The Not Too Late Show with Elmo.”","More original programming will come over time, including the DC Comics film “Justice League,” recut by director Zack Snyder."
78,https://www.reuters.com/article/att-hbo-max/att-launches-hbo-max-vying-with-netflix-others-for-quarantine-viewing-idUSL1N2D81OU,2020-05-27T10:00:00Z,"AT&T launches HBO Max, vying with Netflix, others for quarantine viewing","May 27 (Reuters) - AT&T’s WarnerMedia division launches its HBO Max streaming service on Wednesday, taking on Netflix, Disney and Amazon at a time when coronavirus lockdowns have boosted demand for streaming even as rising unemployment has cut disposable incomes.","HBO Max launches to a captive audience stuck at home without access to theater, live music, shopping excursions or live or televised sporting events. That situation helped Netflix Inc sign up 15.8 million new paying customers in the first three months of the year, more than double what it expected to attract.","But with film and TV productions halted across the globe, HBO has postponed dozens of releases - most notably a “Friends” reunion special originally planned for launch. If HBO Max does not resume production by this fall, the service could start to see a shortage of original content as early as January, according to a source familiar with the company.","At $15 per month, the service is more expensive than both the $7 per month Disney+ streaming service and the $13 per month standard Netflix plan. Still, WarnerMedia hopes to reach about 80 million global HBO Max subscribers by 2025.","Many existing HBO subscribers in the United States will not need to do anything to get the new service, as WarnerMedia revised deals with distributors including Apple Inc, Charter Communications Inc, Hulu and Alphabet Inc’s Google and YouTube TV.","But subscribers of HBO through Comcast Corp, Amazon.com Inc and Roku Inc are out of luck as WarnerMedia has yet to strike new agreements.","For these and new customers, WarnerMedia is offering a promotion for subscribing directly with the company: $3 off the regular $15 price. Some AT&T customers will also get it at no additional cost.","HBO Max will feature 10,000 hours of content from WarnerMedia brands and libraries such as Warner Bros, New Line Cinema and Cartoon Network. At launch it will include six original titles, including “Love Life,” a romantic comedy anthology series featuring Anna Kendrick, and a Sesame Workshop children’s show “The Not Too Late Show with Elmo.”","More original programming will come over time, including the DC Comics film “Justice League,” recut by director Zack Snyder. (Reporting by Helen Coster in New York. Editing by Kenneth Li and David Gregorio)"
79,https://www.reuters.com/article/us-at-t-hbo-max-media/hbo-max-announces-more-launch-partners-no-deals-yet-with-amazon-comcast-roku-idUSKBN22W2II,2020-05-20T16:08:56Z,"HBO Max announces more launch partners; no deals yet with Amazon, Comcast, Roku","(Reuters) - HBO Max, the forthcoming streaming service from AT&T Inc-owned WarnerMedia, announced on Wednesday several new partners will carry its content, but it has not yet announced deals with Comcast Corp, Amazon.com Inc or Roku Inc.","HBO Max will be available on Altice USA Inc, Cox Communications, Microsoft Corp, National Cable Television Cooperative (NCTC), Samsung, Sony Interactive Entertainment and Verizon Communications Inc when it launches on May 27, the company said.","The company had previously announced distribution deals with Apple Inc, Charter Communications Inc, Hulu and Alphabet Inc’s Google and YouTube TV.",HBO Max is launching at a time when demand for new content is high - as more people are staying home due to the coronavirus - but consumers’ income may have taken a hit as a result of the pandemic. The service will cost $15 per month for non-AT&T customers; WarnerMedia is also offering lower-cost promotional deals and has said HBO Max will be free to some AT&T customers at launch.,"HBO Max will enter a crowded streaming landscape dominated by Netflix Inc, Walt Disney Co-owned Disney+, and Amazon Prime Video. It will include 10,000 hours of content from WarnerMedia brands and libraries such as Warner Bros, New Line Cinema and Cartoon Network. At launch it will include six original titles, including the underground ballroom dance competition series “Legendary” and a Sesame Workshop children’s show “The Not Too Late Show with Elmo.”"
80,https://www.reuters.com/article/us-at-t-venezuela/att-shuts-venezuela-subscription-tv-unit-citing-u-s-sanctions-idUSKBN22V227,2020-05-20T11:52:25Z,"AT&T shuts Venezuela subscription TV unit, citing U.S. sanctions","(Reuters) - AT&T Inc T.N said on Tuesday it was shutting its DirecTV subscription access to Venezuela due to U.S. sanctions, cutting off a key source of entertainment for millions of people stuck in their homes under a strict coronavirus quarantine.","DirecTV was the country’s most popular television service, providing a range of foreign channels as alternatives to the country’s beleaguered local television industry that has been battered by a hyperinflationary economic crisis.","U.S. sanctions meant to force President Nicolas Maduro from office prohibit companies from contracting with state agencies, but local Venezuelan laws require subscription services to carry channels run by the government.","“Because it is impossible for AT&T’s DIRECTV unit to comply with the legal requirements of both countries, AT&T was forced to close its pay TV operations in Venezuela,” the company said in a statement.",Venezuela’s information ministry did not immediately reply to a request for comment.,"Some users reported seeing their screens go blank, while others said they continued to receive foreign channels but no local ones. It was not immediately evident how long it would take for the closure to take effect.","DirecTV has for years been a mainstay of poor neighborhoods in Venezuela, where the company’s antennas were often visible on the zinc roofs of low-income cinder-block houses.","“I don’t like these Venezuelan channels, it’s all politics,” said Aura Leon, a homemaker in Catia, a working class area of Caracas. “I called my son ... and he told me what was happening, that DirecTV wasn’t going to exist anymore, and I was in shock.”"
81,https://www.reuters.com/article/att-venezuela/att-closes-its-paytv-service-in-venezuela-amid-u-s-sanctions-idUSL4N2D13B2,2020-05-19T13:48:11Z,AT&T closes its payTV service in Venezuela amid U.S. sanctions,May 19 (Reuters) - AT&T Inc said on Tuesday it has closed its DirecTV Latin America operations in Venezuela amid sanctions by the United States on the country.,"The sanctions prohibited it from broadcasting channels that were essential to providing its pay TV services in Venezuela, the wireless carrier said.",The United States has been slapping sanctions on Venezuela in a pressure campaign aimed at ousting President Nicolas Maduro.,AT&T said the decision to close operations was made by its U.S. team without any participation from the pay TV’s Venezuela team.
82,https://www.reuters.com/article/att-lawsuit/att-wins-dismissal-of-lawsuit-by-ex-time-warner-shareholders-over-merger-disclosures-idUSL1N2CO1HV,2020-05-06T18:34:50Z,AT&T wins dismissal of lawsuit by ex-Time Warner shareholders over merger disclosures,AT&T Inc won the dismissal of a lawsuit by former Time Warner Inc shareholders who said it failed to disclose serious deterioration in its DirecTV and DirecTV Now businesses before the companies’ $85 billion merger in June 2018.,"In a decision on Tuesday, Justice Barry Ostrager of the state supreme court in Manhattan said DirecTV and DirecTV Now were not material to AT&T at the time of the offering documents, and that the documents made no specific representations about them aside from their alleged “strong launch.”","To read the full story on Westlaw Practitioner Insights, click here: bit.ly/3bcbAAJ"
83,https://www.reuters.com/article/us-at-t-warnermedia/att-brings-ad-unit-xandr-under-warnermedia-ahead-of-hbo-max-launch-idUSKBN22C2SI,2020-04-30T16:32:29Z,AT&T brings ad unit Xandr under WarnerMedia ahead of HBO Max launch,"(Reuters) - AT&T Inc T.N said on Thursday it will bring its advertising unit Xandr under its WarnerMedia label, which is set to launch its streaming channel HBO Max in May.",The move comes two months after Xandr Chief Executive Office Brian Lesser resigned from the company.,"AT&T launched Xandr in 2018 to offer partners a better way to target ads to consumers using data collected from phone, internet and TV services.",Xandr also has partnered with Walt Disney Co DIS.N and AMC Networks to make it easier for advertisers to buy TV commercials across the networks.
84,https://www.reuters.com/article/us-media-streaming-hbo-max/hbo-max-streaming-service-to-be-available-on-google-platforms-at-launch-idUSKBN22B2WN,2020-04-29T18:42:20Z,HBO Max streaming service to be available on Google platforms at launch,"(Reuters) - HBO Max, the upcoming streaming service from AT&T Inc owned WarnerMedia, will be available across Google platforms and devices when it launches on May 27, the company said on Wednesday.","HBO Max is entering a crowded streaming landscape dominated by Netflix Inc, Walt Disney Co’s Disney+, and Amazon.com Inc’s Prime Video.","Customers in the United States will be able to access the service on Android phones and tablets, Android TV devices, and Chromebooks at launch, WarnerMedia said.",AT&T had previously said it would make HBO Max free to some customers at launch. The service will cost $15 per month for non-AT&T customers.
85,https://www.reuters.com/article/us-media-streaming-hbo-max/hbo-max-streaming-service-will-be-available-on-apple-devices-at-may-27-launch-idUSKCN2292I7,2020-04-27T17:11:45Z,HBO Max streaming service will be available on Apple devices at May 27 launch,"(Reuters) - HBO Max, the forthcoming streaming service from AT&T Inc.-owned WarnerMedia, will be available on Apple Inc. devices when it launches on May 27, the company said on Monday.","Customers will be able to access HBO Max on the iPhone, iPad and iPod touch devices, as well as the Apple TV 4K and Apple TV HD. Customers with second- and third-generation Apple TV models will be able to stream HBO Max content from their iPhone or iPad to their TV with AirPlay.","Those who previously subscribed to HBO through Apple TV channels will be able to log in and access the HBO Max app at no additional charge, the company said. New HBO Max customers will be able to subscribe directly in the app.",AT&T had previously said it would make HBO Max free to some customers at launch. The service will cost $15 per month for non-AT&T customers.,"HBO Max will enter a crowded streaming landscape dominated by Netflix Inc, Walt Disney Co-owned Disney+, and Amazon.com Inc’s Prime Video. It will include 10,000 hours of content from WarnerMedia brands and libraries such as Warner Bros, New Line Cinema and Cartoon Network."
86,https://www.reuters.com/article/us-at-t-ceo/att-names-new-ceo-as-trump-gloats-over-changes-at-cnn-owner-idUSKCN2262A7,2020-04-24T18:37:00Z,AT&T names new CEO as Trump gloats over changes at CNN owner,"(Reuters) - Veteran John Stankey will take over as AT&T T.N chief executive officer, the company said on Friday, as the U.S. telecommunications and media giant grapples with the impact of the coronavirus outbreak and its late entrance into the global streaming wars.","Stankey will take over on July 1 from Randall Stephenson, who said on Friday he will retire from the CEO position but will serve as executive chairman of the board until January 2021.","The announcement, made during AT&T’s virtual annual shareholder meeting, drew a sharp response from U.S. President Donald Trump, who tweeted it was “great news” that Stephenson was leaving.","“Anyone who lets a garbage “network” do and say the things that CNN does, should leave ASAP. Hopefully replacement will be much better!” he wrote.","Stankey oversaw WarnerMedia after AT&T’s $85 billion purchase of media company Time Warner, as well as the creation of HBO Max, the new streaming service that will launch May 27. He was also promoted to COO last year.",The success of HBO Max will be a big test of Stankey's role as AT&T hopes to compete with streaming giants like Netflix IncNFLX.O and Walt Disney Co'sDIS.N Disney+.,"AT&T, which faced some criticism from HBO fans and the creative community, is betting the service can achieve wider appeal with hit shows like “Friends” while hanging onto more sophisticated audiences with “Succession” and similar shows.","AT&T’s board reviewed both external and internal candidates for the CEO role as part of a succession planning process started in 2017, Stephenson said.","“After an extensive evaluation, it was clear that John Stankey was the right person to lead AT&T into the future,” he said.","New York-based activist investor Elliott Management called for a shake-up at AT&T last fall, urging the company to end its buying spree and improve its operating businesses. The hedge fund also questioned Stankey’s leadership skills and AT&T’s desire to promote him to the top role.","By late October, AT&T struck a truce with Elliott and unveiled a three-year plan that included selling up to $10 billion worth of businesses, paying off debt and adding two new board members.",Elliott said Friday it supports Stankey’s appointment to CEO.,"“We have been engaged with the company throughout the search process, which was a robust one, including a range of highly qualified outside candidates and overseen by independent directors,” said Jesse Cohen, a partner at Elliott Management. “We look forward to working with John as he begins his term as CEO.”","A continuing challenge for Stankey will be to stitch together AT&T’s media business with its phone, TV and internet products, to create an advertising powerhouse. Brian Lesser, who led AT&T advertising unit Xandr, resigned last month.","“My commitment is, you’ll get my best from me every day,” Stankey said.","His appointment should come as no surprise, one investor said. “Stankey has been running the company for at least the past few months. This has been well telegraphed to the market,” said Sam Hendel, president and a co-portfolio manager at investment firm Levin Easterly, which owns 1.93 million AT&T shares.","On Wednesday, AT&T pulled its financial forecast for the year and said the coronavirus pandemic clouded its view for the foreseeable future.",AT&T shares were down marginally at $29.45 in afternoon trading.
87,https://www.reuters.com/article/att-ceo/corrected-update-2-att-announces-john-stankey-will-become-ceo-on-july-1-idUSL2N2CC0T4,2020-04-24T16:32:58Z,CORRECTED-UPDATE 2-AT&T announces John Stankey will become CEO on July 1,"(Corrects penultimate paragraph to show Levin Easterly two words; holds 1.93 million shares of AT&T, not $1.93 million worth of shares)","April 24 (Reuters) - Veteran John Stankey will take over as AT&T chief executive officer, the company announced on Friday, as the U.S. telecommunications and media giant grapples with the impact of the coronavirus outbreak and its entrance into the global streaming wars.","Stankey will take over on July 1. Randall Stephenson, AT&T’s current CEO, said Friday he will retire, but will serve as executive chairman of the board until January 2021.",The announcement was made during AT&T’s virtual annual meeting.,Stankey oversaw WarnerMedia after AT&T’s $85 billion purchase of media company Time Warner. He was promoted to COO last year.,"“After an extensive evaluation, it was clear that John Stankey was the right person to lead AT&T into the future,” Stephenson said.","New York-based activist investor Elliott Management called for a shake-up at AT&T last fall, urging the company to end its buying spree and improve its operating businesses. The hedge fund also questioned Stankey’s leadership skills and AT&T’s desire to promote him into the top role.","By late October, AT&T had unveiled a three-year plan that included selling up to $10 billion worth of businesses, paying off debt and adding two new board members.",Elliott said Friday it supports Stankey’s appointment to CEO.,"“We have been engaged with the company throughout the search process, which was a robust one, including a range of highly qualified outside candidates and overseen by independent directors,” said Jesse Cohen, a partner at Elliott Management. “We look forward to working with John as he begins his term as CEO.”","“My commitment is, you’ll get my best from me every day,” Stankey said.",President Donald Trump tweeted it was “great news” that Stephenson was leaving.,"“Anyone who lets a garbage “network” do and say the things that CNN does, should leave ASAP. Hopefully replacement will be much better!” he wrote.","The move should come as no surprise, one investor said. “Stankey has been running the company for at least the past few months. This has been well telegraphed to the market,” said Sam Hendel, president and a co-portfolio manager at investment firm Levin Easterly, which owns 1.93 million shares of AT&T.","AT&T shares were down marginally at $29.39 in morning trading. (Reporting by Sheila Dang; additional reporting by Helen Coster and Svea Herbst-Bayliss Editing by Kenneth Li, Chizu Nomiyama and Jonathan Oatis)"
88,https://www.reuters.com/article/att-ceo/att-announces-john-stankey-will-become-ceo-on-july-1-idUSL2N2CC0RL,2020-04-24T14:28:05Z,AT&T announces John Stankey will become CEO on July 1,"April 24 (Reuters) - AT&T Inc said Friday that Chief Operating Officer John Stankey will take over as chief executive officer, effective July 1.",The announcement was made during AT&T’s annual meeting. (Reporting by Sheila Dang Editing by Chizu Nomiyama)
