176,https://www.reuters.com/article/us-at-t-mexico-lawsuit/atts-mexico-unit-loses-class-action-lawsuit-to-consumer-watchdog-idUSKCN1SG2K7,2019-05-11T02:30:43Z,AT&T's Mexico unit loses class action lawsuit to consumer watchdog,"MEXICO CITY (Reuters) - Mexico’s consumer watchdog, Profeco, said on Friday it won a class-action lawsuit against the local unit of U.S. telecommunications giant AT&T Inc for undue charges and poor service.","Profeco said that in 2013 it sued telecommunications operator Nextel, which was acquired by AT&T in 2015, for undue charges, changing rates without informing customers and continuing to charge clients for services that had been canceled.","Nextel offered 4G technology on its website though “it was proven in court the technology provided was inferior to what was advertised, underscoring the use of abusive and false advertising to prompt consumers into mistakenly acquiring their services,” Profeco said in a statement.","Profeco said AT&T, Mexico’s third-largest mobile service provider, “must pay damages to its affected consumers, plus 20% compensation and an additional 9% annual legal interest, for the various undue charges.”",It did not estimate how much that could mean AT&T will have to pay.,The sentence is final after Mexico’s Supreme Court rejected a prior appeal filed by the company.,"“These trials began well before AT&T entered the market, as part of a class action suit presented against all wireless companies in Mexico, including Nextel, which we acquired in 2015,” AT&T said in a statement. “We continue working to serve our customers in better ways.”"
177,https://www.reuters.com/article/us-at-t-results/att-misses-revenue-estimates-as-pay-tv-subscribers-bleed-away-idUSKCN1S01AT,2019-04-24T15:34:03Z,AT&T misses revenue estimates as pay-TV subscribers bleed away,"(Reuters) - AT&T Inc’s first-quarter revenue fell short of Wall Street estimates on Wednesday after it lost subscribers in nearly all of its main businesses except wireless, where it paid heavily to gain customers through price promotions.","AT&T lost a net 544,000 premium TV subscribers, a category that includes DirecTV satellite and U-verse television customers. Analysts had expected a loss of 385,000 customers across DirecTV and U-verse, according to research firm FactSet.","Pay-TV providers have struggled to keep customers as viewers move to streaming services like Netflix Inc. AT&T has launched its own streaming service, but that too lost customers in the quarter.",Total revenue for the quarter rose nearly 18 percent to $44.83 billion but fell short of expectations of $45.11 billion.,"Revenue in AT&T’s wireless business was hurt by aggressive smartphone promotions. The company has tried to reduce its dependency on its phone business, which now brings in roughly 40 percent of total operating revenue, by adding media content through its $85 billion acquisition of Time Warner.","“Altogether, AT&T’s collection of assets remains challenged,” Jonathan Chaplin, an analyst with New Street Research, said in a note on Wednesday. AT&T’s business wireline segment saw declines in the top and bottom line, and even WarnerMedia trends “were just okay,” Chaplin wrote.","AT&T’s WarnerMedia unit, which includes Turner and premium TV channel HBO, reported revenue of $8.38 billion in the quarter, but that was short of analysts’ estimates of $8.45 billion, according to IBES data from Refinitiv.","The company added a net 80,000 phone subscribers, beating analysts’ forecast of a loss of 44,000 subscribers, as it leaned on the smartphone promotions to combat competition in a saturated U.S. market.","But Mobility, AT&T’s largest segment and which includes its wireless business, had revenue of $17.57 billion during the quarter, missing estimates of $17.65 billion, as those promotions hurt revenue for the unit.",AT&T shares were down 3.9 percent at $30.84 on Wednesday.,"Postpaid phone churn, or the rate of customer defections, was 0.93 percent during the first quarter, up from 0.84 percent in the previous year.","AT&T’s entertainment segment, which includes satellite TV provider DirecTV, has been in continuous decline. Revenue from the segment fell nearly 1 percent to $11.33 billion.","AT&T also continued to lose subscribers for its DirecTV Now streaming service, which shed a net 83,000 customers during the quarter as viewers abandoned the service after their introductory price promotion plans ended.","“AT&T’s first-quarter earnings give a clear signal that the company is willing to compromise on growth in the short term as it struggles to cut its heavy load of debt,” said Haris Anwar, senior analyst at Investing.com.",“And it’s a wise thing to do considering the market is very concerned about the company’s balance-sheet risk.”,"AT&T’s Latin America segment had revenue of $1.7 billion during the quarter, down from $2 billion in the year-ago quarter. AT&T said the segment lost $551 million due to foreign exchange pressures.","The carrier has focused on paying down its debt after the purchase of Time Warner. The company paid off $2.3 billion during the first quarter, and net debt now stands at $169 billion.","On Tuesday, AT&T announced it would sell office space at Hudson Yards in New York City for $2.2 billion, which it plans to use to pay down debt.",AT&T previously received $1.43 billion by selling its stake in streaming service Hulu back to the company.,"Verizon Communications Inc, an AT&T rival, raised its 2019 profit forecast and beat Wall Street estimates for quarterly profit on Tuesday, although it lost more phone subscribers than analysts had expected.","Net income attributable to AT&T fell to $4.1 billion, or 56 cents per share, from $4.66 billion, or 75 cents per share, a year earlier. Excluding items, the company earned 86 cents per share, in line with estimates."
178,https://www.reuters.com/article/us-usa-property-warnermedia-hudsonyards/related-to-buy-atts-warnermedia-headquarters-for-2-2-billion-idUSKCN1S0064,2019-04-24T14:05:33Z,Related to buy AT&T's WarnerMedia headquarters for $2.2 billion,"NEW YORK (Reuters) - Developer Related Companies said on Tuesday one of its affiliates has agreed to buy the global headquarters of AT&T’s WarnerMedia in Manhattan for about $2.2 billion, in one of the city’s most expensive commercial real estate deals.","The affiliate has entered into a contract expected to close late in the second quarter for WarnerMedia’s offices spanning 26 floors at 30 Hudson Yards, Related said in a statement.","Related will enter into a long-term lease-back until early 2034 for the space of about 1.5 million square feet (139,355 meters) in an office tower that has the highest observation deck in the Western Hemisphere.",Hudson Yards is a new $25 billion complex of commercial and residential skyscrapers built on Manhattan’s far west side above the rail yards.,"Related won bidding to buy WarnerMedia’s stake, as Reuters reported earlier this month. WarnerMedia, formerly Time Warner, became a partner in the building’s development in 2014.",AT&T has sought to cut its debt by about $20 billion in 2019 after last year’s $85 billion takeover of Time Warner.,"A team led by Doug Harmon at brokerage Cushman & Wakefield represented WarnerMedia in the transaction, the most expensive in Manhattan since the sale of Chelsea Market to Alphabet Inc’s Google last year for $2.4 billion in a deal Harmon also handled.","(This story corrects last paragraph to say WarnerMedia, not Related)"
179,https://www.reuters.com/article/att-results/att-posts-surprise-gain-in-quarterly-wireless-phone-subscribers-idUSL3N22630E,2019-04-24T10:59:09Z,AT&T posts surprise gain in quarterly wireless phone subscribers,"April 24 (Reuters) - AT&T Inc on Wednesday posted a surprise gain in first quarter net wireless subscribers who pay a monthly bill, as it rolled out a series of price-cut promotions for smartphones.","The second-largest U.S. wireless carrier by subscribers added a net 80,000 phone subscribers, while analysts were expecting a loss of 44,000 subscribers, according to research firm FactSet.","Total revenue rose to $44.83 billion from $38.04 billion, falling short of analysts’ expectations of $45.11 billion, according to IBES data from Refinitiv. (Reporting by Akanksha Rana in Bengaluru and Sheila Dang in New York; Editing by Shailesh Kuber)"
180,https://www.reuters.com/article/us-time-warner-at-t-congress/white-house-will-not-turn-over-documents-on-att-time-warner-merger-idUSKCN1RS28R,2019-04-17T02:19:13Z,White House will not turn over documents on AT&T-Time Warner merger,(Reuters) - The White House has told two U.S. House Democrats it will not turn over documents that could show whether Republican President Donald Trump sought to intervene in the regulatory review of AT&T Inc’s $85 billion acquisition of Time Warner Inc.,"In March, House Judiciary Committee Chairman Jerrold Nadler and Representative David Cicilline, who chairs a panel overseeing antitrust issues, asked the White House and Justice Department to turn over records after The New Yorker magazine reported Trump directed then-National Economic Council Director Gary Cohn to use the Justice Department to block the deal.","The pair wrote that if accurate, Trump’s involvement would “constitute a grave abuse of power.” In February, a federal appeals court upheld a lower-court ruling rejecting a Justice Department challenge to the deal filed in November 2017.","Trump criticized the deal as a candidate in late 2016, saying it would concentrate too much media power in the hands of one owner, and later saying it would raise prices. He has also frequently attacked CNN, a Time Warner property now owned by AT&T, for what he sees as negative coverage of his campaign and administration.","In a letter dated Monday and released on Tuesday by Cicilline, White House counsel Pat Cipollone declined to release any documents, saying he would not provide “protected communications between the president and his senior advisers that are the very core of the executive branch’s confidentiality interests.”",Cipollone added that the Justice Department would be responding “in due course.”,"The two Democrats responded in a joint statement that “the White House Counsel has made a blanket claim that all White House communications — regardless of whether they contain evidence of improper or even unlawful activities — are protected by a cone of secrecy,” adding they would “pursue this matter.”","Makan Delrahim, the head of the Justice Department’s antitrust division, said in a 2018 declaration he had never received “orders, instructions, or directions relating” to the AT&T-Time Warner deal from Trump, Justice Department officials or White House officials.",The Justice Department said in February it would not seek further appeals to block the merger.,"In February 2018, U.S. District Judge Richard Leon rejected AT&T’s request to see White House communications that might shed light on whether Trump pressured the Justice Department to try to block the deal.","AT&T lawyers said last year the deal may have been singled out for enforcement, citing as evidence statements by Trump as a candidate and as president that the deal was bad for consumers and the country. AT&T declined comment on Tuesday."
181,https://www.reuters.com/article/us-at-t-hulu/hulu-spends-1-43-billion-to-buy-back-att-stake-values-streaming-service-at-15-billion-idUSKCN1RR2AM,2019-04-16T17:32:54Z,"Hulu spends $1.43 billion to buy back AT&T stake, values streaming service at $15 billion","(Reuters) - Hulu has bought back wireless carrier AT&T Inc’s stake in the U.S. entertainment streaming service for $1.43 billion, in a deal that values Hulu at $15 billion, the two companies said on Monday.","The sale of AT&T’s 9.5 percent stake to Hulu in a cash deal gives Walt Disney Co, which holds a 60 percent stake in Hulu via a joint venture, more control of the company.","Comcast Corp’s NBCUniversal has a 30 percent stake in Hulu. Based on the joint venture agreement, Disney and Comcast will decide how they want to allocate the shares bought from AT&T.","Hulu, which competes with Netflix Inc and Amazon.com’s Prime Video, has more than 25 million subscribers and is expected to lose $1.5 billion in the current fiscal year.","Hulu’s total value has risen from a reported $5.8 billion in 2016, when Time Warner - now a part of AT&T - bought the stake. Netflix at the time had a market capitalization of about $41 billion. Based on Monday’s stock market closing price, Netflix is valued at $152 billion.","AT&T, which is preparing to launch its own subscription streaming video service later this year, said that its unit WarnerMedia would continue to work with Hulu to deliver content over the platform. It did not give further details.","“WarnerMedia will remain a valued partner to Hulu for years to come as we offer customers the best of TV, live and on demand, all in one place,” Hulu Chief Executive Officer Randy Freer said in a statement.","AT&T said it would use the proceeds here from the deal to reduce debt, which stood at $176.5 billion at the end of 2018.",The company had said in November it could consider selling its stake in Hulu and review its non-core assets in 2019.,"The transaction did not require any governmental or other third-party approvals and was simultaneously signed and closed, Hulu and AT&T said.",Disney last week forecast Hulu’s subscribers to reach 40 million to 60 million by fiscal 2024 and for the company to become profitable in the United States by 2023 or 2024.
182,https://www.reuters.com/article/att-hulu/hulu-buys-back-atts-9-5-pct-stake-idUSL3N21X4AE,2019-04-15T21:23:09Z,Hulu buys back AT&T's 9.5 pct stake,"April 15 (Reuters) - Streaming service company Hulu is buying back wireless carrier AT&T Inc’s 9.5 percent stake in the company in a deal valued at $1.43 billion, the two companies said on Monday.",The transaction valued Hulu at $15 billion. AT&T said it will use proceeds here from the deal to cut down its debt.
183,https://www.reuters.com/article/us-at-t-hbo-europe-divestiture/att-not-planning-to-sell-hbo-europe-warnermedia-ceo-idUSKCN1RM0EI,2019-04-10T12:49:34Z,AT&T not planning to sell HBO Europe: WarnerMedia CEO,"(Reuters) - WarnerMedia Chief Executive John Stankey denied a report on Wednesday that parent company AT&T was considering selling its HBO Europe business, calling it “baseless and inaccurate”.","The Financial Times report, citing current and former senior executives, said AT&T had internally discussed selling HBO Europe as part of efforts to reduce a debt pile of $170 billion.","“We normally do not comment on speculation, but when a news outlet is advised that their reporting is factually incorrect and report it anyway, we feel compelled to set the record straight,” Stankey, who heads the newly created unit of AT&T, said in a statement.",“There is no truth whatsoever to the Financial Times’ story saying AT&T is or has considered selling HBO Europe. It’s completely baseless and inaccurate. HBO Europe is a valuable asset for our growth plans in Europe.”,The paper said that HBO Europe was one of several assets AT&T had considered selling but that it had not held formal talks with any potential buyers.,"In November, AT&T said it had committed to cutting its heavy debt load in 2019 through a variety of measures, including a review of all of its non-core assets such as its stake in streaming video company Hulu for possible sale."
184,https://www.reuters.com/article/att-hbo-europe-divestiture/att-explores-sale-of-hbo-europe-to-reduce-debt-ft-idUSL3N21S16C,2019-04-10T04:41:43Z,AT&T explores sale of HBO Europe to reduce debt - FT,"April 10 (Reuters) - AT&T has internally discussed about selling its HBO Europe business as the telecom group aims to reduce a debt pile of $170 billion, the Financial times reported, citing current and former senior executives.","Comcast-owned Sky would be an ""obvious buyer"" given its relationship with HBO, the paper said on.ft.com/2WWtl07, citing people at AT&T and HBO. Sky distributes HBO content in the UK, Germany and Italy.",HBO became part of AT&T after the telecom group closed its $85 billion acquisition of Time Warner Inc last year.,"HBO Europe is one of several assets AT&T has considered selling but has not held formal talks with any potential buyers, the paper added.","In November, AT&T said it had committed to cutting its heavy debt load in 2019 through a variety of measures, including a review of all of its non-core assets such as its stake in streaming video company Hulu for possible sale.",AT&T and Comcast did not immediately respond to requests for comment on the report. (Reporting by Philip George and Ishita Palli in Bengaluru; Editing by Gopakumar Warrier)
185,https://www.reuters.com/article/us-usa-property-warnermedia-hudsonyards/related-cos-wins-bid-in-warnermedias-office-sale-at-hudson-yards-source-idUSKCN1RD330,2019-04-01T23:42:38Z,Related Cos wins bid in WarnerMedia's office sale at Hudson Yards: source,"NEW YORK (Reuters) - Related Companies has won a bid to buy a stake in the second-tallest office building in Manhattan from AT&T’s WarnerMedia in a deal expected to top $2 billion, a source involved in the bidding said on Monday.","The winning bid for WarnerMedia’s 1.5 million square feet (139,355 meters) of space at 30 Hudson Yards, the hub of the new development on Manhattan’s far west side, was chosen last week, the source said.","AT&T, looking to cut debt after last year’s $85 billion takeover of Time Warner, plans to lease back the space at the tower, which has the highest outdoor observation deck in the Western Hemisphere jutting out from the 100th floor.","AT&T declined to comment. Doug Harmon, the broker at Cushman & Wakefield handling the transaction, declined to comment, as did Joanna Rose, a spokeswoman for Related.","The deal would be similar to Time Warner’s sale of its office space in the Time Warner Center in 2014 to Related and two sovereign wealth partners in the deal, the Abu Dhabi Investment Authority and Singapore’s GIC.","That sale allowed Time Warner to acquire its space at Hudson Yards, a $25 billion project developed by Related with Canada’s Oxford Properties that officially opened last month.","Time Warner aimed to consolidate 5,000 employees spread across seven locations into one site. WarnerMedia recently began moving into 30 Hudson Yards, the first tenant to do so.","AT&T is in the midst of a restructuring at WarnerMedia that has seen the heads of HBO, Turner Broadcasting and Warner Brothers leave this year.","AT&T’s plans for a sale and leaseback deal surfaced in January and attracted pension funds, a sovereign wealth fund and real estate investment trusts. The losing bidders have been notified, the source said.","AT&T plans this year to shave $20 billion off its net debt of $171.3 billion, as reported at the end of 2018, with debt reduction a top company priority."
186,https://www.reuters.com/article/usa-property-warnermedia-hudsonyards/atts-warnermedia-close-to-selling-hudson-yards-stake-source-idUSL1N21J0YA,2019-04-01T19:05:19Z,AT&T's WarnerMedia close to selling Hudson Yards stake -source,"NEW YORK, April 1 (Reuters) - A winning bidder has been selected for the sale of AT&T’s WarnerMedia unit’s stake in the second-tallest office building in Manhattan, a deal expected to top $2 billion, a source involved in the bidding said on Monday.","The winner, whose identity remains undisclosed, was chosen at the end of last week for WarnerMedia’s 1.5 million square feet (139,355 meters) of space at 30 Hudson Yards, the hub of the trendy development project on Manhattan’s far west side, the source said.",An announcement could come as early this week.,"AT&T, looking to cut debt after last year’s $85 billion take over of Time Warner, plans to lease back the space, the source said.","AT&T declined to immediately comment. Doug Harmon, the broker at Cushman & Wakefield handling the transaction, declined to comment.","AT&T’s plans for a sale and leaseback deal surfaced in January and attracted pension funds, a sovereign wealth fund and real estate investment trusts. The losing bidders have been notified, the source said.",The office tower is the tallest building in Hudson Yards and has the highest outdoor observation deck in the Western Hemisphere jutting out from the 100th floor.,"The $25 billion project, which officially opened last month, has been developed by Related Cos and Canada’s Oxford Properties."
187,https://www.reuters.com/article/us-at-t-viacom/viacom-att-renew-contract-avoid-directv-blackout-idUSKCN1R613V,2019-03-25T18:02:20Z,"Viacom, AT&T renew contract, avoid DirecTV blackout","(Reuters) - Viacom Inc has renewed its carriage contract with AT&T Inc, avoiding a blackout of MTV, Nickelodeon and Comedy Central for users of the telecom carrier’s pay TV service DirecTV, the companies said on Monday.","Viacom needed to resolve the AT&T contract before considering any other strategic moves including a potential tie-up with CBS Corp, sources told Reuters on Friday.","Shares of Viacom rose nearly 4 percent to $26.30 before the opening bell, while those of AT&T were marginally higher.","“We are pleased to announce a renewed Viacom-AT&T contract that includes continued carriage of Viacom services across multiple AT&T platforms and products,” the companies said.","The initial deadline to reach a new contract was by midnight of March 22. The companies, however, continued to negotiate past the deadline.",Such conflicts have become increasingly common as media companies consolidate and viewers shift from traditional pay TV services to streaming services such as Netflix Inc and Amazon.com Inc’s Prime Video.,"In November, AT&T-owned premium cable network HBO stopped being carried on Dish’s satellite television service after failing to reach a new deal and has not returned to the service.","Last week, Viacom accused the wireless carrier of abusing its powers after buying Time Warner Inc.","AT&T has said Viacom’s channels are no longer as popular as they once were, and accused them of being a “serial bad actor” in contract renewal negotiations.","AT&T is Viacom’s largest distributor, representing 24.5 million total video subscribers, and was responsible for about 15 percent of Viacom’s 2018 revenue."
188,https://www.reuters.com/article/att-viacom/viacom-renews-contract-with-att-to-continue-airing-channels-on-directv-idUSL3N21C2N7,2019-03-25T10:53:16Z,Viacom renews contract with AT&T to continue airing channels on DirecTV,"March 25 (Reuters) - Viacom Inc has renewed its contract with AT&T Inc, avoiding a blackout of MTV, Nickelodeon and Comedy Central for DirecTV users, the companies said on Monday.","Viacom needed to resolve the AT&T contract before considering any other strategic moves including a potential tie-up with CBS Corp, sources told Reuters on Friday.","“We are pleased to announce a renewed Viacom-AT&T contract that includes continued carriage of Viacom services across multiple AT&T platforms and products,” the companies said. (Reporting by Vibhuti Sharma in Bengaluru Editing by Saumyadeb Chakrabarty)"
189,https://www.reuters.com/article/us-att-viacom/att-viacom-continue-contract-negotiations-past-deadline-idUSKCN1R406V,2019-03-23T06:11:30Z,"AT&T, Viacom continue contract negotiations past deadline","(Reuters) - MTV, Nickelodeon, Comedy Central and other Viacom Inc channels were still available on AT&T Inc’s DirecTV satellite TV service on early Saturday morning as the companies continued to hash out a new carriage contract.","It was not immediately clear if a deal could be reached, sources briefed on the matter said. AT&T and Viacom declined to comment.","The previous contract, in which AT&T paid Viacom about $1 billion in fees annually, expired at midnight Friday. Failing to reach a deal means Viacom channels would not be available to AT&T’s 24.5 million customers.",These types of conflicts have become increasingly common amid waves of media consolidation and the migration of viewers from traditional pay television services to streaming TV services such as Netflix and Amazon.,"The current discussions have weighed on any potential tie-up of CBS Corp and Viacom, both of which are controlled by the Redstone family’s National Amusements Inc.",Viacom had begun warning AT&T subscribers on Tuesday that its channels could stop being shown on the DirecTV service if it failed to reach a new contract by midnight on March 22.,"Viacom, owner of MTV, Nickelodeon, BET and Comedy Central, accused AT&T of abusing its powers after buying Time Warner Inc, which owns the Warner Bros Hollywood studios and HBO premium cable network.",AT&T has said Viacom channels are no longer as popular as they once were and accused them of being a “serial bad actor” in contract renewal negotiations.
