260,https://www.reuters.com/article/us-usa-commerce-at-t/u-s-government-watchdog-examines-oversight-of-atts-emergency-broadband-contract-idUSKBN1JO34B,2018-06-28T20:46:04Z,U.S. government watchdog examines oversight of AT&T's emergency broadband contract,"WASHINGTON (Reuters) - The U.S. Commerce Department's Inspector General has opened an audit into the federal government's supervision of a multi-billion dollar contract granted to AT&T Inc T.N, the world's largest telecommunications company, to build a long-awaited nationwide broadband network for emergency responders.","Carol Rice, assistant inspector general for audit and evaluation, said in a memo published on May 3 this year that her office was reviewing how well the department’s First Responder Network Authority, also known as FirstNet, was carrying out its mandate to create and run a new national emergency responders network.","The network, which authorities have been considering since the Sept. 11 attacks on New York and Washington, is supposed to provide vast new capacity for communication among emergency officials and crews.","The contract to build and run the network was awarded to AT&T in March 2017, but within communications industry and among emergency responders the contract has generated controversy.",Critics have questioned the need for a large new network and also how well other companies’ networks and AT&T’s new network operate together.,The AT&T project is financed by $7 billion from federal government auctions of broadcast spectrum and another $40 billion from AT&T.,"The audit aims to determine whether FirstNet “properly administered” a departmental task order covering the deployment, operation and maintenance of the new emergency network, Rice said in her memo. The audit is expected to take about a year.",Government and AT&T officials involved with the contract said the inspector general’s audit was routine.,"Verizon Communications Inc VZ.N, the world's largest wireless telecommunications company and AT&T's main rival, Verizon did not bid on the contract but has said it has already set aside considerable capacity for emergency use.","At a industry conference in March this year, Mike Maiorana, a Verizon senior vice president, said Verizon covers 400,000 more square miles than AT&T. “And we’re already working with our public-safety customers to build the solutions they need,” he said. In comments to Reuters this week, Maiorana reaffirmed his comments about Verizon’s capacity and its public safety customers.","This week government and AT&T officials told Reuters that the new network’s core is already operational in all U.S. states. AT&T’s contract gives it up to five years to construct further infrastructure for the network, including new towers and hanging new equipment on existing towers.","The officials also said this week that one way AT&T will pay for its $40 billion investment is by charging ordinary broadband users for commercial access to the network when it is not being used for emergencies. The new network is designed to rapidly preempt routine traffic to free bandwidth for emergency use, they said.",In an email to Reuters on Thursday AT&T said the new network would be fully interoperable with existing networks.,"“FirstNet is being built on open industry standards,” AT&T said. “So that means first responders on FirstNet will be able to seamlessly communicate with customers on commercial core networks from AT&T, Verizon, Sprint or T-Mobile, and vice versa.”",A spokeswoman for FirstNet said: “The FirstNet Core is built on physically separate hardware for a highly secure network. It separates public safety traffic from commercial traffic and provides them an always-on connection with priority and preemption.”
261,https://www.reuters.com/article/att-settlement/att-to-pay-5-25-million-to-settle-u-s-probe-into-911-call-outages-idUSL1N1TU1TE,2018-06-28T19:50:15Z,AT&T to pay $5.25 million to settle U.S. probe into '911' call outages,"WASHINGTON, June 28 (Reuters) - AT&T Inc will pay $5.25 million to settle a U.S. investigation after two outages in 2017 prevented about 15,000 callers from making emergency “911” calls, documents show.",The Federal Communications Commission said Thursday AT&T had agreed to make changes to reduce the likelihood and impact of future 911 outages and improve notifying 911 call centers of outages.,AT&T said it has “taken steps to prevent this from happening again.”,The FCC said the 911 service outages were the result of planned network changes implemented by AT&T inadvertently interfering with the company’s routing of 911 calls. (Reporting by David Shepardson; Editing by Lisa Shumaker)
262,https://www.reuters.com/article/us-appnexus-m-a-at-t/att-to-buy-online-ad-exchange-firm-appnexus-idUSKBN1JL1FR,2018-06-25T15:41:39Z,AT&T to buy online ad exchange firm AppNexus,"(Reuters) - AT&T Inc T.N said on Monday it would buy online advertisement exchange company AppNexus Inc, less than a month after the No. 2 U.S. wireless carrier closed its $85 billion deal to acquire media company Time Warner Inc TWX.N.","AT&T did not disclose the AppNexus deal value. The Wall Street Journal, citing sources, reported last week the company was in talks to buy AppNexus for about $1.6 billion.","AppNexus, which runs a digital platform for advertisers to purchase online ads, will become part of AT&T advertising & analytics, as the U.S. telecom company aims to expand its online advertising to better compete with Alphabet Inc's GOOGL.O Google and Facebook Inc FB.O.","The company will start selling targeted ads for Turner networks such as TNT and CNN “in short order,” John Stankey, chief executive of newly named AT&T unit WarnerMedia had said last week.","“Think of this as buying a sofa to furnish the new house (Time Warner) they just bought,” said Moffett Nathanson analyst Craig Moffett, adding that AppNexus will add muscle to AT&T’s strategy of making its ads more targeted.","New York-based AppNexus, which claims over 11.4 billion impressions transacted daily, extends AT&T’s advertising and analytics’ footprint into Asia-Pacific, Australia, Europe, and Latin America, the company said.","“AppNexus would provide the company with one of the largest digital ad exchanges,” Barclays analyst Amir Rozwadowski said in a note.","The acquisition also adds to AT&T’s ad-supported premium video content portfolio including WarnerMedia’s Turner Networks and Otter Media, the company said.","Last week, AT&T revealed its plans for fewer commercials while using mobile phone and video data supplied by customers who have given permission to sell targeted advertisements.","“AT&T currently has two minutes of ad space per TV hour to sell on satellite service DirecTV. Time Warner’s Turner cable channels, which include CNN, TNT and TBS, will give it about 14 more minutes per hour,” Rozwadowski said.",The transaction is expected to close in the third quarter of 2018.
263,https://www.reuters.com/article/deals-day/deals-of-the-day-mergers-and-acquisitions-idUSL4N1TR426,2018-06-25T13:40:36Z,Deals of the day-Mergers and acquisitions,"(Adds AT&T, Gray Television, Diageo)","June 25 (Reuters) - The following bids, mergers, acquisitions and disposals were reported by 1338 GMT on Monday:","** Gray Television Inc said it would buy privately held rival broadcaster Raycom Media Inc in a cash-and-stock deal valued at $3.65 billion, in a push to move into more local television markets and attract additional advertising.","** Education Realty Trust Inc, an owner of collegiate housing communities, said it would be acquired by an affiliate of Greystar Real Estate Partners for about $4.6 billion, including debt.","** Enel agreed a deal that could see it spend more than 2 billion euros ($2.3 billion) to buy Latin American fiber company Ufinet International, as the Italian company looks to advance its ultrafast broadband ambitions.","** Diageo Plc, the world’s largest spirits company, said it had proposed a partial tender offer to Chinese liquor company Sichuan Shuijingfang Company to raise its stake to up to 60 percent in the company.","** AT&T Inc said it would buy online advertisement exchange company AppNexus Inc, less than a month after the No. 2 U.S. wireless carrier closed its $85 billion deal to acquire media company Time Warner Inc.","** French outdoor advertising company JC Decaux said it was still in talks with Australian billboard firm APN Outdoor Group over its offer to buy APN, currently worth around $810 million.","** Australia’s Gateway Lifestyle Group said it received a sweetened A$713.8 million ($531 million), or A$2.35 a share, takeover offer from Hometown Australia Holdings Pty Ltd and Hometown America Communities Limited Partnership.","** The Czech anti-monopoly office UOHS has cleared Chinese state-owned CITIC Group Corporation’s takeover of most of the Czech-based assets held by China’s struggling conglomerate CEFC, the watchdog said.","** EDP-Energias de Portugal Chief Executive Officer Antonio Mexia is touring London, Beijing and New York as he tries to convince investors that a takeover bid offered by China Three Gorges is too low while EDP seeks clarification from the bidder.","** Andritz has agreed to buy U.S. machine industry company and supplier Xerium Technologies in a cash deal worth roughly $833 million, the Austrian engineering group said.",** South African healthcare provider Ascendis Health said it plans to dispose of smaller local non-core businesses as part of a strategic review aimed at improving cash generation and enhancing profitability. (Compiled by Karan Nagarkatti in Bengaluru)
264,https://www.reuters.com/article/appnexus-ma-att/att-to-buy-online-ad-exchange-firm-appnexus-idUSL4N1TR494,2018-06-25T12:14:06Z,AT&T to buy online ad exchange firm AppNexus,June 25 (Reuters) - AT&T Inc said on Monday it would acquire online advertisement exchange company AppNexus Inc.,"AppNexus will become a part of AT&T advertising & analytics, as U.S. telecom company aims to grow its digital advertising in order to combat Alphabet Inc’s Google and Facebook Inc.","AT&T did not disclose the deal value. However, it is expected to be $1.6 billion, the Wall Street Journal reported here, citing sources last week. (Reporting by Sonam Rai in Bengaluru; Editing by Maju Samuel)"
265,https://www.reuters.com/article/us-at-t-video/att-to-launch-wireless-plans-bundled-with-video-after-time-warner-win-idUSKBN1JH1AA,2018-06-21T17:07:40Z,AT&T to launch wireless plans bundled with video after Time Warner win,"(Reuters) - AT&T Inc T.N will launch two new unlimited wireless plans next week that will be bundled with a new video streaming service called WatchTV, in the company's first move to pair entertainment with phone service after closing its $85 billion acquisition of media company Time Warner Inc.","The No. 2 U.S. wireless carrier is putting to use Time Warner’s stable of content, including TV channels like TBS and CNN, to drive sales of the wireless plans at a time when carriers have struggled to find growth.","“This is the first step to transforming how content is created, distributed and consumed,” David Christopher, president of AT&T mobility and entertainment, said in an interview.","WatchTV, which will have over 30 live channels but no sports or local news channels, will be free for customers of the new wireless plans. It will cost $15 per month as a standalone product. Customers who sign up for the higher-priced wireless plan can also get HBO for free, the premium TV channel with the hit show “Game of Thrones” that AT&T acquired as part of the Time Warner deal.","A federal judge earlier this month approved the merger of AT&T and Time Warner, handing AT&T a win after the U.S. Department of Justice sued to stop the deal, saying a merger would give AT&T unfair leverage over rival pay-TV providers.","AT&T, like other pay-TV providers, has been losing linear TV subscribers as viewers “cut the cord” on satellite TV packages in favor of cheaper streaming options. In the first quarter, AT&T shed 187,000 linear video subscribers.","The company also lost 22,000 wireless customers who pay a monthly bill during the first quarter, and while it was an improvement from the 348,000 customers it lost the previous year, continued losses have pressured AT&T to find ways to grow the valuable wireless business.","WatchTV as a standalone product will compete with other low-cost video streaming options, including Dish Network's DISH.O Sling TV, which costs $20 for the base package, and Philo, which costs $16.","WatchTV’s channel lineup, which includes AMC, HGTV and TNT, could appeal to viewers who do not have a large cable package or are looking to further “trim the cord,” Christopher said."
266,https://www.reuters.com/article/us-at-t-stankey/att-promises-fewer-ads-tailored-programing-after-merger-idUSKBN1JE2NO,2018-06-18T22:48:49Z,"AT&T promises fewer ads, tailored programing after merger","LOS ANGELES (Reuters) - AT&T Inc T.N is promising fewer commercials, smaller channel bundles and personalized programming now that it has taken over Time Warner channels in an $85 billion mega-merger.","After overcoming the U.S. Justice Department’s objection that the deal would harm competition, AT&T, the country’s number two wireless operator, said it will use its technology to reinvent how consumers receive and view entertainment.","A major aim is to reduce the number of commercials now that customers are accustomed to ad-free services such as Netflix Inc NFLX.O, said John Stankey, chief executive of newly named AT&T unit WarnerMedia.","“One of the big benefits we can bring to the market is lighter ad loads,” Stankey told Reuters in an interview.","AT&T, long dominant in the U.S. telephone industry, is now at the forefront of Hollywood with its purchase of Time Warner, which owned HBO, the Warner Brothers film and television studios, and Turner Broadcasting and CNN.","AT&T plans to use mobile phone and video data, supplied by customers who have given permission, to sell targeted advertisements. The thinking is that brands will pay more if they know their message is reaching someone likely to be interested in it.","For example, “if I’m a beer drinker, I’m more interested in seeing things about beer than soft drinks,” Stankey said.","Some of Time Warner’s Turner networks already have cut the number of commercials. Comedy network TruTV, for example, has reduced ad time by roughly 50 percent.","AT&T “absolutely” should be able to further reduce ad inventory across Turner networks, Stankey said.","The company will start selling targeted ads for Turner networks such as TNT and CNN “in short order,” Stankey said.","An industry-wide, automated marketplace, which would sell ads across other companies’ channels, would require cooperation across multiple players, and Stankey acknowledged that remains “easily a year off.”","The Justice Department and other critics had argued that AT&T’s purchase of Time Warner would harm consumers by limiting competition and leading to price increases. But a U.S. judge disagreed, and AT&T completed the merger last week. The government still may appeal.","AT&T now owns popular properties such as “Game of Thrones” along with the Harry Potter and Wonder Woman franchises. In the coming days, it will launch AT&T Watch, a package of Turner networks plus some from other media companies, Stankey said.","Designed as a general entertainment package that is smaller than traditional cable bundles, AT&T Watch will not carry sports-specific networks, Stankey said.","AT&T also plans to tailor programing to customer interests, such as by sending CNN news clips to mobile phone users based on their interests, or alerts about types of programing they might like based on earlier viewing, Stankey said.","Customers of HBO’s online services should not expect any immediate change to the company’s stance on password sharing, Stankey said. HBO limits the number of simultaneous streams but has accepted that some password sharing will occur.","AT&T is comfortable with password sharing among family members and believes most cases occur among people with a close relationship to someone who pays for the service, Stankey said.","“If somebody becomes really passionate about doing something through password sharing, and at some point they get hooked on it, they move into being a paying subscriber,” he said."
267,https://www.reuters.com/article/att-stankey/att-executive-promises-fewer-ads-on-newly-acquired-time-warner-networks-idUSL1N1TK1G8,2018-06-18T20:05:58Z,AT&T executive promises fewer ads on newly acquired Time Warner networks,"LOS ANGELES, June 18 (Reuters) - AT&T Inc should be able to reduce the number of commercials during programming on its newly acquired Time Warner networks by using wireless and TV customer data to target personalized advertisements, John Stankey, the longtime AT&T executive who will run the networks, said in an interview on Monday.","The wireless phone giant plans to start selling targeted ads for Turner networks such as TNT and CNN “in short order,” said Stankey, chief executive of the new WarnerMedia. An industry-wide, automated marketplace, which would sell ads across other companies’ channels, is “easily a year off,” he said. (Reporting by Lisa Richwine Editing by James Dalgleish)"
268,https://www.reuters.com/article/us-time-warner-m-a-at-t/att-ceo-says-ready-to-invest-warnermedia-rebranding-unveiled-idUSKBN1JB2A4,2018-06-15T20:55:39Z,"AT&T CEO says ready to invest, WarnerMedia rebranding unveiled","(Reuters) - AT&T Inc is committed to spend as much as needed on the media business of newly acquired Time Warner Inc, Chief Executive Randall Stephenson told CNBC on Friday, with a plan to invest $21 billion to $22 billion in the combined company.","“We’re not going to be penny-wise and pound-foolish here,” Stephenson said in an interview on the financial news channel. “We intend to invest.”","The No. 2 U.S. wireless carrier closed its $85 billion acquisition of Time Warner on Thursday and now faces the task of integrating a media company into its operations as it seeks to rival Netflix Inc, Amazon.com Inc and other technology companies providing entertainment directly to customers.","Time Warner will be renamed WarnerMedia, according to a memo sent to employees by John Stankey, who will serve as CEO of WarnerMedia.","Turner CEO John Martin will leave the company, according to the memo, which was seen by Reuters.","Stephenson said on Friday AT&T intends to preserve Time Warner’s creative culture, albeit under a new name.","He acknowledged differences in an email to AT&T and Time Warner employees late on Thursday, a copy of which was seen by Reuters.","“As different as our businesses are, I think you’ll find we have a lot in common,” wrote Stephenson. “We’re big fans of your talent and creativity. And you have my word that you will continue to have the creative freedom and resources to keep doing what you do best.”","Stephenson told CNBC he expects AT&T’s debt levels to come down quickly in about a year, returning to normal levels within four years at about 2.3 times earnings before interest, tax, depreciation and amortization.","Some analysts have raised concerns about the high level of debt the company took on to acquire Time Warner, about $180 billion at the close of the merger, Stephenson said.","AT&T’s spending plans include investing more in HBO, the premium TV channel with the hit show “Game of Thrones,” and expanding HBO’s direct-to-consumer platform, Stephenson said."
269,https://www.reuters.com/article/time-warner-ma-att/att-ceo-says-ready-to-invest-keep-culture-at-time-warner-cnbc-idUSL1N1TH0U6,2018-06-15T16:10:41Z,"AT&T CEO says ready to invest, keep culture at Time Warner -CNBC","June 15 (Reuters) - AT&T Inc is committed to spend as much as needed on the media business of newly acquired Time Warner Inc, Chief Executive Randall Stephenson told CNBC on Friday, with a plan to invest $21 billion to $22 billion in the combined company.","“We’re not going to be penny-wise and pound-foolish here,” Stephenson said in an interview on the financial news channel. “We intend to invest.”","The No. 2 U.S. wireless carrier closed its $85 billion acquisition of Time Warner on Thursday and now faces the task of integrating a media company into its operations as it seeks to rival Netflix Inc, Amazon.com Inc and other technology companies providing entertainment directly to customers.","That will be the job of John Stankey, who will lead the company’s combined entertainment business. Stephenson said on Friday AT&T intends to preserve Time Warner’s creative culture.","He acknowledged such differences in an email to AT&T and Time Warner employees late on Thursday, a copy of which was seen by Reuters.","“As different as our businesses are, I think you’ll find we have a lot in common,” wrote Stephenson. “We’re big fans of your talent and creativity. And you have my word that you will continue to have the creative freedom and resources to keep doing what you do best.”","Stephenson told CNBC he expects AT&T’s debt levels to come down quickly in about a year, returning to normal levels within four years at about 2.3 times earnings before interest, tax, depreciation and amortization.","Some analysts have raised concerns about the high level of debt the company took on to acquire Time Warner, about $180 billion at the close of the merger, Stephenson said.","AT&T’s spending plans include investing more in HBO, the premium TV channel with the hit show “Game of Thrones,” and expanding HBO’s direct-to-consumer platform, Stephenson said. (Reporting by Sheila Dang Additional reporting by Diane Bartz in Washington Editing by Bill Rigby)"
270,https://www.reuters.com/article/us-comcast-m-alending/comcasts-record-all-cash-fox-bid-signals-aggressive-lending-push-idUSKBN1JB1QN,2018-06-15T13:47:49Z,Comcast’s record all-cash Fox bid signals aggressive lending push,"NEW YORK (LPC) - Media company Comcast Corp’s record all-cash US$65bn bid to buy Twenty-First Century Fox’s media assets, a day after AT&T’s long-sought acquisition of Time Warner received a green light, signals an oncoming wave of M&A that banks will aggressively compete to finance.","The federal judge’s ruling in favor of the US$85bn AT&T/Time Warner tie-up, first announced in October 2016, without any conditions, removed an obstacle for debt markets after several huge, high profile technology and healthcare deals were scuttled by antitrust or national security concerns.","“After the AT&T news, people have a much more optimistic view on the regulatory front, and I think that will push bankers to pitch more on M&A,” said one senior banker. “There’s more of a willingness to look at vertical integrations,” in which a company buys a supplier.","Comcast, in announcing its Walt Disney Co-topping bid, said it had “highly confident” letters from Bank of America Merrill Lynch and Wells Fargo that the banks can secure the needed financing for the proposed acquisition.","A considerable amount of the needed financing was already put in place before this newly raised bid. In April, the company said it lined up £23bn (US$32bn) of loans led by BAML and Wells Fargo.","The existing credit comprises up to £16bn of 364-day bridge loans and up to £7bn of term loans, with the bridge expected to be replaced in part or in full by senior unsecured bonds, LPC previously reported.",BAML and Wells Fargo declined to comment.,"The AT&T victory “does make people feel a bit more of a risk appetite for complex transactions on the regulatory front,” said another banker.","Vertical transactions tend to be better for the M&A market because they allow companies to get into complementary areas for growth, as opposed to horizontal deals which focus more on synergies and cost cutting, he said. “That can be pretty helpful to the overall M&A market.”","Corporations buying other companies for growth have helped drive total M&A lending up to US$326bn so far this year, a 39% leap above the same time last year, according to LPC data.","Attention shifts next to Disney, and whether it answers Comcast’s bid by increasing its US$52bn all-stock agreement to purchase Fox’s film, television and international businesses.","And still in the regulatory review line is T-Mobile’s US$26bn proposed merger with Sprint, two leading wireless carrier competitors, in what is considered a horizontal deal.","As for Comcast’s new financing, banks typically provide “highly confident” letters as a tactic used for large hostile takeovers, that allows borrowers to avoid paying fees on funds committed by banks to a huge deal that may not take place.","Banks do not immediately tie up their balance sheets, as a result, while signaling to markets that financing will be there if the deal is approved.","Similarly, five initial banks indicated their confidence this way last November for chipmaker Broadcom’s unsolicited bid to buy rival Qualcomm. The lending group was later expanded and provided US$100bn of financing – the largest loan package ever – before the deal was ultimately canceled as President Trump blocked the merger over national security concerns.",Banks remain eager to put money to work and see a more open dealmaking path after the AT&T/Time Warner merger outcome.,"“Now that the judge has given the all-clear, without conditions, it’s basically a free ride, and this will open up other opportunities for companies in the space that need to position themselves,” a third banker said."
