1,https://www.reuters.com/article/turquoise-hill-oyu-tolgoi-force-majeure/turquoise-hills-oyu-tolgoi-mine-partially-resumes-shipments-to-china-idUSL4N2MC44X,2021-04-19T22:09:52Z,Turquoise Hill's Oyu Tolgoi mine partially resumes shipments to China,"April 19 (Reuters) - Turquoise Hill Resources Ltd said on Tuesday the Oyu Tolgoi mine in Mongolia had partially resumed shipments to China, after the Canadian miner declared force majeure on some Chinese contracts last month due to COVID-19-led curbs.","The company is evaluating multiple contingencies, including an alternative shipping route via Mongolia’s capital city of Ulaanbaatar, to deal with the force majeure, which refers to unexpected external factors that prevent a party from meeting contract obligations.",Turquoise Hill’s force majeure was related to coronavirus-related restrictions at the Chinese-Mongolian border crossing. The company partially resumed shipments to China on April 15.,"Oyu Tolgoi, the world's largest copper-gold-silver mine, was already at the center of a protracted dispute between Turquoise and its top shareholder, Rio Tinto, over funding for the underground expansion of the mine. (reut.rs/3ehhDY9)","Turquoise said that it continues to be in talks with Rio Tinto and the government of Mongolia, after reaching a binding agreement over the funding spat two weeks earlier. (reut.rs/3mZZjXH)","Rio owns 51% of Turquoise Hill, which owns 66% of the Oyu Tolgoi mine. The rest of the mine is owned by the government of Mongolia. (Reporting by Rithika Krishna in Bengaluru; Editing by Devika Syamnath)"
2,https://www.reuters.com/article/us-rio-tinto-oyu-tolgoi-turquoise-hill/rio-tinto-turquoise-hill-reach-deal-on-oyu-tolgoi-expansion-idUSKBN2BW0P5,2021-04-09T15:17:23Z,"Rio Tinto, Turquoise Hill reach deal on Oyu Tolgoi expansion",MELBOURNE (Reuters) -Rio Tinto Ltd said on Friday it has reached a binding agreement with Turquoise Hill Resources Ltd over funding for expansion of the massive Oyu Tolgoi copper-gold mine in Mongolia.,Rio and Turquoise Hill will restructure debt payments of up to $1.4 billion with lenders and look to raise up to $500 million in supplemental debt under existing financing arrangements. (bit.ly/3uCfg96),"The agreement will smooth the way for the next phase of development, which has faced cost and timeline blowouts and has caused acrimony between the mining giant and its junior partner.","“It’s just been such a troublesome asset, at least this takes away one of the issues - you have still got the issues with the government and the technical issues,” said Andy Forster, portfolio manager at Argo Investments in Sydney.","“From a financing perspective there has been a fractured relationship there, so I guess this result is positive.”","The Oyu Tolgoi mine expansion has seen costs balloon to $6.75 billion, about $1.4 billion higher than Rio’s estimate in 2016, and has led to friction over funding between it and Turquoise Hill.","The new funding plan tackles the remaining estimated funding requirement of about $2.3 billion, Rio said. It will back potential shortfalls from the debt re-profiling as well as new debt up to $750 million through a co-lending facility.",U.S.-listed Turquoise Hill shares were up 5% at $18.89 in pre-market trading.,The Canadian miner said it committed to complete an equity offering of common shares of up to $500 million within six months of the co-lending facility becoming available to satisfy any remaining shortfall.,"Oyu Tolgoi, one of the world’s largest-known copper and gold deposits, is 34% owned by the Mongolian government with the rest held by Turquoise Hill, in which Rio owns a 50.8% stake.",The government has also sought to cancel the deal underpinning the mine’s underground expansion. nL1N2KE22P],"At peak production, the operation is expected to produce an average of 480,000 tonnes of copper per year from 2028 to 2036, from the open pit and underground. By 2030 it is expected to be the fourth-largest copper mine in the world."
3,https://www.reuters.com/article/rio-tinto-oyu-tolgoi-turquoise-hill/rio-tinto-signs-binding-agreement-with-turquoise-hill-for-oyu-tolgoi-financing-idUSL4N2M21M9,2021-04-09T06:14:44Z,Rio Tinto signs binding agreement with Turquoise Hill for Oyu Tolgoi financing,April 9 (Reuters) - Rio Tinto said on Friday it has reached a binding agreement with Turquoise Hill Resources to update funding plans for the massive Oyu Tolgoi copper-gold mine in Mongolia. (bit.ly/3uCfg96) (Reporting by Nikhil Kurian Nainan in Bengaluru; Editing by Shounak Dasgupta)
4,https://www.reuters.com/article/turquoise-hill-oyu-tolgoi-force-majeure/update-1-turquoise-hills-oyu-tolgoi-declares-force-majeure-on-some-chinese-contracts-idUSL4N2LS3C1,2021-03-30T12:38:51Z,UPDATE 1-Turquoise Hill's Oyu Tolgoi declares force majeure on some Chinese contracts,"(Adds details on COVID-19 cases at mine, background)","March 30 (Reuters) - Canada’s Turquoise Hill Resources Ltd said on Tuesday its Oyu Tolgoi mining unit in Mongolia declared force majeure on some Chinese contracts, after shipments to China were suspended due to COVID-19 related restrictions.","The force majeure compounds problems at one of the world’s largest copper-gold-silver mine Oyu Tolgoi, which is already at the center of a protracted dispute between Turquoise and its top shareholder, Rio Tinto, over funding for the underground expansion of the mine.",Force majeure refers to unexpected external circumstances that prevent a party to a contract from meeting its obligations.,"Rio owns 51% of Turquoise Hill, which owns 66% of the Oyu Tolgoi mine. The rest of the mine is owned by the government of Mongolia.","The force majeure is related to coronavirus-related restrictions at the Chinese-Mongolian border crossings, Turquoise Hill said on Tuesday, adding that it was working with Chinese officials to resume the shipments of copper concentrates to its Chinese customers.","Turquoise said that Oyu Tolgoi also confirmed two cases of COVID-19 at the site that were managed in compliance with public health guidelines. It also said it has completed over 9,700 PCT tests at the site that have all confirmed negative.","Underground work at the mine was halted for the testing, while ongoing travel restrictions hit people’s movement from Mongolian capital Ulaanbaatar to the mine site, Turquoise said, adding Oyu Tolgoi is developing contingency plans to mitigate related risk.","Open pit mining continues to operate uninterrupted at Oyu Tolgoi, Turquoise Hill said."
5,https://www.reuters.com/article/turquoise-hill-oyu-tolgoi-force-majeure/turquoise-hills-oyu-tolgoi-declares-force-majeure-on-contracts-idUSL4N2LS3B9,2021-03-30T12:09:24Z,Turquoise Hill's Oyu Tolgoi declares force majeure on contracts,March 30 (Reuters) - Canadian miner Turquoise Hill Resources Ltd said on Tuesday its Oyu Tolgoi mining unit in Mongolia has declared force majeure on customer contracts for concentrate after shipments to China were suspended due to COVID-19 related restrictions. (Reporting by Shariq Khan in Bengaluru; Editing by Shinjini Ganguli)
6,https://www.reuters.com/article/us-turquoise-hill-results/turquoise-hill-profit-jumps-41-on-higher-copper-gold-production-idUSKBN2B02JE,2021-03-08T23:07:47Z,"Turquoise Hill profit jumps 41% on higher copper, gold production","(Reuters) - Canada’s Turquoise Hill Resources Ltd posted a 41.4% rise in quarterly profit on Monday, helped by higher copper prices and increased production of copper and gold at its Oyu Tolgoi mine in Mongolia.","The results come a week after Chief Executive Officer Ulf Quellmann resigned amid a protracted dispute between the company and its top shareholder, Rio Tinto, over funding for the underground expansion of the Oyu Tolgoi copper-gold mine.","Mongolia had sought an agreement with Rio to cancel the deal underpinning the mine’s underground expansion, saying rising costs and project delays had eroded the expected benefits.","Oyu Tolgoi is one of the world’s largest copper-gold-silver mines. Rio owns 51% of Turquoise Hill, which in turn owns 66% of the mine. The rest of the mine is owned by government of Mongolia.","Copper production rose 26.4% to 41.6 thousand tonnes in the fourth quarter, while gold production surged 266.7% to 88 thousand ounces.","Rio Tinto-controlled Turquoise Hill said income attributable to owners of the company was $159.9 million, or 79 cents per share, for the three months ended Dec. 31, compared with $113.1 million, or 56 cents per share, a year earlier."
7,https://www.reuters.com/article/turquoise-hill-results/refile-turquoise-hill-profit-rises-41-idUSL4N2L63W4,2021-03-08T22:58:45Z,REFILE-Turquoise Hill profit rises 41%,(Corrects typographical error in headline),"March 8 (Reuters) - Canada’s Turquoise Hill Resources Ltd posted a 41.4% rise in quarterly profit on Monday, helped by higher copper prices and increased production of copper and gold at its Oyu Tolgoi mine in Mongolia.","Rio Tinto-controlled Turquoise Hill said income attributable to owners of the company was $159.9 million, or 79 cents per share, for the three months ended Dec. 31, compared with $113.1 million, or 56 cents per share, a year earlier. (Reporting by Arunima Kumar and Praveen Paramasivam in Bengaluru; Editing by Amy Caren Daniel)"
8,https://www.reuters.com/article/turquoise-hill-ceo-pentwater/activist-investor-pentwater-takes-aim-at-turquoise-rio-boards-over-ceo-exit-idUSL3N2L33UN,2021-03-05T16:15:23Z,"Activist investor Pentwater takes aim at Turquoise, Rio boards over CEO exit",March 5 (Reuters) - Activist investor Pentwater Capital Management LP on Friday condemned the surprise resignation of Turquoise Hill Resources Ltd’s chief executive officer following pressure from the Canadian miner’s top shareholder Rio Tinto.,"Turquoise Hill said on Thursday Ulf Quelmann resigned, effective March 3, after Rio said it would vote against his re-election to the board.","Pentwater, Turquoise Hill’s largest shareholder after Rio with a 9% stake, said it believed the boards of Turquoise and Rio breached their legal obligations in the way Quelmann’s departure was handled.","In response to Pentwater’s statement, a Rio spokesman said the company supports the reset of leadership at Turquoise.",Turquoise Hill did not immediately respond to requests for comment.,"During Quelmann’s over two-year tenure as CEO, Turquoise found itself locked in a feud with Rio over how to fund the underground expansion of the massive Oyu Tolgoi copper-gold mine in Mongolia.","Rio is the operator for the mine and owns 51% of Turquoise Hill, which in turn owns 66% of Oyu Tolgoi.",Pentwater did not detail what actions it plans to take and did not immediately respond to a request for comment. (Reporting by Shariq Khan in Bengaluru; Editing by Sriraj Kalluvila)
9,https://www.reuters.com/article/turquoise-hill-ceo/update-4-turquoise-hill-ceo-exits-after-rio-tinto-pressure-shares-tumble-idUSL3N2L239I,2021-03-04T17:36:09Z,"UPDATE 4-Turquoise Hill CEO exits after Rio Tinto pressure, shares tumble",(Adds analyst comment in 11th paragraph),March 4 (Reuters) - Canada’s Turquoise Hill Resources Ltd said on Thursday Chief Executive Officer Ulf Quellmann has resigned after top shareholder Rio Tinto said it would vote against his re-election to the board.,"The departure, effective March 3, comes with Turquoise Hill and global miner Rio locked in a protracted dispute over funding for the underground expansion of Rio’s massive Oyu Tolgoi copper-gold mine in Mongolia.","The Anglo-Australian miner also faces renegotiation of an expansion agreement with Mongolia, which owns a 34% stake in the mine. Rio owns 51% of Turquoise Hill, which in turn owns 66% of the mine.",Turquoise Hill said on Thursday a board committee told Quellmann that Rio believed new leadership was “necessary” to advance the mine expansion.,"Rio also advised it would vote against Quellmann’s re-election at the annual shareholders’ meeting in May, Turquoise Hill said.","Mongolia is seeking added benefits including more tax revenue from the mine after costs for the expansion ballooned to $6.75 billion, about $1.4 billion higher than Rio’s estimate in 2016.",A government source said on Thursday that Ulaanbaatar is disappointed with Quellmann’s sudden exit because it disrupts the continuity of negotiations.,"“In our view he was doing what he was supposed to do,” the source said.","Turquoise Hill said its former finance chief, Steeve Thibeault, will replace Quellmann on an interim basis.","Thibeault led negotiations for funding agreements with Rio in 2015 but has had no affiliation with either company since April, 2017, it added.",Bank of Nova Scotia analyst Orest Wowkodaw said Quellmann’s departure “significantly reduces” the likelihood of a non-dilutive gold streaming transaction to help fund the mine expansion.,Rio said it remains committed to working with both Turquoise Hill and the government.,"“Aligning and coordinating our joint efforts to resolve the concerns of the Government of Mongolia going forward is of the highest priority,” the company said.",Toronto-listed shares of Turquoise Hill fell as much as 8.5% in mid-afternoon trading. (Reporting by Arundhati Sarkar in Bengaluru; additional reporting by Jeff Lewis in Toronto; Editing by Devika Syamnath and Chris Reese)
10,https://www.reuters.com/article/us-turquoise-hill-oyu-tolgoi/turquoise-hill-gets-interim-relief-in-funding-spat-with-rio-for-mongolia-mine-idUSKBN2A41VQ,2021-02-04T14:14:21Z,Turquoise Hill gets interim relief in funding spat with Rio for Mongolia mine,"(Reuters) - Canada’s Turquoise Hill said on Thursday it has received temporary relief in the arbitration proceedings against Rio Tinto, related to the proposed funding of the Oyu Tolgoi mine.","As a result of the order, Rio Tinto may not use the parties’ existing contractual arrangements to restrict Turquoise Hill from engaging on funding and other matters with its fellow stakeholders in the mine, the Canadian miner said.","Oyu Tolgoi is one of the world’s largest-known copper and gold deposits, located in the South Gobi region of Mongolia. The Mongolian government holds a 34% stake in the project with Rio’s majority-owned Turquoise Hill owning the rest.","Until further order, Rio Tinto may also not authorize re-profiling negotiations with project lenders in a manner that would render Oyu Tolgoi LLC unable to execute an offering of bonds in 2021, Turquoise added.","Tensions between mine operator Rio and Turquoise Hill’s management and minority shareholders have spilled into the open in recent months. Rio owns 51% of Turquoise, which in turn owns 66% of the mine.","Turquoise Hill in November launched arbitration proceedings against Rio, saying the miner’s approach to funding the expansion is “incompatible” with its own. It had in January sought an interim order in its arbitration."
11,https://www.reuters.com/article/us-turquoise-hill-oyu-tolgoi/turquoise-hill-seeks-interim-order-in-funding-spat-with-rio-for-mongolia-mine-idUSKBN29X2S2,2021-01-28T20:12:01Z,Turquoise Hill seeks interim order in funding spat with Rio for Mongolia mine,"(Reuters) - Canada’s Turquoise Hill Resources Ltd said on Thursday it has sought an interim order in its arbitration against Rio Tinto, saying the majority shareholder’s actions limit Turquoise’s funding options for the Oyu Tolgoi project.","Oyu Tolgoi is one of the world’s largest-known copper and gold deposits, located in the South Gobi region of Mongolia, in which the Mongolian government holds a 34% stake.","Tensions between mine operator Rio and Turquoise Hill’s management and minority shareholders have spilled into the open in recent months. Rio owns 51% of Turquoise, which in turn owns 66% of the mine.","Turquoise Hill in November launched arbitration proceedings against Rio, saying the miner’s approach to funding the expansion is “incompatible” with its own.","Rio Tinto in 2019 announced a 30-month delay to the Oyu project to expand the mine underground and a cost overrun due to difficult geology. Last month, the company confirmed that the expansion at the mine would cost $6.75 billion, about $1.4 billion higher than its estimate in 2016.",Earlier in the month the Canadian miner said that Mongolia’s government is considering terminating the companies’ underground expansion of their Oyu Tolgoi project due to rising development costs.
12,https://www.reuters.com/article/rio-tinto-oyu-tolgoi-mongolia/update-2-mongolia-considers-terminating-oyu-tolgoi-copper-mine-expansion-as-costs-jump-developer-idUSL4N2JM2HU,2021-01-11T16:04:10Z,UPDATE 2-Mongolia considers terminating Oyu Tolgoi copper mine expansion as costs jump -developer,"(Adds shares, comment from Rio, analysts)",Jan 11 (Reuters) - Rio Tinto-controlled Turquoise Hill Resources said on Monday that Mongolia’s government is considering terminating the companies’ underground expansion of their Oyu Tolgoi copper mine project due to rising development costs.,Shares of Turquoise Hill fell as much as 20% in early trading on the news.,Oyu Tolgoi is one of the world’s largest-known copper and gold deposits.,"Rio Tinto announced in 2019 a 30-month delay to a project to expand the mine underground and a cost overrun due to difficult geology. Last month the company confirmed that the expansion at the mine would cost $6.75 billion, about $1.4 billion higher than its estimate in 2016.","The government has told Rio Tinto it is dissatisfied with the miner’s plans and is concerned that the significant increase in the development costs of the Oyu Tolgoi project has eroded the economic benefits that the country had hoped to get, Turquoise Hill said.","“The government of Mongolia has indicated that if the Oyu Tolgoi project is not economically beneficial to the country, it would be necessary to review and evaluate whether it can proceed,” Turquoise Hill said in a statement.","The government’s position is not surprising given it is not expected to receive any cash flows beyond taxes and mining royalties from its ownership stake in the project for the foreseeable future due to $7 billion in partner loans accumulated during construction, Bank of Nova Scotia analyst Orest Wowkodaw said.",The Mongolian government holds a 34% stake in the mine and Turquoise Hill owns 66%.,"Exchanging the government’s stake for “a markedly higher royalty (cash flowing immediately) would be in the best interest of all stakeholders,” Wowkodaw said.",Turquoise Hill said it was committed to engaging immediately with the government and Rio Tinto to address the development plan and revisit the sharing of economic benefits.,"The companies have sunk $11 billion into the mine since 2010, Rio said in a separate statement to Reuters, adding it “remains open” to increasing benefits to all shareholders."
13,https://www.reuters.com/article/rio-tinto-oyu-tolgoi-mongolia/mongolia-considers-terminating-replacing-plan-to-develop-oyu-tolgoi-copper-mine-idUSL4N2JM2FX,2021-01-11T13:11:03Z,"Mongolia considers terminating, replacing plan to develop Oyu Tolgoi copper mine","Jan 11 (Reuters) - The Government of Mongolia is considering terminating and replacing the development and financial plan for the Oyu Tolgoi copper mine in the country, Rio Tinto-controlled Turquoise Hill Resources said on Monday.","The government has advised Rio Tinto it is dissatisfied with the miner’s plans to achieve production from the Oyu Tolgoi copper mine in the country for development capital of $6.75 billion, Turquoise Hill Resources said.","Oyu Tolgoi is one of the world’s largest-known copper and gold deposits, located in the South Gobi region of Mongolia. The Mongolian government holds a 34% stake in the project and Rio-controlled Turquoise Hill owns the rest."
14,https://www.reuters.com/article/turquoise-hill-oyu-tolgoi/canadas-turquoise-hill-considers-gold-streaming-debt-funding-for-mongolian-mine-idUSKBN28X0CW,2020-12-23T03:56:12Z,"Canada's Turquoise Hill considers gold streaming, debt funding for Mongolian mine",(Reuters) - Canadian miner Turquoise Hill Resources Ltd said on Tuesday it intended to pursue “gold streaming” and medium-term debt offering transactions for its Oyu Tolgoi copper and gold project in Mongolia.,"The streaming transaction would involve “a significant up-front payment” to Oyu Tolgoi, as well as deferred payments based on gold “spot” prices, Turquoise Hill said.","Streaming is a type of alternative finance that generally involves an upfront payment by the streamer to a miner, which repays the loan by supplying metal at a later date.","The potential transaction will be in exchange for deliveries to one or more streamers of an agreed portion of gold produced from the Oyut deposit, the company added.",It was also considering one or more offering of global medium-term debt by Oyu Tolgoi with a tenor of at least 10 years. It would require Oyu Tolgoi to make a “bullet” repayment of the principal at maturity.,"“We will now focus on finalising terms for a streaming transaction as soon as possible, and on completing preparations necessary for a potential inaugural offering of (global medium term notes/bonds) later in 2021,” Chief Financial Officer Luke Colton said.",The Oyu Tolgoi deposit in south Mongolia is jointly owned by Rio Tinto-controlled Turquoise Hill and the Mongolian state.
15,https://www.reuters.com/article/us-mining-rio-mongolia-explainer/explainer-whats-behind-a-feud-at-rio-tintos-copper-mine-in-mongolia-idUSKBN28G0B2,2020-12-06T11:18:32Z,Explainer: What's behind a feud at Rio Tinto's copper mine in Mongolia,"TORONTO (Reuters) - Canadian mining company Turquoise Hill Resources Ltd is locked in a feud with its largest shareholder, Rio Tinto Plc, over the underground expansion of its massive Oyu Tolgoi copper mine in Mongolia.","Tensions between mine operator Rio and Turquoise Hill’s management and minority shareholders have spilled into the open in recent months. Rio owns 51% of Turquoise Hill, which in turn owns 66% of the mine.",Here is an explanation of the dispute.,"Oyu Tolgoi is one of the world’s largest-known copper and gold deposits, located in the South Gobi region of Mongolia. The Mongolian government holds a 34% stake in the project with Rio’s majority-owned Turquoise Hill owning the rest.","Open-pit mining began in 2011. First production from the underground expansion is slated for 2022, climbing to 500,000 tonnes of copper per year at full capacity in what would make it the world’s third-largest copper mine.","Rio in 2019 announced a 30-month delay and a cost overrun of up to $1.9 billion due to difficult geology, putting total expenditures in a range of $6.5 billion to $7.2 billion.",Costs for a coal-fired power plant to supply power to the mine would come on top of that figure.,"Turquoise Hill in November launched arbitration proceedings against Rio, saying the miner’s approach to funding the expansion is “incompatible” with its own.","Rio in September said it would borrow $500 million to develop the mine, with any remaining funding gap met by a Turquoise Hill stock offering.",Turquoise Hill shareholders fear that would allow Rio to take a greater stake in Turquoise Hill that underplayed its full valuation.,"Pentwater Capital, which holds a 9.23% stake in Turquoise Hill, and Sailingstone Capital Partners, which holds 3%, accuse Rio of mismanaging costs and unfairly restricting Turquoise Hill’s ability to obtain financing to pay for those costs.","The Canadian mining company wants to extend the timeline it has to repay some debt while also exploring other funding options, including a possible gold stream, to delay or avoid a stock offering.","Turquoise Hill has said arbitration, which could take up to five months, would provide needed “clarity” on mine financing. It said on Dec. 1 that the board of Oyu Tolgoi had approved forming a special committee to conduct an independent review of cost overruns and delays at the mine.","An outside firm of experts is to report to the special committee within six months of commencing the investigation, according to the company.",Rio declined comment.,"Turquoise Hill has said it would need to raise $1.1 billion via bank debt, bonds or a metal stream if it and Rio extend the timeline to repay existing loans and raise new debt as planned.","However, the Canadian mining company said it may need to issue at least $3 billion of additional stock, if it cannot amend its debt repayment terms or secure other financing."
