1,https://www.reuters.com/article/brief-alleghany-announces-pricing-of-500/brief-alleghany-announces-pricing-of-500-million-of-3-625-senior-notes-due-2030-idUSASA00Q2A,2020-05-13T21:37:28Z,BRIEF-Alleghany Announces Pricing Of $500 Million Of 3.625% Senior Notes Due 2030,Alleghany Corp:,* ALLEGHANY ANNOUNCES PRICING OF $500 MILLION OF 3.625% SENIOR NOTES DUE 2030,* ALLEGHANY CORP - SENIOR NOTES WERE PRICED AT 99.867% OF PAR Source text for Eikon: Further company coverage:
2,https://www.reuters.com/article/brief-alleghany-files-for-senior-notes-o/brief-alleghany-files-for-senior-notes-offering-idUSFWN2CT0YE,2020-05-11T16:07:27Z,BRIEF-Alleghany Files For Senior Notes Offering,May 11 (Reuters) - Alleghany Corp:,* ALLEGHANY FILES PRELIM PROSPECTUS FOR SENIOR NOTES OFFERING; SIZE NOT DISCLOSED - SEC FILING Source text: (‍here ) Further company coverage:
3,https://www.reuters.com/article/brief-alleghany-corp-files-for-potential/brief-alleghany-corp-files-for-potential-debt-shelf-offering-idUSFWN2CO1ED,2020-05-06T22:58:09Z,BRIEF-Alleghany Corp Files For Potential Debt Shelf Offering,May 6 (Reuters) - Alleghany Corp:,* ALLEGHANY CORP FILES FOR POTENTIAL DEBT SHELF OFFERING; SIZE NOT DISCLOSED - SEC FILING Source text (bit.ly/2YDTODI) Further company coverage:
4,https://www.reuters.com/article/brief-alleghany-says-adjusted-earnings-p/brief-alleghany-says-adjusted-earnings-per-diluted-share-for-q1-of-2020-were-4-99-idUSFWN2CN132,2020-05-05T22:28:11Z,BRIEF-Alleghany Says Adjusted Earnings Per Diluted Share For Q1 Of 2020 Were $4.99,May 5 (Reuters) - Alleghany Corp:,* ALLEGHANY SAYS ADJUSTED EARNINGS PER DILUTED SHARE FOR Q1 OF 2020 WERE $4.99 - SEC FILING,* NET PREMIUMS WRITTEN INCREASED 10.7% IN Q1 OF 2020 FROM Q1 OF 2019,"* BOOK VALUE PER SHARE WAS $549.07 AS OF MARCH 31, 2020, A DECREASE OF 7.7% FROM YEAR-END 2019",* RECORDED A $30 MILLION IMPAIRMENT AT STRANDED OIL RESOURCES CORPORATION IN Q1 OF 2020,* Q1 EARNINGS PER SHARE VIEW $7.95 -- REFINITIV IBES DATA Source text: [bit.ly/2W9VAuV] Further company coverage: (Reuters.Briefs@thomsonreuters.com)
5,https://www.reuters.com/article/brief-alleghany-corporation-announces-ad/brief-alleghany-corporation-announces-adjournment-of-2020-annual-meeting-of-stockholders-to-may-8-2020-idUSFWN2CC1YS,2020-04-24T16:54:17Z,"BRIEF-Alleghany Corporation Announces Adjournment Of 2020 Annual Meeting Of Stockholders To May 8, 2020",April 24 (Reuters) - Alleghany Corp:,"* ALLEGHANY CORPORATION ANNOUNCES ADJOURNMENT OF 2020 ANNUAL MEETING OF STOCKHOLDERS TO MAY 8, 2020 Source text for Eikon: Further company coverage:"
6,https://www.reuters.com/article/brief-alleghany-corporation-announces-in/brief-alleghany-corporation-announces-intention-to-adjourn-2020-annual-meeting-of-stockholders-to-may-8-idUSFWN2C10BU,2020-04-13T12:56:31Z,BRIEF-Alleghany Corporation Announces Intention To Adjourn 2020 Annual Meeting Of Stockholders To May 8,April 13 (Reuters) - Alleghany Corp:,"* ALLEGHANY CORPORATION ANNOUNCES INTENTION TO ADJOURN 2020 ANNUAL MEETING OF STOCKHOLDERS TO MAY 8, 2020 AND CHANGE TO A VIRTUAL MEETING FORMAT Source text for Eikon: Further company coverage:"
7,https://www.reuters.com/article/brief-alleghany-capital-corporation-incr/brief-alleghany-capital-corporation-increases-ownership-in-wilbert-funeral-services-idUSFWN2BP1DG,2020-04-01T21:39:12Z,BRIEF-Alleghany Capital Corporation Increases Ownership In Wilbert Funeral Services,April 1 (Reuters) - Alleghany Corp:,* ALLEGHANY CAPITAL CORPORATION INCREASES OWNERSHIP IN WILBERT FUNERAL SERVICES,"* ALLEGHANY CORP - UNIT ACQUIRED A MAJORITY INTEREST IN WILBERT FUNERAL SERVICES, INC. Source text for Eikon: Further company coverage:"
8,https://www.reuters.com/article/brief-alleghany-capital-corporation-anno/brief-alleghany-capital-corporation-announces-jazwares-acquisition-of-kellytoy-idUSASA00JQ0,2020-04-01T20:39:05Z,BRIEF-Alleghany Capital Corporation Announces Jazwares' Acquisition Of Kellytoy,April 1 (Reuters) - Alleghany Corp:,* ALLEGHANY CAPITAL CORPORATION ANNOUNCES JAZWARES’ ACQUISITION OF KELLYTOY,"* ALLEGHANY - ACQUIRED A MAJORITY STAKE IN KELLY TOYS HOLDINGS, LLC AND KELLY AMUSEMENT HOLDINGS, LLC Source text for Eikon: Further company coverage:"
9,https://www.reuters.com/article/brief-alleghany-corp-says-ceo-weston-m-h/brief-alleghany-corp-says-ceo-weston-m-hicks-2019-total-compensation-was-14-million-idUSFWN2B914R,2020-03-16T16:44:14Z,BRIEF-Alleghany Corp Says CEO Weston M. Hicks' 2019 Total Compensation Was $14 Million,March 16 (Reuters) - Alleghany Corp:,* ALLEGHANY CORP SAYS CEO WESTON M. HICKS' 2019 TOTAL COMPENSATION WAS $14 MILLION VERSUS $8.1 MILLION IN 2018 – SEC FILING Source text - (bit.ly/2xLC2TX) Further company coverage:
10,https://www.reuters.com/article/brief-alleghany-reports-q4-earnings-per/brief-alleghany-reports-q4-earnings-per-share-1-98-idUSFWN2AJ13Z,2020-02-19T22:34:18Z,BRIEF-Alleghany Reports Q4 Earnings Per Share $1.98,Feb 19 (Reuters) - Alleghany Corp:,"* BOOK VALUE PER SHARE WAS $611.00 AS OF DECEMBER 31, 2019, AN INCREASE OF 15.8% FROM YEAR-END 2018",* QTRLY NET PREMIUMS WRITTEN $1.51 BILLION VERSUS $1.28 BILLION Source text: (bit.ly/37NzbWU) Further company coverage:
11,https://www.reuters.com/article/brief-alleghany-corp-qtrly-earnings-per/brief-alleghany-corp-qtrly-earnings-per-diluted-share-11-04-idUSFWN1SA1AM,2018-05-03T20:56:20Z,BRIEF-Alleghany Corp Qtrly Earnings Per Diluted Share $11.04,May 3 (Reuters) - Alleghany Corp:,* ALLEGHANY CORP QTRLY EARNINGS PER DILUTED SHARE WERE $11.04 PER SHARE,"* ALLEGHANY - BOOK VALUE PER COMMON SHARE WAS $545.07 AS OF MARCH 31, 2018, A DECREASE OF 1.5% FROM BOOK VALUE PER COMMON SHARE AS OF DECEMBER 31, 2017",* ALLEGHANY CORP QTRLY OPERATING EARNINGS PER DILUTED SHARE WERE $11.24 IN THE FIRST QUARTER OF 2018,"* ALLEGHANY CORP QTRLY NET PREMIUMS WRITTEN OF $1,253.3 MILLION VERSUS $1,233.1 MILLION","* ALLEGHANY - IN QUARTER,JAZWARES’ EXPENSES ROSE DUE TO INCREASED STAFF COUNT TO SUPPORT GROWTH, LIQUIDATION FILING OF TOYS R US, INCREASING INSURANCE COSTS Source text (bit.ly/2w99cvf) Further company coverage:"
