13.76410891589764," Apollo reports first full-year loss since 2011 after rocky fourth quarter NEW YORK (Reuters) - Private equity firm Apollo Global Management on Thursday reported a loss for the last quarter of 2018, contributing to the firm’s first year in the red since 2011 as falling equity markets diminished the value of its investments on paper. Apollo’s economic net loss per share was $1.01 in the fourth quarter, steeper than the 82-cent loss analysts had expected, according to Refinitiv data. In the fourth quarter of 2017, Apollo reported economic net income per share of $1.22. Overall in 2018, Apollo lost 21 cents per share, the firm’s first year in the red since 2011. Still, shares were up around 5 percent in mid-morning trading, outshining the broader U.S. stock market, as analysts took comfort from Apollo’s assets under management rising to a record $280.3 billion by the end of 2018. “While we do not dismiss one quarter of challenging investment performance, given that marks can be volatile from period-to-period (and were actually roughly in line with our expectation), we remain encouraged with the business heading into 2019,” according to a note by JMP Securities analyst Devin Ryan, who rates the stock “market outperform.” The benchmark S&P 500 index suffered its worst three months in more than 7 years at the end of 2018, dropping about 14 percent in the fourth quarter. In late morning trading, the S&P index was up about 0.4 percent. Apollo reported its private equity fund depreciated 10.9 percent in the quarter and was down 9.8 percent for 2018. The value of Apollo’s public equity holdings fell 29 percent. “What we’ve seen in our portfolio is a microcosm of what’s been going between the markets and the underlying economy in the U.S.,” Chairman, Chief Executive and Co-founder Leon Black said in a statement. “The fundamentals actually have been pretty attractive... vis-à-vis our own portfolio in terms of revenue and earnings growth. But the market got very skittish in the fourth quarter.” Economic net income reflects the mark-to-market valuation gains or losses on Apollo’s portfolio. Peers Blackstone Group, Carlyle Group and KKR & Co have recently deemphasized the earnings metric and focused primarily on distributable earnings, the actual cash available for paying dividends. Apollo’s distributable earnings totaled $252.4 million in the quarter, down 20.4 percent from $317.2 million a year earlier. Blackstone on Thursday posted distributable earnings of $722 million for the fourth quarter, down 42 percent on the year."
13.76410891589764," Berry Global weighs bid for packager RPC in challenge to Apollo (Reuters) - Berry Global Group is considering a cash offer for British packager RPC Group in a challenge to a 3.3 billion pound ($4.3 billion) bid from the U.S. company’s former parent, Apollo Global. Apollo agreed to acquire RPC last week after months of negotiations, marking the latest M&A deal in the consolidating packaging sector. Private equity firm Apollo would not sweeten its offer of 782 pence per share, a source with knowledge of the matter told Reuters, despite grumbling at the relatively modest premium. “It (Apollo’s offer) is fully funded, it is deliverable in a short space of time and that is the final offer ... Apollo is not going to be sort of spooked into a bidding war,” the source said. RPC, Europe’s biggest plastic packaging company, said that it had received a request for information from plastics maker Berry Global, based in the town of Evansville, Indiana. “The board of RPC confirms that it will engage with Berry in accordance with its obligations under the (Takeover) Code and in order to advance discussions in the interests of delivering best value to shareholders,” RPC said in a statement. The packaging sector has seen a series of recent takeovers as investors are drawn to reliable cashflow underpinned by strong demand from online shopping. RPC’s shares were up 3.7 percent at 793 pence at 1440 GMT, comfortably above Apollo’s offer. Apollo’s offer represented a premium of 15.6 percent to RPC’s closing price on Sept. 7, the day before reports of takeover interests emerged. Royal London Asset Management, which owns a 1.33 percent stake in RPC, flagged the low offer price. “Apollo was always going to run this risk having pitched the bid at this level which has clearly given others encouragement,” said Craig Yeaman, fund manager at Royal London Asset Management. “Berry Global, being a competitor to RPC, would have plenty of synergies to go after and the first casualties could include senior management who were so willing to accept Apollo’s offer,” Yeaman said. (Graphic: Apollo offer fails to cheer RPC investors - tmsnrt.rs/2SffFPf) Aviva Investors, which owns a 1.93 percent stake in RPC according to Refinitiv Eikon data, has said it does not agree with the terms of Apollo’s offer. RPC, a FTSE listed mid-cap company, ended takeover talks with Bain Capital, another U.S. private equity firm, in December. Apollo declined to comment. RPC was founded in 1999 and produces a range of products from coffee capsules to healthcare products in 34 countries. Berry Global makes plastic containers, prescription vials and adhesives. Apollo and Graham Partners bought it in 2006 and it was listed in 2012. Goldman Sachs and Wells Fargo are joint financial advisers to Berry. ($1 = 0.7614 pounds)"
13.76410891589764," Berry Global considers possible cash offer for Apollo target RPC Jan 31 (Reuters) - U.S.-based Berry Global Group said on Thursday it was considering a possible cash offer for RPC Group, rivalling Apollo Global Management’s 3.3 billion pounds ($4.33 billion) deal to buy the British packaging products maker. Berry Global said it had requested due diligence information from RPC. ($1 = 0.7614 pounds) (Reporting by Noor Zainab Hussain in Bengaluru Editing by Saumyadeb Chakrabarty)"
21.452262231740562," Apollo Global to buy packaging group RPC for 3.3 billion pounds (Reuters) - Apollo Global Management is to buy packaging products maker RPC Group RPC.L for 3.3 billion pounds ($4.28 billion) in cash after months of negotiations, marking the latest M&A deal for an industry in the midst of a consolidation phase. The acquisition highlights how the sector’s reliable cashflow, driven by demand from online shopping, is proving attractive to private equity firms and bigger packaging players. RPC, Europe’s biggest plastic packaging maker, makes a range of products including packaging for beverages, coffee capsules and healthcare products. Apollo’s offer of 782 pence per share represents a premium of 15.6 percent to RPC’s closing price on Sept. 7, the last trading day before the offer period began. Aviva Investors, which owns a 1.93 percent stake in RPC according to Refinitiv Eikon data, said separately that it did not agree with the terms of Apollo’s offer. “In our view, this protracted bid process has not delivered fair value to RPC’s shareholders,” said David Cumming, Chief Investment Officer for Equities at Aviva Investors. The final offer price was some way behind what analysts had suggested was possible, said Nicholas Hyett, an analyst at Hargreaves Lansdown. Hyett said it was not impossible for a rival bidder to emerge but plastic packaging was far from popular at the moment and with the global economy looking rocky, it might be asking a bit much to expect a rival to pay around 4 billion pounds to keep RPC out of private equity hands. He also said that with board backing and minimal regulatory concerns, he expected the deal to go through. The RPC deal is not Apollo’s first foray into the plastics and packaging industry. The private equity firm previously owned U.S.-based Berry Plastics. Other M&A deals in packaging last year included Australia's Amcor Ltd's AMC.AX agreement to buy U.S. firm Bemis Co BMS.N for $5.25 billion and DS Smith Plc's SMDS.L $2.2 billion deal to acquire Spanish rival Europac PYCE.MC. The plastics industry is facing tighter regulation in Europe and elsewhere due to environmental concerns. RPC, which operates in 33 countries and employs about 25,000 people, said in September it was in talks on a possible sale to Apollo and another private equity firm Bain Capital. The deadlines on the deal for Apollo and Bain were repeatedly extended and Bain Capital ended talks in December. RPC had said last July that shareholder pressure was preventing it from pursuing some growth opportunities. RPC had been investing heavily to take advantage of Chinese demand as well as produce more recyclable plastics, prompting fears that higher spending would hit cash flow. Apollo’s affiliate will finance the deal through a combination of equity and debt provided by a number of banks. RPC’s London-listed shares rose as much as 5.5 percent to 774 pence, while Apollo’s shares were down 0.4 percent at $27.04 on the New York Stock Exchange. RPC’s shares ended at 766.50 pence, well below Apollo’s offer price of 782 pence per share. RPC was advised by Rothschild & Co, Credit Suisse CSGN.S and Evercore EVR.N. Barclays BARC.L and Citi C.N acted as lead financial advisers for Apollo. ($1 = 0.7717 pounds)"
20.848520630082266," RPT-UPDATE 2-Apollo Global to buy packaging group RPC for 3.3 bln pounds (Repeats to add pix to slug) * Deal latest in consolidation wave in packaging * Offer of 782 pence per share in cash * Deal to be financed through equity, debt * Shares rise 5.5 pct but still below offer price By Sangameswaran S and Arathy S Nair Jan 23 (Reuters) - Apollo Global Management is to buy packaging products maker RPC Group for 3.3 billion pounds ($4.28 billion) in cash after months of negotiations, marking the latest M&A deal for an industry in the midst of a consolidation phase. The acquisition highlights how the sector’s reliable cashflow, driven by demand from online shopping, is proving attractive to private equity firms, as well as a spate of takeovers by bigger packaging players. RPC, Europe’s biggest plastic packaging maker, makes a range of products including packaging for beverages, coffee capsules and healthcare products. Apollo’s offer of 782 pence per share represents a premium of 15.6 percent to RPC’s closing price on Sept. 7, the last trading day before the offer period began. RPC’s shares rose on Wednesday as much as 5.5 percent to 774 pence. Nicholas Hyett, analyst at Hargreaves Lansdown, said the final offer price was some way behind what analysts had suggested was possible. Hyett said it was not impossible for a rival bidder to emerge but plastic packaging was far from popular at the moment and with the global economy looking rocky, it might be asking a bit much to expect a rival to pay around 4 billion pounds to keep RPC out of private equity hands. He also said that with board backing and minimal regulatory concerns, he expected the deal to go through. The RPC deal is not Apollo’s first foray into the plastics and packaging industry. The private equity firm previously owned Berry Plastics, now called Berry Global, a U.S.-based plastics manufacturer and marketer. Other M&A deals in packaging last year included Australia’s Amcor Ltd agreement to buy U.S. firm Bemis Co for $5.25 billion, while DS Smith Plc spent about $2.2 billion to acquire Spanish rival Europac. The plastics industry is facing tighter regulation in Europe and elsewhere due to environmental concerns. RPC, which operates in 33 countries and employs about 25,000 people, said in September it was in talks on a possible sale to Apollo and another private equity firm Bain Capital. The deadlines on the deal for Apollo and Bain were repeatedly extended and Bain Capital ended talks in December. RPC had said last July that shareholder pressure was preventing it from pursuing some growth opportunities. RPC had been investing heavily to take advantage of China demand as well as produce more recyclable plastics, prompting fears that higher spending would hit cash flow. Apollo’s affiliate will finance the deal through a combination of equity and debt provided by a number of banks. RPC was advised by Rothschild & Co, Credit Suisse and Evercore. Barclays and Citi acted as lead financial advisers for Apollo."
20.848520630082266," REFILE-Apollo Global to acquire RPC for 3.3 bln pounds (Changes media packaging code, corrects dateline to Jan 23 from Jan 22) Jan 23 (Reuters) - RPC Group said on Wednesday Apollo Global Management agreed to buy Europe’s biggest plastics packaging maker for 3.3 billion pounds ($4.28 billion) in cash, ending months of negotiations. The per-share offer of 782 pence represents a premium of 15.6 percent to RPC’s closing price of 683.6 pence on Sept. 7, the last trading day before the offer period began. ($1 = 0.7717 pounds) (Reporting by Sangameswaran S in Bengaluru; Editing by Anil D’Silva)"
21.683215749461944," Apollo nears $3.8 billion-plus deal for packaging group RPC: WSJ (Reuters) - Private equity company Apollo Global Management APO.N is in advanced talks to buy Europe's biggest plastics packaging maker RPC Group RPC.L for more than $3.8 billion, the Wall Street Journal reported on Monday. RPC on Friday extended the deadline to Jan, 23 for Apollo to make a firm offer or walk away. Citing people familiar with the matter, the Journal said that a deal could be announced as soon as Tuesday. Private equity has long been attracted to the sector’s reliable cash flow and growing demand from online shopping, with a spate of takeovers by bigger packaging players further spurring their interest. RPC, which operates in 34 countries, on Monday had a market capitalization of 3.26 billion pounds ($4.2 billion). The company said in September that it was in talks on a possible sale to Apollo and U.S. private equity firm Bain Capital, with the deadlines to make a firm offer extended repeatedly since then. The FTSE mid-cap company ended talks with Bain in December. RPC declined to comment when contacted by Reuters and Apollo could not be reached for comment outside normal business hours. (This story corrects the market cap in paragraph five)"
21.683215749461944," Apollo nears deal to buy RPC Group for over $3.8 bln -WSJ Jan 21 (Reuters) - Private equity company Apollo Global Management LLC is in advanced talks to buy Europe's biggest plastics packaging maker RPC Group Plc for more than $3.8 billion, the Wall Street Journal reported on.wsj.com/2RHnm0W on Monday, citing people familiar with the matter. Neither company was immediately available for comment. (Reporting by Kanishka Singh in Bengaluru Editing by Nick Zieminski)"
12.961149361684122," Private equity suitor Apollo gets more time to make RPC offer (Reuters) - RPC Group RPC.L, Europe's biggest plastics packaging maker, said on Friday the deadline for its private equity suitor Apollo Global Management APO.N to make a firm offer for the company has been extended to Jan. 23. RPC Group, which first announced the talks in September last year, said the takeover panel granted the extension on the company’s request and that discussions with Apollo are ongoing. RPC Group shares reversed course to trade 1 percent up after the extension of deadline."
8.167617679300648," MOVES- Apollo Global Management, Willis Towers, Principal Global Jan 15 (Reuters) - The following financial services industry appointments were announced on Tuesday. To inform us of other job changes, email moves@thomsonreuters.com. The private equity firm said it was promoting Anthony Civale and Martin Kelly to co-chief operating officers, deepening its bench of potential successors to co-founder and Chief Executive Officer Leon Black. The advisory and broking firm named Jonathan Oppenheim as regional construction leader in its southeast region. He will be based in Atlanta. The asset management firm named Xin Shao as managing director for China. (Compiled by Shradha Singh in Bengaluru)"
8.167617679300648," Apollo Global nears deal to buy Arconic for more than $10 billion: WSJ (Reuters) - Apollo Global Management LLC APO.N is nearing a deal to buy U.S. aluminum products maker Arconic Inc ARNC.N for more than $10 billion, the Wall Street Journal reported on Tuesday. The private equity firm would pay between $21 and $22 per share in a deal that would likely be announced this week, the report said, citing people familiar with the matter. The deal would represent a premium of 10 percent or more as the shares were recently trading just above $19, according to the report. Arconic shares rose almost 4 percent, while Apollo shares were up 2 percent on Tuesday. Reuters had reported in October that Apollo Global was in advanced negotiations to acquire Arconic. Elliott Management Corp, the activist hedge fund that sits on Arconic board, is working to address potential liabilities weighing on the sale process for the U.S. aluminum products maker, Reuters had reported in November. Arconic declined to comment, while Apollo Global did not immediately respond to a Reuters request for comment."
8.167617679300648," Apollo Global nears deal to buy Arconic for more than $10 bln - WSJ Jan 15 (Reuters) - Apollo Global Management LLC is nearing a deal to buy U.S. aluminum products maker Arconic Inc for more than $10 billion, the Wall Street Journal reported on Tuesday. The private equity firm would pay between $21 and $22 per share in a deal that would likely be announced this week, the report here said, citing people familiar with the matter. Arconic shares rose almost 4 percent, while Apollo shares were up 1 percent. Reuters had reported in October that Apollo Global was in advanced negotiations to acquire Arconic. Both companies did not immediately respond to a Reuters request for comment. (Reporting by Sanjana Shivdas in Bengaluru; Editing by James Emmanuel)"
14.870116603749961," Buyout firm Apollo eyes deal for GE's aircraft leasing unit: sources (Reuters) - Private equity firm Apollo Global Management LLC APO.N is working on an offer to acquire General Electric Co's aircraft leasing operations, which are worth as much as $40 billion, people familiar with the matter said on Friday. Apollo’s bid comes as GE’s new chief executive officer, Larry Culp, is battling to restore profits and slash debt after the industrial conglomerate lost $22.8 billion in the third quarter, mostly from its ailing power unit. GE GE.N is already pressing on with divesting several assets, including spinning off its healthcare unit and shedding its stake in oilfield services company Baker Hughes BHGE.N. Apollo's offer could put pressure on GE to also sell the aircraft unit, known as GE Capital Aviation Services (GECAS). Apollo is looking at financing its bid partly through debt and equity provided by Athene Holding Ltd ATH.N, the annuity provider for which it provides asset management services, the sources said. Apollo's private equity funds, co-investment from Apollo's investors, and debt financing from banks will also help fund the deal, the sources added. In addition, Apollo is open to exploring a transaction for GE’s long-term-care insurance business, whose liabilities have emerged as a significant burden, according to the sources. GE has not yet agreed to a deal with Apollo, the sources said. The company could decide to explore a deal with other buyers or not sell GECAS at all, the sources added, asking not to be identified because the matter is confidential. Apollo and GE declined to comment. Bloomberg News first reported on Apollo’s offer. GECAS has a fleet of more than 1,900 planes, which it provides to airlines under long-term leases. Consolidation in the sector has intensified in the last few years, as Asian competitors chip away at the market shares of GECAS and its rival AerCap Holdings NV AER.N. GECAS is a unit of GE Capital, which GE has been trimming since the 2008 financial crisis. In 2015, it clinched a deal to sell most of GE Capital's real estate assets to Blackstone Group LP BX.N and Wells Fargo & Co WFC.N for $23 billion. Apollo has done several deals with GE. In October, Apollo agreed to buy a portfolio of $1 billion in energy investments from GE Capital. In 2015, Mubadala GE Capital, a joint venture between Abu Dhabi state fund Mubadala and GE Capital, agreed to sell a $3.6 billion portfolio of corporate and real estate loans in the United States and Europe to Apollo."
16.266075398931086," Arconic shares jump after report of buyout by Apollo Global (Reuters) - Shares of Arconic Inc ARNC.N closed up 9.7 percent after Bloomberg reported that Apollo Global Management LLC APO.N is in talks to buy the U.S. aluminum products maker for about $22 a share, citing people familiar with the matter. The deal could be reached by mid-January, and the two companies are negotiating one that would protect Apollo from Arconic’s possible liability tied to a deadly apartment fire in London in 2017, according to the report. Elliott Management Corp, the activist hedge fund that sits on Arconic board, is working to address potential liabilities weighing on the sale process for the U.S. aluminum products maker, Reuters had reported in November. Elliott’s move comes after Arconic had rejected an acquisition offer of more than $11 billion from Apollo Global Management as inadequate. Apollo and Arconic did not immediately respond to a Reuters request for comment. (This story removes extraneous words in lede)"
26.952962996891337," China's HNA in talks to sell Ingram Micro to Apollo Global: source (Reuters) - HNA Group Co [HNAIRC.UL] is in talks to sell Ingram Micro Inc to private equity firm Apollo Global Management Llc APO.N, a source familiar with the matter said on Friday, as the Chinese conglomerate continues to scale back operations. HNA hopes to sell the U.S. electronics distributor for $7.5 billion, including $1.5 billion in debt, the source said, adding that it is currently in talks with Apollo after rebuffing an earlier offer that it considered too low. HNA has already pushed ahead with asset sales that have so far included real estate and stakes in hotels groups. Apollo declined to comment and Ingram was not immediately available for comment. HNA was not available for comment outside normal business hours in China. The Wall Street journal first reported here the news on Friday. Earlier this month, Reuters reported that China Development Bank was leading a team to supervise HNA’s asset disposals as the heavily indebted conglomerate unwinds a $50 billion acquisition spree and scales back to a point that will leave it holding only core assets. Bad debt managers China Cinda Asset Management Co 1359.HK advised HNA and has been involved in talks with potential buyers for Ingram, which HNA bought for $6 billion in 2016, Reuters reported in November. HNA Technology Co 600751.SS, which owns Ingram, said in September it had $3.55 billion of outstanding debt from the purchase of the firm, of which $350 million was due for payment this year."
26.952962996891337," UPDATE 2-China's HNA in talks to sell Ingram Micro to Apollo Global - source (Changes sourcing) Dec 21 (Reuters) - HNA Group Co is in talks to sell Ingram Micro Inc to private equity firm Apollo Global Management Llc, a source familiar with the matter said on Friday, as the Chinese conglomerate continues to scale back operations. HNA hopes to sell the U.S. electronics distributor for $7.5 billion, including $1.5 billion in debt, the source said, adding that it is currently in talks with Apollo after rebuffing an earlier offer that it considered too low. HNA has already pushed ahead with asset sales that have so far included real estate and stakes in hotels groups. Apollo declined to comment and Ingram was not immediately available for comment. HNA was not available for comment outside normal business hours in China. The Wall Street journal first reported here the news on Friday. Earlier this month, Reuters reported that China Development Bank was leading a team to supervise HNA’s asset disposals as the heavily indebted conglomerate unwinds a $50 billion acquisition spree and scales back to a point that will leave it holding only core assets. Bad debt managers China Cinda Asset Management Co advised HNA and has been involved in talks with potential buyers for Ingram, which HNA bought for $6 billion in 2016, Reuters reported in November. HNA Technology Co, which owns Ingram, said in September it had $3.55 billion of outstanding debt from the purchase of the firm, of which $350 million was due for payment this year. (Reporting by Greg Roumeliotis in New York and Uday Sampath in Bengaluru; Editing by Arun Koyyur)"
26.952962996891337," RPC pushes deadline for Apollo to make offer Dec 21 (Reuters) - RPC Group Plc on Friday yet again pushed the deadline by which Apollo Global Management must make a firm offer to buy the London-listed plastics packaging firm or walk away. The fourth such extension of the deadline gives the U.S. private equity firm time until Jan. 18 to make a firm buyout offer. “Discussions are well advanced and Apollo has confirmed to RPC that its diligence is now substantially complete,” RPC said in a statement. U.S.-based Bain Capital was also in discussions with RPC for a possible buyout but talks ended early this month, leaving Apollo in the lead to buy Europe’s biggest plastics packager. (Reporting by Samantha Machado in Bengaluru; Editing by Sai Sachin Ravikumar)"
