18.08297591539172," Private equity can still find 'diamonds in the rough': Apollo exec NEW YORK (Reuters) - Private equity billionaire Joshua Harris thinks there are still plenty of undervalued companies to improve and profit from, especially away from the public markets. “Certainly, this is not a value-oriented environment,” said Harris, senior managing director of Apollo Global Management, “but we’re able to find really interesting diamonds in the rough.” Harris, speaking at the CNBC Institutional Investor Delivering Alpha conference, said Apollo saw opportunity in taking public companies private. Harris cited Apollo’s purchase of Aspen Insurance Holdings for $2.6 billion in August 2018 and Smart & Final Stores for $1.1 billion in April 2019 as examples. There is likely more to come: The New York Post reported Apollo wants to buy publicly traded Hilton Grand Vacations Inc, the hotel chain’s time-share operator, for $2.4 billion. Harris said at the New York event that sectors still under significant pressure, including banking, insurance and energy, still needed capital and provided opportunity for firms like Apollo. Generally, Harris said that private equity profits “have come down a bit,” but that they “still way better” than returns in the public market, such as stocks. Investors seem to agree: Earlier this year, the firm said it planned to raise around $9 billion. Apollo, founded in 1990, already has $319 billion in committed capital. Some $77 billion of that is in private equity funds, including $24.7 billion for its latest portfolio, Fund IX, which was closed in 2017."
18.341204333810165," Apollo Global, Athene to buy GE Capital's aircraft lending unit (Reuters) - Apollo Global Management APO.N and Athene Holding ATH.N said on Thursday they would buy PK AirFinance, an aircraft lending business that is a part of GE Capital's aviation services unit for an undisclosed amount. Private equity firm Apollo would acquire PK AirFinance's aircraft lending platform, and life insurance holding company Athene would acquire its existing portfolio of loans, the companies said in a statement. (reut.rs/2ZAC2y6) The deal is expected to close in the fourth quarter of 2019. Citi and Goldman Sachs & Co. LLC were financial advisers to GE Capital and RBC Capital Markets advised Apollo."
20.56370771261688," TV station operator Tegna confirms buyout interest from Apollo Global Aug 21 (Reuters) - U.S. TV station operator Tegna Inc on Wednesday confirmed it received buyout interest from Apollo Global Management but said the private equity firm had not specified a price. The company said Apollo disclosed its interest in a letter in late February. Tegna’s shares fell 6% in early trading. In June, Apollo made another proposal to merge Tegna into some of the other broadcast assets it has been buying, in a deal that would not have changed the ownership of the broadcaster, Tegna said in a statement. Last week, the Wall Street Journal reported that Apollo Global had approached Tegna about a sale earlier this year, citing people familiar with the matter. Tegna said it would not make any further disclosures about the matter. (Reporting by C Nivedita in Bengaluru Editing by Saumyadeb Chakrabarty)"
37.28126340580696," Apollo Global approached media company Tegna for a deal earlier this year: WSJ (Reuters) - Private equity firm Apollo Global Management APO.N has approached TV station operator Tegna Inc TGNA.N about a sale earlier this year, the Wall Street Journal reported, citing people familiar with the matter. Tegna’s shares were up 5% in extended trading after closing 10.21% higher after the report on Friday. Apollo first contacted Tegna about a potential transaction at the beginning of the year, and later sent a formal letter to the board in February, the newspaper said. Apollo Global declined to comment, while Tegna did not immediately respond to a Reuters request for comment."
26.699549853673375," Apollo posts second-quarter distributable earnings just shy of estimates (Reuters) - Alternative asset manager Apollo Global Management APO.N said on Wednesday second-quarter distributable earnings rose 7% year on year, as growth in transaction and management fees from its credit business helped offset a decline in earnings from private equity and real assets. Apollo said after-tax distributable earnings (DE) – the cash available for paying dividends – rose to $230.8 million in the second quarter of 2019, compared with $218.2 million a year earlier. The New York-based firm said DE per share rose to 56 cents per share, from 52 cents per share a year earlier. That was just shy of the average analyst forecast of 57 cents, according to data compiled by Refinitiv. Jefferies analysts Gerald O’Hara and Daniel Fannon, who rates Apollo’s stock “buy,” said in a note to investors that the company’s earnings “reflect relatively muted exit activity” during the quarter, referring to asset sales. Apollo’s performance fee income rose to $176.9 million from $129 million a year earlier owing to fewer asset sales across its private and public investments. The earnings lag slightly the trend set by private equity rivals Blackstone Group LP BX.N, Carlyle Group CG.O and KKR & Co Inc KKR.N, whose second quarter earnings beat analysts' estimates. Under generally accepted accounting principles (GAAP), Apollo said net income per share on a diluted basis rose to 75 cents per share, up from 25 cents per share a year earlier. Blackstone and KKR reported 45 cents per share and 93 cents per share respectively. Fees earned from its credit business, which accounts for more than half of Apollo’s asset under management, rose 40% during the quarter. This was driven mainly by earnings from fundraising activity and management fees from permanent capital. Total asset under management rose to $311.9 billion, up 3% from three months earlier. Apollo declared a distribution of 50 cents per share."
26.699549853673375," Apollo CEO says coverage of Epstein ties not affecting investor relationships (Reuters) - Apollo Global Management LLC APO.N Chief Executive and co-founder Leon Black said on Wednesday the ongoing press coverage of his ties to Jeffrey Epstein, the financier facing charges of sex trafficking involving dozens of underage girls, is not affecting Apollo's relationship with investors. “The tsunami of press attention is not affecting our relationship with investors,” Black said during Apollo’s second quarter earnings call. Epstein was a tax and estate-planning adviser to Black for many years and also served as a director for the Debra and Leon Black Family Foundation. In a memo to Apollo employees, Black had said Epstein was asked to resign in 2007 and did no business with the private equity firm."
19.228760974578293," Starwood, Apollo bid for $4 billion GE air-finance unit: Bloomberg (Reuters) - Starwood Capital Group and Apollo Global Management APO.N have submitted offers to buy an aircraft-financing business owned by General Electric Co GE.N that could be valued at about $4 billion, Bloomberg reported on Tuesday, citing people familiar with the matter. GE is working with advisers as it explores a possible sale of PK AirFinance, a unit of the company's broader aircraft-leasing business known as GECAS, and has received interest from potential suitors, some of which have advanced into the next round of bidding, according to the report. (bloom.bg/2M9iZI6) GE and Apollo Global declined to comment, while Starwood Capital was not immediately available to a Reuters request for comment."
19.228760974578293," CORRECTED-Starwood, Apollo bid for $4 bln GE air-finance unit - Bloomberg (Corrects to say Starwood Capital did not immediately respond to a Reuters request for comment, not declined to comment, in third paragraph) July 23 (Reuters) - Starwood Capital Group and Apollo Global Management have submitted offers to buy an aircraft-financing business owned by General Electric Co that could be valued at about $4 billion, Bloomberg reported on Tuesday, citing people familiar with the matter. GE is working with advisers as it explores a possible sale of PK AirFinance, a unit of the company's broader aircraft-leasing business known as GECAS, and has received interest from potential suitors, some of which have advanced into the next round of bidding, according to the report. (bloom.bg/2M9iZI6) Starwood Capital, GE and Apollo Global did not immediately respond to a Reuters request for comment. (Reporting by Shanti S Nair in Bengaluru; Editing by Anil D’Silva)"
18.615367480962316," Exclusive: Apollo Global makes offer for France's Coface: sources (Reuters) - Buyout firm Apollo Global Management LLC APO.N has approached Coface SA COFA.PA, the credit insurance company partly owned by French bank Natixis SA CNAT.PA, with an acquisition offer, people familiar with the matter said on Friday. The potential deal would allow Natixis, owned by French cooperative lender BPCE, to cash out on its remaining 42 percent stake in Coface following an initial public offering of the company in 2014. The deal talks between Apollo and Coface are at an early stage, and there is no certainty they will result in an agreement, the sources said, asking not to be identified because the matter is confidential. Details of the price negotiations could not be learned. Coface did not immediately respond to a request for comment, while Apollo declined to comment. Coface shares jumped 8.4 percent on the news to 10.70 euros, giving the company a market capitalization of 1.6 billion euros ($1.8 billion). Coface provides credit insurance to protect companies against potential nonpayment by their customers. It also offers debt collection, factoring and market research services to its clients. Natixis was one of the French banks hardest hit by the crisis in 2007, when the collapse of bonds backed by poor quality mortgages - dubbed subprime - spread through financial markets. Natixis eventually had to be rescued by its parent bank, BPCE. Natixis, France’s fourth largest listed bank, has sold businesses related to retail banking such as consumer lending and factoring to BCPE for 2.7 billion euros, in order to focus on investment banking, asset management and insurance. Apollo Global is a New York-based investor in private equity and corporate credit assets with assets under management of $303.3 billion as of the end of March."
18.546110833211845," Generali buys Portuguese assets from Apollo for $674 million MILAN (Reuters) - Italy's top insurer Assicurazioni Generali GASI.MI has reached a deal to buy Portuguese insurer Seguradoras Unidas and a smaller service company from U.S. fund Apollo Global Management APO.N for a total of 600 million euros ($674 million), it said on Thursday. Seguradoras Unidas, also known as Tranquilidade, is the second largest non-life business operator in Portugal with a 15.5% market share in the segment. Generali said it had agreed to buy the company for 510 million euros, while it will pay 90 million euros for AdvanceCare, a service platform operating primarily in the healthcare sector also owned by Apollo. Reuters reported on July 9 that Generali had entered exclusive negotiations to buy Tranquilidade to boost its presence in Portugal, citing two sources familiar with the matter. ($1 = 0.8908 euros)"
22.556056939261175," Italian banks reject Apollo's rescue plan for Carige ROME (Reuters) - Italy’s banking fund FITD said on Monday it had rejected a rescue plan presented by a private equity fund for ailing lender Banca Carige. In a statement, the fund did not name the private equity but sources had told Reuters last week that U.S. private equity fund Apollo Global Management, which already owns Carige’s insurance units, had presented its offer. The FITD did not give a reason for the rejection on Monday but only said that it “was not in a position to accept a private equity fund’s draft plan in its current state”. However, one source close to the bank said Apollo was expected to present a new rescue plan in the coming hours. FITD added it was ready to consider alternative solutions involving the bank’s current shareholders and other private or public investors. Carige, which was placed under special administration by the European Central Bank in January, has a capital shortfall of 630 million euros ($717 million). Carige’s temporary administrators have been trying to find a buyer for months but their efforts were thrown into disarray last month when BlackRock pulled out of a proposed rescue plan. That plan included the conversion into equity of a 320 million euro bond held by the FITD deposit guarantee fund. FITD said it would start a detailed analysis of Carige’s capital needs on Tuesday. Bank rescues are sensitive in Italy, where an anti-establishment government has campaigned against EU “bail-in” rules that limit the use of public money to prop up ailing lenders. EU antitrust regulators blocked the rescue of Tercas in 2015 because it was carried out with money from FITD. Brussels considered the bailout breached EU state aid rules because it said the fund had acted on behalf of the Italian state, effectively providing unfair subsidies to the bank. The EU General Court overturned that decision in March, ruling that the fund had acted independently. A source close to the FITD, said on Monday, that thanks to this ruling, the FITD, which has 1.5 billion euros of liquidity, could inject cash into Carige without breaking EU antitrust rules. However, the European Commission appealed against the EU court ruling last month, paving the way for a long legal dispute which could prevent the Italian government from using the easier terms of the Tercas rescue for future bank bailouts."
21.706986313532003," U.S. fund Apollo presents rescue plan for Italy's Carige: sources MILAN (Reuters) - U.S. private equity fund Apollo Global Management has presented a draft rescue plan for Italy’s troubled bank Carige, three sources close to the matter said. Meanwhile, Italian banks are considering whether they could step in to plug Carige’s entire capital shortfall, the head of a deposit guarantee fund made up of all of the country’s banks said on Wednesday. Carige, which was placed under special administration by the European Central Bank in January, has a capital shortfall of 630 million euros ($706 million). Carige’s temporary administrators have been trying to find a buyer for months but their efforts were thrown into disarray last month when BlackRock pulled out of a proposed rescue plan. That plan included the conversion into equity of a 320 million euro bond held by the FITD deposit guarantee fund. Two of the sources said on Wednesday Apollo, which already owns Carige’s insurance units, had presented its offer through Italian broker Equita, which is acting as its adviser. Salvatore Maccarone, who heads the FITD fund, said it had received an offer by an unnamed party, but it was still at such an early stage that the fund could not assess it. Apollo was not immediately available for comment. Italian newspaper Il Messaggero said on Wednesday the offer by Apollo called for a capital increase of 450-500 million euros, of which the U.S. fund would cover around 120-130 million euros. The banks would plug the bulk of the remainder through the 320 million euros bond conversion, which would give them a controlling stake in Carige. According to the paper, Apollo wants an option to buy the banks’ stake in Carige for 1 euro. Such a plan might be difficult to swallow for both Italy’s government and the country’s banks. Maccarone said on Wednesday the banks were considering whether to plug Carige’s entire capital shortfall themselves, without Apollo’s intervention. Back in 2016, the U.S. fund had offered to buy a controlling stake in Carige in a 550-million euros cash call, but the bank’s top shareholder - the Malacalza family of steel entrepreneurs - rejected the bid saying it did not reflect Carige’s market value. The Malacalzas have a 27.6 percent stake in Carige. Vittorio Malacalza was quoted as saying at the weekend that Apollo’s renewed interest for the bank was not based on an industrial project."
22.348204437629853," Apollo in talks to finance Dish Network bid for T-Mobile, Sprint assets - sources (Reuters) - Private equity group Apollo Global Management is in talks with satellite TV provider Dish Network to finance a bid for wireless assets that will be divested in the proposed merger between T-Mobile and Sprint Corp, according to two people familiar with the matter. The two U.S. wireless carriers have agreed to sell prepaid brand Boost Mobile to gain regulatory approval for the $26 billion merger. Sources said that Dish is interested in the assets. The talks between Apollo and Dish demonstrate private equity interest in the wireless business as regulators are pushing to create a viable fourth U.S. wireless competitor, even as the nation’s third- and fourth-largest carriers are combining. Dish and Apollo declined to comment. There is no certainty that Apollo will participate in Dish’s bid, and Apollo may decide to finance another bidder or pass on the opportunity, one of the sources said. The U.S. Department of Justice has been in discussions with Dish, Altice USA and Charter Communications to purchase wireless assets from the merger to preserve competition in the industry, according to sources familiar with the matter. The Justice Department is expected to decide whether to approve the merger as early as next week, a source has told Reuters. Over the past few weeks, regulators have held discussions with potential bidders about what would constitute a wireless company that could compete with larger carriers Verizon, AT&T and the combined T-Mobile. Dish has stockpiled wireless spectrum, or airwaves that carry data, and is facing a deadline next year to build a network that fulfills the license requirements or risk losing the license. The company, controlled by founder Charlie Ergen, met with the Federal Communications Commission on June 11 to discuss the impact of the merger on its plans to enter the wireless market, according to a regulatory filing."
24.240506364824643," Brazil's Klein eyes Via Varejo bid with Apollo, Starboard - newspaper SAO PAULO, June 11 (Reuters) - Brazilian businessman Michael Klein, whose family holds a 25.2% stake in Via Varejo SA , met with Starboard Partners and Apollo Global Management to discuss a potential joint bid for the country’s biggest appliances retailer, newspaper Valor Econômico reported on Tuesday. The newspaper, which did not name any sources, said the meeting between Klein and representatives of both funds took place last Friday to discuss the matter. Via Varejo declined to comment. Michael Klein, Apollo and Starboard did not immediately respond to requests for comment. Talks between Klein and the funds are still in a preliminary stage, Valor said citing unnamed sources. Last week, Klein told Via Varejo he was in talks to hire XP Investimentos SA as a financial adviser as he considered raising his stake. Klein’s tentative plan, Valor said, would be to join forces with local and international investment vehicles to acquire a 36% stake worth 2.37 billion reais ($613 million) on the stock exchange. Klein confirmed to Valor he had hired XP as financial adviser to evaluate the acquisition of an additional stake in Via Varejo, without naming potential partners he was contacting. ($1 = 3.8664 reais) (Reporting by Ana Mano Editing by Susan Thomas)"
24.240506364824643," Buyout firm Apollo Global agrees to acquire Shutterfly (Reuters) - Private equity firm Apollo Global Management LLC said on Monday it had agreed to acquire U.S. digital imaging company Shutterfly Inc for $2.7 billion, including the company’s $900 million debt. The deal, first reported by Reuters on Monday, is the culmination of several years of private equity interest in Shutterfly, which allows customers to make photo books, cards and gifts from their photos. Its business has become increasingly commoditized and competitive, forcing it to explore a sale. Apollo said it would pay $51 per share in cash for Shutterfly, a 13% premium to the company’s value on Feb. 5, the last trading day before it announced it would explore a sale. Apollo also announced it would acquire privately held Snapfish LLC, a small internet-based retailer of photography products, to merge it with Shutterfly. Headquartered in Redwood City, California, Shutterfly makes personalized consumer photo products such as photo books, holiday cards, invitations and stationary. Founded in 1999, Shutterfly faces increasing competition from other online digital photography services companies such as Snapfish and Vistaprint, as well as brick-and-mortar retailers, such as Wal-Mart, Costco and Target, that offer low-cost digital photography products and services. Shutterfly was approached by several buyout firms over the years about a deal, including by Thomas H. Lee in 2016 and Silver Lake Partners LP in 2014, Reuters has previously reported. In February, Shutterfly said its board had formed a committee to explore its options with the help of investment bank Morgan Stanley after receiving acquisition interest from an undisclosed party. The company also announced that its Chief Executive Christopher North would leave the company in August. Shutterfly last year acquired privately held Lifetouch, which helps schools and families shoot professional photos, for $825 million in cash."
22.81873054420725," Shutterfly to be bought by Apollo Global in a $2.7 billion deal (Reuters) - Digital imaging company Shutterfly Inc has agreed to be acquired by Apollo Global Management LLC in a $2.7 billion deal, the private equity firm said on Monday. Apollo’s cash offer of $51 per share represents a premium of about 1.5% to Shutterfly’s closing price on Monday. Earlier on Monday, Reuters reported that Apollo was in the lead to acquire Shutterfly. (reut.rs/2WZY8wB)"
1.5774666772971961," Apollo in talks to back Jupiter's U.S. crude pipeline, export projects: sources HOUSTON/NEW YORK (Reuters) - Private equity firm Apollo Global Management LLC is in advanced talks to help finance a proposed oil pipeline and export terminal on the U.S. Gulf Coast, according to people familiar with the discussions. The talks between Apollo and Jupiter Energy Group are the latest example of investors looking for oil infrastructure deals that tie booming U.S. shale production in West Texas and New Mexico to Gulf Coast export hubs. At least eight crude export facilities capable of loading supertankers also have been proposed for the U.S. Gulf Coast, to provide an outlet for record U.S. oil production which last year surpassed Saudi Arabia and Russia to become No. 1 in the world. Apollo’s investment would be dependent on Jupiter securing commitments from producers willing to transport crude in its pipeline, as well as regulatory approvals, according to the people, who spoke on condition of anonymity as the information is not public. Apollo declined to comment. Jupiter late last year proposed a crude pipeline and export facility off Brownsville, Texas, that would compete with similar projects advanced by Enterprise Products Partners LP, Enbridge Inc, and commodities trader Trafigura AG. Investors Carlyle Group LP and Blackstone Group LP separately are backing planned crude export facilities in Corpus Christi, Texas, and Venice, Louisiana, respectively. Jupiter’s open season to solicit shipper commitments for its proposed 650-mile (1,046-km) oil pipeline from the Permian to Brownsville ends on May 31."
