2.0276469921583677," Apollo-backed SPAC aims to raise $400 million in U.S. IPO (Reuters) - A blank-check company backed by private equity firm Apollo Global Management Inc APO.N said on Friday it was looking to raise $400 million in a U.S. initial public offering. Spartan Acquisition Corp II is aiming to sell 40 million units at $10 apiece, the company said in a filing here. It is a special acquisition purpose company (SPAC) that is looking to invest in a business focused on energy transition and sustainability. A SPAC is a shell vehicle that raises money in an IPO to buy and then merge with another company, typically within two years. Several high-profile investors such as Bill Ackman and Michael Klein have raised billions through their SPACs this year. In July, another Apollo-backed SPAC called Spartan Energy Acquisition Corp SPAQ_u.N said it will take electric-car maker Fisker public at a valuation of $2.9 billion. Citigroup, Credit Suisse, Cowen and Morgan Stanley are the book-running managers to Spartan Acquisition’s offering."
7.2028555894321205," ADNOC and Apollo-led consortium close $5.5 billion real estate investment partnership DUBAI (Reuters) - The Abu Dhabi National Oil Company (ADNOC) said on Tuesday it closed its $5.5 billion real estate investment partnership with entities owned and/or advised by Apollo Global Management Inc APO.N subsidiaries and a group of institutional investors. The closing takes the combined investment in select ADNOC real estate assets by the investor consortium to $2.7 billion, the company said in a statement. The Apollo-led consortium collectively holds a 49% stake in Abu Dhabi Properly Leasing Holding Company RSC Limited (ADPLHC). ADNOC retains a 51% majority stake, according to the statement."
5.636696516369776," Caesars shoots lower than expected with $3.7 billion William Hill bid (Reuters) - Caesars CZR.O is in advanced takeover talks with William Hill WMH.L that value the British bookmaker at 2.9 billion pounds ($3.7 billion) and would give the casino operator full control of a quickly expanding U.S. sports-betting and online business. Caesars was considering offering 272 pence per share and William Hill’s board was inclined to recommend such an offer to shareholders, the companies said on Monday. William Hill shares on Friday surged to more than 312 pence each after it said it had received separate offers from Caesars and buyout group Apollo APO.N. Those gains were handed back on Monday, however, leaving the stock at 273 pence, suggesting that even if Apollo counters, investors now expect the price to be far lower. Caesars only holds 20% of its U.S. joint venture with William Hill but the business is built on a presence in Caesars casinos and its brand name, which the casino owner said it would have the right to terminate in the event of an Apollo buyout. The bid significantly undervalues the company but there seems limited scope for bid competition due to the joint venture terms and also since William Hill’s board said it would be minded to recommend the offer, Jefferies analysts said. Apollo did not immediately respond to a Reuters’ request for comment outside usual business hours. Stifel analyst Bridie Barrett said the brokerage’s valuation range for William Hill is 270 pence to around 400 pence. “While a termination of the relationship with William Hill under new ownership makes little business sense, it does add risk for a private equity acquisition...a price at the upper end of our range is unlikely,” Barrett said. William Hill’s shares were already trading close to two-year highs before news of the proposals, having fallen to their lowest in 20 years in March. It has offset regulatory pressure at home by expanding in the U.S. and partnering with CBS Sports and ESPN to cash in on the relaxation of sports betting rules there. To fund the deal, Caesars said it was raising equity and would take out $2 billion of new debt secured against William Hill’s non-U.S. businesses. Caesars said the enlarged sports and online gaming business in the U.S. could generate between $600-$700 million in net revenue in FY2021. The offer comes soon after Eldorado Resorts completed buying bigger rival Caesars for about $8.5 billion, creating a new competitor for larger sector players like Las Vegas Sands LVS.N and Wynn Resorts WYNN.O."
11.019874222700619," William Hill shares surge 20% on report of Apollo bid approach LONDON (Reuters) - Shares in William Hill WMH.L surged over 20% on Friday after a news report by Bloomberg said the UK bookmaker had been approached by private equity firm Apollo Global Management APO.N for a potential acquisition. Representatives for William Hill and Apollo Global Management did not immediately respond to a request for comment. At 1156 GMT, William Hill shares were trading up 19% at 259.3 pence."
8.178186190955463," Covestro denies it is in takeover talks with Apollo MUNICH (Reuters) - German plastics maker Covestro 1COV.DE rejected a report on Friday that it was in takeover talks with private equity firm Apollo Global Management APO.N. Shares in the blue-chip company were trading up 6.1% by 0723 GMT, having risen as much as 11% in pre-market trade following a Bloomberg report that Apollo was exploring a takeover. “We are not in takeover talks with Apollo,” spokesman Lars Boelke said. “We are regularly in talks with various market participants about strategic opportunities.” Apollo could not immediately be reached for comment. Shares in Covestro, which was spun out from Bayer BAYGn.DE in 2015, have shed more than half of their value since hitting a peak in February 2018. It had a market value of 8.14 billion euros ($9.64 billion) as of Thursday’s market close, Refinitiv Eikon data showed. The company told Reuters last month it was on track for better-than-expected earnings in the third quarter as stay-at-home workers’ appetite to upgrade their mobile devices and furniture drives demand for the company’s materials."
8.178186190955463," Shares in plastics maker Covestro up 10% on takeover report BERLIN (Reuters) - Shares in German blue-chip company Covestro 1COV.DE rose by 9.9% in early trade on Friday after Bloomberg reported private equity firm Apollo Global Management APO.N was exploring a takeover of the plastics maker. The talks are at an early stage and there is no certainty they will result in a deal, the report said. “Apollo has broad experience in the plastics industry with a prior investment in LyondellBasell and unsuccessful aim to takeover RPC Group Plc, so story seems very likely,” a local trader said. Apollo and Covestro did not immediately respond to Reuters requests for comment."
11.530297075993253," Apollo said to weigh deal for $10 billion plastics firm Covestro: Bloomberg News (Reuters) - Private equity firm Apollo Global Management Inc APO.N is exploring a takeover of German plastics maker Covestro AG 1COV.DE, Bloomberg News reported here on Thursday, citing people with knowledge of the matter. The New York-based buyout firm, led by billionaire Leon Black, reached out to Covestro in recent weeks, the report said. The talks are at an early stage and there is no certainty they will result in a deal, according to the report. Apollo and Covestro did not immediately respond to Reuters requests for comment. The plastics maker had a market value of 8.14 billion euros ($9.64 billion) as of Thursday’s market close, according to Refinitiv Eikon."
-4.016994558030343," ADNOC signs $5.5 billion real estate deal with Apollo-led consortium DUBAI (Reuters) - Abu Dhabi National Oil Company (ADNOC) said on Wednesday it had entered into a $5.5 billion real estate investment partnership with a consortium led by Apollo Global Management Inc. ADNOC said in a statement that the transaction will result in upfront proceeds of $2.7 billion to ADNOC and is expected to close before year-end. “The strategic investment will leverage the rental income streams from select ADNOC real estate assets under a 24-year master lease agreement,” it added. Under the real estate transaction, which ADNOC said was one of the region’s largest, private equity firm Apollo led a consortium of institutional investors to acquire a 49% stake in Abu Dhabi Property Leasing Holding Company (ADPLHC), which is a wholly owned affiliate of ADNOC. The Abu Dhabi oil producing company will retain a 51% majority stake, maintaining full ownership and control over the select real estate and social infrastructure assets, it added."
-4.016994558030343," ADNOC signs $5.5 billion real estate deal with Apollo-led consortium DUBAI (Reuters) - Abu Dhabi National Oil Company (ADNOC) said on Wednesday it had entered into a $5.5 billion real estate investment partnership with a consortium led by Apollo Global Management Inc APO.N. ADNOC, the state-owned oil company of Abu Dhabi in the United Arab Emirates, said in a statement that the transaction will result in upfront proceeds of $2.7 billion and is expected to close before year-end. “The strategic investment will leverage the rental income streams from select ADNOC real estate assets under a 24-year master lease agreement,” it added. Under the real estate transaction, which ADNOC said was one of the region’s largest, private equity firm Apollo led a consortium of institutional investors to acquire a 49% stake in Abu Dhabi Property Leasing Holding Company, a wholly owned ADNOC affiliate. ADNOC will retain a 51% majority stake, maintaining full ownership and control over the select real estate and social infrastructure assets, it added. “This strategic partnership allows ADNOC to unlock and monetise significant value from its non-oil and gas strategic infrastructure assets and reinvest into our core business to deliver further growth and realise greater returns,” ADNOC’s Chief Executive Officer Sultan al-Jaber said. The deal comes as the world’s top oil and gas companies, including ADNOC, try to control costs in response to the coronavirus pandemic that has reduced oil demand and prices. In June, ADNOC signed a $10 billion deal to lease its natural gas pipeline assets to a group of investors, under a newly formed subsidiary ADNOC Gas Pipelines, for 20 years in return for a volume-based tariff. Four years ago, ADNOC started a transformation strategy to adapt more quickly to market changes, and the company has said it would continue to work with investors to attract foreign capital and maximise value from its resources."
-1.4381670865562375," MEDIA LINK-Apollo's Leon Black to be subpoenaed in Epstein case -New York Times Aug 23 (Reuters) - Officials in the U.S. Virgin Islands want the billionaire investor Leon Black, one of the most powerful men on Wall Street, to hand over information about his decades-long business ties to the convicted sex offender Jeffrey Epstein, the New York Times reported on Sunday. Black is a founder of the private equity firm Apollo Global Management . Reuters has not verified this story and cannot vouch for its accuracy. Source link: here (Reporting by Gertrude Chavez-Dreyfuss)"
-6.627263850615675," Apollo to acquire stake in renewable energy developer US Wind for $265 million (Reuters) - Apollo Global Management Inc APO.N said on Friday that it agreed to invest $265 million in offshore wind developer US Wind Inc, marking the private equity firm's first foray into one of the hottest areas of renewable energy development in the country. Apollo said its investment, which includes both debt and equity, will fund the construction of an offshore wind project off the coast of Maryland. Wind power is the largest source of renewable energy in the United States, generating about 7.3% of the nation’s electricity supply, according to the U.S. Energy Information Administration. The majority of U.S. wind energy is currently generated onshore. But most new wind power projects are being sited offshore owing to limited availability of leased land and growing conflicts with local communities and land owners. Apollo said US Wind holds a lease on about 80,000 acres located 10 to 30 miles off the coast of Maryland, which can contain 1.3 gigawatt of installed wind power generation capacity. US Wind aims to construct a 270-megawatt wind power plant in the first phase of the project, which will supply electricity to75,000 Maryland homes when it launches in early 2024. “US Wind is a premier developer at the forefront of an offshore wind energy industry that is rapidly expanding in both the US and abroad, as interests coalesce around clean energy,” Geoffrey Strong, co-head of infrastructure and natural resources at Apollo, said in a statement. Apollo’s investment in US Wind was made out of the buyout firm’s second infrastructure fund, Apollo Infrastructure Opportunities Fund II, which is seeking to raise $3.5 billion from investors, according to regulatory filings."
-7.821147132165319," Aeromexico lines up $1 billion DIP loan from Apollo Global Management MEXICO CITY (Reuters) - Mexican carrier Aeromexico AEROMEX.MX, which filed for Chapter 11 bankruptcy protection in the United States at the end of June, said on Thursday it has lined up $1 billion in debtor-in-possession financing with Apollo Global Management Inc. “Today we obtained, subject to court approval, commitments for a $1.0 billion senior secured superpriority multi-tranche debtor in possession term loan facility, the DIP Facility, with funds managed by affiliates of Apollo Global Management Inc.,” Aeromexico said in a statement. The DIP facility consists of two tranches and can only be used for certain expenses, including working capital expenses, general corporate purposes and restructuring costs. “This is a critical milestone in the ongoing process to transform our company with the goal of driving long-term, sustainable growth for Aeromexico,” said Aeromexico Chief Executive Andres Conesa. The DIP Facility, still subject to bankruptcy court approval and other agreements, will provide Aeromexico with liquidity to meet its future obligations in a timely and orderly fashion, and to continue with operations during and after the restructuring process, the firm said."
-14.696784758290482," Apollo-owned Rackspace slumps more than 20% on Nasdaq debut (Reuters) - Shares of Rackspace Technology Inc RXT.O plunged more than 20% on their Nasdaq debut on Wednesday, a blow for the cloud services firm's private equity owners Apollo Global Management APO.N. The stock was trading at $16.59 at 1:16 p.m. ET (1716 GMT) on Wednesday, down from the $21 per share price Rackspace shares had sold for in its initial public offering on Tuesday. The lackluster IPO and trading debut bucked the recent trend of strong appetite from investors for cloud computing companies as the novel coronavirus pandemic drives more businesses to operate digitally and rely on cloud computing for more of their workflow. Rackspace sold 33.5 million shares in its IPO at the bottom end of its target range of $21 to $24 per share, valuing the company at $4.18 billion, excluding debt. “We’ve actually been very pleased with how the IPO process has gone. This is one of the largest tech IPOs of the year so we’re pretty excited to reach this milestone,” Rackspace Chief Executive Kevin Jones said in an interview before the stock started trading. “We’re not really focused on today’s stock price. We’re more focused on the long term and the future,” Jones added. Cloud companies such as Ncino Inc NCNO.O and Kingsoft Cloud Holdings Ltd KC.O have seen their share prices more than double since going public earlier this year. Rackspace has historically leased server space and helps corporations store and access data in the cloud, and in recent years, has expanded its business to include multicloud services. Rackspace had been exploring an IPO for the last two years, but its weak organic growth and large debt due to its $4.3 billion leveraged buyout by Apollo in 2016 and subsequent acquisitions had stopped it from pursuing an IPO earlier. Goldman Sachs, Citigroup and J.P. Morgan were the lead underwriters for the IPO."
-14.696784758290482," Apollo-owned cloud company Rackspace shares slump 20% in Nasdaq debut Aug 5 (Reuters) - Shares of cloud services firm Rackspace Technology Inc plunged nearly 20% after making their Nasdaq debut on Wednesday, after the company owned by Apollo Global Management sold shares to investors in its $703.5 million initial public offering. The stock opened at $16.85 on Wednesday, compared with its IPO price of $21.00 per share. Rackspace, which leases server space and helps corporations store and access data in the cloud, sold 33.5 million shares at the bottom end of its target range of $21.00 to $24.00 per share, valuing the company at $4.18 billion, excluding debt. The IPO bucked the recent trend of strong appetite from investors for cloud computing companies as the novel coronavirus outbreak drives more businesses to operate digitally and rely on cloud computing for more of their workflow."
-26.313401578371558," Apollo Global's earnings drop on slower asset sales NEW YORK (Reuters) - Buyout firm Apollo Global Management Inc APO.N said on Thursday its second-quarter distributable earnings fell 11% year-on-year, weighed down by slower asset sales in its private equity and real estate businesses. Apollo said distributable earnings (DE) - the cash available for paying dividends to shareholders - fell to $205.2 million from $230.8 million a year earlier. This translated to DE per share of 46 cents, less than the Wall Street analyst consensus of 48 cents, according to data from Refinitiv. Apollo’s shares were trading 3.1% lower at $52.38 in afternoon trading. “Asset sales were muted as prices are still recovering and the environment is challenging, though the reopening of capital markets may offer more opportunities to monetize assets,” said JMP analyst Devin Ryan. Apollo said the value of its funds rebounded in the second quarter following the rally in U.S. public markets from the coronavirus-induced downturn, leading to a 180% year-on-year rise in net income to $437.2 million under generally accepted accounting principles (GAAP). The New York-based buyout firm said its credit funds appreciated by 7.4% in aggregate in the second quarter, its private equity portfolio rose by 11.7%, while its real estate, principal finance and infrastructure funds climbed 1.4% in aggregate. Apollo's peers also reported a similar appreciation in their funds. Blackstone Group Inc BX.N said last week its private equity portfolio grew 12.8% in the second quarter, while Carlyle Group Inc CG.O reported its corporate private equity and credit funds rose by 13% and 8%, respectively. Apollo said its assets under management (AUM) rose by nearly $100 billion during the second quarter to $413 billion. The steep rise was largely driven by strong fundraising and the closing of two deals by its insurance affiliates that boosted its credit assets. Apollo also said Marc Rowan, its co-founder who has led its drive into the insurance space, will step down from day-to-day management. “Marc will remain a member of the Apollo board and executive committee, will continue to serve on the board and executive committee of Athene and will remain on the board of Athora,” Apollo CEO Leon Black said during a conference call with analysts on Thursday. Apollo’s fee-related earnings rose to $259 million from $239 million in the second quarter, driven by the addition of AUM in Apollo’s credit business."
-26.313401578371558," Apollo Global's quarterly earnings fall on slower asset sales NEW YORK, July 30 (Reuters) - Buyout firm Apollo Global Management Inc said on Thursday its second-quarter distributable earnings fell 11% on-year, weighed down by slower asset sales in its private equity and real estate businesses. Apollo said distributable earnings (DE) - the cash available for paying dividends to shareholders - fell to $205.2 million from $230.8 million a year earlier. This translated to DE per share of 46 cents, less than the Wall Street analyst consensus of 48 cents, according to data from Refinitiv. The New York-based company said the value of its funds rebounded in the second quarter following the rally in U.S. public markets from the coronavirus-induced downturn, leading to a 180% year-on-year rise in net income to $437.2 million under generally accepted accounting principles (GAAP). The buyout firm said its credit funds appreciated by 7.4% in aggregate in the second quarter, its private equity portfolio rose by 11.7%, while its real estate, principal finance and infrastructure funds climbed 1.4% in aggregate. Apollo’s peers also reported a similar appreciation in their funds. Blackstone Group Inc said last week its private equity portfolio grew 12.8% in the second quarter, while Carlyle Group Inc reported that its corporate private equity and credit funds rose by 13% and 8%, respectively. Apollo said its assets under management (AUM) rose by nearly $100 billion during the second quarter to $413 billion. The steep rise was largely driven by strong fundraising and the closing of two deals by its insurance affiliates that boosted its credit assets. In April, Apollo’s European insurance business, Athora Holdings, closed its acquisition of life insurer VIVAT from China’s Anbang Group Holdings Co, which contributed about $45 billion in AUM. Last month, Athene Holdings Ltd agreed to reinsure most of the liabilities of U.S. annuities provider Jackson National Life Co, a subsidiary of British insurer Prudential Plc , a deal that increased Apollo’s AUM by about $28 billion. Apollo is the investment manager of Athene’s entire assets. Apollo’s fee-related earnings rose to $259 million from $239 million in the second quarter, driven by the addition of AUM in Apollo’s credit business. Apollo declared a quarterly dividend of 49 cents per share. (Reporting by Chibuike Oguh in New York, Editing by Sherry Jacob-Phillips)"
-6.106174532399641," Apollo-owned cloud company Rackspace files for U.S. IPO (Reuters) - Cloud services firm Rackspace Technology Inc, owned by private equity firm Apollo Global Management, filed for a U.S. initial public offering on Friday. Rackspace did not specify the size of the offering in the paperwork filed bit.ly/2W2edQQ to the U.S. Securities and Exchange Commission. Reuters reported in April that Apollo was preparing to take Rackspace public in an IPO that could value the company at more than $10 billion, including debt, citing people familiar with the matter. Rackspace leases server space and helps corporations store and access data in the cloud. The San Antonio-based company had been exploring an IPO for the last two years, but its weak organic growth and large debt, owed to its $4.3 billion leveraged buyout by Apollo in 2016 and subsequent acquisitions, had stopped it from pursuing it. Rackspace is among the tech firms that have benefited as companies have allowed employees to work remotely, with the pandemic driving up demand for cloud computing services. The company intends to list its shares on the Nasdaq under the symbol “RXT”. Goldman Sachs, Citigroup, and J.P. Morgan are the lead underwriters for the IPO."
-6.106174532399641," Apollo-owned cloud company Rackspace files for U.S. IPO July 10 (Reuters) - Cloud services firm Rackspace Technology Inc, owned by private equity firm Apollo Global Management, filed for a U.S. initial public offering on Friday. Rackspace did not specify the size of the offering in the paperwork. (bit.ly/2W2edQQ) (Reporting by Bharath Manjesh in Bengaluru; Editing by Vinay Dwivedi)"
-6.26025804280245," Apollo launches platform to make large loans (Reuters) - Buyout firm Apollo Global Management Inc APO.N said on Monday it is creating a new credit unit to provide companies with loans of about $1 billion. The new unit, Apollo Strategic Origination Partners, is expected to provide $12 billion in loans over the next three years through direct lending. In direct lending, credit providers make loans and keep them on their books instead of syndicating them out to intermediaries such as investment banks. Abu Dhabi state fund Mubadala Investment Co is the lead backer of the venture and Apollo plans to pull in additional capital from other investors. Mubadala is the second-biggest state investor in Abu Dhabi after Abu Dhabi Investment Authority (ADIA)."
-6.26025804280245," Apollo launches platform to make large loans - WSJ July 6 (Reuters) - Buyout firm Apollo Global Management Inc is creating a $12 billion platform to provide companies with loans of about $1 billion, the Wall Street Journal reported on Monday, citing company executives. Abu Dhabi state fund Mubadala Investment Co is the lead backer of the venture, the report on.wsj.com/2Ayu7el said, adding that Apollo plans to pull in additional capital from other investors. Apollo Global did not immediately respond to a Reuters request for comment. (Reporting by Bharath Manjesh in Bengaluru; Editing by Maju Samuel)"
