168.51666833333334," Wall St Week Ahead-GameStop frenzy reveals potential for broader market stress As the trading frenzy in GameStop Corp (GME.N)shares and other social media favorites recedes, investors are eyeing signs of potential market stress that could weigh on broader stock performance in coming weeks. For now, U.S. equities appear to be looking past last week's surge in volatility that led the S&P 500 (.SPX) to its biggest weekly decline since October. Solid earnings, fiscal stimulus expectations and progress in country-wide vaccination efforts are leading stocks back to all-time highs. The S&P 500 and Nasdaq (.IXIC) posted records for a second straight session on Friday. read more Some investors, however, worry that the wild swings in GameStop and other ""meme stocks"" may have exacerbated concerns over market volatility and elevated valuations that could make market participants more risk-averse. The S&P 500 stands near its highest forward price-to-earnings ratio in about two decades after rallying 74% from its March lows. ""The recent retail activity was concerning for the broader market,"" said Benjamin Bowler, head of global equity derivatives research at BofA Global Research. Liquidity in futures on the S&P 500 dried up as market makers and other investors sought to reduce risk during the GameStop surge, according to BofA analysts. Earlier this week ""market fragility,"" as measured by the bank, stood at its highest level since March 2020, making U.S. equities exceptionally vulnerable to sudden market shocks, the firm said. Moves in the Cboe Volatility Index (.VIX), known as Wall Street's ""fear gauge,"" also indicate that investors may be more sensitive to market turbulence than usual. On Jan. 27 the index surged 14 points, its biggest one-day gain since March, as the S&P 500 lost 2.6%. The fear gauge's climb was eight to 10 points greater than the expected move following such a drop in the S&P 500, according to Stuart Kaiser, strategist at UBS. The outsized reaction, he said, points to heightened jitters among investors that could suggest bigger market sell-offs in response to negative developments. The VIX has since reverted to its lowest level since early December as U.S. equities have rallied this week. Even so, ""I wouldn't say we're completely past it yet,"" Kaiser said. Next week, investors will focus on quarterly corporate results from Cisco Systems Inc (CSCO.O), General Motors Co (GM.N) and Walt Disney Co (DIS.N) as well as data on U.S. consumer prices. Options markets have not flashed the green light to go full speed ahead with resuming risk. Investor demand for calls on the S&P 500, used to position for gains in the index, has jumped after plummeting to a multi-decade low earlier in the week, according to Charlie McElligott, managing director, cross-asset macro strategy at Nomura. The swing in demand points to risk of a pullback and choppy trade in the next few weeks, he said. Longer-term, several market analysts say the GameStop effect may be no more than a blip on the radar screen for markets as a whole. Drops in the VIX of 20% or more to below 25 tend to bode well for stocks, with the S&P 500 rising 2.6% a month later, according to Christopher Murphy, co-head of derivatives strategy at Susquehanna Financial Group. Still, the exuberance that magnified the market's fault lines has not completely faded. According to data from Trade Alert, options activity shows heavy demand for upside calls in the SPDR S&P Retail ETF (XRT.P), which includes GameStop, and the iShares Silver Trust (SLV.P), which was also rocked by retail trading. As a result, some investors say they plan to tread cautiously for the time being, especially if they are exposed to passive funds that hold a large number of small-cap stocks that could be sensitive to a sudden retail frenzy. ""Time will tell whether this has a more lasting effect on the market,"" said Matt Forester, chief investment officer of BNY Mellon's Lockwood Advisors. ""We need to police our holdings to make sure we're not overly exposed to these trends.""  "
152.48548690606867," Wall Street Week Ahead: GameStop frenzy reveals potential for broader market stress NEW YORK (Reuters) - As the trading frenzy in GameStop Corp shares and other social media favorites recedes, investors are eyeing signs of potential market stress that could weigh on broader stock performance in coming weeks. For now, U.S. equities appear to be looking past last week’s surge in volatility that led the S&P 500 to its biggest weekly decline since October. Solid earnings, fiscal stimulus expectations and progress in country-wide vaccination efforts are leading stocks back to all-time highs. The S&P 500 and Nasdaq posted records for a second straight session on Friday. Some investors, however, worry that the wild swings in GameStop and other “meme stocks” may have exacerbated concerns over market volatility and elevated valuations that could make market participants more risk-averse. The S&P 500 stands near its highest forward price-to-earnings ratio in about two decades after rallying 74% from its March lows. “The recent retail activity was concerning for the broader market,” said Benjamin Bowler, head of global equity derivatives research at BofA Global Research. Liquidity in futures on the S&P 500 dried up as market makers and other investors sought to reduce risk during the GameStop surge, according to BofA analysts. Earlier this week “market fragility,” as measured by the bank, stood at its highest level since March 2020, making U.S. equities exceptionally vulnerable to sudden market shocks, the firm said. Moves in the Cboe Volatility Index, known as Wall Street’s “fear gauge,” also indicate that investors may be more sensitive to market turbulence than usual. On Jan. 27 the index surged 14 points, its biggest one-day gain since March, as the S&P 500 lost 2.6%. The fear gauge’s climb was eight to 10 points greater than the expected move following such a drop in the S&P 500, according to Stuart Kaiser, strategist at UBS. The outsized reaction, he said, points to heightened jitters among investors that could suggest bigger market sell-offs in response to negative developments. The VIX has since reverted to its lowest level since early December as U.S. equities have rallied this week. Even so, “I wouldn’t say we’re completely past it yet,” Kaiser said. Next week, investors will focus on quarterly corporate results from Cisco Systems Inc, General Motors Co and Walt Disney Co as well as data on U.S. consumer prices. Options markets have not flashed the green light to go full speed ahead with resuming risk. Investor demand for calls on the S&P 500, used to position for gains in the index, has jumped after plummeting to a multi-decade low earlier in the week, according to Charlie McElligott, managing director, cross-asset macro strategy at Nomura. The swing in demand points to risk of a pullback and choppy trade in the next few weeks, he said. Longer-term, several market analysts say the GameStop effect may be no more than a blip on the radar screen for markets as a whole. Drops in the VIX of 20% or more to below 25 tend to bode well for stocks, with the S&P 500 rising 2.6% a month later, according to Christopher Murphy, co-head of derivatives strategy at Susquehanna Financial Group. Still, the exuberance that magnified the market’s fault lines has not completely faded. According to data from Trade Alert, options activity shows heavy demand for upside calls in the SPDR S&P Retail ETF, which includes GameStop, and the iShares Silver Trust, which was also rocked by retail trading. As a result, some investors say they plan to tread cautiously for the time being, especially if they are exposed to passive funds that hold a large number of small-cap stocks that could be sensitive to a sudden retail frenzy. “Time will tell whether this has a more lasting effect on the market,” said Matt Forester, chief investment officer of BNY Mellon’s Lockwood Advisors. “We need to police our holdings to make sure we’re not overly exposed to these trends.”"
150.08624117923785," GameStop shares halt slide after Robinhood lifts trading curbs (Reuters) - Shares of GameStop and other companies caught in the recent social media-fueled trading frenzy bounced on Friday, after online broker Robinhood lifted all the buying curbs imposed at the apex of the battle between amateur investors and Wall Street hedge funds. The videogame retailer, the initial trigger for the market slugfest after gaining popularity on social media platform Reddit’s WallStreetBets, closed up 19.20% at $63.77 after hitting a session high of $95, although the wild gyrations seen in the past two weeks appeared to be easing. “The WallStreetBets influence is diminishing to a certain extent because there are a lot of people that got burned,” said Dennis Dick, head of markets structure and a proprietary trader at Bright Trading LLC in Las Vegas. “From a short seller’s perspective, I was spooked a week-and-a-half ago to short any small caps because I was worried WallStreetBets could squeeze me on it,” Dick said. “I’m not spooked anymore; I kind of went back to normal trading, so I can say I think the WallStreetBets influence is not as strong as it was last week.” Robinhood, among the fee-free online brokers credited with fueling the trades, said late on Thursday it had removed all buying restrictions imposed due to a surge in clearinghouse deposit requirements last week. With many of the stocks involved in the so-called “Reddit rally” slumping this week, hedge funds with bearish positions on GameStop made $3.6 billion in profits compared with losses of $12.5 billion in January, financial analytics firm Ortex said on Friday. The slump cut declines so far this year for GameStop shorts to $8.73 billion realized and unrealized losses through Friday morning, according to analytics firm S3 Partners. Analysts pointed to a stunning Hong Kong debut for Tencent-backed Kuaishou Technology as more evidence of the growing power of small investors, but on the WallStreetBets forum at the center of the last week’s action there were few signs of consensus around new stock market favorites. “The speculation is now fading, but that doesn’t mean it can’t come back a month or two months from now,” said Peter Cardillo, chief market economist at Spartan Capital Securities in New York. “A lot of the small investors may have gotten burnt, so it’s going to take time to heal that wound,” Cardillo said. “It may not pop up in those stocks that were already attacked, but it could happen in other companies and maybe on a broader scale.” Other stocks that have seen sharp declines as their fortunes reversed in the social media phenomenon, such as Koss Corp and the U.S.-listed shares of Blackberry closed higher on Friday, while others such as Bed, Bath & Beyond, saw their price fall slow. U.S. Treasury Secretary Janet Yellen met with top officials on Thursday to discuss the volatility, and sources told Reuters securities regulators were looking at all aspects of the rally and all parties involved. GameStop’s stock has crashed to as low as $51.09 after scaling as high as $483 last week, but is still up about 220% from levels at the start of the rally in mid-January. Shares of cinema operator AMC Entertainment have more than halved from a closing peak of $19.90 and closed down 3.67% on Friday. (Graphic: Wild ride for Gamestop and AMC: ) Shares of insurer Clover Health, which on Thursday became the first company to be targeted by a short-selling report in weeks, rose 5.7% due to a late rally sparked by comments from venture capitalist backer Chamath Palihapitiya in response. The company earlier said on Friday it had received a letter from the Securities and Exchange Commission following the report published by Hindenburg Research. Meanwhile, on WallStreetBets, participants were still urging investors to stick with GameStop. “GME YOLO/FOMO my second mortgage. 35k to 5mil to 300k. I WILL NOT SELL!,” read one post by a participant with the handle u/Rhollow1."
150.08624117923785," Numbers of GameStop shares shorted dips further -- S3 Partners NEW YORK (Reuters) - The number of GameStop shares being shorted continued to decline modestly, according to the latest data from analytics firm S3 Partners, as the stock fueled by retail traders fell sharply in price. As of Thursday’s close, 25.4 million shares were shorted versus 25.86 million a day earlier, according to S3. GameStop short interest, a measure of stock price and the number of shares shorted, stood at $1.36 billion. As of Friday morning, GameStop shorts were down $8.73 billion in realized and unrealized losses so far in 2021, according to S3. GameStop shares were rebounding in price on Friday, but were still down some 77% for the week."
150.08624117923785," 'The police will visit you': why GameStonk won't come to China (Reuters) - In his Hangzhou apartment in eastern China, Wen Hao had just finished his daily stockpicking video when he discovered he’d been barred from social media platform Toutiao, a day after inviting netizens to join his stock-recommending community. In a country where trading activities are closely monitored and the internet censored, Wen, 35, reckoned his own blocking showed why the mass buying that sent shares in U.S. videogame retailer GameStop more than 2,000% higher over two weeks could never happen in China. “It’s OK if you have one hundred followers,” said Wen, a self-styled investment adviser who livestreams his stock recommendations everyday via Wechat. “But if you ask thousands of followers to buy a stock at the same time via social media in China, the police will visit you.” GameStop’s rally grabbed world market headlines for the manner in which swarms of Reddit users took on big short-sellers and hedge funds. Efforts to emulate that sort of drama in Asia’s idiosyncratic markets have been isolated so far. There was a small-scale online crusade to support Malaysia’s heavily shorted glove makers, and calls in South Korea to retain a ban on short-selling. But such retail cheerleaders have struggled to attract much of a following. China’s stock market once had the reputation of being a casino, yet the country’s stringent censorship, absence of famous short-sellers and a general tendency to not cross state directives stymie their efforts. Dean Li, a blogger on Xueqiu.com, a Reddit-like investor community, said the GameStop saga had demonstrated that “if a short-seller dares to rashly announce bearish bets against a listed company, it will be in trouble.” But both short-selling and option trading, the key drivers of GameStop’s stratospheric rise, are restricted in China, making such a duel impossible, he said. Huang Wei, founder of an online investment community that comprises what he calls “grassroots investors”, said he emphasizes with U.S. retail investors in their “riot” against Wall Street short-sellers, but in China, there’s no grounds for a retail investor uprising. “It’s a clash of people’s value outlook. It’s like farmers uprising against tyranny,” Huang said. “There isn’t widespread public discontent at the moment.... so you don’t see Che Guevara or Mao Zedong in the market,” Huang said, referring to the charismatic leaders in Cuban and Chinese revolutions. The chance of a Chinese equivalent to GameStop emerging has been dimmed further by recent capital market reforms aimed at weeding out weak companies and encouraging long-term investment. Chinese regulators are also cracking down on price manipulation and Internet stock recommendations. The China Securities Regulatory Commission campaign last September scrutinized illegitimate stock recommendations, also taking aim at “market black mouths” who spread misleading information to influence stock prices, as well as “black apps”, which attract investor clients using chat groups on social media. Chinese hedge fund manager Yuan Yuwei said the trading patterns seen in GameStop are not new in China, or Hong Kong, where speculators have talked up stocks in pump-and-dump schemes. “The pattern is identical. You drive up share prices and attract followers. And then, you dump your holdings to late comers. The only difference is that you have no or little short positions (in China),” he said, adding such practices have become much less common in China in recent years. Still, Nirgunan Tiruchelvam, head of consumer equity research at Tellimer, said he expected the retail frenzy to flare up soon in Asia, including China. “That could be a perfect storm where you have the use of these Robinhood-type platforms, plus, the spread of internet chat groups, plus, the highly shorted names. That would create a potent cocktail,” said Tiruchelvam, who identified stocks including China Literature and MTR Corp as potential targets. “This is actually the beginning of a massive wave of investing behavior along these lines.”"
150.08624117923785," 'To the moon' or to a lawyer, GameStop investors cope with stock's rollercoaster NEW YORK (Reuters) - Eric Diaz, an operations manager in Tampa, Florida, remains committed to his GameStop shares even after their steep retreat from highs they hit last week. “It got personal,” he said. Like many other people, Diaz first invested $3,000 after reading about the video game retailer’s stock on the popular Reddit forum WallStreetBets. The so-called “Reddit rally” to squeeze shortsellers rocketed GameStop Corp shares from below $18 a share in early January to as high as $483 last week. Diaz sold some to take profits of $1,500 and hold on to the rest, 10 shares. After watching the shares plunge on Thursday to close at $53.5, Diaz said he plans to buy more if the price keeps dropping. “At first it was investing in an idea,” said Diaz. “But then after all the shenanigans when retail investors who wanted to purchase were prevented from doing it, it got personal. So I’m just going to hold until it plays out.” The wild swings of GameStop and other Reddit rally favorites were cast as a David versus Goliath tale of individuals taking on Wall Street hedge funds. With trading volume swelling last week, online broker Robinhood and other investing apps placed restrictions on GameStop and other shares. The fierce rally damaged some hedge funds when they could not cover short positions. Still, many people on Wall Street have also made money off GameStop, while some small investors were hurt by its rapid decline. Many financial professionals had warned the rally could not last forever. Still, lawyers said their phones have been ringing with GameStop shareholders hoping to recoup losses. Even during this week’s swoon, many recent Reddit posts pledged to hold GameStop until the stock goes “to the moon.” “IF HE’S STILL IN, I’M STILL IN” Those who were late to the party are likely looking at losses, if they did not hedge their long positions somehow. John Gjolaj, a restaurant manager in New York and longtime user of Reddit’s WallStreetBets forum, invested in over 300 shares of GameStop last week at $269 a share. He plans to hold on. Gjolaj said he believed GameStop’s team can turn around the company. “I’m hoping I can sell it at $500 or so. But if it takes years, I’ll be holding,” Gjolaj said. “I invested in bitcoin at its height in 2017. I can stomach all this volatility.” Jerry Corley, a gardener in Arkansas, joined WallStreetBets’ thread on Reddit last week and bought three shares of GameStop on Monday. Looking at a loss, he has drawn encouragement from Roaring Kitty, the online handle of an investor who championed GameStop and whose posts claimed he turned an investment of a few thousand dollars into millions. “He has got his money where his mouth is. This guy’s no dummy. That’s a great sign right there,” said Corley. On Wednesday, Roaring Kitty, also known as DeepF***ingValue on WallStreetBets, posted a screenshot on Twitter of the GameStop stock, which was traded at around $4 in July, adding “I like the stock.” Keith Patrick Gill, a trained financial advisor who is behind the Roaring Kitty streams, did not respond to a request for comment. His recent posts show he still holds a position worth over $8 million in the stock. Some followers on Reddit posted after his Wednesday tweet: “If he’s still in, I’m still in.” Diaz tried to get around Robinhood’s trading restrictions by using several trading platforms. But the trading limits quickly drew a backlash from investors and U.S. lawmakers from both parties, and have also sparked lawsuits. Levin Papantonio Rafferty attorney Michael Bixby said his firm has gotten dozens of calls with “every sort of complaint you could imagine” related to Robinhood’s handling of GameStop trading. “If you lost $10,000, that might be a heck of a lot of money to the individual but it would be difficult to justify the cost of litigation,” Bixby said. A representative for Robinhood declined comment on the lawsuits. Previously, the online broker said the trading restrictions were put in place to because of the collateral it needs to post required by clearinghouses to backstop many of the trades. Matthew Schwartz, attorney at Kass Shuler in Florida, said most of the calls he received were from individuals trading options that could not buy, or who had traditional equities that were restricted. The Reddit rally also had winners that remain in play. Bryan Towey, a 20-year-old entrepreneur in New York, said he made over 890% returns on GameStop since he invested in 10,000 shares at an average cost of $22.10 per share in early January after reading about the company’s e-commerce sales growth. Towey has gradually sold his holdings since it hit $165, but still owns 2,200 shares, in the hope for another breakout. “I’m like a gut investor type of person,” Towey said. “I have a good feeling about the business. If there is another bubble, I’ll probably get rid of it.”"
150.08624117923785," GameStop, Clover Health rise in early U.S. pre-market trading (Reuters) - Shares of videogame retailer GameStop Corp and insurance company Clover Health rose 3.5% and 4.1%, respectively, in early U.S. pre-market trading on Friday. Clover Health had slumped 12% on Thursday after short-selling specialist Hindenburg Research published a critical report of the Chamath Palihapitiya-backed company. GameStop’s stock has now slumped to about $53 after scaling as high as $483 last week in a rally fueled by amateur traders on social media forums such as Reddit’s WallStreetBets. It is still up about 177% from levels at the start of the rally."
150.08624117923785," Performance of funds invested in GameStop in past 2 weeks (Reuters) - The Morgan Stanley Institutional Small Co. Inception Portfolio fund was among the top gainers among mutual funds over the past two weeks having exposure to videogame retailer GameStop, data from Refinitiv Lipper showed. Crowds of retail punters sent shares in GameStop up by more than 2000% last month, causing some Wall Street hedge funds to lose billions of dollars on their short bets on the stock. The Morgan Stanley fund, which had 346,943 shares of GameStop as per the latest filing, gained 23% in the last two weeks, according to the data, which was based on the last two weeks’ price performance. The fund’s net assets rose 61% to $746.7 million in January, the data showed. Shares of iShares Micro-Cap ETF and Cambria Shareholder Yield ETF also gained about 7% each in the past two weeks. Shares of GameStop have fallen more than 83.5% in the first four days of this month as the retail frenzy faded. Graphics: Mutual fund gainers in the past two weeks - Graphics: Bottom performers in the past two weeks -"
150.08624117923785," Performance of funds invested in GameStop in past two weeks (Reuters) - The Morgan Stanley Institutional Small Co. Inception Portfolio fund was among the top gainers among mutual funds over the past two weeks having exposure to videogame retailer GameStop, data from Refinitiv Lipper showed. Crowds of retail punters sent shares in GameStop up by more than 2000% last month, causing some Wall Street hedge funds to lose billions of dollars on their short bets on the stock. The Morgan Stanley fund, which had 346,943 shares of GameStop as per the latest filing, gained 23% in the last two weeks, according to the data, which was based on the last two weeks’ price performance. The fund’s net assets rose 61% to $746.7 million in January, the data showed. Shares of iShares Micro-Cap ETF and Cambria Shareholder Yield ETF also gained about 7% each in the past two weeks. Graphic: Mutual fund gainers in the past two weeks Shares of GameStop have fallen more than 83.5% in the first four days of this month as the retail frenzy faded. Graphic: Bottom performers in the past two weeks"
