315.93989159891595," Citadel's Griffin says firm does not use personal information of retail investors: CNBC (Reuters) - Market maker Citadel Securities does not use the personal information of retail investors, its billionaire co-founder Ken Griffin told CNBC on Friday, a day after the U.S. congressional hearing on GameStop. During Thursday’s hearing, several lawmakers had raised concerns on whether large market makers had taken advantage of retail investors and if they could pose a threat to the financial system. Griffin had pushed back against those questions, saying that Citadel Securities, which executes roughly 47% of all U.S.-listed retail volume, had worked for years to help give consumers “a better price.” A market maker is a broker or dealer who holds a certain amount of securities at hand to facilitate trading, competing for orders by giving buy and sell price quotations, then filling orders rapidly either from its own inventory or an offsetting order. The retail investor-led rally in heavily shorted stocks earlier this year has raised scrutiny on the information market makers can collect from the order flow. “There’s been a number of misperceptions about the data that we receive from the retail brokerage community. In fact, a prominent U.S. Senator asked us specifically about what personal identifying information do we receive from retail investors. The answer is none,” Griffin told CNBC. Friday’s interview allowed Griffin to clear the air after he got cut off repeatedly on Thursday by lawmakers who demanded quick, clear responses. “This conspiracy theory that we somehow or another are like some of the big tech giants that have access to personal identifying information is just flat out false,” he said on Friday."
315.93989159891595," Long, tense with cat photo for relief; how the GameStop hearing unfolded WASHINGTON/BOSTON/NEW YORK (Reuters) - Tension, irate questions, people talking over one another, and a cat photo. Thursday’s five-plus hour U.S. congressional hearing on GameStop had all of that, as top hedge fund managers, the head of Robinhood, and Roaring Kitty himself answered a barrage of questions over who was at fault in January’s trading frenzy. GameStop rose more than 1,000% during two weeks as retail traders using the Reddit platform encouraged each other to pile in, socking it to hedge fund managers who were short the stock - a bet GameStop would fall. The trade deflated, however, after online brokerage Robinhood and several other brokers controversially restricted buying GameStop’s shares - leaving retail investors frustrated but capping the losses for the hedge funds. “Robinhood owns what happened and we need to make sure it doesn’t happen again,” said Robinhood CEO Vlad  Tenev, who appeared to field the most questions at the U.S. House of Representatives Committee on Financial Services hearing. Keith Gill, a Reddit user and YouTube streamer known as Roaring Kitty who had boosted the stock with his videos about how undervalued the company was, provided a more lighthearted exterior. Gill sat in a red videogaming chair from which he recorded many videos promoting his investment in GameStop. Displayed behind him was a poster of a kitten with the caption “Hang in there!” Many investors who bought GameStop as the price skyrocketed now face deep losses. Speaking as much to his social media followers as to the lawmakers, Gill said, “I like the stock”, a phrase that has become a rallying call on Reddit, where commenters watching the hearing cheered him on, some calling him their “savior” and a “hero.” Hedge fund managers Gabe Plotkin, whose Melvin Capital lost 53% in January in the GameStop frenzy and Ken Griffin, who built both Citadel LLC and market making business Citadel Securities, also spoke. The hearing was led by Representative Maxine Waters, chair of the Democratic-led panel, who is a critic of Wall Street and in January called hedge funds “unethical.” Some lawmakers questioning the witnesses at times cut them off in frustration at not getting quick, clear answers. At the end, Waters promised to hold more hearings, with testimony from regulators at the Securities and Exchange Commission and the Financial Industry Regulatory Authority. She said she was “more concerned than ever” that retail investors were being taken advantage of, and that large market makers such as Citadel Securities could pose a threat to the financial system. Republicans on the panel also sought to burnish their consumer-protection credentials, making for a fiery virtual hearing featuring echoes, feedback and background noise. One main question was whether Robinhood had been pressured by hedge funds holding losing positions - they had an interest in making the short squeeze of GameStop end. But Tenev and Griffin denied that. “We don’t answer to hedge funds,” said Tenev. “We serve millions of small investors who use our platform.” Citadel CEO Griffin said the same. “Absolutely not,” he replied, when asked whether Citadel had contacted Robinhood about restricting trading. Tenev found himself repeatedly in the hotseat, explaining how Robinhood makes money and how its clients fare while trading on its platform. Representative Sean Casten, a Democrat, played an automated message on the Robinhood customer service phone line while questioning Tenev about how customers are treated. Griffin, a Republican donor, was meanwhile castigated by another Democrat, Representative Brad Sherman, for evading his question about whether market-makers provide the same prices to all brokers. Griffin maintained that Citadel Securities, which executes roughly 47% of all U.S.-listed retail volume, had worked for years to help give consumers “a better price.” Some of the repercussions of the GameStop saga could be in the business of short selling itself. Melvin Capital’s Plotkin, who first bet against the future of GameStop in 2014 when it traded around $40, is wary about holding big short positions again. Melvin suffered massive losses as the stock soared leading up to Jan. 28. Citadel made a $2 billion investment in Melvin on Jan. 25. “I don’t think investors like ourselves want to be susceptible to these types of dynamics,” Plotkin said. “Whatever regulation you guys come up with we’ll abide by.” Reddit CEO Steve Huffman also appeared, but was grilled less than the Wall Street players. Huffman and Reddit user Gill were asked about the role of social media platforms in potential market manipulation. “We spend a lot of time at Reddit ensuring the authenticity of our platform ... And in this specific case, we did not see any signs of manipulation,” Huffman told lawmakers. (GRAPHIC: GameStop's rise and fall - ) (GRAPHIC: GameStop comments soared on Reddit's Wallstreetbets - )"
315.93989159891595," Short-selling under spotlight in GameStop hearing NEW YORK (Reuters) - Short selling was under the microscope on Thursday as a U.S. House committee grilled executives from trading app Robinhood and hedge funds Melvin Capital and Citadel over the GameStop Corp trading frenzy, with some calling for change. Shorting a stock is a bet that the share price will fall. GameStop had around 140% short interest at its peak in January, meaning more shares were shorted than the company had outstanding. “The ability for the same share to be shorted an indefinite number of times is somewhat of a pathology and that should be fixed,” said Robinhood Chief Executive Officer Vlad Tenev. He called for a modernization of the market’s infrastructure so shares can properly be tracked once they’ve been loaned out to be shorted, which does not currently happen. The GameStop saga could also dampen industry demand for shorting stocks going forward, said Melvin’s CEO Gabe Plotkin. Melvin had been short GameStop since 2014. It suffered massive losses as retail investors piled into GameStop in January, driving its price up 1,400% and creating a “short-squeeze,” where short sellers were forced to buy the shares back at a higher prices to close their positions, adding to the upward pressure on the stock price. Citadel made a $2 billion investment in Melvin on Jan. 25, which closed its GameStop position on Jan. 27. People familiar with the fund said it lost almost 30% in the first three weeks of January. Citadel CEO Ken Griffin said of short-selling reforms that as far as legislative priorities that could improve the markets go, “this doesn’t make the top 100 list.” “The short interest in GameStop was exceptional and I’m not sure it’s worth us delving into legislative corrections for a very unique situation in terms of the extreme sides of the short interest,” he said."
315.93989159891595," Key quotes from the GameStop testimonies: 'I am not a cat' (Reuters) - At a grilling by lawmakers over the frenzied trading in retailer GameStop, Keith Gill, a YouTube streamer known as Roaring Kitty, hedge fund managers and the head of Robinhood and Reddit defended their actions. Those testifying were Robinhood CEO Vlad  Tenev, Melvin Capital CEO Gabriel  Plotkin, Citadel CEO Ken Griffin and Reddit CEO Steve Huffman. Here are the testimonies of the players involved and a link to biographies of some of them. Some quotes from the hearing: “A few things I am not. I am not a cat. I am not an institutional investor, nor am I a hedge fund. I do not have clients and I do not provide personalized investment advice for fees or commissions. I am just an individual whose investment in GameStop and posts on social media were based upon my own research and analysis.” “Investing can be risky and my approach can be risky but for me personally, yes (I would buy GameStop now). Yes, I do find it attractive at this price point.” “My investment in GameStop was based on the fundamentals.” “Increased transparency could help. That someone like me could have a better understanding of how those things work ... would help retail investors.” ROBINHOOD CEO VLAD  TENEV: “We always felt comfortable with our liquidity... The additional capital we raised wasn’t to meet capital requirements or deposit requirements... ” “I recognize customers were very upset (from the restrictions on trading)... it would have been significantly worse if we had prevented customers from selling.” “Not at all, zero pressure (from anyone on the panel to decide to restrict trading), it was a collateral depository decision.” “I’m sorry for what happened. I apologize. I’m not going to say that Robinhood did everything perfect and we haven’t made mistakes in the past, but what I commit to is making sure that we improve from this, learn from it, and we don’t make the same mistakes in the future. And Robinhood as an organization will learn from this and improve and make sure it doesn’t happen again, and I will make sure of that.” “I do believe that the ability for the same share to be shorted an indefinite number of times is somewhat of a pathology and that should be fixed and I think step one of that is modernizing the antiquated settlement infrastructure that everything is built on. We simply don’t have the ability to properly track which shares have been shorted and how many times as they are moving through our settlement system.” “Robinhood owns what happened and we need to make sure it doesn’t happen again but Robinhood Securities had limited options and I believe the team did the right thing and the only thing. “Payment for order flow is one of our largest revenue sources. Yes (it is the largest.)” “As I was trying to explain... the quality of the execution varies by the channel of the order, this is a commonly understood phenomenon in economics.” “We have fought for 15 years to make that the basis by which orders are allocated because we strongly believe Citadel is better to provide better execution for retail orders in the long run.” “We are able to share our trading acumen with retail investors, give them a better price and give payments for orderflow to firms like Robinhood. “This has been very important for the democratization of finance.” “I believe that the short interest in GameStop was exceptional. I’m not sure it’s worth us delving into legislative corrections for a very unique situation.” “We of course are talking to Robinhood as we manage a substantial portion of their order flow. “Absolutely not (whether they contacted Robinhood about restricting trading in GameStop).” “We don’t own DTCC. We are not party to the discussion/ dialogue between DTCC and Robinhood. We have literally nothing to do with DTCC other than being a member of DTCC... Citadel Securities owes a duty of best execution for every order that comes from Robinhood and I’m proud of how seriously our team takes that best execution.” “If we were to think about legislative priorities this (short selling) doesn’t make the top 100 list.” MELVIN CAPITAL CEO GABRIEL  PLOTKIN “I think it is a really good question (regarding more reporting around shorting). It is not for me to decide. But if those are the rules then I will certainly abide by them.” “Anytime we short a stock, we locate a borrower. Our systems actually force us to find a borrower.” “In 2014 at our inception (we took a short position in GameStop). “I don’t remember (what it was worth) at the time. Maybe $40. We believed the company had a lot of structural challenges. “Our systems won’t allow that (a naked short position) so it wouldn’t be possible to do.” “They (retail traders) exploited an opportunity around short selling and we will have to adapt. “I don’t think you’ll see stocks with the kind of short interest levels that you saw earlier this year, people like ourselves won’t want to be susceptible for that.” “We spend a lot of time at Reddit ensuring the authenticity of our platform. So we’ve got a large team dedicated to this exact task. Everything on Reddit - all of the content is created by users, voted on by users and ranked by users, and we make sure that is authentic, and as unmanipulated as possible. And in this specific case, we did not see any signs of manipulation.”"
315.93989159891595," Hedge fund manager Plotkin's GameStop short, dissected BOSTON (Reuters) - Hedge fund manager Gabriel Plotkin first bet against the future of GameStop Corp in 2014 when it traded around $40. But after a harrowing experience with short sellers in recent weeks, he’s wary about holding big short positions again. Plotkin, long one of the hedge fund industry’s most admired traders, became one of the financial industry’s most vilified players last month when an army of retail investors pushed the video game retailer’s stock much higher after his hedge fund shorted the stock, betting its price would fall. On Thursday, he spent more than five hours answering U.S. lawmakers’ questions about how his firm Melvin Capital Management, which shed 53% of its value in January, lost so much money and whether it wasn’t playing by the rules. But the fund manager, trying to strike a contrite note by saying he has to earn the cash back for his investors, turned the lens around and cast himself as having been hurt by Main Street investors who ganged up on the professionals. “They exploited an opportunity around short selling and we will have to adapt and the whole industry will have to adapt,” Plotkin said. “I don’t think investors like ourselves want to be susceptible to these types of dynamics. Whatever regulation you guys come up with we’ll abide by.” Plotkin said Melvin is paid to take a view on companies and always follows financial industry rules. “If those are the rules then I will certainly abide by them.” To him, GameStop was an ailing video retailer with structural problems and declining revenues. “Anytime we short a stock, we locate a borrower, our systems actually force us to find a borrower,” he said, explaining that Melvin does not engage in so-called naked shorting which is prohibited. He was not drawn into a debate about the merits of short selling. And he sidestepped picking a fight with Elon Musk when a lawmaker asked him whether Musk’s tweet “Gamestonk!!”, seen as an endorsement of the stock, might have targeted him for having at one point bet against Musk’s electric vehicle maker Tesla Inc. “I don’t want to speculate on what the motives of his tweet were. The stock did rise,” Plotkin said diplomatically. GameStop’s gains deeply wounded Melvin as its assets shriveled to $8 billion from $12.5 billion at the start of the year. Billionaires Steven A. Cohen - Plotkin’s mentor - and Kenneth Griffin, who runs hedge fund Citadel LLC, gave Melvin Capital a $2.75 billion dollar lifeline. Due to the pandemic, lawmakers and Plotkin used video to communicate and the fund manager sat in a drab room whose biggest feature was a large printer. He said he comes from a middle-class family in Maine, and did not have a job when he graduated college. He left out that he worked for one year at Griffin’s Citadel and soon joined Cohen’s SAC Capital Advisors. He has earned enough money during his career to buy a stake in the Charlotte Hornets professional basketball team and pay around $44 million for two side-by-side properties overlooking Miami’s Biscayne Bay last year."
315.93989159891595," QUOTES-Key quotes from the GameStop testimonies: 'I am not a cat' At a grilling by lawmakers over the frenzied trading in retailer GameStop (GME.N), Keith Gill, a YouTube streamer known as Roaring Kitty, hedge fund managers and the head of Robinhood and Reddit defended their actions. Those testifying were Robinhood CEO Vlad  Tenev, Melvin Capital CEO Gabriel  Plotkin, Citadel CEO Ken Griffin and Reddit CEO Steve Huffman. read more Here are the testimonies of the players involved and a link to biographies of some of them. read more Some quotes from the hearing:  KEITH GILL: ""A few things I am not. I am not a cat. I am not an institutional investor, nor am I a hedge fund. I do not have clients and I do not provide personalized investment advice for fees or commissions. I am just an individual whose investment in GameStop and posts on social media were based upon my own research and analysis."" ""Investing can be risky and my approach can be risky but for me personally, yes (I would buy GameStop now). Yes, I do find it attractive at this price point."" ""My investment in GameStop was based on the fundamentals."" ""Increased transparency could help. That someone like me could have a better understanding of how those things work ... would help retail investors.""  ROBINHOOD CEO VLAD  TENEV: ""We always felt comfortable with our liquidity... The additional capital we raised wasn’t to meet capital requirements or deposit requirements... "" ""I recognize customers were very upset (from the restrictions on trading)... it would have been significantly worse if we had prevented customers from selling."" ""Not at all, zero pressure (from anyone on the panel to decide to restrict trading), it was a collateral depository decision."" ""I’m sorry for what happened. I apologize. I’m not going to say that Robinhood did everything perfect and we haven’t made mistakes in the past, but what I commit to is making sure that we improve from this, learn from it, and we don’t make the same mistakes in the future. And Robinhood as an organization will learn from this and improve and make sure it doesn’t happen again, and I will make sure of that."" ""I do believe that the ability for the same share to be shorted an indefinite number of times is somewhat of a pathology and that should be fixed and I think step one of that is modernizing the antiquated settlement infrastructure that everything is built on. We simply don’t have the ability to properly track which shares have been shorted and how many times as they are moving through our settlement system."" ""Robinhood owns what happened and we need to make sure it doesn't happen again but Robinhood Securities had limited options and I believe the team did the right thing and the only thing. ""Payment for order flow is one of our largest revenue sources. Yes (it is the largest.)""  CITADEL CEO KEN GRIFFIN ""As I was trying to explain... the quality of the execution varies by the channel of the order, this is a commonly understood phenomenon in economics."" ""We have fought for 15 years to make that the basis by which orders are allocated because we strongly believe Citadel is better to provide better execution for retail orders in the long run."" ""We are able to share our trading acumen with retail investors, give them a better price and give payments for orderflow to firms like Robinhood. ""This has been very important for the democratization of finance."" ""I believe that the short interest in GameStop was exceptional. I’m not sure it’s worth us delving into legislative corrections for a very unique situation."" ""We of course are talking to Robinhood as we manage a substantial portion of their order flow. ""Absolutely not (whether they contacted Robinhood about restricting trading in GameStop)."" ""We don't own DTCC. We are not party to the discussion/ dialogue between DTCC and Robinhood. We have literally nothing to do with DTCC other than being a member of DTCC... Citadel Securities owes a duty of best execution for every order that comes from Robinhood and I'm proud of how seriously our team takes that best execution."" ""If we were to think about legislative priorities this (short selling) doesn't make the top 100 list.""  MELVIN CAPITAL CEO GABRIEL  PLOTKIN ""I think it is a really good question (regarding more reporting around shorting). It is not for me to decide. But if those are the rules then I will certainly abide by them."" ""Anytime we short a stock, we locate a borrower. Our systems actually force us to find a borrower."" ""In 2014 at our inception (we took a short position in GameStop). ""I don't remember (what it was worth) at the time. Maybe $40. We believed the company had a lot of structural challenges. ""Our systems won't allow that (a naked short position) so it wouldn't be possible to do."" ""They (retail traders) exploited an opportunity around short selling and we will have to adapt. ""I don't think you'll see stocks with the kind of short interest levels that you saw earlier this year, people like ourselves won't want to be susceptible for that.""  REDDIT CEO STEVE HUFFMAN ""We spend a lot of time at Reddit ensuring the authenticity of our platform. So we’ve got a large team dedicated to this exact task. Everything on Reddit - all of the content is created by users, voted on by users and ranked by users, and we make sure that is authentic, and as unmanipulated as possible. And in this specific case, we did not see any signs of manipulation."" "
