80.22221888888889," GLOBAL MARKETS-Global equities rally as more U.S. stimulus looms, silver slumps (Adds U.S. market open, NEW YORK dateline, byline) * MSCI world shares index up 1.44% * GameStop shares plunge, silver prices tumble * U.S. stimulus package brightens in Congress NEW YORK/LONDON Feb 2 (Reuters) - Global stock markets surged for a second day on Tuesday, spurred by increased optimism about more U.S. stimulus and recovery, while retail investors retreated from GameStop and their fleeting interest in silver, causing their prices to tumble. The party for the trading frenzy mob that pushed GameStop’s stock up five-fold in a week appeared over as its shares plunged 46.20% to $121.06. GameStop closed on Friday at $325 a share after hitting $483 earlier in the session. Silver prices also fell on Tuesday, sliding -7.52% to $26.80, after exchange operator CME Group Inc raised margins on its COMEX 5000 Silver Futures contract by 17.9% to their highest since October 2020. CME’s move on silver took the air out GameStop too, with short interest declining to 53% of the stock’s available shares to trade, from 140%, said Tom Hayes, founder and chairman of hedge fund Great Hill Capital LLC in New York. “Everyone’s rushing for the same narrow exit and trying to get off margin, and you have a lot of weak sisters that are coming out of the stock,” Hayes said. “The squeeze is over.” Equity markets rallied as investors saw improved prospects for President Joe Biden’s proposed $1.9 trillion COVID-19 relief package after he met with 10 Senate Republicans to discuss their scaled-back $618 billion plan. Expectations for Alphabet’s Google and Amazon.com earnings after the bell are high, Hayes said. “Very few people want to be short going into that type of earnings report, he said. The Dow Jones Industrial Average rose 1.99%, the S&P 500 gained 1.79% and the Nasdaq Composite added 1.58%. Positive momentum overnight in Asia carried through to Europe, with the pan-European STOXX 600 climbing 1.33%. Initial European Union estimates showed the euro zone economy contracted less than expected in the fourth quarter of 2020 but is heading for another, probably steeper decline, in the first quarter of 2021. MSCI’s world equity index, which tracks shares in 49 countries, was up 1.50% after posting its strongest day in three months on Monday. MSCI’s gauge of Asia-Pacific stocks outside Japan rose 1.4%. China’s benchmark CSI300 Index gained 1.5%, helped by easing concerns about tight liquidity and declining cases of new coronavirus infections. Japan’s Nikkei 225 added 1%. The dollar rose to two-month highs against the euro on a perceived widening disparity between the strength of U.S. and European economic recoveries from the coronavirus pandemic. A sell-off in the euro after coronavirus lockdowns choked consumer spending in Germany and short-covering in over-crowded dollar-selling positions also strengthened the greenback. The euro was last down 0.31% at $1.2022. The Japanese yen weakened 0.16% at 105.08 per dollar. The Australian dollar pared gains after the country’s central bank said it would extend its quantitative easing program to buy an additional $100 billion of bonds. The Aussie last stood at $0.7602, off the day’s high of $0.7662. With global market sentiment remaining upbeat about U.S. fiscal stimulus, core euro zone government bond yields edged up, with the benchmark German 10-year Bund yield < DE10YT=RR.> around two basis points higher at -0.492%. The 10-year U.S. Treasury note rose 2.4 basis points to 1.1031%. Spot gold prices fell -1.21% to $1,837.74 an ounce. Oil prices rose more than 2%, reaching their highest in nearly 12 months after major producers showed they were reining in output roughly in line with their commitments. Brent crude futures rose $1.35 to $57.7 a barrel. U.S. crude futures gained $1.38 to $54.93 a barrel."
80.22221888888889, GameStop trading resumes after brief halt as shares tumble Shares of videogame retailer GameStop Corp (GME.N) resumed trading on the New York Stock Exchange after being briefly halted following a 42% slump when the markets opened on Tuesday. The stock has been at the heart of a battle between amateur investors and Wall Street hedge funds in a social media-driven trading frenzy since last week. It was last down 49% at $115. 
80.22221888888889," GLOBAL MARKETS-Global markets buoyant as U.S. stimulus debate approaches Global stock markets surged for a second day on Tuesday, spurred by increased optimism about more U.S. stimulus and the economic recovery, while retail investors retreated from GameStop and fleeting interest in silver, causing their prices to tumble. The party for the Reddit-inspired trading frenzy that pushed GameStop's stock (GME.N) up five-fold in five days last week appeared over as its shares plunged 60% in heavy trade to close at $90.00, less than one-fifth of an all-time peak on Friday. Silver prices also fell on Tuesday, sliding 8.5% to $26.54, after exchange operator CME Group Inc (CME.O) raised maintenance margins on its COMEX 5000 Silver Futures contract by 17.9% to their highest since October 2020. CME's move on silver took the air out of GameStop too, with short interest declining to 53% of the stock's available shares to trade, from 140%, said Tom Hayes, founder and chairman of hedge fund Great Hill Capital LLC in New York. ""Everyone's rushing for the same narrow exit and trying to get off margin, and you have a lot of weak sisters that are coming out of the stock,"" Hayes said. ""The squeeze is over."" Equities rallied as investors saw improved prospects for President Joe Biden's proposed $1.9 trillion COVID-19 aid bill. The U.S. Senate voted to open debate on a budget resolution, starting a process that would allow Democrats to pass Biden's package without Republican support. read more Expectations for Alphabet's Google and Amazon.com earnings after the bell were high and lifting investor sentiment, Hayes said. ""Very few people want to be short going into that type of earnings report,"" he said. Google (GOOGL.O) closed up 1.38% and Amazon (AMZN.O) added 1.11%. The two stocks were among the top boosts to the S&P 500; 97% of technology companies have beaten analysts' earnings estimates, IBES data from Refinitiv shows. The Dow Jones Industrial Average (.DJI) rose 1.57%, the S&P 500 (.SPX) gained 1.39% and the Nasdaq Composite (.IXIC) added 1.56%. Advancing shares outnumbered declining ones by almost 3:1 on both the New York Stock Exchange and Nasdaq. Positive momentum overnight in Asia carried through to Europe, with the pan-European STOXX 600 (.STOXX) closing up 1.29%. Medical device maker Coloplast (COLOb.CO) and Sweden's Indutrade (INDT.ST) were the top gainers on STOXX 600 on beating quarterly earnings. Initial European Union estimates showed the euro zone economy contracted less than expected in the fourth quarter but was headed for another, probably steeper decline, in the first quarter of 2021. MSCI's world equity index (.MIWD00000PUS), which tracks shares in 49 countries, was up 1.34% after posting its strongest day in three months on Monday. Its emerging markets index (.MSCIEF) rose 1.52%. MSCI's gauge of Asia-Pacific stocks outside Japan (.MIAPJ0000PUS) rose 1.4%. China's benchmark CSI300 Index (.CSI300) gained 1.5%, helped by easing concerns about tight liquidity and declining cases of new coronavirus infections. Japan's Nikkei 225 (.N225) added 1%. The dollar rose to two-month highs against the euro on a perceived widening disparity between the strength of U.S. and European economic recoveries from the coronavirus pandemic. A sell-off in the euro after coronavirus lockdowns choked consumer spending in Germany and short-covering in over-crowded dollar-selling positions also strengthened the greenback. The euro was last down 0.17% at $1.2038. The Japanese yen weakened 0.08% at 105.02 per dollar.    The Australian dollar pared gains after the country's central bank said it would extend its quantitative easing program to buy an additional $100 billion of bonds. The Aussie last stood at $0.7602 , off the day's high of $0.7662. Core euro zone government bond yields edged up, with the benchmark German 10-year Bund yield around two basis points higher at -0.484%. The 10-year U.S. Treasury note yield rose about 0.2 basis points to 1.1014%. U.S. gold futures settled down 1.6% at $1,833.40 an ounce. Oil prices rose 2% or more to their highest in nearly 12 months after major producers showed they were reining in output roughly in line with their commitments. Brent crude futures rose $1.11 to settle at $57.46 a barrel. U.S. crude futures settled up $1.21 at $54.76 a barrel. "
80.22221888888889," Analysis: GameStop saga expected to revive scrutiny of hedge fund industry WASHINGTON (Reuters) - With hedge funds at the center of market drama for the second time in less than 12 months, the GameStop saga is likely to expedite a regulatory review of the ever-larger role non-bank firms play in the financial markets, regulatory experts said. Scrutiny of the non-bank financial sector was already expected to be high on newly appointed Treasury Secretary Janet Yellen’s agenda after hedge fund de-leveraging contributed towards turmoil in the U.S. treasury market in March 2020. But the sector is likely to garner much closer attention after a retail buying frenzy in GameStop and other stocks burnt several hedge funds that had bet against the companies, and led retail brokerages to restrict trading in the affected stocks. The incident appeared to spark market-wide volatility, as hedge funds scrambled to meet their obligations and close out bad bets, trading the highest volume of shares since 2009, according to an analysis from Goldman Sachs Group Inc. It has shone a spotlight on the huge footprint of non-bank equity trading firms, particularly that of Citadel Securities, which accounts for over 20% of all U.S. equities volumes and roughly 39% of all U.S.-listed retail volume, according to its website. Its heft has raised questions over the company’s market power. “Washington was already expected to scrutinize various non-bank financial markets, but this episode increases the urgency,” Isaac Boltansky, director of policy research at Compass Point Research & Trading wrote in a note. “Citadel Securities will certainly be part of the conversation.” A spokeswoman for Citadel Securities did not immediately provide comment Monday evening. After the 2009 financial crisis, Congress imposed tough rules on banks, pushing riskier activities into more lightly-regulated sectors, such as asset managers and private funds. In response, the Treasury’s Financial Stability Oversight Council (FSOC) began a review of the asset management sector, and in 2016 warned that leveraged hedge funds could cause instability during market stress if they became forced sellers. The FSOC said it would continue monitoring hedge fund risks, including leverage, and address data blindspots, but months later former President Donald Trump’s administration shut down that project, according to Yellen and public records. With a Democratic administration now in power and a new crop of regulators due to take over, regulatory advocates expect the Treasury to reprise this project. “This is a decent moment to step back and think about what trading activities in the financial system regulators should really be concerned about from a broader systemic perspective,” said Gregg Gelzinis of Washington think tank Center for American Progress, who has advocated for FSOC to take on hedge funds. The Managed Funds Association, which represents the sector, did not provide comment on recent industry gyrations, but has said that hedge fund investments help pension funds and other institutional investors manage risk and deliver returns. Hedge funds won’t be the only ones in the spotlight. Open-ended funds and money market funds, which have also grown in systemic importance, are already under review internationally by the global Financial Stability Board. “We need better oversight of the non-bank financial sector, to make sure we have rules and safeguards in place that creates a financial system that serves the economy,” said Gelzinis. The Treasury did not respond to a request for comment, but Yellen has been a strong advocate of FSOC’s work and has previously said March’s treasury market turmoil showed that the risks FSOC had identified were “real and serious.” During that episode, highly leveraged hedge funds dumped treasuries to meet margin calls, prompting the Federal Reserve to step in and prop up the market, according to the Bank for International Settlements. It added that September 2019 dislocations in the repurchase agreement market were a “precursor” to the March turmoil and involved similar players. As of 2020, the aggregate net value of U.S. hedge fund assets was $2.9 trillion, but when taking leverage into account gross assets were $6.3 trillion, said FSOC. While aggregate leverage was relatively small, much of it was concentrated among a small number of players, FSOC found in 2016. That concentrated leverage and the exposure it creates for bank counterparties “could become an area of focus,” said Boltansky."
80.22221888888889," GLOBAL MARKETS-Global markets buoyant as U.S. stimulus package debate looms Global stock markets gained for a second day on Tuesday, spurred by increased optimism about economic stimulus and global recovery, while retail investors retreated from GameStop and their new-found interest in silver. Positive momentum from Asia carried through to Europe, with the pan-European STOXX 600 (.STOXX) edging up 0.9%. Shares in BP (BP.L) lost 3.8% after it plunged to a $5.7 billion loss last year, its first in a decade. read more MSCI's world equity index, which tracks shares in 49 countries, was 0.4% firmer after posting its strongest day in three months on Monday. MSCI's gauge of Asia Pacific stocks outside Japan (.MIAPJ0000PUS) rose 1.5%, with China's benchmark CSI300 Index (.CSI300) climbing 1.5%, helped by easing concerns about tight liquidity and falling cases of new coronavirus infections. Japan's Nikkei 225 (.N225) added 1%. E-mini futures for the S&P 500 index added 0.8%. Markets were buoyant ahead of negotiations Tuesday between U.S. President Joe Biden and Republican senators on a new COVID support bill. The GOP's $618bn stimulus plan released early Monday was about a third the size of the President's proposal. Top Democrats later on Monday filed a joint $1.9 trillion budget measure in a step toward bypassing Republicans. read more ""If you have the ability to have stimulus compromise it's going to be very supportive for financial assets in the medium term as it means you will have the ability to have an economic recovery,"" said Francois Savary, chief investment officer at Swiss wealth manager Prime Partners. ""The $1.9 trillion was set as a high bar of the possibilities and in a way to get into a negotiation to get something that would be smaller and more efficient."" The dollar hovered near a seven-week high, benefiting from a euro selloff overnight after coronavirus lockdowns choked consumer spending in Germany, and on short-covering in over-crowded dollar-selling positions. The dollar index eased a touch by 0.1% to 90.91. Against the U.S. dollar, the euro was trading at $1.2078, just above an early December low of $1.2056 hit in the previous session.  The Australian dollar pared gains after the country's central bank said it will extend its quantitative easing programme to buy an additional $100 billion of bonds. The Aussie last stood at $0.7627 , nearly flat on the day. Turkey's lira firmed more than 1%, extending a rally after the central bank promised tight policy for an extended period last week. With global market sentiment remaining upbeat about U.S. fiscal stimulus, core euro zone government bond yields edged up, with the benchmark German 10-year Bund yield < DE10YT=RR.> around two basis points higher at -0.4980%. Institutional investors are still digesting the retail trading frenzy that boosted GameStop Corp and other so-called meme stocks in recent sessions against their financial fundamentals but have made cautious moves to protect their positions. GameStop's Frankfurt-listed shares were down 30% from Monday's close at 143 euros in early trade on Tuesday. It closed in U.S. markets at $225. L4N2K81PJ Spot silver prices slipped 4.8% to $27.59 per ounce, as investors locked in profits after the precious metal touched a near eight-year peak in the previous session driven by retail investors. read more Spot gold fell 0.6% Tuesday to $1,847.51 per ounce. Brent crude was up 1.1% at $56.95 a barrel. U.S. crude gained 1.2% to $54.22 as falling inventories and rising fuel demand due to a massive snow storm in the Northeast United States propped up prices. "
80.22221888888889," Buying into 'poor man's gold', Chinese investors jump on silver SHANGHAI (Reuters) -Chinese investors rushed into silver investments on Monday, pushing up Shanghai silver prices while boosting performances of related stocks and funds, matching calls by global retail investors to boost prices of the precious metal. Retail traders on Reddit and other social media who caused a rally in share prices of U.S. video game retailer GameStop Corp have now turned their attention to silver, leading Chinese investors to also jump on the bandwagon. China’s domestic silver prices rose to their highest since September. Prices on the Shanghai Futures Exchange closed up 9.27% at 5,939 yuan per kilogram. Spot prices on the Shanghai Gold Exchange surged to an over four-month high on Monday before ending afternoon trade up 9.4% at 5,890 yuan per kilogram. Open interest on the Shanghai futures contract also jumped on Monday to 516,568 lots, its highest since the start of the year. Trading volumes reached 2.28 million lots. “Since last week’s Reddit discussions to buy long, funds have flowed into the silver market,” said Xu Ying, precious metals senior analyst at Orient Securities Research. “In the short term, silver’s rise has little to do with fundamentals. Sentiment to go long is high, the market rally is not over yet.” Silver is dubbed the “poor man’s gold”, as it is cheaper to buy and invest in while impacted by the same factors as gold. Shares of Chinese listed silver mining companies like Shengda Resources Co Ltd and Inner Mongolia Xingye Mining Co Ltd, rallied on Monday, while listed open fund UBS SDIC silver futures fund closed 8.7% up. Chinese social media was abuzz with silver’s rally, but warned of a possible bubble. “I thought it will be the victory of retail investors, but if this continues, the market will definitely fall and retail investors will only harm one another,” said a comment on Weibo."
80.22221888888889," Analysis: GameStop saga may provide early test of Biden administration ethics pledges WASHINGTON (Reuters) - Arguably the last thing new U.S. Treasury Secretary Janet Yellen wants to take up during her first days in office is a financial market imbroglio involving one of her last private sector business relationships. But as hedge fund Citadel LLC emerges as one of the key actors in the trading frenzy last week involving GameStop Corp - and questions arise over whether the activity exposes deeper risks for the financial system - Yellen could find herself pulled into the fray. Citadel, together with another fund, extended a $2.75 billion financial lifeline to hedge fund Melvin Capital Management, which had suffered heavy losses by betting against GameStop. Citadel Securities, a separate trading arm, pays Robinhood to execute its users’ trades, a practice that has drawn some concern from investor advocates. The White House has said Yellen is among a handful of officials monitoring the fracas. As head of the Financial Stability Oversight Council (FSOC), Yellen is broadly responsible for the health of the entire trading and investing system. A sticking point for her to clear, though, may be $700,000 in speaking fees she accepted from Citadel, as recently as last fall. Yellen has pledged not to involve herself in an official capacity in matters involving the firm without first seeking a written waiver from Treasury ethics officials. Ethics experts say that pledge is not a hard wall for her to scale should the need arise. After ethics violations dogged the Trump administration, some groups are urging Yellen to pre-emptively seek a waiver, and set a precedent. “This example is a good test of Biden’s ethics executive order and the transparency that follows, but it also highlights the revolving door and why restrictions are necessary to protect the integrity of government missions, policies, and programs,” said Scott Amey, general counsel at Project On Government Oversight, a nonpartisan government watchdog group. The Treasury secretary normally does not get involved in matters involving individual stocks and concentrates instead on broad systemic risks to the financial system, which the department monitors through daily market surveillance. “Secretary Yellen of course will abide by her ethics agreement and ethics pledge in all instances,” Treasury spokesman Calvin Mitchell said. He did not indicate how she would approach the specific Citadel issue. Like many former government officials, including here her Federal Reserve chair predecessor Ben Bernanke, Yellen took speaking fees from private companies after she left government. Yellen filed an ethics agreement here with the Office of Government Ethics in December saying she would ""seek written authorization to participate personally and substantially in any particular matter"" related to any companies that paid her speaking fees prior to joining President Joe Biden's administration - for a year after her last speech to each firm. Yellen spoke several times at Citadel, most recently on an Oct. 27 webinar, according to the filing. She was paid at least $700,000 in speaking fees by the Citadel while she was in private practice at the Brookings Institution think tank, another disclosure here shows. These speaking engagements, which also include financial heavyweights such as Barclays, Citigroup, and Goldman Sachs, are not likely to impact her ability to give Biden broad advice on the stock trading matter, government ethics experts say. “If this becomes a situation where regulators are considering new rulemaking with Citadel as the poster-child, that’s different,” said Lisa Gilbert, executive vice president of Public Citizen, a group pushing for stronger financial regulation. A major question is whether volatility from Gamestop and similar retail investor revolts against short-squeezes boil over into a systemic event that sends markets crashing broadly. Typically a matter involving an individual stock or equity market trading and brokerages would fall to the Securities and Exchange Commission, which has said it is examining the matter. On Friday, SEC commissioners including acting chair Allison Herren Lee said in a statement here they were closely monitoring the extreme volatility in certain stocks and warned market participants to ""uphold their obligations to protect investors and to identify and pursue potential wrongdoing."" Extreme stock price volatility “has the potential to expose investors to rapid and severe losses and undermine market confidence,” they added. Biden’s choice to run the SEC, Gary Gensler, awaits Senate hearings. The FSOC that Yellen chairs is charged with identifying risks and responding to emerging threats to financial stability. It includes the heads of the Federal Reserve and other major U.S. financial regulatory agencies. It has the authority to designate non-bank financial institutions for consolidated supervision to minimize risk to the financial system or to break up firms that pose a “grave threat.” Distress in individual companies rarely rises to such a level. Treasury maintains daily market surveillance, but it is looking for orderly market functioning and broad systemic threats. Thus far, the situation looks contained, Barclays said in a note to clients on Friday. Short positions in stocks favored on the Reddit social media site total about $40 billion, which would limit the pain to a handful of hedge funds. “The ongoing short squeeze in a few stocks by retail investors has raised concerns of a broader contagion. While we believe there is more pain to come, we remain optimistic that it is likely to remain localized,” Barclays said. Unlike many previous Treasury secretaries, Yellen has only worked as an academic and for the government, not at a bank or trading firm. Richard Painter, a former top ethics lawyer to President George W. Bush, said many Treasury secretaries had a great deal more entanglements that would raise conflict of interest concerns than Yellen. Henry Paulson, a Republican who was U.S. Treasury secretary during the 2008 financial meltdown, sold half a billion dollars in stock from his former employer Goldman Sachs Group Inc to satisfy ethics concerns. Paulson later forced Goldman and other major banks to take billions of dollars in taxpayer capital at the depth of the financial crisis. Steven Mnuchin, Yellen's immediate predecessor, pledged here after he was nominated to divest $94 million in investments, and refrain from any decisions involving CIT Group until August 2018, when he was due a payment of $5 million from the company. “Yellen is going to be about as clean as you can get on this stuff,” Painter said. (This story refiles to add in paragraph 3 full company name for Citadel entity that executes Robinhood trades)"
