-45.787691692307696," ""GameStop effect"" could ripple further as Wall Street eyes short squeeze candidates NEW YORK (Reuters) - The clash between retail traders and Wall Street professionals that sparked roller coaster rides in the shares of GameStop Corp may pose a risk to dozens of other stocks and potentially create a headache for the broader market, analysts said. Market watchers identified dozens of stocks potentially vulnerable to extreme volatility after a buying spree from an army of retail traders in recent days prompted hedge funds to unwind their bets against GameStop and other companies, fueling surges in their share prices in a phenomenon known as a “short squeeze.” “Unfortunately, it’s definitely not a one-off thing,” said Randy Frederick, vice president of trading and derivatives at the Schwab Center for Financial Research. “The type of activity that drove that higher, I believe, has caused people to try to duplicate that in other names.” J.P. Morgan earlier this week named 45 stocks that may be susceptible to short squeezes and similar “fragility events,” including real estate company Macerich Co, restaurant chain Cheesecake Factory Inc and clothing subscription service Stitch Fix Inc. Like GameStop, American Airlines Group Inc, AMC Entertainment Holdings Inc and others that have recently become targets of retail traders in recent days, all the stocks have high short interest ratios. That means a large percentage of investors have borrowed the stock to sell it in anticipation that they will be able to buy it back at a lower price and profit on the trade. But if the stock rises sharply, those investors may be forced to buy back the stock at a loss. “The unfortunate events in GameStop this week may be building a dangerous precedent for markets whereby retail investors act en masse to leverage their buying powers to spark fragility events,” analysts at J.P. Morgan said in a note. Using derivatives and coordinating buying on websites such as the Reddit forum wallstreetbets, retail investors have had an outsize impact on markets in recent months. Hedge funds Melvin Capital Management and Citron Capital closed out short positions in GameStop earlier this week after buying pressure pushed up the company’s shares. GameStop shares were recently down 25% on Thursday as retail brokerages Robinhood Markets Inc and Interactive Brokers Inc, restricted purchases of the stock, along with several others that have catapulted in recent days, including AMC Entertainment Group Inc and BlackBerry Ltd.. Even so, the video game retailer’s shares have gained more than 500% since last Thursday. Barring wider trading restrictions, similar patterns could play out over several weeks as short sellers unwind their bets, said Michael Purves, chief executive of Tallbacken Capital Advisors. Some firms run strategies that involve holding both long and short positions on a stock, he said, and as a result, certain stocks could see a surge and then a sharp drop as those firms adjust their positions. That process could put pressure on stocks more broadly and contribute to market volatility. “I do think the contagion risk is real,” Purves said. “Any stock that is heavily shorted is exposed to getting GameStopped.”"
-45.787691692307696," Asia's 'ant' and 'moth' investors test broker nerves SINGAPORE (Reuters) - Asia’s retail investors, emboldened by the meteoric rise of U.S. videogame retailer GameStop, are taking on short sellers and making their brokers nervous enough to cut off margin lending. In South Korea, small investors known as “ants” have borrowed so much money to dabble in stocks that at least half a dozen brokerages have stopped offering them leverage. GameStop’s global impact is the latest manifestation of a day-trading mania driven by amateur investors that is boosting the price of assets ranging from cryptocurrencies to new stock market listings. “Not afraid, not flinching,” said Ji-Han Kim, who works at a food delivery chain in Seoul and whose stock portfolio includes Chinese drone-maker Ehang, which he says has made him a 412% return, and chip giant Samsung Electronics. “I see it as a bubble that doesn’t burst for a while.” However, this euphoria is not universal and Korea Financial Investment Association data shows six South Korean brokerages stopped margin lending this month, after loan values hit a record 21.6 trillion won ($19.3 billion) this week. “Any more lending to ants would go against the capital requirement ratio for brokerages,” said Kwak Sang-jun, a stockbroker at Shinhan Investment Corp in Seoul. “No-one expected the rally would be this explosive, and trading demand from retail investors would grow this explosive.” The retail phenomenon is widespread across Asia, where small-time traders have long played an outsized role, especially in markets such as South Korea and China. But investors are becoming younger, much more leveraged and influential. In Thailand, where they are known as “moths”, such investors piled into local cannabis-related stocks on Thursday in anticipation of regulatory changes by the government there. In Hong Kong, retail investors borrowed more than $50 billion to buy shares in Chinese video sharing app Kuaishou Technology’s float. And in Australia and Japan, heavily shorted stocks are surging as small investors try and emulate the squeeze that has driven GameStop shares up 17-fold in little more than two weeks. GameStop has become the poster-stock for apparently coordinated small-investor buying, marshalled over online forums such as Reddit, and aimed at inflicting pain on big hedge funds who had bet it would struggle and its stock would fall. It was the most-traded stock at brokers Stockal and Vested Finance in India and a tiny Australian nickel explorer with a similar ticker, GME Resources, rose as much as 50% on Thursday in Sydney. Such trades lit up market forums such as chat app Telegram, Kakao Talk in South Korea and 2 channel in Japan, as prices reacted to the retail army, though with much less of the fury of Reddit forums and much more enthusiasm for locking in gains. “People are calling me and saying: I’m FOMO, I think I’m missing something,” said Chris Brankin, CEO at TD Ameritrade in Singapore, a platform for local investors to buy U.S. stocks. Along with fellow retail darling AMC Entertainment, GameStop has topped volumes over last few days for Saxo Capital Markets, said its Asia-Pacific CEO Adam Reynolds, adding new account volumes are “insane”, with 80% of new clients under 40. “Because they’re getting better and because they’re getting more confidence, it’s sometimes the institutional (investors) who are getting a bit overrun,” Reynolds said. Retail investors made up 67% of average daily trading volume on South Korea’s main KOSPI market last year and a “buy everything” market has lifted it 113% since March. Asian markets were jittery on Thursday and painful for short sellers, as some heavily shorted companies jumped. In Australia, funeral operator InvoCare, salmon farmer Tassal and poultry producer Inghams, all of which have short interest levels higher than 8% according to regulatory data, leapt to multi month highs. Japan’s most shorted stock, telecom equipment maker Anritsu Corp, touched a two-decade high. In China, where investors are more familiar with the swings and roundabouts of a market in which fickle retail buyers command price moves, traders were admiring of the role adopted by U.S. retail investors but said that such stock volatility would trigger action by Chinese regulators. “Retail investors in the U.S. are marvellous,” read one well-liked post on a chat app run by Hithink RoyalFlush. For Chinese cryptocurrency entrepreneur Justin Sun, who bid$4.6 million for a charity lunch with Warren Buffet in 2019, the GameStop party is not over. “I’ll be buying $1 mil of $GME tonight,” he said on Twitter. “Watch out, Asians are coming!”"
-45.787691692307696," WRAPUP 2-""We love this stock"": GameStop effect spreads as calls for probe build An army of retail investors that has routed Wall Street’s professionals in recent days was dealt a blow on Thursday, after online brokerages restricted purchases of red-hot GameStop and other stocks that had soared this week. But the shares rebounded in after hours trading, resuming their advances after Robinhood Markets Inc and Interactive Brokers said they planned to lift the restrictions on Friday. Retail investors, celebrities and policymakers had denounced Thursday's restrictions and participants in online forums seethed, accusing the trading platforms of seeking to protect Wall Street's interests at the expense of smaller investors. ""Robin Hood: a parable about stealing from the rich to give to the poor. Robinhood: an app about protecting the rich from being short squeezed by the poor,"" Jake Chervinsky, a lawyer for fintech company Compound, wrote on Twitter. Robinhood reversed course by the end of the day and said limited buying in the stocks would resume on Friday. Shares of retail favorites including GameStop (GME.N) and AMC Entertainment (AMC.N), which erased an early surge on news of the restrictions then rose after hours. ""In order to protect the firm and protect our customers we had to limit buying in these stocks,"" Robinhood chief executive Vlad Tenev said in an interview with CNBC. ""We absolutely did not do this at the direction of any market-maker or any hedge fund or anyone we route to or other market participants."" Robinhood has drawn down some of its credit lines with banks, tapping at least several hundred million dollars from lenders including JP Morgan Chase and Co and Goldman Sachs Group Inc, Bloomberg reported on Thursday, citing sources. The firm did not immediately respond to a request for comment, but in a blog post earlier it said that volatility affected its obligations to hold capital and clearinghouse deposits. But Tenev said there was no liquidity crisis. The buying restrictions, and their partial reversal, marked a turn in a battle that many have framed as a showdown between hedge funds and other institutions against retail investors. Until Thursday, it appeared retail traders had the upper hand. Coordinating on forums such as Reddit’s Wallstreetbets, the small investors forced hedge funds to unwind short positions that had bet on the decline of shares in companies such as GameStop and American Airlines. That activity resulted in a short squeeze that sent the shares soaring. GameStop, the video game retailer whose 1,700% rally has been at the heart of the slugfest in the past week, initially rallied to more than $480 a share on Thursday, Refinitiv data showed. It closed down around 44% at $193.60. AMC's value was cut by nearly half and Koss Corp (KOSS.O) dropped by around a third. ""The Robinhood ban on those stocks have put a pretty good end to (the rally),"" said Dennis Dick, proprietary trader at Bright Trading LLC in Las Vegas. ""Everybody's trying to hit the exit button at the same time.""  SOME BUYING TO RESUME FRIDAY Citing market volatility and the need to keep investors informed, Robinhood, based in Menlo Park, California, said it was halting buying of viral stocks and raising margin requirements for certain securities. Two customers sued Robinhood over the trading ban, seeking damages. Robinhood said later that it planned to allow limited purchases of these securities starting Friday. Some users complained on Twitter that Robinhood had notified them that it was selling their shares, without their consent. A Robinhood spokeswoman did not immediately respond to a request for comment. Interactive Brokers, another online trading platform, also restricted trading in those stocks. Robinhood has seen business boom during the coronavirus pandemic as more home-bound consumers took to trading stocks online. The app now counts more than 13 million users. Social media chatrooms are beginning to resemble the squawk boxes on trading floors as a new generation of retail traders gains influence. U.S. Senator Sherrod Brown, incoming Democratic chairman of the Senate Banking and Housing Committee, said he will hold a hearing on the current state of the stock market. ""People on Wall Street only care about the rules when they're the ones getting hurt,"" Brown said in a statement.  KNOCK-ON EFFECTS Before its retreat, GameStop briefly became the biggest stock in the Russell 2000 index (.RUT) of small caps, according to Zerohedge. Lawmakers from both main parties in Congress, including Democrat Alexandria Ocasio-Cortez and Republican Ted Cruz, criticized the decision by Robinhood to restrict retail trading. Robinhood did not respond to requests for comment. Other stocks swept up in the drama were Canada's First Majestic Silver (FR.TO), , Blackberry (BB.TO), Australian nickel and cobalt explorer GME Resources (GME.AX) and oil driller New Concept Energy (GBR.A). J.P. Morgan named 45 stocks that it said may be susceptible to short squeezes and similar “fragility events,” including Macerich Co (MAC.N), Cheesecake Factory Inc (CAKE.O) and Stitch Fix Inc (SFIX.O). Short-sellers are sitting on estimated losses of $71 billion from positions in U.S. companies this year, data from analytics firm Ortex showed. Long derided by market professionals as “dumb money,” the pack of retail traders, some of them former bankers working for themselves, has become an increasingly powerful force worth 20% of equity orders last year, UBS data showed. "
-45.787691692307696," WRAPUP 1-GameStop slugfest spreads as calls for probe build An army of retail investors that has routed Wall Street’s professionals in recent days was dealt a blow on Thursday, after online brokerages restricted purchases of red-hot GameStop and other stocks that had soared this week. But the shares rebounded in after hours trading, resuming their advances after Robinhood Markets Inc and Interactive Brokers said they planned to lift the restrictions on Friday. Retail investors, celebrities and policymakers had denounced Thursday's restrictions and participants in online forums seethed, accusing the trading platforms of seeking to protect Wall Street's interests at the expense of smaller investors. ""Robin Hood: a parable about stealing from the rich to give to the poor. Robinhood: an app about protecting the rich from being short squeezed by the poor,"" Jake Chervinsky, a lawyer for fintech company Compound, wrote on Twitter. Robinhood reversed course by the end of the day and said limited buying in the stocks would resume on Friday. Shares of retail favorites including GameStop (GME.N) and AMC Entertainment (AMC.N), which erased an early surge on news of the restrictions then rose after hours. ""In order to protect the firm and protect our customers we had to limit buying in these stocks,"" Robinhood chief executive Vlad Tenev said in an interview with CNBC. ""We absolutely did not do this at the direction of any market-maker or any hedge fund or anyone we route to or other market participants."" Robinhood has drawn down some of its credit lines with banks, tapping at least several hundred million dollars from lenders including JP Morgan Chase and Co and Goldman Sachs Group Inc, Bloomberg reported on Thursday, citing sources. The firm did not immediately respond to a request for comment, but in a blog post earlier it said that volatility affected its obligations to hold capital and clearinghouse deposits. But Tenev said there was no liquidity crisis. The buying restrictions, and their partial reversal, marked a turn in a battle that many have framed as a showdown between hedge funds and other institutions against retail investors. Until Thursday, it appeared retail traders had the upper hand. Coordinating on forums such as Reddit’s Wallstreetbets, the small investors forced hedge funds to unwind short positions that had bet on the decline of shares in companies such as GameStop and American Airlines. That activity resulted in a short squeeze that sent the shares soaring. GameStop, the video game retailer whose 1,700% rally has been at the heart of the slugfest in the past week, initially rallied to more than $480 a share on Thursday, Refinitiv data showed. It closed down around 44% at $193.60. AMC's value was cut by nearly half and Koss Corp (KOSS.O) dropped by around a third. ""The Robinhood ban on those stocks have put a pretty good end to (the rally),"" said Dennis Dick, proprietary trader at Bright Trading LLC in Las Vegas. ""Everybody's trying to hit the exit button at the same time.""  SOME BUYING TO RESUME FRIDAY Citing market volatility and the need to keep investors informed, Robinhood, based in Menlo Park, California, said it was halting buying of viral stocks and raising margin requirements for certain securities. Two customers sued Robinhood over the trading ban, seeking damages. Robinhood said later that it planned to allow limited purchases of these securities starting Friday. Some users complained on Twitter that Robinhood had notified them that it was selling their shares, without their consent. A Robinhood spokeswoman did not immediately respond to a request for comment. Interactive Brokers, another online trading platform, also restricted trading in those stocks. Robinhood has seen business boom during the coronavirus pandemic as more home-bound consumers took to trading stocks online. The app now counts more than 13 million users. Social media chatrooms are beginning to resemble the squawk boxes on trading floors as a new generation of retail traders gains influence. U.S. Senator Sherrod Brown, incoming Democratic chairman of the Senate Banking and Housing Committee, said he will hold a hearing on the current state of the stock market. ""People on Wall Street only care about the rules when they're the ones getting hurt,"" Brown said in a statement.  KNOCK-ON EFFECTS Before its retreat, GameStop briefly became the biggest stock in the Russell 2000 index (.RUT) of small caps, according to Zerohedge. Lawmakers from both main parties in Congress, including Democrat Alexandria Ocasio-Cortez and Republican Ted Cruz, criticized the decision by Robinhood to restrict retail trading. Robinhood did not respond to requests for comment. Other stocks swept up in the drama were Canada's First Majestic Silver (FR.TO), , Blackberry (BB.TO), Australian nickel and cobalt explorer GME Resources (GME.AX) and oil driller New Concept Energy (GBR.A). J.P. Morgan named 45 stocks that it said may be susceptible to short squeezes and similar “fragility events,” including Macerich Co (MAC.N), Cheesecake Factory Inc (CAKE.O) and Stitch Fix Inc (SFIX.O). Short-sellers are sitting on estimated losses of $71 billion from positions in U.S. companies this year, data from analytics firm Ortex showed. Long derided by market professionals as “dumb money,” the pack of retail traders, some of them former bankers working for themselves, has become an increasingly powerful force worth 20% of equity orders last year, UBS data showed. "
-45.787691692307696," GameStop up another 60%, amateur interest shows no sign of abating A slugfest between Wall Street and Main Street took an unexpected turn late on Wednesday after moderators of a stock trading forum that has helped fuel massive rallies in the shares of GameStop (GME.N) temporarily closed its doors. Shares of GameStop and other companies tumbled in extended trading after Wallstreetbets, a discussion forum popular with retail traders on the Reddit website, briefly turned invitation-only. They pared those losses around an hour later, when the forum opened back up. ""We have grown to the kind of size we only dreamed of in the time it takes to get a bad night's sleep. We've got so many comments and submissions that we can't possibly even read them all, let alone act on them as moderators,"" read a message from the group's moderators after Wallstreetbets reopened. Shares of GameStop, AMC Entertainment (AMC.N), Koss Corp (KOSS.O) and BlackBerry (BB.TO) all dropped at least 20% moments after the shuttering of the forum, highlighting the role it has played in fueling stock rallies that many say have been driven primarily by retail investors. Earlier in the day, amateur traders chalked one up versus Wall Street as hedge funds suffered heavy losses on short positions in GameStop, and regulators and financial professionals called for more scrutiny of trading fueled by anonymous social media posts. In the latest skirmish in a week-long battle between Wall Street and Main Street, funds sold long positions in stocks to pay for losses shorting GameStop, contributing to a slide of more than 2% in Wall Street's main indexes. ""We are moving to a world where ordinary folk have the same access as professionals and can come to the same conclusion or maybe the opposite,"" technology investor Chamath Palihapitiya told CNBC. ""The solution is more transparency on the institutional side, not less access for retail."" The market turmoil caught the attention of the White House, with press secretary Jen Psaki saying President Joe Biden's economic team - including Treasury Secretary Janet Yellen on her first full day on the job - was ""monitoring the situation."" Massachusetts state regulator William Galvin called on NYSE to suspend GameStop for 30 days to allow a cooling-off period. ""This isn’t investing, this is gambling,"" he said in an interview. ""This is obviously contrived."" read more Nasdaq chief Adena Friedman said exchanges and regulators should watch whether anonymous social media posts could be driving ""pump and dump"" schemes. read more ""If we see a significant rise in the chatter on social media ... and we also match that up against unusual trading activity, we will potentially halt that stock to allow ourselves to investigate the situation,"" Friedman said on CNBC. The U.S. Securities and Exchange Commission said it was aware of the market volatility and working with fellow regulators to ""assess the situation and review the activities of regulated entities, financial intermediaries, and other market participants."" U.S. Senator Elizabeth Warren, long critical of Wall Street, called on regulators to take action. “For years, the same hedge funds, private equity firms, and wealthy investors dismayed by the GameStop trades have treated the stock market like their own personal casino while everyone else pays the price,” Warren said on Twitter. “It's long past time for the SEC and other financial regulators to wake up and do their jobs.” Reddit has not been contacted by authorities over stock surges driven by a message board on the platform, a spokeswoman said.  GAME ON The war began when famed short seller Andrew Left of Citron Capital bet against GameStop and was met with a barrage of retail traders betting the other way. Citron has been a target on Wallstreetbets. Left said in a video post that Citron abandoned its bet against GameStop after the video game retailer's value soared almost tenfold in a fortnight. ""I have respect for the market,"" Left said in the post. Melvin Capital Management closed out its short position in GameStop on Tuesday after taking a huge loss. read more Shares of GameStop surged 135% during Wednesday's trading session, bringing their gain since Jan. 12 to about 1,700% and ballooning its market capitalization to $24 billion. read more U.S. shares of BlackBerry jumped 33%, bringing their gain in 2021 to 279%, while movie theater operator AMC surged 300% and is now up over 800% year to date. Along with Finnish technology firm Nokia Oyj (NOKIA.HE), , those companies were among the most heavily traded, with Reddit threads humming with chatter about the stocks. Nokia said it was not aware of any reason for the continuing surge in its share price. read more Such inflated stocks will eventually fall back to their fair value, predicted Ryan Detrick, senior market strategist at LPL Financial in Charlotte, North Carolina. ""It does have a David and Goliath feel, where the Reddit crowd is taking on the most shorted stocks by the largest hedge funds in the world and winning."" BlackRock Inc (BLK.N), the world's largest asset manager, could have made gains of about $2.4 billion on its investment in GameStop. Its share holdings amounted to roughly a 13% stake as of Dec. 31, 2020, a regulatory filing showed. read more According to research firm S3 Partners, total short interest in GameStop was $10.6 billion as of Wednesday. In the last seven days the short has increased by $117 million, or 1.1%, as the stock price surged. Year-to-date, GameStop shorts have lost $19.15 billion, including $9.85 billion on Wednesday at a $285 share price, according to Ihor Dusaniwsky, S3's managing director of predictive analytics. ""These large mark-to-market losses will be squeezing many existing shorts out of their positions, but we are still seeing new short sellers taking their place as they look to short at the top and ride a windfall of profits,"" he said. Long dismissed as ""dumb money,"" retail traders have made stocks move in ways that defy fundamental analysis. read more Global bets worth billions of dollars could be at risk as amateurs challenge bearish positions of influential funds. Experts are debating whether these massive share moves should be considered ominous signs for the market. read more Reddit co-founder Alexis Ohanian said the rise of retail investors is healthy, however. ""That's the sentiment, the public doing what they feel has been done to them by institutions,"" Ohanian said in a tweet on Wednesday. "
