4.851278328611905," Honda offers early retirement in India amid slowing motorcycle sales CHENNAI (Reuters) - Honda Motor Co is offering voluntary retirement to some permanent employees at its motorcycles and scooters unit in India amid slowing demand there following the COVID-19 pandemic, the company said on Wednesday. Honda Motorcycles and Scooters India (HMSI), the country’s second-largest manufacturer of two-wheelers, said it planned to realign its production strategy to improve operational efficiency and ensure long term business sustainability. “The Indian auto industry is going through an exceptionally challenging phase from the past three years considering the prolonged demand slowdown and overall economic fallout from the COVID-19 pandemic,” the company said in a statement. While automakers globally have been battered by the pandemic, companies in India have also been hit by slowing demand since 2019. The move comes weeks after the Japanese automaker said it would shutter one of two car plants in India due to slowing demand. HMSI made the scheme available to its employees’ union through a letter dated Jan. 5, which was reviewed and reported by Reuters earlier on Wednesday. The letter said the scheme was open to permanent employees who have completed 10 years of service or are over 40 as of Jan. 31, 2021. Depending on the number of years of service, a senior manager or vice president could be eligible for a payout of 7.2 million rupees ($98,488), the letter showed. While it was not immediately clear how many employees would qualify, the letter said the first 400 people to opt for retirement would get an additional 500,000 rupees. HMSI had more than 7,000 employees across its four plants in India as of March 31, 2020, according to a filing with the U.S. Securities and Exchange Commission. Between April and November, the first eight months of the current fiscal year, HMSI’s sales plummeted 32% to 2.4 million units, with sales of motorcycles and scooters falling 25%, industry data showed. The automaker has capacity to manufacture 6.4 million motorcycles and scooters a year in India, according to its website. The company continues to see a strong potential to develop India as Honda’s global export hub in the mid-term and its investment plans for future products and technology remain unchanged, it said."
4.851278328611905," Honda Motorcycles offers voluntary retirement in India, letter shows Honda Motor Co (7267.T) is offering voluntary retirement to employees of its motorcycles and scooters unit in India amid slowing demand in the country following the COVID-19 pandemic, a company letter shows. Honda Motorcycles and Scooters India (HMSI), the country's second-largest manufacturer of two-wheelers, made the offer to ""maintain its existence"" in a competitive market, it said in a letter to its employees' union dated January 5. ""The Indian auto industry is going through an exceptionally challenging phase considering the prolonged demand slowdown and economic fallout from the coronavirus crisis,"" HMSI said in the letter, which was reviewed by Reuters. ""In these uncertain times, we are aligning our production strategy for improved overall operational efficiency with the objective of long term business sustainability,"" it said. HMSI did not immediately respond to an email seeking comment. "
10.25362318840579," Honda halts UK car output on Tuesday and Wednesday due to supply delays LONDON (Reuters) - Japanese carmaker Honda said it was halting output at its British factory on Tuesday and Wednesday due to global supply delays. Honda also suspended production for a few days in December as some major container ports, such as Felixstowe, struggled to cope with disruption caused by COVID-19, pre-Brexit stockpiling and Christmas. The pandemic has upended normal trade flows, leaving stranded empty cargo containers in the wrong places, spawning bottlenecks around the world. Output at Honda’s southern English factory in Swindon had resumed on Monday after the festive break. “The situation is currently being monitored with a view to re-start production on Thursday 7 January,” the Japanese carmaker said in a statement. Major automakers operate just-in-time manufacturing, meaning some parts arrive moments before they are fitted to vehicles. Honda made just under 110,000 Civic cars in Britain in 2019 but is due to permanently close the site this year."
7.705965909090902," Honda to stop auto sales in Russia in 2022 MOSCOW (Reuters) - The Russian subsidiary of Japan’s Honda Motor Co said on Wednesday it would stop supplying new cars to official dealers in Russia in 2022 as part of the company’s efforts to restructure its operations. The company said it would keep its presence on the Russian market with motorcycle and power equipment sales, and retain its activities related to the after-sales service of its vehicles. Honda, which has no plants in Russia unlike other Japanese carmakers such as Toyota and Nissan, sold 79 vehicles in Russia last month, a 50% drop from a year earlier, according to the Association of European Businesses. Its sales from January to November were down 15% to 1,383 vehicles. More than 1.3 million new cars were sold in Russia during that period."
5.532213078858995," No UK port problems so far for Jaguar Land Rover (Reuters) - Luxury carmaker Jaguar Land Rover has not seen any impact so far from issues at UK ports, its parent Tata Motors said on Thursday, even as many countries cut transport ties with Britain due to a fast-spreading new variant of the coronavirus. Tokyo-listed Honda Motor Co Ltd had to stop output at its British factory earlier this month because of transport-related delays that caused a shortage of parts. It resumed production about a week later. The COVID-19 pandemic has compounded issues that were already plaguing carmakers ahead of Brexit, with the looming end to the transition period widely expected to cause delays at ports regardless of the outcome of talks on a trade deal. Jaguar Land Rover halted production at its British factories for a week in November last year to mitigate any potential impact from a no-deal Brexit ahead of the then Oct. 31 deadline."
3.767824296260161," Honda recalling 1.79 million vehicles worldwide for safety issues WASHINGTON (Reuters) -Honda Motor Co said on Tuesday it was recalling 1.79 million vehicles worldwide in four separate campaigns, including some linked to reported fires. The recalls cover 1.4 million vehicles in the United States. The Japanese automaker said one recall covers 268,000 2002-2006 model year CR-V vehicles in the United States to replace power window master switches. Honda said there had been no reported injuries, but 16 fires reported related to the issue. Honda conducted a prior recall of the power window master switches in 2012. The new recall is in response to moisture-related failures of switches repaired under the previous campaign. Honda is also recalling about 735,000 U.S. 2018-2020 Accord, Accord Hybrid and 2019-2020 Insight vehicles to update the Body Control Module software. A programming flaw could disrupt communication causing illumination of several warning lights and malfunction of electronic components, it said, including “the rear view camera display, turn signals and windshield wipers.” Honda is also issuing two recalls covering 430,000 U.S. vehicles in 22 U.S. states and the District of Columbia with significant road salt use to inspect and potentially replace front drive shafts. Both are in response to possible breakage of the drive shafts due to corrosion. No injuries have been reported in relation any of the recalls, the company said. Honda said repair parts are not available for all vehicles involved in the drive shaft recalls. The recalls cover some 2012 Honda Civic Hybrid, 2007-2014 Honda Fit, 2013-2015 Acura ILX 2013 Acura ILX Hybrid and 2013-2015 Honda Accord vehicles. No crashes have been reported in the drive shaft or software recalls."
3.767824296260161," Honda recalling 1.4 million U.S. vehicles Honda Motor Co (7267.T) said on Tuesday it was recalling 1.79 million vehicles worldwide in four separate campaigns, including some linked to reported fires. The recalls cover 1.4 million vehicles in the United States. The Japanese automaker said one recall covers 268,000 2002-2006 model year CR-V vehicles in the United States to replace power window master switches. Honda said there had been no reported injuries, but 16 fires reported related to the issue. Honda conducted a prior recall of the power window master switches in 2012. The new recall is in response to moisture-related failures of switches repaired under the previous campaign. Honda is also recalling about 735,000 U.S. 2018-2020 Accord, Accord Hybrid and 2019-2020 Insight vehicles to update the Body Control Module software. A programming flaw could disrupt communication causing illumination of several warning lights and malfunction of electronic components, it said, including ""the rear view camera display, turn signals and windshield wipers."" Honda is also issuing two recalls covering 430,000 U.S. vehicles in 22 U.S. states and the District of Columbia with significant road salt use to inspect and potentially replace front drive shafts. Both are in response to possible breakage of the drive shafts due to corrosion. No injuries have been reported in relation any of the recalls, the company said. Honda said repair parts are not available for all vehicles involved in the drive shaft recalls. The recalls cover some 2012 Honda Civic Hybrid, 2007-2014 Honda Fit, 2013-2015 Acura ILX 2013 Acura ILX Hybrid and 2013-2015 Honda Accord vehicles. No crashes have been reported in the drive shaft or software recalls. "
1.8125854993160095," Honda's UK output to resume on Monday after parts delays Honda (7267.T) said car production at its British factory will resume on Monday after transport-related parts delays halted output since Wednesday. ""Honda of the UK Manufacturing has confirmed to employees that full production operations will resume in all areas on Monday 14 December,"" the firm said in a statement. Britain's major container ports have been hit by the COVID-19 pandemic, which has disrupted global trade, leaving containers in the wrong place and goods stacked up. That has been compounded by Christmas and goods being stockpiled before Brexit. "
1.4655760054533051," Verstappen snatches pole for Abu Dhabi finale (Reuters) - Max Verstappen denied Mercedes a final front-row lockout of the season by snatching pole position in the dying seconds of Saturday’s qualifying for the year-ending Abu Dhabi Grand Prix. The Dutchman steered his Honda-powered Red Bull around the 5.5km-long Yas Marina circuit in one minute, 35.246 seconds edging Mercedes’ provisional pole-sitter Valtteri Bottas by just 0.025 seconds. World champion Lewis Hamilton, back in the car after his COVID-19-enforced absence at last week’s Sakhir Grand Prix, was third but only 0.086 seconds off the pace. “I said before I went into qualifying, it’s going to be the final send of the season and we did that,” said Verstappen after taking his third career pole and first this season. “The whole year when you’re behind getting closer, it’s getting sometimes a bit frustrating.” Verstappen’s dazzling display under the floodlights means it will be only the second time in 17 races this season that Mercedes haven’t started from the front. It was also the first non-Mercedes pole position of the season with Lance Stroll’s qualifying-topping effort in Turkey set in his Mercedes-powered Racing Point, and only the fourth time this season that Hamilton and Bottas haven’t locked out the front row. “The main issue was we couldn’t really get the soft tyres to work properly as it should,” said the 31-year-old Bottas. “The balance was not quite perfect.” Hamilton, who has taken 10 of Mercedes’ 15 poles this season, said he still wasn’t back to full fitness after only just having recovered from COVID-19. “It’s definitely been a difficult weekend,” said the 35-year-old Briton. “It just felt like you’ve lost that momentum and really struggled so far with the balance this weekend.” Verstappen had headed a Red Bull one-two from Alexander Albon in Saturday’s final practice session. But Mercedes were expected to strike back come the qualifying hour. Hamilton led Bottas in the first two parts of qualifying, with the pair looking like favourites for a front-row lockout. Verstappen, however, showed his speed as the final shootout got underway, splitting his Mercedes rivals after his first run, before posting the lap that deposed Bottas and Hamilton from the top of the timesheets. Lando Norris was an impressive fourth for McLaren, winning the team mate qualifying battle at McLaren against Ferrari-bound Spaniard Carlos Sainz who was sixth. Charles Leclerc was ninth for Ferrari but the Monegasque will drop three places on the grid due to a penalty for causing a collision at the last race in Sakhir. Sebastian Vettel was knocked out in the second phase of his final qualifying session for Ferrari. The German, moving to Racing Point which is rebranding to Aston Martin next year, was 13th. Sergio Perez, making way for Vettel at the Silverstone-based team, will start at the back of the grid. The Mexican, who became F1’s newest winner last weekend in Sakhir, is carrying engine-related penalties and did only a warm-up lap in the second phase of qualifying."
-0.6738544474393507," Honda warns UK output could be temporarily halted due to supply problems LONDON (Reuters) - Honda said on Tuesday potential parts shortages might result in the Japanese automaker needing to temporarily halt production at its British factory, where it builds the Civic car, due to transport-related delays. “Whilst a number of measures are being taken to mitigate any disruption, there could be a temporary pause to production to enable any supply issue to be resolved,” the company said in a statement. Spokesmen for the company did not immediately say whether the issue was related to Brexit. Talks between Britain and the European Union to strike a free trade deal by the end of the year have been unsuccessful so far with companies warning about the risk of severe disruption if there is no agreement. Transport between Britain and mainland Europe is likely to face some disruption even if there is an agreement before the transitional arrangements expire at the end of the year. Honda’s southern English Swindon factory built just under 110,000 cars last year but is due to close permanently next year."
-2.617630881378397," Motorcycling: Marquez stays in hospital after infection post-surgery (Reuters) - Six-times MotoGP world champion Marc Marquez will stay in hospital to treat an infection discovered after a third operation on his right arm, his Repsol Honda team said in an update on Saturday. The Spaniard fractured his humerus in the season-opening Spanish Grand Prix in Jerez in July, then had a second operation after damaging a plate in his arm while opening a window at home. He underwent another eight hours of surgery on Thursday for a new plate and bone graft. Honda said hospital doctors had deemed Marquez’s post-operative situation to be satisfactory. “However, the cultures obtained during the pseudarthrosis surgery have confirmed that there was a previous infection in the fracture, which will see Marquez undergo specific antibiotic treatment in the coming weeks,” the team added. It said he will remain at the hospital in Madrid. Honda have not said how long the Spaniard is likely to take to recover but media reports have suggested he could miss the start of next season in March."
-5.235255135851552," Marquez has third surgery on his right arm (Reuters) - Six-times MotoGP champion Marc Marquez has had a third operation on his right arm to put in a new plate, his Repsol Honda team said in a statement on Thursday. The Spaniard fractured his humerus in the season-opening Spanish Grand Prix in Jerez in July and had a second operation after damaging a plate in his arm while opening a window at home. He ended up missing the rest of the season, failing to score a single point. Honda said the latest surgery was due to the slow healing of the humerus “which has not improved with specific shock wave treatment.” The procedure lasted eight hours, they said, and was uneventful. Honda did not say how long the Spaniard’s recovery might take but motorsport.com suggested he could be out for six months, which would mean missing the start of next season. The first race is in Qatar on March 28."
-3.7565217391304286," Ferrari will support engine freeze, says team boss MANAMA (Reuters) - Ferrari will support a freeze on Formula One engine regulations starting in 2022, team principal Mattia Binotto said on Thursday, which would enable Red Bull to use their Honda power units even after the Japanese manufacturer leaves the sport. Honda, which exclusively supplies Red Bull and sister team AlphaTauri, is set to bow out of Formula One at the end of the 2021 season leaving the two outfits looking for a new supply. Red Bull’s preferred option is to acquire the intellectual property of the Honda power unit and continue using it for its two teams. But they have said that would only be financially viable if expensive engine development was frozen. Ferrari had been against the move to freeze engines even as rivals Mercedes, who have won every championship since the current engine rules were introduced in 2014, have supported it. But after meetings in recent days with the sport’s commercial rights holder and the governing FIA, Binotto said the Italian manufacturer had changed their mind provided the introduction of the next power unit, whose details are yet to be worked out, is brought forward a year from 2026 to 2025. “As Ferrari we understand the situation,” Binotto told reporters at the Bahrain Grand Prix in a video conference from Ferrari’s headquarters in Maranello. “We’re... supportive in trying to anticipate by one season, one year, the freezing of the engines. That will mean as well trying to anticipate to 2025 the new regulations for the power units.” Binotto, whose power unit is seen as the weakest of the four manufacturers, said the sport was discussing putting in place a mechanism that would allow any engine makers lacking performance to catch up. Like Ferrari, Renault had also been opposed to an engine freeze. But on Friday the team’s executive director Marcin Budkowski said the French manufacturer had always supported the idea of halting development in the build-up to a rules change so as to avoid running two programmes simultaneously. He said in the past it was Honda who had been against halting engine development. Renault were open to a “reasonable compromise”, added Budkowski, as long as any decision to freeze engine development was taken for the good of the sport and not for Honda or Red Bull. “Let’s find the right thing for the sport, let’s find the right engine formula for the future, and at the right time to introduce it,” he said."
-3.1281567440296025," Nissan to sell redesigned Note compact car in Japan as it looks to restore profitability Tokyo (Reuters) - Nissan Motor Co Ltd on Tuesday said it will sell a redesigned version of its best-selling Note compact car in Japan from December featuring new hybrid drive technology, to win market share from Toyota Motor Corp and Honda Motor Co Ltd. The Note’s first full model change in eight years is part of a plan by the carmaker to revamp an aging vehicle line up and return to profitability as it pulls back from the expansion pursued by former Chairman Carlos Ghosn to focus on sales in Japan, China and the United States. The Note will feature “e-Power” hybrid technology, which uses a gasoline engine to charge a battery that powers the vehicle. New autonomous drive functions will help drivers slow down on curves using data from the car’s navigation system. Nissan, which expects to post a record operating loss of 340 billion yen ($3.25 billion) in the year to March 31, is cutting production capacity and model numbers by a fifth and aims to slash operating expenses by 300 billion yen over three years. At the same time, it has promised to launch a slew of vehicles in Japan, China and the United States, including new electric vehicles to lure increasingly environment-conscious drivers. In Japan, the Note, which uses a platform designed with French alliance partner Renault SA, will compete With Toyota’s Yaris and Honda’s Fit. A Nissan spokeswoman said the automaker has not made any decision on selling the redesigned vehicle in other markets."
4.301829890626583," Honda says will be first to mass produce level 3 autonomous cars TOKYO (Reuters) - Japan’s Honda Motor Co said on Wednesday it will be the world’s first automaker to mass produce sensor-packed level 3 autonomous cars that will allow drivers to let their vehicles navigate congested expressway traffic. “Honda is planning to launch sales of a Honda Legend (luxury sedan) equipped with the newly approved automated driving equipment” before the end of March 2021, Honda said in a press release. The race to build self-driving cars is a key technology battleground for automakers, with technology companies such as Google parent Alphabet Inc also investing billions of dollars in a field expected to boost car sales. Japan’s government earlier in the day awarded a safety certification to Honda’s autonomous “Traffic Jam Pilot” driving technology, which legally allow drivers to take their eyes off the road. “Self driving cars are expected to play a big role in helping reduce traffic accidents, provide transportation for the elderly and improve logistics,” said Japan’s Ministry of Land, Infrastructure, Transport and Tourism. There are six levels of vehicle autonomy, from 0 to 5, ranging from manual cars or those with simple functions such as cruise control to fully self-driving vehicles that would not need steering wheels, or brake and acceleration pedals. Level 2 cars, which are currently on public roads, can control their own speed and steering, but must have an alert driver able to take control at all times. In July, U.S. electric vehicle maker Tesla Inc said it was “very close” to achieving level 5 autonomous driving."
5.63079136246583," Motorocycling-MotoGP champion Marquez to miss rest of season with arm injury Nov 10 (Reuters) - MotoGP world champion Marc Marquez will not return this season as he continues to recover from a broken arm, his Repsol Honda team said on Tuesday. The Spaniard fractured his upper arm in the season-opening Spanish Grand Prix in Jerez in July and had to undergo a second operation after damaging a plate in the arm while opening a window ahead of the second race in Jerez. With only two races left on the 2020 calendar, Honda have decided to complete the season with Marquez’s younger brother Alex and test rider Stefan Bradl. ""Working through his recovery programme and tracking the progress of his arm, Marc Marquez in conjunction with Honda, his team and multiple expert doctors, has elected to officially delay his return to action until 2021,"" Repsol Honda said in a statement here. Six-times MotoGP champion Marquez, who won the world title in each of the last four seasons, will finish the 2020 campaign without a single point on the board. ""It's time to continue with the recovery,"" Marquez said on Twitter here. ""Thanks for the messages of support. Looking forward to returning in 2021."" The penultimate race of the season will be held in Valencia on Sunday, with Suzuki’s Joan Mir holding a 37-point lead at the top of the championship standings. (Reporting by Hardik Vyas in Bengaluru; Editing by Hugh Lawson)"
