0.7012622720897591, BRIEF-Invacare Says Entered Into Unsecured Loan Agreement In Amount Of $10.0 Mln May 21 (Reuters) - Invacare Corp: * INVACARE SAYS ON MAY 15 IT ENTERED INTO UNSECURED LOAN AGREEMENT IN AMOUNT OF $10.0 MILLION - SEC FILING * INVACARE CORP - BOARD OF DIRECTORS DECIDED TO SUSPEND QUARTERLY DIVIDEND Source: (bit.ly/2zV0xz4) Further company coverage:
3.927492447129906, BRIEF-Invacare Reports Q1 Adjusted Loss Per Share $0.21 May 6 (Reuters) - Invacare Corp: * Q1 EARNINGS PER SHARE ESTIMATE $-0.22 -- REFINITIV IBES DATA * Q1 SALES $218.4 MILLION VERSUS REFINITIV IBES ESTIMATE OF $221.7 MILLION * MUST REMAIN FLEXIBLE AS WE NAVIGATE SUPPLY CHAIN ISSUES TO MEET INCREASED DEMAND * INVACARE - REDUCING EXPENSES TO OFFSET DECLINES IN OTHER PARTS OF BUSINESS * INVACARE - ANTICIPATES 2Q20 FINANCIAL RESULTS WILL BE CHALLENGED BY LOWER SALES VOLUMES * INVACARE - CONTINUE TO EVALUATE AND TAKE ACTIONS TO PRESERVE LIQUIDITY * CONTINUES TO SUSPEND ITS FULL YEAR 2020 GUIDANCE Source text for Eikon: Further company coverage:
-6.9930069930069925," BRIEF-Invacare Says Co Taking Steps To Offset Cost Increases From Pandemic-Related Supply Chain Disruptions April 14 (Reuters) - Invacare Corp: * INVACARE CORPORATION PROVIDES BUSINESS UPDATE AND ANNOUNCES PRELIMINARY FINANCIAL RESULTS FOR 1Q20 * INVACARE - FOR Q1 2020, EXPECTS TO REPORT PRELIMINARY NET SALES OF ABOUT $218.0 MILLION, DECREASE OF ROUGHLY 2.2% COMPARED TO PRIOR YEAR * INVACARE CORP - TAKING STEPS TO OFFSET COST INCREASES FROM PANDEMIC-RELATED SUPPLY CHAIN DISRUPTIONS * INVACARE CORP - IN MEDIUM-TERM, STILL EXPECT TO EXECUTE ON PREVIOUSLY PLANNED STEPS IN OUR TRANSFORMATION * INVACARE CORP - SUBSEQUENT TO Q1 2020, CO BORROWED AN ADDITIONAL $8.5 MILLION UNDER ITS EUROPEAN CREDIT FACILITY Source text for Eikon: Further company coverage:"
47.84990829520371," BRIEF-Invacare Corp - Demand For Respiratory Products & Long-Term Care Beds Has Increased Dramatically Worldwide March 23 (Reuters) - Invacare Corp: * INVACARE CORP - DEMAND FOR RESPIRATORY PRODUCTS & LONG-TERM CARE BEDS HAS INCREASED DRAMATICALLY WORLDWIDE * INVACARE CORP - EXPERIENCED REDUCTION IN MOMENTUM OF MOBILITY & SEATING PRODUCT LINE OVER PAST FEW WEEKS * INVACARE CORP - IN LIGHT OF COVID-19, SUSPENDING FISCAL 2020 GUIDANCE PROVIDED ON FEBRUARY 10, 2020 * INVACARE - EXPECT CASH BALANCES ON HAND, PLUS FORECASTED OPERATING RESULTS, TO PROVIDE SUFFICIENT LIQUIDITY TO MANAGE BUSINESS DURING COVID-19 UNCERTAINTY Source text for Eikon: Further company coverage:"
15.649404405567315," BRIEF-Invacare Corp To Sell Its Dynamic Controls Business To Allied Motion Technologies March 9 (Reuters) - Allied Motion Technologies Inc: * INVACARE CORPORATION ANNOUNCES SALE OF ITS DYNAMIC CONTROLS BUSINESS TO ALLIED MOTION TECHNOLOGIES, INC. * INVACARE CORP - AS PART OF DEAL, INVACARE HAS ENTERED INTO A LONG-TERM PRODUCT SUPPLY AGREEMENT WITH DYNAMIC CONTROLS * INVACARE CORP - TRANSACTION WAS COMPLETED ON MARCH 7, 2020 Source text for Eikon: Further company coverage:"
-36.247092558938874," BRIEF-Invacare Posts Q4 Loss Per Share Of $0.56 Feb 10 (Reuters) - Invacare Corp: * ORATION ANNOUNCES FINANCIAL RESULTS FOR THE FOURTH QUARTER AND FULL YEAR ENDED DECEMBER 31, 2019 * Q4 EARNINGS PER SHARE ESTIMATE $-0.13 -- REFINITIV IBES DATA * SEES 2020 FREE CASH FLOW GENERATION OF AT LEAST $5 MILLION * QTRLY REPORTED NET SALES DECREASED 4.8% TO $232.9 MILLION Source text for Eikon: Further company coverage:"
-7.807281116026672," BRIEF-Invacare Corp Expands Board Size To Eight Members May 18 (Reuters) - Invacare Corp: * INVACARE CORP - ON MAY 17, BOARD EXPANDED BOARD SIZE TO EIGHT MEMBERS AND ELECTED PETRA DANIELSOHN-WEIL AS A DIRECTOR - SEC FILING Source text: (bit.ly/2rSA7Hj) Further company coverage:"
-4.798319195031365, BRIEF-Invacare Reports Q1 Adjusted Loss Per Share $0.35 May 7 (Reuters) - Invacare Corp: * Q1 EARNINGS PER SHARE VIEW $-0.38 -- THOMSON REUTERS I/B/E/S * Q1 SALES $237.1 MILLION VERSUS I/B/E/S VIEW $233.6 MILLION * COMPANY ANTICIPATES ITS CASH FLOW USAGE FOR 2018 WILL BE SIMILAR TO CASH USED IN 2017 Source text for Eikon: Further company coverage:
