6.716417910447764," Macy's, Hudson's Bay to temporarily close U.S. stores due to virus outbreak (Reuters) - Department store operators Macy's Inc M.N and Hudson's Bay decided on Tuesday to temporarily close all its stores in the United States due to the coronavirus pandemic, but said their e-commerce sites would continue to operate. Peer Nordstrom Inc JWN.N had on Monday decided to close its shops in the United States and Canada after pulling its fiscal 2020 forecast. Hudson’s Bay said its stores would be closed for two weeks, but customers can avail its curbside pickup facility to collect merchandise ordered online. Macy's, along with Saks Fifth Avenue and Gap Inc's GPS.N Banana Republic, had last week informed shoppers they were open for business, in a move to stem losses due to a steep decline in store traffic. The fast-spreading virus, which has killed about a hundred and infected over 4,000 in the United States, has been a big headache for retailers who are already struggling with falling sales due to stiff competition and a shift to online shopping. Shoemaker Cole Haan, which has abandoned its IPO plan due to the outbreak, is also closing a number of its U.S. retail stores in areas that have been most impacted by the health crisis. It expects to reopen them on or before March 31."
6.716417910447764," Macy's to temporarily close all stores due to virus outbreak March 17 (Reuters) - Macy’s Inc on Tuesday joined Nordstrom Inc to temporarily close all of its stores in the United States, due to the coronavirus pandemic. Nordstrom said on Monday it would temporarily shut its stores in the U.S. and Canada and withdrew its fiscal 2020 forecast. Macy’s, which owns over 800 stores, said it would continue to operate its e-commerce sites. Macy’s, along with Saks Fifth Avenue and Gap Inc’s Banana Republic, last week sent notices to shoppers that they were open for business in a move to stem losses due to a steep decline in traffic. The fast-spreading virus, which has killed about a hundred and infected over 4,000 in the United States, has been a big headache for retailers who are already struggling with falling sales due to stiff competition and a shift to online shopping. (Reporting by Nivedita Balu in Bengaluru; Editing by Shounak Dasgupta)"
6.716417910447764," BRIEF-Macy’s Temporarily Closes Stores Nationwide In Response To Covid-19 Outbreak March 17 (Reuters) - Macy’s Inc: * MACY’S, INC. TEMPORARILY CLOSES STORES NATIONWIDE IN RESPONSE TO COVID-19 OUTBREAK * MACY’S INC - WILL PROVIDE BENEFITS AND COMPENSATION TO ITS IMPACTED WORKFORCE * MACY’S - WILL TEMPORARILY CLOSE ALL STORES BY END OF BUSINESS TODAY, MARCH 17, 2020, THROUGH MARCH 31, 2020 * MACY’S - MACY’S, BLOOMINGDALE’S & BLUEMERCURY WILL CONTINUE TO SERVE CUSTOMERS THROUGH MACYS.COM, BLOOMINGDALES.COM & BLUEMERCURY.COM & MOBILE APPS Source text for Eikon: Further company coverage:"
-46.23330447670323," BRIEF-Medexus Expands Its US Product Portfolio By Acquiring The Hematology Asset Ixinity Feb 28 (Reuters) - Medexus Pharmaceuticals Inc: * MEDEXUS EXPANDS ITS US PRODUCT PORTFOLIO BY ACQUIRING THE HEMATOLOGY ASSET IXINITY® * MEDEXUS PHARMACEUTICALS INC - ANNOUNCES US$20 MILLION CREDIT FACILITY WITH MIDCAP FINANCIAL * MEDEXUS PHARMACEUTICALS INC - ACQUISITION EXPECTED TO BE IMMEDIATELY ACCRETIVE TO ADJUSTED EBITDA * MEDEXUS PHARMACEUTICALS INC - DEAL FOR UP-FRONT CASH CONSIDERATION OF APPROXIMATELY US$30 MILLION * MEDEXUS PHARMACEUTICALS - DEAL FINANCED ENTIRELY WITH EXISTING CASH, NEW US$20 MILLION TERM LOAN CREDIT FACILITY WITH MIDCAP FINANCIAL Source text for Eikon: Further company coverage:"
-55.9866125114153," Macy's holiday quarter beats Street, investors skeptical on strategy (Reuters) - Macy's Inc M.N holiday-quarter results beat analyst expectations on Tuesday, but investor skepticism around its cost-cutting strategy at a time of intense online competition sent shares down nearly 5%. Earlier this month, Macy’s said it would close 125 stores, including those based in “lower tier” shopping malls, and explore new off-mall formats in order to trim costs and boost growth. The Cincinnati, Ohio-based retailer, along with other department store chains, has grappled with retaining existing shoppers and attracting new ones as consumers increasingly turn to online giants like Amazon.com Inc AMZN.O and discount retailers like TJX Cos Inc's TJX.N Marshalls and T.J. Maxx chains. “The challenge with Macy’s is that it is in the struggling department store sector and many of its locations just aren’t good,” Sucharita Kodali, retail analyst at Forrester Research, said. “But hopefully with more drop-shipping in digital, more stores-in-stores, more private label, better supply chain - that may collectively help to reverse their revenue decline,” she said. Shares of the company were down 4.5% at $14.75 in afternoon trading. To prop up profits and foot traffic, the 161-year-old retailer has also invested heavily in its off-price “Backstage” business and experimented with resale and rental offerings. Some analysts were not optimistic about the cost-cutting efforts. Retail research firm GlobalData Retail’s managing director Neil Saunders said there would be disruptions and higher expenses, and questions remained over how initiatives such as store closures and new formats would bring in gains. There could be other headwinds as well, officials said. Macy’s has seen slower sales at tourist-based stores due to the coronavirus outbreak that began in China, and anticipates a small impact on first-quarter sales from a dent in international tourism, executives told investors on a conference call. The company, which operates roughly 70 stores with a strong Asian customer base, is working with vendor partners to minimize disruption, the executives said. Fine jewelry, dresses and fragrances performed well during the reported quarter, the retailer said, while demand for fashion watches and small household items was weak. Macy’s reported a small decline in holiday same-store sales in January, surprising investors who were bracing for a sharper drop after a profit warning citing weak international tourism and sluggish mall traffic. “We had a solid holiday season,” though the entire year did not play out as intended, Chief Executive Officer Jeff Gennette said on a post-earnings conference call. Excluding one-time items, the company earned $2.12 per share, beating the average estimate of $1.96. Net sales fell 1.4% to $8.34 billion, but were a touch above analysts’ estimate of $8.32 billion. Comparable sales at Macy’s owned and licensed stores fell 0.5% in the fourth quarter ended Feb. 1, compared with the 0.93% fall estimated by analysts, according to IBES data from Refinitiv. Net income attributable to the company fell to $340 million, or $1.09 per share, from $740 million, or $2.37 per share, a year earlier. The company reaffirmed its full-year forecast on Tuesday."
-55.9866125114153," CORRECTED-UPDATE 1-Macy’s quarterly profit, sales beat estimates on holiday lift (Corrects Q4 sales change percentage, paragraph 9) Feb 25 (Reuters) - Department store chain Macy’s Inc on Tuesday reported quarterly comparable sales and profit that beat Wall Street estimates with the help of an uptick in holiday sales, sending shares up 4% before the bell. The U.S. retailer reported a small decline in holiday same-store sales in January, surprising investors who were bracing for a sharper drop after a profit warning citing o weak international tourism and sluggish mall traffic. “We executed well during the Holiday 2019 season,” Chief Executive Officer Jeff Gennette said in a statement. “We were pleased with the significant trend improvement in the fourth quarter, including a meaningful sales uptick in the 10 shopping days before Christmas.” The entire year, however, did not play out as intended, Gennette added. Earlier this month, Macy’s said it would close 125 stores, including those based in shopping malls, and explore new off-mall formats as a part of its strategy to cut costs and boost growth. The retailer also cut jobs and is closing several offices. Excluding one-time items, the company earned $2.12 per share, beating the average estimate of $1.96. Net sales fell 1.4% to $8.34 billion, but was a touch above analysts’ estimate of $8.32 billion. Comparable sales at Macy’s owned and licensed stores fell 0.5% in the fourth quarter ended Feb. 1, compared with the 0.93% fall estimated by analysts, according to IBES data from Refinitiv. Net income attributable to the company fell to $340 million, or $1.09 per share, from $740 million, or $2.37 per share, a year earlier. (Reportng by Nivedita Balu in Bengaluru; editing by Tomasz Janowski)"
-55.9866125114153," CORRECTED-Macy's holiday-quarter comparable sales beats forecasts, shares jump (Corrects comp sales for Q4 figure) Feb 25 (Reuters) - Department store chain Macy’s Inc on Tuesday reported quarterly comparable sales that beat Wall Street estimates with the help of a smaller-than-feared decline in holiday sales. Macy’s shares rose 7% in pre-market trade. Comparable sales at Macy’s owned and licensed stores fell 0.5% in the fourth quarter ended Feb. 1, compared with the 0.93% drop estimated by analysts, according to IBES data from Refinitiv. Net income attributable to the company fell to $340 million, or $1.09 per share, from $740 million, or $2.37 per share, a year earlier. (Reporting by Nivedita Balu in Bengaluru Editing by Tomasz Janowski and Alexander Smith)"
-64.87341565008582," Ratings agency S&P cuts Macy's credit rating to 'junk' Feb 18 (Reuters) - S&P Global Ratings cut Macy’s Inc’s credit rating to “junk” on Tuesday, citing considerable execution risks in the company’s new plan to revive its business, sending its shares down as much as 4.7%. The department-store operator said earlier this month that it would shut 125 stores and cut more than 2,000 jobs, aiming to save $1.5 billion annually by 2022 under the plan. The ratings agency said Macy’s improvement trajectory is weaker than its prior expectations and that the company’s operating performance would deteriorate over the next several quarters, with declines in comparable same-store sales. S&P lowered its long-term rating on the company to ""BB+"" from ""BBB-"", but kept its outlook at stable. (bit.ly/2HMvqGF) BB level, or “junk”, rating for companies is seen as having higher risk to lenders. (Reporting by Ashwini Raj in Bengaluru; Editing by Krishna Chandra Eluri)"
-66.67504743905012," Macy's to close 125 stores, cut more than 2,000 jobs (Reuters) - Macy's Inc M.N said on Tuesday it plans to close 125 of its least productive stores over the next three years to tackle slowing mall traffic and will slash more than 2,000 corporate jobs as a part of a cost-savings effort. The Cincinnati, Ohio-based company operated 867 stores according to a regulatory filing a year ago. It had 130,000 total employees at the time. Macy’s said it would close stores in “lower tier” malls, and explore new off-mall formats, as it looks to tackle plummeting mall traffic in the United States. The 161-year-old department store chain has been grappling with retaining existing shoppers and attracting new ones as consumers opt for online shopping. Since 2015, it has closed more than 100 stores and cut thousands of jobs. “We will focus our resources on the healthy parts of our business, directly address the unhealthy parts of the business and explore new revenue streams,” Chief Executive Officer Jeff Gennette said in a statement. The 125 stores targeted for closure currently account for about $1.4 billion in annual sales, the company said. Annual revenue was $24.97 billion in fiscal 2019. The largest U.S. department store operator also said it expects annual gross cost savings of $1.5 billion by 2022, with $600 million expected in 2020. It forecast full-year net sales of between $23.6 billion and $23.9 billion, below analysts’ average estimate of $24.36 billion, according to IBES data from Refinitiv. “We think the pace of closures across three years is modest compared to years past,” said CFRA analyst Camilla Yanushevsky. Shares of the company were trading roughly flat after market close on Tuesday. The company will host its investor day on Wednesday."
-66.67504743905012," Macy's to close 125 department stores in next three years Feb 4 (Reuters) - Macy’s Inc said on Tuesday it plans to close 125 of its least productive stores over the next three years, including about 30 stores that are already in the process of closing. The 125 stores currently account for about $1.4 billion in annual sales, the company said."
-65.4181347416496," Macy's holiday season sales fall less than feared, to close 29 stores (Reuters) - Macy's Inc M.N reported a small decline in holiday same-store sales on Wednesday, surprising investors who were bracing for a sharper drop following an earlier profit warning. The company, which cut its annual profit forecast in November blaming weak international tourism and sluggish mall traffic, reported a 0.6% decline in holiday sales during November and December. Macy’s is among the first major corporate names to report sales for the holiday season, which is seen as a barometer for the health of U.S. consumer spending. The retailer also plans to shutter 28 Macy’s locations and one Bloomingdale’s store in the coming weeks, a Macy’s spokeswoman said. She said the closures were part of a routine review of the company’s store portfolio. Macy’s operates about 860 stores in the United States. For the full quarter, analysts were expecting a 1.8% decline in same-store sales, according to IBES data from Refinitiv. “It’s bit of a relief for investors, as they were concerned sales were going to be down more than that,” Ken Perkins, founder of research firm Retail Metrics told Reuters. Given the traffic at stores did not look particularly great during the holidays, the sales number looks good, Perkins said. He cautioned, however, that heavy discounting during the season could dent the company’s margins. Chief Executive Officer Jeff Gennette said Macy’s holiday sales benefited from online purchases and demand for gift products, as well as a complete revamp of about 150 stores with fresh interiors and better merchandise. U.S. consumers are increasingly spending more money online rather than queuing up at physical stores during the holiday season, forcing traditional brick-and-mortar retailers to invest in more shopping and delivery options. U.S. e-commerce sales in the period from Nov. 1 through Christmas Eve rose 18.8%, according to a Dec. 25 report by Mastercard Inc MA.N, while overall holiday retail sales, excluding autos, rose just 3.4%. Consumer spending in the country is benefiting from wage growth and the lowest unemployment rate in nearly half a century. Shares of the company, which rose as much as 5%, were marginally up at $17.78."
-65.4181347416496," REFILE-Macy's allays holiday season sales worries, shares rise 5% (Corrects day in paragraph one) Jan 8 (Reuters) - Macy’s Inc reported just a 0.6% drop in holiday period same-store sales on Wednesday, quelling fears of a more dramatic fall in the department store operator’s numbers for the crucial annual shopping season after an earlier profit warning. The company benefited from strong online sales and demand for gifting assortments, Macy’s Chief Executive Officer Jeff Gennette said. The reported drop was for the months of November and December. Macy’s shares rose nearly 5% in premarket trading."
-11.511809692968395," Balloons cleared to fly in iconic NYC Thanksgiving Day parade (Reuters) - Thanksgiving Day in New York City started with something many New Yorkers and visitors will be grateful for: the giant balloons in the annual Macy’s Thanksgiving Day parade were given the all clear to fly after fears strong winds could ground them. “Good News, New York City: the winds are holding and the #MacysThanksgivingDayParade balloons will FLY!,” New York City Mayor Bill de Blasio said in a tweet early on Thursday. Concerns had been mounting earlier in the week over a forecast of strong winds on Thanksgiving Day. City regulations that were put in place after a Cat in the Hat balloon knocked down a lamp post in 1997, injuring four spectators, say the inflatable characters must be kept out of the sky sustained winds top 23 miles per hour (37 km per hour), and gusts exceed 34 mph (54 kph). Many of the massive helium-inflated balloons require up to 90 handlers and can be challenging to maneuver even in calm weather. The giant balloons, including a 49-feet (15-m) tall Snoopy beagle decked out in astronaut gear to commemorate the 50th anniversary of the Moon landing, and numerous floats will parade down Manhattan’s 6th Avenue during the iconic celebration that began in the 1920s. Thousands of onlookers lined the city streets to watch the 93rd parade with its marching bands, clowns and performances expected to attract millions of viewers across the country. In Philadelphia, local media reported early Thursday morning that high winds had forced authorities to ground balloons for the city’s Thanksgiving Day parade."
-11.511809692968395," CORRECTED-Balloons cleared to fly in iconic NYC Thanksgiving Day parade (Corrects parade route from 5th to 6th Avenue in paragraph 5) Nov 28 (Reuters) - Thanksgiving Day in New York City started with something many New Yorkers and visitors will be grateful for: the giant balloons in the annual Macy’s Thanksgiving Day parade were given the all clear to fly after fears strong winds could ground them. “Good News, New York City: the winds are holding and the #MacysThanksgivingDayParade balloons will FLY!,” New York City Mayor Bill de Blasio said in a tweet early on Thursday. Concerns had been mounting earlier in the week over a forecast of strong winds on Thanksgiving Day. City regulations that were put in place after a Cat in the Hat balloon knocked down a lamp post in 1997, injuring four spectators, say the inflatable characters must be kept out of the sky sustained winds top 23 miles per hour (37 km per hour), and gusts exceed 34 mph (54 kph). The giant balloons, including a 49-feet (15-m) tall Snoopy beagle decked out in astronaut gear to commemorate the 50th anniversary of the Moon landing, and numerous floats will parade down Manhattan’s 6th Avenue during the iconic celebration. The parade, a tradition that began in the 1920s, with its marching bands, clowns and performances is expected to draw large crowds in New York City and millions of viewers across the country. (Reporting by Maria Caspani, Editing by Marguerita Choy)"
13.363333609766537," Macy's cuts profit outlook as tourist numbers drop (Reuters) - Macy's Inc M.N cut its annual profit forecast for the second time this year on Thursday, as the department store operator blamed weak international tourism, warm weather and sluggish mall traffic for the first drop in same-store sales in two years. Shares fell nearly 2% in afternoon trading. The company was the second major U.S. department store, after Kohl's Corp KSS.N, to cut its earnings outlook ahead of the critical holiday sales season. “The sales deceleration was steeper than we expected,” Chief Executive Jeff Gennette said in a statement. But he told investors Macy’s was positioned for a strong holiday season, citing an expanded assortment of gifts, improved customer service and more flexible pickup or delivery options. Department stores and apparel retailers are struggling to lure shoppers to malls and away from big-box budget retailers like Target Corp TGT.N and Walmart Inc WMT.N, or online sellers like Amazon.com Inc AMZN.O. Target on Wednesday posted another set of strong sales numbers and raised its full-year forecast. Comparable sales at Macy’s owned and licensed stores fell 3.5% in the third quarter ended Nov. 2, as warm weather hurt demand for coats and sweaters. Analysts had expected a 1% decrease, according to IBES data from Refinitiv. A drop in international tourists, some of Macy’s biggest spenders, also hit sales, the 161-year-old, Cincinnati-based retailer, said. Tourist arrivals to the United States have taken a hit in the past year, hurt by a stronger dollar, weaker pound, and escalating trade tensions between Washington and Beijing, denting the number of international visitors to the country. Tourism was down 6.3% in the quarter, following on from a 4% fall the previous year, Macy’s said. The company also said it had experienced some issues with its website “in preparation for the fourth quarter.” Some analysts are skeptical about Macy’s and other department stores’ prospects for the holiday season, a period that can be make-or-break for retailers. Thanksgiving, the traditional kickoff of the U.S. holiday shopping period, falls on Nov. 28 this year, a week later than last year’s Nov. 22, leaving retailers with six fewer days to make sales between Thanksgiving and Christmas Day. “We expect a very competitive and difficult holiday quarter for the department store segment,” said research firm Retail Metrics founder Ken Perkins, citing expected steep promotions and discounts. Many of the top gift ideas are electronics including TVs and laptops, which Macy’s does not sell, Perkins added. Macy’s does sell some smaller electronics, such as smart watches, Bluetooth speakers, and headphones, however. The largest U.S. department store operator is also hoping a recent revamp will lure in holiday shoppers. It has closed more than 100 stores since 2015 and cut thousands of jobs as mall traffic plummeted, but has completed a revamp of about 150 stores with refreshed interiors. It has also expanded discounted “Backstage” departments into more stores. It has also upgraded its website and worked to clear excess inventory, said Gennette. Mattresses, fragrances, dresses, and fine jewelry performed well during the reported quarter, the retailer said, while men’s and women’s sportswear, handbags, housewares, and furniture performed poorly. Macy’s now expects 2019 adjusted profit of between $2.57 per share and $2.77 per share, compared with its previous forecast of between $2.85 and $3.05. It also projected full-year total comparable sales to fall between 1% and 1.5%, compared with a previous forecast of up to a 1% rise. Adjusted net income attributable to Macy’s shareholders fell to $21 million, or 7 cents per share, in the quarter, from $83 million, or 27 cents per share, a year earlier. Analysts had expected the company to break-even on a per share basis. Rival Nordstrom Inc JWN.N is set to report quarterly results later on Thursday."
13.363333609766537," Macy's posts bigger-than-expected drop in same-store sales, cuts outlook Nov 21 (Reuters) - Macy’s Inc reported a bigger-than-expected fall in quarterly same-store sales and cut its full-year profit forecast on Thursday, blaming weak international tourism and sluggish mall traffic. Shares of the department store operator slipped 4% in premarket trading. Comparable sales at Macy’s owned and licensed stores fell 3.5% in the third quarter ended Nov. 2, bigger than the 1% decrease analysts had expected, according to IBES data from Refinitiv. The company now expects 2019 adjusted profit of between $2.57 per share and $2.77 per share, compared with its previous forecast of between $2.85 and $3.05. (Reporting by Uday Sampath in Bengaluru; Editing by Sriraj Kalluvila)"
0.8300716956169786," Macy's sees savings of up to $550 million from targeted promotions, better pricing (Reuters) - Macy's Inc M.N said on Thursday it aimed to save $400 million to $550 million annually in the next two to four years, as the department store chain cuts back on discounts, sending its shares up 5% in mid-day trading. The 160-year-old company, which has been spending heavily on remodeling its stores and building off-price and online businesses, has relied on discounting to clear inventory, a move that has hurt its earnings. Speaking at a retail conference hosted by Goldman Sachs, Chief Financial Officer Paula Price said some of the savings will be supported by better prices as the retailer moves towards targeted promotions for customers. “We know that some of our customers respond particularly well to coupons while others do not. And so using data and customer analytics, we can become more precise on who we target with promotions and what offers we provide,” Price said. Macy’s, the largest U.S. department store chain, has closed more than 100 stores and cut thousands of jobs as mall traffic falls amid a shift in customer preference to shop online. The company said it is also testing self checkout in stores and rolling out new modernized handheld devices for staff to improve efficiency. The retailer also said it expects to drive about $100 million in additional working capital improvements. Earlier this year, Macy’s said it would cut 100 senior management positions to reduce costs and improve profitability."
0.8300716956169786," Macy's aims to save up to $550 mln in 2-4 years, shares rise Sept 5 (Reuters) - Macy’s Inc said on Thursday it aimed to save $400 million to $550 million annually in the next two to four years, as the department store chain cuts back on discounts, while focusing more on targeted promotions for customers. Shares of the company rose 4% in early trading. (Reporting by Nivedita Balu in Bengaluru; Editing by Anil D’Silva)"
