16.573556797020476," Macy's to be 'smaller company' as loss to hit $1 billion in quarter amid lockdowns (Reuters) - Macy's Inc M.N said on Thursday it could rack up operating losses of up to $1.11 billion in the first quarter, as the department store operator was forced to shut stores due to lockdowns aimed at curbing the spread of the new coronavirus. “We anticipate that our sales recovery will be gradual and that for a period of time, we will be a smaller company,” Chief Executive Jeff Gennette said on a call with investors. Shares were up nearly 3% at $5.22 in morning trading. The global health crisis has forced brick-and-mortar retailers to tap credit lines, lay off employees and suspend dividends and buybacks in a bid to stay afloat amid store closures. Just this month, several retailers, including J Crew, J.C. Penney and Neiman Marcus Group, filed for bankruptcy after failing to cope with market uncertainties and mounting debt. Macy's, which shut all of its 775 stores on March 18, hired investment bank Lazard Ltd LAZ.N to explore options for bolstering its finances, Reuters reported last month. While online sales have helped, they weren’t enough to offset losses relating to store closures, and from suits to dresses, apparel sales have been “soft,” Gennette said. However, fine jewelry, kids and home were categories that performed better than others during the pandemic, he said. Macy’s will continue to monitor consumer behavior and expand its packaged food offerings and more, he said. The largest U.S. department store operator by sales, Macy’s expects an operating loss of between $905 million and $1.11 billion in the first quarter, and sales of $3 billion to $3.03 billion, down from $5.50 billion a year earlier. The loss excludes estimated pretax non-cash goodwill and asset impairment charges for the quarter. The 161-year-old retailer started reopening stores on a state-by-state basis on May 4. As of this week, about 190 stores of Macy’s and Bloomingdale’s, a chain that belongs to Macy’s, had reopened. Macy’s expects most stores to reopen by late June, including its flagship Herald Square store, which stretches over an entire block in the heart of Manhattan in New York City. The company expects to report more details on its preliminary first-quarter performance on June 9 and release its earnings for the period on July 1."
16.573556797020476," Macy's forecasts $1 billion quarterly loss due to lockdowns May 21 (Reuters) - Macy’s Inc forecast a quarterly operating loss of up to $1.11 billion on Thursday, as the retailer was forced to shut stores due to lockdowns implemented to curb the spread of the coronavirus. The department store chain said it expects to post an operating loss of between $905 million and $1.11 billion. It also forecast first-quarter sales in the range of $3 billion to $3.03 billion, down from $5.50 billion a year earlier. Macy’s had earlier this month said it would report its first-quarter earnings on July 1 as significant business disruptions due to the pandemic had led to delays in preparing its financial statement. (Reporting by Aishwarya Venugopal in Bengaluru; Editing by Arun Koyyur)"
30.314960629921263," Macy's delays first-quarter results to July 1, citing COVID-19 disruption (Reuters) - Department store chain Macy's Inc M.N on Thursday delayed its first-quarter earnings report to July 1, citing significant business disruption due to the COVID-19 pandemic, which has also led to delay in financial statement preparation. Last year, it reported bit.ly/3b8jcEk results on May 15 and in 2018 on May 16. “These are unprecedented times for the country, the retail landscape and Macy’s,” Chief Executive Officer Jeff Gennette said. Macy’s, like many retailers, has had to close its stores, furlough employees, suspend dividend and tap into credit facilities to survive the financial hit caused by the lockdowns. The company said it would release preliminary sales results on May 21, followed by a discussion involving CEO Gennette and J.P. Morgan analyst Matt Boss. It would report some preliminary first quarter financial results in June."
6.143344709897601," Macy's reopening 68 stores, targets all within six weeks as U.S. curbs loosen NEW YORK (Reuters) - Macy’s Inc plans to reopen 68 U.S. stores on Monday in states that have loosened coronavirus lockdowns, the department store operator said on Thursday, as more retailers sought to get business going after a crushing month of closures. Cincinnati, Ohio-based Macy’s, the largest U.S. department store operator by sales, said it expects to have all of its roughly 775 stores reopened in six weeks, if infection rates taper off as projected and state and local governments allow it. The next batch of roughly 50 stores is scheduled to reopen on May 11, it said. At this time, the company is not naming which store locations will reopen, a spokeswoman said. All of its stores have been closed since March 18. However, the shopping experience will be greatly changed, as many shoppers remain wary about the virus. For instance, the number of fitting rooms offered to shoppers at one time will be reduced and sanitized frequently. Plexiglas will be at each cash register, signs will alert shoppers to keep 6 feet apart, beauty consultations will be “no-touch” only, and more. The reopened stores will operate on reduced hours from 11 a.m. to 7 p.m. Shares of Macy’s, which also owns the Bloomingdale’s and Bluemercury chains, were down roughly 6.5% in afternoon trading. Earlier this month, Reuters reported that Macy’s hired investment bank Lazard Ltd to explore options for bolstering its finances after the department store operator lost most of its revenue because of its decision to shut down all its stores amid the outbreak, people familiar with the matter said. The reopening plan, first reported by the Wall Street Journal, follows moves by other major retailers judged “non-essential” in the crisis to get business at their physical stores going again, albeit slowly and with restrictions in place. Simon Property Group Inc, America’s biggest mall operator, expects to open 49 properties starting Friday based on current state and/or local stay-at-home or closure orders. The majority of reopenings are expected in the South, where restrictions have loosened up the most thus far in the United States. Coach handbag maker Tapestry Inc also said on Thursday it would start reopening some stores in North America, as it tries to recover from the damage to its sales caused by the lockdowns. “Keeping stores closed isn’t helping the retailers or malls. ... They don’t have cash to last too much longer,” Sucharita Kodali, retail analyst at Forrester Research, said of retailers starting to reopen stores for business. “Opening them may help to salvage some sales especially so long as they can generate more revenue than their labor costs.” The most cash-constrained will likely reopen soon, Kodali added, while others “may have the luxury to hold out longer.”"
6.143344709897601," Macy's reopens stores, targets all within six weeks -WSJ April 30 (Reuters) - Macy’s Inc plans to reopen 68 stores on Monday in U.S. states that have loosened coronavirus lockdowns, the Wall Street Journal reported on Thursday, as more retailers sought to get business going after a crushing month of closures. The newspaper reported Macy’s Chief Executive Jeff Gennette as saying in an interview that he expected to have all of the company’s roughly 775 stores reopened in six weeks, if infection rates taper off as projected and state and local governments allow it. The next batch of roughly 50 stores is scheduled to reopen May 11, it said. The report follows moves by other major retailers judged “non-essential” in the crisis to get business at their physical stores going again, albeit slowly and with restrictions in place. Coach handbag maker Tapestry Inc also said on Thursday it would start reopening some stores in North America, as it tries to recover from the sales damage caused by the lockdowns. Macy’s did not immediately respond to Reuters request for comment. (Reporting by Patrick Graham and Saumya Sibi Joseph; Editing by Saumyadeb Chakrabarty)"
34.02489626556016," Macy’s taps Bank of America for US$5bn in debt to support operations NEW YORK, April 22 (LPC) - Department store chain Macy’s is looking to raise up to US$5bn in debt financing, two sources familiar with the discussions told Refinitiv LPC on Wednesday. Bank of America is leading the transaction. The financing package could comprise cash flow and asset-based components including debt secured by real estate assets, the two sources said. CNBC first reported the debt financing on Tuesday. The new financing may also encompass a refinancing of Macy’s existing debt, one of the sources said. The move comes as retailers have been forced to shutter their stores on government orders as consumers remain indoors and avoid large public gatherings to limit the spread of the coronavirus. All of Macy’s stores, including the Bloomingdales, and Bluemercury brands, have been closed since March 18, according to a company press release. Though the retailer has lost the majority of its sales due to the closures, it said the stores will remain shuttered until it is safe to reopen. Measures the company has taken to maintain financial flexibility include suspending its dividend, drawing down on its US$1.5bn revolving credit, freezing both hiring and spending, and putting the majority of its employees on furlough. The company said it is evaluating financing options, the release states. Macy’s hired financial advisory firm Lazard and law firm Kirkland & Ellis earlier this month to explore options that could include new financing, Reuters reported on April 11. Last month the company announced plans to draw down the entire US$1.5bn from its revolving credit facility to preserve financial flexibility in light of the coronavirus spread. A Bank of America spokesperson declined to comment. A spokesperson for Macy’s did not immediately respond to a request for comment. (Reporting by Sasha Padbidri and Michelle Sierra. Editing by Kristen Hauss and Aaron Weinman.)"
34.02489626556016, BRIEF-Macy's Weighs Raising As Much As $5 Bln In Debt To Weather Coronavirus Crisis - CNBC April 21 (Reuters) - * MACY’S WEIGHS RAISING AS MUCH AS $5 BILLION IN DEBT TO WEATHER CORONAVIRUS CRISIS - CNBC * MACY'S WILL SEEK TO USE ITS INVENTORY AS COLLATERAL TO RAISE $3 BILLION AND REAL ESTATE TO RAISE $1 BILLION TO $2 BILLION - CNBC Source text : cnb.cx/2XTOls8 Further company coverage:
6.655844155844158," Exclusive: Macy's taps Lazard to bolster finances as coronavirus saps sales - sources NEW YORK (Reuters) - Macy's Inc M.N has hired investment bank Lazard Ltd LAZ.N to explore options for bolstering its finances after the department store operator lost most of its revenue as it shut down all its stores as a result of the coronavirus outbreak, people familiar with the matter said. The move by Macy’s, the largest U.S. department store operator by sales, is a sign of the severity of the crisis facing brick-and-mortar retailers, which were already struggling with the shift to online shopping. The pandemic has forced store closures and widespread furloughs of employees as state after state issued shelter-in-place orders in efforts to contain the spread of the coronavirus, which causes the COVID-19 respiratory illness. Macy’s has called in Lazard bankers who specialize in finding ways to recapitalize financially troubled companies and rework debts, the sources said. Macy’s has also enlisted debt restructuring lawyers at Kirkland & Ellis LLP, two of the sources said. Macy’s has asked its advisers to help manage its liabilities and explore options that could include new financing, the sources said, adding that no debt restructuring is imminent. The sources asked not to be identified because the deliberations are confidential. A spokeswoman for Macy’s said in a statement that the company is “exploring numerous options to strengthen our capital structure,” adding that it maintains relationships with a range of advisers. The company, which operates the Macy’s and Bloomingdale’s department stores, declined to comment further beyond pointing to previous steps it has taken in response to the pandemic, which include suspending its quarterly dividend, drawing down its credit line, deferring spending, reducing pay at most management levels and furloughing the majority of its roughly 123,000 employees. A Kirkland spokeswoman did not immediately respond to a request for comment. A Lazard spokeswoman declined to comment. The company, which also operates the bluemercury beauty products and spa chain, has $3.6 billion in long-term debt and roughly $7 billion in store lease obligations. It had $685 million in cash as of the end of its most recent fiscal year, and recently drew down another $1.5 billion from a credit line while its stores remained closed. Macy's decision to explore new financing, among other options, makes it the latest U.S. retailer to do so. On Thursday, rival Nordstrom Inc JWN.N raised $600 million by placing real estate assets that included five stores, six distribution centers and its Seattle headquarters in a separate company and borrowing against it by issuing bonds. Macy’s was already in the midst of slashing costs before the coronavirus outbreak, with plans to permanently close 125 stores over the next three years and cut more than 2,000 jobs. Those were in addition to the more than 100 store closures and thousands of job cuts it has rolled out since 2015. The 161-year-old department store operator closed all of its 775 department stores last month in response to the pandemic. That made its e-commerce operations its only source of revenue; e-commerce accounted for about 25% of its roughly $25 billion in sales in the 12 months ending Feb. 1. It is unclear when Macy’s and other department store chains will be able to re-open their stores. Credit ratings firm Fitch Ratings Inc said earlier this month that it expected Macy’s revenue to plunge nearly 25% this year. The New York-based company’s shares have tumbled more than 60% since the start of this year, giving the retailer a market capitalization of roughly $2 billion. Like many companies hit hard by the pandemic, Macy’s has said its chief executive, Jeff Gennette, will forego pay during the crisis. Last week, Macy’s announced that its chief financial officer had decided to step down at the end of May and that it was seeking a replacement. Macy’s became a U.S. household name over the decades, known for its Thanksgiving Day Parade in New York City and its flagship Herald Square store, which stretches over an entire block in the heart of Manhattan. Macy’s has $530 million of debt due in January 2021 and another $450 million at the start of 2022, and likely has enough cash to make those payments, Fitch said. The company’s credit rating was downgraded to junk by two ratings firms in recent weeks, making it more expensive for the retailer to borrow. However, Macy’s junk-rated bonds rallied last week after the Federal Reserve said it would expand its asset-buying program to bonds of companies that had been investment-grade but then were downgraded to junk status. (This story has been refiled to correct headquarters to New York, not Cincinnati in 5th to last paragraph)"
10.998307952622664," Macy's finance chief Paula Price to step down in May (Reuters) - Department store chain operator Macy's Inc M.N said on Tuesday Chief Financial Officer Paula Price would step down from the role next month after nearly two years on the job. The planned exit comes as Macy’s, like other U.S. companies, struggles with the fallout of the coronavirus pandemic that has forced it to furlough almost all of its 130,000 employees and tap its credit-line. Price will continue to be a “critical” part of the plan to emerge out of the pandemic, Chief Executive Officer Jeff Gennette said in a statement on Tuesday. Price will step down from her role as finance head on May 31, but will remain as an adviser through November, the company said, adding that an external search is underway for a replacement. Shares of Macy’s, which have lost nearly two-thirds of their value this year, were up nearly 10% in premarket trading."
10.998307952622664," Macy's finance chief Paula Price to step down in May April 7 (Reuters) - Department store chain operator Macy’s Inc said on Tuesday that Chief Financial Officer Paula Price would step down from the role on May 31. Price, who took charge in July 2018, will remain an adviser through November 2020, the company said in a statement. (Reporting by Aishwarya Venugopal in Bengaluru; Editing by Sriraj Kalluvila)"
40.12219959266802," Macy's to drop from S&P 500 to small-cap index (Reuters) - Macy's Inc M.N will be removed from the benchmark S&P 500 stock index .SPX, the S&P Dow Jones Indices said on Tuesday, as coronavirus-induced store closures compound the retail sector's struggles with a shift to online shopping. The company’s shares have plunged more than 70% so far this year, leaving Macy’s with a market value of $1.52 billion as of Tuesday’s close, according to Refinitiv IBES data. “Macy’s has a market capitalization more representative of the small-cap market space,” S&P said, adding that the company would become part of the S&P small-cap 600 index, effective April 6. The pandemic has forced U.S. brick-and-mortar retailers, including Macy's Inc M.N and Gap Inc GPS.N, to shut stores, furlough employees, withdraw forecasts and suspend dividends. Macy's will be replaced in the S&P 500 by air conditioning company Carrier Global Corp CARR_w.N. Carrier was spun out last month by United Technologies in a bid to shed assets to complete its merger with Raytheon Co RTN.N. That deal is expected to close on April 3. Raytheon will be replaced in the S&P 500 by United Technologies' elevator unit Otis Worldwide Corp OTIS_w.N, according to a statement from the S&P Dow Jones Indices."
28.11918063314711," Macy's, Kohl's, Gap turn to mass furloughs as virus crisis deepens (Reuters) - Major U.S. retailers Macy's Inc M.N, Kohl's Corp KSS.N and Gap Inc GPS.N said on Monday they would furlough tens of thousands of employees, as they prepare to keep stores shut for longer to curb the spread of the coronavirus outbreak. Kohl’s also said it would suspend its share repurchase program, evaluate its dividend plan and draw down $1 billion from an existing credit line, joining a growing list of companies seeking to shore up their cash reserves to weather the financial hit from the health crisis. Macy’s and Gap have suspended their dividends and have also tapped into their credit facilities. Gap said the furloughs will affect its store employees in the United States and Canada. The company had about 129,000 employees at the end of last year. The action will impact a majority of its about 130,000 employees, Macy’s said, while all workers at store and store distribution centers, as well as some corporate office associates will be affected, according to Kohl’s. Shares of Kohl’s, which had about 122,000 employees in 2019, closed down nearly 9%. Macy’s stock ended nearly 3% lower. “Given these extraordinary circumstances, we are taking difficult and decisive actions to strengthen our financial liquidity,” Kohl’s Chief Executive Officer Michelle Gass said in a statement. Gass said she will not take a salary. Widespread lockdowns to arrest the spread of the outbreak in the United States have hammered sales for brick-and-mortar retailers as most stores remain closed, despite their online business staying up and running. President Donald Trump on Sunday extended his stay-at-home guidelines until the end of April, dropping a hotly criticized plan to get the economy up and running by mid-April after a top medical adviser said more than 100,000 Americans could die from the outbreak. The pandemic, which has killed about 34,000 people across the globe, has compounded sales pressure for retailers already facing stiff competition and a shift to online shopping. Kohl’s said furloughed employees would continue to get health benefits. Macy’s specified that employees enrolled in health benefits will continue to receive coverage, at least through May. Macy’s said it would maintain the “absolute minimum” workforce needed to maintain basic operations across its Macy’s, Bloomingdales and Bluemercury brands. The retailer added there would be fewer furloughs in its digital business, supporting distribution centers and call centers, while Kohl’s said it would start buy online and pick up-at-store services later this week."
28.11918063314711," Macy's to furlough most of 130,000 employees as stores stay shut March 30 (Reuters) - Macy’s Inc said on Monday it would furlough most of its 130,000-strong workforce starting this week as all of the company’s stores have been temporarily shut due to the coronavirus pandemic. The department store chain added here that there would be fewer furloughs in its digital business, which is still operational, supporting distribution centers and call centers. Macy’s had about 130,000 employees as of Feb. 2. (Reporting by Aishwarya Venugopal in Bengaluru; Editing by Devika Syamnath)"
28.11918063314711," BRIEF-Macy's Says All Stores Will Remain Closed Until We Have Clear Line Of Sight On When It Is Safe To Reopen March 30 (Reuters) - Macy’s Inc: * MACY’S - ALL OF OUR STORES HAVE BEEN CLOSED SINCE MAR 18 AND WILL REMAIN CLOSED UNTIL WE HAVE CLEAR LINE OF SIGHT ON WHEN IT IS SAFE TO REOPEN * MACY’S - ACROSS MACY’S, BLOOMINGDALES, AND BLUEMERCURY BRANDS, WE WILL BE MOVING TO ABSOLUTE MINIMUM WORKFORCE NEEDED TO MAINTAIN BASIC OPERATIONS * MACY’S - MAJORITY OF OUR COLLEAGUES WILL GO ON FURLOUGH BEGINNING THIS WEEK * MACY’S - AT LEAST THROUGH MAY, FURLOUGHED COLLEAGUES WHO ARE ENROLLED IN HEALTH BENEFITS TO CONTINUE TO GET COVERAGE WITH CO COVERING 100% OF PREMIUM * MACY’S - THERE WILL BE FEWER FURLOUGHS IN OUR DIGITAL BUSINESS * MACY’S - EXPECT TO BRING FURLOUGHED COLLEAGUES BACK ON A STAGGERED BASIS AS BUSINESS RESUMES * MACY'S - WHILE THE DIGITAL BUSINESS REMAINS OPEN, WE HAVE LOST THE MAJORITY OF OUR SALES DUE TO THE STORE CLOSURES Source text: [ID:bit.ly/2ULFBkP] Further company coverage:"
48.64864864864867," Nordstrom joins Macy's in suspending dividend amid coronavirus (Reuters) - Nordstrom Inc JWN.N said on Monday it would suspend its quarterly cash dividend and share repurchases as it looks to weather the impact from the coronavirus pandemic. The upscale department store chain also said it drew down $800 million on its revolving line of credit. Last week, peer Macy's Inc M.N also suspended its quarterly dividend and said it would borrow $1.5 billion from a revolving credit facility. Nordstrom said the dividend suspension would begin in the second quarter. The company also said it is targeting reductions of more than $500 million in expenses, capital expenditures and working capital."
14.285714285714294," Macy's suspends quarterly dividend, withdraws 2020 forecast (Reuters) - Macy's Inc M.N said on Friday it would suspend its quarterly dividend and withdrew its 2020 sales and profit forecasts due to ongoing disruptions from store closures on the back of the fast-spreading coronavirus. The company said it would borrow $1.5 billion from a revolving credit facility to brace the impact from the pandemic. “The retail environment has deteriorated rapidly since we last provided guidance ... we are now operating in an environment with a high degree of uncertainty,” Chief Executive Officer Jeff Gennette said in a statement. The company has already shut stores for two weeks in the United States on March 18, but has kept its online operations open for business. Macy’s had declared a quarterly dividend of 37.75 cents per share, payable on April 1, which will not be affected by the suspension. The company said it is also reviewing all non-essential expenses to lower its 2020 capital expenditure."
14.285714285714294," BRIEF-Macy's Inc - Withdrawing 2020 Sales And Earnings Guidance March 20 (Reuters) - Macy’s Inc: * MACY’S, INC. PROVIDES UPDATE IN RESPONSE TO COVID-19 OUTBREAK * MACY’S INC - REVIEWING ALL NON-ESSENTIAL OPERATING EXPENSES AND REDUCING 2020 CAPITAL EXPENDITURES * MACY’S INC - WITHDRAWING 2020 SALES AND EARNINGS GUIDANCE DUE TO ONGOING DISRUPTION * MACY’S INC - CREDIT AGREEMENT IS SCHEDULED TO EXPIRE ON MAY 9, 2024 Source text for Eikon: Further company coverage:"
14.285714285714294, Macy's suspends quarterly dividend program March 20 (Reuters) - Macy’s Inc on Friday said it would suspend its quarterly dividend program and would access $1.5 billion from a revolving credit facility to brace the impact from the coronavirus pandemic. (Reporting by Nivedita Balu in Bengaluru; Editing by Maju Samuel)
