-1.2407956620922345," Macy's shares sink as discounts to clear inventory hurt, tourism drops (Reuters) - Macy's Inc M.N cut its full-year earnings forecast on Wednesday after missing estimates for quarterly profit for the first time in at least two years, as it discounted merchandise heavily to clear spring inventory, sending its shares down as much as 18%. The largest U.S. department store operator, whose flagship building in Manhattan is a major tourist attraction, blamed a bigger-than-expected decline in tourist spending for the shortfall along with weak demand for its own-brand women’s sportswear and for warm weather apparel. “We had a slow start to the quarter and finished below our expectations,” Chief Executive Jeff Gennette said in a statement. Tourist arrivals to the United States have taken a hit in the past year, hurt by a stronger dollar and escalating trade tensions between Washington and Beijing, denting the number of Chinese visitors to the country. The number of Chinese citizens arriving in the United States dipped 2.8% in the first six months of the year, according to the National Travel and Tourism Office. Like its peers, the Cincinnati, Ohio-based retailer, which has closed more than 100 stores since 2015 and cut thousands of jobs as mall traffic plummeted, faltered in the past few years as it struggled to adjust to a fiercely competitive retail landscape where shoppers buy more goods online at places like Amazon.com Inc AMZN.O. “While they are controlling what they can control, the headwinds from both macro and micro factors continue to grow, creating a challenging backdrop for CEO Jeff Gennette to manage through,” said Gordon Haskett analyst Chuck Grom. “The good news is that they have a plan.” The 160-year-old company is pumping money into projects such as remodeling its stores and building up its off-price and online businesses. Macy’s also announced a partnership with fashion resale marketplace thredUP, aimed at helping the chain “reach a new customer and keep them coming back to shop...,” the company said. Retailers like Macy’s have been burdened by a long-drawn trade war between the United States and China, which U.S. President Donald Trump escalated earlier this month by threatening to impose 10% tariffs on $300 billion worth of Chinese goods from Sept. 1. On Tuesday, the Trump administration delayed the 10% tariffs on some Chinese goods until Dec. 15. Macy’s executives reassured investors on a post-earnings call Wednesday that the company is in “active discussions” with vendors and suppliers to mitigate tariffs and minimize customer impact in 2019 as much as possible. Analysts said the temporary tariff reprieve would likely not benefit retailers greatly. “Only a small percentage of soft-good tariffs are actually getting delayed until December 15th and none have been removed yet,” UBS analyst Jay Sole wrote in a note, adding that, of the approximately 789 apparel and footwear categories on the original latest list of tariffs, only 17% have had tariffs delayed. Gennette said he believed 10% tariffs to be manageable but that it would be harder to maintain pricing if 25% tariffs are imposed on all remaining imports from China, adding “there’s no customer appetite for price increases.” Macy’s now expects 2019 adjusted profit to be between $2.85 per share to $3.05 per share, down from a previous forecast of $3.05 to $3.25. The company’s margins in the quarter fell to 38.8% from 40.4% a year earlier, hit hard by steep markdowns. For the second quarter ended Aug. 3, net income attributable to Macy’s shareholders slumped 48% to $86 million, or 28 cents per share. Analysts on average had expected the company to earn 45 cents per share, according to IBES data from Refinitiv. Net sales fell marginally to $5.55 billion, largely in line with estimates, while sales at its established stores rose 0.3%. Still, Macy’s, whose digital business posted its fortieth consecutive quarter of double-digit growth, maintained its 2019 sales expectations, and said it entered the fall season with the “right inventory.” Macy’s shares, which have declined about 35% this year, opened at a near 10-year low. Shares were down about 15% at $16.50 in afternoon trading Wednesday. The company, which is the first of the department stores to report results, also dragged down peers' shares. Kohl's KSS.N, Nordstrom JWN.N and J.C. Penney JCP.N were down between 8% and 11%."
-1.2407956620922345," Macy's not looking to raise prices if new tariffs imposed: CEO (Reuters) - Macy's Inc M.N Chief Executive Officer Jeff Gennette said on Wednesday that the department store chain would not raise prices on products if the Trump administration goes ahead with its latest 10% tariffs. Shares of retailers, including Macy’s, jumped on Tuesday after the Office of the U.S. Trade Representative announced it is delaying proposed tariffs on clothing, footwear and a number of other items until Dec. 15. Macy’s said it had raised prices in some categories such as luggage, housewares and furniture during the previous rounds of levies. On a post-earnings call Gennette said the previous rounds of tariffs showed that “the customer had very little appetite” for cost increases. Shares of the company slumped 17% on Wednesday after it slashed its full-year earnings forecast and missed quarterly profit expectations by a wide margin."
-1.2407956620922345," Macy's not looking to raise prices if new tariffs imposed - CEO Aug 14 (Reuters) - Macy’s Inc Chief Executive Officer Jeff Gennette said on Wednesday that the department store chain would not raise prices on products if the Trump administration goes ahead with its latest 10% tariffs. Shares of retailers, including Macy’s, jumped on Tuesday after the Office of the U.S. Trade Representative announced it is delaying proposed tariffs on clothing, footwear and a number of other items until Dec. 15. Macy’s said it had raised prices in some categories such as luggage, housewares and furniture during the previous rounds of levies. On a post-earnings call Gennette said the previous rounds of tariffs showed that “the customer had very little appetite” for cost increases. Shares of the company slumped 17% on Wednesday after it slashed its full-year earnings forecast and missed quarterly profit expectations by a wide margin. (Reporting by Aishwarya Venugopal in Bengaluru)"
-1.2407956620922345," Macy's posts 48% drop in profit, cuts full-year forecast Aug 14 (Reuters) - Macy’s Inc reported a 48% fall in quarterly profit and cut its forecast for full-year adjusted earnings on Wednesday, as the department store operator discounted heavily to clear excess inventory, sending its shares down 13%. Net income attributable to Macy’s shareholders fell to $86 million, or 28 cents per share, in the second quarter ended Aug. 3, from $166 million, or 53 cents per share, a year earlier. “We had a slow start to the quarter and finished below our expectations,” Chief Executive Officer Jeff Gennette said. The company now expects 2019 adjusted profit to be between $2.85 per share to $3.05 per share, from a previous guidance of $3.05 to $3.25. (Reporting by Aishwarya Venugopal in Bengaluru; Editing by Sriraj Kalluvila)"
-28.036411384303594," Macy's accused of bias against black, Latino workers with criminal histories Macy’s Inc on Wednesday was hit with a lawsuit claiming it unlawfully refuses to hire or fires workers with criminal records, which has a disproportionate impact on black and Latino people. The Fortune Society, a nonprofit that helps former convicts find jobs, and a former Macy’s call center employee accused the company of violating a slew of federal and New York state laws in a proposed class action filed in federal court in Manhattan. The plaintiffs said Macy’s does not consider the seriousness of the crimes, how long ago they happened or whether they would affect a worker’s ability to perform a job. To read the full story on WestlawNext Practitioner Insights, click here: bit.ly/2ZPI8uV"
-28.177100664264266," Retailers J.C.Penney, Macy's oppose proposed tariffs on apparel, footwear (Reuters) - Department store operators J.C. Penney Co Inc and Macy’s Inc have opposed U.S. President Donald Trump’s proposal to include apparel and footwear among the Chinese goods targeted for tariffs. The companies warned that U.S. consumers would have to pay more as they would not be able to quickly shift sourcing from China for items listed in separate letters dated June 17 and posted online to the U.S Trade Representative. The retailer listed 26 items, ranging from women’s pullovers to Christmas ornaments, and stressed that women would be hurt disproportionately by the proposed tariffs. It said that 13 items on their priority list were apparels for women and girls. ""For goodness sakes, a tax on Christmas ornaments? One wouldn't think the Administration would seek to emulate the Grinch, who left little Cindy-Lou Who with walls devoid of ornaments and 'nothing but hooks and some wire,'"" J.C. Penney said in the letter here. Penney’s rival Macy’s, which listed 63 priority items, said the tariffs on all types of baby garments could hurt new parents. ""It is hard enough for new parents to make ends meet while changing diapers and surviving on a few hours of sleep. Is it really a good idea to impose new taxes on baby clothes?"" it said in the letter here. The USTR had on Monday kicked off seven days of testimony from U.S. retailers, manufacturers and other businesses about Trump’s plan to hit another $300 billion worth of Chinese goods with tariffs. The hearings will end on June 25 and the tariffs will not come into effect until after July 2, when a seven-day final rebuttal comment period ends."
-17.577836545944038," Retailers RH, Oxford Industries plan price hike to soften China tariff impact (Reuters) - Home furnishing retailer RH and apparel retailer Oxford Industries Inc revealed major steps, including shifting production out of China and raising prices, to cushion the impact of the tariff hike on Chinese goods. Shares of RH surged about 25%, while those of Oxford Industries rose 9% after both companies reported strong quarterly results. RH said it selectively increased prices of its products while moving certain production and development of new products out of China and expanding manufacturing facilities in the United States to offset the impact of tariffs. “Long term, we do not believe the current trade climate will impair our ability to achieve our stated financial goals,” RH Chief Executive Officer Gary Friedman said in a statement. Tommy Bahama-owner Oxford Industries, which reaffirmed its full-year outlook, said it plans to hike prices selectively, if proposed tariff hike on remaining Chinese imports are introduced. Oxford Industries is also negotiating on price reductions with factories and shifting production out of China, besides accelerating the delivery of its Fall products. Ever since the U.S. imposed tariffs on Chinese imports in the wake of trade dispute between Washington and Beijing last year, retailers have been adopting various strategies to mitigate the impact. Retailers like Walmart Inc and Best Buy Co Inc had warned of higher prices after Washington dramatically escalated the trade war last month with threats of new tariffs on another $300 billion worth of U.S. imports from China after hiking levies on $200 billion worth of Chinese goods. Separately, mattress fabrics maker Culp Inc said on Wednesday the tariffs had caused “significant disruptions” throughout the furniture industry supply chain. Culp also noted that the expectation of additional tariffs led to advance customer purchases in its upholstery segment in previous quarters, resulting in higher inventories that partly hit its sales in the fourth quarter. Culp said it was taking steps to adjust its supply chain, including partnering with sources for cut and sew kits in Vietnam, in response to the latest round of tariffs."
-24.194073113693058," Macy's CEO says tariff escalation could hurt business (Reuters) - Macy’s Inc said on Wednesday the latest tariffs on Chinese imports by Washington are hitting its furniture business and warned investors that additional levies would leave its clothing and accessory categories vulnerable as well. The largest U.S. department store operator is one of the first to comment publicly on the damage that U.S. President Donald Trump imposing tariffs on all remaining imports from China, another $300 billion worth of goods, could have on business. In Macy’s case, the potential tariffs would impact both its private and national brands, Gennette said. Gennette said any escalation of tit-for-tat tariffs was not factored into the company’s annual outlook and that the company would do what it could to minimize the effect on customers. The executive said the company had worked hard to reduce reliance on Chinese suppliers. Washington dramatically escalated its 10-month trade war with Beijing on Friday by raising levies on $200 billion of Chinese goods in the midst of trade talks, and U.S. President Donald Trump has threatened new tariffs on all remaining U.S. imports from China, sending global financial markets into a tailspin. China retaliated on Monday, though on a smaller scale. Macy’s topped Wall Street estimates for quarterly same-store sales and profit benefiting from increased online sales and higher demand for items sold at its off-price stores. Macy’s shares, which have so far lost more than a quarter of their value this year, were down less than 1% at $21.61 in afternoon trading. Like its peers, the Cincinnati, Ohio-based department store chain, which has closed more than 100 stores since 2015 and cut thousands of jobs as mall traffic plummeted, faltered in the past few years as it struggled to adjust to a fiercely competitive retail landscape where shoppers buy more goods online at places like Amazon.com Inc. The 160-year-old retailer has poured money into building up its private label clothing as well as expand its off-price venture, Backstage, by adding 45 more stores this year. Gennette said brick-and-mortar sales trends improved sequentially in the first quarter, helped by its off-price Backstage business. The retailer said it saw double-digit growth in its digital business and that mobile continues to be Macy’s fastest-growing channel for sales growth. Sales at Macy’s stores open more than 12 months, including sales in department stores licensed to third parties, rose for the sixth straight quarter. They were up 0.7%, above the average analyst estimate of a 0.3% rise, according to research firm Consensus Metrix. Gross margin in the quarter fell to 38.2% from 39%, because a delayed start to spring bloated inventories. Macy’s said it expects to see some gross margin pressure in the second quarter as it continues to clear excess spring products. Last quarter, Macy’s announced a plan focused on cost cuts for 2019 to speed up decision-making and result in an annual savings of $100 million. The company earned $136 million, or 44 cents per share, in the first quarter ended May 4, compared to $139 million, or 45 cents per share, a year ago. That exceeded the average analyst estimate of 33 cents. Net sales fell to $5.50 billion, roughly in line with analysts expectations, according to IBES data from Refinitiv. “With comp results coming in better-than-feared, we’d expect a modest relief rally out of Macy’s today, but would not be chasing the stock,” Gordon Haskett analyst Chuck Grom said in a note. The company also repeated its previously issued financial forecast for the year."
-24.194073113693058," Macy's CEO says recent tariffs to impact furniture business (Reuters) - Macy’s Inc said on Wednesday the recent hike in U.S. tariffs on Chinese goods will hurt its furniture business of the department store operator. U.S. President Donald Trump escalated the trade war by raising tariffs on $200 billion worth of Chinese goods to 25% from 10% last Friday. This was in addition to the already imposed 25% tariff on $50 billion worth of Chinese imports. Macy’s Chief Executive Officer Jeff Gennette said the potential fourth tranche of tariffs that would be placed on all Chinese imports will impact both its private and national brands. “This potential fourth tranche of tariffs was not contemplated when we provided the annual guidance,” Gennette said on a post-earnings call. Shares of the company, which rose about 2%, fell 1%."
-24.194073113693058," Macy's CEO says recent tariffs to impact furniture business May 15 (Reuters) - Macy’s Inc said on Wednesday the recent hike in U.S. tariffs on Chinese goods will hurt its furniture business of the department store operator. U.S. President Donald Trump escalated the trade war by raising tariffs on $200 billion worth of Chinese goods to 25% from 10% last Friday. This was in addition to the already imposed 25% tariff on $50 billion worth of Chinese imports. Macy’s Chief Executive Officer Jeff Gennette said the potential fourth tranche of tariffs that would be placed on all Chinese imports will impact both its private and national brands. “This potential fourth tranche of tariffs was not contemplated when we provided the annual guidance,” Gennette said on a post-earnings call. Shares of the company, which rose about 2%, fell 1%. (Reporting by Aishwarya Venugopal in Bengaluru; Editing by Arun Koyyur)"
-24.194073113693058," Macy's same-store sales tops expectations; shares rise 7% May 15 (Reuters) - Macy’s Inc topped Wall Street estimates for quarterly same-store sales on Wednesday, benefiting from increased digital sales and higher demand for discounted luxury items sold at its off-price stores, sending its shares up 7%. Sales at Macy’s stores open more than 12 months, including sales in department stores licensed to third parties, rose 0.7%, above the average analyst estimate of a 0.3% rise, according to research firm Consensus Metrix. Net sales fell to $5.50 billion in the first quarter ended May 4, roughly in line with analysts expectations, according to IBES data from Refinitiv. (Reporting by Aishwarya Venugopal in Bengaluru; Editing by Arun Koyyur)"
-13.525894298101399," Macy's new restructuring to cut 100 senior jobs, save $100 million annually (Reuters) - Macy’s Inc, the largest U.S. department store chain, said on Tuesday it would cut 100 senior management positions to reduce costs and improve profitability, and reported holiday same-store sales growth short of Wall Street’s expectations. A multi-year program will also help the Cincinnati-based company improve its supply chain and tightly control its inventory, it said. The job cuts, at the vice presidential level and higher, combined with its supply chain and inventory actions, are expected to yield annual savings of $100 million, starting in the current fiscal year, 2019. “The steps ... will allow us to move faster, reduce costs and be more responsive to changing customer expectations,” Chief Executive Jeff Gennette said. Last month, Macy’s tempered expectations for the holiday season by slashing its fiscal 2018 revenue and profit forecast on weak demand for women’s sportswear, seasonal sleepwear, fashion jewelry, fashion watches and cosmetics. Its shares plunged 18 percent. Department stores in recent quarters had shown signs they were finding ways to cope with declining mall traffic and tough competition from online seller Amazon.com Inc, helped by a robust economy and strong consumer spending in 2018. In 2019, Macy’s said it would invest in categories where the company already has strong market share such as dresses, fine jewelry, women’s shoes and beauty, as well as revamp 100 stores, up from the 50 stores it remodeled last year. It also plans to build out its off-price Backstage business to another 45 store locations. Shares of the company were roughly flat at $24.27 in morning trading, after rising as much as 5 percent earlier. Macy’s, which has closed more than 100 locations and cut thousands of jobs since 2015, reported a smaller-than-expected 0.7 percent rise in holiday quarter same-store sales on Tuesday, below the company’s own expectations. “Core EPS guidance came in a bit lighter than we were expecting, but no worse than buy-side fears,” said Gordon Haskett analyst Chuck Grom. “Inventory levels are heavier than normal for Macy’s, but the company appears to have done a good job clearing through excess levels following a softer holiday period,” he said. The company now forecasts adjusted profits for fiscal 2019 between $3.05 to $3.25 per share, below analysts estimates of $3.29."
-13.525894298101399," Macy's announces restructuring plan to save $100 mln annually Feb 26 (Reuters) - Macy’s Inc on Tuesday announced a restructuring plan that would cut the complexity of its top management structure to speed up decision-making and reduce costs. The retailer said it expects the move to yield annual expense savings of $100 million, starting fiscal 2019. Macy’s also reported a smaller-than-expected rise in holiday quarter same-store sales on Tuesday. Shares of the company rose as much as 2.6 percent to $25 in early trading. (Reporting by Aishwarya Venugopal in Bengaluru; Editing by Shailesh Kuber)"
-3.6542487617982524," Macy's cuts profit, sales forecast after weak holiday season (Reuters) - Macy's Inc M.N shares plunged 18 percent on Thursday after the department store operator slashed its full-year profit and sales forecast on the back of an anemic holiday season, sending a chill through the wider retail sector. Macy’s said its sales slowed after a good start to the holidays, and flagged particular weakness in women’s sportswear, sleepwear, fashion jewelry, fashion watches and cosmetics. Its comparable sales over the critical November and December months rose 1.1 percent. Department stores in recent quarters had shown signs they were finding ways to cope with declining mall traffic and tough competition from online seller Amazon.com Inc AMZN.O. A robust economy and strong consumer spending had been expected to offer further relief. Kohl's Corp KSS.N reported similarly muted comparable sales growth for the holidays, sending its shares down as much as 9 percent. Target Corp TGT.N was down nearly 4 percent even after the retailer posted relatively strong holiday sales growth of nearly 6 percent. Those results come as overall sales for the 2018 U.S. holiday shopping season hit a six-year high as shoppers were encouraged by early discounts, according to a Mastercard report in late December. But some are already calling for an industry-wide slowdown this year. “It looks like the consumer is in good shape but generally there are signs of some slowing in the economy,” said Ken Perkins, founder of research firm Retail Metrics. Consumer confidence in 2019 is seen as likely to be strained by rising U.S. interest rates, the ongoing trade spat with China, market volatility due to concerns over global growth and political deadlock in Washington. A recession could hit many department stores particularly hard, some industry watchers said. “If we do get a recession, the retailers that can offer strong value in both physical bricks-and-mortar format, as well as a good online experience will do best,” said Jeff Yastine, senior equities analyst at investment advisory firm Banyan Hill Publishing. “That leaves many department store chains, like Macy’s, on the outside of this trend until they can figure out how to marry ‘luxury’ with the convenience of online retail that consumers want,” he said. Macy’s now expects 2 percent growth in comparable sales for the full year, down from a previous outlook of 2.3 percent to 2.5 percent growth. Its comparable sales, including licensed departments, rose 1.1 percent during November and December. The retailer is now calling for diluted earnings per share of $3.95 to $4.00 for fiscal 2018, excluding settlement charges, impairment and other costs. Its previous guidance issued in November called for EPS of $4.10 to $4.30. “The holiday season began strong - particularly during Black Friday and the following Cyber week, but weakened during the mid-December period and did not return to expected patterns until the week of Christmas,” Jeff Gennette, chairman and chief executive officer at Macy’s, said in a statement. The retailer has reported four consecutive quarters of same-store sales growth, and its shares had risen more than 80 percent over a 12-month period heading into Thanksgiving. Kohl’s reported comparable sales growth of 1.2 percent during the final two months of 2018, down sharply from 6.9 percent a year earlier. Target was a bright spot with comparable sales growth of 5.7 percent during November and December, up from growth of 3.4 percent in the same period last year, but its performance on Thursday was overshadowed by its rivals. Target said its sales were helped by higher customer visits and strong online sales during the holiday season, as well as strength in with toys, baby and seasonal gifts. It expects same-store sales growth of about 5 percent for the fourth quarter through January. Target reaffirmed its full-year earnings and sales forecast, putting it on track for its fastest full-year comparable sales growth since 2005."
