21.51246590715599," BRIEF-Manulife Financial To Issue $1 bln Principal Amount Of 2.237% Fixed/Floating Subordinated Debentures Due May 12, 2030 May 7 (Reuters) - Manulife Financial Corp: * INTENDS TO ISSUE $1 BILLION PRINCIPAL AMOUNT OF 2.237% FIXED/FLOATING SUBORDINATED DEBENTURES DUE MAY 12, 2030 * INTENDS TO ISSUE $1 BILLION PRINCIPAL AMOUNT OF 2.818% FIXED/FLOATING SUBORDINATED DEBENTURES DUE MAY 13, 2035 Source text for Eikon: Further company coverage:"
27.323483703081568," 'You deserve a raise': Canada to help fund pay hikes for essential workers OTTAWA (Reuters) - Canada and the country’s 10 provinces will boost pay for essential workers such as employees in seniors’ residences, which are linked to 80% of coronavirus deaths, Prime Minister Justin Trudeau said on Thursday. “If you’re risking your health to keep this country moving and you’re making minimum wage, you deserve a raise,” he told a daily briefing. The total number of coronavirus-related deaths rose by just over 4% to 4,280 from 4,111 on Wednesday, official data showed, further evidence the outbreak has peaked. The number of positive diagnoses edged up to 63,895 from 62,458. Quebec, the province hardest hit by the coronavirus, has unveiled plans to gradually restart its economy but on Thursday pushed back for the second time the date when businesses can reopen in Montreal, Canada’s second biggest city. Premier Francois Legault cited shortages of personnel in hospitals and said Quebec would offer higher pay to part-time medical workers. Montreal firms can now only open on May 25, not May 11 as originally planned. “Montreal is fragile - the rest of Quebec is a paradise. That’s how it is, they are two completely different worlds,” said Quebec’s chief public health office Horacio Arruda. Canada’s military is increasing its support in Quebec and aims to have more than 1,350 members in 25 different homes in coming days, Defence Minister Harjit Sajjan told reporters. Trudeau made his announcement a day before Statistics Canada releases unemployment data for April. Analysts say they expect around 4 million people to have lost their jobs after a record 1 million were thrown out of work in March. Manulife Financial Corp's MFC.TO chief executive Roy Gori cautioned against reopening economies too soon. “Subsequent pandemic waves could create greater ... devastation than we’ve already seen,” he said. Under the deal with the provinces, Ottawa will contribute C$3 billion ($2.1 billion), representing 75% percent of the total cost of the increased wages, the government said in a statement. The provinces will be responsible for determining who is essential and how much they receive. Ontario, Canada’s most populous province, will slowly begin resuming elective and non-essential surgeries, Premier Doug Ford announced, starting with the most urgent procedures such as cancer and cardiac surgeries. The Pacific province of British Columbia said it would unveil a plan to handle 30,000 non-urgent surgeries that have been postponed. This involves adding new capacity and hiring and training staff."
27.323483703081568," Manulife CEO warns of 'devastation' if COVID-19 closures end too soon TORONTO (Reuters) - Manulife Financial Corp’s chief executive on Thursday cautioned against reopening economies shut by the COVID-19 pandemic despite challenges that contributed to a 40% decline in first-quarter profit for Canada’s biggest life insurer. A “dramatic increase” in testing and contact tracing, and progress on development of treatments and a vaccine are needed before economies can begin returning to normal, CEO Roy Gori said at Manulife’s annual shareholder meeting. “We cannot afford to get this wrong,” Gori said. “Subsequent pandemic waves could create greater economic and social devastation than we’ve already seen.” Investment gains this year look unlikely, and Manulife expects elevated credit losses through the recession, executives said on an analyst call earlier. The insurer will not meet its medium-term earnings-per-share growth target of 10% to 12% this year, they said. Global insurance companies are seeing plunging yields slam investment returns, while the pandemic has boosted some payout expenses. That has been compounded by a collapse in crude prices with closures due to the outbreak eroding demand. Many North American producers have responded by reducing output. Manulife sees significant pressure on oil prices leading to downgrades on some energy holdings, but doesn’t expect widespread defaults, Chief Investment Officer Scott Hartz said on the call. Manulife saw losses of C$750 million ($533.54 million) in energy investments in its alternative long-duration assets (ALDA) portfolio, Hartz said. That contributed to the decline in the company’s earnings, reported late on Wednesday. Manulife invests in energy companies in ALDA, and in corporate bonds in its fixed income portfolio. One-third of Manulife’s oil and gas bond holdings are in more resilient midstream companies, and 94% are investment grade, Hartz said. Energy investments account for 6% of Manulife’s ALDA portfolio. “Given our limited exposure to high-yield issuers, we do not expect widespread defaults, although given the significant pressure on oil prices,” downgrades are likely, Hartz said. “We would need to get north of $50 (U.S. crude) to encourage significant shale drillings,” he added. “We would expect significant recovery in our portfolio at those levels.” U.S. crude was trading at about half that level on Thursday. Smaller rival Great-West LifeCo on Wednesday posted a 45% drop in first-quarter net income to 37 Canadian cents a share. Sun Life Financial also reported lower profit on Tuesday. Manulife shares reversed earlier gains to fall 1.7% to C$16.40 in Toronto, compared with little change in the Toronto stock benchmark."
27.323483703081568," Manulife expects downgrades on some energy exposures on oil price declines TORONTO, May 7 (Reuters) - Manulife Financial Corp expects significant pressure on oil prices to lead to downgrades on some of its energy holdings, but doesn’t expect widespread defaults in its investments, its chief investment officer said on Thursday. Canada’s biggest life insurer saw losses of C$750 million ($533.54 million) in oil and gas investments in its advanced life deferred annuity (ALDA) product, which contributed to a 40% decline in the company’s first-quarter net income. While further losses from its oil and gas investments are possible, its exposure to higher quality companies will limit them and keep a lid on defaults, CIO Scott Hartz said on an analyst call on Thursday. Manulife shares rose 1.2% to C$16.89 in morning trade in Toronto. ($1 = 1.4057 Canadian dollars) (Reporting By Nichola Saminather)"
26.048536864228396," BRIEF-Manulife Financial Reports Qtrly Earnings Per Share Of $0.64 May 6 (Reuters) - Manulife Financial Corp: * MANULIFE REPORTS 1Q20 NET INCOME OF $1.3 BILLION AND CORE EARNINGS OF $1.0 BILLION, A STRONG CAPITAL POSITION WITH A LICAT RATIO OF 155%, AND NET INFLOWS OF $3.2 BILLION IN GLOBAL WEALTH AND ASSET MANAGEMENT * Q1 ANNUALIZED PREMIUM EQUIVALENT SALES FELL 9 PERCENT TO C$1.6 BILLION * NEW BUSINESS VALUE OF $469 MILLION IN 1Q20, A DECREASE OF 11% COMPARED WITH 1Q19 * ANNUALIZED PREMIUM EQUIVALENT SALES OF $1.6 BILLION IN 1Q20, A DECREASE OF 9% COMPARED WITH 1Q19 * MANULIFE FINANCIAL - REPORTED GLOBAL WEALTH & ASSET MANAGEMENT NET INFLOWS OF $3.2 BILLION IN 1Q20, COMPARED WITH NET OUTFLOWS OF $1.3 BILLION IN 1Q19 * QUARTER-END WEALTH AND ASSET MANAGEMENT ASSETS UNDER MANAGEMENT AND ADMINISTRATION $636.2 BILLION * Q1 EARNINGS PER SHARE VIEW C$0.59 -- REFINITIV IBES DATA Source text for Eikon: Further company coverage:"
26.048536864228396," Canada's Manulife profit declines on market woes, lower Japan sales TORONTO (Reuters) - Manulife Financial Corp MFC.TO reported a 34% drop in first-quarter core earnings on Wednesday, missing analyst expectations, on unfavorable market conditions and lower sales in Japan that weighed on earnings from Asia. While net income attributable to shareholders was helped by gains from widening credit spreads, that was offset by lower-than-expected investment returns, primarily because of the sharp declines in oil prices, the insurer said in a statement. Global insurers have faced a double whammy as market volatility and plunging yields have slammed investment returns, while the COVID-19 outbreak has boosted some payout expenses. “The COVID-19 pandemic continues to disrupt economies and capital markets worldwide, and our operating conditions during the first quarter were understandably affected,” Chief Executive Roy Gori said in the statement. Global wealth and asset management was the only unit to see core earnings gains, with an increase of 7.3% from a year earlier, with net inflows of C$3.2 billion, compared with net outflows of C$1.3 billion a year earlier, largely driven by institutional allocations. The decline in sales in Japan offset increases in Hong Kong and elsewhere in Asia to result in a 5.6% decline for the region, the insurer’s growth driver over the past few years. Core earnings in Canada fell 16% from a year earlier, primarily due to unfavourable travel insurance claims related to COVID-19, while they declined 13% in the U.S. on higher life insurance claims, the insurer said. Manulife in March provided a temporary extension here of emergency out-of-country coverage for Canadian group and individual customers who experienced travel delays. Underlying profit, which excludes the impact of market movements and investment activities, fell to C$1 billion ($706.9 million), or 51 Canadian cents a share, in the three months ended March 31, from C$1.5 billion or 76 cents a share a year earlier, Manulife said. Analysts had expected C$1.1 billion, or 59 cents a share. Reported net income was C$1.3 billion, or 64 Canadian cents a share, compared with analyst expectations of C$753 million, or 44 cents a share."
26.048536864228396," BRIEF-Manulife Financial Reports Quarterly Earnings Per Share Of $0.64 May 6 (Reuters) - Manulife Financial Corp: * MANULIFE REPORTS 1Q20 NET INCOME OF $1.3 BILLION AND CORE EARNINGS OF $1.0 BILLION, A STRONG CAPITAL POSITION WITH A LICAT RATIO OF 155%, AND NET INFLOWS OF $3.2 BILLION IN GLOBAL WEALTH AND ASSET MANAGEMENT * NEW BUSINESS VALUE OF $469 MILLION IN 1Q20, A DECREASE OF 11% COMPARED WITH 1Q19 * ANNUALIZED PREMIUM EQUIVALENT SALES OF $1.6 BILLION IN 1Q20, A DECREASE OF 9% COMPARED WITH 1Q19 * MANULIFE FINANCIAL - REPORTED GLOBAL WEALTH & ASSET MANAGEMENT NET INFLOWS OF $3.2 BILLION IN 1Q20, COMPARED WITH NET OUTFLOWS OF $1.3 BILLION IN 1Q19 * QUARTER-END WEALTH AND ASSET MANAGEMENT ASSETS UNDER MANAGEMENT AND ADMINISTRATION $636.2 BILLION * Q1 EARNINGS PER SHARE VIEW C$0.59 -- REFINITIV IBES DATA Source text for Eikon: Further company coverage:"
26.048536864228396," Canada's Manulife posts profit miss on market woes, coronavirus-related claims TORONTO, May 6 (Reuters) - Manulife Financial Corp reported on Wednesday a 34% drop in first-quarter core earnings, missing analyst expectations, on unfavorable market conditions related to the COVID-19 outbreak and declining new business in Japan. Underlying profit fell to C$1 billion ($706.9 million), or 51 Canadian cents a share, in the three months ended March 31, from C$1.5 billion or 76 cents a share a year earlier, Canada’s biggest life insurer said in a statement. Analysts had expected C$1.1 billion, or 59 cents a share. Reported net income attributed to shareholders was C$1.3 billion, or 64 Canadian cents a share, compared with analyst expectations of C$753 million, or 44 cents a share. ($1 = 1.4147 Canadian dollars) (Reporting by Nichola Saminather; Editing by Peter Cooney)"
8.556683555270943, BRIEF-Mahindra & Mahindra Financial Services Completes Divestment Of 49% Stake In Unit To Manulife April 29 (Reuters) - Manulife Financial Corp: * MAHINDRA & MAHINDRA FINANCIAL SERVICES-COMPLETED PROCEEDINGS FOR DIVESTMENT OF 49% STAKE IN UNIT MAHINDRA ASSET MANAGEMENT CO PVT LTD TO MANULIFE Further company coverage:
25.435627268422518, BRIEF-Manulife Announces Intention To Redeem 2.10% Fixed/Floating Subordinated Debentures April 23 (Reuters) - Manulife Financial Corp: * MANULIFE ANNOUNCES INTENTION TO REDEEM 2.10% FIXED/FLOATING SUBORDINATED DEBENTURES Source text for Eikon: Further company coverage: (Reuters.Briefs@thomsonreuters.com)
24.90584904794229, BRIEF-John Hancock - Announces Strategic Collaboration With Clareto April 22 (Reuters) - Manulife Financial Corp: * JOHN HANCOCK - ANNOUNCES STRATEGIC COLLABORATION WITH CLARETO TO ACQUIRE AND AGGREGATE ELECTRONIC HEALTH DATA Source text for Eikon: Further company coverage:
58.14666152101914," UPDATE 1-About 75% of Manulife China employees back in offices, CEO says (Recasts to lead with China employees returning to work) TORONTO, March 23 (Reuters) - Most of Manulife Financial Corp’s employees in China have returned to work in its offices, as the spread of the new coronavirus slows, the chief executive of the Toronto-listed insurer said on Monday. “Four weeks ago we had less than 25% of our people coming into the office,” Roy Gori said at a webcast TD Securities event. “As at Friday of last week, we had nearly 75% of employees back in the office.” Mainland China on Monday reported a drop in its daily tally of new coronavirus cases, reversing four straight days of increases, with most new infections in recent days coming from travelers arriving from overseas. As of Sunday, the total number of cases in mainland China stood at 81,093. The death toll rose to 3,270, up nine from the previous day. “Obviously folks are still trying to get their houses in order in China and figuring out how to navigate in this new world,” Gori said. But “there is a shift we’re starting to see in China, more of a normalization is taking place there.” Manulife has accelerated its efforts to enable 12,000 agents in China to interact with clients digitally, and is also recruiting new agents virtually, he said, adding that Manulife also does a lot of its sales remotely in China. On the broader market impact of the outbreak, Gori said Manulife sees opportunities to acquire the debt of good U.S. companies, thanks to the widening of credit spreads following the Federal Reserve’s interest rate cut to near zero. “That’s a big part of our focus, so that’s an opportunity we will definitely continue to focus on and capture,” Gori said. While Manulife’s focus is to grow its existing businesses, it will also look elsewhere if opportunities exist, he said. “In times like these, if there is are opportunities to transact at good value, as long as they are aligned with our strategic priorities, we will consider those,” he said. Gori also said that Manulife has diversified its portfolio and exposure since the global financial crisis, and that it is less sensitive to interest-rate changes and equity market volatility than it was during the global financial crisis. (Reporting By Nichola Saminather; Editing by Denny Thomas and Sam Holmes)"
58.14666152101914," Manulife CEO sees opportunity to acquire good U.S. company debt TORONTO, March 23 (Reuters) - Manulife Financial Corp sees opportunities to acquire U.S. corporate debt, thanks to the widening of credit spreads, Chief Executive Roy Gori said on Monday. “That’s a big part of our focus, so that’s an opportunity we will definitely continue to focus on and capture,” Gori said. (Reporting By Nichola Saminather; Editing by Sandra Maler)"
-40.940385670680925," Canadian insurer Manulife to invest in own business after capital boost TORONTO (Reuters) - Manulife Financial Corp MFC.TO, Canada's biggest insurer, has the flexibility to invest capital into its own businesses after improving its leverage ratio and freeing up billions of dollars, executives said on Thursday. Manulife, which on Wednesday missed analyst expectations for its fourth-quarter earnings, has been on a push to increase efficiencies and free up capital from its legacy business, which includes annuities and long-term care. It has amassed C$5.1 billion ($3.9 billion) of capital through measures including new and renegotiated reinsurance transactions, real estate deals and asset sales, it said on Wednesday. The company achieved its medium-term leverage ratio target of 25% in the past quarter, from 28.6% in 2018, and boosted its quarterly dividend by 12%. The current leverage ratio means “we have quite substantial financial flexibility,” Chief Financial Officer Phil Witherington said on an analyst call on Thursday. “Our highest priority is the opportunity to organically invest... If there are inorganic opportunities out there, we may consider them, but one thing you can be assured of, is we’ll be very disciplined.” The executives did not expand on specific opportunities. Leverage ratio is the sum of long-term debt, capital instruments and preferred shares divided by the sum of long-term debt, capital instruments and total equity. Manulife shares were down l.2% in early afternoon trade. “Business has been good and they want to take the opportunity to tidy up what needs tidying up,” said John Kinsey, portfolio manager at Caldwell Securities, who owns Manulife shares. “This may be long overdue.” As part of its push to cut costs, Manulife has also delivered C$700 million of its C$1 billion target for expense efficiencies, Chief Executive Roy Gori said on the call. It cut 1,900 employees over the past two years, about 5% of its total workforce, through its restructuring initiatives, including early retirement and voluntary exit programs, he added. Rival Sun Life Financial Inc SLF.TO reported core earnings of C$1.34 per share on Wednesday, beating analyst estimates of C$1.30. Sun Life executives said on Thursday the coronavirus outbreak could increase claims in a ""material way"" if the situation deteriorates rapidly, but it is too early to gauge the impact. Sun Life shares were down 0.3%. Great-West Lifeco Inc GWO.TO on Thursday posted adjusted earnings per share of 80 Canadian cents, slightly beating estimates."
-40.940385670680925," Manulife's 25% leverage enables it to deploy capital into organic investments - CFO TORONTO, Feb 13 (Reuters) - Manulife Financial Corp , Canada’s biggest insurance company, has reduced its leverage ratio to under 25%, giving it flexibility to deploy capital, primarily into organic investments, Chief Financial Officer Phil Witherington said on an analyst call on Thursday. The company has also seen 1,900 employee departures through as part of its restructuring initiatives, and has delivered C$700 million of its C$1 billion target of expense efficiencies, Chief Executive Roy Gori said on the call. Manulife on Wednesday reported fourth-quarter earnings excluding one-off items of 73 Canadian cents a share, missing analyst estimates of 75 cents, and raised its dividend by 12%. Its shares were down 1.4% on Thursday. (Reporting By Nichola Saminather)"
-40.940385670680925," Manulife quarterly profit misses estimates, while Sun Life beats (Reuters) - Canada’s biggest life insurers reported increases in core quarterly profit on Wednesday as gains in earnings from wealth and asset management helped offset slower growth elsewhere. Manulife Financial Corp MFC.TO missed estimates as earnings from Canada fell 5.6%, while Sun Life Financial SLF.TO beat expectations despite only posting 2% increase in profit from its Asian business, its traditional growth driver. Both companies said it was too soon to gauge the impact of the coronavirus outbreak in China. Manulife’s chief executive, Roy Gori, told Reuters it was too early to make any changes to the insurer’s business, while Sun Life Chief Financial Officer Kevin Strain said the company has taken steps to speed up processing of claims related to the outbreak. Asia has been the growth engine for Canadian life insurers, with the region’s expanding middle class helping them diversify away from the more mature and intensely competitive market at home. Insurers are also increasingly relying on asset management for a relatively steady source of earnings with low costs. Manulife, Canada’s biggest insurer, posted 16% growth in earnings excluding one-off items from its global wealth and asset management business in the quarter from a year ago. While it reported declines in new business in Japan, 33% growth in Hong Kong and elsewhere in Asia mitigated the impact, CFO Phil Witherington said in an interview. That helped the region post a 6.7% increase in core earnings. Underlying earnings from Sun Life's Asia business grew 2%, in part due to some issues with its China joint venture, Strain said, without elaborating. Sun Life has a 25% stake in a joint venture with China Everbright 601818.SS. Its asset management earnings rose 24% from a year ago. Manulife earned C$1.48 billion ($1.13 billion), excluding one-off items, in the fourth quarter, from C$1.34 billion, a year earlier. Manulife also said it had freed up C$5.1 billion of capital, achieving its planned goal three years early. The cost of doing so was less than C$200 million on an annualized basis, Gori said. On a per share basis, Manulife posted core earnings of 73 Canadian cents, missing estimates of 75 Canadian cents, according to IBES data from Refinitiv. Sun Life’s underlying income rose to C$792 million, or C$1.34 per share, in the fourth quarter, from C$718 million, or C$1.19 per share, a year earlier. Analysts on average had expected a profit of C$1.30 per share. Manulife shares have gained 27% over the past year, while Sun Life has added 41%. That compares with a 14% increase in the Toronto stock benchmark. .GSPTSE"
-39.47158016099302," BRIEF-Manulife Reports 2019 Net Income Of $5.6 Bln And Core Earnings Of $6.0 Bln Feb 12 (Reuters) - Manulife Financial Corp: * MANULIFE REPORTS 2019 NET INCOME OF $5.6 BILLION AND CORE EARNINGS OF $6.0 BILLION, SOLID GROWTH IN ASIA AND A DIVIDEND INCREASE OF 12% * QTRLY WEALTH AND ASSET MANAGEMENT ASSETS UNDER MANAGEMENT AND ADMINISTRATION $681.4 BILLION * NEW BUSINESS VALUE OF $526 MILLION IN 4Q19, AN INCREASE OF 4% COMPARED WITH 4Q18 * ANNUALIZED PREMIUM EQUIVALENT SALES OF $1.5 BILLION IN 4Q19, AN INCREASE OF 1% COMPARED WITH 4Q18 * REPORTED ANNUALIZED PREMIUM EQUIVALENT (“APE”) SALES OF $1.5 BILLION IN 4Q19, AN INCREASE OF 1% COMPARED WITH 4Q18 * Q4 EARNINGS PER SHARE VIEW C$0.75 -- REFINITIV IBES DATA Source text for Eikon: Further company coverage:"
-39.47158016099302," Insurer Manulife profit misses estimates on decline in Japan sales TORONTO, Feb 12 (Reuters) - Manulife Financial Corp , Canada’s biggest insurer, reported core quarterly earnings that missed analyst estimates on Wednesday, as declining sales in Japan offset growth elsewhere. The Toronto-based company posted earnings excluding one-off items of C$1.5 billion ($1.13 billion), or 73 Canadian cents a share, in the fourth quarter, compared with analyst expectations of 75 cents, and 65 cents a year ago. Manulife reported net income attributable to shareholders of C$1.2 billion, missing estimates of C$1.5 billion. ($1 = 1.3251 Canadian dollars) (Reporting By Nichola Saminather; Editing by Sandra Maler)"
5.404465561543822," Canadian insurers Manulife, Sun Life profits beat on Asia demand (Reuters) - Canadian insurers Manulife MFC.TO, Sun Life SLF.TO beat analysts' quarterly profit estimates on Wednesday, driven by strong demand in Asia, especially Hong Kong. Asia has been a focus area for Canadian insurers who have been looking to sell cheaper insurance policies to the region’s burgeoning middle class as domestic markets face intense competition. Manulife’s Asia unit reported a nearly 13% rise in core earnings to C$520 million ($394.6 million), while its domestic and U.S. businesses slipped. Canada’s biggest insurer said annualized premium equivalent sales in Hong Kong surged 58%, driven by its recently launched health insurance and other products. “Our Hong Kong business has been less impacted by the current political situation,” Sun Life Chief Financial Officer Kevin Strain told Reuters. “Hong Kong has a lot of resilience and our performance underscores the strong commitment to Hong Kong and our ability to offer the right savings and insurance products. We have been around in Hong Kong for a long time and we remain committed to Hong Kong.” Underlying net income at the company’s Asia unit rose 25% to C$138 million, while insurance sales jumped 47% from a year earlier. Hong Kong has witnessed massive protests over the past five months over perceived Chinese meddling with the freedoms promised when the former British colony returned to Chinese rule in 1997. China denies doing so, and has blamed Western countries for stirring up trouble. Sun Life’s underlying net income rose to C$809 million, or C$1.37 per share, in the third quarter ended Sept. 30, from C$730 million, or C$1.20 per share, a year earlier. Analysts on average had expected a profit of C$1.27 per share, according to IBES data from Refinitiv. However, Manulife’s core earnings attributed to shareholders fell marginally to C$1.53 billion. On a per share basis, core earnings rose by 1 Canadian cent to 76 Canadian cents. Analysts on average had expected a profit of 73 Canadian cents per share, according to IBES data from Refinitiv."
