9.189640742443435," UPDATE 1-Manulife says will prioritize organic growth, dividend hikes for C$29 bln excess capital (Adds share prices, background) TORONTO, Feb 11 (Reuters) - Canada’s top insurer Manulife Financial Corp will prioritize organic growth, dividend increases and share buybacks over acquisitions for its C$29 billion ($22.9 billion) of excess capital, its chief executive said on Thursday. “We don’t need M&A to deliver on our medium-term goals of 10% to 12% core earnings per share growth,” CEO Roy Gori said on an analyst call after reporting higher-than-expected fourth-quarter earnings on Wednesday. “When we do deploy capital, for any M&A, we will do that opportunistically ... when we’ve got a high degree of confidence that we can execute against that agenda,” he added. Gori, in an interview on Wednesday, said the company expects Asia to account for half of its core earnings from both insurance and wealth and asset management by 2025, up from 41% in 2020. Smaller rival Sun Life Financial Inc also beat earnings estimates on Wednesday, helped by strong wealth management growth. The chief executives of both companies said they are optimistic about 2021, thanks to the deployment of coronavirus vaccines and the reopening of economies from prolonged lockdowns in many markets, after a challenging 2020 from which they managed to emerge relatively unscathed. The two companies paid out a total of C$590 million in coronavirus-related death claims in 2020. Sun Life executives told analysts on Thursday it was reducing its real estate footprint in Canada and the United States and expects to take a C$40 to C$60 million charge in the first quarter as a result. Shares of Manulife rose 2.1% to C$25.12 in morning trading in Toronto, while Sun Life shares were up 1.2% at C$62.50. Both were on track for their highest close in nearly a year. The Toronto stock benchmark was down 0.15%."
9.189640742443435," Manulife says prioritize organic growth, dividend hikes, buybacks for C$29 bn excess capital TORONTO, Feb 11 (Reuters) - Manulife Financial Corp will prioritize organic growth, dividend increases and buybacks for its C$29 billion ($22.9 billion) of excess capital over acquisitions, its chief executive said on Thursday. “We don’t need M&A to deliver on our medium-term goals of 10% to 12% core earnings per share growth,” Roy Gori said on an analyst call after Manulife reported fourth-quarter earnings that beat estimates. “When we do deploy capital, for any M&A, we will do that opportunistically... when we’ve got a high degree of confidence that we can execute against that agenda.”"
12.540189373724486," Canada's Manulife reports marginal rise in fourth-quarter profit (Reuters) - Canada’s biggest life insurer Manulife Financial Corp on Wednesday reported a fourth-quarter profit that was largely unchanged. Manulife reported core earnings of C$1.47 billion ($1.16 billion), or 74 Canadian cents a share, in the three months through December, compared with C$1.47 billion, or 73 Canadian cents a share, a year earlier. ($1 = 1.2696 Canadian dollars) (Corrects to remove reference to performance slip at Asian, U.S. and wealth and asset management businesses in paragraph 1)"
24.120811693413337," Aviva to sell Vietnam unit to ManuLife LONDON (Reuters) - British insurer Aviva is to sell its Vietnamese business to Canadian insurer ManuLife it said on Monday, as it pushes ahead with plans to pull out from its non-core markets. Aviva, under new boss Amanda Blanc, is looking to sell its businesses in continental Europe and Asia, to focus on Britain, Ireland and Canada. Years of share price underperformance in the life and general insurer have irked investors. Aviva did not give a price for the cash sale of the Vietnamese life insurance business, but said the deal would increase its net asset value and Solvency II surplus by around 100 million pounds ($133.67 million). ManuLife said in a separate statement it had agreed a 16-year bancassurance partnership with VietinBank, and was buying Aviva Vietnam as part of the deal. Aviva sold a majority holding in its Singapore business in September and last week completed the sale of its Hong Kong joint venture. In Europe, French mutual insurer Macif is stepping up efforts to buy Aviva France, Reuters reported last week. Aviva is also looking to sell businesses in Italy and Poland, and joint ventures in Turkey, China and India. It sold its stake in Italian life insurer Aviva Vita to joint venture partner UBI Banca last month. Aviva’s shares were up 2% at 0816 GMT. ($1 = 0.7481 pounds)"
25.790934588755544," UPDATE 1-Manulife says Hong Kong market share doubled, eyes Asia, asset management for M&A (New throughout, adds share price, analyst comment, details from call) TORONTO, Nov 12 (Reuters) - Manulife Financial doubled its market share in the third quarter in an “exceedingly resilient” Hong Kong from a year earlier, despite challenging conditions, executives said on Thursday after the company’s earnings beat analyst estimates. Canada’s biggest life insurer is focusing on acquisition opportunities in Asia and its wealth and asset management business, which helped drive its better-than-expected performance during the quarter, Chief Executive Roy Gori told Reuters on Wednesday following its results release. Manulife has about C$32 billion ($24 billion) of excess capital it can deploy, he said. “We clearly see Asia as a jewel in the Manulife crown,” Gori said in an interview. The company has “strong capability” in Asia and in wealth and asset management, and sees potential for growth by adding to these areas, he added. In Asia, Manulife would consider acquisitions that would complement its operations in countries where it has a larger presence, as well as those that would help it build scale in smaller markets, he said. Manulife already doubled its market share in Hong Kong in the first half of 2020 from a year earlier, and the business posted third-quarter core earnings growth of 15%, executives said on the call. Manulife shares fell 2% to C$21.00 in morning trading in Toronto, compared with a 0.1% decline in the Toronto Stock Exchange 300 Composite index. They had climbed nearly 19% this month as of Wednesday’s close, versus the benchmark’s 7.3% gain. “The shares are modestly underperforming today following a sharp rise in the shares recently,” Edward Jones analyst James Shanahan said. Despite the earnings beat, Manulife’s core earnings fell 6% from a year ago. And while core earnings per share have dropped 10% this year, executives maintained Manulife’s medium-term growth rate target of 10% to 12% for 2021 and beyond. ($1 = 1.3134 Canadian dollars) (Reporting By Nichola Saminather; Editing by David Gregorio)"
20.993552252603216," Manulife profit beats forecasts on growth in Asia, asset management (Reuters) - Manulife Financial Corp MFC.TO on Wednesday said third-quarter core profit declined less than analyts had expected, helped by earnings growth in Asia and asset management, but it warned the COVID-19 pandemic posed risks. Canada’s top life insurer said the environment remains uncertain due to legal and regulatory responses to the resulting economic downturn from the pandemic. “These disruptions, if they continue, could have a significant adverse impact on our global businesses and operations and on our financial results,” Manulife said in a statement. Manulife reported underlying profit, excluding one-time charges, of C$1.45 billion ($1.11 billion), or 73 Canadian cents a share, in the three months through September, down from C$1.53 billion, or 76 cents, a year earlier. Analysts had expected profit of 70 Canadian cents. Higher payouts in its Canadian insurance business and lower new business volumes due to the coronavirus pandemic were offset by factors including growth in in-force business - the business it has on its books - and increased assets in its wealth and asset management unit, the company said. Third-quarter sales fell 2% from a year earlier as the pandemic-driven declines in Hong Kong and the United States failed to offset gains in other areas. Rival Sun Life Financial Inc SLF.TO last week reported better-than-expected third-quarter core earnings, benefiting from new business gains in Asia and growth in income from its asset management unit. Manulife’s net income attributed to shareholders rose to C$2.1 billion from C$723 million a year earlier as the company posted gains from investment-related experience versus losses in the prior period. Separately, the company said it had appointed Leagh Turner, chief operating officer for Ceridian HCM Holding CDAY.N, to its board of directors, effective Nov. 10."
20.993552252603216," Manulife beats estimates on Asia, asset management earnings growth Nov 11 (Reuters) - Canadian insurer Manulife Financial Corp on Wednesday beat analysts’ estimates for third-quarter core profit as earnings growth from its Asian and wealth and asset management businesses offset declines in Canada. Manulife reported underlying profit, excluding one-time charges, of C$1.45 billion ($1.11 billion), or 73 Canadian cents a share, in the three months through September, from C$1.53 billion, or 76 cents, a year earlier. Analysts had expected 70 Canadian cents. Net income attributed to shareholders rose to C$2.1 billion from C$723 million a year earlier as the company posted gains from investment-related experience versus losses in the prior period."
22.21233800675746," Manulife to begin offering COVID-19 related travel insurance product TORONTO (Reuters) - Canadian insurer Manulife Financial Corp MFC.TO will restore some coverage for coronavirus-related trip interruptions in a new travel insurance policy that also includes COVID-19 in its emergency medical coverage. The policy will launch in October for Canadians traveling domestically and internationally, including to countries subject to a level 3 travel advisory, Canada’s biggest life and travel insurance company said on Wednesday. Canada has a level 3 advisory, which urges avoidance of non-essential travel, for all countries. Manulife, as well as some other insurers, said in March they would stop covering trip cancellations or interruptions related to the pandemic as the disease was deemed a “known event.” Manulife’s Canadian core earnings in the three months through March declined primarily due to higher travel insurance claims at the start of the pandemic. Manulife shares are down 27% this year, versus a 3.6% decline in the Toronto stock benchmark .GSPTSE. Manulife joins smaller rivals, including Medipac Travel Insurance and the Ontario and Quebec plans of the Canadian Association of Blue Cross, which began offering medical travel insurance including COVID-19 coverage in July. Neither offers pandemic-related trip interruption coverage. Manulife’s policy has a C$5 million ($3.79 million) non-COVID-19 emergency medical coverage limit, and a COVID-19 limit of C$200,000. It will also cover daily quarantine-related expenses of C$150 per person or C$300 per family for up to 14 days, Manulife said. If a level 3 advisory is upgraded to level 4, Manulife said it will pay a combined C$500 per person for return airfare, meals and accommodation. ($1 = 1.3180 Canadian dollars)"
22.21233800675746," Manulife to begin offering COVID-19 related travel insurance product TORONTO, Sept 16 (Reuters) - Canadian insurer Manulife Financial Group will restore some coverage for coronavirus-related trip interruptions in a new travel insurance policy that also includes COVID-19 in its emergency medical coverage. The policy will launch in October for Canadians traveling domestically and internationally, including to countries subject to a level 3 travel advisory, Canada’s biggest life and travel insurance company said on Wednesday. Canada has a level 3 advisory, which urges avoidance of non-essential travel, for all countries. Manulife, as well as some other insurers, said in March they would stop covering trip cancellations or interruptions related to the pandemic as the disease was deemed a “known event.” Manulife joins smaller rivals, including Medipac Travel Insurance and the Ontario and Quebec plans of the Canadian Association of Blue Cross, which began offering medical travel insurance including COVID-19 coverage in July. Neither offers pandemic-related trip interruption coverage. Manulife’s policy has a C$5 million ($3.8 million) non-COVID-19 emergency medical coverage limit, and a COVID-19 limit of C$200,000. It will also cover daily quarantine-related expenses of C$150 per person or C$300 per family for up to 14 days, Manulife said. If a level 3 advisory is upgraded to level 4, Manulife said it will pay a combined C$500 per person for return airfare, meals and accommodation."
17.1660309992983," Canadian oil producer Whitecap to buy NAL Resources for nearly $119 million (Reuters) - Canadian oil producer Whitecap Resources Inc WCP.TO said on Monday it would buy NAL Resources Ltd, owned by Manulife Financial Corp MFC.TO, for C$155 million ($118.59 million) as it looks to boost its core Alberta and Saskatchewan assets. Whitecap said it would issue 58.3 million of its shares to Manulife in exchange for all the issued and outstanding shares of NAL, which operates in Canada’s Saskatchewan and Alberta. Insurance and financial services provider Manulife will own about 12.5% of the combined company. The deal marks growing interest in mergers among smaller Canadian oil producers to bolster their portfolios, as uncertainty about future oil demand persists. The COVID-19 pandemic destroyed fuel demand and left dozens of energy companies without the prospect of drilling their way out of debt or bankrupt, making consolidations a viable solution for many smaller players. Separately on Monday, Calgary, Alberta based oil and gas company Obsidian Energy Ltd OBE.TO offered two shares for every share of Bonterra Energy Corp BNE.TO. That would value Bonterra at about C$35 million, or C$1.06 per share, a 29.3% discount to its Friday close. Bonterra shareholders would own about 48% in the combined company, Obsidian said. Last month, top independent U.S. oil producer ConocoPhillips COP.N said it would buy land from Kelt Exploration Ltd in Canada's Montney shale oil play in a $375 million deal. ($1 = 1.3070 Canadian dollars)"
3.6187922417628506," Canada's Manulife core profit beats expectations, rises on fewer payouts and markets TORONTO (Reuters) - Manulife Financial Corp MFC.TO on Wednesday comfortably beat analyst estimates for second-quarter core profit, which rose from a year earlier due in part to favorable policyholder experience and market impacts. Underlying profit rose to C$1.6 billion ($1.21 billion), or 78 Canadian cents a share, from C$1.45 billion, or 72 cents, a year earlier, Canada’s biggest life insurer said in a statement. That compared with expectations of 62 Canadian cents. Favorable policyholder experience typically results in lower payouts for insurers and includes beneficial mortality trends and fewer claims. Investors and analysts had forecast large drops in profit for Canadian life insurers during the quarter, driven by the pandemic-driven declines in interest rates and the hit to sales from economic shutdowns. Some of that materialized in Manulife’s reported net income, which halved from a year ago to C$727 million, or 35 Canadian cents per share, weighed by lower interest rates and narrowing credit spreads. Annual premium equivalent sales fell 13% during the quarter. Despite the improvement in underlying earnings, growth was capped by the lack of core investment gains - expected due to mark-to-market losses in the prior quarter - and lower new business volumes, Manulife said. U.S. core earnings posted the strongest growth, climbing 32%, while Canada’s rose 10%. Earnings from Asia grew a subdued 1% as fewer claims were offset by a decline in new business due to the pandemic. Even as assets in the global wealth and asset management unit grew nearly 7% from a year ago, core earnings fell 4% due to lower fee revenues and tax benefits. While new business value was affected by the pandemic, “positive momentum” in annual premium equivalent sales in Asia in the final month of the quarter was “encouraging,” Chief Financial Officer Phil Witherington said in the statement."
3.6187922417628506," Canada's Manulife beats expectations, posts core profit rise helped by market recovery TORONTO, Aug 5 (Reuters) - Manulife Financial Corp on Wednesday comfortably beat analyst estimates for second-quarter core profit, which rose from a year earlier due in part to favourable market impacts. Underlying profit rose to C$1.6 billion ($1.21 billion), or 78 Canadian cents a share, from C$1.45 billion, or 72 cents, a year earlier. That compared with expectations of 62 Canadian cents. But reported net income attributed to shareholders fell to C$727 million, or 35 Canadian cents, from C$1.48 billion, or 73 cents, a year earlier. For details ($1 = 1.3264 Canadian dollars) (Reporting by Nichola Saminather in Toronto Editing by Matthew Lewis)"
2.330690065466923," Canadian insurer Manulife to boost diversity by 30% in five years (Reuters) - Manulife Financial Corp MFC.TO said on Friday it was making a push to increase the representation of minorities across its north American businesses, joining a host of companies that have pledged to improve racial diversity at workplaces. The Canadian insurer is planning a 30% increase in minority representation in leadership positions by 2025, while hiring at least 25% through its graduate program, Manulife said in a statement. A number of companies, including Microsoft Corp MSFT.O, Alphabet Inc's GOOGL.O Google and Royal Bank of Canada RY.TO, are confronting discrimination after the death of George Floyd at the hands of Minneapolis police triggered protests in the United States against racial inequality. Last month, Manulife and Bank of Nova Scotia BNS.TO pledged C$3.5 million ($2.58 million) and C$500,000, respectively, for diversity initiatives. The Canadian Council of Business Leaders Against Anti-Black Systemic Racism in June urged here corporates to commit to increasing Black representation in their workforce and boardrooms by 2025."
-1.4264463409677008, BRIEF-Nicole Arnaboldi Appointed To Manulife's Board Of Directors Manulife Financial Corp: * NICOLE ARNABOLDI APPOINTED TO MANULIFE’S BOARD OF DIRECTORS Source text for Eikon: Further company coverage:
8.749832296752896," Manulife CEO says lower rates for longer is 'new headwind' TORONTO (Reuters) - Manulife Financial Corp's MFC.TO chief executive said on Wednesday an environment of lower interest rates for longer is proving a challenge for the insurer, which did not expect the ""significant"" drop in long-term rates that has taken place. “A new era of lower rates for longer is a new headwind we’ll have to grapple with,” Roy Gori said at the S&P Global Insurance Conference. “When we did our planning for 2020 and 2021, we never really anticipated the significant drop in the longer end of the curve as much as we’ve actually seen.” Global insurance companies are seeing plunging yields slam investment returns, while the pandemic has boosted some payout expenses. Manulife last month reported a 40% drop in first-quarter profit. The decline in rates has required Manulife to respond by changing pricing and products and increasing efficiency, in part through increased technology adoption, he said. Manulife has done more to advance digitization in the past five months than in the previous five years, and more than 90% of products can now be sold digitally, Gori said. Gori said Manulife’s operations outside North America, particularly in Asia, have helped cushion some of the impact of low rates. With different Asian markets are at different points on the yield curve, “you start to appreciate the benefits of global diversity,” he said. Gori cautioned that volatility, particularly in equity markets, will continue until a coronavirus vaccine is developed and deployed. Gori also said 90% of Manulife’s employees in China and 50% in Hong Kong have returned to offices. That contrasts with its North American operations, where 98% of staff are still working from home. Manulife shares rose 4.1% to a seven-month high of C$18.50 on Wednesday, compared with a 1.1% gain in the Toronto stock benchmark .GSPTSE."
8.749832296752896," Manulife CEO says lower rates for longer is 'new headwind' TORONTO, June 3 (Reuters) - Manulife Financial Corp’s said an environment of lower interest rates for longer is a new headwind, proving a challenge for the insurer, which did not anticipate the ‘significant’ drop in long-term rates when planning for 2020 and 2021. “A new era of lower rates for longer is a new headwind we’ll have to grapple with,” Roy Gori said at the S&P Global Insurance Conference. “When we did our planning for 2020 and 2021, we never really anticipated the significant drop in the longer end of the curve as much as we’ve actually seen.” That has required Manulife to “adjust and respond and adapt” by changing pricing and products and increasing efficiency, in part through better adoption of technology, he said. (Reporting By Nichola Saminather Editing by Chizu Nomiyama)"
23.036688854643923," BRIEF-Manulife Entered Agreement To Privately Place $200 Mln Of Senior Notes May 25 (Reuters) - Manulife Financial Corp: * MANULIFE FINANCIAL CORP - ENTERED AGREEMENT TO PRIVATELY PLACE U.S.$200 MILLION OF 2.396% SENIOR NOTES DUE JUNE 1, 2027 Source text for Eikon: Further company coverage:"
32.01096803927996," BRIEF-Manulife Financial Corporation Announces USD Senior Notes Private Placement May 22 (Reuters) - Manulife Financial Corp: * MANULIFE FINANCIAL CORPORATION ANNOUNCES USD SENIOR NOTES PRIVATE PLACEMENT * MANULIFE FINANCIAL CORP - ENTERED AGREEMENT TO PRIVATELY PLACE U.S.$200 MILLION PRINCIPAL AMOUNT OF 2.396% SENIOR NOTES DUE JUNE 1, 2027 Source text for Eikon: Further company coverage:"
34.30265628493591, BRIEF-Manulife Prices U.S. Public Offering Of $500 Million Amount Of 2.484% Senior Notes At 100% May 14 (Reuters) - Manulife Financial Corp: * MANULIFE FINANCIAL CORPORATION PRICES U.S. PUBLIC OFFERING OF SENIOR NOTES * MANULIFE FINANCIAL CORP - PRICED U.S. PUBLIC OFFERING OF U.S.$500 MILLION AMOUNT OF 2.484% SENIOR NOTES DUE 2027 AT OFFERING PRICE OF 100%. Source text for Eikon: Further company coverage:
35.96484314190228," UPDATE 1-Manulife would be 'very happy' to boost stake in China life-insurance venture-CFO (Adds further details, context, share price) TORONTO, May 14 (Reuters) - Manulife Financial Corp would be “very happy” to increase its stake in its Chinese joint venture with Sinochem, the chief financial officer of Canada’s biggest life insurer said on Thursday. Manulife has a 51% interest in the venture, which it entered into with the Chinese state-owned company in 1996. While acquisitions are lower on Manulife’s list of priorities, “if there’s an opportunity to increase the extent of our ownership (in the Sinochem joint venture), we would be happy to do that,” CFO Phil Witherington said at the online Barclays Americas Select Conference. “It’s not something that’s a necessity, but a nice to have,” he said. “It’s a nice way to potentially deploy capital.” In China, where the novel coronavirus emerged earlier than elsewhere in the world, about 80% of Manulife’s workforce is back in offices following lockdowns to curb the virus’ spread, while in Hong Kong, about half have returned, Witherington said. Asia has been the growth engine for Canadian life insurers over several quarters, with the region’s expanding middle class helping them diversify away from the more mature and competitive market at home. Last week, the Toronto-based insurer reported a decline in first-quarter profit, hit by equity market disruptions due to the coronavirus pandemic and lower sales in Japan, although the company did see growth in new business elsewhere in Asia. Witherington said the insurer also benefitted from lower interest rates, which widened the spreads between risk-free rates and yields on its corporate bond holdings, and from currency movements. But “I wouldn’t bank all of those benefits,” Witherington said. “As markets normalize, assuming the external environment and macro conditions improve, I would expect to give some of those, or possibly all of those, benefits back.” Separately, Manulife said in a statement it had invested C$1.2 billion ($851.79 million)in renewable energy and energy efficient projects in 2019. Manulife invests in energy companies in its alternative long-duration assets portfolio, and through corporate bonds in its fixed income portfolio. Manulife shares were trading 2.7% lower at C$15.81 in morning trading, compared with a 1.2% drop in the Toronto stock benchmark."
35.96484314190228," Manulife would be 'very happy' to increase stake in China life-insurance JV-CFO TORONTO, May 14 (Reuters) - Manulife Financial Corp would be “very happy” to increase its stake in its Chinese joint venture with Sinochem, the chief financial officer of Canada’s biggest life insurer said on Thursday. Manulife has a 51% interest in the JV, which it signed with the Chinese state-owned company in 1996. While acquisitions are lower on Manulife’s list of priorities, “if there’s an opportunity to increase the extent of our ownership (in the joint venture), we would be happy to do that,” CFO Phil Witherington said at the virtual Barclays Americas Select Conference. “It’s not something that’s a necessity, but a nice to have,” he said. “It’s a nice way to potentially deploy capital.” (Reporting By Nichola Saminather )"
