9.29072429481104, BRIEF-Markel Reports First Quarter 2020 Results April 28 (Reuters) - Markel Corp: * MARKEL REPORTS FIRST QUARTER 2020 RESULTS Source text for Eikon: Further company coverage:
15.14671493134393, BRIEF-Markel Corp Entered Into A Definitive Agreement To Acquire A Majority Interest In Lansing Building Products March 16 (Reuters) - Markel Corp: * MARKEL CORP - ENTERED INTO A DEFINITIVE AGREEMENT TO ACQUIRE A MAJORITY INTEREST IN LANSING BUILDING PRODUCTS * MARKEL CORP - LANSING ENTERED INTO A DEFINITIVE AGREEMENT TO ACQUIRE DISTRIBUTION BUSINESS OF HARVEY BUILDING PRODUCTS * MARKEL CORP - ADDITIONAL TERMS WERE NOT DISCLOSED Source text for Eikon: Further company coverage:
15.14671493134393," BRIEF-Dunes Point Capital Signs A Purchase Agreement To Sell The Distribution Business Of Harvey Building Products March 16 (Reuters) - Markel Corp: * PRESS RELEASE - DUNES POINT CAPITAL, LP ANNOUNCES SIGNING A PURCHASE AGREEMENT TO SELL THE DISTRIBUTION BUSINESS OF HARVEY BUILDING PRODUCTS * DUNES POINT CAPITAL, LP - LANSING ENTERED INTO A DEFINITIVE AGREEMENT TO SELL A MAJORITY INTEREST TO MARKEL CORPORATION * DUNES POINT CAPITAL, LP - DPC WILL RETAIN MANUFACTURING BUSINESS OF HARVEY Source text for Eikon: Further company coverage:"
-26.287316376081808," BRIEF-Markel To Combine Its U.S. Specialty And Assurance Divisions March 2 (Reuters) - Markel Corp: * MARKEL TO COMBINE ITS U.S. SPECIALTY AND ASSURANCE DIVISIONS; PROMOTES WENDY HOUSER, SARAH GAVLICK INTO NEW LEADERSHIP ROLES * MARKEL SAYS COMBINING EXISTING U.S. INSURANCE DIVISIONS, ASSURANCE AND SPECIALTY INTO ONE DIVISION CALLED MARKEL SPECIALTY, EFFECTIVE APRIL 1 Source text for Eikon: Further company coverage:"
7.156658826220082," BRIEF-Markel Corp Board Approved New $300 Mln Repurchase Program May 17 (Reuters) - Markel Corp: * MARKEL- ON MAY 14, BOARD APPROVED NEW REPURCHASE PROGRAM WITH IMMEDIATE EFFECT AUTHORIZING CO TO REPURCHASE UP TO $300 MILLION OF CO’S STOCK - SEC FILING * MARKEL CORP - NEW SHARE REPURCHASE PROGRAM REPLACES PROGRAM AUTHORIZED IN NOV 2013 UNDER WHICH ABOUT $176 MILLION OF CO’S STOCK HAS BEEN REPURCHASED * MARKEL CORP - NEW PROGRAM HAS NO EXPIRATION DATE BUT MAY BE TERMINATED BY BOARD AT ANY TIME Source text: (bit.ly/2Laaaej) Further company coverage:"
1.8592270428393172," MOVES-Markel, Lazard, Capital Generation April 30 (Reuters) - The following financial services industry appointments were announced on Monday. To inform us of other job changes, email moves@thomsonreuters.com. The specialist insurer, a unit of U.S.-based Markel Corp , appointed Debbie O’Sullivan as senior yacht underwriter to its marine team. David Prior, a former UK undersecretary of state, has returned to the firm as a senior adviser in its financial advisory unit, mainly to work with its healthcare team. The investment manager named Michel de Carvalho as chairman of the group. (Compiled by Sanjana Shivdas in Bengaluru)"
-1.4696347525394424," BRIEF-Markel Corp Q1 Loss Per Share $4.25 April 24 (Reuters) - Markel Corp: * Q1 EARNINGS PER SHARE VIEW $8.77 -- THOMSON REUTERS I/B/E/S * BOOK VALUE PER COMMON SHARE OUTSTANDING OF $671.05 AT MARCH 31, 2018, DOWN 2% FROM $683.55 AT DECEMBER 31, 2017 * COMBINED RATIO WAS 90% FOR Q1 OF 2018 COMPARED TO 100% FOR Q1 OF 2017 Source text for Eikon: Further company coverage:"
