2.0215495272716004," Britain should have enough electricity supply over summer - National Grid LONDON, April 16 (Reuters) - Britain should have enough electricity to meet demand over the summer months, the country’s National Grid Electricity System Operator (ESO) said on Thursday, as reduced demand due to the coronavirus is likely to outstrip potential supply impacts. Electricity demand could fall by as much as 20% compared with business as usual this summer due to restrictions placed on businesses and homes to help curb the spread of the virus, the National Grid ESO said. (Reporting by Susanna Twidale; Editing by Susan Fenton)"
2.343145477603792, BRIEF-UK's Ofgem Requires Intergen To Pay 37 Mln Stg Over Energy Market Abuse April 15 (Reuters) - UK’s Ofgem: * OFGEM REQUIRES INTERGEN TO PAY £37M OVER ENERGY MARKET ABUSE * INVESTIGATION FOUND INTERGEN SENT MISLEADING SIGNALS TO NATIONAL GRID ELECTRICITY SYSTEM OPERATOR IN 2016 ABOUT ENERGY IT COULD SUPPLY * INVESTIGATION FOUND INTERGEN SENT MISLEADING SIGNALS TO NATIONAL GRID ELECTRICITY SYSTEM OPERATOR IN 2016 TO MAKE SUBSTANTIAL PROFITS * IMPOSED PAYMENTS AMOUNTING TO £47.8 MILLION (REDUCED TO PAYMENTS OF £37.2M AFTER SETTLEMENT DISCOUNT ON PENALTY LEVIED) ON INTERGEN * FOUND THAT INTERGEN MADE £12.8 MILLION THROUGH ITS “MANIPULATION OF MARKET” Source text for Eikon: Further company coverage:
10.841282041867577," BRIEF-National Grid Says It Has Not Seen Material Impact On Financial Performance From Virus April 2 (Reuters) - National Grid PLC: * NATIONAL GRID PLC - FINANCIAL PERFORMANCE FOR FULL-YEAR, BEFORE ANY COVID-19 IMPACTS, IS EXPECTED TO BE IN LINE WITH PRIOR GUIDANCE * NATIONAL GRID PLC - NOW AIM TO PUBLISH FULL YEAR RESULTS IN MID-JUNE, WITH A PLANNED DATE TO BE CONFIRMED IN DUE COURSE * NATIONAL GRID - NOT SEEN MATERIAL IMPACT ON FINANCIAL PERFORMANCE FROM VIRUS, STARTING TO SEE SOME DELAYS AND DISRUPTION TO CAPITAL PROGRAMME * NATIONAL GRID - IN US, SUSPENDED DEBT COLLECTION AND CUSTOMER TERMINATION ACTIVITIES ACROSS JURISDICTIONS * NATIONAL GRID - FOR DIVIDEND FOR 2019/20 CO TO TAKE INTO ACCOUNT EXPECTED BUSINESS PERFORMANCE, REGULATORY DEVELOPMENTS, ASSESSMENT OF IMPACT OF VIRUS * NATIONAL GRID - COMPARED TO PREVIOUS GUIDANCE, EXPECT HIGHER OPERATING COSTS IN US BUSINESS DUE TO FURTHER STORM REMEDIATION COSTS FOR 2019/20 Source text for Eikon: Further company coverage:"
8.290532364405324," UK's National Grid says it can keep the lights on during coronavirus crisis LONDON, March 18 (Reuters) - Britain’s National Grid has plans in place to keep the lights on throughout the coronavirus outbreak as more people than usual remain at home, it said on Wednesday. “We have well-developed procedures in place to manage the effects of a pandemic and have analysed anticipated effects on electricity supply and demand of mass self-isolation of the UK’s workforce,” the grid operator said. (Reporting by Nina Chestney Editing by David Goodman)"
-12.203894483982095," UPDATE 1-National Grid says Peter Gershon to step down as chairman (Adds background on company, details on Gershon’s re-election from statement) Jan 30 (Reuters) - British energy company National Grid said on Thursday Peter Gershon will step down as chairman after nine years in the position. The FTSE 100 company, which runs Britain’s energy system, said it was looking for Gershon’s successor and that he would stand for re-election at the company’s shareholder meeting in July to ensure smoother transition. Gershon’s plan to leave the company comes after National Grid ran into regulatory troubles in both its domestic and overseas markets. In the UK, investigations into a power outage that left over a million people without power last August raised concerns over how the National Grid’s Electricity System Operator manages the system. National Grid in late 2019 also agreed to pay $36 million in response to an ultimatum from New York Governor Andrew Cuomo and compensate natural gas customers in New York City and Long Island."
-12.203894483982095," UK's National Grid says Peter Gershon to step down as chairman Jan 30 (Reuters) - British energy company National Grid said on Thursday Peter Gershon will step down as chairman after nine years in the role. The FTSE 100 company, which runs Britain’s energy system, added that it has started to look for a replacement. (Reporting by Muvija M in Bengaluru; Editing by Bernard Orr)"
-11.387639252526427," National Grid agrees $431 million of contracts for stabilising UK electricity system LONDON (Reuters) - National Grid's NG.L said on Wednesday it had agreed contracts with five parties worth 328 million pounds ($431 million) over a six-year period for services to manage the stability of its electricity system in Britain. National Grid's Electricity System Operator said the new approach, agreed with Drax DRX.L, Rassau Grid Services, Statkraft [STATKF.UL], Triton and Uniper UN01.DE, will save consumers up to 128 million pounds over the six years. The key service to be provided is what is known as “inertia” on the grid, which helps to keep the electricity system running at the right frequency, National Grid said. Last August, a power outage cut off 1.1 million electricity customers. This was because when 1 gigawatt (GW) of supply went offline there was a large drop in the frequency of electricity running through the grid. Subsequent investigations into the incident also raised concerns about how the National Grid’s Electricity System Operator manages the system. Under the new approach, National Grid said inertia will be achieved without having to provide electricity. This will allow more renewable generation to operate and ensure system stability at lower costs. ""This approach is the first of its kind anywhere in the world and is a huge step forward in our ambition to be able to operate the GB electricity system carbon free by 2025,"" Julian Leslie, ESO Head of Networks said here."
-11.387639252526427," National Grid moves towards reduced carbon emissions with electricity system contract Jan 29 (Reuters) - National Grid’s Electricity System Operator (ESO) said on Wednesday it has agreed contracts with five parties, worth 328 million pounds ($431 million) over a six-year period for a new way to manage the stability of its electricity system. ""This approach is the first of its kind anywhere in the world and is a huge step forward in our ambition to be able to operate the GB electricity system carbon free by 2025,"" Julian Leslie, ESO Head of Networks said here. National Grid’s ESO said the new approach, agreed with Drax , Rassau Grid Services, Statkraft, Triton and Uniper , will save consumers up to 128 million pounds over the six-year period. ($1 = 0.7608 pounds) (Reporting by Noor Zainab Hussain in Bengaluru; Editing by Elaine Hardcastle)"
-11.580378483277052," UPDATE 1-UK's Ofgem to probe National Grid, Scottish Power subsea cable delivery (Adds details on investigation, background) Jan 28 (Reuters) - British energy market regulator Ofgem said here on Tuesday that it opened an investigation into National Grid Plc and Scottish Power's delivery and ongoing operation of the Western HVDC subsea cable. The investigation will review the performance of the two companies in delivering the cable, Ofgem said, adding it will consider whether the late delivery of the cable means they breached a special licence condition, which specifies the expected delivery date. The Western HVDC is a 1.3 billion pound ($1.71 billion)subsea electricity cable that transports electricity between Scotland, Wales and England. Scottish Power is owned by Spain’s Iberdrola. The probe will also consider compliance with a licence condition for the provision of transmission services and with the Electricity Act 1989, which deals with the provision of “economical, efficient and co-ordinated services”, Ofgem said. The investigation will also examine potential breaches relating to the operation of the cable, the regulator said, but added that the opening of this investigation does not imply that it has made any findings about non-compliance. The announcement comes months after National Grid agreed to pay $36 million in response to an ultimatum from New York Governor Andrew Cuomo and compensate natural gas customers in New York City and Long Island that were hurt by a moratorium. The company also ran into trouble in its home market after a blackout caused by a lightning strike left more than a million customers including homes, businesses, a hospital and Newcastle Airport without power. National Grid and Scottish Power did not immediately respond to a request for comment."
14.503253470617523," National Grid to pay $36 million and lift natgas moratorium after NY settlement (Reuters) - National Grid Plc on Monday agreed to pay $36 million in response to an ultimatum from New York Governor Andrew Cuomo and compensate natural gas customers in New York City and Long Island that were adversely impacted by a moratorium. National Grid, which will invest most of that money in new energy conservation and clean energy projects, said in a statement it will immediately lift the moratorium on signing up new gas customers for about two years. National Grid, which owns and operates electricity transmission networks in the United Kingdom, also supplies power and gas to customers in New York and New England in the United States, including about 1.8 million gas customers in New York City and Long Island. At the heart of the conflict was National Grid’s decision in May to impose a moratorium on signing up new gas customers in downstate New York and refusal to reconnect service to more than 1,100 pre-existing clients. The utility blamed New York regulators’ rejection of Williams Cos Inc’s $1 billion Northeast Supply Enhancement gas pipeline project from Pennsylvania to New York and New Jersey, which the blue-chip company was counting on to meet growing demand for gas. “National Grid will pay a significant penalty for its failure to address the supply issue, its abuse of its customers, and the adverse economic impact they have caused,” Cuomo said in a statement. National Grid agreed to settle after Cuomo sent a letter on Nov. 12, threatening to revoke the utility’s certificate to operate its gas franchise in downstate New York for allegedly failing to provide “adequate and reliable service” as required by state law. The governor, who has been pushing utilities to invest in renewable power and energy efficiency programs rather than new fossil-fired infrastructure, gave National Grid 14 days to say how it would fix supply problems. The governor has threatened to revoke other companies’ franchises before, but no utility has ever lost its New York franchise, according to state energy officials. Ratings agency Moody’s placed two of National Grid’s utilities in the United States on review for downgrade on Nov. 18, citing heightened regulatory uncertainty and saying the impact extended to other utilities operating in New York. “The threat to revoke a utility’s license represents a weakening of the consistency and predictability of New York’s utility regulatory environment,” credit rating agency Moody’s said. The ratings agency added that the letter seemed to bypass the regulatory process. National Grid, whose stock was up about 1.3% on Monday, was not the only New York City gas company to impose a moratorium on signing up new gas customers. In January, Consolidated Edison Inc blamed tight gas supplies when it announced it would impose a moratorium on new gas customers in March in parts of Westchester County, located north of New York City. Con Edison also received threats from the governor in 2018 and 2019 that he would revoke the utility’s electric franchise following power outages. It reached agreements with gas pipeline operators to increase the pressure on existing pipes so they can deliver more of the fuel. Con Edison said that should allow it to lift the Westchester moratorium once the new capacity is available around November 2023."
14.503253470617523," National Grid to lift natgas moratorium after NY settlement Nov 25 (Reuters) - National Grid said on Monday it would pay $7 million in compensation for a moratorium on new gas customers in Brooklyn, Queens and Long Island after the utility reached an agreement with the State of New York. National Grid will lift its moratorium for about two years. Its settlement includes a commitment to invest $8 million in energy efficiency programmes and an additional $20 million in clean energy projects, it said. The company had said in May it would not process new applications for natural gas services in its New York City and Long Island service area until Williams Cos Inc’s Northeast Supply Enhancement (NESE) pipeline received the permits it needs to proceed. Since then, New York Governor Andrew Cuomo threatened to revoke its certificate to operate its gas franchise in downstate New York, saying the utility had failed to provide “adequate and reliable service.” (Reporting by Shashwat Awasthi in Bengaluru; editing by David Evans)"
19.54184596413839," UPDATE 2-UK's National Grid looks past regulatory challenges after profit beat * H1 profit above market view * Shares climb more than 1% * CEO does not expect a fine for Aug. 9 blackouts (Adds CEO comments from call) Nov 14 (Reuters) - National Grid said on Thursday it was confident it would be able to address concerns over gas supplies raised this week by governor of New York who warned he could revoke the British firm’s licence to operate in southern parts of the state. The utility, which runs Britain’s energy system and operates a gas franchise in New York City and Long Island, also said it expected to avoid being fined by Britain’s energy regulator over widespread outages in August. It offered the assurances after reporting higher-than-expected half-year profit. Earlier this week, New York Governor Andrew Cuomo threatened to strip National Grid of its licence to supply gas in the city and Long Island, saying that it had failed to provide “adequate and reliable service”. He gave the company 14 days to respond and explain why it should retain the license. National Grid said it continued to work with all parties to find a long term solution to ensure gas supplies and was confident it would be able to satisfactorily address Cuomo’s concerns. The company also ran into trouble in its home market after a blackout caused by a lightning strike left more than a million customers including homes, businesses, a hospital and Newcastle Airport without power. “We did a thorough and detailed investigation...we are not expecting the (regulator) Ofgem will fine us because everything operated as intended and in line with our license and security standards,” Chief Executive Officer John Pettigrew told Reuters. National Grid shares climbed 1.2% to 902 pence by 0921 GMT, outperforming the broader index, which was down 0.4% National Grid reported its underlying profit before tax fell 4% to 785 million pounds ($1 billion) for the six months ended Sept. 30. The result came above the 748 million pound figure that analysts had expected here, with the power company citing the strength of its U.S. business. National Grid also set a new target to reach net zero emissions by 2050 for a cleaner energy future, in line with the country’s goal. It had in 2008 set an 80% reduction plan by 2050. “This objective will be supported by work in other areas, such as offering further energy efficiency programmes for our U.S. customers, proposals for renewable natural gas and hydrogen blending programmes,” Pettigrew said. The pledge follows calls from politicians, corporations and organisations around the world to tackle global warming and the disruption to climate conditions."
19.54184596413839," UK's National Grid posts lower first-half profit Nov 14 (Reuters) - National Grid, which is facing an investigation over a widespread power cut in Britain a few months ago, reported a drop in first-half earnings compared with last year, when it recorded a legal settlement income. Profit before tax at the London-listed grid operator fell 23% to 404 million pounds ($516.96 million) for the six months ended Sept. 30. A year ago, it had received 94 million pounds in legal settlement income at its National Grid Ventures business."
18.957300711222295," N.Y. governor threatens to revoke National Grid's natgas certificate (Reuters) - New York Governor Andrew Cuomo on Tuesday gave UK energy company National Grid Plc 14 days to explain why the state should not revoke the utility’s certificate to operate its gas franchise in downstate New York, saying that it had failed to provide “adequate and reliable service.” The governor, in a statement, cited National Grid’s imposition of a moratorium on new customers, failure to address supply issues and the neglect of the needs of customers. National Grid said in response that it “is in receipt of the letter ... and will review and respond accordingly within the timeframe outlined.” The company said it will “continue to work with all parties on these critical natural gas supply issues on behalf of all our customers in downstate New York.” In May, National Grid announced a moratorium on new gas customers in New York City and Long Island after New York regulators rejected a pipeline that Williams Cos Inc wants to build that will provide gas to National Grid’s downstate customers. Williams has said it hopes New York and New Jersey will ultimately approve the pipe, called Northeast Supply Enhancement (NESE), which would transport about 0.4 billion cubic feet per day of gas from Pennsylvania to New York - enough to supply about 2.3 million homes. In October, National Grid said it would reconnect about 1,000 gas customers in New York City and Long Island following a state order after the utility previously refused to reinstate service, citing short supply. Those were existing customers who had their service turned off for things like renovation or construction, according to local media reports. Cuomo said National Grid has made clear that its only plan for future supply was based on the construction of Williams’ NESE pipeline. “The plan to build such a pipeline was risky at best. The pipeline required multiple regulatory approvals in both states (New York and New Jersey), faced multiple potential legal challenges and construction hurdles,” Cuomo said. The governor said National Grid could have planned to truck or barge more gas into the region to increase supplies and adopted more demand response and energy efficiency programs to reduce usage. National Grid does have a plan to truck liquefied natural gas and compressed natural gas (CNG) to New York and New England to ensure customers have enough gas to heat homes and businesses on the coldest days this winter."
19.59539763279344," National Grid to truck natgas to meet winter demand in New England/New York Nov 12 (Reuters) - National Grid Plc will truck liquefied natural gas (LNG) and compressed natural gas (CNG) to New York and New England to ensure customers have enough gas to heat homes and businesses on the coldest days this winter. The Rhode Island Energy Facility Siting Board last week approved National Grid’s plan to install a temporary LNG vaporization facility in Portsmouth, Rhode Island to provide gas when needed to Aquidneck Island. In January, almost 7,500 customers on Aquidneck Island lost gas supplies during a brutal freeze. Aquidneck Island is home to Newport, Portsmouth and Middletown, Rhode Island. While much of the county is awash in gas with U.S. production at record levels and growing, some gas companies in the Northeast still struggle to meet demand on the coldest winter days. Opposition to buildout of pipeline infrastructure, particularly in New York state, has prevented some areas farther north from accessing booming Appalachian supply,” Daniel Myers, market analyst at Gelber & Associates in Houston, said in a report on Tuesday. In addition to trucking LNG to Rhode Island, National Grid said it plans to transport CNG to Long Island, New York to help meet demand this winter, according to a report by S&P Global Platts. The company has operated temporary LNG and CNG stations in New York and Rhode Island to provide consumers with gas on peak winter days in the past, according to the S&P Global Platts article. National Grid, which has imposed a moratorium on signing up new gas customers in New York City and Long Island, has said it hopes this is a temporary fix while it waits for long-delayed pipeline projects to enter service. Regulators in New York and New Jersey have so far rejected Williams Cos Inc’s proposed $1 billion Northeast Supply Enhancement (NESE) project. Williams, however, has said it hopes to overcome the states opposition and get the pipe built. National Grid, which has agreed to buy gas from Williams’ NESE project, has said it cannot sign up new gas customers until the pipe is allowed to proceed because it would not have access to enough gas to supply the new customers without the new pipe. NESE is designed to transport about 0.4 billion cubic feet per day of gas from Pennsylvania to New York - enough to supply about 2.3 million homes. National Grid serves about 1.8 million customers in New York City and Long Island."
11.791419545408404," UK regulator looks to cut costs of new Hinkley Point grid link (Reuters) - British energy market regulator said it would grant National Grid 637 million pounds ($803.38 million) to build the transmission link for the Hinkley Point C nuclear plant, lower than the company’s initial request for 717 million pounds. Ofgem said on Tuesday consumers will save money under its plans to reduce National Grid Electricity Transmission's (NGET) funding request to connect the new Hinkley Point C nuclear reactor to the grid. bit.ly/2piprDs The regulator’s move comes after EDF said last month that its Hinkley Point C nuclear plant could cost up to 2.9 billion pounds more than its last estimate, and face further delays. Britain needs to invest in new capacity to replace its aging coal and nuclear plants due to close in the 2020s. Once complete, Hinkley C is expected to provide around 7% of the country’s electricity. EDF said Hinkley Point C was estimated to cost 21.5-22.5 billion pounds. EDF initially promised Hinkley C would be powering ovens to cook Britons’ Christmas dinners in 2017 and was originally forecast to cost 18 billion pounds. The 3.2 gigawatt plant, which EDF is building with China General Nuclear Power Corp, is now expected to begin generation at the end of 2025. Ofgem said it cut the allowed funding after rejecting 40 million pounds in “risk funding” that NGET had sought to be included in the upfront cost of the link. NGET may be in a position to seek additional funding for some risks, such as extreme weather or widespread flooding, if they are efficiently managed and take place during construction, Ofgem added. Ofgem said it had planned to use the new “Competition Proxy” funding model to fund the link, but updated analysis showed that this may no longer deliver the best savings for consumers. Ofgem plans to use its network price control framework to allow NGET to fund the investment and recoup the cost from consumers’ energy bills over 45 years. The regulator now plans to use the next network price control which takes effect from March 2021-2026 known as RIIO2. Bernstein analysts called Ofgem’s move “positive”. National Grid, which was granted permission to work on the station in 2018, said it would look to provide further evidence to Ofgem to support its view of the capital costs for the Hinkley-Seabank project, meant to allow for the safe connection of the nuclear power station. “While we welcome Ofgem’s minded-to position not to proceed with the Competition Proxy Model (CPM) for this project, we continue to question the value of the CPM,” National Grid said in a separate statement. At the time, the Hinkley-Seabank project was forecast to cost 650 million pounds. Ofgem said it would make a final decision on the allowed cost and whether to use the RIIO2 price control model following a six-week consultation period."
11.791419545408404," UK regulator looks to cut costs of new Hinkley Point grid link Oct 15 (Reuters) - British energy market regulator Ofgem said it would grant National Grid Plc 637 million pounds ($803.38 million) to build the transmission link for the Hinkley Point C nuclear plant, lower than the company’s initial request for 717 million pounds. Ofgem said on Tuesday consumers will save money under its plans to reduce National Grid Electricity Transmission's (NGET) funding request to connect the new Hinkley Point C nuclear reactor to the grid. (bit.ly/2piprDs) Ofgem’s move comes after EDF said last month that its Hinkley Point C nuclear plant could cost up to 2.9 billion pounds more than its last estimate, and face further delays. ($1 = 0.7929 pounds) (Reporting by Noor Zainab Hussain in Bengaluru; Editing by Shounak Dasgupta)"
