-2.603610063064311," WRAPUP 2-Loan growth drives profit beat at Royal Bank of Canada, TD Bank (Adds shares, provisions for loan losses, analyst quotes) * RBC books 9% loan growth, at TD up 3% * Provisions jump at RBC, TD, weigh on shares * RBC shares down over 2%, TD trims early gains May 23 (Reuters) - Two of Canada’s largest lenders beat analysts’ estimates for quarterly profits on Thursday, as strong loan growth boosted their retail banking businesses and interest income. But shares of both Royal Bank of Canada and Toronto-Dominion Bank were pressured in midday trading as investors focussed in on the spike in loan loss provisions, which rose 55% at RBC, and 14% at TD Bank. RBC also gave a cautious outlook for net interest margins (NIM). On a post-earnings conference call, bank executives said NIM is expected to be relatively flat over the next several quarters, given the outlook for interest rates. The Canadian central bank and the U.S. Federal Reserve have paused rate hikes after raising them multiple times since July 2017. In the reported quarter, higher interest rates in Canada and the United States helped improve NIMs at the banks, as they earned more from loans than they paid out on deposits. Total loans at RBC jumped 9% in the second quarter, while at TD, they rose 3%, with home, personal and business lending showing growth. In contrast, smaller bank Canadian Imperial Bank of Commerce reported negligible quarterly loan growth on Wednesday. Its home loans business declined 0.5%. Residential mortgage loan growth has been a focus for investors following stringent regulatory changes that require borrowers of uninsured mortgages to be stress-tested to check their ability to repay. “Regulatory changes have helped some of Canada’s major housing markets stabilize, particularly in Ontario and to the East. Western Canadian markets remain under downward pressure,” said David McKay, chief executive officer of RBC. Loans grew not only in the domestic markets, but also in the U.S., where both the banks have sizeable businesses. “RBC is showing decent domestic loan growth and strong growth south of the border,” said John Aiken, an analyst with Barclays, while at TD, “underlying retail loan growth remains strong on both sides of the border.” Net income at RBC’s personal and commercial banking division rose 6% from a year earlier, while TD’s domestic retail banking income rose 5.6%. “Overall, we view the earnings at RBC and TD as strong...,” DBRS analyst Robert Colangelo said. Capital markets results, including investment banking, advisory and trading, were mixed. Trading rose at RBC on “improved market conditions and increased client activity,” while it fell at TD due to “challenging market conditions and reduced client activity.” At CIBC, it was the only bright spot in an otherwise muted quarter. Top investment banks in the U.S. reported huge declines in equities trading in the most recent quarter as tepid markets, due to the U.S.-China trade war, crimped activity. RBC's adjusted earnings per share of C$2.23 beat analyst estimates of C$2.21, while TD's C$1.75 per share profit beat estimates by 8 Canadian cents. (reut.rs/2JXVLU9) RBC’s shares fell over 2% in trading around noon, while TD gave up some early session gains."
-2.603610063064311," UPDATE 2-Royal Bank of Canada, TD Bank profit beats view, powered by loan growth (Adds TD’s results, background, CIBC, analysts’ comparisons) May 23 (Reuters) - Royal Bank of Canada and Toronto-Dominion Bank beat analysts’ estimates for quarterly profits on Thursday, as strong loan growth bolstered their retail banking businesses and interest income. Higher interest rates in Canada and the United States also gave a boost to net interest margins at Canada’s two biggest banks, as they earned more from loans than they paid out on deposits. Since July 2017, the Central Bank of Canada has raised key interest rates five times, while the U.S. Federal Reserve has increased rates six times. At RBC, total loans rose around 9%, while at TD, they rose 3%, with all home, personal and business loans showing growth. Smaller bank Canadian Imperial Bank of Commerce, which reported its second-quarter results on Wednesday, posted negligible growth in total loans. Its residential mortgage loans fell. Net income at RBC’s personal and commercial banking division, which provides loans and other financial products across Canada, rose 6% from a year earlier, while TD’s domestic retail banking income rose 5.6%. Trading rose at RBC on “improved market conditions and increased client activity,” while at TD, the overall trading fell due to “challenging market conditions and reduced client activity.” Markets trading was the only bright spot at CIBC. Top U.S. investment banks reported huge losses from equities trading in the most recent quarter as tepid markets, due to the U.S.-China trade war, crimped activity. RBC's adjusted net income available to shareholders rose 6% to C$3.16 billion, or C$2.23 per share, beating analysts' estimates of C$2.21 per share, according to Refinitiv IBES data. (reut.rs/2JXVLU9) TD’s net income, excluding special items, rose 6.7% to C$3.27 billion, or C$1.75 per share, ahead of analysts’ estimates of C$1.67 per share, according to Refinitiv IBES data. Smaller rival CIBC on Wednesday missed quarterly profit estimates. ($1 = 1.3474 Canadian dollars) (Reporting By Aparajita Saxena and Bharath Manjesh in Bengaluru; Editing by Sriraj Kalluvila and Shinjini Ganguli)"
-2.603610063064311," Royal Bank of Canada profit rises 6% on retail banking growth May 23 (Reuters) - Royal Bank of Canada reported a 6% rise in adjusted quarterly profit on Thursday, lifted by growth in its retail banking and capital markets businesses. Adjusted net income available to shareholders rose to C$3.16 billion ($2.35 billion), or C$2.23 per share, in the second quarter ended April 30, from C$2.98 billion, or C$2.10 per share, a year earlier. (reut.rs/2JXVLU9) Analysts had expected Canada’s biggest lender by market cap to report earnings per share of C$2.17, according to Refinitiv IBES data. It was not immediately clear if the numbers were comparable. Smaller rival CIBC on Wednesday missed quarterly profit estimates due to sluggish loan growth and higher loan loss provisions."
5.4139579808982115," RBC CEO says Canada losing some of its economic spark TORONTO (Reuters) - The chief executive of Royal Bank of Canada, the country’s biggest lender by market value, said on Thursday that Canada’s struggle to compete with global peers is hurting its ability to grow the economy. Canada, a G7 economy, has suffered in recent years from low productivity growth, lackluster foreign direct investment and difficulty in bringing oil, one of its major exports, to market due to a lack of pipeline capacity. The Liberal government, which faces a general election in October, has committed to major infrastructure investment and has allowed businesses to write off additional capital investments to make them more competitive, but has opted not to match aggressive tax cuts by the United States. “Our competitiveness is challenged. Our capacity to grow and advance our economy is stalling,” said RBC Chief Executive Dave McKay, in prepared remarks for shareholders at the company’s 150th annual meeting, in Halifax, Nova Scotia. “When I travel overseas, I often hear concerns from investors about Canada’s falling position in the world,” McKay said. RBC has a market capitalization of about C$149 billion ($111.70 billion), according to Refinitiv Eikon data. Data last month for the fourth quarter showed that Canada’s economy barely grew due to plunging Canadian crude oil export prices and that the labor productivity of Canadian businesses fell by 0.4 percent. Steps that Canada can take to improve its competitiveness include building digital and physical infrastructure, such as energy pipelines, McKay said. Due to a lack of pipeline capacity, the price of Canadian heavy crude fell last October to a discount of more than $50 a barrel below the benchmark for U.S. oil. A Canadian court last August overturned approval of the Trans Mountain oil pipeline expansion. The government has since bought the pipeline in an effort to save the project."
0.7853262234443872," Royal Bank of Canada forms C$7 bln real estate partnership March 12 (Reuters) - Royal Bank of Canada will form a real estate investment partnership with property assets worth over C$7 billion ($5.24 billion), the country’s largest lender said in a statement on Tuesday. The agreement was between RBC Global Asset Management Inc, pension fund manager British Columbia Investment Management Corp (BCI) and real estate developer QuadReal Property Group. The bank also said it would set up a real estate fund, which will be open for investment in the third quarter. “Institutional clients are increasingly looking to alternative investment opportunities, and especially private market assets, to help them meet their long-term goals,” said Damon Williams, who heads RBC Global Asset Management. ($1 = 1.3371 Canadian dollars) (Reporting by John Benny in Bengaluru; Editing by Shailesh Kuber)"
2.260480095538996," Royal Bank of Canada's earnings rise despite weak capital markets TORONTO (Reuters) - Royal Bank of Canada on Friday said first-quarter earnings rose in line with market expectations, as growth in personal and commercial banking offset lower earnings at its capital markets division. Canada’s biggest lender by market value said earnings per share grew by 7 percent in the quarter to Jan. 31 to C$2.15. Adjusted earnings per share were C$2.19, in line with the average analyst forecast according to IBES data from Refinitiv. Net income rose by 5 percent to C$3.17 billion ($2.40 billion), the bank said. That included growth of 3 percent at its personal and commercial banking business, helped by increased sales and improved margins thanks to higher Canadian interest rates. Like other Canadian banks, RBC has benefited from the Bank of Canada raising rates five times since July 2017. However, net income at the bank’s capital markets division declined by 13 percent due to an increase in funds set aside to cover bad loans and a decline in revenue from corporate and investment banking due to challenging market conditions. Global stock markets declined during the period due to investor concerns about rising interest rates and escalating trade tensions between the U.S. and China. “This quarter the markets were choppy, weak in the first half of the quarter and strong in the second half of the quarter,” Chief Financial Officer Rod Bolger said in an interview. Shares in the bank have underperformed the Toronto Stock Exchange’s banks index so far this year, partly due to concerns over the outlook for capital markets, which make up a higher proportion of its earnings than rival Canadian banks. Shares in RBC were down 1 percent in mid-morning trade, underperforming the TSX banks index which fell 0.1 percent. “We don’t believe that these result will drive any catch-up versus peers in the near term,” said Eight Capital analyst Steve Theriault. Net income at the bank’s wealth management business was unchanged from a year ago, RBC said, with increased sales offset by higher costs and increases in funds set aside to cover bad loans. Net income at the bank’s insurance business rose by 31 percent from a year ago, partly reflecting lower claims costs. RBC was the first of Canada’s big banks to report first-quarter earnings. Its largest rival, Toronto-Dominion Bank, reports first-quarter earnings next Thursday."
2.260480095538996," CORRECTED-UPDATE 2-RBC posts 7 percent increase in first quarter earnings (Corrects net income in bullet point to 5 percent from 2 pct) * Q1 EPS C$2.19, in line with market forecasts * Net income up 5 percent to C$3.17 billion TORONTO, Feb 22 (Reuters) - Royal Bank of Canada on Friday reported a 7 percent rise in earnings in the first quarter, with growth in personal and commercial banking partially offset by lower earnings at its capital markets division. Canada’s biggest lender by market value said earnings per share rose to C$2.15 in the three months to Jan. 31. Adjusted earnings per share were C$2.19, in line with analysts’ expectations, according to IBES data from Refinitiv. Chief Executive Dave McKay said the bank had delivered solid results against a challenging market backdrop. The bank said net income rose 5 percent to C$3.17 billion ($2.40 billion) during the period. That included growth of 3 percent at its personal and commercial banking business, helped by increased sales and improved margins thanks to higher Canadian interest rates. Like other Canadian banks, RBC has benefited from the Bank of Canada raising rates five times since July 2017. The bank said net income at its capital markets division declined by 13 percent during the period due to an increase in funds set aside to cover bad loans and a decline in revenue from corporate and investment banking due to challenging market conditions. Global stock markets declined during the period due to investor concerns about rising interest rates and escalating trade tensions between the U.S. and China. Net income at the bank’s wealth management business was unchanged from a year ago, RBC said, with increased sales offset by higher costs and increases in funds set aside to cover bad loans. Net income at the bank’s insurance business rose by 31 percent from a year ago, partly reflecting lower claims costs."
2.260480095538996," CORRECTED-Royal Bank of Canada posts 7 percent rise in quarterly earnings (Corrects to show earnings per share rose by 7 percent (not 2 percent), net income rose by 5 percent (not 2 percent)) TORONTO, Feb 22 (Reuters) - Royal Bank of Canada on Friday reported a 7 percent rise in first-quarter earnings, with growth in wealth management and personal & commercial banking offset by lower earnings at its insurance and capital markets divisions. Canada’s biggest lender by market value said earnings per share rose to C$2.15 in the three months to Jan. 31. Earnings per share, excluding one-off items, were C$2.19. Net income rose by 5 percent to C$3.17 billion ($2.40 billion)."
7.535724795473872," RBC lowers five-year fixed mortgage rate - The Globe and Mail Jan 16 (Reuters) - Royal Bank of Canada has become the first major Canadian bank to cut its five-year fixed mortgage rate, The Globe and Mail reported on Wednesday. The Canadian lender cut its five-year fixed mortgage rate to 3.74 percent from 3.89 percent, the report tgam.ca/2CunAhQ said. RBC did not immediately respond to a request for comment outside regular business hours. (Reporting by Kanishka Singh in Bengaluru; Editing by Sandra Maler)"
6.429075104361491," UPDATE 1-MOVES-Rob Lamb to head RBC European corporate DCM (Adds background) LONDON, Jan 10 (IFR) - Rob Lamb has been promoted to head of European corporate debt capital markets at Royal Bank of Canada following Christoph Seibel’s departure, according to a source familiar with the matter. Lamb moves up to the role after Seibel left, following six years in the job, to join Mizuho Securities Europe as chief executive based in its Frankfurt Brexit hub (see related content). Lamb has been head of UK corporate debt capital markets since 2014, having joined from HSBC and reports to Sean Taor, head of DCM."
6.429075104361491," MOVES-Rob Lamb to head RBC European corporate DCM LONDON, Jan 10 (IFR) - Rob Lamb has been promoted to head of European corporate debt capital markets at Royal Bank of Canada following Christoph Seibel’s departure, according to a source familiar with the matter. Lamb moves up to the role after Seibel left to join Mizuho Securities Europe as chief executive (see related content). Lamb has been head of UK corporate debt capital markets since 2014, having joined from HSBC."
6.71581487164621," Instant View: Canada's economy posts 2.0 percent annualized growth in third quarter TORONTO (Reuters) - Canada’s economy grew at an annualized rate of 2.0 percent in the third quarter, in part due to higher export volumes and strength in mining and petroleum refineries, Statistics Canada said on Friday. Market reaction: CAD/ LINK: here “Two (percent) is sort of in line with estimates. ... A bit more worrying, though, is the monthly detail showing an unexpected decline in September, setting us up for a fairly weak fourth quarter situation being compounded by the postal strike and the fall-off in oil prices.” “In terms of impact on the Bank of Canada, the third quarter numbers would be in line with their forecast but a further weakening might be a bit less positive in terms of their outlook for the economy. However, I think it reinforces a gradual pace of tightening, dependent on the data and the extent of slowing that we see in the fourth quarter, and some sense of whether that slowing’s going to be sustained or whether it’s going to bounce back as we move into 2019.” “It is not a great batch of data. We did see a little bit more weakness from the oil patch in the September figures than we were expecting. We thought that would be more concentrated in October, so perhaps the negative print on the September industry level GDP number isn’t as negative as it looked at first glance.” At the same time, if you look at the Q3 data as a whole, we had a big drawdown in business investment, we did see the deceleration in consumption activity, it’s not a great mix of data.” “I do think if you are looking at this mix of data knowing that you are probably going to have a weak Q4, you do have to start asking questions about if the Bank of Canada is going to be able to throw caution to the wind a bit and lift rates in January or maybe they are going to want to wait a bit til March.” “The headline numbers are no surprise whatsoever. If anything, the quarterly number was a touch better than some expected, like the Bank of Canada.” “September surprised a bit by declining 0.1 percent, which doesn’t give us a very good lead in to the 4th quarter... It wasn’t a big surprise but there was some notable softness in domestic spending, especially in business investment. “I’d be shocked if the bank did anything with the rates next week... The issue is in January. The market is mostly assuming the bank will hike rates at that meeting. I continue to believe it’s a closer call than the market is priced for. Today’s news reinforces that message.”"
5.705789589279645," Royal Bank of Canada eyes further margin gains in 2019 TORONTO (Reuters) - Royal Bank of Canada RY.TO said it anticipated margins will continue to improve next year after reporting a forecast-beating 17 percent jump in fourth-quarter earnings on Wednesday. RBC has benefited from the Bank of Canada raising interest rates five times since last summer, helping it improve its net interest margin (NIM), the difference between the interest it gets from borrowers and what it pays to savers. The bank posted earnings per share of C$2.20 in the three months to Oct. 31, ahead of a consensus analyst forecast of C$2.12, according to IBES data from Refinitiv. It benefited from growth at its Canadian retail and wealth management businesses. Shares in RBC, Canada’s biggest lender by market value, were up 1.6 percent in mid-morning trading. “The solid headline beat, good operating trends in Canadian banking and resilient underwriting in capital markets are encouraging,” said Eight Capital analyst Steve Theriault. The bank reported a 15 percent increase in net income to C$3.25 billion ($2.45 billion) during the quarter. That included a 10 percent rise in net income from retail banking to C$1.54 billion, benefiting from improved margins and growth in residential mortgages, commercial lending and deposits. RBC lifted its net interest margin by 12 basis points over the course of 2018 to 2.77 percent and Chief Financial Officer Rod Bolger said it is forecasting an average 1-2 basis point rise in its NIM during each quarter next year, resulting in a 4-8 basis point improvement across the year. Bolger said that forecast takes into account increasing competition for deposits. Analysts have said an emerging price war between banks could crimp profits going forward. “Competition for deposits has always been strong,” Bolger said in an interview. “As rates increase, deposits become more valuable for both banks and consumers so I think it’s quite healthy that there’s deposit competition.” RBC reported a 13 percent increase in net income at its wealth management business to C$553 billion, reflecting higher average fees from clients. Net income from insurance rose 20 percent from a year ago to C$318 million. The bank’s investment banking business increased net income by 14 percent from a year ago to C$666 million, driven by beneficial U.S. tax reforms and higher trading revenue arising from market volatility. For the full year, RBC reported record net income of C$12.4 billion, up 8 percent on the year before."
5.705789589279645," Royal Bank of Canada quarterly earnings beat market forecasts TORONTO, Nov 28 (Reuters) - Royal Bank of Canada on Wednesday reported a forecast-beating 17 percent jump in fourth-quarter earnings, helped by growth in its retail banking and wealth management divisions. Canada’s biggest lender posted earnings per share of C$2.20 in the three months to Oct. 31, ahead of a consensus analysts’ forecast of C$2.12, according to IBES data from Refinitiv. (Reporting by Matt Scuffham Editing by David Goodman)"
2.207510687263153," Bank of Canada raises rates, might speed up pace of future hikes OTTAWA (Reuters) - The Bank of Canada on Wednesday raised interest rates as expected and said it might speed up the pace of future hikes given the economy was running at almost full capacity and did not need any stimulus. The central bank, which has now lifted rates five times since July 2017, also hailed the signing of a new North American trade pact it forecast would reduce economic uncertainty. The bank tweaked its standard language on future hikes, dropping previous references to a gradual pace of tightening. Senior officials said markets had misread the use of the word “gradual” to infer that the bank would only raise rates at every other scheduled meeting it holds to discuss policy. The bank announces rates eight times a year, on fixed dates. “It’s possible the pace could be a bit faster but it’s also possible it could be a bit slower,” the bank’s senior deputy governor Carolyn Wilkins told a news conference, saying future moves would depend heavily on economic data. The rate increase, by a quarter of a percentage point, took the bank’s overnight interest rate to 1.75 percent, still well below the “neutral” rate of 2.5 to 3.5 percent where monetary policy is neither stimulative nor accommodative. The bank, noting the U.S. economy was “especially robust,” boosted its estimate of third-quarter annualized Canadian economic growth to 1.8 percent from 1.5 percent. Growth in the fourth quarter should jump to 2.3 percent, it added. “The economy is running at its capacity and it is no longer needing stimulus. And so it’s our job to prevent the thing from overheating and creating inflation pressures down the road,” said Bank of Canada Governor Stephen Poloz. The news helped push the Canadian dollar up to a one-week high of C$1.2969 to the U.S. dollar, or 77.11 U.S. cents, and opened the possibility of another hike on Dec. 5. “They are teeing up another run at it in December ... They are signaling a more urgent sense that they have to get up to neutral quicker than the markets were pricing,” said Derek Holt, senior vice president of capital markets economics at Scotiabank. Three major Canadian main street banks -- Royal Bank of Canada, Toronto-Dominion Bank and Bank of Montreal -- all quickly announced they were raising their prime lending rates to 3.95 percent from 3.70 percent. The central bank noted positive developments in two areas of potential risk. Trade uncertainty in North America will diminish after the United States, Canada and Mexico agreed on a new continental trade agreement on Sept. 30, it said. It also noted households were adjusting spending as expected in response to higher interest rates and housing market policies. The bank has long fretted about Canadians’ ability to cope with higher borrowing costs. On a more gloomy note, it said trade tensions between the United States and China were weighing on global growth and commodity markets and “could have a significant and lasting impact on the global economy.” The bank said overall inflation should drop in early 2019 as the effect of temporary factors fades and then remain at around 2.0 percent - the mid point of its 1 to 3 percent target range - through the end of 2020."
2.207510687263153," RBC makes new appointments to European real estate team (Reuters) - Royal Bank of Canada said on Wednesday Charlie Foster and Andrew Penny from Canaccord Genuity have joined its European real estate team within its investment bank. Foster, who served as Canaccord’s head of real estate banking and broking, will become managing director and head of European real estate at RBC. Penny, who will be senior adviser, European real estate at RBC, previously held similar positions at Ernst & Young and Canaccord. RBC also said Julian Livingston-Booth will join its equity research team as director and head of European real estate research, after having spent 18 years at Goldman Sachs."
