15.900110316874146," UPDATE 1-AG unit seeks ruling to prevent RBC from auctioning off mortgage debt (Adds details of market disruptions, context) March 25 (Reuters) - An AG Mortgage Investment Trust unit on Wednesday sought to prevent Royal Bank of Canada (RBC) from auctioning off nearly $11 million of its commercial mortgage-backed securities the lender is a counterparty to, according to a court filing. RBC, Canada’s biggest bank, and other lenders have taken advantage of lack of liquidity created by a flight of investors from non-government-debt to mark down these assets and “to trigger widespread margin calls,” AG MIT CMO, the AG subsidiary, said in a request for a temporary restraining order and injunction filed in the U.S. Southern New York District Court. A RBC spokeswoman declined to comment. Mortgage real estate investment trusts (REITs) have been savaged recently as recession fears driven by the new coronavirus outbreak spurred risk aversion and concerns about home loan defaults, prompting a deluge of margin calls from lenders. The exclusion of some parts of the mortgage-backed debt market from the Federal Reserve’s stimulus measures has prompted criticism by investors and warnings that the U.S. commercial real estate mortgage market is on the brink of collapse. Mortgage REITs like AG fund operations by selling mortgage bonds to lenders in exchange for short-term loans, with an agreement to repurchase them at a pre-determined price on an agreed-upon date. A decline in the securities’ market values prompts demands from the lenders for additional payments, known as margin calls. RBC issued margin calls to AG on Monday, AG said in the filing. On Tuesday, AG learned that RBC intended to conduct a CMBS auction on Wednesday at 11 a.m. EST, including AG’s bonds, according to the filing. It was unclear if the auction went ahead. A lawyer for AG did not immediately respond to requests seeking comment. Such an auction would “likely precipitate a chain reaction of other banks being pressured to foreclose on other (mortgage real estate investment trusts’) pledged securities, all at prices informed by the fire sale that Defendants seek to hold,” AG said in the filing. The Wall Street Journal earlier reported that RBC was seeking bids on Wednesday for more than $600 million of debt tied to commercial mortgages. AG on Monday reported an “unusually high” number of margin calls from financing counterparties. It said that it did not expect to be able to fund the anticipated volume of future margin calls, and that it was discussing agreements with counterparties to hold off on exercising their rights. (Reporting By Nichola Saminather in Toronto and Brendan Pierson in New York; Editing by Denny Thomas and Cynthia Osterman)"
15.900110316874146," AG Mortgage seeks to prevent RBC from auctioning off mortgage debt March 25 (Reuters) - AG Mortgage Investment Trust on Wednesday sought a court order to prevent Royal Bank of Canada (RBC) from auctioning off nearly $11 million of commercial mortgage-backed securities that serve as collateral for defacto loans to AG, according to a court filing. RBC, Canada’s biggest lender, and other banks have taken advantage of illiquidity due to a market selloff to mark down these assets and “to trigger widespread margin calls,” AG said in a request for a temporary restraining order and injunction filed in the U.S. Southern New York District Court. A RBC spokeswoman declined to comment. (Reporting By Nichola Saminather in Toronto and Brendan Pierson in New York; Editing by Cynthia Osterman)"
10.30799651654206, BRIEF-Royal Bank of Canada Announces Temporary Branck Closures To Slow COVID-19 Spread March 17 (Reuters) - Royal Bank of Canada: * TO SLOW THE SPREAD OF COVID-19 RBC ANNOUNCES TEMPORARY BRANCH CLOSURES * RBC ROYAL BANK - TEMPORARY CLOSURES WILL NOT IMPACT EMPLOYEE JOB SECURITY Source text for Eikon: Further company coverage:
4.599211133632398," K+S advised by Deutsche Bank, RBC for sale of salt business: sources FRANKFURT (Reuters) - K+S SDFGn.DE is being advised by Deutsche Bank DBKGn.DE and Royal Bank of Canada (RBC) RY.TO as the German mineral miner plans to sell its salt business in North and South America, two people familiar with the matter told Reuters on Wednesday. K+S said earlier on Wednesday it would sell the business, which accounts for more than a third of group sales, to slash its debt pile and focus on potash fertilizer products. K+S and Deutsche Bank declined to comment while RBC did not immediately respond to a request for comment."
4.599211133632398," K+S advised by Deutsche Bank, RBC for sale of salt business-sources FRANKFURT, March 11 (Reuters) - K+S is being advised by Deutsche Bank and Royal Bank of Canada (RBC) as the German mineral miner plans to sell its salt business in North and South America, two people familiar with the matter told Reuters on Wednesday. K+S said earlier on Wednesday it would sell the business, which accounts for more than a third of group sales, to slash its debt pile and focus on potash fertiliser products. K+S and Deutsche Bank declined to comment while RBC did not immediately respond to a request for comment. (Reporting by Arno Schuetze, Ludwig Burger and Patricia Weiss)"
5.00625418454393," UPDATE 1-RBC CEO sees 'fairly material short-term impact' from measures to control coronavirus TORONTO, March 10 (Reuters) - Royal Bank of Canada Chief Executive Officer Dave McKay said on Tuesday “fairly material short-term impact” from global measures to contain the coronavirus outbreak is likely, although the economic effects remain difficult to predict. But he warned that interest rate cuts alone may not be sufficient to deal with the situation after Canadian and U.S. central banks last week cut key rates by 50 basis points to gird against the fallout of the outbreak. “I don’t think purely monetary rate cuts are going to satisfy the disruption,” McKay said, adding that there are ongoing dialogues with governments around the world around coordinated and targeted fiscal stimulus. On Monday, RBC confirmed that one of its employees had tested positive for the coronavirus. Canadian banks including RBC have joined global counterparts in splitting their trading operations to reduce disruptions due to the outbreak. “An abundance of caution is appropriate as we try to figure out how to get global control” of the coronavirus, McKay said at the RBC Capital Markets Financial Institutions Conference in New York, which was held as a remote event due to the outbreak. More than 114,000 people have been infected with the virus and over 4,000 have died, according to a Reuters tally of government announcements. Airlines and tourism have been particularly hard hit, and global supply chains have been disrupted as a result of the outbreak. McKay said he envisions three economic impact scenarios: where the crisis is contained within four to six weeks, leading to a V- or U-shaped economic recovery; where the disruptions remain for six to eight months, slowing demand and hitting industries; and the worst-case scenario, where it continues for a prolonged period. “I don’t think any of us really know yet which of those variations and hybrids of those scenarios will come into play,” he said. U.S. President Donald Trump said he will discuss a payroll tax cut with congressional Republicans on Tuesday as part of efforts to protect against the impact of the outbreak. Despite the expectation of more interest rate cuts, McKay said a fall into negative rates appears unlikely in the United States and Canada. There are “large questions about whether (negative rates) have been effective or not in the European experiment,” he said. “I get the sentiment from central bankers that we’d have to expend all coordinated fiscal and monetary stimulus down to zero before we’d consider negative rates.” (Reporting By Nichola Saminather Editing by Chizu Nomiyama and Steve Orlofsky)"
5.00625418454393," RBC CEO sees 'fairly material' short-term impact from measures to control coronavirus TORONTO, March 10 (Reuters) - A “fairly material short-term impact” from global measures to contain the coronavirus outbreak is likely, although the economic effects remain difficult to predict, Royal Bank of Canada Chief Executive Officer Dave McKay said on Tuesday. “An abundance of caution is appropriate as we try to figure out how to get global control” of the coronavirus, McKay said at the RBC Capital Markets Financial Institutions Conference in New York, which was held as a remote event due to the outbreak. McKay said he envisions three scenarios: one where the crisis is contained within four to six weeks, leading to a V- or U-shaped economic recovery; one where the disruptions remain for about six to eight months and the precautions slow demand and affect a number of industries; and the worst-case scenario, where it goes on for a prolonged period. “I don’t think any of us really know yet which of those variations and hybrids of those scenarios will come into play,” he said. (Reporting By Nichola Saminather Editing by Chizu Nomiyama)"
-1.9558662395669946," RBC to cut Canada prime rate to 3.45%, rivals follow (Reuters) - Royal Bank of Canada RY.TO said on Wednesday it would cut its prime rate to 3.45% from 3.95% in its first reduction since July 2015, with the country's other lenders expected to follow suit, even as the moves weigh on margins already under pressure. Canada’s biggest lender announced the move, which will take effect on Thursday, after the Bank of Canada cut benchmark rates by 50 basis points on Wednesday to help tackle a coronavirus outbreak and said it was ready to cut again. Following suit, Bank of Nova Scotia BNS.TO, Toronto-Dominion Bank TD.To, Bank of Montreal BMO.TO and Canadian Imperial Bank of Commerce (CIBC) CM.TO also said they would cut the rate to 3.45%. The central bank’s cut is “well in advance of the banks’ expectations,” said Rob Colangelo, senior vice president for credit ratings at DBRS Morningstar. The Bank of Canada’s reduction, following a similar move by the U.S. Federal Reserve on Tuesday, will lead to margin compression at or slightly above the higher end of the 1-to-2 basis-point-per-quarter range expected by the banks at the end of fiscal 2019, Colangelo said. The last two times the Bank of Canada lowered rates, in January and July of 2015, the banks passed on only 30 basis points of the 50-basis-point cuts. But the major banks matched the central bank’s three quarter-percentage-point increases in 2018. “They’re choosing to err on the side of caution and put more stimulus into the economy,” said John Kinsey, portfolio manager at Caldwell Securities. “But it will squeeze them.” The economic growth spurred by the cut would improve loan growth, but it “likely won’t be enough to offset net interest margin compression,” said Laura Lau, chief investment officer at Brompton Group. Canadian banks are somewhat protected by their skew toward more fixed-rate loans, said Gabriel Dechaine, an analyst at National Bank Financial (NBF), contrary to the dominance of variable rates in the U.S. “It’s not an immediate hit when the central bank cuts,” Dechaine, who expects the cuts to result in a 1% to 2% reduction in his earnings estimates for the major banks. The decline in margins would be driven more by commercial loan portfolios, which price more frequently, Colangelo said. Banks have been growing their business loan books at double-digit rates recently. The Fed’s rate cut would weigh more on Canadian banks’ U.S. operations, Dechaine said in a note on Tuesday. Canadian banks experienced 43 basis points of average net interest margin compression following the Fed’s three rate cuts in 2019, he said. Canadian banks' earnings could fall by between 0.6% to 1.5% in the next two quarters, with the more U.S.-focused TD Bank TD.TO and Bank of Montreal BMO.TO taking the biggest hits, he said."
-5.624505648517601," RBC first to cut Canada prime rate to 3.45% March 4 (Reuters) - Royal Bank of Canada cut the prime rate for Canadian borrowers to 3.45% from 3.95% on Wednesday, the first reduction since July 2015, kicking off a raft of expected cuts in response to the Bank of Canada’s 50-basis-point interest rate cut. Canada’s other banks are expected to follow suit. The lenders in 2018 incorporated into their prime rates the full extent of the central bank’s three interest rate increases. (Reporting By Nichola Saminather; Additional reporting by Bharath Manjesh; Editing by Shailesh Kuber)"
-26.457154032337964," Royal Bank of Canada profit jumps 11% Feb 21 (Reuters) - Canada’s biggest lender, Royal Bank of Canada reported a nearly 11% rise in quarterly profit on Friday, boosted by growth in its capital markets, and personal and commercial banking units. Net income rose to C$3.51 billion, or C$2.40 per share, in the first quarter ended Jan. 31, from C$3.17 billion, or C$2.15 per share, a year earlier. RBC is the first of Canada’s big banks to report first-quarter earnings. (Reporting by C Nivedita in Bengaluru and Nichola Saminather in Toronto; Editing by Shinjini Ganguli)"
-22.06695600809221," CORRECTED-RBC has no plans to take any restructuring charges: CEO (Corrects percentage of workforce cuts at BMO in third paragraph) TORONTO, Jan 7 (Reuters) - Royal Bank of Canada has no plan to take any restructuring charges, Chief Executive Officer Dave McKay said on Tuesday, following a C$357 million ($274.7 million) charge that Bank of Montreal took in the fourth quarter. “If we were to take a restructuring charge, we would have taken it in Q4,” McKay said at the RBC Canadian Bank CEO conference. BMO took the charge as part of its push to reduce its workforce by 5%, or about 2,300 employees, and increase efficiencies."
-3.977088191237297," Royal Bank of Canada profit falls marginally Dec 4 (Reuters) - Royal Bank of Canada reported a nearly 1% fall in quarterly profit on Wednesday, hurt by higher loan loss provisions. Net income fell to C$3.2 billion, or C$2.18 per share, in the fourth quarter ended Oct. 31, from C$3.25 billion, or C$2.22 per share, a year earlier."
10.430922165267683," RBC, TD Bank to pay C$24.5 million to settle forex trading charges: regulator TORONTO (Reuters) - Royal Bank of Canada and Toronto-Dominion Bank have agreed to pay a combined C$24.5 million ($18.5 million) to settle charges of foreign exchange trading malpractices brought against the Canadian banks by a regulator, following a settlement hearing held on Friday. In separate statements of allegations, the Ontario Securities Commission (OSC) said this week that TD and Royal Bank of Canada had failed to have sufficient supervision and controls in their foreign exchange trading businesses from at least 2011 to 2013. “The settlement will send a clear message to firms about the importance of promoting a culture of compliance,” Cullen Price, Manager, Market Abuse Team, Enforcement at OSC said during TD’s hearing. The two banks allowed the inappropriate sharing of confidential customer information by traders at the banks with their counterparts at other firms, the OSC said in the statement of allegations. TD agreed to pay a combined C$10.1 million, split between fines to the commission and investigation cost, the OSC said. The total bill for RBC, Canada’s biggest bank, came to C$14.4 million. “TD takes its obligations to have sufficient controls in its business very seriously. It’s integral to its culture of serving customers efficiently. Bottom line is that TD’s controls on FX trading is quite different today than it was 6-8 years ago,” a TD representative told the hearing. Ahead of Friday’s settlement hearing, RBC said the bank was “pleased to resolve this matter in cooperation with the OSC. “The conduct covered by the allegations occurred many years ago, and we have taken a number of steps since that time to enhance our controls,” RBC said. Some of the world’s biggest investment banks have already paid more than $11 billion in fines to settle U.S., British and European regulatory allegations that traders rigged the currency markets. In May, the European Union fined Barclays, JP Morgan, Royal Bank of Scotland, Citigroup, and MUFG a combined 1.07 billion euros ($1.2 billion) for rigging the multi-trillion dollar foreign exchange market. In June last year, Brazil’s antitrust watchdog fined Royal Bank of Canada and Morgan Stanley a combined 42.9 million reais for meddling with foreign exchange rates charged to clients."
12.418405397165387," Canadian regulator summons RBC, TD Bank over malpractice charges (Reuters) - The Ontario Securities Commission has issued a notice of hearing to Royal Bank of Canada RY.TO and Toronto-Dominion Bank TD.TO to settle charges of forex trading malpractices, the Canadian regulator said on Monday. Both banks face charges relating to allegations that their traders used confidential customer information to gain potential advantage in foreign exchange transactions that took place between 2011 and 2013, the regulator said. The hearing will be held on Friday at the commission’s office in Toronto. The banks are accused of failing to have sufficient controls in their FX trading business during the three-year period, according to two separate ‘statements of allegations’ from the Ontario Securities Commission. The regulator also said the banks’ lack of sufficient controls allowed inappropriate sharing of confidential client information by their respective FX traders with traders at other competitor firms. The commission’s staff have identified hundreds of prohibited disclosures throughout 2011-2013, the notices said. “The conduct covered by the allegations occurred many years ago, and we have taken a number of steps since that time to enhance our controls,” RBC said in a statement cited by Canadian media. ""We will discipline, up to and including termination, anyone on our platform who does not comply with our high standards of behavior and the applicable laws and regulations in any jurisdiction,"" RBC said in a statement quoted by the Financial Post bit.ly/30NdIKE. A TD Bank statement quoted by the media said the bank takes “matters of this kind extremely seriously,” without adding further details. The banks did not immediately respond to Reuters requests for comment outside regular business hours."
10.596273166372365," Royal Bank of Canada profit rises 5% on retail strength Aug 21 (Reuters) - Royal Bank of Canada reported a 5% rise in quarterly profit on Wednesday, boosted by growth in personal and commercial banking. Net income rose to C$3.26 billion ($2.45 billion), or C$2.22 per share, in the third quarter ended July 31, from C$3.11 billion, or C$2.10 per share, a year earlier. [reut.rs/2P7EYCn ] RBC is the first of Canada’s big banks to report third-quarter earnings. ($1 = 1.3302 Canadian dollars) (Reporting by Bharath Manjesh in Bengaluru; Editing by Shinjini Ganguli)"
3.6479213863143367," MOVES-RBC industrials investment banking co-head moves to Jefferies -sources June 27 (Reuters) - Royal Bank of Canada’s co-head of industrials investment banking Glenn Riedman has resigned to join the investment banking arm of Jefferies Financial Group Inc , according to people familiar with the matter. Riedman had been with RBC in New York since 2011, where he oversaw the bank’s relationships with industrial conglomerates as well as building products, packaging, chemicals, metals and mining companies. His new title at Jefferies could not be verified. Jefferies declined to comment, while RBC and Riedman did not respond to requests for comment. Before joining RBC, Riedman was a managing director in the diversified industrials group at JPMorgan Chase & Co. Riedman is not the first industrials banker recently poached by Jefferies. The bank has been scaling up its industrials practice since May 2018, when Reuters reported the bank had hired Goldman Sachs Group Inc veteran Peter Scheman to be its new co-head of industrials investment banking for the Americas. (Rreporting by Harry Brumpton in New York; Editing by Richard Chang)"
-2.603610063064311," Canada's RBC, TD Bank raise bad debt provisions as slowing economy bites (Reuters) - Royal Bank of Canada and Toronto-Dominion Bank, Canada’s two largest lenders, beat analysts’ estimates for quarterly profit on Thursday as strong loan growth boosted interest income, but a spike in provisions for soured loans spooked investors. Canadian lenders are faced with a sharply slowing economy, a cooling house market, with a record high household debt-to-income ratio stoking concerns of loan losses. Both banks posted double-digit growth in money set aside for such losses in the second quarter. On Wednesday, smaller rival Canadian Imperial Bank of Commerce estimated zero earnings growth, sending its shares down for a second straight day on Thursday. “Last quarter’s higher provisions seemed to be an anomaly, but with Q2 also higher, we think it could be the beginning of an overall weakening,” Chris Kuiper, senior analyst at CFRA Research, said. “The first time, it was easy to give them a pass as a “one-off” but with the second quarter also showing higher provisions it seems like this is becoming more of a trend,” he added. RBC blamed losses in personal and commercial banking for a 55% rise in quarterly provisions. On a post-earnings call with analysts, bank executives said that some of their oil and gas clients had come under pressure due to a fall in crude prices. Provisions at TD rose 14% to $633 million from a year earlier due to increase in money set aside to meet future losses in the banks’ personal lending portfolios. RBC also said it expected net interest margin or NIM, a key measure of profitability, to be relatively flat over the next several quarters, given the outlook for interest rates. RBC shares were down 2.4%, while TD shares rose 2.2%, helped by a stronger earnings beat, and relative share price underperformance ahead of the earnings. The Canadian central bank and U.S. Federal Reserve have paused interest rate hikes after raising them multiple times since July 2017. In the reported quarter, higher rates in Canada and the United States helped improve NIMs at the banks, as they earned more from loans than they paid out on deposits. Total loans at RBC jumped 9% in the second quarter, while at TD, they rose 3%, with home, personal and business lending showing growth. CIBC, which is most exposed to Canadian economy, reported negligible quarterly loan growth on Wednesday. Residential mortgage loan growth has been a focus for investors following stringent regulatory changes that require borrowers of uninsured mortgages to be stress-tested to check their ability to repay. “Regulatory changes have helped some of Canada’s major housing markets stabilize, particularly in Ontario and to the East. Western Canadian markets remain under downward pressure,” said RBC Chief Executive David McKay. Loans grew not only in the domestic markets, but also in the United States, where both banks have sizeable businesses. “RBC is showing decent domestic loan growth and strong growth south of the border,” said John Aiken, an analyst with Barclays. At TD, “underlying retail loan growth remains strong on both sides of the border,” he added. TD's net income, excluding special items, rose to C$3.27 billion ($2.43 billion), or C$1.75 per share, in the three months ended April 30, from C$3.06 billion, or C$1.62 per share, a year earlier. [reut.rs/2whvJDj] Analysts on average expected earnings per share of C$1.67, according to IBES data from Refinitiv. Trading rose at RBC on “improved market conditions and increased client activity,” while it fell at TD due to “challenging market conditions and reduced client activity.” Top U.S. investment banks reported huge declines in equities trading in the most recent quarter due to the U.S.-China trade war. RBC's adjusted earnings per share of C$2.23 beat analyst estimates of C$2.21, while TD's C$1.75 per share profit beat estimates by 8 Canadian cents. (reut.rs/2JXVLU9)"
