0.8840065632951075," TJX raises full-year profit forecast after same-store sales beat (Reuters) - TJX Cos Inc raised its full-year profit forecast and beat quarterly same-store sales estimates on Tuesday, as the off-price retailer’s steep discounts attracted more shoppers. TJX, which sells coveted apparel brands such as Tommy Hilfiger and Calvin Klein at prices 20% to 60% lower than those sold at other retailers, has been opening new shops while attracting customers with its “treasure hunt” store formats. The company also hinted at easing transportation and labor cost pressures by forecasting a 3% to 4% impact to full-year profit, compared to the about 4% it forecast earlier. TJX raised its full-year earnings per share profit forecast range by a cent to $2.56 to $2.61. Comparable-store sales rose 5% in the first quarter ended May 4, beating the average analyst estimate of a 3.44% increase, according to IBES data from Refinitiv. Net income rose by a cent to 57 cents per share, ahead of estimates of 55 cents. Net sales climbed 6.8% to $9.28 billion, also topping expectations of $9.21 billion. Shares of the company rose 1.8% before the bell."
0.8840065632951075," TJX quarterly same-store sales top expectations May 21 (Reuters) - TJX Cos Inc reported a better-than-expected quarterly same-store sales on Tuesday, as the off-price retailer’s steep discounts brought more shoppers to its Marshalls and HomeGoods stores. Comparable-store sales at TJX rose 5%, beating the average analyst estimate of 3.44% rise, according to IBES data from Refinitiv. Net sales rose to $9.28 billion in the first quarter ended May 4, from $8.69 billion, a year earlier. (Reporting by Soundarya J in Bengaluru; Editing by Arun Koyyur)"
-2.4631888756413685," TJX holiday quarter same-stores sales beat estimates (Reuters) - Off-price apparel retailer TJX Cos Inc reported better-than-expected quarterly same-store sales on Wednesday, as steep discounts drove more shoppers to its T.J. Maxx and Marshalls stores during the holiday season. TJX reported a 6 percent rise in comparable-store sales, beating analysts’ average estimate of a 3.54 percent rise, according to IBES data from Refinitiv. Net sales rose to $11.13 billion from $10.96 billion."
-2.4631888756413685," UPDATE 1-TJX holiday quarter same-stores sales beat estimates (Adds details on segment results, profit, share movement, compares with analysts estimate) Feb 27 (Reuters) - Off-price apparel retailer TJX Cos Inc reported better-than-expected quarterly same-store sales on Wednesday, as steep discounts drove more shoppers to its T.J. Maxx and Marshalls stores during the holiday season. Shares of the Framingham, Massachusetts-based company rose 2 percent before the bell. TJX has opened more stores and largely depended on its deep in-store discounts to drive traffic unlike other brick-and-mortar retailers, which have shuttered shops and invested in e-commerce as shoppers move online. The company reported a 6 percent rise in comparable-store sales, beating analysts’ average estimate of a 3.54 percent rise, according to IBES data from Refinitiv. Same-store sales at Marmaxx, the company’s biggest and most profitable unit which includes T.J. Maxx and Marshalls stores, rose 7 percent during the quarter, beating estimates of 4.45 percent growth. Net income fell to $841.5 million, or 68 cents per share, in the fourth quarter ended February 2, from $877.3 million, or 69 cents per share, a year earlier. Net sales rose 1.5 percent to $11.13 billion, beating analysts estimate of $11 billion. (Reporting by Soundarya J in Bengaluru; Editing by Shounak Dasgupta and Shailesh Kuber)"
8.305745385317637," TJX's holiday profit forecast disappoints as freight, labor costs bite (Reuters) - TJX Cos Inc's TJX.N holiday-quarter earnings forecast fell largely below analysts' estimates on Tuesday, as the off-price retailer faces rising freight and labor costs, sending its shares down as much as 7 percent. Several retailers have warned that a shortage of truck drivers, new driver regulations and higher fuel prices would make moving freight much costlier this year. Wages are also rising in a tightening U.S. labor market. TJX said it expects the rising transportation and wage costs to cut next year’s profit by about 4 percent. “Unfortunately, the environment is not playing into our plans to have us picking up next year on our (earnings per share),” Chief Executive Officer Ernie Herrman said on a conference call with analysts. In addition to costs, TJX is facing tough competition from online firms and other retailers such as Macy's M.N and Nordstrom JWN.N, which have been focusing more on their off-price businesses. Unlike other brick-and-mortar retailers, which have closed stores and invested in e-commerce as shoppers move online, TJX has largely depended on deep in-store discounts to drive traffic. The retailer expects higher costs during the current quarter to hurt profits by 5 percent, resulting in earnings of 66 cents to 67 cents per share. Analysts on average were expecting 71 cents, according to IBES data from Refinitiv. The tepid forecasts overshadowed TJX’s better-than-expected third-quarter sales. The company reported a 7 percent rise in comparable-store sales in the quarter ended Nov. 3, above the 4.1 percent Wall Street had estimated. The company’s treasure-hunt format, which encourages shoppers to hunt for deals across a swath of products and brands in stores, helped drive its 17th consecutive quarter of traffic growth. Comparable-store sales in the company’s biggest unit, Marmaxx, rose 9 percent, marking the best growth in at least two years. Net income surged 18.8 percent to $762.3 million, or 61 cents per share, from a year earlier. The company’s net sales climbed 12.2 percent to $9.83 billion, beating analysts’ expectations of $9.49 billion. TJX's smaller rival Ross Stores Inc's ROST.O fourth-quarter forecast for same-store sales on Tuesday was also below analysts' estimates. TJX’s shares, which touched a five-month low of $45.56, were down 3.7 percent at $47.17 in late afternoon trading. As of Monday, the stock had risen nearly 28 percent this year."
8.305745385317637," TJX Cos sees freight, labor costs impacting fiscal 2020 earnings (Reuters) - Off-price retailer TJX Cos Inc TJX.N expects rising freight and labor costs to impact full-year 2020 earnings by 2 percent each, it said on a post-earnings call on Tuesday. Earlier in the day, the company forecast holiday-quarter earnings and full-year 2019 profit largely below analysts’ estimates on increasing freight and labor costs."
8.305745385317637," TJX Cos sees freight, labor costs impacting fiscal 2020 earnings Nov 20 (Reuters) - Off-price retailer TJX Cos Inc expects rising freight and labor costs to impact full-year 2020 earnings by 2 percent each, it said on a post-earnings call on Tuesday. Earlier in the day, the company forecast holiday-quarter earnings and full-year 2019 profit largely below analysts’ estimates on increasing freight and labor costs. (Reporting by Soundarya J in Bengaluru; Editing by Maju Samuel)"
8.305745385317637," TJX tops same-store sales estimates Nov 20 (Reuters) - Off-price apparel retailer TJX Cos Inc reported better-than-expected quarterly same-store sales on Tuesday, as heavy discounting drove more shoppers to its T.J. Maxx and Marshalls stores. TJX said same-store sales rose 7 percent in the third quarter ended Nov. 3, better than analysts’ average estimate of a 4.1 percent increase, according to IBES data from Refinitiv. Its net sales climbed to $9.83 billion from $8.76 billion. Third-quarter net income rose to $762.3 million or 61 cents per share, from $641.4 million or 50 cents per share a year earlier. (Reporting by Soundarya J in Bengaluru)"
-12.96624376458883," TJX beats estimates as big discounts attract young shoppers (Reuters) - TJX Cos Inc TJX.N reported a 6 percent rise in quarterly comparable-store sales on Tuesday, topping analysts' estimates as big discounts attracted more younger shoppers and generated the off-price retailer's 16th consecutive quarter of customer-traffic growth. Unlike Macy's Inc M.N and J.C. Penney Co Inc JCP.N, which have closed stores and shifted their focus online, TJX has stuck to brick and mortar retail, thriving in a period of uncertainty for major U.S. retailers driven by the growth of Amazon.com and other web-based players. The company’s treasure-hunt style marketing technique, based on unpublicized but deep discounts on branded apparel and accessories, proved to be a hit with younger customers, driving a 34 percent jump in profit and lifting its shares by 5 percent to a record high. “We have been attracting a significant share of millennial and Gen-Z shoppers among our new customers at each of our divisions...which indeed bodes very well for our future,” TJX Chief Executive Officer Ernie Herrman said. The 6 percent rise in same-store sales in the second quarter, easily beat the 2.2 percent increase analysts had expected, according to Thomson Reuters I/B/E/S. The company also raised its full-year same store sales growth forecast to 3 to 4 percent, above the average estimate of a 2.4 percent increase. The company’s Marmaxx unit, which includes T.J. Maxx and Marshalls stores, saw a 7 percent increase in same-store sales as it attracted more new customers, the majority of whom were between the ages of 18 and 34. Herrman declined to say what products younger customers were buying. However, Jessica Ramirez, an analyst with Jane Hali & Associates, said TJX stocking more trendy active wear and beauty products in its stores was attracting more shoppers. The company’s net income rose to $739.6 million, or $1.17 per share, in the second quarter ended Aug. 4, from $553 million, or 85 cents per share, a year earlier. The retailer also raised its full-year adjusted profit forecast. The Framingham, Massachusetts-based company said net sales during the quarter rose 11.6 percent to $9.33 billion. Analysts expected the company to report earnings of $1.05 per share on revenue of $9.00 billion. “...the retail game is still being played firmly in TJX’s ballpark,” Neil Saunders, Managing Director of GlobalData Retail said in an email. “People simply enjoy the thrill of snagging a bargain.”"
-12.96624376458883," TJX quarterly same-store sales crushes estimates Aug 21 (Reuters) - Off-price retailer TJX Cos Inc topped quarterly comparable-store sales estimates on Tuesday, as deep discounts helped drive more customers to its T.J. Maxx and Marshalls stores. The company’s net income rose to $739.6 million, or $1.17 per share, in the second quarter ended Aug. 4, from $553 million, or 85 cents per share, a year earlier. TJX reported a 6 percent rise in same-store sales, blowing past the 2.2 percent increase analysts had expected, according to Thomson Reuters I/B/E/S. The Framingham, Massachusetts-based company said net sales rose to $9.33 billion from $8.36 billion. (Reporting by Uday Sampath in Bengaluru; Editing by Arun Koyyur)"
5.0226953073612055," U.S. hedge funds bet on retail, tech in second-quarter as economy sizzled (Reuters) - Prominent hedge fund managers appeared to make big second-quarter bets that the U.S. economy would continue to expand despite increasing concerns about a broadening trade dispute between the United States and China, regulatory filings showed Tuesday. Third Point added new positions in payment companies PayPal Holdings Inc PYPL.O and Visa Inc V.N, both of which are up more than 19 percent year to date. Greenlight Capital, run by billionaire investor David Einhorn, added new positions in low-to-middle income retailers including Dollar Tree Inc DLTR.O, Dollar General Corp DG.N, Gap Inc GPS.N, and TJX Companies Inc TJX.N, the parent company of discount retailers TJ Maxx and HomeGoods. Activist fund Jana Partners added shares of broad-based exchange-traded funds that track the S&P 500 and the Russell 2000 indexes and took new positions in Wells Fargo & Co WFC.N and food delivery company GrubHub Inc GRUB.N. The flurry of new positions in cyclical companies came during a quarter in which U.S. gross domestic product increased at an annual rate of 4.1 percent, nearly double the 2.2 percent rate of the first quarter of the year, according to Commerce Department estimates. A rally in cyclical companies would help boost hedge fund industry returns at a time when many fund firms are under pressure from investors to lower their fees or improve their performance. Hedge funds, on average, are up 1.5 percent since the start of January, according to research firm Hedge Fund Research, well behind the 6.2 percent gain in the benchmark S&P 500 index over the same time. “Everyone is comparing everything to the S&P 500 and that’s a very difficult hurdle for the last few years,” said Sol Waksman, president of research firm BarclayHedge. Quarterly disclosures of hedge fund managers’ stock holdings, in what are known as 13F filings with the U.S. Securities and Exchange Commission, are one of the few public ways of learning what the managers are selling and buying. But relying on the filings to develop an investment strategy comes with some risk because the disclosures come 45 days after the end of each quarter and may not reflect current positions. Still, the filings offer a glimpse into what hedge fund managers saw as opportunities to make money on the long side. The filings do not disclose short positions, or bets that a stock will fall in price. As a result, the public filings do not always present a complete picture of a management firm’s stock holdings. Large hedge fund managers cut their positions in some of the so-called FAANG stocks - the moniker given to Facebook Inc FB.O, Apple Inc AAPL.O, Amazon.com Inc AMZN.O, Netflix Inc NFLX.O, and Google-parent Alphabet Inc GOOGL.O - that led the market higher last year. Third Point sold all of its stake in Alphabet and divested 1 million shares of Facebook, reducing its position in the company by 25 percent. At the same time, it increased its stake in Microsoft Corp MSFT.O by nearly 310 percent, buying 1.7 million shares. Omega Advisors, meanwhile, sold all of its position in Netflix and added new holdings in biotechnology companies including Madrigal Pharmaceuticals Inc MDGL.O and Deciphera Pharmaceuticals Inc DCPH.O. A number of prominent fund managers sharply cut their stake in Apple only weeks before it became the first publicly traded U.S. company to be worth more than $1 trillion. Einhorn’s Greenlight Capital slashed its stake by 77 percent, while Philippe Laffont’s Coatue Management got rid of 95 percent. Advisory firm Diamond Hill Capital Management cut its stake by 27 percent. Other big holders, including Sanders Capital and Adage Capital Partners, trimmed only small amounts in the second quarter."
21.406481383174913," Bargain-hungry shoppers help TJX beat sales forecasts (Reuters) - TJX Cos Inc TJX.N attracted more bargain hunters in the first quarter, helping the off-price apparel retailer report same-store sales above Wall Street expectations and sending its shares to a record high on Tuesday. The company’s focus on keeping prices low and making shopping more engaging has helped it draw more people to its T.J. Maxx and Marshalls stores, a stark contrast to many U.S. retailers that have been hit hard by consumers shopping online. TJX does not advertise the brands it sells, but encourages shoppers to go on a “treasure hunt” through its aisles to find ever-changing deals on a wide array of products. If lucky, a shopper can sometimes find a Versace coat at a T.J. Maxx at half the price offered by most other retailers. “The treasure hunt nature continues to drive new interest, new people and more visits by current customers,” said Brian Yarbrough, an analyst at Edward Jones. On the other hand, retailers including Macy’s, Kohl’s and Nordstrom are investing heavily in online shopping. TJX’s products, prices and inventory management dispel the notion that it needs a bigger online presence, Yarbrough said. “We are convinced that the ability to touch and feel the merchandise and the inspiration that our shopping experience elicits, leads to instant gratification — all important factors for shoppers,” Chief Executive Officer Ernie Herrman said on a conference call with analysts. TJX reported a 3 percent rise in same-store sales in the first quarter ended May 5, compared with the 2.5 percent increase analysts had estimated, marking the seventh time in nine quarters the company has topped expectations. Shares of the Framingham, Massachusetts-based retailer rose as much as 4.8 percent to an all-time high of $88.74 on Tuesday afternoon. TJX warned that rising freight costs will likely lower its earnings later in the year. Still, the company slightly lifted its forecast for yearly adjusted earnings to $4.04 to $4.10 per share from $4.00 to $4.08. TJX expects second-quarter net sales of about $9 billion. Analysts on average were expecting $8.89 billion, according to Thomson Reuters I/B/E/S. Its first-quarter net income soared 33.6 percent year-over-year to $716.4 million, or $1.13 per share. Net sales climbed 11.6 percent to $8.69 billion, topping expectations of $8.47 billion."
21.406481383174913," TJX same-store sales top estimates May 22 (Reuters) - Off-price apparel retailer TJX Cos Inc reported better-than-expected quarterly comparable-store sales on Tuesday, as deep discounts helped drive more customers into its stores. The company’s net income rose to $716.4 million, or $1.13 per share, in the first quarter ended May 5, from $536.3 million, or 82 cents per share, a year earlier. TJX reported a 3 percent rise in comparable store sales, compared with the 2.5 percent increase analysts had expected, according to Thomson Reuters I/B/E/S. The Framingham, Massachusetts-based company’s net sales rose to $8.69 billion from $7.78 billion. (Reporting by Uday Sampath in Bengaluru; Editing by Maju Samuel)"
15.119144782545154, BRIEF-TJX Companies Says CEO Ernie Herrman's FY 2018 Total Compensation Was $16.9 Million April 26 (Reuters) - TJX Companies Inc: * TJX COMPANIES SAYS CEO ERNIE HERRMAN’S FY 2018 TOTAL COMPENSATION WAS $16.9 MILLION VERSUS $18.5 IN FY 2017 - SEC FILING * TJX COMPANIES INC SAYS EXECUTIVE CHAIRMAIN CAROL MEYROWITZ'S FY 2018 TOTAL COMPENSATION WAS $13.4 MILLION VERSUS $14.5 MILLION IN FY 2017 - SEC FILING Source text: (bit.ly/2HsJSpm) Further company coverage:
