10.080824730621575," TJX beats estimates on HomeGoods strength, shares rise (Reuters) - Discount store operator TJX Cos Inc beat estimates for quarterly results on Wednesday, boosted by strong demand for home improvement products at its HomeGoods chain as well as activewear and beauty products during the COVID-19 pandemic. TJX’s shares, up about 37% this year, rose 4% in premarket trading. The chain, which also operates Marmaxx stores, has benefited from its diversified product offerings, as people largely staying at home invest in renovating and furnishing their homes even as they spend less on suits and dresses. U.S. same-store sales at its reopened HomeGoods stores rose 15% in the third quarter ended Oct. 31, cushioning the declines in its other units. TJX, known for its treasure-hunt shopping experience, now plans to roll out an online HomeGoods store next year, as many analysts have indicated that off-price chains are missing out on the e-commerce boom due to a near-absence of online operations. TJX’s overall third-quarter net sales fell about 3% to $10.12 billion, but they were above the Refinitiv IBES estimate of $9.36 billion. Net income rose about 5% to $866.7 million, or 71 cents per share. Analysts had expected a profit of 40 cents. The chain also said same-store sales at its reopened stores in the first two weeks of the holiday quarter were down 7%, with about 470 stores - most of them in Europe — temporarily closed due to government mandates. “TJX’s comparable sales trajectory is likely to be a bumpy road ... Q3 is confirmation that the TJX model is continuing to win share, has opportunity on gross margin, and should continue to outperform the market,” Bernstein analyst Jamie Merriman said. Same-store sales declined 5% at its reopened stores in the reported quarter. TJX also said it expects to reinstate a quarterly dividend of 26 cents per share in the fourth quarter, representing a 13% increase from the amount it paid in March."
10.080824730621575," TJX beats quarterly sales estimates Nov 18 (Reuters) - Discount store operator TJX Cos Inc beat estimates for quarterly net sales on Wednesday, boosted by strong demand for home improvement products at its HomeGoods chain during the COVID-19 pandemic. The company’s net sales fell to $10.12 billion in the third quarter ended Oct. 31, from $10.45 billion a year earlier. Analysts on average had expected sales of $9.36 billion, Refinitiv data showed. (Reporting by Praveen Paramasivam in Bengaluru; Editing by Maju Samuel)"
13.245036340406546," TJX forecasts current-quarter comparable sales to drop up to 20% (Reuters) - TJX Cos Inc TJX.N on Wednesday forecast current-quarter same-store sales to fall up to 20% after reporting a bigger-than-expected loss for the previous three months, sending the off-price retailer's shares down about 7%. Much like department-store chain Kohl's Corp KSS.N and retail giant Walmart Inc WMT.N, TJX said it anticipated slower back-to-school selling season, as more school districts rolled back their reopening plans. The retail chain also grappled with bringing shipments into its stores, particularly in Canada, due to virus-led supply and logistics issues that have gripped some retailers ever since the lockdown was imposed. Several apparel brands are keeping their best merchandise for their own channels or have put their wholesale business on pause due to supply-chain issues, forcing department stores and off-price players to rely more on other categories. Still, TJX, the parent of Marmaxx stores, said it had increased its buying since mid-July to support the flow of inventory. TJX, which forecast third-quarter comparable sales at its reopened stores to decline 10% to 20%, also said traffic and demand have moderated after a stronger-than-expected surge upon the reopening of its stores. The Framingham, Massachusetts-based company has reopened nearly all of its 4,557 locations in nine countries. In the quarter, TJX’s Marmaxx brand witnessed a 6% decline in comparable sales at its reopened stores, even as its HomeGoods chain, which sells furniture, rugs, tabletop and cookware, posted a 20% increase. Overall net sales slumped 32% to $6.67 billion as its stores were closed for nearly one-thirds of the quarter, but the numbers came in above estimates of $6.57 billion. Excluding items, it lost 18 cents per share in the second quarter ended Aug. 1, compared with market expectations of 10 cents per share, according to IBES data from Refinitiv."
13.245036340406546," UPDATE 2-TJX forecasts current-quarter comparable sales to drop up to 20% (Adds background, details from release on inventory and sales; updates share movement) Aug 19 (Reuters) - TJX Cos Inc on Wednesday forecast current-quarter same-store sales to fall up to 20% after reporting a bigger-than-expected loss for the previous three months, sending the off-price retailer’s shares down about 7%. Much like department-store chain Kohl’s Corp and retail giant Walmart Inc, TJX said it anticipated slower back-to-school selling season, as more school districts rolled back their reopening plans. The retail chain also grappled with bringing shipments into its stores, particularly in Canada, due to virus-led supply and logistics issues that have gripped some retailers ever since the lockdown was imposed. Several apparel brands are keeping their best merchandise for their own channels or have put their wholesale business on pause due to supply-chain issues, forcing department stores and off-price players to rely more on other categories. Still, TJX, the parent of Marmaxx stores, said it had increased its buying since mid-July to support the flow of inventory. TJX, which forecast third-quarter comparable sales at its reopened stores to decline 10% to 20%, also said traffic and demand have moderated after a stronger-than-expected surge upon the reopening of its stores. The Framingham, Massachusetts-based company has reopened nearly all of its 4,557 locations in nine countries. In the quarter, TJX’s Marmaxx brand witnessed a 6% decline in comparable sales at its reopened stores, even as its HomeGoods chain, which sells furniture, rugs, tabletop and cookware, posted a 20% increase. Overall net sales slumped 32% to $6.67 billion as its stores were closed for nearly one-thirds of the quarter, but the numbers came in above estimates of $6.57 billion. Excluding items, it lost 18 cents per share in the second quarter ended Aug. 1, compared with market expectations of 10 cents per share, according to IBES data from Refinitiv. (Reporting by Praveen Paramasivam in Bengaluru, Editing by Sherry Jacob-Phillips)"
-4.825039757830382," TJX says sales recovering after coronavirus slump (Reuters) - TJX Cos Inc TJX.N said it was seeing very strong sales at its stores reopened post-coronavirus lockdowns, offering hope of a swift recovery after a huge quarterly loss due to closures and a resulting decline in sales, sending its shares up 6% on Thursday. The discount chain is seen as among the better positioned retailers as its value-priced goods are attractive to shoppers looking to save money in the face of increased uncertainty about jobs and household finances. “Although it’s still early and the retail environment remains uncertain, we have been encouraged with the very strong sales we have seen with our initial reopenings,” Chief Executive Officer Ernie Herrman said. “We believe this very strong start speaks to our compelling value proposition and the appeal of our treasure-hunt shopping experience, as well as pent-up demand.” TJX, the parent of Marmaxx stores, said it has reopened more than 1,600 of its about 4,500 stores worldwide. MKM Partners analyst Roxanne Meyer said TJX’s sales update was a sharp contrast to what other mall-based retailers have said. “We think TJX traffic disproportionately benefits from its off-mall, high traffic locations as well as its cult-like customer following.” In contrast, department store chains, including J.C Penney JCP.N and Neiman Marcus, that have been through recessions and economic uncertainties in the past were forced to seek bankruptcy protection as losses mount and mall traffic declines. TJX in March halted both online and offline operations to prevent its employees from catching COVID-19. It said there will be no dividend for the first quarter and also does not expect to pay any in the current quarter. For the quarter ended May 2, net sales fell 52.5% to $4.41 billion. Net loss came in at $887.5 million, or 74 cents per share."
-4.825039757830382," TJX's quarterly sales more than halve amid pandemic May 21 (Reuters) - TJX Cos Inc’s first-quarter sales more than halved on Thursday, as the off-price retailer’s stores and online operations remained shut for most of the quarter due to coronavirus-led lockdowns. For the three months ended May 2, net sales fell to $4.41 billion from $9.28 billion a year earlier. The company reported a net loss of $887.5 million, or 74 cents per share, compared with a profit $700.2 million, or 57 cents per share. (Reporting by Nivedita Balu in Bengaluru; Editing by Shinjini Ganguli)"
16.724962217355884," BRIEF-TJX Companies Inc Says CEO Ernie Herrman's FY 2020 Total Compensation Was $19.1 Mln April 23 (Reuters) - TJX Companies Inc: * TJX COMPANIES INC SAYS CEO ERNIE HERRMAN’S FY 2020 TOTAL COMPENSATION WAS $19.1 MILLION VERSUS $18.8 MILLION IN FY 2019 - SEC FILING * TJX COMPANIES INC SAYS EXECUTIVE CHAIRMAN CAROL MEYROWITZ’S FY 2020 TOTAL COMPENSATION WAS $10.5 MILLION VERSUS $11.3 MILLION IN FY 2019 * TJX COMPANIES INC SAYS CFO SCOTT GOLDENBERG’S FY 2020 TOTAL COMPENSATION WAS $6.7 MILLION VERSUS $6.4 MILLION IN FY 2019 * TJX COMPANIES INC SAYS FOR FY 2020, CEO PAY RATIO WAS 1,590:1 Source text : (bit.ly/3axsV6E) Further company coverage:"
8.826052340894535," TJX to furlough most of about 286,000 staff as stores stay shut amid pandemic (Reuters) - Off-price retailer TJX Companies Inc TJX.N said on Tuesday it would furlough most of the employees at its stores and distribution centers, as outlets remain closed to curb the spread of the coronavirus. TJX, which had about 286,000 employees as of Feb. 1 according to its latest annual filing, will pay its staff until the week ending April 11. U.S. retailers, including Macy's M.N and Nordstrom JWN.N, have closed stores as several states called for lockdowns to curb the spread of the virus outbreak that has killed over 10,000 in the country. TJX said several executives, including Chief Executive Officer Ernie Herrman, would take a pay cut, a pattern seen across U.S. companies looking to strengthen their balance sheets amid the economic downturn triggered by the health crisis. The company said store reopening dates would defer based on the state and locality of the outlet."
6.330178453544423," BRIEF-Tjx Companies Files For Four-Part, Notes Offering Size Not Dislcosed - SEC Filing March 30 (Reuters) - TJX Companies Inc: * TJX COMPANIES INC FILES FOR FOUR-PART, NOTES OFFERING; SIZE NOT DISLCOSED - SEC FILING Source text: bit.ly/2wFziau Further company coverage:"
26.38655366246909," TJX draws down $1 billion from credit line, suspends share buybacks (Reuters) - Discount store operator TJX Cos Inc TJX.N said on Thursday it was drawing down $1 billion from its existing credit line and suspending its share buyback program to maintain liquidity in a difficult period brought on by the coronavirus pandemic. All stores in the United States, Canada, Europe and Australia will be closed for two weeks and websites shut down, the company said. Smaller rivals Ross Stores Inc ROST.O and Burlington Stores Inc BURL.O also suspended their buyback programs on Thursday, with Ross saying it would draw down $800 million from its existing credit line. All three companies ditched their full-year forecasts as the fast spreading virus sends the U.S. retail industry spiraling. Retail outlets, restaurants, theaters and other places which usually draw crowds have shut their doors in recent days to help stop the infection from spreading. TJX said it was evaluating its dividend program and reviewing all operating and capital expenditures, as companies around the globe hoard cash on the growing prospect of a global economic downturn. A retail industry group on Wednesday asked the White House for a direct, government-backed loan program to help pay workers’ salaries, rents and repay loans."
26.38655366246909," BRIEF-The TJX Suspends Share Repurchase Program, Withdraws Financial Guidance March 19 (Reuters) - TJX Companies Inc: * TJX COMPANIES INC - CLOSING ALL OF ITS STORES IN UNITED STATES, CANADA, EUROPE, AND AUSTRALIA FOR TWO WEEKS * TJX COMPANIES INC - SUSPENDING ITS SHARE REPURCHASE PROGRAM * TJX COMPANIES INC - DRAWING DOWN $1 BILLION FROM ITS REVOLVING CREDIT FACILITIES * TJX COMPANIES - IT IS WITHDRAWING ITS Q1 AND FULL YEAR FISCAL 2021 FINANCIAL GUIDANCE GIVEN ON ITS FEBRUARY 26, 2020 EARNINGS CONFERENCE CALL * TJX COMPANIES INC - COMPANY IS NOT PROVIDING AN UPDATED OUTLOOK AT THIS TIME * TJX COMPANIES INC - WITHDRAWING ITS Q1 AND FULL YEAR FISCAL 2021 FINANCIAL GUIDANCE * TJX COMPANIES INC - ALSO CLOSING ITS ONLINE BUSINESSES TJMAXX.COM, MARSHALLS.COM, AND SIERRA.COM * TJX COMPANIES INC - TEMPORARILY CLOSING ITS DISTRIBUTION CENTERS & OFFICES Source text for Eikon: Further company coverage:"
-13.58024337617577," Holiday demand powers T.J. Maxx owner's sales and profit beat, shares rise (Reuters) - TJX Cos Inc TJX.N beat Wall Street expectations for sales and profit on Wednesday, as more customers flocked to the off-price retailer's T.J. Maxx and Marshalls' stores during the holiday shopping period. Shares of the Framingham, Massachusetts-based company were up 7.5% after TJX announced plans to buyback up to about $2.25 billion of its stock this year and raised its quarterly dividend by 13%. New formats, better lighting, flooring and enhanced shelves at stores, and higher spending on marketing during the holidays paid off as the company recorded customer traffic growth across stores during and after the crucial shopping period. “Our gift-giving assortments at great values, supported by our marketing, attracted customers around the globe during the holiday season and beyond,” Chief Executive Officer Ernie Herrman said. Comparable-store sales rose 6% during the reported quarter, driven by strong sales at its Marmaxx and HomeGoods stores. Analysts on average had estimated growth of 3.03%, according to IBES data from Refinitiv. The company, which has been investing in its online business and launched Marshalls’ website in September, said it would keep its online product mix different from its brick-and-mortar stores as an incentive for customers to shop from both channels. “Q4 was another strong quarter for TJX, suggesting that the off-price format continues to gain share,” Bernstein analyst Jamie Merriman said. But the company forecast its full-year profit largely below Wall Street estimates as it planned to continue investing in new stores, store remodels and its supply chain. Rival Burlington Stores BURL.N, on the contrary, raised its fourth-quarter forecast earlier this month. Net sales for TJX jumped nearly 10% to $12.21 billion, while net income rose 17% to $984.8 million, or 81 cents per share, in the fourth quarter ended Feb. 1. Analysts on average had expected a profit of 77 cents per share on net sales of $11.83 billion. TJX’s shares were trading at a record high of $64.86."
-13.58024337617577," TJX same-store sales top expectations, shares rise Feb 26 (Reuters) - TJX Cos Inc topped quarterly same-store sales estimates on Wednesday, as more customers shopped at the off-price retailer’s T.J. Maxx and Marshalls’ stores during the holiday shopping period, sending its shares up 6%. The company reported a 6% rise in comparable-store sales, trouncing the average analyst estimate of a 3.03% rise, according to IBES data from Refinitiv. Net income rose to $984.8 million, or 81 cents per share, in the fourth quarter ended Feb. 1 from $841.5 million, or 68 cents per share, a year earlier. (Reporting by Aditi Sebastian in Bengaluru; Editing by Anil D’Silva)"
-29.409904439767807," BRIEF-Adage Capital Partners Takes Share Stake In TJX Cos And Johnson Controls Feb 14 (Reuters) - Adage Capital Partners GP LLC: * ADAGE CAPITAL PARTNERS GP LLC UPS SHARE STAKE IN CONOCOPHILLIPS BY 24.3 PERCENT TO 1.8 MILLION SHARES - SEC FILING * ADAGE CAPITAL PARTNERS GP LLC UPS SHARE STAKE IN EXXON MOBIL CORP BY 28.2 PERCENT TO 2.9 MILLION SHARES * ADAGE CAPITAL PARTNERS GP LLC UPS SHARE STAKE IN BOSTON SCIENTIFIC CORP BY 24.1 PERCENT TO 2.0 MILLION SHARES * ADAGE CAPITAL PARTNERS GP LLC CUTS SHARE STAKE IN CITIGROUP INC BY 12.6 PERCENT TO 2.6 MILLION SHARES * ADAGE CAPITAL PARTNERS GP LLC CUTS SHARE STAKE IN PELOTON INTERACTIVE INC BY 61.2 PERCENT TO 903,500 CLASS A SHARES * ADAGE CAPITAL PARTNERS GP LLC CUTS SHARE STAKE IN ORACLE CORP BY 15.7 PERCENT TO 2.2 MILLION SHARES * ADAGE CAPITAL PARTNERS GP LLC UPS SHARE STAKE IN BUNGE LIMITED BY 19.6 PERCENT TO 2.1 MILLION SHARES * ADAGE CAPITAL PARTNERS GP LLC TAKES SHARE STAKE OF 2.9 MILLION SHARES IN JOHNSON CONTROLS INTERNATIONAL * ADAGE CAPITAL PARTNERS GP LLC TAKES SHARE STAKE OF 1.4 MILLION SHARES IN TJX COMPANIES INC * ADAGE CAPITAL PARTNERS GP LLC UPS SHARE STAKE IN DUPONT BY 66.5 PERCENT TO 2.3 MILLION SHARES * ADAGE CAPITAL PARTNERS GP LLC - CHANGE IN HOLDINGS ARE AS OF DECEMBER 31, 2019 AND COMPARED WITH THE PREVIOUS QUARTER ENDED AS OF SEPTEMBER 30, 2019 Source for the quarter ended December 31, 2019: bit.ly/2UTbN7w Source for the quarter ended September 30, 2019: bit.ly/2KgPJxt"
5.61649510665235," T.J.Maxx owner TJX buys 25% stake in Russian retailer Familia MOSCOW (Reuters) - U.S. discount store operator TJX Companies Inc TJX.N has acquired a 25% stake in Russian low-cost apparel retailer Familia for $225 million, the Russian company said in a statement on Tuesday. Discount retailers have flourished in Russia as sanctions and a decline in global prices for oil, Russia’s most important export, dealt a blow to the rouble and consumer spending. Familia, which has more than 275 stores in Russia selling clothes, shoes, accessories and household goods, enjoyed 24% turnover growth in the first nine months of 2019 compared with the same period of 2018, with like-for-like sales rising 7%. It said the market has significant potential for further growth. TJX, the owner of T.J. Maxx and Marshalls stores, has the right to elect one representative to Familia's board, Familia said, adding that its founders, along with Baring Vostok and Goldman Sachs GS.N remained shareholders of the company and were committed to its long-term growth."
5.61649510665235," TJX raises full-year profit forecast after beating quarterly estimates (Reuters) - TJX Cos Inc TJX.N raised its full-year profit forecast on Tuesday ahead of the holiday shopping season and reported better-than-expected quarterly same-store sales as the off-price retailer's steep discounts brought in more shoppers. TJX, which draws in price-conscious shoppers with the promise of sought-after and luxury brands like Dolce & Gabbana and Calvin Klein at discounts of up to 60%, has been steadily expanding with a program of new store openings and remodeling of existing ones. The company now expects full-year profit of $2.61 to $2.63 per share, compared with its prior forecast of $2.56 to $2.61. “The fourth quarter is off to a solid start and we have many initiatives underway to keep driving traffic and sales to our stores and online during the holiday season and beyond,” Chief Executive Ernie Herrman said in a statement. The company reported a 4% rise in comparable-store sales for the third quarter, beating the average analyst estimate of a 2.30% rise, according to IBES data from Refinitiv. TJX now expects comparable store sales growth of 3% on a consolidated basis, compared with its prior outlook of 2% to 3% growth. Same-store sales at Marmaxx, TJX’s biggest unit that houses T.J. Maxx and Marshalls stores, rose 4%, also beating estimates of a 2.31% rise. TJX’s net income rose to $828.3 million, or 68 cents per share, in the quarter ended Nov. 2, from $762.3 million, or 61 cents per share, a year earlier. Net sales rose to $10.45 billion from $9.83 billion. Analysts on average had expected a profit of 66 cents per share on net sales of $10.32 billion. Shares of the Framingham, Massachusetts-based company rose 1.4% before the opening bell."
5.61649510665235," TJX buys 25% stake in Russian retailer Familia MOSCOW, Nov 19 (Reuters) - U.S. discount store operator TJX Companies Inc has acquired a 25% stake in Russian low-cost apparel retailer Familia for $225 million, the Russian company said in a statement on Tuesday. The stake will give TJX the right to elect one representative to Familia’s board, Familia said, adding that its founders, along with Baring Vostok and Goldman Sachs remained shareholders of the company. (Reporting by Anton Kolodyazhnyy; writing by Maria Kiselyova; editing by Tom Balmforth)"
5.61649510665235," TJX beats same-store sales estimates, raises FY profit forecast Nov 19 (Reuters) - TJX Cos Inc raised its full-year profit forecast on Tuesday ahead of the holiday shopping season and reported better-than-expected quarterly same-store sales as the off-price retailer’s steep discounts brought in more shoppers. The company now expects full-year profit of $2.61 to $2.63 per share, compared with its prior forecast of $2.56 to $2.61. The company reported a 4% rise in comparable-store sales, beating the average analyst estimate of a 2.30% rise, according to IBES data from Refinitiv. Net income rose to $828.3 million, or 68 cents per share, in the third quarter ended Nov. 2, from $762.3 million, or 61 cents per share, a year earlier. Net sales rose to $10.45 billion from $9.83 billion. (Reporting by Praveen Paramasivam in Bengaluru; Editing by Maju Samuel)"
15.617447350169172," TJX posts rare same-store sales miss as competition stiffens (Reuters) - TJX Cos Inc TJX.N forecast third-quarter profit below expectations and reported quarterly same-store sales that missed estimates for the first time in more than a year, as the discount store operator faces intense competition from online and other retailers. Shares of the company fell 4% to $49.41 in early trading. With traditional retailers such as Macy's Inc M.N and Nordstrom Inc JWN.N stepping into the territory of discount retailers, off-price stores like TJX and Burlington Stores are struggling to boost sales. TJX, which sells coveted apparel and luxury brands such as Dolce & Gabbana and Calvin Klein at a discount of 20%-60%, has been opening new stores, while also trying to attract consumers with treasure hunts at its stores, encouraging shoppers to spot deals among rapidly changing assortments. While the efforts helped the company report positive traffic, it posted its slowest same-store sales growth in six quarters, rising only 2% in the quarter ended August 3. Analysts on average had expected a increase of 2.95%, according to IBES data from Refinitiv. Neil Saunders, the managing director of GlobalData Retail, noted that above average levels of discounting across many apparel retailers was a serious threat to TJX this quarter. “This gave those shoppers looking for bargains more choice and more reason to shop around, something that had a tangible impact on both T.J. Maxx and Marshalls,” Saunders said. Same-store sales at Marmaxx, the biggest company unit that houses T.J. Maxx and Marshalls stores, rose just 2%, while that at HomeGoods, its second biggest, was flat in the quarter, both segments missing analysts’ expectations. TJX expects third-quarter profit in the range of 63 cents to 65 cents per share, below analysts’ expectation of 68 cents. The result follows a weak quarterly report from retailers Macy's and J.C. Penney Co Inc JCP.N with Macy's cutting its annual profit forecast and J.C. Penney reporting a slump in sales. TXJ’s net sales rose 4.8% to $9.78 billion in the second quarter. Net income rose to $759 million, or 62 cents per share, from $739.6 million, or 58 cents per share, a year earlier. Analysts on average had expected a profit of 62 cents per share on sales of $9.90 billion."
15.617447350169172," TJX quarterly same-store sales miss estimates Aug 20 (Reuters) - TJX Cos Inc’s second-quarter same-store sales fell short of Wall Street expectations on Tuesday, as the off-price retailer struggled to attract shoppers amidst stiff competition from online and other retailers. The company reported a 2% rise in comparable-store sales in the quarter ended August 3, but missed the average analyst estimate of a 2.95% increase, according to IBES data from Refinitiv. Net sales rose to $9.78 billion from $9.33 billion, also missing estimates of $9.90 billion. (Reporting by Soundarya J in Bengaluru; Editing by Shinjini Ganguli)"
