13.302804366461855," Vans sneaker maker's revenue, profit view disappoints on pandemic hit (Reuters) - VF Corp raised its full-year forecast for revenue and profit on Wednesday, but it came in below market estimates as the apparel maker struggles to bring in sales with the COVID-19 pandemic shuttering stores in some of its major markets. The Vans sneaker maker’s shares fell 8% in premarket trading as it posted a 5.8% drop in net revenue for the third quarter and said more than 60% of its stores were temporarily closed in Europe, the Middle East and Africa, with less than 10% of its outlets shut in North America. Its digital revenue jumped 53% but that was not enough to counterbalance weak in-store sales, as fresh restrictions in its key U.S. and Europe markets doused a short-lived sales rebound triggered by the lifting of earlier curbs. VF now expects fiscal 2021 revenue between $9.1 billion and $9.2 billion, with the midpoint below the Refinitiv IBES estimate of $9.19 billion, even as it pointed to an about $125 million revenue boost from its recent acquisition of Supreme. The owner of Timberland and The North Face brands also expects fiscal 2021 adjusted earnings per share of about $1.30, 6 cents below Wall Street expectations. The company had previously forecast 2021 revenue of at least $9 billion and per-share profit of at least $1.20. Denver, Colorado-based VF’s net revenue fell to $2.97 billion, missing the average analyst estimate of $3 billion, as even the traditionally busy holiday shopping season saw thin crowds. However, excluding items, VF earned 93 cents per share, above the 90-cent estimate."
13.302804366461855," Vans sneaker maker VF Corp raises fiscal 2021 revenue forecast Jan 27 (Reuters) - Apparel maker VF Corp raised its full-year forecast for revenue on Wednesday, as consumers working or attending classes from home due to the COVID-19 pandemic shopped online for its sportswear and athleisure apparel. VF, which recently closed the acquisition of streetwear brand Supreme, now expects fiscal 2021 revenue between $9.1 billion and $9.2 billion, compared with its prior estimate of at least $9 billion and a Refinitiv IBES estimate of $9.19 billion. (Reporting by Mehr Bedi and Praveen Paramasivam in Bengaluru; Editing by Devika Syamnath)"
4.961592074761515," Vans owner VF Corp to buy streetwear brand Supreme for about $2.1 billion (Reuters) - VF Corp VFC.N said on Monday it would pay $2.1 billion to buy streetwear apparel company Supreme, adding another popular brand to the Vans shoe maker's roster. VF Corp, which also houses brands such as The North Face and Timberland, said it would make an additional payment of up to $300 million, subject to satisfaction of certain post-deal closing milestones. Shares of VF Corp surged about 13% to $78.94 in afternoon trading. It said current investors Carlyle Group and New York-based private equity firm Goode Partners were selling their stakes in Supreme, founded by American-British businessman James Jebbia in 1994. Known for its red box logo with “Supreme” written in white, the brand has gained a following among “hypebeasts,” or fans of the streetwear style, with product launches of everything from hoodies to burner phones selling out in minutes and people lining up outside its 12 stores worldwide for hours. Perceived scarcity has helped Supreme to acquire a cachet among young people and allowed it to charge far higher prices than other streetwear brands like VF’s Vans and Nike. “This scarcity, novelty and strong social influence model supports meaningful pricing power resulting best in class profitability,” VF Corp Chief Executive Steve Rendle said. VF Corp estimated the broader streetwear market to be a roughly $50 billion global opportunity and that Supreme was at the epicenter of this market, he said. VF Corp executive said its deal with Supreme will help bolster its e-commerce business, which has become more urgent for apparel and footwear makers due to the COVID-19 pandemic. Supreme, which has collaborated with many prominent fashion names including Louis Vuitton as well as Nike, Levi and Vans, gets over 60% of its revenue from the online business. The deal, which is expected to be completed late in 2020, is anticipated to contribute at least $500 million of revenue and adjusted earnings per share of 20 cents in fiscal 2022. Supreme does not provide group sales or profit figures but its UK-based European arm is obliged to publish annual accounts and these have showed rapid growth and industry-leading margins in recent years. In the year to the end of January 2019, Supreme’s European business racked up revenue of 100 million pounds ($130 million) despite having just two stores and a profit margin, before interest expenses, of 44% - a multiple of the margins earned by other streetwear brands like Vans, Abercrombie & Fitch or even luxury brands like Gucci, company filings show. Analysts have wondered whether Supreme will be able to maintain its premium pricing as its products become more ubiquitous, but were more sanguine after Monday’s announcement. “Supreme is a strong streetwear brand .... and while the brand has built its appeal on scarcity, we believe the market will be excited at the margin and growth profile and its contribution to VFC,” Bernstein analyst Jaime Merriman said."
4.738971129924584," Vans owner VF Corp to buy streetwear brand Supreme for $2.1 billion Nov 9 (Reuters) - Vans owner VF Corp said on Monday it would pay $2.1 billion to buy popular streetwear brand Supreme, which is expected to add at least $500 million to the apparel company’s annual revenue in fiscal 2022. VF Corp said it would pay an additional $300 million subject to satisfaction of certain post-closing milestones. It added that Carlyle Group and Goode Partners are selling their stakes in privately owned Supreme. (Reporting by Aishwarya Venugopal in Bengaluru; Editing by Maju Samuel)"
16.80534158476023," UPDATE 1-Vans owner VF Corp eyes acquisitions amid coronavirus uncertainty - FT (Adds VF Corp’s statement) June 14 (Reuters) - Apparel maker VF Corp is eyeing further acquisitions despite coronavirus uncertainty, saying it could be a good time to expand its collection, the Financial Times reported on.ft.com/2C3miO1 on Sunday. “In times like this, some of the greatest returns could be generated through acquiring,” the newspaper quoted chief executive officer and chairman, Steve Rendle, as saying. Rendle said he saw potential opportunities to buy smaller rivals in subsectors including athleisure, outdoor and activewear, FT added. VF Corp said it has no further comment. (Reporting by Sabahatjahan Contractor in Bengaluru; Editing by Daniel Wallis)"
16.80534158476023," Vans owner VF Corp eyes acquisitions amid coronavirus uncertainty: FT (Reuters) - Apparel maker VF Corp VFC.N is eyeing further acquisitions despite coronavirus uncertainty, saying it could be a good time to expand its collection, the Financial Times reported on.ft.com/2C3miO1 on Sunday. “In times like this, some of the greatest returns could be generated through acquiring,” the newspaper quoted chief executive officer and chairman, Steve Rendle, as saying. Rendle said he saw potential opportunities to buy smaller rivals in subsectors including athleisure, outdoor and activewear, FT added. VF Corp was not immediately available to respond to a request for comment from Reuters."
24.511573603467532," Vans owner VF Corp expects quarterly sales to halve as stores shut (Reuters) - VF Corp VFC.N, the maker of Timberland boots and The North Face backpacks, warned on Friday that it expects current-quarter revenue to more than halve due to the coronavirus-induced store closures. Shares fell about 4% before the bell, as the company also did not provide an outlook for its fiscal 2021, citing uncertainty over the duration and severity of the health crisis. “Through the first 10 months of fiscal 2020 our business delivered results above our stated long-term growth objectives. Then the world changed for all of us as a result of COVID-19,” Chief Executive Officer Steve Rendle said in a statement. VF said its suppliers, including third-party manufacturers, logistics providers and other vendors, have also been hit and that many of its facilities were operating at a reduced capacity. Retail stores in the Asia-Pacific region, including China, have reopened, the company said, adding that retail store traffic has improved recently, but remains significantly lower than last year. In Europe, Middle East and Africa, the company has started a phased reopening of its retail stores and is preparing for a gradual restart in North America. It expects most of its stores to be open by mid-2020. Several retail and department stores that sell the company’s merchandise were also closed, forcing the company to limit business to its online offerings. The Denver, Colorado-based company said it expects free cash flow to exceed $600 million in the current first quarter. For the fourth quarter ended March, the company reported a net loss of $483.8 million, or $1.22 per share, compared with a profit of $128.8 million, or 32 cents per share, a year earlier, as it discontinued some operations. Excluding one-time items, the company earned 10 cents per share, compared with the average analyst estimate of 14 cents, according to IBES data from Refinitiv. Net revenue fell about 2% to $2.10 billion, missing estimate of $2.28 billion."
19.236357803036373," BRIEF-Vf Corporation Provides Update On Global Business Impact Of Covid-19 March 16 (Reuters) - VF Corp: * VF CORPORATION PROVIDES UPDATE ON GLOBAL BUSINESS IMPACT OF COVID-19 * VF CORP - ANNOUNCED TEMPORARY CLOSURE OF ALL OWNED RETAIL STORES ACROSS NORTH AMERICA, EFFECTIVE MARCH 16 THROUGH APRIL 5 * VF CORP - ALL RETAIL EMPLOYEES AT THESE LOCATIONS WILL CONTINUE TO RECEIVE FULL PAY AND BENEFITS DURING TEMPORARY CLOSURE PERIOD * VF CORP - CLOSED ITS CORPORATE AND BRAND OFFICES IN NORTH AMERICA UNTIL APRIL 5 AND IS ENABLING ALL OFFICE EMPLOYEES TO WORK REMOTELY * VF CORP - TEMPORARY CLOSURE OF BOTH OFFICES AND RETAIL LOCATIONS MAY BE EXTENDED DEPENDING ON OVERALL STATE OF COVID-19 SITUATION * VF CORP - WILL PROVIDE AN UPDATE AS TO OPERATIONAL AND FINANCIAL IMPACTS OF CORONAVIRUS DURING CO’S Q4 FISCAL 2020 CONFERENCE CALL IN MAY 2020 * VF CORP - VF’S SUPPLY CHAIN OPERATIONS HAVE EXPERIENCED LIMITED DISRUPTION TO DATE AS A RESULT OF COVID-19 SITUATION * VF CORP - ACTIONS IN NORTH AMERICA ARE CONSISTENT WITH SIMILAR OPERATIONAL DECISIONS MADE IN ITS EMEA AND ASIA PACIFIC REGIONS * VF CORP - VF’S OFFICES AND RETAIL LOCATIONS IN SOUTH KOREA, JAPAN, HONG KONG AND TAIWAN REMAIN OPEN, BUT OFFICE EMPLOYEES ARE WORKING REMOTELY * VF CORP - IN MAINLAND EUROPE, VF HAS CLOSED ALL OFFICES AND RETAIL STORE LOCATIONS UNTIL FURTHER NOTICE * VF CORP - LOCATIONS IN UNITED KINGDOM ARE CURRENTLY OPERATING ON REDUCED HOURS. * VF CORP - CURRENTLY, CO’S OFFICES IN GREATER CHINA ARE OPEN AND ABOUT 90 PERCENT OF RETAIL STORE LOCATIONS ARE NOW OPEN FOR BUSINESS * VF - AS STATED IN VF’S NEWS RELEASE DATED FEB 7, CORONAVIRUS OUTBREAK WAS NOT CONTEMPLATED AT TIME VF PROVIDED ADJUSTED 2020 OUTLOOK ON JAN 23 * VF CORP - DISTRIBUTION AND FULFILLMENT CENTERS AROUND WORLD REMAIN OPERATIONAL * VF CORP - WHILE RETAIL STORE TRAFFIC IN GREATER CHINA HAS STEADILY IMPROVED OVER PAST MONTH, IT REMAINS DOWN SIGNIFICANTLY COMPARED WITH PRIOR YEAR * VF CORP - NOT POSSIBLE TO GAUGE FULL IMPACT TO VF’S SUPPLY CHAIN AT THIS TIME FROM COVID-19 SITUATION * VF CORP - RETAIL STORE LOCATIONS ARE OPERATING ON REDUCED HOURS IN SOME CASES IN SOUTH KOREA, JAPAN, HONG KONG AND TAIWAN * VF CORP - ONGOING DIVERSIFICATION EFFORTS ARE UNDERWAY IN AN ATTEMPT TO MITIGATE POTENTIAL FUTURE DISRUPTION FROM COVID-19 SITUATION * VF CORP - ONGOING DIVERSIFICATION EFFORTS INCLUDE RE-DIRECTING MANUFACTURING AND MATERIALS SOURCING Source text for Eikon: Further company coverage:"
-30.47884412586212, BRIEF-Vf Corporation Provides Update On Business Impact Of Coronavirus In China Feb 7 (Reuters) - VF Corp: * VF CORPORATION PROVIDES UPDATE ON BUSINESS IMPACT OF CORONAVIRUS IN CHINA * VF CORP - ABOUT 60 PERCENT OF VF’S OWNED AND PARTNER STORES IN CHINA HAVE BEEN TEMPORARILY CLOSED DUE TO CORONAVIRUS MITIGATION EFFORTS * VF CORP - STORES CURRENTLY OPEN IN CHINA HAVE EXPERIENCED SIGNIFICANT DECLINES IN RETAIL TRAFFIC * VF CORP - IT IS NOT POSSIBLE TO GAUGE IMPACT TO OUR SUPPLY CHAIN AT THIS POINT * VF CORP - WILL PROVIDE UPDATE AS TO OPERATIONAL AND FINANCIAL IMPACTS OF CORONAVIRUS DURING VF’S Q4 FISCAL 2020 CONFERENCE CALL IN MAY 2020 Source text for Eikon: Further company coverage:
-35.92722389836734," VF Corp cuts forecast on weak Timberland, slowing Vans; shares fall (Reuters) - VF Corp VFC.N trimmed its full-year forecasts on Thursday, as the apparel maker struggles with waning demand for its Timberland outerwear and slowing growth at Vans. Shares dropped 8% in morning trading as the company also fell short of quarterly sales estimates. The results come as the 120-year-old company has been spending heavily on marketing, launching new products and improving its online presence to fend off larger rivals Nike NKE.N and Under Armour UAA.N. Vans, the company’s biggest brand, posted its slowest revenue growth in two years at 12% in the third quarter, amid new launches that included a sneaker line inspired by skater Anthony van Engelen. The outdoor segment, which includes Timberland and The North Face brands, reported revenue of $1.66 billion, missing the average analyst estimate of $1.7 billion. “This morning’s results suggest the greater need to pare back the underperforming aspect of the (outdoor) portfolio,” RBC Capital Markets analyst Kate Fitzsimons said. Timberland, a brand VF calls one of its “top four,” was particularly hit, falling 5% globally due to weakness in online sales, leading the company to cut its full-year revenue forecast for the business. Sales fell in the Americas, and Europe and Middle East, while they were flat in the Asia-Pacific region. VF now expects full-revenue at the brand to decline 1% to 2%, compared with a 1% to 2% rise expected earlier. Revenue growth in The North Face brand near halved from a year earlier. An uptick in promotional activity, starting pretty early and specifically with our cold weather brands, hit North Face and Timberland, Chief Financial Officer Scott Roe said on a post-earnings call. The company estimated annual revenue of $11.75 billion, compared with its prior forecast of $11.8 billion. It projected adjusted profit per share to be about $3.30, lower than its prior range of $3.32 to $3.37. Wedbush analyst Christopher Svezia called the lowered outlook a rarity for the company over the last several years. VF, which spun off its jeans business as Kontoor Brands KB.N in May, is pushing ahead with divesting its non-core brands. The company announced on Tuesday a review for nine workwear brands, including Red Kap and Bulwark. Net revenue rose 4.6% to $3.38 billion in the three months ended Dec. 28, but fell short of the average analyst estimate of $3.43 billion, according to IBES data from Refinitiv. Excluding items, the company earned $1.23 per share, beating estimates of $1.21."
-35.92722389836734," Vans sneaker maker VF Corp cuts full-year forecast after revenue miss Jan 23 (Reuters) - Apparel maker VF Corp cut its full-year revenue and profit forecast on Thursday after missing Wall Street estimates for third-quarter revenue, dragged by weak demand for its Timberland brand. The company now expects to post annual revenue of $11.75 billion, compared with its prior forecast of $11.8 billion. It also expects adjusted profit per share to be about $3.30, compared with its prior range of $3.32 to $3.37. Net revenue for the third quarter ended Dec. 28 rose to $3.38 billion from $3.23 billion a year earlier, but fell short of the average analyst estimate of $3.43 billion, according to IBES data from Refinitiv. (Reporting by Praveen Paramasivam in Bengaluru; Editing by Sriraj Kalluvila)"
-43.24463805886876," Vans owner VF Corp explores options for nine brands (Reuters) - VF Corp VFC.N said on Tuesday it was starting a review for nine workwear brands that target businesses, including Red Kap and Bulwark, as the apparel maker looks to focus on its retail-oriented brands such as Vans. The company said the brands under review represented about $865 million of its total fiscal 2019 revenue of $13.85 billion and about 50% of the workwear segment’s sales. It also said divesting the brands, including VF Solutions that sells uniform to businesses and governmental organizations, would give it financial flexibility to plan future divestments. It said it would, however, retain Dickies and Timberland Pro brands from the workwear segment. VF, which spun off its jeanswear business as Kontoor Brands KTB.N last year, is set to report quarterly results before market opens on Thursday."
0.9876677264378946," Slowing Vans demand drive VF Corp earnings miss; shares fall (Reuters) - VF Corp VF.N fell short of Wall Street estimates for its quarterly profit and revenue on Friday, hit by growing competition for its popular brands Vans and Timberland, sending shares of the apparel maker down as much as 10%. The company didn't benefit significantly from its move to ramp up direct selling and boost online business to compete with larger players such as Nike NKE.N and Under Armour UAA.N that pulled in more customers with new launches and a stronger digital presence. VF Corp’s unchanged full-year sales and earnings forecast, reflecting a 7-cents hit from higher tariffs, the ongoing disruption in Hong Kong and a stronger dollar, also disappointed investors. Shares of the Colorado-based company, which in May spun off its less profitable jeans business, Kontoor Brands KB.N, were down 7% at $84.48, having gained 35.25% so far this year. VF Corp has been trying to reduce its reliance on China imports as consumer-facing brands start to come in the range of fire of the latest round of proposed U.S.-China tariffs on $300 billion worth of goods that target apparel and footwear. Chief Financial Officer Scott Roe said on a call with analysts the company plans to keep its sourcing from the country at about 4% next year, down from 7% presently. Revenue from Vans grew 14% in the second quarter ended Sept. 28, slowing from a growth of 26% last year, while that from its work segment, which includes brands Dickies and Timberland, fell 4%. Profit dropped 24% in the segment prompting VF Corp to cut full-year outlook for the unit. Net income rose to $649 million, or $1.61 per share, from $507.1 million, or $1.26 per share, a year earlier. Excluding items, the company earned $1.26, missing the average analyst estimate of $1.31. Net revenue rose 5.4% to $3.39 billion, but missed the average analyst estimate of $3.42 billion, according to IBES data from Refinitiv."
0.9876677264378946," Vans owner VF Corp revenue misses estimates on sluggish demand Oct 25 (Reuters) - Apparel maker VF Corp reported second-quarter revenue that missed Wall Street expectations on Friday, hurt by sluggish demand for its North Face and Vans brands. Net income rose to $649 million, or $1.61 per share, in the quarter ended Sept. 28, from $507.1 million, or $1.26 per share, a year earlier. Net revenue climbed 5.4% to $3.39 billion, but missed the average analyst estimate of $3.42 billion, according to IBES data from Refinitiv."
4.60187485236681," Lee, Wrangler jeans maker Kontoor posts over 8% drop in quarterly revenue Aug 8 (Reuters) - Kontoor Brands Inc, the recently spunoff jeans unit of VF Corp, reported an 8.2% fall in quarterly revenue on Thursday, as the company took a hit from the bankruptcy of a major customer last year and a stronger dollar. The company’s net income fell to $38 million, or 67 cents per share, in the second quarter ended June 29, from $60.5 million, or $1.07 per share, a year earlier. Net revenue fell to $609.7 million from $663.9 million. (Reporting by Uday Sampath and Aditi Sebastian; Editing by Maju Samuel)"
2.1694311446643884," VF Corp raises annual profit forecast on Vans, North Face demand (Reuters) - VF Corp VFC.N raised its full-year profit forecast on Wednesday after reporting better-than-expected quarterly revenue and earnings, powered by demand for the apparel maker's Vans and North Face brands. Shares of the company, which reported its first results since spinning off of its less-profitable jeans business in May, rose as much as 3.7% in morning trade. VF has been introducing new collections under its high-margin Vans and North Face brands as well as investing in its digital capabilities and new store openings. Vans, in particular, has been creating buzz with its new Harry Potter collection, sneaker lines inspired by Mexican artist Frida Kahlo and late rock singer David Bowie. The efforts helped Vans revenue jump 20% in the first quarter. Revenue at North Face also rose 9%. Bernstein analyst Jamie Merriman said that first-quarter results will be reassuring for VFC bulls, given the growth in Vans and the uptick in North Face. The company now projects 2020 fiscal revenue from North Face to grow by 8% to 9%, and that from Vans by 11% to 13%. “We are confident in Vans’ ability to sustain its trajectory above our long-term target,” said Chief Executive officer Steve Rendle in a conference call with analysts. Rendle said VF would invest $20 million more this fiscal year in launching North Face’s new waterproof outerwear called FutureLight in fall. VF forecast full-year adjusted profit from continuing operations to be in the range of $3.32 to $3.37 per share, compared with its previous forecast of $3.30 to $3.35. Net revenue rose 6.3% to $2.27 billion in the quarter, beating analysts’ estimate of $2.24 billion, according to IBES data from Refinitiv. Net income fell to $49.2 million, or 12 cents per share, in the quarter ended June 29, from $160.4 million, or 40 cents per share, a year earlier, primarily due to its jeans business spinoff. Excluding items, the company earned 30 cents per share, beating analysts’ estimate by a cent."
2.1694311446643884," Vans shoe maker VF Corp beats quarterly revenue estimates July 24 (Reuters) - VF Corp’s quarterly revenue beat Wall Street expectations on Wednesday, helped by higher demand for its Vans sneakers and the North Face brand. Net revenue rose 6.3% to $2.27 billion in the first quarter, beating analysts’ estimate of $2.24 billion, according to IBES data from Refinitiv. Net income fell to $49.2 million, or 12 cents per share, in the quarter ended June 29, from $160.4 million, or 40 cents per share, a year earlier, primarily due to the spin-off of its less profitable jeans business in May. (Reporting by Soundarya J in Bengaluru; Editing by Maju Samuel)"
-4.1788073501196035," VF Corp's 2020 forecast disappoints as demand for Vans sneakers slows (Reuters) - Apparel maker VF Corp forecast full-year revenue and profit below expectations on slowing demand for its popular outdoor wear label North Face and sneaker brand Vans, sending its shares down about 7%. The company wants to better focus on the high-margin brands, and is, therefore, spinning off its less profitable jeans business, including Lee and Wrangler brands. The separation will be completed this week. The company launched new collections under the brands to drives sales, kept a tight lid on inventories and sold at full price. But the efforts didn’t pay off. The company now expects sales growth in its active segment, which includes Vans, to slowdown further. VF Corp forecast 2020 revenue in the range of $11.7 billion to $11.8 billion, much below analysts’ estimates of $14.6 billion, according to IBES data from Refinitiv. Full-year sales for the company’s active segment are expected at 6% to 7%, compared with a 16% growth in 2019 “The fact that Vans as the largest brand in the portfolio is likely guided to its longer term 10-12% run rate with this outlook, there likely is some conservatism embedded in that outlook coming off of 24% growth in FY19,” said RBC analyst Kate Fitzsimons. The company also forecast 4% to 5% sales growth in outdoor segment that includes North Face, compared with a 9% increase in 2019. VF Corp said it expects full-year adjusted profit in the range of $3.30 to $3.35 per share. Analysts were expecting a profit of $4.25. The tepid forecast overshadowed the better-than-expected results in the fourth quarter. Excluding items, the company earned 60 cents per share in the fourth quarter ended March 30, beating analysts’ estimate of 58 cents. Revenue in Vans, known for its iconic Classic Slip-ons, rose 14% in the quarter, compared with a 45% increase in the year earlier. North Face saw an 8% growth in revenue, down from 11%. Total revenue rose 5.5% to $3.21 billion, edging past analysts’ estimate of $3.20 billion, according to IBES data from Refinitiv. Shares of the company were down about 7% at $86 in early trading. The stock had gained 29% year-to-date outperforming the broader S&P 500 index’s 14.3% gain in the same period."
-4.1788073501196035," Vans owner VF Corp quarterly revenue beats estimates May 22 (Reuters) - Apparel maker VF Corp exceeded Wall Street’s quarterly sales expectations, boosted by higher demand for its Vans sneakers and outdoor wear brand North Face. Net income fell to $128.8 million, or 32 cents per share, in the fourth quarter ended March 30, from $252.8 million, or 63 cents per share, a year earlier. Total revenue rose 5.5% to $3.21 billion, edging past analysts’ estimate of $3.20 billion, according to IBES data from Refinitiv. (Reporting by Soundarya J in Bengaluru; Editing by Shinjini Ganguli)"
