16.74041170130571," VF Corp raises full-year forecasts on continuing Vans demand (Reuters) - Apparel maker VF Corp VFC.N raised its full-year revenue and profit forecast on Friday, as demand for its high-margin, popular Vans sneakers continues to boost sales, sending the company's shares up as much as 15 percent. Vans has had a surge in demand in the last two years as VF cut inventory and launched new sneakers, including a line decorated with satin brocade, to appeal to fashion conscious millennials. The brand’s popularity highlights how shoe makers have benefited from “sneaker culture” growing around the globe that has given them the luxury of being able to charge high prices for new and retro styles. Nike Inc NKE.N saw its Jordan brand return to growth in its last reported quarter, while Skechers USA Inc SKX.N was boosted by the resurgence of the chunky shoe trend among fashion-conscious consumers. However, VF’s Chief Financial Officer Scott Roe expects Vans, which saw a 25 percent jump in revenue during the holiday quarter, to grow at a low double-digit rate in fiscal 2020. “At some point, the laws of gravity do re-establish themselves,” Roe said. The company raised its full-year adjusted earnings forecast to $3.73 per share from a prior estimate of $3.65. VF also increased its full-year revenue forecast by $100 million to $13.8 billion. Analysts on average were expecting full-year earnings of $3.68 per share on revenue of $13.76 billion, according to IBES data from Refinitiv. Net revenue, also boosted by growth at the company’s North Face and Timberland brands, rose nearly 8 percent to $3.94 billion, beating Wall Street estimates of $3.87 billion. On an adjusted basis, the company earned $1.31 per share, in the third quarter ended Dec. 29, beating analysts’ expectations of $1.10. VF said last year that it plans to spin off the unit which houses brands like Lee and Wrangler. Revenue at the unit fell 5 percent in the reported quarter. The company’s shares have fallen over 17 percent in the last 3 months and were last trading at $81.50 on Friday."
16.74041170130571," Vans shoe maker VF Corp beats quarterly revenue estimates Jan 18 (Reuters) - Apparel maker VF Corp beat Wall Street’s estimates for quarterly revenue on Friday, boosted by demand for its high-margin Vans shoes and North Face apparel. The company reported a net income of $463.5 million, or $1.16 per share, in the third quarter ended Dec. 29, compared to a loss of $90.3 million, or 23 cents per share, a year earlier. Net revenue rose to $3.94 billion from $3.65 billion, beating analysts’ average estimate of $3.87 billion, according to IBES data from Refinitiv. (Reporting by Uday Sampath in Bengaluru; Editing by Shounak Dasgupta)"
7.502503055712778," VF Corp jeanswear spin-off to be called Kontoor Brands (Reuters) - VF Corp VFC.N has named its jeanswear business it plans to spin off next year Kontoor Brands Inc, the apparel maker said on Thursday. VF said in August it would spin off the business, which includes Lee and Wrangler jeans, to focus on its more profitable Vans sneakers and The North Face outerwear businesses. The separation is expected to be completed in the first half of 2019."
6.569713748292472," Lee, Wrangler owner's shares fall 9 percent on fading jeans business (Reuters) - VF Corp VFC.N shares fell 9 percent on Friday after the apparel maker lowered revenue forecasts for its jeans business and reported slow outdoor wear sales even as its popular Van sneakers lifted quarterly profit. In August, VF said it would spin off its less profitable Wrangler and Lee jeans into a publicly traded company, allowing it to focus on Vans and its outdoor wear businesses to help improve profit margins. On Friday, it said revenue for the year from its jeans business will fall in a range of 1 to 2 percent, compared with previous forecasts for flat revenue growth. Its shares were down as much as 9.1 percent at $79.09 in midday trading. They have risen roughly 18 percent year to date. Second-quarter revenue at Timberland, part of the company’s outdoor wear business, fell 2 percent, Wrangler was down 5 percent and Lee was off 9 percent. Gross margin from continuing operations decreased 10 basis points to 50.1 percent. “There is noise in this quarter, but when you zoom out and click and look at the big picture, we’re in fundamentally the same place that we thought we were,” VF Chief Financial Officer Scott Roe said when asked about the jeans business, whose spinoff will be completed in April next year. Still, its high-margin Vans business revenues rose 26 percent, and online sales for the brand grew 55 percent, lifting its second-quarter profit by a better than expected 7.5 percent. Overall, its active business revenue rose 19 percent. It also raised its full-year forecasts and increased its quarterly dividend by 11 percent. “While the results were generally strong, the lack of upside on gross margin and the deterioration in the jeans business, led by Lee ... raise some questions around the story,” Wedbush Securities analyst Christopher Svezia wrote in a note. VF has kept its inventories flowing, selling its clothes and shoes at full price and providing fresh styles to lure millennials as it tackles rising competition from the likes of Nike Inc NKE.N. It raised its full-year adjusted earnings forecast to $3.65 per share from the previous expected range of $3.52 to $3.57. It expects revenue for the year to be above or equal to $13.7 billion. Income from continuing operations rose to $507.1 million, or $1.26 per share, in the second quarter ended Sept. 29, from $473.8 million, or $1.19 per share, a year earlier. Excluding certain items VF earned $1.43 per share, beating analysts’ average estimate of $1.33, according to Refinitiv estimates. Net revenue rose 15 percent to $3.91 billion, above the market expectation of $3.87 billion."
6.569713748292472," Vans shoe maker VF Corp quarterly revenue tops estimates Oct 19 (Reuters) - Apparel maker VF Corp topped analysts’ estimates for revenue on Friday, boosted by thriving demand for its high-margin Vans shoes and North Face apparel. The company’s income from continuing operations rose to $507.1 million, or $1.26 per share, in the second quarter ended Sept. 30, from $473.8 million, or $1.19 per share, a year earlier. Net revenue rose 15 percent to $3.91 billion, beating analysts’ average estimate of $3.87 billion, according to Refinitiv estimates. The company, in August, announced the spin off of Lee and Wrangler jeans brands into a separate public company, allowing it to focus on its more profitable businesses. (Reporting by Aishwarya Venugopal in Bengaluru; Editing by Arun Koyyur)"
-9.574529289879433," VF to spin off Lee and Wrangler jeans into public company (Reuters) - VF Corp VFC.N, one of the world's biggest apparel makers, will spin off Lee and Wrangler jeans into a separate public company, it said on Monday, allowing it to focus on its more profitable Vans sneakers and The North Face outerwear businesses. Denims were responsible for more than half of VF’s overall profit in 2000, but have since been outpaced by skateboarder favorite Vans, which has driven much of VF’s recent growth. The spin-off, expected to be completed in the first half of 2019, will also give VF more flexibility to pursue acquisitions and explore new business areas. However, investors reacted coolly to the news, with VF’s shares falling nearly 4 percent to $92.53 on Monday afternoon. The stock has risen roughly 20 percent year to date. While VF's activity-based outdoor products business saw profit jump 15 percent in the year that ended in March, earnings from jeans slipped nearly 13 percent in the same period, as big outlets including Walmart Inc WMT.N turned to their own denim brands. “(Jeans) has been the weak link in the portfolio,” Jane Hali, head of investment research firm Jane Hali & Associates, said via email. “Now they can concentrate on the outdoor coalition and Vans, a much more unified and strong stable of brands.” The new VF, which already sold off apparel brand Nautica last year, will have annual revenue of more than $11 billion, compared to just over $2.5 billion for the jeans unit, which includes Wrangler, Lee, Rustler and Rock & Republic. The jeans company will focus on maintaining shareholders’ dividends, cutting debt and increasing sales in China and other Asian markets. Acquisitions of smaller firms are a longer-term possibility, VF said. However, the new spun-off retailer could face headwinds related to changing tastes - with some consumers souring on jeans - and U.S. negotiations on the North American Free Trade Agreement, said Ed Gribbin, U.S.-based CEO of apparel business and product development consulting firm Alvanon. “If NAFTA were to go away, that would be a significant challenge for them in the denim business,” Gribbin said. The jeans division is heavily invested in Mexico. VF will shift base to Denver while the still-to-be-named jeans maker will move to the company’s traditional base in Greensboro, North Carolina and be led by Scott Baxter, currently president of VF’s Americas West group. Baxter led VF’s jeans business from 2011 to 2015. VF, which has a market value of about $38 billion, projected a 5-cent hit to current-quarter earnings per share due to the deal. VF had considered “all options” for the jeans business including an outright sale, but decided that a spin-off would serve shareholders best, executives said on a conference call with analysts."
-9.574529289879433," Lee, Wrangler owner VF Corp to spin off jeans business Aug 13 (Reuters) - VF Corp said on Monday it would spin off its jeans business, which includes the Lee and Wrangler brands, into an independent publicly traded company. The transaction will be structured as a tax-free spin-off to VF’s shareholders. (Reporting by Uday Sampath in Bengaluru; Editing by Sai Sachin Ravikumar)"
-12.15474682669396," Lee, Wrangler owner VF Corp looks to exit denim business: WSJ (Reuters) - VF Corp VFC.N is exploring strategic options for its denim business that could include a sale or spin off of its Lee and Wrangler jeans brands, the Wall Street Journal reported on Friday, citing people familiar with the matter (on.wsj.com/2Oo36eK). Greensboro, North Carolina-based VF, which also makes Vans shoes, rakes in more than $2.5 billion in annual revenue. Its jeans business has seen demand slip as big retailers including Walmart WMT.N stock more of their own private label brands. VF did not immediately respond to Reuters’ request for comment. Its shares rose 1.5 percent to a record high of $96.99 on Friday afternoon after the report."
-15.90939356750175," VF Corp raises full-year forecast, propelled by soaring Vans sales (Reuters) - Vans shoe maker VF Corp VFC.N raised its full year revenue and earnings forecast on Friday after soaring demand for its skateboarding-culture inspired sneakers helped the company beat quarterly Wall Street estimates. The go-to brand for skateboarders, Vans is now appealing to a more fashion-conscious millennial crowd due to its updated styles, tie-ups with hip-hop artists and collaboration with Marvel comics. Vans has been especially popular with 18- to 24-year-olds with 14 percent of individuals surveyed by Cowen & Co choosing it as their footwear brand of choice trailing only behind Nike NKE.N. “Vans remains on fire,” Cowen analyst John Kernan said in a client note. Sales at the brand rose 35 percent in the quarter. VF shares rose 4.8 percent to a record-high of $93.50 in early trading In contrast, Skechers USA Inc SKX.N reported a lower-than-expected profit and gave a disappointing quarterly forecast on Thursday, sending its shares tumbling. Skechers sneakers just dont have the “cool factor” that Vans does, and appeals more to baby boomers, Jane Hali, CEO of investment research firm Jane Hali & Associates said. VF which also makes North Face apparel and Wrangler jeans raised its fiscal 2019 revenue forecast to between $13.6 billion and $13.7 billion, compared with analysts’ expectations of $13.56 billion.The Greensboro, North Carolina-based company’s total revenue rose 23 percent to $2.79 billion in the quarter ended June 30, beating analysts’ average estimate of $2.68 billion, according to Thomson Reuters I/B/E/S. VF’s jeans business, a pain point for the company in recent quarter, also showed modest signs of improvement with a 3 percent rise in sales. The company raised its full-year earnings forecast range to $3.52 to $3.57 per share from a prior expectation of $3.48 to $3.53.Excluding certain items, VF, earned 43 cents per share, beating analysts’ average estimate of 33 cents. Net income rose to $160.4 million, or 40 cents per share, in the quarter, from $109.9 million, or 27 cents per share, a year earlier."
-15.90939356750175," Vans shoe maker VF Corp's quarterly results top estimates July 20 (Reuters) - Apparel maker VF Corp reported first-quarter revenue and profit that beat Wall Street estimates on Friday and raised its full year earnings forecast, as demand for its high-margin Vans shoes soared. The Greensboro, North Carolina-based company’s total revenue rose 23 percent to $2.79 billion in the quarter ended June 30, beating analysts’ average estimate of $2.68 billion, according to Thomson Reuters I/B/E/S. VF said revenue from the company’s Vans shoe segment rose 35 percent in the quarter. Shares of the company, which hit a record high earlier in the week, rose 1 percent to $90.24 in pre-market trading on Friday. The company raised its full-year earnings forecast range to $3.52 to $3.57 per share from a prior expectation of $3.48 to $3.53. Excluding certain items, VF, earned 43 cents per share, beating analysts’ average estimate of 33 cents. Net income rose to $160.4 million, or 40 cents per share, in the quarter, from $109.9 million, or 27 cents per share, a year earlier. (Reporting by Uday Sampath in Bengaluru; Editing by Bernard Orr)"
21.8673458804352," VF shares dive as investors worry jeans still a 'pain point' NEW YORK (Reuters) - VF Corp VFC.N shares slid as much as 4.5 percent on Friday as Wall Street worried about profit margins for the jeans business, with major customer Walmart Inc WMT.N turning more toward private labels. One analyst on the company’s earnings call voiced concern about an 11 percent drop in global business for VF’s Lee jeans brand. “What needs to change there to see a more steady rate of growth?” asked Piper Jaffray analyst Erinn Elisabeth Murphy. “I know you’re reworking to kind of restructure the cost basis... How should the operating margin opportunity shape over the next couple of years?” VF quarterly revenues jumped 22 percent from a year earlier due to a booming Vans shoes business, demand for North Face apparel and higher online sales, while profits excluding items just edged past Wall Street estimates. Executives said margin expansion and restructuring investments are a priority. “I know one of the primary culprits there has been Walmart,” said KeyBanc Capital Markets’ managing director Ed Yruma. “They’ve leaned more into private label, so that’s been kind of a chronic pain point for them.” Chief Executive Officer Steve Rendle told analysts on the call that VF expects relatively flat jeans wear revenue for fiscal year 2019. He said VF has ramped up efforts to elevate its most powerful brands. “We’re intensely focused on protecting and enabling the explosive growth in Vans, shepherding the positive momentum of The North Face while focusing on re-energizing growth in Timberland North America,” Rendle said. Excluding items, VF earned 67 cents per share in the quarter, beating estimates by 1 cent, according to Thomson Reuters I/B/E/S. Revenue jumped 22 percent from a year earlier to $3.05 billion, surpassing analysts’ average estimate of $2.92 billion. The Greensboro, North Carolina-based company said it has been selling more products through Amazon.com Inc AMZN.O specifically for the North Face brand. The company said net income rose to $252.8 million, or 63 cents per share, from $209.2 million, or 50 cents per share, a year earlier. Shares fell as much as 4.5 percent after the earnings report, and were down 3.2 percent at $75.92 by 12:58 p.m. EDT (1658 GMT). VF aims to boost direct-to-consumer and digital businesses and direct investment to Asia, with a focus on China. “I’ve seen evidence that some of the initiatives are starting to pay off, but fundamentally, jeans has not changed. The story that we’ve been talking about for the last 12 months is still in place,” said Scott Roe, chief financial officer. For full-year fiscal 2019, the company expects revenue of $13.45 billion to $13.55 billion and adjusted earnings per share of $3.48 to $3.53. Analysts on average expect earnings of $3.48 per share and sales of $13.30 billion, according to Thomson Reuters I/B/E/S."
21.8673458804352," Vans shoes maker VF's quarterly revenue top estimates May 4 (Reuters) - VF Corp’s first-quarter revenue topped Wall Street estimates on Friday, driven by demand for Vans shoes and North Face apparel as well as higher online sales. VF said net income rose to $252.8 million or 63 cents per share in the three months ended March 31, from $209.2 million or 50 cents per share a year earlier. Revenue jumped 22 percent to $3.05 billion, topping analysts’ average estimate of $2.92 billion, according to Thomson Reuters I/B/E/S. (Reporting by Siddharth Cavale in Bengaluru; Editing by Sai Sachin Ravikumar)"
21.8673458804352," BRIEF-VF Corp Sees FY 2019 Adjusted Earnings Per Share Of $3.48 To $3.53 May 4 (Reuters) - VF Corp: * VF REPORTS RESULTS FOR TRANSITION PERIOD ENDED MARCH 31, 2018 * QUARTERLY ADJUSTED EARNINGS PER SHARE $0.67 INCLUDING ITEMS * QUARTERLY EARNINGS PER SHARE $0.65 FROM CONTINUING OPERATIONS * QTRLY REVENUE FROM CONTINUING OPERATIONS INCREASED 22 PERCENT (UP 17 PERCENT CURRENCY NEUTRAL) TO $3.0 BILLION * REVENUE IS EXPECTED TO BE IN RANGE OF $13.45 BILLION TO $13.55 BILLION FOR 2019 * Q4 EARNINGS PER SHARE VIEW $0.66, REVENUE VIEW $2.92 BILLION -- THOMSON REUTERS I/B/E/S * ADJUSTED EARNINGS PER SHARE IS EXPECTED TO BE IN RANGE OF $3.48 TO $3.53 FOR 2019 * CASH FLOW FROM OPERATIONS IS EXPECTED TO EXCEED $1.6 BILLION FOR 2019 * AT QUARTER-END, INVENTORIES WERE UP 17 PERCENT COMPARED WITH SAME PERIOD IN 2017 * SEES FULL YEAR FISCAL 2019 CAPITAL EXPENDITURES OF APPROXIMATELY $275 MILLION * FY2019 EARNINGS PER SHARE VIEW $3.48, REVENUE VIEW $13.30 BILLION -- THOMSON REUTERS I/B/E/S * QTRLY TOTAL REVENUES $3.05 BILLION VERSUS $2.50 BILLION Source text for Eikon: Further company coverage:"
