-5.454331170649568," Wells Fargo settles BlackRock, Pimco MBS trustee class action for $43 million (Reuters) - In what appears to be the first class action settlement in a wave of noteholder suits against banks that served as trustees for mortgage-backed securities trusts, Wells Fargo agreed Friday to a $43 million deal to resolve claims by BlackRock, Pimco and other noteholders in 271 trusts that lost nearly $35 billion in the financial crisis. If the proposed settlement is approved by Manhattan State Supreme Court Justice Charles Ramos, shareholders will also receive $70 million from an indemnity fund Wells Fargo reserved to litigate noteholder suits. The question, of course, is what the settlement means in the larger context of MBS investor suits against the trustees they accuse of failing to protect noteholders when problems showed up in the home mortgage loans underlying the securities. As I’ve written, these trustee suits are the last big tranche of MBS litigation by noteholders who lost untold billions of dollars in the MBS market. Should investors read the Wells Fargo settlement as a sign the hard-fought MBS trustee litigation is about to pay off or as an acknowledgment that their claims aren’t very valuable? I’d say the latter is a better reading of the settlement than the former. The noteholders’ lawyer who led the class action against Wells Fargo, Timothy DeLange of Bernstein Litowitz Berger & Grossmann didn’t immediately respond to my email requesting comment, but he is actually quoted in the Wells Fargo press release announcing the deal. He didn’t exactly crow about the result: “Following more than four years of litigation, including fact and expert discovery, we concluded that this agreement provides a fair and reasonable resolution of the claims,” DeLange said. “While we believe the claims are meritorious, the settlement provides an immediate and concrete benefit for class members, while bringing the litigation to a close.” In the memo asking Judge Ramos to approve the deal, noteholders acknowledged some of the litigation setbacks investors have experienced in their suits against trustees. Although noteholders have broadly survived defense dismissal motions, post-dismissal rulings have turned the litigation into an expensive quagmire for investors. Class certification has been one big problem, with Manhattan federal judges issuing a series of rulings denying class certification to MBS noteholders because, according to the decisions, individual issues of standing and timeliness predominate over classwide concerns. (A BlackRock investors’ class certification motion against Wells Fargo was pending before U.S. District Judge Katherine Failla of Manhattan when the two sides agreed to settle their parallel case in state court.) Courts have also foreclosed evidentiary shortcuts for noteholders, ruling that noteholders must prove trustees were aware of problems in underlying mortgage pools on a loan-by-loan, trust-by-trust basis. Judges have generally refused to allow investors to prove deficiencies by extrapolating from a sample of underlying mortgage loans. And at least one judge, U.S. District Judge Valerie Caproni of Manhattan, has ruled, on a summary judgment motion, that noteholders must show trustees had actual knowledge that individual underlying loans failed to live up to representations and warranties. (A New York state appeals court took an easier line on trustees’ knowledge, concluding that investors need not allege trustees’ actual knowledge on a loan-by-loan basis.) Black Rock and the other noteholders suing Wells Fargo acknowledged their tough road ahead in the memo requesting settlement approval. “To defeat summary judgment and prevail at trial, plaintiffs would have been required to prove, among other things, that Wells Fargo discovered breaches of representations and warranties and had actual knowledge of servicing violations with respect to individual loans in the trusts,” the memo said. “Wells Fargo would have had substantial arguments to make concerning each of these issues. For example, Wells Fargo would have argued that plaintiffs must prove, on a loan-by-loan basis, Wells Fargo’s discovery of breaches of representations and warranties and actual knowledge of servicing violations. … In addition, Wells Fargo would have argued that any damages to plaintiffs and the class were caused by factors unrelated to the purported breaches of representations and warranties or servicing violations. Had any of these arguments been accepted in whole or in part, it could have eliminated or, at a minimum, drastically limited any potential recovery.” And based on sheer math, the settlement looks more like a business decision by Wells Fargo than an admission of the merits of claims that the bank failed to live up to its MBS trustee responsibilities. As I mentioned, the Black Rock investors alleged losses of nearly $35 billion across the 271 trusts covered by the settlement. Their amended complaint sought to hold Wells Fargo liable for all of those losses. Instead, the settlement is for only $42 million. We can infer, moreover, that Wells Fargo expected the litigation to cost at least that much. Acting in its capacity as MBS trustee, the bank reserved about $90 million from MBS trusts to pay legal expenses stemming from its trustee duties. (BlackRock actually sued Wells Fargo over the reserve fund, asserting that the bank had looted trust assets, but Judge Ramos dismissed the suit in 2017.) By releasing $70 million of the reserve fund to investors as part of Friday’s settlement, Wells Fargo effectively said it would have cost more to defend the Black Rock class action than to settle it. It’s worth pointing out that Wells Fargo kept $20 million in the reserve fund, presumably to fend off MBS trustee claims by investors in another 58 trusts. Based on the bank’s per-trust payout in the BlackRock case, however, Wells Fargo’s exposure in those cases is less than $10 million. That calculation assumes Wells Fargo – as well as other MBS trustees such as Bank of New York Mellon, U.S. Bank and Deutsche Bank – will present the Black Rock class settlement as a ceiling for future settlements, not a floor. Individual noteholders may well balk at the idea that they’re on par with the BlackRock group, some of whose affiliated investment advisors were facing third-party claims by Wells Fargo that they, and not the trustee, were responsible for MBS losses. Wells Fargo hasn’t brought analogous third-party claims against the individual noteholders suing that bank as an MBS trustee. I checked in with a plaintiffs' lawyer who represents individual certificate-holders in MBS trustee cases, David Wollmuth of Wollmuth Maher & Deutsch. Wollmuth client Phoenix Life reached a confidential settlement last month of claims against Bank of America, which had limited trustee duties in an MBS offering of more than $600 million. The settlement amount was not disclosed and Wollmuth said he could not comment on the agreement. But overall, he said, Phoenix continues to believe in the strength of its claims and is “pleased at how the cases are progressing.” Wells Fargo is represented in the MBS trustee litigation by Jones Day. Partner Howard Sidman is lead counsel."
-9.552353209830255," Wells Fargo to combine private bank with ultra-rich client business (Reuters) - Wells Fargo & Co WFC.N said on Thursday it is restructuring its wealth and investment management business to combine its two high-net worth operations, the private bank and Abbot Downing, under a new unit leader who it has not yet named. As part of the plans, the bank will also create a new unit under wealth management for its direct-to-client products, Intuitive Investor and Wells Trade. Another new unit will cover lending, trust and mergers and acquisitions, bank spokeswoman Shea Leordeanu said in an emailed statement. Leaders of the three units, who have not yet been named, will report to Jon Weiss, head of wealth and investment management."
-8.718995676286674," Regulators warn Wells Fargo over technology oversight: WSJ (Reuters) - Wells Fargo WFC.N received a warning from the Office of the Comptroller of the Currency (OCC) in recent weeks related to its technology operations, the Wall Street Journal reported on Wednesday citing people familiar with the matter. The bank also has failed or isn't expected to meet deadlines on around two dozen technology-focused OCC regulatory warnings known as ""Matters Requiring Attention"" that have been issued since 2014 or earlier, the WSJ reported on.wsj.com/2QqLVe5. The warning adds to the bank's list of woes since the sales scandal erupted more than two years ago. (reut.rs/2STESft) Wells Fargo was not immediately available to comment, while OCC declined to comment."
-6.502337606043709," Wells Fargo executives knew auto insurance program was flawed: lawsuit WASHINGTON (Reuters) - Wells Fargo & Co executives were warned that an auto insurance plan could be overcharging customers four years before the bank scrapped the program, according to a complaint released by a judge this week. Several executives, including then-General Counsel James Strother and chief auditor David Julian, were among the bank officials briefed in 2012 about possible flaws in the auto insurance program that was ended in 2016, according to parts of a class-action lawsuit that were unsealed on Monday. A Wells Fargo official declined to comment on the allegations in the lawsuit but said the bank intended to repay all customers who were hurt. “We have been reviewing customer accounts and developing a remediation plan – which we hope to finalize very soon,” said spokeswoman Natalie Brown. Strother, Julian and other executives named in the lawsuit could not immediately be reached for comment. Last month, regulators warned Julian and another bank official that they could face sanctions for their past work with Wells Fargo. Wells Fargo ended its auto insurance program in September 2016 after an internal review found many customers were being wrongfully placed in a costly product they did not need. The bank had a right to force auto borrowers into the product called ‘collateral protection insurance’ (CPI) if they let their own policies lapse. But ultimately, the bank said some 600,000 customers were forced into CPI unnecessarily when it reached a $1 billion regulatory settlement in April. Wells Fargo initially estimated remediation efforts would cost $64 million, but that figure has since swelled as it determined more borrowers were owed greater amounts. In the third quarter, Wells Fargo set aside $241 million for those affected customers. Its auto insurance abuses are part of a broader scandal over Wells Fargo’s treatment of customers. The bank revealed over two years ago that it opened millions of phony accounts in customers’ names without their permission to hit sales targets. The San Francisco-based lender has since found sales abuses in businesses ranging from mortgage loans to wealth management. The lawsuit was originally filed in U.S. District Court, Central District of California, in August. Wells Fargo has fought to keep some details of the case under seal. The plaintiffs say they are customers seeking reimbursement for wrongful charges, and allege Wells Fargo pushed drivers with poor credit into policies more often than well-off customers. Wells Fargo was 10 times more likely to force borrowers with damaged credit into CPI insurance than those with high credit scores, according to the lawsuit, which cites an internal bank presentation. Drivers of Tesla vehicles and others who carried high loan balances were exempted from CPI, according to the lawsuit."
-6.502337606043709," Wells Fargo's wealth management head to retire (Reuters) - Wells Fargo & Co's WFC.N head of wealth management Jay Welker will retire at the end of March after more than two decades with the San Francisco-based bank. Welker joined Wells Fargo in 1988, overseeing regional commercial banking offices for the bank in California. He was named Wells’ wealth management head in 2003, according to a memo seen by Reuters. The memo had no details on Welker’s successor."
-6.502337606043709," Wells Fargo says internal error caused more home foreclosures than expected (Reuters) - Wells Fargo & Co WFC.N said on Tuesday an internal underwriting error had caused it to reject home loan modifications, resulting in the bank foreclosing more homes than expected. The bank said in a filing with regulators that an expanded review found that 870 customers were incorrectly denied mortgage changes, leading to 545 of them losing their homes. This comes after the bank in August had for the first time disclosed a calculation error in an internal underwriting software had caused 625 borrowers to be incorrectly denied mortgage loan modifications under a federal assistance program, 400 of whom had their homes foreclosed upon. “We’re very sorry that the errors occurred and have assigned a single, dedicated point of contact to ensure that each customer is engaged with and assisted individually,” Tom Goyda, a spokesman for the company, said in an email. The company said the expanded review is still under way and took into account customers who were in the foreclosure process between March 15, 2010, and April 30, 2018. Goyda said the bank had contacted a substantial majority of the affected customers to provide remediation as well as the option to pursue no-cost mediation with an independent mediator. The revelations are an additional headache for the San Francisco-based bank which is facing numerous regulatory penalties and private lawsuits, most of which stem from a sales practices scandal that touched on all of the bank’s major business units. The bank said the issue stems from a calculation error that overstated attorneys’ fees that were needed in determining whether a customer qualified for a mortgage loan modification or repayment plan. In August, the bank said it rectified the calculation errors and had set aside $8 million to compensate borrowers. On Tuesday, the bank, however, did not update that figure. The bank updated disclosures on issues it discovered in auto lending, saying it had tacked on an additional $241 million for customer compensation on top of the $212 million announced earlier, related to a practice where it forced customers auto insurance that in some cases resulted in vehicle repossessions. The bank has since discontinued that practice. (This story corrects to say the bank added an additional $241 million for customer compensation, not increased it to $241 million in penultimate paragraph.)"
-6.599188689114779," Wells Fargo fights securities fraud lawsuit over auto insurance Wells Fargo on Friday asked a federal judge in San Francisco to dismiss a securities fraud lawsuit accusing it of not promptly telling investors that the bank had charged several hundred thousand borrowers for auto insurance they did not need. In a motion on Friday, Wells Fargo said it informed regulators as soon as it learned of the insurance problems and it had no duty to disclose the matter to investors before it completed an investigation into the issue. To read the full story on WestlawNext Practitioner Insights, click here: bit.ly/2QmXovc"
-1.394018794874802," Wells Fargo says aware about issues with ATM and credit card transactions (Reuters) - Wells Fargo & Co on Thursday said it was aware of issues with its debit and credit card transactions. Wells Fargo is working on a resolution, the bank said in a tweet, apologizing for the problem."
-2.5538582192837285," Two Wells Fargo executives go on leave of absence amid sales scandal review (Reuters) - Wells Fargo & Co said on Wednesday it put two executives on leave in connection with ongoing regulatory reviews into the bank’s retail sales practices. Chief Administration Officer Hope Hardison and Chief Auditor David Julian have begun leaves of absence and will no longer be members of the bank’s operating committee, the bank said. The bank declined to comment on the reason for the moves, which it announced in a press release. Hardison is a 24-year veteran of Wells Fargo and assumed the CAO role in 2015, according to the company website. Julian joined Wells through its merger with Wachovia Corp and has served as chief auditor since 2012, according to LinkedIn. Wells Fargo has been coping with the fallout of a sales practice scandal since late 2016, when it was revealed that millions of fake accounts may have been opened in customers’ names by bankers facing lofty sales targets. Since then the bank has been hit with penalties including a $1 billion fine and a cap on assets put in place by the Federal Reserve. Earlier this week, the bank settled for $65 million with the New York attorney general’s office which alleged that the bank misled investors about its sales practices. The fourth-largest U.S. lender is still facing inquiries into its customer sales abuses by the Department of Justice, the Securities and Exchange Commission and the Department of Labor, according to Wells Fargo’s most recent regulatory disclosure. The bank is also facing several class-action lawsuits from angry customers. “We remain steadfast in our focus on making things right for customers and building a better Wells Fargo,” Chief Executive Officer Tim Sloan said in a statement on Wednesday."
0.3872499453195034," Two Wells Fargo executives go on leave of absence amid sales scandal review Oct 24 (Reuters) - Wells Fargo & Co said on Wednesday Chief Administrative Officer Hope Hardison and Chief Auditor David Julian have begun leaves of absence, in connection with regulatory reviews into the bank’s retail sales scandal that first surfaced in 2016. The two executives will no longer be members of the company’s operating committee, Wells Fargo said. (Reporting by Diptendu Lahiri in Bengaluru Editing by Sai Sachin Ravikumar)"
-2.0064080241263533," Wells Fargo pays $65 million to settle 'cross-sell' fraud claims with New York (Reuters) - Wells Fargo & Co will pay $65 million to settle claims that it misled investors about its “cross-selling” business strategy, the New York Attorney General’s office said on Monday. A push by Wells Fargo to get existing customers to buy more of the bank’s products, known as “cross-selling,” was at the center of a fake customer accounts scandal that has dogged the bank for two years. Wells Fargo failed to disclose to investors that the success of its cross-selling was built on sales practice misconduct, Underwood’s office said. “The misconduct at Wells Fargo was widespread across the bank and at every level of management – impacting both customers and investors who were misled,” New York Attorney General Barbara Underwood said in a statement. The bank, which has paid hundreds of millions of dollars in regulatory fines and settlements related to the scandal, said in a statement it had previously accrued the penalty costs. Since the sales scandal came to light in 2016, Wells Fargo has overhauled management and is trying to regain trust, including through an ad campaign saying that Wells Fargo was established in 1852 and “re-established” in 2018."
-2.684638122398463," Wells Fargo to pay $65 mln to settle with NY Attorney General Oct 22 (Reuters) - Wells Fargo & Co will pay $65 million to settle claims stemming from an investigation into the lender’s sales practices that saw it open fake accounts for customers to inflate sales metrics, the New York Attorney General’s office said on Monday. “The misconduct at Wells Fargo was widespread across the bank and at every level of management – impacting both customers and investors who were misled,” NY Attorney General Barbara Underwood said. Wells Fargo said in a statement it had previously accrued the penalty costs. (Reporting by Diptendu Lahiri in Bengaluru Editing by Saumyadeb Chakrabarty)"
-5.057251240397602," Senator Warren urges Fed to require removal of Wells Fargo CEO WASHINGTON/NEW YORK (Reuters) - U.S. Senator Elizabeth Warren said on Thursday the Federal Reserve should not allow Wells Fargo & Co WFC.N to grow in size until the bank replaces Chief Executive Officer Tim Sloan. In a letter to Fed Chairman Jerome Powell, Warren said Sloan, a 30-year veteran of Wells, was “deeply implicated” in prior bank misconduct and it was untenable for him to remain at the bank as the Fed sought a drastic overhaul of its operations. “The Wells Fargo Board of Directors cannot plausibly claim that it is ‘ensuring senior management’s ongoing effectiveness in managing the firm’s activities’ while retaining a CEO that helped oversee this much misconduct,” she wrote. The Fed took the unprecedented step of ordering the bank to keep its assets below $1.95 trillion in February, saying Wells Fargo had prioritized growth at the expense of proper compliance and risk management. The bank now must convince the Fed it has sufficiently overhauled its policies before it is permitted to grow. Warren has called for Sloan’s removal in the past, but she cannot compel the U.S. central bank to take such a step. Still, her letter indicated she was ramping up her efforts to oust Sloan, and it marks the latest challenge for the bank in Washington, where Wells Fargo has been working to move past its scandals and rebuild its reputation. Wells Fargo is confident in the steps it has taken so far to satisfy the consent order and is engaged in constructive dialogue with the Fed, spokeswoman Erika Reynoso said in response to questions about the letter. A Fed spokesman said the agency had received the letter and would respond. Sloan told analysts during a conference call on Friday that the bank continues to expect the asset cap to be lifted in the first half of next year. Wells Fargo has been coping with a series of scandals since 2016, when it was reported that employees had opened potentially millions of phony accounts in customers’ names without their permission. The bank has disclosed other problems since then, including enrolling hundreds of thousands of customers in costly products, such as auto insurance, that they did not need or want. Since Sloan took over as CEO in 2016, analysts and investors have repeatedly questioned whether he was the right person to turn around the bank. Wells’s board has defended its pick, saying Sloan’s deep knowledge of the bank was an asset. Most recently, the bank's chair, Betsy Duke, shot down rumors that the board was seeking to replace Sloan with former Goldman Sachs Group GS.N executive and Trump adviser Gary Cohn. “CEO Tim Sloan has the unanimous support of the board, and this support has never wavered,” she said in a statement at the time. Financial analysts do not expect Warren’s letter to carry much weight with the Fed or with Wells Fargo’s board, but the Fed has given in to Warren’s pressure once before. In May, the Fed said it would hold a public vote on whether to lift growth restrictions on Wells Fargo, after being urged to do so by the Democratic senator. “I don’t think that political pressure is going to sway the Fed either way,” said Edward Jones analyst Kyle Sanders, noting that President Donald Trump’s criticism of rising interest rates have not deterred the regulator from implementing more hikes."
-5.057251240397602," U.S. Senator Warren urges Fed to require removal of Wells Fargo CEO WASHINGTON, Oct 18 (Reuters) - U.S. Senator Elizabeth Warren said on Thursday the Federal Reserve should not allow Wells Fargo & Co to grow in size until the bank replaces Chief Executive Officer Tim Sloan. In a letter to Fed Chairman Jerome Powell, Warren said Sloan, a 30-year veteran of Wells, is “deeply implicated” in prior bank misconduct, and it is untenable for him to remain at the bank as the Fed seeks a drastic overhaul of its operations. “The Wells Fargo Board of Directors cannot plausibly claim that it is ‘ensuring senior management’s ongoing effectiveness in managing the firm’s activities’ while retaining a CEO that helped oversee this much misconduct,” she wrote. (Reporting by Pete Schroeder; Editing by Jeffrey Benkoe)"
-5.057251240397602," U.S. Senator Warren urges Fed to require removal of Wells Fargo CEO WASHINGTON, Oct 18 (Reuters) - U.S. Senator Elizabeth Warren said on Thursday the Federal Reserve should not allow Wells Fargo & Co to grow in size until the bank replaces Chief Executive Officer Tim Sloan. In a letter to Fed Chairman Jerome Powell, Warren said Sloan, a 30-year veteran of Wells, is “deeply implicated” in prior bank misconduct, and it is untenable for him to remain at the bank as the Fed seeks a drastic overhaul of its operations. “The Wells Fargo Board of Directors cannot plausibly claim that it is ‘ensuring senior management’s ongoing effectiveness in managing the firm’s activities’ while retaining a CEO that helped oversee this much misconduct,” she wrote. (Reporting by Pete Schroeder; Editing by Jeffrey Benkoe)"
