4.494480873813174," Wells Fargo to pay customers $386 million over unwanted auto insurance June 7 (Reuters) - Wells Fargo & Co will pay at least $386 million to settle class-action claims by customers who said the bank signed them up for auto insurance they did not want or need when they took out car loans. The settlement was disclosed in filings on Thursday with the U.S. District Court in Santa Ana, California, and requires a judge’s approval. National General Insurance Co, an underwriter, will pay an additional $7.5 million, making the total payout at least $393.5 million, according to the filings. Wells Fargo denied wrongdoing but settled to avoid the risks, cost and distraction of litigation, court papers show. The bank had no immediate comment on Friday. Lawyers for the customers did not immediately respond to requests for comment. Wells Fargo has been beset since September 2016 by a series of scandals over how it treats customers, including wrongly charging an estimated 600,000 auto loan borrowers for insurance. [nL2N1X51T4} In April 2018, Wells Fargo agreed to pay $1 billion to the Consumer Financial Protection Bureau and Office of the Comptroller of the Currency to settle U.S. probes of the San Francisco-based bank’s auto insurance and mortgage practices. Wells Fargo is taking steps to rebuild customer trust, but remains unable to expand under restrictions imposed in February 2018 by the Federal Reserve until the bank, now the nation’s fourth-largest by assets, cleans up its culture and oversight. Thursday’s proposed settlement covers Wells Fargo customers charged for “collateral protection insurance” between Oct. 15, 2005 and Sept. 30, 2016. The complaint said Wells Fargo’s wrongful practices caused nearly 275,000 customers to become delinquent, and nearly 25,000 vehicles to be illegally repossessed. Through Thursday, Wells Fargo’s share price had been little changed since the scandals broke, while the KBW Nasdaq Bank Index had risen 33 percent. The case is In re Wells Fargo Collateral Protection Insurance Litigation, U.S. District Court, Central District of California, No. 17-ml-02797. (Reporting by Jonathan Stempel in New York; Editing by Dan Grebler)"
3.8345628187781906," Wells Fargo hires former Deutsche Bank executive for risk management team (Reuters) - Wells Fargo & Co said on Thursday that it had appointed Deutsche Bank’s Kate Clifford-Toomey to be chief operating officer for corporate risk. Clifford-Toomey joins the risk management team, led by Chief Risk Officer Mandy Norton, at a time when the bank is working to overhaul its risk management procedures to satisfy regulator demands. Regulators have held the San Francisco-based bank under a microscope since 2016 when whistleblowers revealed Wells Fargo had opened potentially millions of unauthorized accounts. The scandal led the bank to uncover issues in each of its primary business segments, and has resulted in billions of dollars in fines and penalties. The appointment is effective Sept. 3. Prior to Wells Fargo, Clifford-Toomey was chief operating officer of the Americas and head of Americas regulatory transformation at Deutsche Bank. She has also worked at Bank of America Corp and JPMorgan Chase & Co. Deutsche Bank has also had to overhaul its risk management processes in recent years to satisfy U.S. regulators after failing to prove that its business could withstand an economic downturn during the Federal Reserve’s annual stress tests. Wells Fargo is currently operating under more than a dozen regulatory consent orders."
5.006815971289531," Exclusive: Wells Fargo board weighs keeping interim CEO in place - sources (Reuters) - Wells Fargo & Co board members are considering keeping interim Chief Executive Allen Parker in the job permanently even after saying they would seek an outsider to fill the role, according to two sources familiar with the board’s thinking. Parker, 64, was thrust into the position in March when former CEO Tim Sloan resigned abruptly, saying pressure from politicians and regulators had become a distraction in running the scandal-plagued bank. Critics like U.S. Senator Elizabeth Warren, a Democratic presidential candidate, had argued Sloan’s 30-year tenure made him incapable of changing an internal culture that fueled a string of customer abuses. Sloan was the second Wells Fargo CEO to depart following revelations in 2016 that employees had opened potentially millions of fake customers accounts. The fourth-largest U.S. bank has paid billions of dollars in fines and is still being investigated by various federal agencies. The board had set a goal of hiring an outsider, with Chair Betsy Duke saying the position should attract the top talent in banking. Reuters reported in April the bank had hired search firm Spencer Stuart and was focused on finding female candidates. But the external search has been complicated by concerns Wells Fargo could not pay the big dollars necessary to lure talent from competing banks. The board’s pick would also be subject to an unusual vetting by U.S. regulators. Board members started warming up to the idea of keeping Parker after he made a good impression on stakeholders including regulators, investors and employees. “He’s obviously exceeded expectations and that’s a credit to him,” said Steven Potter, CEO of executive recruiting firm Odgers Berndtson U.S. Sources familiar with the board’s thinking said Parker has not been tainted by the scandal since he joined in 2017, the year after customer abuses first emerged. One of the sources said Parker’s two years at the bank have given him enough understanding of lingering problems to fix them quickly. It could take months for the search committee to come to a final decision about who is the best person to lead the San Francisco-based bank. Comptroller of the Currency Joseph Otting would then need to privately review and sign off on that pick. A spokeswoman for Wells Fargo declined to comment. Representatives from the Federal Reserve and the Office of the Comptroller of the Currency, the bank’s primary regulators, declined to comment. Parker joined Wells Fargo as general counsel from law firm Cravath, Swaine & Moore, where he was partner in charge of managing the firms operations. Through his work at the firm defending high-profile clients like former U.S. Secretary of State Henry Kissinger, he also developed relationships in Washington that will be helpful while navigating Wells Fargo’s regulatory problems. At Wells Fargo, he has been focused on cleaning up existing issues and preventing them from spreading. Parker spent his first two months as interim CEO meeting with regulators in Washington, employees in Charlotte, North Carolina, and investors in New York City. He has said his priorities as interim CEO are to improve customer service, satisfy regulatory requirements and continue making operations more efficient. At an investor conference last week, Parker said the bank had entered a new stage of understanding with regulators and that, based on his meetings, the relationships were more constructive than before. “We are probably a little bit more attentive now to everything they’re saying,” he told investors. “And frankly, in some cases, they’ve been speaking with greater clarity.” Still, with Parker at the helm the bank could face even more pressure from lawmakers who wanted to see an outsider, industry analysts said. Turning inside to find a successor could also make some investors feel the board was unable to find a desirable candidate interested in the job. Since Parker became CEO, Wells Fargo created a new unit charged with working through the 14 regulatory consent orders the bank is operating under and expanded its board to include a director who has experience managing a bank."
5.006815971289531," Wells Fargo to donate $1 billion toward affordable housing by 2025 (Reuters) - Wells Fargo & Co said on Wednesday it will narrow the focus of its philanthropy toward three causes including affordable housing and will donate $1 billion to housing over the next few years. The San Francisco-based bank named Brandee McHale to be the new head of the Wells Fargo Foundation which will be focused on addressing housing affordability, improving financial literacy and growing small businesses. McHale joins the bank from Citigroup Inc and replaces Jon Campbell whose retirement was previously announced. Wells Fargo, the fourth-largest U.S. bank, has ramped up its charitable giving following a profit boost from tax reform and in the wake of a wide-ranging sales scandal which has badly tarnished its reputation and weighed down its financial performance. Wells Fargo gave away $444 million to charitable causes last year, potentially positioning it as the top corporate cash giver in the country. The bank has pledged to donate 2% of its after-tax profit annually. As part of its renewed focus on promoting home-ownership, Wells Fargo said it will donate $1 billion to organizations that support affordable housing through 2025 and launch a $20 million grant to encourage organizations to find new solutions for the lack of lack of low-to-moderate income housing options. Wells Fargo has already donated over $460 million in down-payment assistance grants since 2012. By focusing on housing, financial literacy and small businesses the bank will be donating more money toward causes that align closely with its business expertise, spokeswoman Jennifer Dunn said. Wells Fargo will still support causes like arts, education and disaster relief through local projects but broader initiatives will be focused on the three primary areas."
2.7045320148243004," Wells Fargo adds former Bank of America executive to board NEW YORK (Reuters) - Wells Fargo & Co said on Wednesday the bank’s board of directors had elected former Bank of America Corp executive Charles Noski to join the board. Noski’s appointment, effective on June 1, expands the board to 13 seats. He will serve on its audit and examination committee. Wells Fargo’s board has been shuffled many times since the bank became mired in scandal roughly 2-1/2 years ago. More than half of the company’s independent directors joined the board after 2016. Noski joined Bank of America in 2010 as chief financial officer while the bank was still trying to turn itself around and recover from the financial crisis. He retired in 2012 after helping the bank change its mortgage lending business model. Noski currently serves on the boards of Microsoft Corp and Booking Holdings Inc and has held director positions at companies including Morgan Stanley, AT&T and Northrop Grumman."
-1.777203265853417," Wells Fargo, homeowners to square off in court over loan relief glitch A federal judge in San Francisco on Thursday will consider whether hundreds of homeowners can pursue a lawsuit accusing Wells Fargo of foreclosing on them because of a computer glitch they blame on the bank’s lax oversight. At a hearing, U.S. District Judge William Alsup will hear oral arguments on Wells Fargo’s motion to dismiss the lawsuit on the grounds that the affected homeowners defaulted on their mortgages, giving the bank the absolute right to foreclose on their homes. To read the full story on Westlaw Practitioner Insights, click here: bit.ly/2Wkr4z2"
-2.2009658302821062," Wells Fargo and Barclays back fintech company OpenFin NEW YORK (Reuters) - Financial services software startup OpenFin has raised $17 million in a funding round led by Wells Fargo & Co with participation from Barclays, the company said on Thursday. Existing investors including JPMorgan Chase & Co, Bain Capital Ventures and Pivot Investment Partners, also participated in the round, the company said. OpenFin, which is headquartered in New York and London, will use the cash injection to accelerate sales efforts and for product development, it said. Founded in 2010, the company has developed an operating system that enables financial institutions to more easily create and upgrade their computer applications, similarly to how consumer apps are updated on smartphones. This can help large firms cut down on the time and money needed to modernize the software they use for a wide array of both front- and back-office functions, such as trading or risk management. It would otherwise take between 6 to 18 months for a financial institution to deploy or update an application, OpenFin said. Over the past few years, banks have been ramping up partnerships and investments in young companies that create products and services which can help large financial institutions remain competitive in an increasingly digital world. “Banks know that they need to significantly reduce their cost of doing business and they need to increase productivity,” Mazy Dar, chief executive and co-founder of OpenFin, said in an interview. “All of this heavy infrastructure needs to be replaced with something that is a lot more agile and nimble.” OpenFin’s operating system is used on nearly 200,000 desktops at 15 global investment banks and more than 1,500 other banks and buy-side firms, it said. The latest investment brings the company’s total amount of venture funding to $40 million."
-4.301082907307445," U.S. bank regulator will vet next Wells Fargo CEO WASHINGTON (Reuters) - A top U.S. bank regulator said on Wednesday it will vet Wells Fargo & Co’s pick for its next chief executive, a development that could complicate the scandal-hit lender’s efforts to find a permanent replacement for CEO Tim Sloan. Joseph Otting, the Comptroller of the Currency (OCC), told Congress he would use special legal powers that the regulator typically reserves for overseeing financially troubled lenders to review any proposed candidate. But Otting said he does not plan to make findings from the review public, despite pressure from U.S. Senator Elizabeth Warren who pressed him on the issue during a hearing before the Senate Banking Committee. “At this point in time I do not have plans to release that information,” Otting told Warren in a heated exchange. Warren and other Democratic lawmakers have accused the OCC of being too soft on Wells Fargo, a claim Otting disputed on Wednesday. Otting said the OCC remains disappointed by the bank’s progress on fixing risk management and governance problems that led to a number of customer abuse scandals, including in its mortgage and auto lending businesses. A spokeswoman for Wells Fargo declined to comment. Sloan abruptly departed in late March, making him the second CEO to leave Wells Fargo following its sales practice scandal. He has said he stepped down because the external attention on him had become a distraction. Wells Fargo general counsel C. Allen Parker, one of the few newcomers in the bank’s top ranks, is serving as interim CEO. Intense congressional and regulatory scrutiny is likely to narrow the field of CEO candidates. Wells Fargo’s board is looking for an outsider following criticism that company veterans are incapable of turning things around. The bank’s CEO search is also being hampered by limits on how much it can pay, Reuters reported this month. Wells Fargo’s woes began in September 2016 when the bank admitted it had potentially opened millions of unauthorized accounts. Internal and regulatory probes have discovered other issues in the bank’s businesses, resulting in billions of dollars in fines and penalties. The Federal Reserve has also placed an unprecedented restriction on Wells Fargo to keep it from growing its balance sheet until it proves risk management controls are improved."
-4.301082907307445," U.S. bank regulator will vet next Wells Fargo CEO (Adds context and background on CEO search, quotes) WASHINGTON, May 15 (Reuters) - A top U.S. bank regulator said on Wednesday it will vet Wells Fargo & Co’s pick for its next chief executive, a development that could complicate the scandal-hit lender’s efforts to find a permanent replacement for CEO Tim Sloan. Joseph Otting, the Comptroller of the Currency (OCC), told Congress he would use special legal powers that the regulator typically reserves for overseeing financially troubled lenders to review any proposed candidate. But Otting said he does not plan to make findings from the review public, despite pressure from U.S. Senator Elizabeth Warren who pressed him on the issue during a hearing before the Senate Banking Committee. “At this point in time I do not have plans to release that information,” Otting told Warren in a heated exchange. Warren and other Democratic lawmakers have accused the OCC of being too soft on Wells Fargo, a claim Otting disputed on Wednesday. Otting said the OCC remains disappointed by the bank’s progress on fixing risk management and governance problems that led to a number of customer abuse scandals, including in its mortgage and auto lending businesses. A spokesman for Wells Fargo did not immediately provide comment. Sloan abruptly departed in late March, making him the second CEO to leave Wells Fargo following its sales practice scandal. He has said he stepped down because the external attention on him had become a distraction. Wells Fargo general counsel C. Allen Parker, one of the few newcomers in the bank’s top ranks, is serving as interim CEO. Intense congressional and regulatory scrutiny is likely to narrow the field of CEO candidates. Wells Fargo’s board is looking for an outsider following criticism that company veterans are incapable of turning things around. The bank’s CEO search is also being hampered by limits on how much it can pay, Reuters reported this month. Wells Fargo’s woes began in September 2016 when the bank admitted it had potentially opened millions of unauthorized accounts. Internal and regulatory probes have discovered other issues in the bank’s businesses, resulting in billions of dollars in fines and penalties. The Federal Reserve has also placed an unprecedented restriction on Wells Fargo to keep it from growing its balance sheet until it proves risk management controls are improved. (Reporting by Pete Schroeder Editing by Bill Berkrot and Meredith Mazzilli)"
0.3182210006226156," Wells Fargo CEO search hobbled by pay limitations: sources (This May 10th story corrects paragraph 7 to say Wells Fargo may need to match stock-based compensation a candidate has at a current employer, not that company may need to match vested shares.) NEW YORK (Reuters) - Wells Fargo & Co’s hunt for a new CEO is being impeded by limits on how much the bank can pay its next leader, a person close to the search and several industry insiders told Reuters. A handful of top candidates have already said they would not pursue the job because Wells Fargo is unlikely to meet their pay requirements, said the person, who spoke about private negotiations on the condition of anonymity. Wells Fargo declined to comment on the search process. The San Francisco-based bank has been looking for a new leader since March, when Tim Sloan became the second CEO to abruptly depart in the wake of a sales scandal that has badly bruised the bank’s reputation and crimped its financial performance. Wells Fargo’s CEO pay package has trailed peers in recent years in the aftermath of a wide-ranging sales practices scandal. Wells Fargo is also the smallest of the top four retail banks by assets. The board will likely pay the next CEO $15 million-$20 million a year, said Robin Ferracone, the chief executive of compensation consultancy Farient Advisors LLC. That compares with the $25 million that CEOs of top retail banks earned last year on average. Wells Fargo may also need to set aside funds to match stock-based compensation a candidate has at a current employer, compensation consultants and recruiters said. That could be difficult in an environment where politicians, regulators and investors are closely scrutinizing Wells Fargo. “If you think about the Wells situation, it has a lot of distressed features to it,” Ferracone said. The banking industry faces special restrictions on compensation that regulators imposed after the 2007-2009 financial crisis. Relative to other sectors, a bigger portion of executive pay comes in deferred stock, and contracts feature clawback provisions, which require money to be paid back under certain circumstances. Among peers, Wells Fargo’s CEO pay package is at the bottom of the pack. Sloan’s $18.4 million pay package last year compared with $31 million for JPMorgan Chase & Co’s Jamie Dimon, $26.5 million for Bank of America Corp’s Brian Moynihan and $24 million for Citigroup Inc’s Michael Corbat. Executives in other industries, and even other parts of Wall Street, get paid significantly more. Blackstone Group LP CEO Stephen Schwarzman, for instance, earned $69.1 million last year. Alphabet Inc Chief Financial Officer Ruth Porat, a former Morgan Stanley executive considered a solid candidate for a bank CEO role, earned $47.3 million. Wells Fargo Chair Betsy Duke has said the board wants to attract the “top talent in banking.” Directors want the next CEO to be an outsider, following critiques from lawmakers that company veterans are incapable of turning things around. The board has discussed approaching JPMorgan's finance chief, Marianne Lake, as well as Citigroup's head of Latin America, Jane Fraser, Reuters previously reported reut.rs/2PvxOo0. They have unvested stock awards worth $18.4 million and $11.2 million, respectively, according to recent filings. Offering a signing bonus to cover such awards is harder at banks than other types of companies because of heightened scrutiny on the sector, industry experts told Reuters. Last year, UBS Group AG’s Andrea Orcel left the Swiss bank to run Banco Santander SA. But the deal fell apart after Santander refused to pay Orcel $50 million in deferred compensation he accrued at UBS. There may be even bigger hurdles in Wells Fargo’s case because of the sales scandal that erupted in late 2016. Regulators including the U.S. Federal Reserve, Office of the Comptroller of the Currency and the Consumer Financial Protection Bureau are also closely monitoring progress of its operational overhaul, including executive changes. The new CEO’s pay package is sure to be “very carefully scrutinized,” said Evan Stewart, who litigates compensation disputes as a partner at the law firm Cohen & Gresser."
0.7999808072496511," Wells Fargo creates new unit focused on regulatory compliance (Reuters) - Wells Fargo & Co is creating a new unit tasked with satisfying U.S. regulatory requirements, according to an internal memo seen by Reuters. Derek Flowers, who has been with the San Francisco-based bank for more than two decades, will become head of strategic execution and operations and will focus on the bank’s regulatory priorities, said the memo, sent by interim chief executive Allen Parker on Wednesday. In his current role as chief credit and market risk officer, Flowers would have had frequent contact with regulators. The new unit, whose creation was reported earlier on Wednesday by the Financial Times, will be charged with working through the more than a dozen regulatory consent orders the bank is operating under - agreements between regulators and the bank that it will work to satisfy certain requirements. It will also implement new business and risk-management processes. Parker has said he wants to “redouble” the bank’s efforts to satisfy and exceed regulatory expectations. Regulators have demanded change from Wells Fargo after employee whistleblowers revealed it had opened potentially millions of unauthorized accounts in 2016. Internal and regulatory probes have since discovered other issues in each of the bank’s primary segments, resulting in billions of dollars in fines, penalties and an unprecedented cap on its balance sheet by the Federal Reserve. The bank has said it is committed to compensating all customers affected by its actions and has so far payed out tens of millions of dollars. However, regulators including the Federal Reserve, the Office of the Comptroller of the Currency and the Consumer Financial Protection Bureau have publicly criticized the bank’s progress within the past month. Wells Fargo has added more than 1,000 jobs to its risk management team and plans to add an additional 1,300 employees this year to help strengthen its compliance efforts, it has said."
